"itemId","star","content","createTime"
1023003,0,"满意。昨天到货，很快，包装严实，没有磕碰。开锅后今天就做了一锅栗子炖鸡，完美。平时用砂锅要2个小时，这锅小火50分钟已经十分软烂入味，汤汁鲜美。赞一个。",2016-10-05 11:45:31
1023003,5,"这个锅简直是太漂亮了，真的非常喜欢<U+0001F495>还没用，就看这颜值做出的食物就有食欲！严选大爱！",2018-02-10 17:56:49
1023003,3,"锅子蛮漂亮，份量很重，毕竟是铸铁锅。不过做菜并不实用：炖菜会溢出，不如用砂锅；不能用钢丝球刷也不能用洗碗机，清洗是个问题。",2018-02-22 09:29:28
1023003,0,"好重，很好",2016-09-22 12:10:15
1023003,0,"不错，用料实在，价格实在",2016-09-19 13:06:19
1023003,0,"喜欢很久啦！第一次在严选买东西，购物体验很棒，包装用心、高大上，价格合适，东西品质好！从此后就是严选的铁粉啦，希望一直能带来惊喜！",2016-09-15 17:11:31
1023003,4,"原以为锅内也有珐琅镀层，不过就这价格而言应该说的过去。",2017-11-05 19:07:50
1023003,0,"很好用的锅，开锅后第一锅红烧兔肉，让我爱上铸铁锅了。",2016-08-28 19:28:04
1023003,0,"颜值不错，煲汤很好用，身为中华小神厨，我要把它养好",2016-08-21 18:32:48
1023003,3,"喷漆有点掉色 泛黄",2017-11-11 12:03:38
1023003,0,"这个锅是真有分量！赞一个",2016-09-18 00:36:27
1023003,0,"超级低调貌美超级好用！几乎天天都在用！！",2016-09-14 13:17:09
1023003,0,"真的很重，新锅上架，等过节炖个汤试试",2016-09-12 19:36:47
1023003,0,"这个锅子太好了 用了一下午熬了一锅汤 超级好喝",2016-08-29 15:39:43
1023003,3,"第一次锅壁有瑕疵，换货了，换来的锅沿有锈迹。看来品控还是有些问题。",2018-02-24 16:37:38
1023003,0,"入手之后连着做大菜 哈哈 炖菜确实很香。锅也很有质感。但是并不是不沾。煎牛排的话，还是会粘锅。",2016-08-29 15:52:47
1023003,5,"锅不错，不过这价格又便宜了",2017-11-04 21:55:10
1023003,2,"锅有掉瓷的现象。这让我心里边很不爽。",2017-10-31 23:04:19
1023003,0,"没有瑕疵，包装很严实，这个颜色太有质感了，厚重，24cm的尺寸刚刚好，太小不方便。活动价298买的，感觉很值。未用。",2016-08-20 08:56:23
1023003,5,"还不错，很有质感，重锅盖使整个锅子有点高压锅的感觉，热量浪费较少，小火炖煮，肉熟的很快。美中不足，火开大了，还是会有水珠溢出。",2017-11-02 14:37:22
1023003,0,"份量很重的锅子，试烧了茄子肉糜煲，全程不放水，这锅最大优点是原汁原味，以后可以试烧葱姜盐h鸡。你值得拥有",2016-08-27 12:52:09
1023003,5,"挺沉   珐琅面不是很光滑  有些许砂眼",2018-02-13 22:31:24
1023003,0,"东西不包，包装特别严实； 一到家里就开始烧汤了。相当不错；值得购买；",2016-08-17 15:17:27
1023003,3,"在网易也买了不少东西了，质量一直都觉得不错，就是快递不怎么行，虽然一直用顺丰或者京东的物流，但是有时候还是会晚几天才收到，这次买的这个锅，10斤重，结果快递小哥直接不联系我，把它直接放在e栈里面，然后让我自己去取，然后拿上6楼，我也是醉了，我家里一直有人，而且他也有我联系方式，但都没有做，快递外包真的不太给力，会大大影响严选的客人体验，这样就算有时候确实质量好点我可能还是会选择天猫或者京东。",2018-02-12 00:26:20
1023003,5,"锅壁有点小瑕疵，重新换了一个",2018-02-13 09:34:46
1023003,0,"美貌与实用并存。一点不比酷彩那些进口锅子差。性价比极高啊。",2016-08-10 21:58:17
1023003,0,"历经波折总算收到了，喜欢的不得了，浆果红不像别人说的看上去就是黑锅，颜色是深亮红很有光泽，非常美，重量很重，感觉质地一级棒，我很满意！开心！",2016-09-04 14:24:41
1023003,0,"颜色不错，烧汤煮粥都非常不错，下次试下干锅",2016-08-31 14:10:29
1023003,0,"使用了，非常好，炖菜会省时省火。很满意。",2016-08-27 08:15:10
1023003,4,"刚收到货就来了个特供 降价几十块 不悦",2017-11-04 21:33:51
1023003,0,"很好，给同事又买了一个炖肉",2016-08-27 08:43:19
1023003,5,"双十一降价太多，早知道就做活动的时候买了<U+0001F601>",2017-11-04 22:41:35
1023003,5,"质量很不错，就是一买就降价了",2017-11-04 23:13:11
1023003,0,"挺好的，我喜欢，物美价廉，赞！",2016-08-26 00:34:01
1023003,0,"炖肉挺好的，就是真沉啊！",2016-08-24 12:04:48
1023003,5,"颜色比图片略深，也很喜欢，珐琅均匀有质感！",2018-02-08 22:22:12
1023003,5,"看了好久了，想看是否有限时购，一直没有，只能买了，感觉不错，挺重的！",2018-02-12 21:16:56
1023003,5,"Better than expected! Quite heavy!",2017-12-14 08:58:53
1023003,3,"心仪已久，终于在限时购的时候买入。
想要买的原因在于它自身很重，锅盖沉，密封好，可以把食物焖熟，保持食物的原汁原味。
但是事实上这个锅的密封并不是很好，一样的透气，所以高压锅不成、汤锅不就。",2018-02-03 11:01:13
1023003,0,"商品非常M意，包b的很好。",2016-08-23 20:34:19
1023003,5,"太大了，不适合一家三口，应该买小点的，退货运费太贵了，所以没去换货了。",2018-02-07 07:35:03
1023003,3,"掉漆",2018-02-07 07:00:36
1023003,5,"很重很重，的确是不粘的，但是不禁磕碰硬度低，锅盖上已经和玻璃的东西撞击磕破了一个点。",2018-02-09 00:38:51
1023003,0,"锅很漂亮，大小正好，颜色也很漂亮",2016-08-22 08:30:22
1023003,3,"希望严选把好进货质量关，已退货",2018-01-22 22:16:13
1023003,0,"挺棒，刚好放下一个猪肘子，烹饪时间比较与普通锅短",2016-08-15 22:38:42
1023003,2,"10月买的，平时很少做饭，就用了7,8次，里面的涂层就掉了一块。。。就外观是好看的",2018-02-03 13:54:41
1023003,5,"超级重啊有木有",2018-01-22 19:37:41
1023003,5,"性价比合理。还没有用呢，刚按说明给边缘涂了油。。这又降价了……但总起来说，还算性价比合理吧。",2017-11-05 00:03:00
1023003,5,"一般般吧。价钱有些贵。",2018-02-03 16:22:03
1023003,5,"锅底有一块破了，要换没货，打算买个小一号的吧。",2018-01-23 11:53:44
1023003,5,"拿到手质感还是不错的，不过跟实体店几千块的还是有差别的。盖子不够严实，主要是拿到手颜色跟手机显示差别有点大，当时就决定退货，就没有拍照。",2018-01-14 18:47:53
1023003,4,"珐琅锅很重，刀具也是做活动买的，有个缺点就是刀具把手全部是金属的，冬天用得冰手疼",2018-01-16 11:18:55
1023003,5,"番茄牛腩作为开锅菜，锅盖沉，一边做饭，一边运动。但是会有糊锅底的问题。",2018-02-08 08:22:55
1023003,0,"挺结实了，看起来很不错的样子。",2016-08-21 11:18:08
1023003,5,"买了两个送弟弟搬家一个，差点就在金格买了2000多的了。险",2017-11-08 08:20:41
1023003,5,"为什么我煮汤就溢锅了，最多不能超过多少水啊",2018-01-26 18:44:56
1023003,0,"很重，看上去不错，还没有使用",2016-08-21 17:57:37
1023003,5,"锅真的是很重啊，但是华丽没的说，炖了两次排骨，还蛮好用的。",2018-01-31 16:43:20
1023003,4,"锅太重了，用过一次后，觉得怎么清洁还是有污渍痕迹",2018-02-02 21:55:19
1023003,1,"网易严选的东西，基本上隔一段时间就把商品改个名字下架，这样其他客户也就看不到差评了。这款锅最大的问题在于密封不严，与其标榜的XXX大牌制造商品质差异较大。",2018-01-24 09:28:45
1023003,5,"锅很好用，打开直接清洗后就用了，也没有养锅之类的每次用完晾干再盖盖子就行了，炖排骨放的水少的非常慢，推荐大家试下排骨五花肉一起炖，五花肉排骨焯水后，不放油直接放五花肉一会就出来好多油，放过排骨调料，水也放够，中间中小火就不用管了，很方便，准备再买一个。",2018-01-30 13:23:03
1023003,0,"好",2016-08-21 23:36:09
1023003,0,"不错！！！",2016-08-21 11:17:32
1023003,0,"<U+200D>目测<U+200D>还不错<U+22EF><U+22EF><U+200D>很重<U+200D>质量<U+200D>也挺好<U+22EF><U+22EF><U+200D>就看<U+200D>煮食物<U+200D>的<U+200D>本事<U+200D>了",2016-08-11 18:54:21
1023003,5,"很好的炖锅，就是太重了点",2018-01-16 06:47:03
1023003,0,"好沉",2016-08-20 12:33:38
1023003,5,"很棒！质量很好、非常实用、详情见图！喜欢的朋友可以放心购买，缺点就是物流稍慢！能有某东自营的速度就完美了！",2018-01-24 21:15:21
1023003,5,"颜值还可以，买了最大号的但是鸭子大一点还是放不下，蹲了两回肉感觉还行",2018-01-26 13:40:09
1023003,5,"退货两个月没消息，每次问客服都要核实，每次都让等，每次等完了就没消息了，前后两个月问询五六次，昨天又让等一天，到现在没有一个回复，没有一个电话。买了几万元的东西，退货却这么麻烦，没有一个负责的，真让人崩溃了。你们什么时候能解决？？？？？？",2018-01-24 09:24:36
1023003,5,"锅用了几次了，煮东西速度很快，唯一缺点是太重。",2018-01-25 00:24:20
1023003,5,"这个锅真的很好很沉很耐用，就是太沉了",2018-01-18 19:43:40
1023003,4,"价格波动太快，收到后一次没用就降了这么多！",2017-11-04 23:09:16
1023003,0,"很沉，很有质感，还没启用，等用了再来评价！",2016-08-10 20:46:53
1023003,4,"用了才来评价，没有想象中那么好，用了一周把手连接处掉了一大块漆，煮汤盖子没有那么严实，盖子上放水也会喷气，小火炖汤两小时后汤会蒸发掉只剩一半。",2018-01-18 09:53:10
1023003,0,"价廉物美",2016-08-13 21:55:41
1023003,5,"好用 就是麻烦 第一次用一定要开锅",2018-01-12 19:14:31
1023003,0,"超级好用，超级满意",2016-08-12 13:57:26
1023003,3,"娇气，比较难打理。忘记涂油就会底部出现彩色……",2018-01-17 09:05:23
1023003,0,"煮粥不错",2016-08-09 08:27:20
1023003,5,"锅可以，发货太慢，客服服务实在太差，有点店大欺客的感觉",2017-11-05 10:03:35
1023003,0,"珐琅锅收到的很及时……遗憾的是锅盖上有几个小麻点……赠送的小锅倒是很完美！",2016-06-18 22:22:49
1023003,0,"看了很久，下手了，比预想中小一点，沉，不错！不过送的掌心锅，完全不知道怎么使用～",2016-06-22 19:41:38
1023003,5,"不错！但是真重啊！",2018-01-13 11:20:39
1023003,5,"珐琅锅收到很好很重",2017-11-08 10:35:27
1023003,3,"跑气跑的很厉害，一整锅汤煲鸡，煲好只剩下半锅。无水煲排骨的话，排骨都快烧糊。",2018-01-13 20:11:22
1023003,0,"很好，不过还没来得及用",2016-07-28 08:13:42
1023003,5,"锅底有个凹进去的沙眼，不知道有没有影响。",2018-01-07 08:50:36
1023003,5,"这个价位没啥说的，不过釉面还是不够光滑。。等搬家了和staub的在对比下。。",2018-01-13 10:13:24
1023003,0,"感觉不错<U+0001F600><U+0001F600><U+0001F600>",2016-07-24 12:35:32
1023003,5,"第一次寄过来的锅有点瑕疵，严选现在换货很方便啊，顺丰快递员直接上门取件，希望严选一直不忘初衷！",2018-01-04 20:46:53
1023003,5,"很快就收到  但是炖的时候 盖子 不严实 容易漏水气",2018-01-08 20:11:21
1023003,4,"用了几次，不能油温很高，会变色，其余很好，炖的时候会跑气，冷敷会好很多，炖的时候全程小火就可以了，炖鸡汤味道不错，炖牛肉并没有传说的特别容易熟烂，还行。",2018-01-12 20:00:46
1023003,5,"有些沉，但舍不得退货",2017-11-05 06:40:53
1023003,5,"实在是重！<U+0001F92A>",2018-01-08 21:58:20
1023003,0,"很漂亮，很有分量，为新家准备的，还没使用。",2016-07-18 21:14:05
1023003,0,"大爱，包装强大，可以没抢到赠品的小锅，感觉24够一家人煲汤用了",2016-06-18 10:20:53
1023003,5,"我可以问一下吗？为什么内壁不光滑，还会生锈？铁锈是对健康有害的，真的很担心，为什么这么贵买的，还生锈？？？？",2018-01-06 22:31:13
1023003,4,"用了一段时间 很重 做东西口感挺好  只是每次都会往外滴水  都这样吗？",2018-01-04 21:17:28
1023003,0,"帮妈妈买的，她说质量不错",2016-07-16 19:02:11
1023003,5,"这个锅真的是值了，使用时要小心，太重了，这锅盖砸到哪估计是场灾难",2018-01-06 11:05:30
1023003,0,"棒棒哒",2016-07-16 21:50:33
1023003,5,"好重好大！买之前尺寸没仔细看，所以有点大。下次有小点的尺寸，还想再进一个",2018-03-12 07:34:56
1023003,5,"锅相比其他的轻了些，比较好端吧，颜色也比较好，价格很有优势，感觉并不输那些大牌",2018-03-07 20:12:06
1023003,5,"买了第二口锅子，第一次买了黑色，质量很好，紧接着买了红色，绝对百年传承之物，买到就开心啊",2018-02-22 17:47:18
1023003,5,"货到后发现锅底部类似小沙眼的小凹洞，因为怕麻烦没有与卖方联系，买了一只鸽子煲汤的确味道很好，原汁原味而且煲的过程中能有效的锁住水分。果断又进了小一号的。",2017-11-05 09:21:24
1023003,5,"很棒的质感，用起来也省事，美中不足的是用小火炖久了会扑锅，炖不够时间又不厚烂",2018-01-03 11:30:15
1023003,5,"好重啊，但确实不错！",2017-12-14 15:31:38
1023003,5,"感觉很酷，本以为保守的妈妈会以为不喜欢这款锅，没想到见到之后爱不释手，重量足。",2018-02-28 01:33:52
1023003,5,"从吃喝到穿戴，从美妆到家用，网易严选正在打造中国版的无印良品哈R支持，加油哈RR",2018-01-27 09:00:01
1023003,5,"非常非常沉，保温效果很好，“闷”的小果很棒，确实省水省气，就是使用的时候比较谨慎，养锅。",2018-02-23 17:54:42
1023003,5,"严选没让我失望，春节10多口人的鸡汤猪脚猪肚羊肉排骨汤全靠它挣脸了",2018-02-23 00:14:43
1023003,1,"刚刚送到货，物品就降价了，让人心情不好",2017-11-05 09:01:29
1023003,5,"颜值很高质量超好。做工比fissler的精致多了。煲汤很少的流失。性价比王",2018-01-30 16:09:12
1023003,5,"好重！看了n次，限时购时没购入，等了好久，重新上架，立马下手了！",2018-02-14 17:09:11
1023003,5,"关注N久，其实这个家已经超值，没想到等到了更值，入手不到270，用了几次，太完美！",2018-01-14 23:59:12
1023003,0,"包装超级赞，小锅用了一次，大锅今天开锅，618买得实惠",2016-06-25 15:42:27
1023003,5,"用了好几次炖牛肉，银耳汤，鸡汤，不担心汤汁干，能锁住水分。颜色好看心情更好",2018-03-06 23:11:19
1023003,0,"重量十足，质量不错。",2016-07-04 08:22:45
1023003,5,"特别好，炖出来的汤啥都不加，稍微放点盐就超级好喝，真的是食材的香味",2017-12-28 11:41:50
1023003,5,"高颜值不用说了，说说使用心得。先小火放在炉子上预升温，等锅体烫了后放入食用油等油加热，放入食材翻炒，加调料，然后放水。水比平时要放的少的多，因为此锅确实锁水，盖上锅盖，全程中小火烹饪。如果锅盖冒气，调整锅盖或者在锅盖上倒冷水可解决。还冒气那就是火大了，减小火头。烹饪好后待锅体自然冷却再清洗，擦干锅体，涂食用油放置。",2018-01-04 09:14:54
1023003,5,"锅很沉，颜色漂亮，做工精良！之前买过一个炒锅，很好用。这个用了后再来评价哟",2018-01-02 22:54:12
1023003,5,"双十二在严选买了一大堆东西，一下子收到了七个邮包，每样都好，非常满意！这个锅颜值好高！",2017-12-14 20:24:42
1023003,5,"看着挺漂亮的，跟我在专卖店看的双立人锅差不多，不知道是不是一样好用，等用了再来评价吧。",2018-02-27 17:30:20
1023003,5,"很漂亮的锅，也很好用，性价比高！炖鸡汤，烧排骨都很好用，三口之家，24的大小更合适些",2018-02-26 20:44:21
1023003,5,"砂锅坏掉之后一直觉得家里应该有个能炖能煮的锅，还是很信赖严选，不论价格高低，品质是前提。",2018-01-02 22:06:09
1023003,5,"好沉！从锅到盖子都是沉沉的。要买的小伙伴要有心理准备哦！质量是杠杠的！",2017-12-14 14:43:24
1023003,5,"看了很久了，降价了终于出手，很好的锅，明天炖个牛腩试一下，京东快递更给力",2017-12-04 19:34:52
1023003,5,"之前自己买了一个，特别好，炖肉菜很好吃，婆婆来家里也觉得好用，这个给婆婆买的",2017-12-04 13:55:08
1023003,5,"很沉，颜色超美的，昨天试着烧肉炖笋干，跟砂锅一样，烧起来很香很香，真是高颜值的居家必备，值得拥有！",2018-02-16 23:51:37
1023003,5,"这个锅必须差评，很不好用，盖子上掉了一块红漆，还有这个盖无论你怎么盖都会走气，焖东西很容易干掉，和好的珐琅锅相差不是一点点，不建议大家买",2018-01-03 13:15:50
1023003,5,"很好看，但是居然会生锈",2018-01-03 07:59:00
1023003,5,"好用使用时要小心容易磕碰雕瓷",2017-12-05 21:13:52
1023003,5,"第一次购买这么厚重的锅具，已经使用过好几次了，感觉用它炖出来的汤，味道的确不错！",2017-12-03 21:32:00
1023003,5,"锅非常厚实，很沉，一拿就知道是好东西，媳妇炖了一回羊肉，好吃，锅应该有一定的功劳",2017-12-03 11:06:08
1023003,5,"很有分量，很重，用了2次，没觉得跟别的锅有什么不同",2017-12-29 05:20:24
1023003,0,"锅的质量完全不输双家或菲家的，分量那是杠杠的。做出来菜品也棒棒的",2017-12-01 17:24:37
1023003,5,"一入严选深似海，从此京东是路人…严选的东西至今为止没有让我失望过，必须全五分！",2017-11-30 17:32:37
1023003,5,"锅底有3个小凸起，两个小凹洞。

很重，很结实的样子。明天开煮",2017-12-15 22:48:33
1023003,5,"刚用就掉了点漆，嫌麻烦没换",2017-12-31 13:47:15
1023003,1,"退款一直各种拖延",2017-12-29 10:59:56
1023003,5,"这锅还得买24cm的，2个人也得买24的，不然汤都不够喝，看到很多人做红烧肉，第一次买回来不会做红烧肉，就炖了一锅排骨，确实比高压锅和普通锅吨出来的好吃，肉嫩有韧性，不是那种烂烂的口感，但是上次的锅有点问题，严选二话不说就给重新换了一个，就冲这点，就得给满分啊。",2017-12-27 18:50:18
1023003,5,"隐隐约约鱼鱼们在哪里！",2017-12-26 13:57:53
1023003,5,"网易严选提供的产品质量好，对产品非常满意。京东一如既往的提供优质服务！谢谢快递哥的辛勤服务。",2017-12-07 20:23:19
1023003,5,"刚收到的，虽然锅的颜色比图片深，但还是比较满意，希望使用的时候让我更喜欢",2017-12-07 14:08:48
1023003,1,"价格保护做的太差，退差价又没有做的十分友好，需要联系客服沟通",2017-12-31 10:15:44
1023003,5,"比较便宜的珐琅锅，但很有分量，烧了一次羊肉，不知道是我厨艺好还是锅好，味道真的很棒",2017-12-28 08:47:31
1023003,5,"颜值高，就是太重。期待效果。看评论才发现有更便宜的价格，还有买一送一的活动。严选就是活动太多了，有时让人后悔买早了。",2017-12-04 20:55:09
1023003,5,"很好用，但是密封性还是差了点，但是这个价格真的很好了，炖肉很快！",2017-12-29 13:01:22
1023003,5,"特别的棒，爱做饭的老公简直爱到不行，一个劲说就是不一样～连严选家的纸盒子都质量那么好",2017-12-04 10:23:55
1023003,5,"前一天下单第二天就到，锅很有份量，用料足，颜值高，好不好用等用过再来评价",2017-11-25 22:40:09
1023003,5,"超级好用的一口锅，收到货后上油开锅，做了一次红烧肉好吃，呵呵吃货的福音，超赞",2017-11-25 22:25:06
1023003,5,"锅盖有瑕眦",2017-12-05 21:35:48
1023003,5,"买了一年多了，经常使用，做红烧的菜式非常好，不用放太多水，小火焖烧，原汁原味。清理也方便。",2017-12-14 13:21:24
1023003,5,"相当满意的一次购物体验，一如既往地无条件支持严选！！只要有需求就要到严选先逛一逛",2018-01-09 00:10:00
1023003,5,"严远家的售后服务<U+0001F44D><U+0001F44D><U+0001F44D>",2017-12-25 09:29:28
1023003,5,"非常超值，性价比超高，颜值爆表，推荐购买，！非常超值，性价比超高，颜值爆表，推荐购买，！",2017-12-14 09:50:01
1023003,5,"锅不错，买回来已经炖了一次羊肉，做了一次红烧肉，还用它做了秋梨膏和冰糖金桔。但是盖子的密封性并没有宣传的那么好，每次在烧的过程中，都会有一点外渗。毕竟就这个价钱，凑合用了。",2017-12-20 09:52:54
1023003,5,"锅体很沉，包装很细致，东东到手很满意。有了利器，期待自己大厨美味菜品吧！",2017-11-26 23:29:26
1023003,5,"大致看了下没有瑕疵，严选的东西确实质优价廉！现在离不开严选了，每天都要看。",2017-12-12 22:13:33
1023003,5,"一买完，就马上有特价活动，差了好几十块，以后网易的东西，我都只会等特价活动才买了！心情变的不好了！",2017-11-04 19:44:26
1023003,5,"下载严选就是因为想要这么一个锅，同时推荐，入坑严选，一入严选深似海。。。剁手党推荐！",2017-11-14 20:56:59
1023003,5,"这个锅买了好几个了 自己用 送人 都是很好的  拿到的时候比我想象的要重很多",2017-12-05 09:25:00
1023003,5,"很重的锅子 还不知道要做什么菜",2017-12-22 23:10:50
1023003,5,"锅很好用，没用过staub一类特别贵的，所以也不知道有什么区别，但是能让我这个厨艺为零的只看菜谱第一次就能做成这样真的已经很满足了",2017-12-27 18:08:18
1023003,3,"买了一阵子一直没有用，昨天用发现密封性不好，漏气导致一直滴水。其他的都还可以。",2017-12-18 15:14:59
1023003,5,"刚刚收到货，从外表看上去和之前在双立人买的德国原产20公分的铸铁锅一模一样。等用用看咯！",2017-11-19 18:42:29
1023003,5,"除了很重，其他都很好，耐用保温性强",2017-12-21 12:08:50
1023003,3,"锅盖不平，一边高一边低，类似于桌子没有放平的感觉，逼死强迫症，旋转各个角度问题依旧，导致结果是漏气（下图最小火，锅盖加水）。结论：比砂锅好一点，但没有带来相应价格的体验飞跃。",2017-12-19 13:01:24
1023003,5,"很满意，锅质量很好的样子，还没用听说用铸铁锅煮的好吃(<U+0E51>′<U+06A1>`<U+0E51>)",2017-12-04 22:21:36
1023003,5,"送给朋友的，她相当满意，严选的东西性价比很高，以后自己新家也打算入一个。",2017-12-02 17:01:23
1023003,5,"锅还是挺好的！颜色没有图片这么亮，但是明火估计会烧黑了",2017-12-16 13:17:13
1023003,5,"这是在严选买的第一件产品，第一次浏览时就心动了，拿到手上，质量杠杠的。",2017-12-24 14:53:26
1023003,1,"锅盖密封不严，炖肉的时候呼呼冒气。炖了两个多小时都觉得肉不烂！本来就是好奇买来看看和我两千多的staub珐琅锅有什么区别，结果真是差太远，两百多买回来个破烂。一分价钱一分货。",2017-12-23 13:03:26
1023003,5,"锅的质量，做工目测不错，还没用，今天刚收到货，京东速递也给力，速度不输顺丰，赞一个！",2017-11-04 14:48:01
1023003,5,"非常好看，用料足了，锅很重。马上用了一下，做出来的肉类真是好吃。",2018-01-20 16:02:04
1023003,5,"颜色不太好看",2017-12-21 22:39:09
1023003,5,"已收货，无瑕疵，锅很重，未使用，尚未知烹调效果如何，以后再追评。",2018-02-14 07:05:42
1023003,3,"我觉得严选的文案绝对比质检做的好太多，被这个珐琅锅种草很久终于买了，但是完全没有想象中那么好用，锅盖不知要转多少次才可以不漏气，自我感觉完全靠运气，做了这么多次菜只有一次没有漏气出来，被种草的童鞋可以拔草了",2017-12-16 11:43:20
1023003,5,"这个锅份量十足啊，真的很重，质量非常好呢，颜值爆表，还没开始用，买给妈妈的",2017-11-21 09:20:32
1023003,5,"它，唯一的缺点，就是，重！除此以外，都是优点！炖汤清澈，色香味具佳！我很喜欢，再重也忍了。",2017-12-21 14:40:55
1023003,1,"锅盖和锅边均有磨损。你们装货时难道不检查吗？如果不是因为太重退换货麻烦，我肯定不会留下来。",2017-12-19 16:17:00
1023003,5,"很沉，准备再买个22的！很沉，准备再买个22的！很沉，准备再买个22的！",2017-10-27 15:20:28
1023003,4,"很重，煮粥还是会溢水，煮饭控制不好会糊锅，电饭煲还是好一些。不如想象中好",2017-12-17 21:19:05
1023003,5,"种草了好久的 在22寸和24寸之间纠结不已 看到限时购果断下单 太好用了 炖猪蹄放了比平时还少的水 炖好久都没怎么消 密封性好 尤其是在锅盖上浇点冷水 会帮助水蒸气回流锅里 比平时用普通炒菜锅炖更加入味 更加省时省力 犹豫的朋友千万不要错过了 真的是值得买的一个炖锅",2017-11-30 21:52:37
