"itemId","star","content","createTime"
1023003,0,"宝贝收到，快递给力，包裹的非常严实，还特别标注易碎勿摔，很负责任！材质非常好，厚实、很重。目前还没使用，用后再来评价！",2017-07-10 23:13:40
1023003,0,"好喜欢，不过对我家人来说太小了点，我家人都是大胃王。",2016-12-17 12:25:20
1023003,0,"不错的炖锅，炖肉好香，好评！",2017-02-01 23:30:21
1023003,5,"锅子小瑕疵还是蛮多的 胜在性价比",2017-08-16 22:21:00
1023003,0,"炖肉很不错，但做米饭煮粥会沸出去，还在逐步学习",2017-01-14 15:57:12
1023003,0,"l炖肉炖排骨又软又烂又嫩",2017-01-30 19:06:35
1023003,0,"颜值高！质感好！",2017-02-01 20:24:41
1023003,0,"实惠",2017-01-31 21:06:42
1023003,0,"很重 很重 可以看出来用料有多扎实 漂亮 快递小哥都送到单元门口了 必须赞一个",2016-11-12 23:24:26
1023003,0,"发货快，速递快，宝贝好",2017-01-30 13:23:57
1023003,0,"收藏用的，哈哈",2017-01-30 12:51:03
1023003,0,"开启严选之旅",2017-01-30 05:17:44
1023003,0,"物流差评。包裹丢失一直没发货，也没人主动联系我，客服还喊我一直等，补寄后快半个月才收到货，也没有任何补偿，体验感太差",2016-12-12 16:23:30
1023003,0,"挺好用的，不过锁水没有想象中的那么强大！",2017-01-26 13:06:26
1023003,0,"超值，用卷后价格非常实惠，质量也很好，老人很满意，严选加油，要继续保持哦！",2016-11-17 17:35:50
1023003,0,"锅很沉 也很漂亮 就是刷完了还要擦干比较麻烦",2017-01-03 22:41:16
1023003,0,"很棒的锅已经煲过好多次汤了，肉很香很松，煲出来的汤颜值也大大提升！",2016-11-10 09:20:29
1023003,5,"我的会漏气，不太好",2017-08-17 14:55:12
1023003,0,"这个可代替高压锅。",2017-01-28 22:29:29
1023003,0,"颜值高，而且相当好用",2017-01-27 19:13:34
1023003,0,"好看好用",2017-01-27 09:58:03
1023003,0,"不太会用，东西真是很扎实。就是自己不知道用这种锅怎么做",2016-12-12 13:14:13
1023003,0,"温馨提醒：这个珐琅锅内表有一层珐琅层，涂层你懂的，比较容易脱落，我刚买来用第一次就脱落了，还好网易退货做的还行，顺利退货了。",2016-12-11 11:25:08
1023003,0,"这个锅超级重，颜色只有这个颜色可以选了，还没使用，看起来很完美。",2016-12-12 16:34:28
1023003,0,"还没用，挺厚重的。就是，颜色要再亮点就好了。",2017-01-15 19:25:59
1023003,0,"确实如评论所说，物有所值，质量很好，爱上严选了，希望推出更多生活用品。",2016-11-14 13:47:00
1023003,0,"有点太重了",2017-01-26 01:16:32
1023003,0,"外观包装都不错，拿回来炖汤以后发现锅底脱色了……你没有看错，褪色了，无法洗干净清理掉，已退货，售后很好",2016-10-31 15:44:15
1023003,0,"好锅啊。",2017-01-26 20:55:01
1023003,0,"同学介绍我来买的，我们四个人人手一个，哈哈，开始料理",2017-01-19 18:58:16
1023003,0,"质量很不错，很厚重，就是价格也有点贵，总之还不错。",2017-01-14 23:00:23
1023003,0,"必须赞一下这个锅。好看，优质，功能超赞。煮了一次瘦肉粥，真的很不错。",2016-12-11 22:42:54
1023003,0,"很漂亮，有些小问题，客服很负责任给退换。网易品质放心",2017-06-13 08:59:18
1023003,0,"挺好的",2017-01-25 20:13:30
1023003,0,"很好用",2017-01-25 01:12:49
1023003,0,"好评",2017-01-25 00:25:09
1023003,0,"炖肉炖菜神器",2017-01-24 22:53:32
1023003,0,"送人的，朋友很喜欢",2017-01-24 10:04:52
1023003,5,"够重、够厚！这个价位做工算得上细致。如果说不粘，那宣传有点夸张，当然煮粥、炖汤一般不会粘锅，但煎牛排、鱼之类的粘的挺严重，需非常注意火的大小会好那么一些。",2017-08-13 11:49:25
1023003,0,"好好 很满意",2017-01-24 09:36:45
1023003,0,"很喜欢这个锅啊，性价比很高～没用过其他的，但这个用下来感觉不错！",2016-11-12 22:27:24
1023003,0,"非常好用，推荐购买",2017-01-23 22:33:22
1023003,0,"好",2017-01-23 10:01:31
1023003,0,"很好！煲汤原汁原味 保热效果很好",2017-01-22 19:34:28
1023003,0,"真的超级棒～煮东西效果非常好～",2017-01-22 14:43:18
1023003,0,"锅还不错",2017-01-22 14:43:56
1023003,4,"颜值在线，太沉了，需要护理，略显麻烦",2017-08-05 07:25:00
1023003,0,"好用，岬每欤放久了也比^保兀值得",2017-01-15 18:40:20
1023003,0,"还没用，看着不错，厚重漂亮。",2017-01-21 20:14:02
1023003,0,"真的非常喜欢这个锅",2017-01-21 15:40:13
1023003,0,"炖出来的东西汤汁饱满，肉烂，入味。是好锅。",2017-01-19 09:17:54
1023003,5,"用小火炖了牛腩，可是等我去看里面汤汁都快干了，灶台上都是水，锅盖盖不严，一个地方一直冒气，找客服说让我锅盖上加水试一下，结果试了一下还是那样，不知道有没人和我一样情况的，我要换货啊啊啊",2017-08-04 09:16:58
1023003,0,"这是第一次在严选买！品质很好！",2017-01-20 22:23:00
1023003,0,"绿色低调的美，炖肉很烂。",2017-01-20 13:40:47
1023003,0,"物美价兼！支持！",2017-01-20 22:16:32
1023003,0,"非常好非常喜欢",2017-01-20 22:25:37
1023003,5,"有两个瑕疵，换货了",2017-08-03 08:16:03
1023003,0,"超级漂亮，不错！",2017-01-20 00:02:54
1023003,0,"还不错",2017-01-20 10:58:26
1023003,0,"好",2017-01-20 20:11:51
1023003,0,"赞",2017-01-20 00:27:14
1023003,4,"还没有使用 表面有点点小瑕疵 懒得换了",2017-07-29 16:04:58
1023003,0,"炖了肉。实在是太喜欢了，和法国滴Le神马有得一比。",2016-12-16 13:17:48
1023003,0,"222做活动买的还行",2017-01-19 11:40:25
1023003,0,"不错，就是真的相当沉。",2017-01-19 02:00:38
1023003,0,"好看，好用。信赖严选。",2017-01-19 17:45:05
1023003,5,"锅盖不严实，煮的时候漏气严重",2017-07-30 19:13:07
1023003,0,"大小合适，漂亮",2017-01-19 07:55:28
1023003,0,"惊艳",2017-01-19 14:50:33
1023003,0,"这个锅简直买得太值了，烧东西和炖汤特别合适",2017-01-01 23:20:36
1023003,0,"买来送朋友的，很上档次",2017-01-18 22:34:44
1023003,0,"既有颜值又实用，非常好",2017-01-18 16:16:50
1023003,0,"没用，好重呀，不会用……",2017-01-18 12:49:19
1023003,4,"蛮好用 很沉 但是盖子有点点不够严密",2017-07-27 22:29:02
1023003,0,"比起双立人，这锅确实不错…",2017-01-18 17:32:56
1023003,0,"还可以，颜色也比较暗",2017-01-18 00:44:38
1023003,3,"粗糙不平 有瘢痕",2017-07-28 13:07:50
1023003,0,"好，还没用。",2017-01-18 20:20:50
1023003,0,"重！加热很快",2017-01-18 19:33:18
1023003,0,"好用",2017-01-18 14:50:20
1023003,0,"不错",2017-01-18 22:02:53
1023003,0,"不错",2017-01-18 09:27:24
1023003,0,"太烂了，差评",2016-12-04 12:30:49
1023003,0,"包装很好，颜色也很暖意。还没使用，应该是可以的。值得推荐。",2016-12-31 06:48:11
1023003,0,"还没用，看着不错",2017-01-17 12:15:30
1023003,0,"很好用，很喜欢",2017-01-17 18:01:12
1023003,0,"很厚重，做饭很好",2017-01-17 10:46:42
1023003,5,"物超所值的锅，至少我没有发现它和双立人的有啥本质的区别，颜值一样，价格少了一大截。唯一不是很满意的就是比预想的大了一点点（平时就2人的餐量）值得推荐！
ps：使用中的保养是个问题，一不小心就容易生锈了
pps：这个能用电磁炉加热吗？网上查了说可以，但还没试过",2017-07-27 00:45:20
1023003,0,"分，份量还是很厚重的.和1.2千的差不多，还没用，不知道质量咋么样",2016-11-14 13:42:24
1023003,0,"活动时候买的，物超所值，真的很棒，包装很扎实。网易严选的品质真的很出乎意料",2016-11-14 10:29:59
1023003,0,"很赞 很重 颜色也很美",2017-01-16 14:00:45
1023003,5,"还没开始用上面有一点划痕",2017-07-23 22:02:24
1023003,0,"非常满意！！",2017-01-16 18:05:59
1023003,0,"不错哦",2017-01-16 17:04:05
1023003,0,"很好。",2017-01-16 14:35:21
1023003,0,"货真价实",2017-01-16 23:42:08
1023003,0,"不开森，明明订了浆果红，却给我发成森林绿。现在浆果红没货了，想换都不能换了……故意的吧……严重低级错误",2016-11-11 20:41:40
1023003,0,"很好，购买多个。炖肉利器，电磁炉可用",2017-01-15 04:48:32
1023003,0,"折后222到手，很重，用料做工都很不错，跟原版比一些细节还有所不及，但这个价格，还要什么自行车啊。",2016-11-12 22:02:43
1023003,0,"还没开煮，好重。一口好锅",2017-01-15 11:53:31
1023003,0,"好用。就是不知道耐用么",2017-01-15 10:26:04
1023003,0,"我想要鲜红鲜红的那款，结果发了个月经红给我，唉...",2016-11-10 15:36:52
1023003,0,"非常好，很有分量",2017-01-15 01:27:44
1023003,0,"一个沉沉的铁锅",2017-01-15 18:27:43
1023003,0,"很好",2017-01-15 22:08:33
1023003,0,"好",2017-01-15 12:27:39
1023003,0,"锅子很重，用起来很结实，非常好。",2017-01-14 13:23:04
1023003,0,"还没用，凑单用，感觉还不错！",2017-01-14 09:58:00
1023003,0,"还没用，拆开包装材质很好。",2017-01-14 10:15:00
1023003,0,"非常好用的珐琅锅",2017-01-14 10:57:37
1023003,0,"一定要买大的锅，小的放不了什么东西",2017-07-12 22:07:28
1023003,0,"还不错，鼓励",2017-01-14 11:54:02
1023003,0,"好东西",2017-01-14 11:39:40
1023003,0,"大小合适，价格合理，做工精细，严选一如既往地好产品",2017-01-12 16:15:45
1023003,0,"虽然还没开用，但和我买的法国名牌锅看上去差不多，两百多的价格确实划算啊！",2016-11-12 23:17:04
1023003,0,"很不错，就是用的时候有点烫手，要是能能附赠一副手套就好了",2017-05-05 09:24:38
1023003,0,"比想象中重很多啊重很多，还没启用，目测煮东西应该会很好吃。。",2016-11-21 12:22:00
1023003,0,"锅的颜值很高哦 比图片好看 质感也非常好 性价比超级高 很赞！",2016-11-21 09:49:32
1023003,0,"好重，还没有开始用，貌美",2017-01-13 10:44:56
1023003,0,"价格实在，不比某菲、某福差",2017-01-13 00:32:39
1023003,0,"炖汤非常好",2017-01-13 22:04:25
1023003,0,"很不错，值得信赖！",2017-01-13 16:54:36
1023003,0,"物有所值。",2017-01-13 12:23:25
1023003,0,"有一点点漏气，不过结实漂亮，实用，还是很喜欢~",2017-01-12 10:00:45
1023003,0,"颜色很暗，没有网上的那么亮，我还一度以为是不是发货发成另一种红了…",2016-04-09 15:45:58
1023003,0,"好快就到货了，今天下班回家就迫不及待的拆开包装，蓝色真漂亮，物超所值",2016-11-11 16:16:35
1023003,0,"相当漂亮，分量十足，送给妈妈了",2017-01-12 14:22:58
1023003,0,"烧汤特别的好用",2017-01-12 22:11:03
1023003,0,"好用 好用 好用",2017-01-12 18:13:09
1023003,0,"有一点嗑坏了，算了不退了",2016-11-27 21:51:48
1023003,0,"很不错",2017-01-12 20:48:58
1023003,0,"很好",2017-01-12 14:30:04
1023003,0,"好用，感觉下厨房都更高雅了。就是养锅麻烦了点",2016-12-26 18:43:09
1023003,0,"锅已收到看着做工不错，待开锅后再评！",2017-01-10 14:31:30
1023003,0,"一共买了三个锅，都不太好用，各种不方便，好看而不实用，如烫手保养很麻烦口味也不见得好，慎买，联系客服累死你。退货难死你。第一次这里买东西，这些好平是哪里来的，慕名而来败兴而归",2017-07-13 10:10:43
1023003,0,"尺寸还是比较小，锅很重，做工很好",2017-01-11 14:35:38
1023003,0,"很重的锅，保热效果好。炖肉很给力",2017-01-08 22:52:40
1023003,0,"买的早，晚点买可以有绿色等更好看的色彩<U+0001F602>",2017-01-08 01:41:13
1023003,0,"很不错，从来不溢锅，味道也很美，就是重了点",2017-01-05 10:02:07
1023003,0,"比想象中颜色深了一点 要是大红色就好了",2017-07-05 17:07:46
1023003,0,"很好用的锅，买第二个了送女儿，而且这次是打折的，非常值得入手。物流也给力，在网易严选购物非常愉快<U+0001F44D><U+0001F44D><U+0001F44D>",2016-11-09 23:32:17
1023003,0,"已经用上了，值得推进",2017-01-11 07:02:05
1023003,0,"性价比超高",2017-01-11 19:24:42
1023003,0,"非常不错的锅",2017-01-11 18:18:53
1023003,0,"很不错",2017-01-11 19:38:46
1023003,0,"物美价廉",2017-01-11 19:24:49
1023003,0,"还没用。用过再来评价哦。外观好看",2017-01-10 11:30:43
1023003,0,"非常好用，使用率非常高",2017-01-10 22:19:31
1023003,0,"炖肉熬汤都很好！就是密封性不是很好吧！时间长就干锅了",2016-10-03 08:25:30
1023003,0,"锅比较沉",2017-01-10 22:51:30
1023003,0,"不错",2017-01-10 21:31:14
1023003,0,"好锅",2017-01-10 17:09:39
1023003,0,"非常好",2017-01-10 16:17:06
1023003,0,"漏发一个锅，售后服务慢，其中一个锅有瑕疵。",2016-11-24 00:00:18
1023003,0,"不错",2017-01-10 21:22:18
1023003,0,"赞",2017-01-10 10:28:15
1023003,0,"好用，不过对于网易的客服处理赠品的方式和态度非常不满，很不专业",2016-11-09 22:19:25
1023003,0,"298买的，买贵了！！！！！现在8折222！其实珐琅锅就是搪瓷锅而已，那材料是搪瓷！",2016-11-09 14:45:00
1023003,0,"好用，煮东西香、不粘、耗时短",2017-01-09 09:30:44
1023003,0,"性价比高的不要不要的！好用的不要不要的！做的食材好吃的不要不要的！",2016-11-15 11:21:27
1023003,0,"很好",2017-01-09 16:00:43
1023003,0,"不错",2017-01-09 10:27:14
1023003,0,"锅身很重，买回来煮了一下，感觉锁水效果不错，今天第一次用来焖排骨，味道不错！担心会干水，加了一点水，煮了很久水还有很多，结果要打开盖子，让水分蒸发走。。",2017-07-08 14:25:48
1023003,0,"质量好、但盖盖煮粥还是会溢出呢",2017-01-07 14:09:05
1023003,0,"因为是铸铁锅，很有份量。煲汤非常不错！",2017-01-08 21:36:49
1023003,0,"这锅真是不错，推荐啊，导热快，不漏气，做东西快。",2017-01-02 17:11:44
1023003,0,"颜色比图片暗一些，还没有使用，看着就挺喜欢的",2017-01-02 18:10:39
1023003,0,"沉太沉",2017-07-08 22:59:03
1023003,0,"很好，煮出来东西很香",2017-01-08 13:30:02
1023003,0,"送人，同学喜欢",2017-01-08 00:42:21
1023003,0,"非常厚实，照说明开了一下锅，希望新年有机会可以用到。",2016-12-28 00:17:25
1023003,0,"很好用的一款锅，如果盖子再凹一些就更好了。",2017-06-18 17:04:07
1023003,0,"如果硬要说个缺点，那就是重，很重，非常重，质感没得说",2016-11-16 16:32:12
1023003,0,"收到就用了，还专程上网搜菜谱。可惜没买到喜欢的颜色，绿色比较暗沉。",2016-11-16 12:49:01
1023003,0,"感觉还行吧，挺沉的，还没用",2017-01-07 09:27:52
1023003,0,"给姐姐的搬家礼物，希望她喜欢",2017-01-07 13:53:04
1023003,0,"送朋友新居的，说是很好",2017-01-07 09:09:40
1023003,0,"我收到的锅怎么没有食谱呢！！！
那我怎么做菜呢？？？？",2017-06-25 22:30:32
1023003,0,"好重啊！8折券I下！超划算！",2017-01-06 15:26:51
1023003,0,"非常沉，称了一下十斤左右，炖肉煲汤挺好的就是煮完太烫了",2016-11-15 21:19:56
1023003,0,"我能说这锅超级赞吗？  已经推荐N多同事加入严选粉丝团，太棒了！！！！",2016-11-15 15:29:14
1023003,0,"看着不错，很重，还没有开始用",2017-01-06 22:59:40
1023003,0,"跟上千的比差点，但是这个价绝对值",2017-07-05 09:49:29
1023003,0,"很厚实，不知道效果如何",2017-01-06 21:01:17
1023003,0,"非常棒的一次购物体验。",2017-01-06 15:00:54
1023003,0,"不错，很好用。",2017-01-06 12:52:29
1023003,0,"颜色美到不行",2017-01-06 13:37:30
1023003,0,"跟普通锅真的不一样，简直惊喜！所以它那么麻烦我还是很开心~满意极啦！",2016-04-10 22:54:22
1023003,0,"不错。我喜欢",2017-01-06 19:56:11
1023003,0,"好得很",2017-01-06 16:41:40
1023003,0,"不错",2017-01-06 17:08:10
1023003,0,"满意",2017-01-06 14:43:24
1023003,0,"一下买了三个，太好用了",2017-07-05 08:29:27
1023003,0,"没我想要的颜色，但又有8折活动，挑了个蓝色，也不错。锅好沉！",2016-11-14 13:17:41
1023003,0,"我的妈呀，这珐琅锅重的海里去了，这锅怎么不用两个100年！",2016-11-14 11:24:36
1023003,0,"质感很强，用起来一定很好<U+0001F60A>",2017-01-05 06:54:20
1023003,0,"非常好，等做一顿尝尝",2017-01-05 20:19:46
1023003,0,"很好，买了很多厨具",2017-01-05 12:57:25
1023003,0,"好用，炖菜煲汤都很合适，烧开后用小火，不会喷得到处都是汤水了。做的菜比一般的锅更香更入味，赞。。",2017-06-20 18:24:38
1023003,0,"买了两个，送朋友一个，自己一个，还没用，挺沉的，先屯着。",2016-12-03 01:09:22
1023003,0,"很重。。期待效果",2017-01-04 10:55:36
1023003,0,"不错，很好",2017-01-04 23:35:53
1023003,0,"很好用",2017-01-04 19:07:48
1023003,0,"盖子不平是翘的，放平面上一按就两边晃动，估计漏气严重啊，品控有待加强啊，打算送人的有点担心别人用着说不好....釉面还是很漂亮的",2016-11-22 10:38:11
1023003,0,"真是太棒了，当天来了锅海鲜粥，那个棒啊，撑得已经扶墙了<U+0001F602>",2016-12-11 19:13:44
1023003,0,"锅非常的重，已经按照说明开锅，但还没有正式使用，希望能有比较好的效果。",2016-11-13 21:13:10
1023003,0,"很重，质量不错",2017-01-03 17:38:22
1023003,0,"很好很厚重，期待作出好料理.",2017-07-02 21:23:41
1023003,0,"厨房必备",2017-01-03 23:46:50
1023003,0,"好",2017-01-03 00:19:57
1023003,0,"满意，用很多次了，也好保养，没有生锈什么的。",2017-01-02 18:11:18
1023003,0,"质量不错",2017-01-02 21:07:31
1023003,0,"锅很重，很美",2017-07-01 09:38:10
1023003,0,"锅子很厚重，炖汤比一般的锅要快一点。",2016-12-31 17:34:04
1023003,0,"好，觉得我家人口多，可以再大一些，全铁的，有重量",2016-12-26 07:24:32
1023003,0,"打开包装了，看到锅觉得特别满意，还没用，希望用了更满意！",2016-12-16 17:26:20
1023003,0,"品质没话说，还是很满意的。",2017-01-01 08:07:54
1023003,0,"包装就那么大气！炖汤不失水，烧肉熟得快，不错不错，感觉和动辄上千的大牌锅比起来也没啥差别。唯一缺点，把手太烫了……",2017-06-21 09:58:48
1023003,0,"挺好用，分量足，质量满意",2017-01-01 18:31:46
1023003,0,"非常好用",2017-01-01 01:28:42
1023003,0,"好的",2017-01-01 11:35:14
1023003,0,"很不错，很有质感，网易出品，必属精品。",2016-12-31 20:48:08
1023003,0,"这个锅内没有珐琅彩，不过也是一个很好的锅，补铁！",2016-12-08 09:42:38
1023003,0,"给妈妈买的 ，说还行。但是也有好多人说不好的，还是要自己试试。",2016-11-10 20:28:14
1023003,0,"看着很不错，希望好用",2016-12-31 15:44:25
1023003,0,"漂亮，实用",2016-12-31 09:48:14
1023003,0,"好东西 红色有点深 基本看不出是红的",2016-12-27 11:41:10
1023003,0,"还没使用 做工很好 相信严选的品质",2016-12-30 23:26:24
1023003,0,"新居准备，很厚实，但有一点磕碰",2016-12-30 23:14:01
1023003,0,"煲汤炖肉的好助手，居家好拍档。中意很久的锅，颜值有了，生活品质也会提高。爱生活，爱厨房，爱美美的锅碗瓢盆。",2016-12-18 09:42:12
1023003,0,"性价比真的很高",2016-12-30 08:11:21
1023003,0,"很有分量，颜色也好。",2016-12-30 22:11:03
1023003,0,"价钱贵了点。",2016-12-30 15:03:50
1023003,0,"很好",2016-12-30 14:14:56
1023003,0,"hao",2016-12-30 23:32:16
1023003,0,"熬出来的玉米掰骨汤都是白色的啦～就是对小女生来说好重，怕打坏",2016-10-24 20:03:52
1023003,0,"外观很漂亮，超喜欢，锅的密封性一般，普通煮会有蒸汽出来，水会少，看有人评价说如果在锅盖上加冷水会好很多，准备下次试试",2016-12-24 00:39:15
1023003,0,"还行吧～买之前很兴奋～拿到以后～就那样吧～还没用～可以不买～",2016-11-18 14:59:20
1023003,0,"老爸说很好很重，然后收到那天赢麻将了。",2017-06-22 23:43:23
1023003,0,"不错，很重的锅，很漂亮",2016-12-29 08:44:43
1023003,0,"很好！很高大上",2016-12-29 10:55:56
1023003,0,"非常好，赞一个！！！！",2016-12-29 08:56:45
1023003,0,"颜色稍暗，质量不错",2016-12-29 08:31:16
1023003,0,"色彩美丽，质量也不错，就是小了一点点。",2017-06-27 00:09:22
1023003,0,"挺好挺好",2016-12-29 09:36:43
1023003,0,"质量很好。",2016-12-29 13:05:52
1023003,0,"质量还不错",2016-12-29 08:31:04
1023003,0,"锅中神器，煲粥还是煨汤都能做出极为成功的作品，当然了，最牛逼的是做煲仔饭焖锅一类的美食，喜欢吃锅巴的童鞋在饭即将熟的那一刻均匀地浇上一勺油，再调至小火等上五分钟，黄金锅巴就出炉了，真的是爱不释手，之前的炒锅炖锅高压锅全部打入冷宫。。。",2016-12-29 17:26:26
1023003,0,"这个锅父母比较满意，厚重 保温效果好 不粘",2016-12-28 15:53:22
1023003,0,"锅很重，还没用，包装不错，用后补评",2016-12-27 20:48:05
1023003,0,"不让双立人活系列，买了之后，看到双立人在商场搞活动，真感觉一样，但价格差一位数",2016-10-23 22:43:06
1023003,0,"好重的锅！美貌！拿来按照指示养了锅，炖了一次汤，好棒！喜欢！",2016-11-17 16:59:56
1023003,0,"收到了，貌似开锅还挺麻烦的…",2017-06-25 17:26:25
1023003,0,"看到活动，立马拿下了～太实惠了",2016-12-28 22:00:46
1023003,0,"不错的呢",2016-12-28 12:16:38
1023003,0,"非常美貌，炖汤很好，只是一家3口太大了。想买小款的。",2016-11-26 16:38:08
1023003,0,"锅很漂亮，很重
就是锅沿有细微瑕疵，还好性价比高",2016-11-16 22:50:27
1023003,0,"颜色纯正，品质好，性价比高",2016-12-27 08:11:23
1023003,0,"严选的东西就是棒，赞！",2016-12-27 08:49:44
1023003,0,"棒棒，好重的锅。",2016-12-27 22:58:38
1023003,0,"很沉",2016-12-27 23:46:50
1023003,0,"好评",2016-12-27 18:04:25
1023003,0,"漂亮",2016-12-27 02:33:18
1023003,0,"非常好的产品，自从几次购买后对严选的品质已经比较信赖，现在看到喜欢就买，至今没有失望的。",2016-10-14 13:06:59
1023003,0,"炖了一次西红柿牛腩 感觉不错",2016-12-26 09:09:42
1023003,0,"涂层容易掉啊。",2016-11-17 11:40:14
1023003,0,"第二件了，好用！",2016-12-26 18:46:02
1023003,0,"还没用。",2016-12-26 22:37:13
1023003,0,"很牛逼！",2016-12-26 01:53:58
1023003,0,"不错吧。",2016-12-26 22:00:24
1023003,0,"特别好",2016-12-26 14:09:02
1023003,0,"还不错，比staub做工还是有些差别。",2017-06-22 00:22:37
1023003,0,"好",2016-12-26 17:53:10
1023003,0,"好",2016-12-26 00:10:22
1023003,0,"很沉，老公很满意！希望真正使用时更满意。",2016-12-25 23:26:30
1023003,0,"和描述一样，漂亮大气，真的挺重的，女生力气小没办法轻松使用，开小火就可以煮一锅靓汤，就是锅盖和锅把太热，必须要配付隔热手套，早上到货晚上马上用了，确实不错",2017-06-22 00:16:35
1023003,0,"这个太好用了 性价比极高",2016-12-25 15:27:47
1023003,0,"买来送人的，备有面子。",2016-12-25 21:22:30
1023003,0,"送朋友的，没打开看。",2016-12-25 21:12:48
1023003,0,"送朋友的，不错",2016-12-25 14:44:06
1023003,0,"好用",2016-12-25 22:35:32
1023003,0,"美丽极了",2016-12-25 09:50:28
1023003,0,"美丽",2016-12-25 09:50:37
1023003,0,"比想象中的小一些，等用了才知道。",2016-12-24 16:25:35
1023003,0,"大概是一百年都腐蚀不完吧，辣鸡锅，不好用",2016-11-11 22:27:23
1023003,0,"物超所值！十分满意！值得选购！",2016-12-24 18:14:09
1023003,0,"很不错的锅",2016-12-24 20:57:52
1023003,0,"好重，看上去不错",2016-12-24 10:07:32
1023003,0,"盖子不太满意，其余灰常好",2017-06-20 09:02:01
1023003,0,"很好",2016-12-24 12:53:56
1023003,0,"好用",2016-12-24 12:03:49
1023003,0,"超值无比好用锅，颜色可能不是渐变色，但质量不比国外名牌差",2016-11-13 20:19:43
1023003,0,"浆果色美炸了！！！然后特别重，九斤多呢！三口之家足够用了，喜欢喜欢！",2016-11-13 13:15:47
1023003,0,"珐琅掉了，退货了，又再拍一个，希望用的久",2016-12-20 18:31:02
1023003,0,"锅挺美的，也做过几次菜了，但是盖子的密封性不好，漏气的，煲甜汤就底下两厘米的水会有水汽凝结沿锅沿流出来，对得起价格吧，另外对是否双立人代生产方表示怀疑",2016-11-15 22:35:18
1023003,0,"质感很好",2016-12-23 16:52:44
1023003,0,"好",2016-12-23 21:23:47
1023003,0,"不错",2016-12-23 21:06:51
1023003,0,"很好，第一次使用烧了红烧肉给家人吃",2016-12-22 13:26:54
1023003,0,"东西很重啊，开锅和保养比较麻烦，其他不错",2016-12-22 11:32:46
1023003,0,"很厚重的一个锅，颜色也好看，以后还要买其他的",2016-12-19 10:37:47
1023003,0,"双十一买的，很划算，之前买过一个红色，很好用，这次买了送给父母。",2016-11-21 11:26:03
1023003,0,"颜值高，容量大，好好用！要挑毛病话就是太
重了",2016-12-16 22:11:17
1023003,0,"很重。周末试试",2016-12-22 22:30:35
1023003,0,"第二次买。",2016-12-22 09:53:23
1023003,0,"物美价廉",2016-12-22 11:47:02
1023003,0,"炒菜、炖肉、煲汤，太实用了。缺点，有点重。",2016-12-20 19:25:41
