"itemId","star","content","createTime"
1039053,0,"还不错，但是合口一般，左边有翘口。",2016-10-19 15:43:14
1039053,0,"我觉得还是不如muji的质量好。。不过反正也是凑单无所谓啦",2016-10-19 21:15:20
1039053,0,"比想象的小，放不了几根笔",2016-10-14 20:22:11
1039053,0,"只是没有无印良品的标签 扣的那里稍微不同",2016-10-24 12:00:56
1039053,0,"笔放一层有点浪费空间，还在里面晃荡，放两层根本放不下。发现设计还是有待优化。",2016-10-23 15:51:07
1039053,0,"盒子太大，以为只有铲子，拿完了就把这个笔盒忘了，给扔了，<U+0001F62D>",2016-10-15 09:53:49
1039053,0,"有些小.....",2016-11-15 05:18:13
1039053,0,"仿制MUJI的，相比之下略粗糙，打开多时候比较费劲",2016-10-13 20:55:49
1039053,0,"很精细，不是粗制滥造的感觉，挺好",2016-10-17 14:32:44
1039053,0,"",2017-01-25 11:21:29
1039053,0,"细节很能表现出一个品牌的质量与一家公司的性格，很加分讲真。笔盒不小，还可以加第二层。",2016-11-12 18:23:44
1039053,0,"非常好，很合适，快递服务很好",2017-01-24 14:20:47
1039053,0,"用来装钢笔的，以后考试还可以装一些小的散东西，不错。",2017-01-06 16:23:54
1039053,0,"本想买来装ipad pencil的，作为极简主义者，感觉应该买小号的",2016-12-07 10:32:23
1039053,0,"非常好非常好非常好非常好非常好非常好非常好非常好非常好",2016-12-17 23:08:57
1039053,0,"便宜好用颜值高！喜欢",2017-01-20 15:48:22
1039053,0,"质感不错，可以放双层笔，不过好像拍错了，本来想买19厘米那款",2016-12-24 00:54:13
1039053,0,"",2017-01-18 23:34:19
1039053,0,"喜欢 所有的东西都喜欢",2017-01-17 08:46:01
1039053,0,"",2017-01-16 10:31:31
1039053,0,"质量很好，就是上手才知道有点小，应该买大号的。",2017-01-02 19:07:50
1039053,0,"很厚实，跟想象的一样，简单有质感，随手放包里也不占空间。",2016-12-19 09:15:38
1039053,0,"质量很好 手感乜很好 喜欢 恩 非常满意的一次购物",2017-01-06 18:54:11
1039053,0,"挺好挺好B<U+A66A>BB<U+A66A>B",2017-01-12 14:03:00
1039053,0,"容量还蛮大的 能放得下十支左右呢！！！",2017-01-09 22:10:16
1039053,0,"在无印良品看到和这个差不多的，很喜欢，所以跑严选赶紧入手一个",2016-12-17 11:10:30
1039053,0,"质量很好，快递也很快，很喜欢",2017-01-09 09:52:33
1039053,0,"",2017-01-09 18:59:51
1039053,0,"简洁，明快，磨砂的手感摩挲起来很好，这是大号的，比一支笔稍长，小号的大小不太清楚了。",2016-11-14 22:29:08
1039053,0,"十分小巧可爱，质量也是杠杠的，很喜欢在严选买的东西。",2016-12-28 09:59:04
1039053,0,"第二次买了<U+0001F601>，不过这个其实是旧的，新的是帮闺密买的顺便凑单（*/<U+2207>＼*）",2016-11-07 12:16:42
1039053,0,"略有小贵，不过挺好用的！",2017-01-07 22:58:05
1039053,0,"三天多到，快递小哥很帅^O^很敬业，晚上十点了还在送。三个字，很喜欢，在三个字，很开心包装很仔细，宝贝很合心意。",2016-12-15 22:51:58
1039053,0,"比较普，但我觉得是OK的",2017-01-07 18:34:19
1039053,0,"颜值高，好看又实用",2017-01-07 09:37:43
1039053,0,"很好很好，东西摸着特别爽，包装看着很舒服，顺丰不用说，刚刚滴",2016-11-15 17:51:46
1039053,0,"简单精致无味！",2017-01-06 16:31:02
1039053,0,"很棒",2017-01-06 12:40:32
1039053,0,"即使是双十一快递也很给力，第二天就到了。质量不错哦，很有质感，不过稍微小了一点，最多只能放四支笔",2016-11-12 15:46:30
1039053,0,"很满意，很简单，好看",2017-01-05 10:41:15
1039053,0,"好用，方便，快捷，实用，简洁，大方，大气。",2017-01-04 22:50:45
1039053,0,"盒子和muji差不多",2017-01-04 18:22:50
1039053,0,"发货很快，用的顺丰快递，物流也快，东西感觉蛮不错的，实物如图，整体满意的一次购物，好评走起。",2016-11-03 18:00:15
1039053,0,"不多说 简单大方没得说",2017-01-03 23:50:55
1039053,0,"P盒斡匈|感，我oM分，呐南碌轿沂稚现换ㄒ惶欤w完美！肋x^m加油！",2016-11-10 18:59:04
1039053,0,"建议买大一点的。当然小的也很高端。大的才能把网易笔都装下来嘛<U+0001F60E>",2016-10-22 19:25:48
1039053,0,"比muji的好，至少不用去撕那个讨厌的标签",2016-11-09 20:54:14
1039053,0,"还不错，和无印良品质量差不多",2016-12-28 23:39:33
1039053,0,"磨砂的，虽然没有想象中的透明，毕竟是磨砂的嘛，摸起来很有质感，装上三四支笔没问题",2016-10-17 10:21:15
1039053,0,"很好，简洁明了，比较短，可以放一块小橡皮，橡皮大的话可以买长一点的~",2016-11-16 09:44:59
1039053,0,"不错。值得购买",2016-12-27 11:51:33
1039053,0,"还不错",2016-12-27 18:21:20
1039053,0,"纯粹为了凑单而买，东西还可以，扣的挺紧的",2016-12-20 22:25:45
1039053,0,"笔盒跟无印比还是有差距的",2016-10-12 23:11:48
1039053,0,"收到之后发现盒子上有点划痕，联系客服后答应补贴个优惠券，",2016-09-30 11:28:01
1039053,0,"够大 很好用 买了俩",2016-12-25 13:09:08
1039053,0,"质量很好。",2016-12-25 14:45:11
1039053,0,"muji上 严选下 手感滑一些 扣要紧一些 价格是二分之一",2016-12-14 12:53:12
1039053,0,"",2016-12-24 01:16:34
1039053,0,"非常好，很喜欢！",2016-12-23 13:08:58
1039053,0,"开合需要试几次，用着没问题",2016-09-25 16:33:34
1039053,0,"给朋友的，她很喜欢",2016-12-22 11:11:55
1039053,0,"不错很喜欢。",2016-12-22 14:40:21
1039053,0,"",2016-12-22 22:29:17
1039053,0,"已经找不到了。。。",2016-11-16 11:01:35
1039053,0,"",2016-12-21 22:39:39
1039053,0,"质感一般，中间的链接有点薄，担心耐用性。",2016-11-12 16:36:14
1039053,0,"质量挺好！大号的容量大能装多支笔适合自习学习！",2016-12-10 16:59:11
1039053,0,"感觉笔盒略大… 但是跟Muji比，这个肯定物美价廉啦。从云音乐到严选，一直在默默支持这丁磊。虽然吃不起黑猪肉，只能充充云音乐年会员，买买严选东西(o_o) 希望严选能有更多物美价廉的好东西～",2016-12-20 15:02:18
1039053,0,"厚实不变形",2016-12-20 17:19:41
1039053,0,"女朋友很高兴，蹦哒了一路。东西不错哦",2016-12-19 23:30:58
1039053,0,"不错，磨砂的，这个尺寸适合男性",2016-12-19 11:45:30
1039053,0,"感觉很棒的样子，快递还蛮快的，因为在上课，所以快递的电话没有接。笔盒摸起来特别有质感，扣的也很紧，这笔盒盖子的设计是倾斜的，这个小细节我注意到了。",2016-12-19 17:47:32
1039053,0,"",2016-12-19 12:17:53
1039053,0,"确实挺小的，不过也够用，质量不错还这么便宜",2016-12-15 00:27:04
1039053,0,"挺好的，挺大的可以装不少的笔",2016-12-17 18:18:29
1039053,0,"正好装了四支笔，是我喜欢的风格，棒棒哒",2016-12-14 18:45:34
1039053,0,"不错的塑料盒",2016-12-16 12:48:06
1039053,0,"当个转换头",2016-12-16 12:48:43
1039053,0,"很不错，很喜欢。",2016-12-16 13:16:58
1039053,0,"还可以",2016-12-16 11:43:18
1039053,0,"不错",2016-12-16 18:09:19
1039053,0,"很好，超出意外的满意。",2016-12-15 16:31:02
1039053,0,"有点小，但是很精致",2016-12-15 12:12:28
1039053,0,"不错不错不错不错",2016-12-15 10:37:00
1039053,0,"很好",2016-12-15 11:05:21
1039053,0,"正正好，喜欢，再也不怕笔戳到包啦",2016-12-14 09:20:55
1039053,0,"这个笔盒我要好好吐槽，根本就盖不上，一直弹起来，整个笔盒都变形了，特别不开心的",2017-03-11 09:15:17
1039053,0,"这个价格还是挺好的",2016-12-14 17:39:33
1039053,0,"质量很好",2016-12-14 23:38:47
1039053,0,"不错，可以，满分",2016-12-14 12:39:22
1039053,0,"蛮小的 简约风 大概放四五只细笔 质感蛮舒服的",2016-12-04 13:23:22
1039053,0,"盖子扣的很紧，质量很好",2016-12-12 16:33:43
1039053,0,"送给老公了，说很喜欢",2016-12-12 10:43:34
1039053,0,"很好，非常赞。",2016-12-12 13:22:22
1039053,0,"材质、手感和价格好评，尺寸差评，之前买大号的太大，几支笔在里面晃，这个小号的呢长度上又稍稍差了点，放上普通大小的橡皮稍长点的笔又放不下了。但摸起来手感确实是好，做工蛮到位。",2016-12-12 17:44:24
1039053,0,"我特别特别特别喜欢！！超喜欢<U+0001F60D>",2016-12-11 12:41:38
1039053,0,"",2016-12-11 16:23:16
1039053,0,"大小还行，放铅笔的长度，钢笔在里面有点晃，质量很好，尺寸方面应该再细化一下，出个更轻巧些的",2016-11-26 18:50:33
1039053,0,"网易版三无，东西不错<U+0001F44D>",2016-12-09 20:28:28
1039053,0,"简约，好看，质量也好",2016-12-09 13:11:23
1039053,0,"很能装，考研狗每天用它装这么多笔，空间很大",2016-11-29 12:56:35
1039053,0,"很好看很喜欢*\(<U+0E51><U+2022><U+00A0><U+2083><U+00A0><U+2022><U+0E51>)安利给朋友了！",2016-12-08 21:14:05
1039053,0,"简单大方，喜欢",2016-12-08 21:55:23
1039053,0,"相比无印良品，开盖觉得更加方便 可能是习惯了吧，这款只需要轻按就可开启，容量可以放五只笔一个橡皮。小心爱护哦，刮了容易有划痕",2016-12-01 11:37:48
1039053,0,"暑假的时候在塑料厂兼职过一段时间，额，这样突出的部分是不能出厂的，希望严选能加强一下制造商的货物标准。",2017-03-15 23:05:00
1039053,0,"比想象中大，挺好。",2016-12-06 17:17:34
1039053,0,"使用了，正好放四支笔，很好，就是不知道盖子翻转处会不会易材料疲劳开裂。",2016-10-12 10:21:58
1039053,0,"还可以吧，就是有点偏贵了",2016-12-04 22:55:44
1039053,0,"没有想象中大，但是够用了，中国版muji",2016-12-03 14:07:44
1039053,0,"和无印良品家的很像，就是没有标签而已。",2016-12-02 11:39:33
1039053,0,"虽然为了凑单买的，但质感不错，毕竟九块多一个塑料笔盒也不便宜",2016-11-04 10:05:42
1039053,0,"简洁大方，朴实无华，森女风满满",2016-12-03 16:42:11
1039053,0,"质量很好，很喜欢",2016-12-03 09:18:48
1039053,0,"挺好的，就是图片的样子",2016-12-02 09:36:44
1039053,0,"拿到手就感觉很清爽。刚好装下4支笔。只能再装一个橡皮檫。大一点的U盘就没空间了。整体不错。",2016-10-22 10:34:48
1039053,0,"小巧玲珑，磨砂材料，质朴无华，美观大方。",2016-11-30 20:43:11
1039053,0,"很棒，质量很好！",2016-11-30 13:44:42
1039053,0,"不错",2016-11-30 13:18:21
1039053,0,"东西不错，四边都比较严实，不漏缝！造型简洁大方，挺方便的，能放十枝笔",2016-10-23 12:21:50
1039053,0,"磨砂笔盒稍窄，高度也不够，可放的文具不多，价格偏贵。",2017-03-04 07:53:02
1039053,0,"非常简约的产品，4支笔标配，5支勉强放上",2016-11-27 12:31:43
1039053,0,"刚好放不下 Apple pencil，有点遗憾。",2016-11-28 07:44:06
1039053,0,"喜欢～",2016-11-28 18:37:15
1039053,0,"质量都很好，盒子大小正好。",2016-11-27 18:46:06
1039053,0,"颜值高，实用。",2016-11-27 18:30:36
1039053,0,"挺小 装四支笔吧～",2016-11-26 17:21:07
1039053,0,"挺实用的，送给学生的。",2016-11-26 20:29:37
1039053,0,"大号合适，不过会磨花",2016-11-25 13:02:43
1039053,0,"很不错",2016-11-25 08:18:47
1039053,0,"良心 ！ 作为一名考研党 背单词收到你们家短信  买买买吧  东西质量真心不错  大爱你们家设计   以后关注你们的招聘信息 hhhhh",2016-11-05 21:00:29
1039053,0,"非常不错，和MUJI品质一样好！且比它便宜，相信网易严选品质",2016-11-15 08:57:51
1039053,0,"超级好用  简单干净",2016-11-24 14:35:17
1039053,0,"比小号的大一点，可以多放个橡皮，不错的",2016-11-20 19:21:21
1039053,0,"还行",2016-11-23 20:28:58
1039053,0,"好评",2016-11-23 11:28:12
1039053,0,"里面跟MUJI比的话更滑一点

还是不错的",2016-11-19 16:38:19
1039053,0,"东西还行，有污渍，去不掉，应该是漆，可能加工水平条件太差了",2017-03-01 13:34:50
1039053,0,"质量不错，跟muji的差不多",2016-11-22 11:38:55
1039053,0,"很好看耐用",2016-11-22 12:38:14
1039053,0,"特别好 逼格足足",2016-11-21 21:57:35
1039053,0,"还不错",2016-11-21 22:01:06
1039053,0,"材质的话感觉和无印的差不多 卡扣比无印的紧~很棒",2016-10-31 17:50:31
1039053,0,"看着好小，其实够用的。小巧、实用！",2016-11-20 19:20:20
1039053,0,"性价比高，东西和想象中一样精致。很值得购买。特别喜欢这种简约风格。",2016-10-15 18:07:53
1039053,0,"不错哦～～跟MUJI买的差别不大",2016-11-20 13:22:22
1039053,0,"总体来说还不错，设计简约，简单好用，价格合适，包装用心，终于可以风格统一了",2016-10-23 23:28:10
1039053,0,"宝贝收到了  网易真严谨 赞一个",2016-11-18 12:46:16
1039053,0,"",2016-11-18 23:33:02
1039053,0,"好看好用",2016-11-17 13:24:28
1039053,0,"比想象中硬 厚",2016-11-16 20:53:09
1039053,0,"简约有质感！满意！",2016-11-16 09:09:24
1039053,0,"i love tiny things.",2016-11-16 13:35:37
1039053,0,"这种盒子放包里走路声音很响",2016-10-10 15:53:48
1039053,0,"摸起来手感不错，没有标签好评",2016-11-15 15:13:40
1039053,0,"好看，也好用，推荐！！！",2016-11-15 17:09:31
1039053,0,"买之前没量。多么痛的领悟。。。。",2016-11-14 18:05:08
1039053,0,"好 薄了点 装一层笔最合适 5-6支的样子",2016-11-11 21:21:57
1039053,0,"简洁风格，硬度满意",2016-11-14 21:30:22
1039053,0,"简约不简单",2016-11-14 11:04:15
1039053,0,"简约磨砂，做工精细，无瑕疵",2016-11-13 19:33:22
1039053,0,"挺好的，很喜欢～",2016-11-13 23:06:20
1039053,0,"简洁，大方，结实，好用！",2016-11-13 13:05:16
1039053,0,"很好",2016-11-12 18:48:18
1039053,0,"很不错，说跟MUJI的一模一样的人不知道是怎么想的，首先在扣口那就不一样，然后在顶盖那，MUJI的是水平的，而这个是倾斜的，顺带说一句，扣口不好开，但是这种扣口设计的好处就是寿命比MUJI的那种设计的长。",2016-11-12 13:34:04
1039053,0,"好看，喜欢，质量也可以",2016-11-11 16:42:34
1039053,0,"看着还可以啊<U+0001F600>",2016-11-11 08:56:36
1039053,0,"",2016-11-11 19:30:45
1039053,0,"严选真的太棒了！！！质感非凡！值得拥有！很喜欢！",2016-11-10 12:57:37
1039053,0,"超级好诶！！！自己原来用无印良品的，感觉网易严选比muji用心多了。国货自然强！希望网易严选能坚持初心，会支持网易的！",2016-10-17 17:40:43
1039053,0,"有个黑点，怎么弄都弄不掉，还是盒子正面。做工越来越不严选了。",2017-01-24 23:11:55
1039053,0,"感觉自己就是个学霸",2016-11-10 14:17:08
1039053,0,"材质顺滑，大小合适，不错的选择",2016-11-10 19:14:09
1039053,0,"很好看，质感也很好",2016-11-10 10:56:25
1039053,0,"不错的，手感，笔也不错",2016-11-10 13:09:00
1039053,0,"很好。放五支笔一块橡皮足够。明天让老公拿走去考试。",2016-11-04 17:44:36
1039053,0,"给muji的水笔买了张床～",2016-11-09 22:46:57
1039053,0,"很结实，很轻便，很用心，赞<U+0001F44D>",2016-11-09 11:18:12
1039053,0,"很不错，比想象中大多了。",2016-11-09 11:52:56
1039053,0,"很棒…比很想象中的还要棒。支持网易…网易邮箱|网易云音乐<U+0001F3B5>|有道词典……做的真的是一种态度。超级棒。有一个小小的建议：希望严选扩大商品的种类…因为感觉在这里买很放心<U+2764>。",2016-11-08 14:46:34
1039053,0,"",2016-11-06 13:28:29
1039053,0,"文具盒质地很不错，硬，大小适中，方便携带，喜欢",2016-11-05 10:58:21
1039053,0,"很棒！简洁大方！是我想要的笔盒！就是箱子大的夸张！",2016-10-17 18:11:16
1039053,0,"简单实用   容量大  支持严选",2016-11-05 17:55:34
1039053,0,"高端大气上档次，低调奢华有内涵。",2016-11-04 15:43:34
1039053,0,"看起来质量还可以",2016-11-04 11:19:34
1039053,0,"赞",2016-11-04 21:30:58
1039053,0,"严选这次没有把关，居然出了这样的货。这胶盒的胶内有杂质，可能是注塑时材料混了杂质。而且还在前面，虽不影响使用，看了很不舒服！很失望的一件商品。",2017-03-15 12:48:05
1039053,0,"很好看",2016-11-03 09:46:57
1039053,0,"挺喜欢的",2016-11-03 10:58:46
1039053,0,"装了正正好。赞",2016-11-02 18:37:06
1039053,0,"挺高逼格",2016-11-02 09:31:06
1039053,0,"不错",2016-11-01 15:57:31
1039053,0,"还是应该加点钱买带小格子的，放些小物件比较方便",2016-10-10 09:44:34
1039053,0,"两天半到货了，商品的质感很好，中性笔书写流畅，感觉很喜欢～",2016-10-15 14:47:20
1039053,0,"很简约，非常喜欢这个风格",2016-10-27 08:54:53
1039053,0,"那个扣真的好紧。。。。。",2016-10-27 11:14:56
1039053,0,"",2016-10-27 18:08:20
1039053,0,"质量不错  蛮有MUJI质感  红白配显得和包装很搭",2016-10-24 09:25:08
1039053,0,"材质好，无味，简洁",2016-10-25 13:28:23
1039053,0,"好看又实用嘻嘻还能装个橡皮",2016-10-24 16:59:52
1039053,0,"",2016-10-24 10:16:28
1039053,0,"不错 就是扣的地方有点紧",2016-10-23 20:28:25
1039053,0,"4只笔就是极限了，盒子简单我喜欢",2016-10-21 13:09:54
1039053,0,"拿到本来很开心，然而，裂了裂了裂了……",2017-03-12 11:35:24
1039053,0,"很棒啊~~有点紧",2016-10-21 12:54:18
1039053,0,"",2016-10-21 19:09:42
1039053,0,"能装5只muji的笔 还好吧",2016-10-20 16:56:25
1039053,0,"小巧精致。本人很喜欢。",2016-10-19 19:42:29
1039053,0,"今天刚收到，包装真心好。大小比较合适，继续体验。",2016-10-18 13:56:13
1039053,0,"磨砂的朦胧感，真的很好",2016-10-18 18:01:59
1039053,0,"小巧，最多装四只笔",2016-10-18 17:49:00
1039053,0,"",2016-10-18 13:31:34
1039053,0,"适合随身携带，放4支笔正好。",2016-10-17 13:24:07
1039053,0,"这单层笔盒实在是小的可怜，不开森<U+0001F614>",2016-10-14 23:09:19
1039053,0,"满分十分，我o十一分",2016-10-15 10:43:40
1039053,0,"手感很舒服，简约风",2016-10-15 11:13:55
1039053,0,"开关不好用啊",2017-02-02 23:51:47
1039053,0,"挺好的，简洁，干净和wuji一样，支持一下",2016-10-14 12:13:16
1039053,0,"很满意，",2016-10-14 10:18:22
1039053,0,"好看，简约，喜欢。大号的正好可以放五支笔。",2016-10-12 09:43:27
1039053,0,"质量不错，可以放三四支笔",2016-10-12 18:20:14
1039053,0,"就是有点不耐摔。",2017-03-11 10:37:19
1039053,0,"很不错，没有什么异味，扣的很紧",2016-10-10 13:24:50
1039053,0,"无印同款，简约而不简单",2016-10-10 10:40:57
1039053,0,"手感很好",2016-10-10 18:19:44
1039053,0,"小号三支笔OK^_^",2016-10-09 21:34:34
1039053,0,"大小合适",2016-10-09 12:27:55
1039053,0,"容量挺大的，盖起来还挺紧，放笔也能放挺多支的，简洁大方，我喜欢~",2016-08-20 16:13:45
1039053,0,"不错",2016-10-07 17:58:28
1039053,0,"简单实用，材质也不错！<U+0001F44D><U+0001F44D><U+0001F44D>",2016-10-06 16:18:15
1039053,0,"怎一个帅字了得！！！",2016-10-06 14:26:24
1039053,0,"非常好！！！！！",2016-10-06 15:59:07
1039053,0,"有点小了，大概能放四只笔",2016-10-04 13:22:26
1039053,0,"不知道禁不禁用，用用看吧",2016-10-01 20:25:57
1039053,2,"比起无印良品的差距非常大，主要体现在开盖的设计上，这个要用力扣开，很费劲。",2017-08-12 07:15:05
1039053,0,"报名会计培训学习，恰好就到了~",2016-09-27 14:00:55
1039053,0,"跟无印良品的一毛一样 便宜质量又好",2016-09-19 10:20:05
1039053,0,"网易严选真的做的很用心，希望做的性价比再高一点，个别价格再降一降，希望严选继续做精，做优",2016-08-26 12:18:57
1039053,0,"在网易严选给宝贝买的餐具，可惜没有配套的盒子，外出用餐不方便携带，这个笔盒刚好，只是有些边缘不够光滑，也不是太好开盒，暂时凑合用吧。",2017-02-22 11:34:04
1039053,0,"轻巧，精致，简洁的设计给人以美的感受！",2016-09-18 15:50:31
1039053,0,"超级棒",2016-09-19 23:31:44
1039053,0,"小巧，实用，颜色好看，手感不错。",2016-09-18 18:52:05
1039053,0,"",2016-09-18 11:47:39
1039053,0,"简单大方，是喜欢的风格！",2016-09-17 11:14:08
1039053,0,"质量不错很喜欢。",2016-09-17 17:02:28
1039053,0,"简单干净！！好看！我就买了两个超级小的东西，居然给我一个超大的快递盒子，搞得我以为它们发错货了呢<U+0001F602>",2016-08-16 09:39:17
1039053,0,"",2016-09-14 09:09:09
1039053,0,"买过两次，每次都特别喜欢网易严选的包装，很有诚意。笔盒很有质感，很硬实，就是容易印上指纹。喜欢",2016-08-03 15:40:55
1039053,0,"简单粗暴上图",2016-09-11 09:19:57
1039053,0,"",2016-09-11 09:19:57
1039053,0,"包装到品质都不错，随身带最好不过了",2016-09-07 16:23:07
1039053,0,"好",2016-09-04 11:29:33
1039053,0,"可以放下四支笔，小巧简单，出去开会再也不怕手忙脚乱找不到笔了",2016-08-14 18:38:22
1039053,0,"买的太大了，没有好好的注意尺寸。自己装了荧光笔在里面，荧光笔和常用的笔长度相同，图片仅供参考。",2016-07-26 20:22:39
1039053,0,"特失望的东西，打击我对网易严远支持，不是钱的事，客服回复慢的可以吃饭了，理由多。一个包装完好商品，打开划痕一片，我是失望了。",2017-02-07 18:19:09
1039053,0,"感觉很高大上的盒子，笔盒很舒服，摸着也舒服，就是有点窄",2016-08-07 10:30:42
1039053,0,"挺好   买的小号也有点大  再出更小的型号就好了。",2016-08-12 12:58:00
1039053,0,"muji风格，性价比挺高",2016-08-31 11:48:49
1039053,0,"这款小的笔盒很小巧精致",2016-08-28 14:44:04
1039053,0,"材质无异味，感觉还不错。",2016-08-27 12:13:14
1039053,0,"",2016-08-24 19:55:25
1039053,0,"笔盒感觉有点小，买大的那个好了！",2016-08-19 10:09:55
1039053,0,"东西收到，笔我握起来真的非常舒服！盒子也很简约！",2016-08-15 00:16:23
1039053,0,"就能发三支笔。。。不要不要不要",2016-08-18 14:37:42
1039053,0,"比较实用",2016-08-18 13:45:49
1039053,0,"完全OK 小了一点 价格可以",2016-08-17 10:51:14
1039053,0,"好用。",2016-08-17 19:57:11
1039053,0,"很棒，很喜欢，和母鸡的一样",2016-08-16 11:24:14
1039053,0,"材质不错，有手感",2016-08-16 10:09:59
1039053,0,"",2016-08-16 12:49:45
1039053,0,"顺带买的 也很美 昨天下午拍的 今天早上就被顺丰小哥叫醒拿快递",2016-07-16 10:44:40
1039053,0,"物流很快，然笔盒还是略有瑕疵，笔盒接口处制造粗燥，不工整。",2016-12-02 12:32:12
1039053,0,"大大的点赞~",2016-08-14 15:27:34
1039053,0,"非常简洁的外形，摸着也很有质感",2016-08-13 23:15:57
1039053,0,"凑单的，就是一个塑料盒",2016-08-13 07:00:28
1039053,0,"跟muji的差不多，感觉muji的比较朦胧？",2016-08-12 14:57:06
1039053,0,"很好用 刚好放下各种笔",2016-08-12 08:19:42
1039053,0,"小清新，感觉不错，包装完美。",2016-08-12 13:01:04
1039053,0,"笔盒不错的。",2016-08-12 14:41:37
1039053,0,"质感手感都不错，挺厚实，价格实惠，还是顺丰快递。好评",2016-08-05 15:05:52
1039053,0,"网易的更透些，里面是光面。muji里外都是磨砂的。",2016-07-27 20:50:42
1039053,0,"东西不错，手感比较好！很细的磨砂！",2016-08-09 23:18:02
1039053,0,"比想象中薄一点。还是很不错的。",2016-08-09 16:09:04
1039053,0,"美美的",2016-08-09 16:17:03
1039053,0,"很棒",2016-08-09 17:23:35
1039053,0,"宝贝儿还不错，就是比较小，只能放4只笔左右。",2016-08-07 20:42:01
1039053,0,"不是MUJI犹胜MUJI！身为文具控，爱不释手。",2016-08-08 11:59:08
1039053,0,"大小合适，容量不大，只适合随身携带。",2016-08-08 15:39:54
1039053,0,"有点小瑕疵，裂开了，懒得换了",2017-01-10 12:35:18
1039053,0,"可以的",2016-08-08 12:19:40
1039053,0,"喜欢",2016-08-08 16:38:18
1039053,0,"感觉很不错，内外都漂亮的包装，笔写起来很流畅。赞<U+0001F44D>",2016-08-04 11:09:07
1039053,0,"挺好的，用来装无印的笔<U+0001F604>",2016-08-07 13:54:12
1039053,0,"非常非常好的文具盒，收到以后爱不释手",2016-08-07 09:24:29
1039053,0,"还没用！刚收到货",2016-08-07 09:43:40
1039053,0,"这个文具盒做的不错 姑且算做到了严选的理念 好的产品没那么贵",2016-07-19 11:00:23
1039053,0,"就是容纳空间不是很好，放四支笔就塞满了",2016-07-31 19:16:59
1039053,0,"一个磨砂塑料盒 感觉不错",2016-08-05 09:07:11
1039053,0,"用着不错，刚好够装几支常用的笔",2016-08-04 17:43:09
1039053,0,"很简约，很干净！",2016-08-04 19:25:02
1039053,0,"不错，希望多些活动。",2016-08-03 17:24:58
1039053,0,"非常不错，满意",2016-08-03 10:58:03
1039053,0,"之前也在无印良品买过这种笔盒 虽然是双面磨砂 但是价格好像也是双倍(ΦωΦ) 网易严选的质量价格都很漂亮呢(*/ω＼*)",2016-07-24 17:06:22
1039053,0,"简简单单的一个小塑料盒，挺好的",2016-08-01 14:02:25
1039053,0,"性冷淡风，很好。",2016-07-31 10:09:41
1039053,0,"",2016-07-31 11:45:32
1039053,0,"大的也放不下尺子，建议出个再大一号的",2016-07-27 14:35:14
1039053,0,"送男票的，他很喜欢。和MUJI一样却便宜好多。",2016-07-24 13:36:26
1039053,0,"小的只能放笔，见图",2016-07-27 14:35:14
