"itemId","star","content","createTime"
1039039,0,"不甜。好喝。会回购。这个是下火的。",2016-12-13 12:02:42
1039039,0,"第二次买 无糖就是好",2016-12-09 13:51:32
1039039,0,"高颜值的包装 味道也不错",2016-12-09 18:46:04
1039039,5,"无糖的确实不好入口，得配蜂蜜",2017-10-25 21:18:25
1039039,0,"『无糖藕粉20克*15袋・日记』
一、无糖，因为奶奶有糖尿病，正好买给她。
二、吃起来没有什么味道。
三、根据老人家反馈，这款藕粉不怎么样，也不怎么好。",2016-11-29 09:06:14
1039039,3,"冲泡不成形",2017-11-13 02:55:39
1039039,0,"因为是无糖的，所以喝起来没有任何味道。藕粉本身很不错！",2016-11-20 19:56:17
1039039,0,"还没吃 应该不错 还特意买了桂花蜜来搭 哈哈",2016-11-20 19:11:31
1039039,0,"打开包装箱一看，藕粉外包装怎么有白色粉末。打开包装盒原来是里面的藕粉漏出来了，不知道破了几包，总之感觉很不爽。",2017-07-18 16:44:15
1039039,0,"还没吃，看着还不错哦，而且顺丰真的很快呢",2016-11-15 13:30:50
1039039,0,"还不错，一包冲一杯了",2016-11-19 16:20:32
1039039,0,"还没吃，应该不错吧。",2016-11-19 21:55:28
1039039,0,"之前买了桂花味很好吃 换原味尝尝",2016-11-14 22:04:51
1039039,0,"试冲了一下，有小时候的感觉！",2016-11-16 21:35:34
1039039,0,"包装不错，价格优惠！",2016-11-13 22:02:21
1039039,0,"第二次买藕粉了，相信严选的品质",2016-11-12 19:07:20
1039039,0,"不错，真的一点糖都没有啊",2016-11-12 10:37:34
1039039,0,"",2016-10-13 19:41:04
1039039,0,"这个真郁闷啊 只要一份 手抖拍了三份六盒。但是严选和的规则和工商的要求不一致，不能退 没开封也不能退，日期不好 所以真的要吃到吐也吃不完了 不开心",2017-08-01 11:25:04
1039039,0,"包装精美！严选不错，希望越做越好！",2016-10-09 14:05:30
1039039,0,"看上去高大上白富美，喝了以后再评价",2016-10-03 20:17:48
1039039,0,"很好",2016-09-30 13:59:55
1039039,5,"还没吃，看着不错的。有一盒底部开了。",2017-11-10 16:48:09
1039039,0,"好吃",2016-09-27 14:51:15
1039039,0,"买了一堆，都特特别好",2016-09-18 20:09:57
1039039,5,"已经扔了，无论怎么都泡不开",2017-11-02 09:04:03
1039039,5,"我怎么冲也冲不出小时候的样子和味道，哭<U+0001F622>",2017-11-03 14:10:27
1039039,0,"喜欢吃藕粉，这个味道很好。下次试试那个桂花味的。",2016-08-29 23:40:35
1039039,5,"东西不错，挺好的",2018-02-07 09:05:50
1039039,0,"这个藕粉质量不错 粉磨的非常细 值得买",2016-08-19 16:37:02
1039039,0,"收到货啦,很期待,回家都要试煮",2016-08-15 08:27:01
1039039,0,"额 不太好化开
喝的时候还能感受到粉的感觉不太好
口感微妙",2017-05-30 01:37:35
1039039,0,"",2016-07-31 10:51:56
1039039,5,"无糖不太习惯，自己放一点点糖",2017-11-19 21:20:32
1039039,0,"有点被压到，包装很好看，味道应该还不错",2016-07-28 10:12:54
1039039,0,"还没吃，不过看包装不错，希望是真藕粉不要参杂其他淀粉什么的。",2016-07-08 23:05:27
1039039,5,"很好，感觉没有添加剂",2017-11-03 15:23:13
1039039,1,"打开后破了两包，弄的一桌子白粉……",2017-07-28 18:45:09
1039039,5,"没有照片，但是这个藕粉味道是真心不错，很细，量也很足，小小这次冲出来一大碗，很细腻！",2018-03-06 15:26:26
1039039,5,"还不错  无糖是真无糖呀<U+0001F602>我吃要自己加糖再吃  无糖不好吃",2018-03-08 00:04:05
1039039,2,"不知道是藕粉还是桂花莲子里的，好恶心",2018-01-06 12:53:38
1039039,5,"第二次购买了，但这次吃的时候有砂砂的感觉，不知道是不是没处理干净的缘故？",2017-11-03 15:41:51
1039039,5,"无糖藕粉真的没有糖 不知道水不是兑多了 没有成糊状 就是粉冲的水……",2018-01-31 16:49:51
1039039,5,"喝着口感很棒，严选的东西放心。以前不敢买藕粉，怕是假的。有严选为我们把关，放心了。",2018-02-03 09:36:10
1039039,5,"无糖藕粉很浓稠，一包可以冲两小碗，自己放些红糖或桂花很好喝哦",2018-02-19 22:06:30
1039039,5,"还没打开吃，但其他的零食尝了好吃！一下手就停不下来！啊啊啊…几百块了( <U+2718>_<U+2718> )<U+21AF>",2018-01-12 22:29:57
1039039,5,"很容易冲泡，当点心很方便，但是要放糖，无糖的好处就是可以做甜品增厚",2018-01-18 13:13:48
1039039,5,"一次就买了俩盒收到货就冲了一包试试，一加入热水桂花的香气扑鼻而来而且十分粘稠孩子也很爱喝。",2018-02-27 19:58:17
1039039,5,"这藕粉没有一点藕的香味，真不知杭州那家还能做出老底子那藕粉的味道",2018-01-28 13:04:36
1039039,5,"很好泡，地道的藕粉色，Q弹筋道，独爱这口感，感觉是非添加的原生态藕粉，太喜欢了",2017-12-30 11:17:32
1039039,5,"包装档次依然很高啊，个人还是喜欢放糖的口味，很好吃，饮水机的热水也能泡开。",2017-12-27 22:31:03
1039039,1,"这还没过期 就有霉点了 而且内容物搅不均匀",2018-03-01 18:28:37
1039039,5,"很好又买一次",2017-12-17 09:07:19
1039039,5,"藕粉香糯可口，清香色纯，个人喜欢无糖和桂花莲子混冲，甜度和香度更符合个人口味",2018-01-11 08:18:00
1039039,5,"终于学会冲藕粉了，透明澄清很漂亮，不过还是桂花莲子味道好吃，无糖的不喜欢",2018-01-10 11:46:26
1039039,5,"无糖的真的是没有味道，介意的要慎拍，个人觉得还是有味的好喝<U+0001F604>",2017-12-22 07:56:13
1039039,5,"吃不惯，一点味道都没有，不过加水搅拌后像果冻一样，挺有趣的，放点蜂蜜应该不错",2017-12-21 17:00:48
1039039,5,"这个藕粉就有点那啥了，自己品评，喝过就知道了，是比较粗的那种。",2018-03-06 15:34:00
1039039,5,"给家里老爸老妈买的情侣款，不过老妈最近补牙不能用，希望能让她满意。",2018-01-06 05:19:54
1039039,5,"包装很好，不过还没研究出来怎么冲出糊状",2018-02-02 21:44:43
1039039,5,"那个莲藕粉是真的有粘性，妈妈说这个味道好，不像放化学物品的味道……",2018-02-09 20:38:20
1039039,0,"小时和家人夏游西湖，将近中暑虚脱，在威逼利诱下咽下了半碗藕粉（藕粉糊的质地，你懂的），小命得存、暑气全消，自此对藕粉有着很复杂的情感……

在超市买过几次，难冲泡、品质一般，机缘巧合获得网易严选50元代金券，下了第一单，非常惊喜!

如果我告诉你，这货和当时的味道一样样，那绝对是装。不过，真的非常细腻的藕粉，冲泡方便、冷水冲开、沸水快搅，纯粹、自然、淡香、营养、健康、消暑。32个赞。

本想吐槽一下，无糖和桂花味的内袋小包装一毛一样，后来再想想，无糖是粉，桂花是粒，哈哈，能分开了。",2016-06-30 11:32:55
1039039,5,"第一次冲没成功，第二次迅速搅拌，成功了！虽然是无糖的难入口，但是这个口感很好，还是吃得下的。",2017-12-09 09:25:22
1039039,5,"桂花莲子比无糖好喝，其实挺容易冲开，我喜欢稀一点的，一包冲了俩碗喝下去，喉咙不痛了，哈哈神奇",2018-01-11 04:58:27
1039039,5,"感觉加钙的藕粉和桂花的更香甜更好喝一些。这个有点薯粉的感觉。透明没味道。",2017-11-23 22:36:31
1039039,5,"每次都在网易严选买藕粉，质量的保证 雾霾天和点藕粉清清肺，孝顺父母之上品",2017-11-29 10:26:43
1039039,5,"严选果然是名符其实，如果一直都能本着这样的态度的话，严选的交易量完全有机会超过天猫",2017-11-19 22:09:06
1039039,5,"味道有点淡",2017-12-17 00:04:17
1039039,1,"盒子封口不严，包装袋明显动过手脚，像是开过封，又封起来的，差评。",2018-01-04 12:03:18
1039039,0,"确实像评价的一样很难冲开，以至于到现在还不知道真正应该什么味道",2017-03-29 22:04:01
1039039,5,"小时候奶奶经常说，泡藕粉吃清凉下火。如今奶奶不在了，但是教导会一直记着并影响给下一代。",2017-11-10 09:21:53
1039039,5,"无糖比桂花的稠好多，桂花也不会太甜 都蛮好喝的 性价比高",2017-12-05 13:43:03
1039039,5,"一直以来的选择，高品质的生活，你需要严选。高品质不一定代表高价格，严选―值得选",2017-11-10 01:44:36
1039039,5,"第一泡没成功，估计后面会成功<U+0001F609>
泡藕粉，对很多人来说，是个技术活儿<U+0001F61C>",2017-11-29 09:04:53
1039039,5,"好的生活真的没有那么贵，这个宣传做的很棒，贴合人心，东西也是真心不错。好货要分享。",2017-11-08 11:18:08
1039039,5,"非常好的口感，而且无添加，健康有营养，希望出无糖哒就更好了！推荐推荐！！",2017-12-14 23:15:30
1039039,5,"包装精致，整个就是高大上的感觉，舍不得拆包了，还没吃，相信一定是很不错的，快递也辛苦了！",2017-11-13 19:54:24
1039039,5,"以前没有买过藕粉，第一次购买，所以无法比较。吃起来口感不错，希望严选能对得起它的名声。",2018-01-04 10:01:18
1039039,4,"最近想养生。。买了无糖的。。感觉每次都像是在和面   也没有清香味了",2018-01-02 09:43:05
1039039,5,"这个味道一般，要自己加糖",2018-01-25 17:32:21
1039039,5,"套装非常的划算，查了一下，和超市里面质量最好的藕粉是同一个厂家。",2018-02-02 18:53:47
1039039,5,"很好吃，就是泡的时候有时不成功",2018-01-11 10:24:29
1039039,5,"专门买来给我妈的，他说还可以，挺不错的，性价比挺好的",2017-12-31 10:52:23
1039039,5,"有糖的很好吃，特别好冲调，好好吃。之前在麦德龙买过这种藕粉，忘记牌子了，这次又买到了，太高兴啦。",2018-01-16 17:29:48
1039039,5,"粉粉的用热水冲泡后饮用，淡淡的很温暖的
。在寒冷冬季天气是不错的选择。早午午后都可以吃的东西。",2018-01-16 19:18:32
1039039,5,"没有糖是我喜欢的感觉，下次还要再买，品质也是很满意。好喝",2018-02-28 13:03:33
1039039,5,"喜欢买精美的食物给家人爱人及朋友分享，严选成了我每天必开的APP，唯有爱与美食不可辜负！",2017-12-16 16:20:33
1039039,5,"我是用来做菜的欠粉，如用了藕粉懒惰肉饼会非常滑嫩细腻。总之我是做嫩肉粉用的，效果一级棒。",2018-03-01 05:16:01
1039039,5,"非常细腻，可以冲稠稠的一碗，必须先用冷水化开，否则会结块，口感爽滑，舒服，好吃，喜欢甜点需要自己加糖",2018-01-05 20:23:04
1039039,5,"给爸妈买的，妈妈说粉很细腻，很好喝，有活动还会买的",2018-01-16 20:31:43
1039039,5,"桂花莲子的喝了一包，挺好喝的，无糖的给妈妈买的，还没喝",2017-12-16 15:27:34
1039039,5,"第一次来买，从包装来看，确实比较精致，就是零食比较少，可选的不多",2017-11-17 11:47:03
1039039,5,"真的很不错，真的很不错，东西是真的很不错，走过路过真的不要错过",2018-02-11 21:45:45
1039039,5,"不太好冲，相比之下更喜欢甜的那款",2018-01-13 08:47:45
1039039,5,"给老妈买的，老妈非常喜欢。浓郁的桂花香像在西湖边吃到的藕粉味儿。",2017-10-21 19:48:52
1039039,5,"很好，不过不容易冲。",2017-11-11 20:08:51
1039039,4,"不太好冲，但是颜色很正！现在很难买到纯藕粉了...",2018-03-06 10:14:12
1039039,5,"喜欢藕粉，但又不想吃那么多的糖，就适合这款了。冲出来的藕粉晶莹剔透，很有弹性，会不断回购",2017-11-06 20:46:14
1039039,5,"有一盒没有包装好，盒子是开着的。好在东西无损 就凑合收下了。以后注意哈。",2018-03-08 10:08:58
1039039,5,"味道很好，要加一点糖会更好，就是要掌握冲调技能哈哈",2018-03-04 12:17:30
1039039,5,"好吃的，含糖的冲泡起来简单，下次试了一下给同事带的无糖型",2018-01-03 07:43:09
1039039,5,"无限回购，洒把桂花进去，不加糖，配上桂花米糕吃不要感觉太好哦",2017-11-05 11:31:30
1039039,5,"很天然的味道，不似那些人工添加剂的味道，不加其他都很好吃，加几粒枸杞更好吃。好评！",2017-09-18 22:04:31
1039039,5,"我冲的很正确 看到想起小时候吃 才买的 小时侯吃不知道里面放了啥那么好吃 让我记忆犹新 我研究研究吧",2017-11-03 19:38:32
1039039,5,"这是我喝过最好喝的藕粉！！！不甜，只有藕的醇香味！",2018-01-18 14:21:03
1039039,5,"很不错的东西，性价比高，颜值也不错，我们全家都很喜欢，下次还会来？",2017-11-18 22:24:38
1039039,3,"非常难冲散 一包都没成功过。。",2017-11-28 22:57:18
1039039,5,"我妈妈最喜欢吃严选的藕粉。她说用来当早餐吃既有饱腹感又养生。帮我妈妈无限回购中…",2017-11-08 12:13:33
1039039,5,"无糖，非常适合长期食用，厚实粘稠，入口纯净的感觉。老人胃不好，食用了几个月了，感觉效果真不错，推荐大家尝试哦",2017-10-15 22:17:43
1039039,5,"没有什么味道，不过气味很香，爱甜的可以自己加糖，品质很好，满意",2018-01-09 22:37:55
1039039,1,"严选据说品质有保障，但是这次购物让我很失望，商品是去年6月2日生产的，让我怎么办，只有5个多月了。再也不到严选买吃的了。差评差评差评！",2018-01-09 18:00:37
1039039,5,"藕粉冲泡很要技巧，多试几次才能有经验。藕粉本身很好吃，无糖的比有糖的入口更像以前吃的藕粉的感觉",2018-02-08 13:01:23
1039039,5,"买了好几次了，真心好喝！",2018-01-09 21:57:00
1039039,5,"冲出来是不错的，正不正宗布吉岛，可能因为无糖，不适合我的口味",2017-12-10 20:47:23
1039039,5,"味道不错，就是包装都是开裂的，很多人反馈，严选怎么就不上心呢，食品包装开裂就该全部返厂！不怕出事吗，出货不检？小事都不能解决，口碑会下降啊！",2017-12-10 08:53:36
1039039,5,"上次买了红枣百合的，有点太甜，这个虽然没有那么多添加，却无糖，老幼咸宜。",2017-11-10 12:17:42
1039039,5,"桂花莲子的比较好泡，无糖的太难泡了，很难化开。",2018-01-30 12:47:11
1039039,5,"挺好的。。挺好的。。挺好的。。挺好的。。挺好的。。挺好的。。",2018-01-02 08:22:17
1039039,5,"味道不错，就是喝了会胃疼，难道不应该是养胃的吗！",2018-01-27 18:29:38
1039039,5,"网易严选没让我失望！质量不错，就是包装过度！！！",2018-01-06 22:03:30
1039039,5,"多次回购，支持严选，多次回购，支持严选，多次回购，支持严选",2018-03-04 15:29:41
1039039,5,"无糖的没有有糖那个好冲，以后还是买有糖那个，其实那个也没有多甜",2017-09-16 18:58:39
1039039,0,"包装依然那么用心美丽。可能自己冲泡水温没掌握好，口感稍微欠缺一点，的确没有味道，但整体还是感觉不错",2017-07-19 18:24:19
1039039,3,"这个藕粉非常不好泡啊 泡了三次 每次都是和果冻胶一样的一大坨 方法也没错啊 先冷水后沸水 以前超市买的藕粉从来不会这样",2017-11-11 19:00:50
1039039,5,"藕粉口感细腻，比超市买的好吃，第二次购买了，严选质量信得过。",2018-02-07 07:46:26
1039039,5,"这款商品非常的好，物美价廉，下次还会购买，强烈推荐给大家，赞赞赞。(复制粘贴)",2017-10-26 11:25:41
1039039,3,"还有三个月过期了哦，大概因为是无糖的原因，购买的人不多",2018-03-12 21:56:44
1039039,5,"之前买的还没吃完，买来屯着。藕粉的味道很好，口感很细腻很顺滑。大赞",2017-08-21 12:11:41
1039039,5,"本来不爱吃藕粉，这个是无糖的，很喜欢，自己加点蜂蜜，很棒",2017-12-18 17:45:32
1039039,3,"味道很淡，不知道是不是就是应该这个味道还是什么！不是很喜欢这个味道……",2017-11-16 14:58:39
1039039,5,"桂花莲子已经试过了，味道不错，而且不需要很高温度就能调成羹",2017-11-19 22:10:14
1039039,5,"一小袋冲出来好大碗 加蜂蜜味道还不错",2018-03-05 00:10:29
1039039,5,"又买了，送人，是纯藕粉，桂花很香，不甜可以放着冰糖。包装简洁大气",2017-10-22 11:57:40
1039039,5,"质量不错，量偏少，冲饮不也是太好把握（加水量、速度，温度）。",2018-01-10 00:10:17
1039039,5,"第一次没有泡好，第二次掌握技巧了，一定要先加一点冷水搅匀，再迅速加入开水。最后勺子<U+0001F944>都能立在杯子中间，好有趣哈哈哈",2018-01-30 16:59:55
1039039,5,"非常好吃 清爽可口 最重要是非常健康 可以吃很久的 下次一定会再买 严选的东西就是棒好好好好好好好恍恍惚惚红红火火恍恍惚惚",2018-03-04 23:07:16
1039039,5,"一口气买了4盒，这是第三次买严选的藕粉了，纯藕粉冲来带着红色",2017-11-15 19:03:49
1039039,5,"刚收到，想想会很好吃，可以放些红糖和坚果。随后吃过追评啊。",2017-11-15 20:39:41
1039039,5,"很好吃，是我想要的味道，吃完了再买",2018-02-28 10:41:20
1039039,2,"收货后发现，藕粉盒底居然没封好。还没有吃呢，就很影响心情！",2018-02-14 07:16:09
1039039,5,"藕粉还不错，桂花莲子一般冲不好",2018-03-11 21:30:51
1039039,5,"桂花莲子是有糖的，360g，无糖的只有300g，包装精美，设计漂亮",2017-11-14 11:19:32
1039039,5,"我只想说，在严选，只要你喜欢，买就是了，质量什么的绝对放心！",2017-12-11 14:25:00
1039039,5,"很不e的|西味道很好希望下次可以再I到",2018-01-26 21:14:32
1039039,5,"第三次买了，很不错(*<U+0E53>′ts`<U+0E53>)<U+2661>，好东西让家人享用吧<U+0001F604>",2017-11-12 15:12:25
1039039,5,"第一次试了四次才弄好，后面熟练了泡的不错。加每日坚果当早餐，推荐",2017-11-12 21:21:45
1039039,1,"你说我咋评价，2017.6.5号，现在2018.3.9号。放三个季度啦，你不知道你有多令我失望<U+0001F614><U+0001F614><U+0001F614>",2018-03-09 18:01:18
1039039,3,"主要感觉淀粉味道大",2018-02-03 22:06:00
1039039,5,"第一次没用凉水冲调，结坨了，冷水冲调后很好喝，不用放糖",2017-12-08 15:49:48
1039039,5,"无糖的，不发胖，味道<U+0001F914>，无糖的能有什么味道",2018-02-09 17:35:08
1039039,5,"早餐常备饮品，口感纯正，一袋竟然能冲两杯！",2018-03-12 22:30:43
1039039,5,"不错",2018-03-13 05:08:08
1039039,5,"无糖的，给老爸喝的，还行，哈哈",2018-03-10 15:50:19
1039039,5,"哈哈哈哈哈哈哈哈，冲泡很有技术含量",2018-03-12 15:58:11
1039039,5,"甜度合适，细腻华润，适合早餐，里边有桂花",2018-03-11 23:33:41
1039039,5,"一如既往的好",2018-03-12 18:55:31
1039039,5,"非常满意",2018-03-12 14:13:47
1039039,5,"不错",2018-03-12 23:36:39
1039039,5,"嗯",2018-03-12 11:10:04
1039039,5,"好",2018-03-12 22:59:32
1039039,5,"好",2018-03-12 22:59:40
1039039,5,"很好给婆婆买的，她说挺好的",2018-03-09 21:08:07
1039039,5,"88选5，简直不要太划算，一次下了好多订单，买了平时早就种草的各种小东西，严选的活动，每次都必参与啊，中毒太深。",2018-01-02 16:14:50
1039039,5,"很好，无糖的藕粉，不过很难冲泡成功",2018-02-28 23:51:40
1039039,2,"生产日期是2017.6.5，一年保质期…还剩不到三个月。这日期也太不新鲜了吧，又是食品…第一次在严选买食品，感觉很不好…",2018-03-15 08:47:28
1039039,5,"用来做甜品的，超好",2018-03-11 10:59:39
1039039,5,"第三次买了",2018-03-11 12:43:12
1039039,5,"味道不错",2018-03-11 07:14:49
1039039,5,"满意",2018-03-11 01:46:01
1039039,5,"不错",2018-03-11 09:26:49
1039039,5,"一定要多用点水啊，不然真的好粘",2018-03-08 23:13:40
1039039,5,"非常好，自己加点料，就是这个味",2018-03-09 21:36:31
1039039,5,"这个还没开始吃，严选的好吃的都好吃<U+0001F60A>",2018-02-27 21:15:29
1039039,5,"还是桂花的吃起来香一些, 无糖的没味道",2018-02-27 09:36:53
1039039,5,"暖胃暖心",2018-03-10 23:47:06
1039039,5,"非常感谢！好",2018-03-10 17:44:23
1039039,5,"不知道怎么弄",2018-03-13 23:02:34
1039039,5,"喜欢！！",2018-03-10 13:10:14
1039039,5,"好吃",2018-03-10 15:29:12
1039039,5,"喜欢",2018-03-10 20:49:27
1039039,5,"好",2018-03-10 15:54:49
1039039,5,"非常好",2018-03-09 21:13:19
1039039,5,"好",2018-03-09 20:55:03
1039039,5,"给婆婆买的，说比超市里的好喝呢！",2018-03-03 20:40:13
1039039,5,"包装很好，小袋独立包装也很方便。很粘稠很好冲泡。",2018-01-18 16:17:14
1039039,5,"很不错的选择，喜欢和信任严选",2018-03-08 11:39:08
1039039,5,"无糖纯粹，凉水搅拌均匀再加开水就很容易做好。",2018-02-01 22:41:28
1039039,5,"我妈妈特别喜欢藕粉，我也觉得是我吃过最好吃的藕粉了！",2017-12-27 07:46:43
1039039,5,"吃过的宝贝再次入手",2018-03-08 12:38:38
1039039,5,"已经快速吃完了，好吃。",2018-03-08 12:59:36
1039039,5,"妈妈收到礼物非常喜欢",2018-03-08 20:53:19
1039039,5,"好吃   一直信赖的产品",2018-03-08 23:02:33
1039039,5,"好吃看得见",2018-03-08 11:49:07
1039039,5,"很好",2018-03-08 22:33:23
1039039,5,"不错",2018-03-08 10:09:19
1039039,5,"送给外婆吃的，合适满意",2018-03-07 12:17:33
1039039,5,"不错的",2018-03-07 15:54:00
1039039,5,"好评",2018-03-07 16:11:47
1039039,5,"好",2018-03-07 08:00:40
1039039,3,"包装是开的，味道就那样吧",2017-11-16 15:30:13
1039039,5,"非常好很喜欢家里人很满意",2018-03-06 15:34:43
1039039,5,"老妈喜欢的藕粉，比在超市里买的好喝！",2018-02-23 10:22:16
1039039,4,"还没吃
明天试试",2018-03-06 20:47:03
1039039,5,"加购，产品不错",2018-03-06 20:31:38
1039039,5,"非常好",2018-03-06 01:12:58
1039039,5,"好吃",2018-03-06 16:00:46
1039039,5,"好",2018-03-06 18:08:54
1039039,5,"。。。。。。。。。。",2018-03-06 22:17:54
1039039,5,"质量不错，冲出来很清澄，加上各种坚果味道很赞",2018-02-14 10:06:38
1039039,5,"给老公买的她很喜欢<U+0001F618>",2018-03-05 17:25:48
1039039,5,"无糖真的一点糖都没有！",2018-03-05 00:01:54
1039039,5,"质量非常好，回忆起小时候的味道。",2018-03-05 10:50:12
1039039,5,"无糖藕粉我冲不好  桂花莲子的很好冲  味道还不错",2018-02-01 09:22:02
1039039,5,"挺好喝的",2018-03-05 23:26:49
1039039,5,"好喝",2018-03-05 18:23:57
1039039,5,"还不错",2018-03-05 13:30:38
1039039,5,"满意",2018-03-05 21:35:42
1039039,5,"先用一点温水泡开了再加热水，当早饭很便捷",2018-02-13 07:54:23
1039039,5,"|量好的，值得I",2018-03-04 19:04:56
1039039,5,"住院期间一直吃，很不错",2018-03-04 13:30:18
1039039,5,"很不错很不错很不错",2018-03-04 23:44:25
1039039,5,"味道不e，是m",2018-03-04 19:09:21
1039039,5,"给宝宝添辅食",2018-03-04 01:00:04
1039039,5,"好吃，很喜欢啦",2018-03-04 19:47:36
1039039,5,"还行",2018-03-04 21:40:46
1039039,4,"不好吃",2018-03-04 19:50:56
1039039,5,"惊喜",2018-03-04 16:41:53
1039039,5,"不错",2018-03-04 17:12:06
1039039,5,"不错",2018-03-04 13:21:04
1039039,5,"好",2018-03-04 12:39:30
1039039,5,"应该买加糖的 自己拿捏不准 哈哈",2018-03-02 13:59:24
1039039,5,"好喝的，很纯",2018-03-03 17:39:11
1039039,5,"还没吃呢",2018-03-03 11:04:20
1039039,5,"健康无糖不错",2018-03-03 08:29:42
1039039,5,"很好吃",2018-03-03 17:35:07
1039039,5,"藕粉香甜",2018-03-03 21:30:40
1039039,5,"无糖确实没什么味道，加点蔓越莓干，用袋装黄砂糖调味也挺好",2017-11-01 06:47:34
1039039,5,"真的一点味道都没有，也不透明……总之一般吧",2017-11-24 10:59:59
1039039,5,"好难吃",2017-11-20 12:40:51
1039039,5,"特别好",2018-03-02 16:43:46
1039039,5,"不甜，给孩子吃好，纯纯的藕粉，孩子爱吃，我也可以偷个懒",2017-10-31 15:17:03
1039039,4,"真的没有味道，最好是一包有糖一包无糖混合吃",2018-02-10 11:44:00
1039039,5,"好冲，也很好喝",2018-03-01 14:36:56
1039039,5,"包装很有严选范儿。",2018-03-01 09:54:50
1039039,5,"还没吃，习惯性好评",2018-03-01 09:44:24
1039039,5,"非常好喝",2018-03-01 10:08:45
1039039,5,"味道不错",2018-03-01 17:30:07
1039039,5,"好吃",2018-03-01 06:28:45
1039039,5,"好",2018-03-01 09:46:45
1039039,5,"不错",2018-03-01 06:52:52
1039039,5,"好吃",2018-03-01 22:24:52
1039039,5,"好吃好吃，西湖藕粉真不错，从小喜欢吃。",2018-02-28 15:57:41
1039039,5,"已经喝完了，无异味，很正宗！！",2018-02-28 10:48:18
1039039,5,"不错不错 严选的东西值得信赖的",2018-02-28 09:59:48
1039039,5,"东西很好还是那样",2018-02-28 22:06:26
1039039,5,"可以，味道不错",2018-02-28 23:06:12
1039039,5,"包装精美",2018-02-28 11:56:48
1039039,5,"粉很细，有藕香味蛮好喝的",2018-02-26 16:25:45
1039039,5,"不e，o糖o毫",2018-02-27 12:02:58
1039039,5,"好",2018-02-27 14:28:40
1039039,5,"好吃",2018-02-27 14:35:46
1039039,5,"给女神买的点心，果不其然的好评~",2018-02-26 01:59:54
1039039,5,"桂花莲子的好吃点",2018-02-26 23:06:58
1039039,5,"很纯的藕粉。",2018-02-26 10:14:24
1039039,5,"忘了吃。。。。",2018-02-26 10:03:15
1039039,5,"太甜",2018-02-26 23:01:51
1039039,5,"很好",2018-02-26 14:35:18
1039039,5,"不错",2018-02-26 20:53:50
1039039,5,"不错",2018-02-26 09:54:31
1039039,5,"冲着纯藕粉买的，而且无糖比较健康吧，吃完再买，非常喜欢",2017-11-23 06:09:00
