"itemId","star","content","createTime"
1057033,5,"好了好了这个感觉必备",2018-03-13 11:14:20
1057033,5,"还没有用，办公室小姐姐说她买了的，用起来还不错",2018-08-03 16:30:56
1057033,5,"好用，小盒装着也方便取",2018-06-25 20:13:32
1057033,5,"和以前用的别的地方买的一模一样，包装比较密封，应该好用~",2018-05-21 11:28:51
1057033,5,"买了很多次，是我喜欢的，和别的牌子比起来还是喜欢严选的这款，价钱也不贵，很适用",2018-08-06 15:03:10
1057033,5,"这个很好用，比屈臣氏的好用又便宜",2018-05-14 09:26:07
1057033,5,"好用，方便，再也不怕塞牙缝了。居然有很多人不知道这个东西，看来我得多推广推广。",2018-07-17 17:31:06
1057033,5,"不知道好不好用，只打算把家里能换的都换成严选的，因为好的生活真的不贵的",2018-07-02 13:25:11
1057033,5,"第一次买这个牙线，还没有拆开用，但是简约大方的包装，价格适中，和以前买的其他牌子差不多。好评！",2018-06-20 14:04:54
1057033,5,"掌柜的也比较客气， 一次不错的购物体验。如果价格上还可以再优惠的话，那当然是最好了。",2018-06-18 13:47:55
1057033,5,"也是回购。很便宜，几块钱50支，有优惠券算下来更便宜。牙线粗细刚好，又坚韧。口腔清洁需要它。",2018-06-09 06:59:48
1057033,5,"好用，牙线比牙签方便舒适多了。用了牙线之后就再也不用牙签了。",2018-07-26 10:27:18
1057033,5,"用牙线用习惯了。这个跟我在沃尔玛买的一样，好用！有个小盒子装着比较卫生。",2018-06-08 11:28:51
1057033,5,"这个牙线棒质量不错，可以保持口腔卫生，严选的东西确实好，已经买了好多东西了",2018-06-13 17:28:11
1057033,5,"太好用了。便宜量多！买回来后直接把老公在超市里买的那盒扔了。哈哈",2018-05-02 19:58:33
1057033,5,"牙线很好用，价格也很便宜，很喜欢，以后有需要还会来网易严选购买的。",2018-05-23 15:38:00
1057033,5,"质量管理体系认证好企业品牌形象产品质量安全好味道不错<U+0001F44D><U+0001F44D><U+0001F44C>",2018-06-15 21:24:11
1057033,5,"严选第一单五人团的牙线棒，必备好物啊。包装整洁大方，产品使用便捷，满意",2018-04-25 23:17:08
1057033,5,"不错，好用。包装也很棒！关键是早上拍下午收货，不要太快哦。",2018-07-21 18:40:37
1057033,5,"无限回购！超级好(<U+272A><U+272A>)不错(*<U+0E53>′ts`<U+0E53>)<U+2661>真的推荐(//<U+2207>//)哈哈(<U+0CA1>ω<U+0CA1>)hiahiahia吼吼\^O^/",2018-04-09 19:42:35
1057033,5,"好用好用好用好用好用好用好用好用好用好用好用的",2018-03-22 17:37:27
1057033,5,"物流很快从下单到收货不到3天时间；快递小哥服务周到热情送货上门；商品真心不错！严选质量没的说！",2018-04-13 23:49:35
1057033,5,"好的生活品质 原来真的也可以不贵 希望严选可以一直走下去  越来越爱严选",2018-04-17 09:40:38
1057033,5,"牙线非常好用，第一次在网易买东西就爱上，感觉要中网易的毒啦",2018-03-28 10:32:31
1057033,5,"清洁比较干净，用着舒服，不会伤害牙龈，物超所值，下回回购。",2018-07-16 22:30:22
1057033,5,"秒杀一堆，严选的速度快！产品无论质量还是包装一直棒棒的，不能剁手啊！",2018-04-08 22:08:26
1057033,5,"比牙签好用一万倍，比扁线的牙线清洁得更干净",2018-08-12 23:43:09
1057033,5,"宝贝到的很快 也是才知道严选的 第一次购买没有失望",2018-08-09 17:27:58
1057033,5,"不错不错不错不错不错不错不错不错不错不错不错不错不错不错不错",2018-08-06 03:03:32
1057033,5,"第一次在网易严选买东西 有点惊喜。还是挺喜欢这种模式，",2018-08-07 10:28:34
1057033,5,"用起来不错，也很实惠，支持严选",2018-08-22 17:28:39
1057033,5,"看着不错，相信严选",2018-08-20 16:52:08
1057033,5,"很棒.性价比很高..方便",2018-08-19 18:35:57
1057033,5,"不错的",2018-08-19 11:11:43
1057033,5,"看起来不错",2018-08-19 10:24:16
1057033,5,"现在大件小件吃的用的都在严选里买，一入严选出不来",2018-05-26 14:25:31
1057033,5,"看着比超市买的线好的多",2018-08-16 13:56:57
1057033,5,"非常满意以后就认定严选了",2018-08-16 19:35:53
1057033,5,"包装精美",2018-08-16 09:51:42
1057033,5,"喜欢",2018-08-14 13:18:14
1057033,5,"酷",2018-08-14 17:32:43
1057033,5,"总体来看，不错不错",2018-08-09 14:12:30
1057033,5,"不错，值得购买。",2018-08-09 19:06:23
1057033,5,"好用又实惠",2018-08-08 23:16:26
1057033,5,"",2018-08-08 12:38:37
1057033,5,"包装设计都很好啊",2018-08-07 19:21:37
1057033,5,"",2018-08-07 13:57:41
1057033,5,"好用，一直在买，日常必备，很棒！",2018-08-06 11:30:55
1057033,5,"很棒棒的包装，网易东西价格比较满意，东西也比较精致，相信网易。",2018-04-21 00:35:52
1057033,5,"质量非常好，与卖家描述的完全一致，非常满意,真的很喜欢，完全超出期望值，发货速度非常快，包装非常仔细、严实，物流公司服务态度很好，运送速度很快，很满意的一次购物",2018-07-30 23:38:50
1057033,5,"严选精品    无印良品风      商品精致   退货方便     商品更全点就好了",2018-05-12 09:45:52
1057033,5,"很不错，用了几天，比淘宝上买的那个强多了，很棒，可以支持一波，以后认准网易严选了，加油I(^ω^)J",2018-04-29 12:46:14
1057033,5,"好使，生活必备",2018-08-01 20:08:22
1057033,5,"性价比高",2018-07-31 18:20:23
1057033,5,"",2018-07-23 14:43:37
1057033,5,"用起来还是可以的，希望可以做得更好",2018-07-20 00:35:26
1057033,5,"虽然只是小小的牙线棒，也要在网易买。虽然比超市比超市的要贵，但是它带给我的满足感是金钱无法衡量的。相信网易，一如既往。",2018-07-16 17:09:24
1057033,5,"老公说蛮好用！",2018-07-20 19:35:23
1057033,5,"非常满意哦",2018-07-20 11:06:03
1057033,5,"看着不错。",2018-07-19 14:19:02
1057033,5,"物美价廉！",2018-07-19 20:13:52
1057033,5,"",2018-07-19 11:03:02
1057033,5,"质量很赞",2018-07-18 11:51:55
1057033,5,"",2018-07-18 11:13:43
1057033,5,"包装用心，和苹果手机官方发货包装一样精美！每件宝贝让人放心，会一如既往光顾！加油！",2018-03-14 19:02:37
1057033,5,"买了n+n次",2018-07-17 12:48:39
1057033,5,"性价比高",2018-07-17 15:45:25
1057033,5,"第二次在严选上买东西了，真的很称心如意，质量很好<U+0001F44D>。还会再买的。",2018-03-13 15:56:29
1057033,5,"牙线还没用，看着很精致",2018-07-11 16:29:54
1057033,5,"看着不错，严选小件也越来越全了<U+0001F60A>",2018-07-07 16:23:35
1057033,5,"和电动牙刷一起买的～都好喜欢！！！！",2018-07-11 23:09:50
1057033,5,"第一次在网易严选买东西，一次下了三个订单，东西价格确实都比较偏高，但是大部分还是质量挺好的，有的信价比比较低了，这个需要自己对比。但是这里买东西挺放心就是了，还会一如既往的支持网易严选",2018-07-10 22:56:48
1057033,5,"",2018-07-10 13:46:59
1057033,5,"还没用，相信严选",2018-07-09 11:16:17
1057033,5,"满意 速度也很快",2018-07-09 19:12:21
1057033,5,"那种单纯线的用的好",2018-07-08 09:56:22
1057033,5,"便宜，好用。",2018-07-08 09:16:42
1057033,5,"好用好用！！！重度中毒啦！！",2018-07-07 00:16:24
1057033,5,"牙线棒超赞！",2018-07-07 16:50:31
1057033,5,"价格实惠！",2018-07-06 20:23:07
1057033,5,"凑单的，还没用",2018-07-05 17:29:00
1057033,5,"50只够用一段时间了，材料感觉很健康，好评！",2018-07-01 12:19:40
1057033,5,"很好满意",2018-07-02 18:36:34
1057033,5,"还没拆开用，但深信不疑严选！",2018-07-01 15:48:55
1057033,5,"",2018-06-30 17:04:27
1057033,5,"比屈臣氏买的好用。",2018-06-28 15:37:57
1057033,5,"非常好用",2018-06-28 12:34:20
1057033,5,"还没用<U+0001F633>价格挺划算的",2018-06-25 11:38:56
1057033,5,"好好用在，质量好好，比平时在超市买的好用，不过贵一点。",2018-05-17 14:22:32
1057033,5,"非常好，购物很满意",2018-06-25 16:58:20
1057033,5,"",2018-06-23 18:03:11
1057033,5,"这是第二次买了，好用",2018-06-22 12:03:26
1057033,4,"第二次买了，还是很好用的，就是没有独个包装这点不够好。希望能出独立包装的牙线，出门方便携带也更卫生。",2018-04-12 18:45:30
1057033,5,"面料很舒服，大小合适，超赞！",2018-06-20 18:59:27
1057033,5,"很好，严选还是靠谱的。",2018-06-19 18:47:50
1057033,5,"质量好，而且包装严密，非常喜欢～～",2018-06-19 15:54:33
1057033,5,"好用，第二次购买",2018-06-19 19:05:34
1057033,5,"",2018-06-19 21:11:52
1057033,5,"质量非常好，与卖家描述的完全一致，非常满意,真的很喜欢，完全超出期望值，发货速度非常快，包装非常仔细、严实， 物流公司 服务态度很好，运送速度很快，很满意的一次购物",2018-06-14 17:19:56
1057033,5,"可以，个人比较懒，一个会用好几次，很实用的",2018-06-09 10:29:20
1057033,5,"网易严选非常好，服务好，质量好，满意你们的产品。",2018-06-12 13:40:18
1057033,5,"晚点试一下口感如何，看起来是蛮不错的",2018-06-14 23:39:29
1057033,5,"还没用，看起来不错。",2018-06-16 13:56:44
1057033,5,"",2018-06-16 22:05:25
1057033,3,"觉得一点粗",2018-08-22 16:47:45
1057033,5,"质感不错。但是好像有点粗",2018-08-19 22:40:15
1057033,5,"参加一元拼团收到的，快！包装严实，服务甜而不腻，细心周到又不骚扰，东西也很不错！以后可以常来网易严选咯<U+0001F604>",2018-04-23 19:50:32
1057033,5,"日用品常备着，总没错，挺好用",2018-06-13 00:12:58
1057033,5,"非常棒！还会再买的",2018-06-12 01:52:19
1057033,5,"好的一盒 爱牙正好",2018-06-10 13:07:17
1057033,5,"一盒很精致的牙线棒！",2018-06-08 14:52:31
1057033,5,"用了两根，清洁牙缝很给力",2018-06-07 15:20:03
1057033,5,"",2018-06-07 14:58:27
1057033,5,"还没使用，看起来不错",2018-06-06 11:44:43
1057033,5,"以前都是用牙签，牙缝都大了，还挑不干净，牙线很方便又好用",2018-08-10 01:18:00
1057033,5,"为严选的高效赞一个，昨天下单，今天就收到了！从开始用到现在已经有一段时间了，效果很好，原来天天刷牙并不能好好地完全干净，用牙线就知道了！",2018-06-03 10:06:40
1057033,5,"也是昨天收到的，同时。包装很好，很用心。",2018-06-03 11:55:32
1057033,5,"第一次用，感觉还不错，以后可能会回购的",2018-05-30 09:56:33
1057033,4,"",2018-06-01 14:38:49
1057033,4,"还不错额！",2018-05-31 14:10:33
1057033,5,"好评 与超市同价格相比 这个的棉线更高质些。而且超市里除了联华自由的 其他一小盒都要20了，用起来还是这个好。",2018-08-13 20:41:34
1057033,5,"买了好几次了，好",2018-08-10 20:09:15
1057033,5,"网易严选，值得信赖，已经用了一年多了",2018-05-30 20:21:55
1057033,5,"已经使用，质量很好，性价比很高，继续回购",2018-05-20 02:52:50
1057033,5,"不适合我这种牙缝小的",2018-08-16 21:15:30
1057033,5,"还挺好用的很不错",2018-05-28 02:40:46
1057033,5,"质量非常好，与卖家描述的完全一致，非常满意,真的很喜欢，完全超出期望值，发货速度非常快，包装非常仔细、严实，物流公司服务态度很好，运送速度很快，很满意的一次购物",2018-05-24 16:13:27
1057033,5,"物美价廉，就是这个意思了。",2018-05-27 12:34:20
1057033,5,"第一次用，感觉还不错，每天敷就会脚底有湿气渗出，会坚持用一段时间看效果，主要是睡眠质量没有特别明显的改善。",2018-08-06 19:21:00
1057033,5,"不错 好用 品质感很高",2018-05-26 23:58:09
1057033,5,"相信网易严选，还可以。",2018-05-25 03:56:57
1057033,5,"第二次买啦，很好用的牙线棒",2018-05-24 12:14:07
1057033,5,"不错 牙线很细 用着很舒服 包装干净 放家里挺方便",2018-04-29 11:57:49
1057033,5,"是回购的，很棒的东西，物流快，给力",2018-05-16 15:16:04
1057033,5,"很好用，而且超级便携！！",2018-05-19 22:53:57
1057033,5,"还不错",2018-05-19 06:03:52
1057033,5,"好用。",2018-05-19 09:26:46
1057033,5,"已经用了有段时间，结实好用！牙齿感觉好多了，牙龈出血现象基本消失了。",2018-08-08 15:39:33
1057033,5,"还是电脑对吧",2018-07-24 00:17:59
1057033,5,"严选质量很好 值得信任",2018-05-15 22:36:42
1057033,5,"合作愉快，已经确认付款，请查收!",2018-07-20 23:14:33
1057033,5,"都很喜欢，萌萌哒。",2018-05-15 12:28:26
1057033,5,"说实在，牙线真不好用，线好粗糙容易断。",2018-07-24 19:33:18
1057033,5,"比牙签好多了",2018-05-15 21:34:30
1057033,5,"一直用",2018-05-15 09:39:46
1057033,5,"Good",2018-05-15 19:25:55
1057033,5,"物流很快，牙线还没有使用，用后再追评",2018-05-06 13:34:16
1057033,5,"买了一堆，包装都是美美的，而且很贴心，喜欢严选。",2018-04-20 23:36:37
1057033,5,"质量好质量好质量好",2018-05-13 22:14:41
1057033,5,"还不错，发漏货，补发货太慢了。",2018-07-22 23:48:27
1057033,5,"可以，好用。图片下面那盒才是牙线棒。",2018-05-08 23:39:07
1057033,5,"严选的东西一直很好！",2018-05-12 16:41:20
1057033,5,"质量很好。比屈臣氏的还好。价格一样。",2018-05-11 21:32:02
1057033,5,"看着不错，还没用的",2018-05-11 13:36:19
1057033,5,"包装精美，质量上乘，值得购买。",2018-05-11 19:56:10
1057033,5,"好好好，多次购买了",2018-05-11 08:44:03
1057033,5,"方便好用！不容易断。",2018-05-10 20:18:36
1057033,5,"懒",2018-07-22 00:27:09
1057033,5,"好",2018-05-10 20:15:14
1057033,5,"味道好，够味，就是这个味道",2018-07-12 01:06:30
1057033,5,"盒子开了就合不上了",2018-07-14 10:39:28
1057033,5,"",2018-05-10 06:24:22
1057033,5,"越用越发现牙线好用。",2018-07-11 19:48:58
1057033,5,"牙线棒收到，非常满意，给个满分。",2018-05-09 22:40:26
1057033,5,"当大家看到我的这一篇评价时，表示我对产品是认可的，尽管我此刻的评论是复制粘贴的。这一方面是为了肯定商家的服务，另一方面是为了节省自己的时间，因为差评我会直接说为什么的。所以大家就当做是产品质量合格的意思来看就行了。真的非常支持严选",2018-07-19 08:02:00
1057033,5,"",2018-05-09 18:21:58
1057033,5,"非常的好，速度很快，质量很不错",2018-05-08 12:21:01
1057033,5,"挺好用的",2018-05-07 12:37:03
1057033,5,"还没有使用，相信不会让我失望的，看着就很好",2018-04-13 13:52:53
1057033,5,"还不错，严选产品质量可靠",2018-05-06 05:00:36
1057033,5,"嗯嗯，不错，专门拿个包裹装，牙线棒也很好",2018-04-22 13:47:38
1057033,5,"牙线非常好，很方便，包装物流给力，认定严选了，质量杠杠的。",2018-03-14 12:26:40
1057033,5,"看起来质感不错，精致生活源于细节，超赞",2018-05-04 12:24:41
1057033,5,"",2018-05-04 20:10:46
1057033,3,"牙线有点容易断",2018-07-16 09:14:31
1057033,5,"还没使用，相信严选的品质",2018-05-03 15:33:41
1057033,5,"牙线棒都一样 但是严选家的盒子真得太爱了1颜值颇高",2018-07-10 16:22:07
1057033,5,"看起来不错",2018-05-02 09:28:49
1057033,5,"好用！",2018-05-02 22:28:11
1057033,5,"美丽。听说淘宝很多网易严选的券代购 全场7折 什么套路啊 这让老老实实app购买的情何以堪 网易严选能不能注意修复下bug",2018-07-09 16:00:25
1057033,5,"没怎么用",2018-07-11 10:17:51
1057033,5,"很好用，性价比高，还会选购",2018-04-30 21:51:16
1057033,4,"不是很好用，更适合牙齿较小牙缝比较大的",2018-07-02 15:31:49
1057033,5,"牙线很高级的感觉 爸爸妈妈都开始用了",2018-04-24 14:30:48
1057033,5,"线太容易断了，而且比其他牙线要粗一些",2018-07-01 04:45:46
1057033,5,"还可以，不错不错",2018-05-01 22:20:39
1057033,3,"使用感受不是很好",2018-06-30 15:28:45
1057033,5,"很好，用了优惠券，价格便宜",2018-04-30 20:52:48
1057033,5,"牙线好啊，放在家里客人都问哪买的！很喜欢！",2018-04-16 08:50:51
1057033,5,"非常好用，就是有时候会拉丝，碰到后槽牙使用的情况时会有点难拔出来",2018-07-03 15:05:13
1057033,5,"一块钱拼单实惠",2018-04-29 12:02:34
1057033,5,"不错！",2018-04-29 20:22:46
1057033,5,"好",2018-04-29 23:49:25
1057033,5,"还没用，c(￣ω￣(￣ω￣〃)f",2018-04-23 11:18:07
1057033,5,"还没有用但是觉得很不错。",2018-04-24 21:45:13
1057033,5,"新人礼，感觉挺有诚意的",2018-04-24 11:46:54
1057033,5,"好",2018-04-24 10:39:29
1057033,5,"",2018-04-24 20:12:08
1057033,3,"好像刷不到",2018-06-19 22:27:42
1057033,3,"不好用，太粗了。",2018-06-19 22:27:05
1057033,5,"第一次拼团，1元就买到啦！好开心",2018-04-23 09:43:06
1057033,5,"买买一起买。",2018-04-23 14:45:57
1057033,5,"物流很快
牙线很棒！很好用！",2018-04-22 18:22:00
1057033,5,"很好用哦~",2018-04-22 18:37:57
1057033,5,"不错",2018-04-22 10:58:35
1057033,5,"还可以吧，比屈臣士的略粗糙一些",2018-06-27 09:25:36
1057033,5,"超好",2018-04-20 23:36:45
1057033,5,"就是普通的牙线棒呀",2018-06-25 19:35:02
1057033,5,"用着还不错，比牙签好，比手卫生，线很牢固，总的时候一定要慢慢的，总体来说奶思，虽然没怎么用，以防万一塞牙缝的时候可以用得上！",2018-04-11 16:03:00
1057033,5,"适合牙缝紧的，像我这样牙间隙大的还是用膨胀的或者扁牙线比较合适",2018-06-20 14:42:35
1057033,5,"已经验货，东西质量好，喜欢，超赞！",2018-04-18 20:53:54
1057033,5,"一直在用的牙线",2018-04-18 11:24:41
1057033,5,"很好用",2018-04-18 15:36:58
1057033,5,"好！！！！",2018-04-18 18:46:51
1057033,5,"给母亲大人和老婆大人买的，性价比不错",2018-04-14 23:11:52
1057033,5,"试着用了一下，还是不习惯。一直掌握不到技术～～再努力努力",2018-06-15 07:19:33
1057033,5,"用惯严选的牙线后就不买其它的了",2018-06-10 20:42:59
1057033,5,"很喜欢，买的所有东西都是我喜欢的风格呀",2018-04-10 16:32:01
1057033,5,"还没用，看起来不错",2018-04-17 23:07:04
1057033,5,"颜值高，好用，已经中毒了，还会在买",2018-04-16 12:55:59
1057033,5,"现在离不开牙线，相信严选，没有失望过。",2018-04-12 15:57:58
1057033,3,"线容易磨细磨出毛",2018-06-10 16:53:23
1057033,5,"还没有 看起来不错呢",2018-04-15 20:41:21
1057033,5,"有效，以后会常购。",2018-04-15 09:18:13
1057033,3,"一般吧，线不是很结实",2018-06-13 13:27:32
1057033,5,"",2018-04-15 22:51:07
1057033,5,"包装精致，但是牙线相对比较粗",2018-04-14 10:18:12
1057033,5,"还没用，相信严选",2018-04-14 19:09:33
1057033,5,"还行，使用感不错。",2018-04-14 00:53:59
1057033,1,"太小了吧，一点都不划算",2018-06-10 19:05:37
1057033,5,"看起来还好。",2018-04-14 21:38:39
1057033,3,"不好用。
清理不了多少颗牙齿，也不能天天清理。清理还很麻烦，容易卡住。",2018-06-12 21:48:57
1057033,5,"好用",2018-04-14 18:25:45
1057033,4,"不好用，还是用回牙签吧",2018-06-09 20:34:41
1057033,5,"我为什么喜欢在网易严选买东西，因为东西真心不错的。宝贝收到了，非常喜欢，质量很好，发货蛮快，服务到位，非常愉快的一次购物体验！而我为什么每个商品的评价都一样，因为在商场买的东西越来越多了，导致积累了很多未评价的订单，所以我统一用段话作为评价内容。在严选购物这么久，有买到很好的产品，也有买到不太满意的产品协调处理后还是满意的，如果我用这段话来评价，说明该款产品没有问题，至少90分以上！",2018-04-14 20:59:22
1057033,5,"还没用，看包装很不错的",2018-04-13 13:05:52
1057033,5,"凑单用的，放车上了，吃完夜宵直接剔。",2018-04-09 13:40:38
1057033,4,"不怎么样",2018-06-03 18:03:34
1057033,3,"质量一般",2018-06-09 22:03:05
1057033,5,"锅的颜值高大上，盘子略有瑕疵，盘边内部有气泡，有黑色污渍，无法处理。",2018-05-30 13:31:49
1057033,5,"很早之前买的了，男朋友用得很开心",2018-04-11 00:38:19
1057033,5,"一直用着的，一如既往的好",2018-04-12 01:15:58
1057033,5,"很好，就是有些尖端折了",2018-06-06 14:48:29
1057033,5,"不要问我开通超级会员是为了什么",2018-06-01 15:25:20
1057033,5,"还没用，感觉还好",2018-04-12 21:15:43
1057033,5,"实用的小东西 很喜欢",2018-04-12 17:44:03
1057033,5,"很好，性价比很高，很喜欢",2018-04-11 21:26:00
1057033,5,"很好用！",2018-04-11 18:09:13
1057033,5,"好用",2018-04-11 12:45:11
1057033,5,"牙线太粗。纸巾太小了。",2018-05-30 11:44:09
1057033,5,"很好，内裤清薄舒服，袋子都没有扔，可以继续使用",2018-04-03 11:42:27
1057033,5,"又当牙签又当牙线",2018-05-29 10:25:27
1057033,5,"包装很精美，非常好用",2018-04-10 00:08:44
1057033,5,"长期购买，很好",2018-04-10 23:36:27
1057033,5,"物廉价美",2018-05-21 18:04:19
1057033,5,"不错",2018-04-09 20:43:55
1057033,5,"",2018-04-09 10:29:15
1057033,5,"质量挺好的 很好用 相信严选的品质",2018-04-07 20:48:12
1057033,5,"感觉不如第一次买的质量好  容易断",2018-05-16 15:54:31
1057033,4,"质量还行，不过和在日本买的相比，太粗了，不太好用",2018-05-28 18:13:00
1057033,5,"不错，牙线棒现在必需品呀~",2018-04-08 19:44:06
1057033,5,"生活已经离不开牙线了，十分好用，不伤牙龈",2018-04-03 12:46:53
1057033,1,"这个是真的毫无用处  呵呵  我真想退货",2018-05-15 22:14:27
1057033,5,"物流有点慢",2018-05-25 08:33:42
1057033,5,"看上去质量很好，严选我还是比较放心的",2018-04-05 12:41:43
1057033,5,"品质生活，从生活习惯的细节开始。",2018-04-06 00:20:36
1057033,5,"第二次购买质量非常好，以后就严选了",2018-04-05 14:44:32
1057033,5,"我好像不是很会用这个压线……",2018-05-17 09:22:08
1057033,5,"多次购买了，使用很方便，非常满意。",2018-04-05 09:41:58
1057033,5,"质量很好，好用。希望一直用心严选！",2018-04-04 10:41:50
1057033,5,"严选的东西总体质量不错的，就是老是码数不全。东西也少了点，现在慢慢从丽芙家居和淘宝转到严选了，希望保持水准，丰富产品。",2018-03-23 10:54:28
1057033,5,"比牙签好用多了，实惠，点赞！",2018-04-03 21:58:48
1057033,5,"鞋硬磨破皮哦，脚后跟得贴创口贴",2018-05-17 07:12:37
1057033,5,"哈哈哈哈哈",2018-04-03 22:10:15
1057033,5,"便宜又好用，出门带牙线棒方便",2018-04-02 10:12:39
1057033,5,"很满意，质量很好，严选的生活用品颜值很高",2018-03-26 15:41:49
1057033,5,"好",2018-04-01 18:33:50
1057033,5,"第二次购买了。挺好用的",2018-04-01 09:13:24
1057033,5,"很方便实用，第二次购了",2018-03-31 17:39:54
1057033,5,"价格合适，质量不错",2018-03-31 21:08:14
1057033,5,"",2018-03-30 18:38:43
1057033,5,"东西质量还不错，我爱严选么么哒",2018-03-28 12:39:07
1057033,3,"比想象中的要粗，不是扁平的",2018-05-08 08:57:18
1057033,5,"不错，质量好，还会再买",2018-03-29 05:38:22
1057033,5,"现在不止在严选买手纸，牙线也开始用严选的了",2018-05-10 22:43:48
1057033,5,"很好的。继续支持网易。",2018-03-29 11:59:32
1057033,5,"第一次用，还没用习惯～",2018-05-11 09:18:01
1057033,5,"这个真心不怎么样，线太粗了。",2018-05-15 12:14:01
1057033,2,"不好用",2018-05-08 17:41:57
1057033,5,"好好好。",2018-03-28 20:22:54
1057033,5,"好用！",2018-03-28 15:23:32
1057033,5,"包装精美，保质期长，越来越喜欢严选的。",2018-03-27 22:14:39
1057033,5,"相当于送的礼物，好好好哟",2018-03-26 08:56:52
1057033,5,"还不错！",2018-03-26 12:27:13
1057033,5,"",2018-03-26 09:53:06
1057033,5,"很舒适，不显脚大。39的脚38码正合适。满意！",2018-03-13 12:11:48
1057033,5,"东东很漂亮，穿在脚上一直在做着按摩，很舒服",2018-03-13 23:34:41
1057033,5,"第一次用，不太习惯",2018-05-09 21:29:59
1057033,5,"质量很好，比药店买的好用很多",2018-03-24 11:25:29
1057033,5,"牙线是一元包邮得到的，非常好用，就是用的时候会控制不住力度，牙银会出血，已经把牙签弃了，改用牙线！",2018-05-10 16:28:33
1057033,5,"快递服务给力，送货上门及时，相当不错满意！",2018-03-25 11:36:35
1057033,5,"包装很精美，便宜携带方便",2018-03-25 20:46:43
1057033,5,"小小一盒，价格不贵，携带方便，赞\(RQ)/",2018-03-22 12:54:57
1057033,5,"屯货中，还没用，相信网易的品质。",2018-03-21 10:58:21
1057033,5,"还行，线不容易分散，很好。",2018-05-03 14:22:00
1057033,5,"",2018-03-22 22:26:46
1057033,5,"线有点粗了～用了整线的那种这种反而不习惯～",2018-05-01 23:30:17
1057033,5,"好用，不错的，严选的质量值得信赖",2018-03-21 12:23:59
1057033,5,"用习惯就发现商场里同价位卖的都是垃圾",2018-04-30 08:13:19
1057033,3,"不会用，牙缝变大了",2018-05-01 11:00:27
1057033,5,"还没用，相信严选品质",2018-03-21 19:20:41
1057033,5,"",2018-03-19 15:15:17
1057033,5,"牙线好用，易进牙缝。",2018-03-17 07:56:17
