"itemId","star","content","createTime"
1085002,5,"卷发不太好用，直发可以",2017-10-18 23:10:50
1085002,5,"拉直头发还蛮好用 很容易上手 做工也不错 就是卷头发还在摸索中",2018-03-09 13:13:26
1085002,5,"我手很笨，以前的卷发棒我都用不了，这款真的是福音，操作超简单顺手！买了三个",2018-02-28 13:28:21
1085002,5,"喜欢！第一次买电发棒，从此不必再纠结烫发染发的问题<U+0001F604>完全可以靠自己做简单的造型",2018-02-21 10:30:30
1085002,5,"实用的一说…

一到手就给老妈拉头发了…

岁月温柔对待老妈的面容",2018-02-07 17:44:35
1085002,5,"用了一次，感觉还可以，这玩意不都挺好用的么，不过自己不怎么会用，偏大。",2018-02-04 18:19:11
1085002,5,"非常非常好用的卷发梳，质量非常好，又容易造型，还不伤发，买了无数个类似产品，这个最喜欢最好",2018-02-26 08:39:24
1085002,5,"用起来非常好，买的很满意，不管卷发还是直发，打理起来很方便，效果也不错。适合我这种懒人",2018-02-23 11:22:20
1085002,5,"用了一段时间了，适合烫空气刘海，不适合长发，卷紧了取不下来。质量非常好，超值的高品质货品",2018-02-14 00:14:38
1085002,5,"外面的梳齿除了打理卷发方便，更重要的是自己夹的时候还能防止烫到手，简直太棒了",2018-01-22 14:29:21
1085002,5,"质量好，和我在日本买的其他款品质一样，用了下温度也好，可以随心所欲变美美哒，<U+0001F604><U+0001F604>",2018-02-05 08:28:05
1085002,5,"非常好用，我这个沙发质是离不开了，也不用去外面做拉直了。",2018-03-06 07:24:19
1085002,5,"感觉不太好使用，懒得退了",2018-01-30 15:05:16
1085002,4,"好大一只啊 以为是很小很便携的呢 用起来还可以 性价比还是不错的",2018-01-02 16:01:31
1085002,5,"特别好用，原来想卷长发，后来剪成荷叶头，这梳子竟然成了必用的了，特别好用。",2017-12-31 03:50:23
1085002,5,"蛮好的 就是自己还不是很会卷 满烫的 挺好用的 卷发最好还是别人帮你 挺大的",2018-03-04 21:34:32
1085002,5,"挺精致，就是不太会用，卷的不好看",2018-02-24 18:22:04
1085002,5,"那个抱枕松松软软的，特别好用，好舒服。卷发棒暂时还不太会用。哈哈哈",2018-01-27 11:52:32
1085002,5,"这种卷发棒真的很好用，能卷发还可以拉直发，又不会烫着头皮，我很喜欢。",2018-01-19 17:26:49
1085002,5,"比较大，比手掌长一截。用起来还是不错，发热快，我是菜鸟级别，用起来还可以",2017-12-04 22:29:54
1085002,5,"只会用直发，卷发还不会用，还在摸索中。严选东西棒棒的！",2018-02-10 08:35:59
1085002,5,"非常满意，感谢网易严选，包装很用心，虽然东西都不贵，但质量都很好，一定会再来",2017-12-16 16:31:04
1085002,5,"试用了一下，感觉不太伤头发，还要多用用才能上手",2018-03-13 23:02:01
1085002,5,"严选的很多产品还是值得推荐的，希望严选再接再厉，出越来越多的更好的产品！！同时多些优惠才更棒哦<U+0001F604>",2018-03-01 12:55:52
1085002,5,"卷出的卷太大了呀",2018-01-05 08:34:20
1085002,5,"这个感觉稍微一般吧，但是比起价格来说已经很划算了。",2018-02-05 22:22:45
1085002,5,"对于短发的我来说有一点点大，适合中长发的妹纸用，而且使用很方便，卷出来效果也不错",2017-11-17 12:39:51
1085002,5,"非常好呢，真的是IW易肋xI上a了～|量好的]f不F，物流又快",2017-12-10 14:05:18
1085002,5,"超好用的 比之前买的用着方便 也不烫手 拉直还是卷发都很好用",2017-11-14 20:51:08
1085002,5,"比想象中的要大很多，两用的比较方便，就是头发短且少，感觉有点大材小用了，，，",2017-11-14 14:05:36
1085002,5,"孩子用来早起烫刘海很好用的，性价比超高，C直发也很不错",2018-01-27 21:14:51
1085002,5,"向用来卷刘海的，一开始不会用搁置了一段时间，现在会用了，真的很好用。",2017-11-16 14:55:14
1085002,5,"还没用过 严选的电器 一直不是很放心，自从香薰机刚过30天就坏了，只能维修，而至今还为修好 这个事件之后，留下了心里阴影，希望这个美发梳可以用的住",2017-12-05 13:51:06
1085002,5,"长了点，考虑到还没正式用，不知顺不顺手，就不退了，估计做这么长是不是方便卷后面的头发。先用着。",2017-12-12 13:02:59
1085002,5,"一直想买个卷发棒，在严选下手了。收到手感不错，加热很快，可以愉快的凹造型了！",2017-12-02 12:04:14
1085002,5,"体积有点大了，买了这款和可以调节温度的夹板，感觉还是那款温控的更实用些",2017-11-14 10:19:24
1085002,5,"感觉高大上啊，还没来得及用，应该是不错的，相信网易严选，一定不会失望，买吧买吧",2017-11-14 18:06:09
1085002,5,"很好用，不怕被烫到。就是温度不太够，高档也没有很烫。对我这种到脖子的内扣很方便。",2017-12-19 19:59:36
1085002,5,"基本没什么用，卷不了头发。只能当夹板。重",2018-01-24 10:32:24
1085002,5,"给妹子买的，早晨起床非常好的打理工具，二合一更是让自己后悔没早点选网易，物超所值，满意",2018-01-08 21:30:59
1085002,5,"这个老早就种草，一直想等双十一应该有活动，看到秒杀赶紧付款，质感真的好。这个价格赚到了哈哈哈哈",2017-11-17 16:34:00
1085002,5,"实话实说，没有在美发店弄出来的漂亮，但出门前用来整理头发是很好的。宝贝手感做工都很好，物流神一样的速度",2018-02-25 11:32:12
1085002,5,"还可以，用起来不是很熟练。。",2018-03-01 17:26:21
1085002,5,"还没用，不是可以折叠的，出差不方便，要有一个外壳就更好了",2018-02-06 21:37:55
1085002,5,"这个真的特别好用，虽然手残，但是因为不会烫到自己，能放心使用",2018-02-05 23:33:03
1085002,5,"效果不错，比之前某宝上买的好多了，就是卷发功能还不会用，探索中",2017-11-13 01:36:10
1085002,5,"原来自己买了一个放在办公室用 同事用了几次觉得不错 就让我帮她也买了一个 好东西分享成功",2017-11-11 07:56:57
1085002,5,"还是很好用的",2017-10-17 22:34:35
1085002,5,"拉直功能好用，卷发还要自己再摸索学习方法。不过加热的挺快的",2018-03-06 12:57:10
1085002,5,"这个超级喜欢，半价买很值，试了一下，热得快，效果也不错，已经推举给朋友了~",2017-12-03 22:56:17
1085002,5,"颜值高，挺好用的。散热的时候把直板那个锁扣松开，就很快啦",2018-01-28 17:03:04
1085002,5,"这个就要强势安利一波了、又便宜又好用、重点是比学生时代在小商品市场买的那种不知道安全多少倍！！！",2017-12-19 11:26:49
1085002,5,"觉得还是没有梳子的好用",2017-11-17 13:53:07
1085002,5,"个头比我想象的大一些 加热很快 不过要想卷的好看还得多实践",2017-11-27 22:01:31
1085002,5,"很好，剪了短发每天都在用，白色感觉很上档次，简约唯美，而且不会烫手，温度上升很快",2017-10-12 13:19:55
1085002,4,"直发效果很好，但是卷发效果可能因为手法问题总是缠头发。但是真的不会烫手烫脸。物流也很快！",2017-10-16 20:50:48
1085002,5,"为了110-220伏都可以用的电压买的，出国带着用，不过 110伏的时候热得超级慢。。。几十分钟才热好。",2018-01-09 18:36:07
1085002,5,"质量非常好，厚实结实，颜色也很漂亮，卷直两用，热的也非常快，很是喜欢",2017-12-20 20:13:14
1085002,5,"加热速度非常快 偶尔会烫到自己 定型效果不错建议干性发质的宝宝搭配一直精油适应会更好",2017-10-07 17:08:20
1085002,5,"用过一两次。还不错。就是保持时间不是很长。",2018-01-16 12:52:18
1085002,5,"呃.....男生头发有点短不好弄",2018-01-09 22:14:16
1085002,5,"很好用，加热时间短，卷发直发都能用，收到就给孩子试了一下，能够抚平毛躁，双十一半价买的，超值！",2017-11-17 12:31:38
1085002,5,"剪了短发后就把这个送人了，用的时候还觉得不错的，可以五星好评",2017-12-18 13:02:00
1085002,5,"今天刚收到，快递速度杠杠的，昨天下午买的，今天早上就到公司了，开森",2018-01-11 19:03:38
1085002,5,"特价时购入，一支搞定能拉直，能弄卷，满意。材质手感很好，值。常使用发棒，要配合护发产品",2017-11-09 13:25:58
1085002,5,"虽然上手还不太熟练，但是东西品质没得说，卷直两用很实用。",2018-02-08 10:01:32
1085002,5,"活动时候买的，性价比超高，有两档可调，还不会烫着手，慢慢练习，很好用",2017-10-06 20:03:52
1085002,5,"加热快，头发短一直都是当直发板用的，所以卷发的功能不知道，一看就很有质感，挺喜欢的",2017-11-05 07:41:04
1085002,5,"特别好 每次严选都不会失望！！！特别好 每次严选都不会失望！！！特别好 每次严选都不会失望！！！特别好 每次严选都不会失望！！！",2018-02-13 11:49:45
1085002,5,"不错，不伤头发，就是有点大，手残党不好控制",2017-11-17 15:15:58
1085002,5,"质感真的超级棒，而且1111特价抢的，很满意，不过我手小不怎么握得住",2017-12-05 14:42:03
1085002,5,"看了好久，看中的就是随心造型，看有活动就赶快拍下了，严选的品质值得信任",2017-09-25 20:50:15
1085002,5,"很快就发热了，有点重。直发用了，卷发不会用，有指南就更好了",2017-12-03 10:23:24
1085002,5,"做内扣很方便，就是保持的时间不长，总体来说还是很不错的",2018-01-31 21:38:06
1085002,5,"外形不错，可是我不太会卷",2018-01-31 11:24:57
1085002,5,"太方便太好用了，100块能买到这么超值的东西真是开熏",2017-12-31 22:37:01
1085002,5,"这个包装盒很好，网易用心做自己的质量好品牌，懂得客户体验是很好。",2017-12-28 00:05:07
1085002,5,"新手用，第一次不很熟练，就玩过几次，也不经常使用，但是质感很好，卷出来也不错的，会用就方便了",2017-10-29 09:49:06
1085002,5,"没想到这么大的卷发棒宿舍居然能用不会断掉，非常非常好。",2018-01-25 11:40:23
1085002,5,"不错，心情不好就换个发型",2018-01-30 22:07:23
1085002,5,"嗯不错，种草严选以后就一发不可收拾～因为不太会用卷发梳所以摸索中～但是不会烧焦头发不错<U+0001F44D>",2017-10-28 22:01:33
1085002,5,"对我这种自然卷发的人，这个很好的解决了我的困扰。直发轻松搞定",2017-10-31 08:48:10
1085002,5,"挺好用的，闺蜜让帮关注，想在限时购的时候买",2018-02-20 22:20:31
1085002,5,"挺好的 就是不会用",2017-11-12 09:20:01
1085002,5,"使用很方便，手残也不怕，外面的梳子用手摸着也不会烫手，比较适合新手～",2017-09-24 10:47:26
1085002,5,"快热，一拉头发就直了，好东西值得拥有，就是有点大了",2018-01-22 15:43:14
1085002,5,"手感不错，就是不太会操作，试一下后，发卷的造型保留时间很短，",2018-01-21 19:26:23
1085002,5,"还没用，但看起来很不错，不充电在头发上比划了一下，也算顺手～",2017-11-22 16:10:20
1085002,5,"很好，性价比超高包装也很好，挺大一个用着不错",2018-03-12 17:06:16
1085002,5,"还可以，就是直径稍稍有点大，用起来有点不方便",2017-11-07 13:58:41
1085002,5,"用着还行吧  就是比较鸡肋吧  只能用来拉直  内扣也行吧 就是很难操作",2017-12-21 10:41:39
1085002,5,"颜值高，材质手感不错，自己手笨只会做稍微内扣的梨花，效果也挺好的",2017-11-18 15:58:37
1085002,5,"卷发用的不太喜欢，总体还可以",2018-03-13 09:53:00
1085002,5,"很漂亮，也很好用，升温非常快，已经用来卷过刘海了，很赞<U+0001F604>",2017-11-17 11:49:11
1085002,5,"活动时买的，太值了，用了一次，和理发店做的一样！",2018-03-05 21:07:34
1085002,5,"洗头后用卷发棒试了一下，效果非常好，都不用去洗发店了",2017-11-16 10:26:00
1085002,5,"之前用了朋友的，感觉挺好的，但是这次买的用起来感觉不一样，用完头发干干的…再有感觉东西不是新的",2017-12-06 21:39:36
1085002,5,"用了很久才来评价 不得不说 是我用过最好用的<U+0001F499>",2017-12-12 22:49:04
1085002,5,"这个卷发棒真的超级好用 很适合中长发做发尾造型 定型快 还不烫手 推荐",2017-09-14 23:40:32
1085002,5,"买回来用了一次，我觉得挺好的～可以卷发可以拉直，性价比高",2017-11-11 17:38:32
1085002,5,"感觉还不错，试用了一下，还是会不小心烫到自己，多练习练习",2018-02-02 13:29:57
1085002,5,"用了一次，热得比较快，把刘海夹直可以，可以撑一天，下次再试一下卷发",2017-09-25 08:59:40
1085002,3,"偏贵",2017-12-05 17:39:09
1085002,5,"之前买了一把，看到限时购赶紧帮同事再入一把，一如既往的好",2017-12-04 17:59:01
1085002,5,"好用
非常不容易烫手
但是卷起来的效果不持久
需要定型水",2017-10-12 23:23:58
1085002,5,"物美价廉，买过好几款直发，沙宣有一款五六百的蒸汽A，都没这个好用",2017-12-02 19:42:01
1085002,5,"超出想象的长，出差携带带不方便，不过还是挺轻的。",2018-03-08 10:37:09
1085002,5,"很漂亮，手感比较不错，直发还行，就是还没学会卷发，慢慢来",2018-03-08 10:37:39
1085002,4,"热的并不算很快 而且好粗…",2018-03-12 08:56:50
1085002,5,"怎么会有这么好用的卷发棒，简直是生活好帮手，喜欢",2018-03-07 10:36:33
1085002,5,"超级好用，看评论以为会很大，其实还好，空气刘海妥妥的",2018-01-24 22:12:01
1085002,5,"还不错哦 同学用了都说好用呢 每天梳一梳也是非常舒服的 喜欢 信任严选",2017-08-28 08:44:22
1085002,5,"嗯…我头发太短了又手残所以没用过几次。不过我要说除了颜值高，防烫设计真的很贴心了",2017-12-03 23:06:09
1085002,0,"买回来就迫不及待试了，很好用，卷直发一体，很好用！弄出来的发型很漂亮",2017-09-17 10:28:46
1085002,5,"用过感觉很好，就是买的有点大了，带出门不太方便",2017-10-18 01:02:19
1085002,5,"热得很快对于赶时间的人来说还是非常不错的，也很好用，做出头发得效果很好",2017-08-26 22:23:35
1085002,5,"真的很好用，种草很久终于下定决心买了，活动价很划算",2018-03-01 21:36:02
1085002,5,"超级好 就是笨手笨脚还不太熟练",2017-12-03 21:12:14
1085002,5,"看着不错要是有挂钩和便携袋就更好了。",2018-02-28 13:39:08
1085002,5,"比想象的大，以为比较小可以出差用的。目前还没有学会使用。手感不错。",2017-12-22 09:04:21
1085002,5,"属于卷出来比较自然的那种，都是老公帮我卷，他说挺好用的",2017-11-23 09:57:19
1085002,5,"手感很好，卷有点大，适合做中发内扣效果，整体很满意",2018-02-07 18:06:40
1085002,5,"非常好用。平常头发打理就不用上理发店，自己就搞定了。",2018-01-15 13:53:38
1085002,5,"还蛮好用！就是懒人起床晚不怎么用…",2017-11-23 23:37:13
1085002,5,"超级好用，接触面大，功率高，我的齐耳短发一会儿就搞定了",2018-01-13 12:45:36
1085002,5,"加热挺快的，卷头发拉直都很方便，后续多用用再追评",2017-12-18 15:23:17
1085002,0,"用的180度的温度卷的，很简单，上卷很容易，建议中长发使用，不知道因为之前烫过还是本来就很好用，后来想拉直，在卷过的基础上拉直的，效果不太好",2017-03-21 19:03:01
1085002,5,"对付我的一头自然卷很好用，梳过以后秒顺",2018-02-23 15:21:44
1085002,5,"用着还行 至少比较安全…做卷发效果不是特别好",2017-10-19 21:50:26
1085002,5,"质量杠杠的，很好用，物流超快，非常满意的一次购物。",2018-03-06 22:56:36
1085002,5,"很好，就是不会用",2017-10-17 23:11:42
1085002,5,"拿到手上就知道质量很好，夹直发真的很棒",2018-03-05 18:53:10
1085002,5,"拯救手残星人，第一速热，加热速度很快，第二是设计非常完美，外层材料有效起到了保护手不被烫伤的作用，朋友推荐来买的嘿嘿",2018-02-24 14:39:01
1085002,5,"看起来质量不错倒是目前我还不会使用回头看一下视频怎样使用",2018-01-08 20:19:12
1085002,5,"好大一支，简直是惊喜！收到就立马使用了，效果棒棒哒，我这一头蓬乱发分分钟就被收拾得妥妥的。好评",2017-11-05 16:28:46
1085002,5,"双十一抢的质量非常棒性价比特别高，款式漂亮非常实用，太喜欢了",2017-12-12 17:05:32
1085002,5,"用了很长一段时间才来评价的，挺好用的，质量杠杠的，很喜欢",2017-11-14 06:23:15
1085002,5,"试了一下，还不错，造型很容易，但是会弄到头发干燥。特别是发尾。用之前最好涂个护发油。",2017-09-20 11:53:11
1085002,5,"试用了一下，很方便， 安全是首要的，卷出来的卷也比较自然，棒棒哒<U+0001F44D>",2017-09-22 08:59:26
1085002,5,"这个东西很洋气，质量可以，但是我家洋气的东西太多，努力一周用一次吧",2018-03-11 08:44:53
1085002,5,"刚开始不太会用 理发店的人教了我一下 果然好用",2018-03-13 10:28:53
1085002,5,"上次买错了，今天收到就试了一下很满意",2018-03-10 23:48:06
1085002,5,"睡的不好头发有些调皮 这个就很好用 加热速度快 又不烫手 夹直弄卷都可以 性价比超高的 种草给闺蜜了",2018-01-23 14:15:29
1085002,5,"试了一下 加热快 不会烫到自己 就是还不大会用卷发 在研究一下！",2018-03-11 11:30:52
1085002,5,"高档，大气，包装好大，快递服务好，还没用，等用过再来评价",2017-12-31 15:24:56
1085002,5,"挺好的，后来要买就不打折了",2018-03-10 14:54:36
1085002,5,"这个非常棒，质量很好，以后自己在家就可以弄头发了",2018-02-08 21:41:55
1085002,5,"还不错，用起来蛮好的",2018-03-12 22:54:18
1085002,5,"挺好的加购产品，",2018-03-12 10:31:38
1085002,5,"非常好用，赶紧买吧",2018-03-12 11:20:35
1085002,5,"不错不错，换购很值",2018-03-12 00:34:30
1085002,5,"很好用~颜值高~",2018-03-12 21:39:52
1085002,5,"很不错",2018-03-12 20:52:47
1085002,5,"还行",2018-03-12 21:52:40
1085002,5,"很棒",2018-03-12 12:50:29
1085002,5,"好",2018-03-12 16:06:22
1085002,5,"不错",2018-03-12 20:51:55
1085002,5,"下次会再买，很方便，东西也新鲜",2018-03-11 20:56:27
1085002,5,"每天都在用，很方便，很好用。",2018-03-11 17:06:04
1085002,5,"还没用 应该行吧",2018-03-11 19:39:02
1085002,5,"送人的，感觉还不错",2018-03-11 20:51:51
1085002,5,"价格便宜还没使用",2018-03-11 16:24:19
1085002,5,"很方便，好用",2018-03-11 21:03:05
1085002,5,"还行吧",2018-03-11 23:56:00
1085002,5,"很好用",2018-03-11 20:55:18
1085002,5,"很好",2018-03-11 09:04:27
1085002,5,"挺好用的，又高低两档温度，拉直或者大卷都快速有效，唯一缺点就是大了点。",2017-08-10 11:13:43
1085002,5,"还没用过看上去不错",2018-03-10 23:22:43
1085002,5,"很好，物超所值",2018-03-10 22:49:10
1085002,5,"好用，不烫手。",2018-03-10 23:36:12
1085002,5,"可以",2018-03-10 18:47:41
1085002,5,"满意",2018-03-10 19:34:26
1085002,5,"好",2018-03-10 14:11:23
1085002,5,"好",2018-03-10 21:30:41
1085002,5,"还是很方便管用的，就是我太懒了。",2018-03-04 23:48:42
1085002,5,"一棒两用 可卷可直 不用浪费钱去搞头发了 手感不错",2018-01-19 21:20:55
1085002,5,"质量超级好，不过头发太短，发挥不出作用。",2018-03-10 18:19:33
1085002,5,"还不错，用起来方便，不担心烫到。卷一卷也还比较快。",2018-02-05 11:13:29
1085002,5,"高颜值高质量，严选的东西真的很有保障",2018-03-08 22:18:50
1085002,5,"质量非常好！！严选目前值得相信",2018-03-09 11:32:13
1085002,5,"直发还可以，卷发效果不明显",2018-03-09 18:22:27
1085002,5,"很好",2018-03-09 10:57:47
1085002,5,"喜欢",2018-03-09 20:58:54
1085002,5,"赞赞赞赞赞赞赞赞赞赞赞赞赞赞赞赞赞赞赞赞赞赞赞赞赞赞赞赞赞赞赞赞赞赞赞赞赞赞赞赞赞赞赞赞赞赞赞赞赞赞赞赞赞赞赞赞赞赞赞赞赞赞赞赞赞赞赞赞赞赞赞赞赞赞赞赞赞赞赞赞赞赞赞赞赞赞赞赞赞赞赞赞赞赞赞赞赞",2018-03-09 12:09:01
1085002,5,"做工很细 测试了一下加热感觉可以",2018-03-08 00:36:23
1085002,5,"还没用呢看着不错",2018-03-08 09:06:04
1085002,5,"好评，物流挺快的",2018-03-08 13:38:51
1085002,5,"美发棒棒哒",2018-03-08 09:15:07
1085002,5,"好评，物流很快",2018-03-08 13:33:08
1085002,5,"好用",2018-03-08 15:33:11
1085002,5,"还行",2018-03-08 20:15:22
1085002,5,"好用",2018-03-08 12:15:12
1085002,5,"好",2018-03-08 09:11:35
1085002,5,"好评",2018-03-08 13:33:27
1085002,5,"很不错，质量也很好",2018-03-07 12:50:31
1085002,5,"可以，一直在用",2018-03-07 10:48:47
1085002,5,"很棒！",2018-03-07 22:37:17
1085002,5,"好用",2018-03-07 15:38:22
1085002,4,"做内扣还行，想做卷有难度。",2018-03-05 12:01:18
1085002,5,"设计感觉不是很合理，看各人需求吧",2018-03-05 20:00:06
1085002,5,"手残党表示很好用，就是大了点不方便携带",2018-02-02 09:13:37
1085002,4,"还可以",2018-03-06 09:06:50
1085002,5,"挺好",2018-03-06 22:27:24
1085002,5,"很好用  就是稍微大了点点  便携版应该也不错",2018-02-01 22:28:54
1085002,5,"非常好，很实用",2018-03-05 11:02:49
1085002,5,"性价比高",2018-03-05 12:04:06
1085002,5,"质量很棒",2018-03-05 23:35:16
1085002,5,"好用～",2018-03-05 22:25:13
1085002,5,"很好",2018-03-05 12:44:15
1085002,5,"用了挺方便，看着质量也不错，",2018-03-04 15:48:12
1085002,5,"热的非常快，直发卷发两用比较方便，就是不是很好掌握温度，有一次没弄好头发都快糊了哈哈哈哈哈哈哈，还有一次把手指边烫了一下脱皮了都",2017-10-19 23:18:16
1085002,5,"珍珠白，非常有质感，直卷两用，方便快捷，比想象中大，设计科学。中短发想做内扣，但是不太会，今天再试试直发",2017-11-15 10:57:05
1085002,5,"还没用，用完来追评",2018-03-04 10:52:32
1085002,5,"不好用",2017-12-18 06:19:22
1085002,5,"不怎么伤头发，但是不会卷头发",2018-02-15 11:24:25
1085002,5,"超喜欢本身头发多洗了之后就很蓬可以拉直弄卷棒棒哒",2017-11-02 07:48:28
1085002,5,"买了两个，",2018-03-04 15:48:42
1085002,5,"喜欢  开始打扮自己",2018-03-04 21:28:19
1085002,5,"很好用。",2018-03-04 01:20:53
1085002,5,"东西还是不错的，就是有点大，不是很会用，貌似",2018-02-15 06:55:28
1085002,5,"还不错，就是女朋友不太会用，如果能有点教学就好了",2017-12-23 00:14:24
1085002,5,"还没使用，用后再追加评价",2018-03-03 17:37:35
1085002,5,"还挺大的  好用",2018-03-03 23:35:47
1085002,5,"买了三个，超好用",2018-03-03 00:53:46
1085002,5,"严选值得信奈，",2018-03-03 00:08:43
1085002,5,"很好用",2018-03-03 22:16:00
1085002,5,"好用",2018-03-03 20:32:23
1085002,5,"很实用",2018-03-03 15:25:11
1085002,5,"很好！",2018-03-03 14:04:36
1085002,5,"实用",2018-03-03 12:59:47
1085002,5,"好",2018-03-03 14:14:40
1085002,5,"好",2018-03-03 14:34:41
1085002,5,"已多次快用，洗头后自己在家弄头发，挺好的",2018-01-30 02:55:32
1085002,4,"使用效果还可以，就是有些大，出差带着不方便。",2018-02-20 18:41:34
1085002,5,"卷发的不怎么用，夹板把头发拉直经常使用，加热很快，拉直的效果也很好",2017-09-13 09:01:17
1085002,5,"还在探索中，不太好卷呀，不咋会。",2017-11-29 23:34:47
1085002,5,"质量好，有点大，还没用，先囤货",2018-03-01 20:40:33
1085002,5,"非常好用，秒加热，而且对发质没有什么损伤感觉，用起来很方便就是略有点缠绕头发的感觉不是特别的好呢。希望可以再改善一下，但是看上去很高大上",2018-02-06 00:14:00
1085002,3,"卷的时候很难打开，把头发打结的一塌糊涂，最后一剪刀剪了。",2018-01-25 13:01:37
1085002,5,"热得很快 暂时只会用来拉直 卷发的还不太会用",2017-11-27 22:41:23
1085002,5,"好东西，回来就迫不及待的打开用了，就是手比较笨，但东西很不错",2017-11-27 14:34:19
1085002,5,"用着很棒 不会烫到",2018-03-02 06:45:21
1085002,5,"严选的品质一直不让人失望，这款带梳齿，完全是手残星人的福音，直接握住也不会烫，另带夹板，功能更齐全些。两档温控，日常晨间护理和定型兼顾，总体满意，值得推荐",2018-03-02 12:27:09
1085002,5,"好用",2018-03-02 22:45:45
1085002,5,"好",2018-03-02 08:51:15
1085002,5,"长发短发，刘海发梢，卷发直发都可以弄！简直全能！",2018-02-24 09:34:33
1085002,5,"用起来特别方便，迅速就热起来了！",2018-03-01 09:26:20
1085002,5,"还好用的，不常用",2018-03-01 23:09:37
1085002,5,"很棒浇颜值也高",2018-03-01 11:14:11
1085002,5,"很好，但是还没用",2018-03-01 22:28:28
1085002,5,"非常实用",2018-03-01 16:18:13
1085002,5,"好用",2018-03-01 12:43:16
1085002,5,"不错嘞",2018-03-01 18:30:39
1085002,5,"很好用，推荐给了好闺蜜",2018-02-28 18:52:19
1085002,5,"还可以，还在探索使用方法",2018-02-28 19:56:18
1085002,5,"手感不错，相信严选的品质",2018-02-28 16:49:58
