"itemId","star","content","createTime"
1092041,3,"实话说，不知道为何好评率这么高。毛刺不少，边缘割手，特别是把手部分全都割手，抽屉顺滑度也不够，做工相当一般。",2018-05-18 07:11:18
1092041,5,"非常好",2018-03-18 23:02:56
1092041,5,"大小正好塞在角落里
设计很好",2018-03-17 20:47:47
1092041,5,"完美利用空间 无异味",2018-03-16 08:43:17
1092041,5,"第二个了 推荐",2018-03-16 08:43:39
1092041,5,"非常实用",2018-03-16 17:02:33
1092041,0,"比想象的更窄，装东西挺多，每层之间的缝隙有点大，可以拆开分层吗？",2017-02-18 23:06:15
1092041,5,"非常好用，质量上乘！",2018-03-15 08:25:49
1092041,5,"不错！",2018-03-15 21:47:17
1092041,3,"滚轮有一个变形了，整体质量一般",2018-03-20 17:50:46
1092041,5,"非常好用，还不占空间",2018-03-14 01:31:45
1092041,5,"已经是第二次购买了，很能装东西",2018-03-13 21:53:03
1092041,5,"很好用",2018-03-13 21:04:58
1092041,5,"质量不错",2018-03-13 14:17:51
1092041,0,"很不错哈哈",2017-05-18 11:34:14
1092041,5,"这个宝贝发的是德邦快递，没有走顺丰，但是也是质量挺好，没有瑕疵或者摔痕迹，宝贝安装起来非常方便，自己动手，打开抽屉稍微有点味道，散一下味道即可，还得很好的<U+0001F61C>",2017-11-07 15:27:44
1092041,0,"这么小的角落也利用起来了。不错",2017-05-17 22:54:15
1092041,0,"很喜欢 已经回购了第二个 可以很好的利用小空间",2017-05-01 11:07:47
1092041,0,"箱子特别好，刚好放在角落里，方便存取物品。",2017-05-13 18:51:30
1092041,0,"还不错，很干净。收纳好便捷",2017-05-12 21:31:38
1092041,5,"这个柜子的设计非常独特，刚刚好",2017-11-02 22:52:38
1092041,0,"很满意，完美利用，哈哈",2017-05-10 12:16:18
1092041,5,"总体满意。就是没有说明书，配的几个轮子不知在哪里安装",2017-11-03 07:59:34
1092041,5,"质量看上去不如其他收纳柜",2017-10-30 23:20:29
1092041,0,"尺寸正好 非常实用",2017-05-08 17:02:02
1092041,0,"好用，可以放很多东西",2017-05-07 19:25:36
1092041,5,"严选退换流程还是很顺畅的，不错",2017-11-03 10:28:37
1092041,5,"严选大美，好感动！收货时看箱子完整就签收了，安装脚轮时才发现，一只抽屉缺了个角儿，小郁闷。试着联络客服，很痛快的就答应给我补寄一只新的抽屉，瞬间幸福感爆棚，感动得我不要不要的。就是这样中了严选的毒，而且中毒日深。让严选毒得更猛烈些吧，哈哈。赞美严选。",2017-10-30 21:58:36
1092041,0,"完美匹配我家衣柜的缝隙。装一些袜子内衣很好用。柜子做工很好重点是没有味道。同款淘宝搜了下价格都差不多还是严选有保证哈！",2017-04-30 07:09:16
1092041,0,"空间利用率高",2017-05-05 16:18:00
1092041,0,"很结实，非常好，网易出品必属精品！",2017-05-03 23:24:54
1092041,0,"包装严实，不用我安装。只要选择安装箱脚或者轮子。安置地方超级搭！",2017-04-09 23:56:14
1092041,0,"物流速度很快，包装的很好。",2017-04-16 21:19:21
1092041,5,"收到两个抽屉都有残破。已提出替换要求。希望能妥善解决。头一次买严选的东西，希望别让我失望",2017-10-10 19:24:37
1092041,0,"确实很窄，还可以拆卸",2017-04-16 11:04:17
1092041,1,"非常差的一款产品，建议严选停售！我也算是严选的忠实用户了，从来没有见过用料和做工都那么差的严选产品，如果可以我希望给0星……",2017-10-09 18:55:37
1092041,0,"good",2017-04-16 11:41:12
1092041,0,"一直想在卫生间有个能储存卷纸的收纳柜，终于找到了，完美放下四个卷纸，就是不太好拿出来，试了放三个就容易取了，8折活动买的，性价比很高",2017-04-15 13:46:53
1092041,0,"充分利用了间隙空间～赞～",2017-04-15 13:07:35
1092041,5,"非常好。还在考虑是不是再来一单",2017-10-19 21:45:01
1092041,1,"非常不满意，质量有问题，客服说可以上门取件，等了半个月，最后也没来，最后售后订单自动取消了………",2017-10-14 18:55:20
1092041,0,"非常好用 放在书桌边上 装满了严选的零食",2017-04-12 22:54:53
1092041,0,"很棒的储物柜！",2017-04-14 09:20:54
1092041,0,"还不错呦，稍微固定下就完美啦",2017-04-09 20:26:26
1092041,0,"心仪很久啦，之前断货，现在补货了，八折优惠果断下手，我是用来放袜子等小物件的。箱子好大一个，包装精细牢固，不用自己组装挺好的，附有轮子和两个立脚，自行选择安装。",2017-04-09 20:53:00
1092041,0,"好东西，在厨房刚好塞进置物架与墙面的缝隙中",2017-03-12 12:00:41
1092041,5,"这次购物过程非常不满意，第一次收到残品，立刻联系售后退货，运费就有52元需要自己先行垫付说是会返还到现在还没有结果，运费价格高不说更换的物品有两处签字笔的印迹非常影响美观，到退换货太麻烦不想再折腾了，希望严选能把好质量关，完善售后服务系统。",2017-10-14 22:18:52
1092041,0,"收纳柜收到了，质量包装都很好放在旋转衣架边正好。物流也很负责",2017-02-18 16:57:16
1092041,0,"大小刚刚好，就像量身定做似的，柜子质量也不错，希望多出几款不同尺寸。",2017-02-13 12:37:57
1092041,5,"放在卫生间缝隙，非常棒",2017-10-27 00:10:20
1092041,0,"很经典很好用 放在马桶边 稍微长了点 储存空间足够大 以后在厨房也补一个 下面有小轮子选择安装 比较方便",2017-01-15 13:00:05
1092041,1,"这款储物柜真的一般，感觉严选再走下坡路，储物盒到处是毛刺，第一次差评！",2017-10-22 19:11:56
1092041,0,"柜子很沉，质感也很好，用来装内衣袜子很实用。分别配有滚轮和四脚底座，很贴心。",2016-12-09 22:28:39
1092041,0,"尺寸正合适！",2017-03-04 08:10:06
1092041,5,"物廉价美",2017-10-26 01:24:27
1092041,0,"这个超赞的！等待到货继续回购～～",2017-03-03 08:58:54
1092041,0,"放在角落处特别刚好，可以灵活处理空间的使用，收到收纳柜的时候特地闻了下，没什么气味。柜子很方便安装，东西不错，感觉价格略贵些，希望严选越做越好。",2017-02-25 16:24:34
1092041,0,"很棒 超级赞",2017-02-26 11:10:00
1092041,0,"真的很棒，不占空间，可以塞很多小东西！下次还买",2017-02-11 19:48:28
1092041,0,"很棒！然而就是太沾灰了。",2017-02-18 03:49:24
1092041,0,"相当完美！",2017-02-17 10:43:21
1092041,0,"稍微窄了一些，不过质量很好",2017-02-15 10:35:49
1092041,0,"非常合适。质量不错。抽屉抽拉方便。",2017-02-14 23:28:44
1092041,5,"质量超级好，摆哪里都不占地方",2017-10-31 10:06:01
1092041,0,"",2017-02-14 12:58:29
1092041,3,"应该是我在严选目前买的最让人有点失望的一件。整体还行，远观也还行。细看做工瑕疵还是有的，侧边很多明显的缝隙和黑线。抽屉还可以。尺寸跟我想放的地方还是贴合的很完美的，功能性也还不错。只是希望品质还待精益求精。",2017-10-25 07:03:15
1092041,0,"放卫生间了，质量还不错。",2017-02-13 21:33:58
1092041,0,"东西不错，比淘宝同款的便宜",2017-02-11 17:07:30
1092041,5,"没有其他用户说的的脏什么的问题，害的我收货的时候一直很忐忑。感觉还是蛮实用的",2017-10-27 14:58:31
1092041,4,"边缘稍微有一点粗糙，退换也没有意义，能用，4星吧",2017-10-20 10:55:19
1092041,0,"每个抽屉有小轮子，需要自己安装，安装後抽屉就不会被拉掉了，透明的抽屉不太大，放马桶边上大小正好。",2016-12-11 15:22:17
1092041,0,"非常好，窄小可以放进一些很难利用的空间，外观不错。板比较薄，包装太紧，开箱的时候就掰坏了一点",2016-12-11 15:22:17
1092041,0,"非常好，宽窄正好合适。",2017-02-10 15:36:29
1092041,0,"小米是为发烧而生，我是为网易而发烧，我很满意",2017-01-13 23:46:52
1092041,0,"宽度刚刚好 放放小东西很合适 估计还要再买个",2017-01-23 20:40:04
1092041,0,"不错无异味，材质不错，蛮好",2017-01-21 17:18:47
1092041,0,"整个柜子寄送过来的，棒，完美无暇",2017-01-19 18:58:38
1092041,0,"很喜欢，超赞，推荐！",2017-01-16 00:08:28
1092041,3,"味道有点冲，塑料顶板连接处有点开缝，其他还好。",2017-10-31 11:16:57
1092041,0,"质量很好，能多一些颜色选择会更好",2017-01-15 13:37:43
1092041,0,"收纳大范，分类明晰，组装方便。果断买入了！",2017-01-13 14:44:47
1092041,0,"还行，主要是喜欢这种性冷淡风。",2017-01-12 19:25:36
1092041,5,"实用，但是有两个零件怎么都找不到要安在哪？",2017-10-27 20:51:21
1092041,0,"不错，尺寸刚刚好。",2017-01-09 17:38:53
1092041,0,"不错，挺结实的。",2017-01-08 10:34:17
1092041,0,"放在书房给孩子放笔，棒棒哒！",2017-01-07 16:25:48
1092041,1,"服务太差了，现在改用其他的物流公司，小一个星期才送到。无语。不用顺丰了，您倒是说啊？",2017-10-31 15:37:15
1092041,0,"东西看着还不错，和无印良品的品质无差。",2017-01-04 20:54:02
1092041,0,"蛮好哒",2017-01-05 23:11:03
1092041,0,"夹缝中求生存！给力的收纳",2017-01-04 21:04:38
1092041,3,"最近无论买啥，发货都很慢！是生意太好了吗？再这样我只能和严选88了",2017-10-30 18:38:21
1092041,0,"很好",2017-01-01 13:42:35
1092041,0,"好实用，点赞严选",2016-12-29 23:45:21
1092041,0,"好大一个箱子，做工很好，夹缝中使用非常实用。",2016-12-23 21:00:42
1092041,5,"感觉有些太窄了 放东西不是很方便 不过可能有些人需要",2017-11-04 13:00:24
1092041,0,"质量很好！",2016-12-19 01:02:17
1092041,0,"大小尺寸正合适，质量很好！",2016-12-16 14:24:38
1092041,0,"非常适合分类放置内衣内裤、袜子等",2016-12-15 21:58:02
1092041,0,"真的是刚刚好！很能装的一个小柜子",2016-12-14 19:06:24
1092041,5,"好窄的一个～不过最下面那层有点容易断开",2017-10-27 22:05:48
1092041,1,"粗糙粗糙，建议做得精致些，怕丝袜刮花，只好贴上胶纸",2017-11-04 11:19:57
1092041,0,"一体化设计，材质放心了，想自由组合加高两层有点困难。",2016-12-13 15:56:02
1092041,0,"放在洗手间刚刚好！",2016-12-14 09:31:21
1092041,0,"很好，材料硬着。快递员很到位！谢谢",2016-12-13 11:19:27
1092041,0,"很好用～质量不错，容量也非常大",2016-12-13 13:01:59
1092041,5,"味道好大 宽一点会更好",2017-10-29 13:11:47
1092041,0,"只需要安装底座或滑轮，材质好，抽屉还有拉手，不知道是否能多套自由组合，放在冰箱旁边，上方还可以叠加上去。要是能像天马收纳箱那样自由叠加就好了。家居情况不同需求也不同。",2016-12-13 15:48:04
1092041,0,"漂亮，小巧，非常好！",2016-12-12 22:03:53
1092041,0,"不占地的收纳柜，把儿子散在飘窗上的玩具碎都收进去了，飘窗瞬间清爽了！活动期间还送重力感应笔和荧光笔，性价比太高了！",2016-12-11 15:26:33
1092041,0,"自己动手拆了一层正好",2016-12-11 12:07:34
1092041,0,"很实用！",2016-12-11 12:35:49
1092041,0,"完美！",2016-12-09 17:44:32
1092041,0,"刚刚好，很合适！",2016-12-04 13:47:26
1092041,3,"有很多瑕疵，缝隙处都有脏脏的污渍，有的接缝处不严实，抽屉有变形，怀疑是别人退换的，客服说是仓库保管问题，重点是不支持上门取件退换货，以前是可以的，我不知道严选为何取消这项服务，如果是为了降低退换货的量，那目的确实是达到了，这样的大件商品寄回很麻烦，家人签收后拆了包装盒快递员直接把盒子收走了，且不说自行寄回垫付运费这件事，就严选以优惠券形式返还运费就相当不合理，沟通后客服说可以帮我特殊申请现金返还，客服的态度尚可，是严选的服务质量下降了，对于大件商品我很在意能不能上门取件退换，毕竟是商品质量问题，这次很失望，以后再买要考虑各种后果了",2018-02-02 20:55:47
1092041,0,"很不错哦！",2016-11-30 15:08:48
1092041,2,"刚买完就下架了，收到货有果然有种被坑的感觉<U+0001F602><U+0001F602><U+0001F602>算是在网易买过最差的吧…",2017-11-29 17:11:18
1092041,5,"尺寸非常适合小户型的缝隙和角落，防潮而且上面还可以搁物品。喜欢",2017-11-05 11:42:56
1092041,5,"质量很好，包装非常的严实，而且物流直接到家门口，实在是太棒啦！严选总是能给你惊喜！",2018-02-28 15:27:13
1092041,5,"质量不错，放在书桌旁正好，就是附加的那些脚还是啥没什么用？整体来说是满意的",2018-03-12 08:30:29
1092041,5,"下面的大格子放孩子的绘本书正好，上面的适合放小物，主要想床头放孩子的书方便晚上讲故事",2018-02-12 13:41:08
1092041,4,"给家人买的缝隙柜，正好放在洗衣机边上，可以放些杂物，上面三层是比较浅的，最下一层比较深。柜子看上去很窄但也能放不少东西，作为收纳还是不错的，底座需要自己安装。",2017-11-27 20:52:16
1092041,5,"本想放卫生间，但它太瘦。把它塞在冰箱边上，位置正好。现在放厨房的各种零碎。",2018-01-21 16:52:25
1092041,5,"很好用，装的东西很多，合理，我是放衣柜里放内裤和袜子等的，整洁。",2018-02-11 08:55:46
1092041,5,"质量不错，安装方便。本来想放在浴室，但是被小朋友抢去放她的玩具了，大小正合适",2018-02-03 17:01:11
1092041,5,"很好用，质量很好，很喜欢。以前用的架子是开放式的很容易脏，换成这个很好打理。",2017-11-27 14:47:43
1092041,5,"大小正合适，正好我买了好多洗化用品没地方放全放进去了，还挺能装的",2017-11-27 19:04:14
1092041,5,"很好很好很好很好很好很好很好很好很好很好很好很好",2017-11-15 10:53:24
1092041,5,"和黑凤梨系列收纳抽屉组合与我家衣柜完美契合，上面几层拿来放内衣裤和袜子，下面放杂物，相当不错。",2017-11-15 19:49:45
1092041,5,"这个盒子可以放很多东西，我两个40L箱子的护肤品全部能放进去，神奇了………………又不占地方 很棒",2017-12-08 08:49:57
1092041,5,"大致看了一下没大毛病，不是这边屋子里用，放过去看看合适不合适。看这柜子塑料材质还可以。",2017-11-16 21:43:38
1092041,5,"此次活动以独特秀秀次一次分析印度土地和嘻嘻嘻火车票惧怕距离凑凑凑次吃",2017-11-04 14:04:03
1092041,5,"爱丽丝也有差不多的款，目前还没找到合适的缝隙塞，做工啥的都不错，抽屉抽拉也很顺畅。",2017-10-24 07:28:43
1092041,5,"质量不错，就是小了点，能稍微宽点就更好了，大桶洗衣液放不下。",2017-11-14 17:43:05
1092041,1,"质量糙而且多处赃迹，还有抽屉损坏缺角，退回货物只退回了商品钱，邮费以返券的形式一直没有给，和客服沟通了两次，就是等待，10月2日退货寄回到现在11月3号了。买到残次品还得继续等。",2017-11-03 19:03:18
1092041,3,"这个材质一般。虽然有保丽龙包装，但是运到还是发现边角碎了。温州产的，质量还是不行，和日本的差距明显。模具，材料，做工，都差一个档次。客观说，设计不错，但质量问题导致这是一个不成功的产品。",2017-10-31 15:47:01
1092041,1,"缝隙很大，结构松，品质感低",2017-11-17 00:12:38
1092041,5,"比想象的小好多，很窄，绝对能放进各种缝隙里。一包抽纸的宽度，要是有五层的就更好了",2017-11-16 23:05:14
1092041,5,"种草很久的款，这回总算收了。放厨房，收纳杂物，感觉厨房环境整洁顺心多了",2017-11-16 19:22:56
1092041,5,"相信严选<U+0001F44D><U+0001F44D><U+0001F44D>下面最大的格子放一袋5kg的米不成问题。",2017-11-11 14:14:35
1092041,5,"已经是第二次购买了，赶上有500-100的活动，买了三个，不占地方节省空间，正好放在家里每一个门背后，尺寸正好。很满意，质量也不错。",2018-03-02 23:48:01
1092041,5,"实用，宽度挺合适，放在床和窗台的缝隙，而且储物空间还不小，没有味道，挺好的",2017-10-13 08:26:39
1092041,5,"这是我最喜欢的一件收纳，哇哈哈，底部可以不用支架，用轮子，设计想法不错，赞",2017-10-13 13:09:28
1092041,5,"熟料胶，承重好。比淘宝便宜一点，就是到货后有点味道，毛巾擦擦就好。",2018-02-27 10:27:19
1092041,5,"正好适合我家冰箱边的缝隙，买两个放下正好，高度也合适，比外面买还便宜",2017-11-07 08:14:08
1092041,5,"东西收到以后马上查看，发现与图片描述一致，超级喜欢，卖家发货速度很快，，服务也很到位，给老板点个赞，下次还会来购买.........",2018-01-11 13:05:59
1092041,3,"拆开后，发现这个最底下的抽屉裂了。<U+0001F643>可以换这个最底层的抽屉不？",2017-11-02 11:57:50
1092041,5,"收纳柜质量非常好，很实用，放在书桌边上装杂物，瞬间感觉整齐了很多。另外，快递包装也很好！",2017-08-30 15:50:59
1092041,5,"看起来瘦瘦的，可是容量很大哦～把桌面乱七八糟的小东西都收起来了～",2017-11-27 21:43:11
1092041,5,"产地温州。 从杭州买了个自家出产的产品。好好笑。 挺好的说",2017-12-25 17:05:37
1092041,5,"老爸说这个不错，可以在屋子里很多空间内搭配使用",2018-02-24 18:49:45
1092041,5,"不用安装真是省心，就是箱子里面为了防撞垫了泡沫板有大有小不规整显得比较low",2018-01-28 12:14:33
1092041,5,"很方便安装，底下可以装上轮子也可以安装固定的脚，小小的可以往缝隙中塞，提高空间利用率。",2018-03-04 18:49:47
1092041,5,"买来就用了，容量也还算大，嗯嗯，好吧，主要是家里杂物也是真的很多",2017-08-23 09:59:05
1092041,5,"拿来收纳的，正好放在房间一个空位上，很合适，拿来装宝宝的一些日用品",2017-11-14 13:56:22
1092041,5,"真的超级实用，节省空间，小零件全部放进去了，正好放在把角儿处，不占地儿！超级喜欢！严选棒棒的！<U+0001F44D>",2017-09-21 22:02:00
1092041,5,"这个非常好用，很紧俏呢！想再补仓一个发现没有啦<U+0001F604>",2017-12-31 15:25:52
1092041,5,"刚好放在缝隙中",2018-03-12 23:17:03
1092041,5,"很好用，很能装",2018-03-11 23:42:53
1092041,5,"大小刚合适",2018-03-11 08:24:33
1092041,5,"整体不错",2018-03-11 22:40:22
1092041,5,"不错",2018-03-11 11:17:23
1092041,5,"看着小，非常能装啊。没有塑料味儿，严选的东西，放心！",2018-02-19 10:06:12
1092041,5,"质量很好，好评！",2018-03-10 16:26:48
1092041,5,"非常适合",2018-03-10 07:12:46
1092041,5,"很好",2018-03-09 12:08:00
1092041,5,"真的很好用，体积小，却能放很多小东西",2018-03-03 01:39:31
1092041,5,"宽度刚合适 手感扎实 看着也不土 很好",2018-03-03 15:16:10
1092041,5,"质量不好非常失望",2017-11-06 15:34:52
1092041,5,"不错，包装仔细严密，货品质量很好",2018-03-08 22:08:04
1092041,5,"非常合适",2018-03-08 08:45:21
1092041,5,"很好",2018-03-08 06:49:04
1092041,5,"不错(*<U+0E53>′ts`<U+0E53>)<U+2661>",2018-03-06 18:57:09
1092041,5,"给儿子买的 很实用",2018-03-06 13:07:24
1092041,5,"非常好，正好放在冰箱旁",2018-03-06 18:51:12
1092041,5,"好评",2018-03-06 22:11:18
1092041,5,"好",2018-03-06 12:51:49
1092041,5,"储物功能上大却又很节省空间，不错",2018-03-03 04:12:11
1092041,5,"这是我最满意的一件产品，质量不错，不是地摊货的那种塑料，快递也很给力，最主要的是尺寸适合我家！",2017-10-01 14:10:47
1092041,5,"不错，狭小空间可以利用起来",2018-03-04 13:07:29
1092041,4,"加上支架就不能加滚轮 质量也就是还行 没有想象中的好",2018-03-07 21:22:47
1092041,5,"放在洗手间非常完美。",2018-03-04 21:55:51
1092041,5,"收纳非常好",2018-03-04 18:19:24
1092041,5,"质量不错的",2018-03-04 09:49:00
1092041,5,"完美",2018-03-04 13:34:34
1092041,5,"很方便的收纳柜，但是还要宽点就好了",2018-02-26 17:36:40
1092041,5,"棒棒哒 节约空间的神器啊。",2018-03-03 23:41:27
1092041,1,"第一次在严选买东西，买了1000多了收纳箱子，这个柜子是我最不满意的一个。柜子本身是4层拼接起来的，包装没有问题，打开一看箱子是脏的，疑似二手。缝隙感人。最不可思议的是吹的“食品级塑料”，里面一堆黑色不明杂质镶嵌在材料中间，呵呵你不会对我说这是故意添加的纹理效果吧？",2018-03-02 14:36:11
1092041,5,"小柜子特别好 容量大 就是发票要快点寄到啊！15-30个工作日有点久",2017-11-05 18:42:09
1092041,5,"质量好，省空间",2018-03-03 09:29:50
1092041,5,"不错哦",2018-03-03 15:20:15
1092041,5,"很不错",2018-03-03 19:44:06
1092041,5,"尺寸合适",2018-03-03 19:34:13
1092041,1,"整整一个多月，拖延耍赖就是不补发，口口声声说“已经通知仓库呢”跟放屁一样。",2018-03-09 07:37:38
1092041,5,"方便使用，节省空间，设计大气",2018-03-02 01:46:31
1092041,5,"很好",2018-03-02 11:44:46
1092041,5,"还可以，小了些",2018-03-01 16:07:50
1092041,4,"质量还行就是感觉有点小宽度再大一点就好了手机盒子正好卡上抽屉材质还可以在好点。。。德邦速度太慢了建议别用了。。来之前也没联系好在家里有人",2018-03-03 18:02:17
1092041,5,"非常好，很实用",2018-03-01 15:50:27
1092041,5,"不错不错 小小的",2018-03-01 23:29:24
1092041,5,"很棒",2018-03-01 16:07:48
1092041,5,"非常满意",2018-03-01 11:02:32
1092041,5,"非常实用",2018-03-01 17:24:07
1092041,5,"好的",2018-03-01 14:04:26
1092041,5,"好",2018-03-01 16:48:34
1092041,5,"这个实用性非常好，放背心袜子小件衣服很合适，也不占地方～",2018-01-11 15:46:08
1092041,5,"质量不错，而且已经组装好了，省事省力！",2018-02-28 21:47:07
1092041,5,"用起来了，感觉挺好，就是不知道有4个大一点的塑料轱辂怎么用找不到安装的地方。希望能告之。",2018-03-03 00:11:51
1092041,5,"还不错，比想象中的好些，就是门如果封闭性再好些就好了",2017-10-30 23:17:55
1092041,5,"严选的质量还是值得信赖！而且价格很实惠！比其他牌子同款便宜很多！",2017-10-30 13:14:51
1092041,5,"质量没的说啊哈哈哈",2018-02-28 15:05:24
1092041,5,"小巧实用",2018-02-28 22:20:05
1092041,5,"不错",2018-02-28 21:19:23
1092041,5,"不错",2018-02-28 19:49:53
1092041,5,"好",2018-02-28 17:33:40
1092041,5,"质量超级好，每天必要看下单",2018-02-27 09:54:53
1092041,5,"很实用，可以把零碎的杂物都放进去，家里变得整洁多了！",2017-12-19 23:10:31
1092041,5,"东西不错",2018-02-27 09:12:08
1092041,5,"很实用，在角落里放，充分利用空间",2018-02-26 14:13:40
1092041,5,"非常满意！实用性很强！",2018-02-26 02:27:15
1092041,4,"整体质量不错。",2018-02-26 23:12:57
1092041,5,"下架一段时间 终于等到上架 果断买了",2018-02-19 21:59:24
1092041,5,"这个东西比想象中的矮，但是装东西还是很多的，没味道，放心把保健品和药品放里面！",2017-08-08 16:51:29
1092041,5,"赞赞赞 很实用",2018-02-24 14:40:25
1092041,5,"比较实用",2018-02-23 22:19:55
1092041,5,"很好",2018-02-23 11:38:56
1092041,5,"质量杠杠滴",2018-02-22 00:36:24
1092041,5,"小贵",2018-02-22 10:54:13
1092041,5,"收纳小能手，一万个赞",2018-02-21 09:20:26
1092041,5,"质量不错，大小合适",2018-02-21 21:23:33
1092041,5,"很好用",2018-02-21 11:17:44
1092041,3,"柜子从最底层上缘齐齐的断掉了，估计是暴力运输的原因。这款柜子本身是很好用的，这是第二个。过年期间退换货相当麻烦，没办法，只能勉强用了。",2018-02-23 18:14:30
1092041,5,"好用啊 超级实用 爸妈都说好 收纳必备",2018-02-15 00:38:55
1092041,5,"用了30元券，比我之前在某宝上买的便宜了几十元，质量也好。",2017-10-24 12:31:54
1092041,5,"很好啊，比tb上都便宜，就是用大箱子包b有c心疼那。",2017-11-06 09:52:19
1092041,5,"好买了两个放在洗衣机的两边当支腿上面放块木板方便实用非常满意",2017-09-28 19:16:50
1092041,5,"塞在小缝缝里很好，拉出来也很方便。",2018-02-08 14:41:27
1092041,5,"配送速度真是]v！！！但凡肋x有的|西F在都不去淘了！！！肋x加油！！！",2017-08-03 11:46:23
1092041,5,"回购",2018-02-17 13:46:02
1092041,5,"非常好<U+0001F44D>第一次买。感觉非常好用",2018-02-15 23:58:00
1092041,5,"很不错的一个ξ锕瘢放在洗衣机和墙壁的夹缝中，可以Ψ藕芏喽西。包装和物流也很满意。",2017-07-27 18:00:54
1092041,5,"质感不错，尺寸也刚刚好，适合塞在冰箱缝隙里",2018-02-10 16:00:39
1092041,3,"最下面抽屉有点点开缝，不影响使用，收下吧，省得麻烦",2017-11-06 14:55:35
1092041,5,"这是家里买的第二个了，充分利用小空间，在卫生间装宝宝的东西很好。",2017-10-20 19:42:59
1092041,5,"好用，",2018-02-15 19:00:37
1092041,5,"给女儿买的，她非常满意",2018-02-14 18:52:50
1092041,5,"哈哈哈哈哈哈哈哈哈哈哈哈哈哈哈
没",2018-02-14 20:48:49
1092041,5,"好",2018-02-14 19:11:22
