"itemId","star","content","createTime"
1097013,5,"没有什么比看着自己的新家逐渐呈现自己想要的样子更美好了。这件五斗柜，简约实用，百搭各种装修风格。",2018-06-17 14:34:35
1097013,5,"实木原木的，没有问到，比市场的便宜，但是质量很好，跟家里面风格挺搭配的！很满意",2018-05-10 14:03:46
1097013,5,"特别棒，和家里的家具都特别搭！！！一直收藏了好久，终于出手了！",2018-07-03 10:58:11
1097013,5,"",2018-08-06 11:47:16
1097013,5,"老妈很喜欢那就够了",2018-08-04 12:34:10
1097013,5,"斗柜很好看，是实木，因装修未完，等装修完了补发照片",2018-07-14 16:53:39
1097013,5,"|量很好，f搭a品有值",2018-07-01 20:18:07
1097013,5,"东西很不错。性价比会比二黑木作这些高一点。适合我这样穷人",2018-04-14 20:41:19
1097013,5,"木质密实，纹理清晰，抽屉面的木质颜色有点不同。",2018-06-21 15:08:45
1097013,5,"柜子不错，第二次购买了。实木的用着放心。",2018-04-28 13:45:28
1097013,5,"圆润光滑 木质细腻 没有味道 五斗柜是卧室最实用的所在",2018-04-18 07:35:01
1097013,5,"挺好看的，跟家里的风格也很搭配",2018-04-21 12:12:12
1097013,5,"柜子不错，淡淡的木香味，家里全套严选家具",2018-04-14 21:09:06
1097013,5,"还在散味中",2018-04-09 09:50:42
1097013,5,"木柜运过来只要安装四个角，运动安装人员专业快速，服务热情，喜欢那种淡淡的原木味道！推荐购买",2018-03-11 19:19:20
1097013,5,"很少这么认真评价，主要中了网易的毒太深，柜不错，送货到家同步安装，满意。",2018-01-10 18:49:25
1097013,5,"质量很好，细节很到位。严选的忠粉，每日必看！棒级了！期待严选一直保持下去",2018-01-05 07:42:57
1097013,5,"品质一贯，风格简洁大方，冷淡风满满，先透透气，应该会成为房间的不可缺的部分",2018-01-02 17:49:01
1097013,5,"评价晚了，柜子太好了，实木环保，整体还美观，和家里风格很搭配！",2018-06-18 10:36:44
1097013,5,"第一次在网上购买这样的家具大件，非常满意。家里目之所及，眼之所处都是严选！希望之后能推迟家具的套餐，这样整体的风格就通一了",2018-07-29 22:12:36
1097013,5,"好评666",2018-08-02 22:52:02
1097013,5,"好看吗。",2018-03-12 10:32:42
1097013,5,"买了第二个了，好看实用",2018-03-10 09:17:00
1097013,5,"快凑齐了，哈哈哈哈",2018-03-09 17:53:11
1097013,5,"实木的，品质有保证，还有专门的售后人员打电话，已中毒",2018-01-12 13:13:44
1097013,5,"非常棒，很喜欢，对于严选已经中毒，非常喜欢这种冷淡风格的东西，已经买了很多严选的东西，也给别人安利了严选，之前是三石的考拉重视粉丝，现在又成了严选的粉丝",2018-02-16 01:18:53
1097013,5,"东西是相当的不错。。。有需要的活动价入手还是能接受的。。",2017-12-24 20:26:55
1097013,5,"买了一套原素系列，满意",2018-01-24 19:52:13
1097013,5,"",2018-01-11 09:53:05
1097013,5,"总体来说东西不错，价格也还算公道，安装的工人说这个价格不贵。",2017-10-16 09:52:13
1097013,5,"非常满意，中了严选的毒了，希望有更多的好产品",2017-12-11 17:24:38
1097013,5,"总体来说满意，犹豫纯木，难免有瘤疤，中间抽屉上有一点，到不影响，更真实。",2017-08-03 11:42:02
1097013,5,"很好。确实不错。",2018-01-02 22:34:21
1097013,5,"第二次购买了，还是不错的。滑道做工稍次一些。",2017-12-18 19:03:51
1097013,5,"很实用的五斗柜，快递师傅很给力，服务很好，非常感谢严选",2017-11-12 11:45:58
1097013,5,"做工还可以",2017-12-03 20:38:22
1097013,5,"很漂亮，实木气息",2017-12-02 17:35:23
1097013,5,"很好",2017-11-28 10:04:07
1097013,5,"",2017-11-19 21:54:36
1097013,5,"",2017-11-15 10:46:53
1097013,5,"卧室都是严选这个系列，很不错，简简单单，很喜欢",2017-11-08 09:24:46
1097013,5,"非常棒 性价比很高",2017-11-12 21:50:43
1097013,5,"非常实用",2017-11-08 21:15:53
1097013,5,"很满意，全实木，有点气味晒几天应该没事的。是我在严选买的最喜欢东西",2018-07-30 09:14:59
1097013,5,"",2017-11-08 20:51:20
1097013,5,"美如画！",2017-10-29 14:47:47
1097013,5,"还可以 看起来挺有质感的",2017-10-31 19:03:02
1097013,5,"非常好看 师傅很给力 台风天照常送货安装 很感动",2017-10-15 18:50:46
1097013,0,"东西非常好，只是安装工人素质太差，安装偷工减料，弹垫没装进去，害我拆下来又装一遍",2017-05-23 19:04:16
1097013,5,"质量不错，桌角可以再厚实一点，还有抽屉最好升级为不容易直接抽出来的就好了。性价比已经很好了",2018-08-18 16:18:02
1097013,1,"还没正式使用，买回来一直在散味。然而最近发现合不进去了，考虑是天气原因热胀冷缩导致板材变形了。。一起购买的床头柜开合没问题",2018-07-09 17:02:46
1097013,5,"实木品质，尺寸合适，实用，小清新的原木色，需要晾味现在味道已经很小了",2018-06-17 15:44:38
1097013,1,"做工粗糙，抽屉沟槽毛刺掉木屑，很担心抽屉用不了多久。",2018-08-12 17:21:28
1097013,5,"设计风格简约 材质光滑细腻 原木色百搭 信赖严选！",2017-10-15 23:44:17
1097013,5,"商品质量好，德邦家装师傅服务态度也特别好，非常满意…",2017-09-20 17:40:04
1097013,3,"四月份买的柜子，五月份就发现侧面主板变形了，经过多次协商才达成换货的协定，结果六月了还没解决，一直强调要先取走再发货，也不知道是什么鬼流程。对严选及其失望，本来是个忠实粉，现在我觉得质量和售后都堪忧！！！再看了看其他有问题的评价，我更担心了！换了以后会不会再有问题！我想说客服你再不尽快给我解决，抽屉就要开始脱离轨道了！！！",2018-06-17 17:48:09
1097013,5,"质量很好 德邦家装服务态度特别好。",2017-09-20 16:10:19
1097013,5,"做工不错，很满意。",2017-09-07 23:13:08
1097013,5,"非常非常漂亮，木纹质感很好，看中很久一直在它和MUJI中纠结，MUJI的更中规中矩一点，适合纯日式风，这款有点设计感，北欧日式都能搭，算很出彩的单品。",2017-09-04 13:28:16
1097013,1,"系统默认好评",2018-08-11 01:55:45
1097013,5,"蛮好的，不比Muji差，很喜欢",2017-08-27 15:47:38
1097013,5,"一直用到现在才评论，感觉很好",2018-08-13 14:11:37
1097013,4,"整体效果不错，但是实际容量没有外观大。抽屉不适合放多或者重的东西，没有滚轮轨道，所以推拉不方便，推拉不方便，推拉不方便。是实木，很重。挪动不方便。以上不足，都靠颜值填平了。就这样吧，如果后期产品优化的时候，可以考虑优化推拉结构。",2018-06-17 21:50:12
1097013,5,"做工精致，木质材料感觉也不错，和新家很配哦",2018-07-31 11:28:32
1097013,5,"不错的柜子",2018-08-07 10:15:25
1097013,5,"中严选的毒了，好的生活品质选严选，只有木头味，无异味!",2018-05-16 20:59:06
1097013,0,"还没来得及买装置品，但是已经很好看了，品质蛮好的",2017-07-17 20:50:17
1097013,5,"很喜欢 送货安装师傅很负责",2018-08-01 07:20:22
1097013,5,"样子不错，全实木！就是漆味大得放一段时间",2017-08-15 17:31:15
1097013,5,"期盼之中，终于等到了心爱的东东，谢谢!",2018-07-22 12:24:13
1097013,5,"质量很好，满意，还要买一个",2018-07-20 23:28:32
1097013,4,"颜值不错，简约有质感，就是味道比较大",2017-08-07 23:02:14
1097013,5,"漂亮！是我的菜！北欧风，实木，做工精细，大爱！",2018-07-02 06:25:39
1097013,5,"好",2018-07-08 14:41:29
1097013,5,"非常棒，连挑剔的老人都说好，全实木，清水漆，基本没味道！样式也好看！",2018-04-20 10:07:55
1097013,5,"样子很漂亮，价格合适，就是味道很大，散了很长时间，抽屉打开还是有味道",2018-07-07 09:41:44
1097013,5,"这柜子不错嗯，物有所值，用料啊，还有做工都不错",2018-06-24 07:32:56
1097013,5,"五斗柜做工不错 原木色也很好看 就是小贵",2018-06-24 00:18:52
1097013,5,"材质好 性价比高 味道不大",2018-07-02 22:40:10
1097013,5,"达到想象的效果，后期上图",2018-07-02 17:40:06
1097013,5,"材质不错，外形也好，特别赞~",2018-06-24 22:06:57
1097013,5,"货真价实",2018-06-18 12:40:34
1097013,5,"好好好好好好好好好",2018-06-15 12:09:30
1097013,5,"颜色有点深",2018-06-14 10:24:33
1097013,4,"性价比高",2018-06-12 21:18:03
1097013,0,"安装很容易，挺大的。",2017-07-16 19:37:30
1097013,5,"柜子很好，超乎我的预期，就是抽屉底板感觉有点薄啊，按下去晃晃的",2018-04-25 16:11:18
1097013,2,"油漆非常薄，方块橡皮在上面，两天后拿掉会粘下一块漆。",2018-05-12 15:09:44
1097013,5,"其他都很好，就是抽屉的推拉和传统的带五金件的不同，没有那么顺滑。",2018-04-20 17:29:47
1097013,1,"不知道各位是否能有幸看到我的亲测，本人是v5会员（一年内做到的），可见曾经也是严选中毒患者。但是就近几个月使用这款五斗柜的体验和售后给的维修建议来看，不敢说以后不在严选买东西，但至少不会像从前那样百分百放心和信任了。说会这款柜子，去年四月购入，12月投入使用，今年3月倒数第一个抽屉开始出现难以拉动（字数限制接图片）",2018-06-08 21:32:38
1097013,0,"比较划算 有点气味",2017-07-15 15:26:26
1097013,2,"买回来将近半年了  味道依然超级重。",2018-05-15 15:05:48
1097013,5,"品质保证！",2018-06-05 12:24:18
1097013,5,"特别好",2018-05-29 00:31:12
1097013,5,"收到货了，还没打开",2018-05-11 06:54:17
1097013,5,"好的呢",2018-05-11 14:29:18
1097013,1,"这一次非常不好的购物体验，非常不好。
1、买了个五斗橱，下单后很久不发货，你这边刚刚撤消订单，那边马上来电话，说进入发货程序了，拒绝撤消。怎么就这么碰巧？
2、货到物流点后，也收到了带货安装的短信，按给的联系电话打给安装师傅，拒接，第一天就这么过去了。第二天早上接着打，接了，说是下午来安装。中午再次确认，如下午来安装。",2018-05-30 21:39:24
1097013,0,"再配一副油画，艺术成分就很高了。",2017-06-24 12:21:24
1097013,5,"不错啊。有点日系，就是里面的木条有点软。",2018-04-15 16:25:12
1097013,5,"柜子很好，味道不重，样子简约大方，很满意。唯一不太好的就是物流，从青岛到包头中间发错了，去了武汉，用了半个多月才送到。",2018-04-26 17:32:33
1097013,0,"颜色很正，质量看着还不错，下午刚到货有一点油漆味儿，比较满意",2017-05-01 20:31:20
1097013,5,"很好，全实木很喜欢<U+0001F495>",2018-05-08 17:39:25
1097013,5,"开心。收到货",2018-05-07 12:41:17
1097013,0,"斗柜不错 准备再楼下房间里面再买几个",2017-06-21 17:47:56
1097013,5,"抽屉的底板薄了点，都不敢用力塞衣服。",2018-04-22 15:20:33
1097013,5,"师傅安装送货还是很麻利。柜子的抽屉底板感觉还是挺单薄的，其他还好，有点味道，散了3天差不多了。这个价格还是满意的。",2018-04-21 10:39:56
1097013,0,"还可以",2017-06-21 17:52:51
1097013,5,"实用",2018-04-29 10:43:04
1097013,5,"柜子是纯实木的，现在很多号称实木家居的背板不是实木。做工很精细，把手、边角都很到位。安装很快，其实都安装好了，只是四个腿没装，10分钟就能解决问题。",2018-04-22 10:01:56
1097013,5,"这个柜子能用五十年！",2018-04-26 08:14:29
1097013,5,"比较满意",2018-04-26 15:30:08
1097013,5,"好极了",2018-04-26 13:47:19
1097013,5,"不错",2018-04-26 00:01:29
1097013,5,"实物和图片一样美观大方，大件的运输安装严选一直在努力做到让客户满意，刚开始看了一些评价有些担心安装和运输的问题，最近购买了几次都很满意，今天的德邦物流师傅说光这个五斗橱商家总的要付给德邦大概600元的送货安装费，他说德邦是物流中最贵的，贵有贵的道理，两个师傅抬到楼上拆箱加安装，还帮我们清理包装物，给严选点赞，一如既往支持严选！期待严选推出更多新品！",2018-03-30 20:36:53
1097013,5,"很好",2018-04-23 19:34:01
1097013,5,"质量可靠，颜值高大，若是背板能再加厚一点就好了！",2018-03-19 08:26:18
1097013,5,"不错，很结实，味道也不大，先放两天再用",2018-04-18 12:22:55
1097013,5,"物超所值，赞",2018-04-22 13:28:19
1097013,5,"被好多人夸，俺娘看了也想买个，哈哈，非常成功~~",2018-03-17 11:05:33
1097013,5,"实木很赞",2018-04-20 11:41:56
1097013,5,"性价比高，材料实在",2018-04-19 22:51:57
1097013,5,"柜子没有味道，不错",2018-04-10 12:20:17
1097013,4,"质量不错，但是味道很重，只能放在入户花园透透气，不敢放房间里面～～～",2018-04-27 13:24:36
1097013,5,"还不错，挺稳实的，就是颜色比图片的要深一些",2018-04-18 08:33:48
1097013,5,"可以",2018-04-08 13:59:53
1097013,5,"还蛮不错的。",2018-04-05 14:55:56
1097013,5,"很好很漂亮，一次买了俩！",2018-04-03 10:17:05
1097013,5,"买给爸妈用的，很棒啊，送货上门安装很方便，但是没有提供固定到墙上的服务，这样会不会被小孩爬得侧翻不安全？",2018-04-13 09:46:05
1097013,5,"味道有点重 希望过一段很快散味 隔板比较薄 外观还是很美的",2018-04-03 23:45:45
1097013,5,"很不错，有颜值有质量",2018-04-01 13:21:47
1097013,0,"简约、素雅的感觉，很喜欢<U+0001F618>
物流以及安装都很贴心",2017-05-13 09:53:13
1097013,3,"一开始发来的货有问题，老板主动给我换了个，3月26日下单，到4月14号完成。总体可以。",2018-04-14 17:07:27
1097013,5,"配件没一起发来，等",2018-03-26 14:16:16
1097013,5,"安装几天后才来评价的，斗柜颜值高，全部是实木，外板的木纹很漂亮。顶部四角圆弧设计防碰撞，抽屉外板和两边木板的镶嵌设计更喜欢，斗柜的味道是木材本身味道，抽屉不打开时味道很小，打开才有木材味道。活动价买性价比更高，总之很喜欢这款斗柜，看着就很开心，推荐大家购买。",2018-04-04 12:59:42
1097013,5,"这个东东很不错哦，值得购买。拖着都是好的",2018-03-20 00:29:57
1097013,5,"很好",2018-03-26 09:44:45
1097013,5,"质量还是听不错的，也有颜值。尺寸刚刚好",2018-03-17 20:39:36
1097013,5,"深信严选，不管是什么都让我放心。只要有需求。来严选就肯定没错。压根就不会有逛某宝的担忧。就是说这个价格的东西绝对超值",2018-03-14 02:01:28
1097013,5,"很能装的五斗柜，放在卧室里很合适。",2018-03-15 16:55:29
1097013,0,"性价比还行",2017-04-24 20:27:13
1097013,5,"不错，就是这次德邦物流太慢了！",2018-03-07 21:32:05
1097013,0,"很好，值",2017-04-17 17:44:55
1097013,4,"北欧风，五个大抽屉装日常穿的各种衣服刚好。柜子顶上有一个小划痕，应该是出库的时候不小心划伤的。",2018-03-25 12:20:02
1097013,0,"真心好看，素雅，实在，哈哈哈",2017-03-23 23:05:15
1097013,4,"有一个角块被钉子弄坏，售后说补寄一块木头维修。售后态度ok。",2018-03-21 16:25:54
1097013,5,"还不错",2018-03-25 11:38:46
1097013,0,"哈哈哈，挺好。家人说质量不错。我还没看到 照片还行",2017-01-06 21:40:22
1097013,0,"有点味道…木头很扎实…安装服务也不错…喜欢",2017-01-04 22:18:16
1097013,5,"气味严重，天猫同价位差不多的产品，要求高的人不建议买",2018-03-25 09:08:43
1097013,5,"质量很好！",2018-03-12 17:17:30
1097013,5,"很厚实。没什么味道",2018-03-09 09:11:06
1097013,5,"不错",2018-03-06 18:18:55
1097013,5,"做工精致物流也很快",2018-03-05 18:16:30
1097013,5,"质量很好",2018-03-03 15:36:32
1097013,5,"还行",2018-02-27 15:29:18
1097013,5,"和图片一样 很好看",2018-02-21 08:36:32
1097013,5,"很好很满意",2018-02-17 11:55:44
1097013,5,"非常喜欢",2018-02-16 19:00:21
1097013,5,"颜值高，老婆很喜欢，搞活动时七折买的",2018-02-14 07:34:23
1097013,5,"非常喜欢",2018-02-12 10:12:54
1097013,5,"好看，好用，实惠！",2018-02-05 12:42:02
1097013,5,"一如既往的好质量。",2018-02-04 21:59:25
1097013,5,"还可以，比较嫩。",2018-01-28 11:59:21
1097013,5,"款式和做工均不错 物流配送到户很方便 活动价购买也比较实惠 推荐！",2017-10-29 13:08:18
1097013,5,"不错，实木的，抽屉里面最好用橡木的，桐木太软了",2017-12-25 15:48:53
1097013,5,"总体满意，如果抽屉底板再结实点就更好了",2018-01-16 23:04:37
1097013,5,"很不错的家具",2018-01-15 00:04:05
1097013,5,"感谢丁磊严选加油",2018-01-14 09:39:15
1097013,5,"比较不错",2018-01-13 19:29:58
1097013,5,"柜子挺有品味的，质量好，味道不大，晾了一周后使用",2018-01-20 22:02:49
1097013,5,"非常愉快的购买，比我想像的还要好。从严选上线来，一直不停的买买买，我应该是最忠实的买家了",2017-09-14 11:17:29
1097013,5,"柜子真的好，已经买第二个了",2018-01-06 00:24:01
1097013,5,"送货上门带安装，很方便，服务好。柜子没异味。还可以",2017-12-31 14:19:22
1097013,5,"非常不错，感谢丁三十",2018-01-04 09:59:55
1097013,5,"实木，漂亮",2018-01-04 15:23:24
1097013,5,"严选的一贯风格，颜值高，简洁大方，非常满意！",2018-01-02 20:39:52
1097013,4,"有点小细节毛病 不过整体还可以",2018-01-08 12:45:39
1097013,5,"很美丽",2018-01-01 16:33:32
1097013,5,"柜子丰常好，喜欢。",2017-12-31 14:25:24
1097013,5,"非常满意！",2017-12-25 00:32:24
1097013,5,"做工挺扎实的。性价比好",2017-12-22 07:40:37
1097013,5,"卧室都是严选这个系列的，挺好的，适合喜欢简简单单的人，严选物品都很好，总忍不住买买买，售后有进步的空间哦^_^",2017-11-08 09:22:07
1097013,4,"整体一般。",2017-12-20 12:14:00
1097013,5,"跟左边实体店买的柜子质量差不多，更喜欢图三的这个细节，图二左上角有一块漆没上好，今天家具美容师傅上门补了，虽然不尽完美，但不细看是发现不了了。

整体值。",2017-12-22 00:38:04
1097013,5,"整体可以，就是色泽这块…尤其第一个抽屉，不过实木也可以接受这样的色泽。",2017-12-16 18:51:12
1097013,5,"还可以",2017-12-18 10:40:07
1097013,1,"发过来是破的 单号数据也错误 一直没有更新状态信息 然后拒收直接退回 现在依然迟迟未给出答复 换货信息也看不到 客服后台只会说给仓库确认 请耐心等待 听一遍还行 问了10次 每次都是耐心等待 然后没有留言 没有电话回访 骂娘的心都有了 宁波人丁磊真给老家人民丢脸了！这点你还真不如Jack Ma了！",2018-01-02 21:57:00
1097013,5,"实木的，非常漂亮",2017-12-17 10:15:15
1097013,5,"品质好 实木",2017-12-17 07:14:46
1097013,5,"还没拆包",2017-12-15 12:00:36
1097013,5,"挺好的",2017-12-15 12:21:56
1097013,5,"很好",2017-12-12 16:38:33
1097013,5,"看师傅送货过来直接拆包装就OK了，说是整装，还真是第一次听说，放到阳台散味了两天，其实气味也不大，品质用送货师傅的话讲整装的品质都比较好，我倒觉得是严选的产品可以放心品质，没有毛疵，也没有钉什么的，抽屉的设计非常棒，可以抽出来也不用担心整个抽屉在使用的过程中滑出，上图吧，说不清楚，看的明白！",2017-12-27 01:08:02
1097013,5,"不错 基本没味道",2017-12-10 12:26:42
1097013,5,"等了一个星期到的，不错",2017-12-18 18:19:41
1097013,5,"很好，很满意！",2017-12-08 17:42:24
1097013,5,"柜子质量挺好的 ，不过少了颗螺钉 联系客服很快答应补发 也是很不错咯",2017-12-21 14:22:13
1097013,5,"可以",2017-12-04 14:27:07
1097013,5,"不错",2017-12-04 23:02:21
1097013,5,"挺方便的",2017-12-02 09:37:46
1097013,5,"信任严选",2017-11-29 09:43:59
1097013,5,"质量非常好，很漂亮，家人很喜欢",2017-11-28 16:04:46
1097013,5,"分量很重，用料十足，没有味道，和图片效果一致",2017-11-20 11:33:47
1097013,5,"一般",2017-11-22 22:25:09
1097013,5,"很漂亮，值得入手",2017-11-19 14:56:56
1097013,5,"还不错。",2017-11-19 10:25:15
1097013,5,"很好",2017-11-19 17:06:05
1097013,5,"6",2017-11-19 21:38:55
1097013,5,"不错",2017-11-19 08:47:49
1097013,5,"质量不错，有无印良品的范儿。",2017-11-11 10:29:02
1097013,5,"不错",2017-11-09 21:15:29
1097013,5,"还行吧，一分价钱一分货",2017-11-08 19:32:33
1097013,5,"不错，性价比比较高，和我家里其他橡木家具的颜色差不多",2017-10-13 20:05:56
1097013,5,"非常环保，没味道，，对于过敏性鼻炎的人是最好的福音",2017-10-22 22:28:30
1097013,5,"好看实用质量好啊",2017-11-06 18:50:42
1097013,5,"不错，目前没有发现问题",2017-11-06 15:38:05
1097013,5,"与描述一致，好看，喜欢",2017-07-31 14:57:55
1097013,5,"很不错 好评好评！",2017-11-05 19:18:27
1097013,5,"符合预期。",2017-07-31 23:44:39
1097013,5,"很好很强大很好很强大很好很强大很好很强大很好很强大很好很强大很好很强大很好很强大很好很强大很好很强大很好很强大很好很强大很好很强大很好很强大很好很强大很好很强大很好很强大",2017-11-05 14:11:36
1097013,3,"细节做工不行，抽屉板太软不结实，一按都吱吱响，味道也重。",2017-08-27 10:17:30
1097013,5,"质量很好",2017-11-03 15:42:51
1097013,0,"原木，唉，难免有瑕疵，跟客服微信咨询后，如果退，下一个还不知咋样了，去去吧，朋友们，如果这款原木<U+0001F236><U+FE0F>介意色差的，就不要选择了",2017-09-18 11:55:55
1097013,5,"非常好",2017-10-31 10:03:09
1097013,1,"柜子左边直接坏的，不知道咋回事有裂缝，骗着签收后，不管拿走，让直接找客服",2017-11-05 19:19:50
1097013,5,"看着还不错",2017-10-24 14:47:30
1097013,2,"非常不满意的是价格体系，太乱了，一天一个价格，购买时候，价格是2299，没过几天，2159，申请了一次差价补偿，再过几天，价格1899，喂严选咱们能不能有点价格诚信啊！怎么可以这样啊！产品木有什么问题，功能也是强大，容纳量高！就是价格乱的让人无语啊！",2017-10-28 16:02:01
1097013,5,"有木头的质感。做工精细",2017-10-20 14:18:41
1097013,5,"非常好，颜色与商家图片有差异，实物发黄一些深一些，到总的来说不错",2017-09-22 04:55:44
1097013,5,"可以，德邦送货安装一条龙",2017-10-19 23:14:56
1097013,4,"不错。就是派送时间派了3天。质量骄好",2017-09-26 19:11:25
1097013,0,"质量不错颜值高",2017-10-19 12:54:59
1097013,5,"少许色差，在可接受范围。柜子味道有些大，需要放一放通风透气。抽屉轨道毛糙，打磨不够好。设计和外观都ok",2017-10-16 13:03:16
1097013,5,"喜欢的",2017-10-15 17:30:52
1097013,3,"面板有裂纹，要换一个抽屉还得先把旧的寄回去，嫌麻烦。有些漆的味道",2017-10-23 22:58:03
1097013,5,"安装快速，实木质量很好，还有一股木头的天然香味，很喜欢！",2017-09-17 08:10:03
1097013,5,"跟我家电视柜一个颜色，有一点点味道，仔细闻可以闻到木头的味道，大小刚好",2017-11-16 15:18:28
1097013,5,"好看，功能很强",2017-10-01 00:39:55
1097013,5,"整体感觉不错。有几个小疤结，在接受范围内。有点味道放在阳台散味。另外抽屉底板和背板较薄。",2017-08-30 14:49:30
1097013,5,"在一起的时候真的好幸福呢！你说",2017-09-30 00:28:52
1097013,3,"第一二层和第三四层有明显色差，外贴皮底下有点翘起，整体颜值还不错",2017-11-19 22:43:58
1097013,5,"不错",2017-09-26 22:31:55
1097013,5,"放东西底板太薄了，一按感觉会断",2017-12-05 12:37:00
1097013,5,"手感不错",2017-09-25 19:35:10
1097013,2,"色差严重，比图片上的颜色深很多，还有味道。退货客服说色差不属于质量问题要自己负担五六百的运费，对色差介意的慎买，退货很麻烦！",2017-11-19 15:01:42
1097013,5,"实物与图片一致很满意。",2017-09-20 14:49:10
1097013,5,"整体柜很不错，抽屉打开还有点味道，先散几天",2017-11-17 19:28:41
1097013,5,"没有比五斗橱更好用的家具啦！",2017-09-16 00:36:25
1097013,5,"有个抽屉两边的挡木坏两半了，应该不是很好的木料，好在是在里边的，后来经过和售后充分沟通，售后又寄了一块挡木，自己动手装上了，还有就是上边四个抽屉面板的颜色与第五个抽屉面板颜色色差有点大，但总体来说还不错。",2017-11-25 12:22:21
1097013,5,"价格实惠，做工好，抽屉顺滑，很好，很好。",2017-09-12 16:12:46
1097013,5,"外观满意。抽屉轨道是木抽，不是五金，缝隙有点大。",2017-11-09 17:27:02
1097013,5,"不错",2017-09-12 14:02:29
1097013,0,"订购1个多月才来货，送来的货又不对版，差评",2017-01-05 22:54:55
1097013,5,"物流不如上次给力",2017-09-07 09:17:03
1097013,5,"有香味，有油漆味，不是特别浓，放阳台去味儿。挺好一家具",2017-08-29 15:39:35
1097013,5,"好",2017-09-02 20:55:13
1097013,0,"味道大，做工一般。",2017-01-11 00:07:41
