"itemId","star","content","createTime"
1108007,5,"出气快而稳，一壶水可以熨3件衣服，安全又放心，手感比较重。线短了点。网易还是值得信赖的。",2018-07-29 23:15:36
1108007,5,"第一次用洗碗皂，出乎意料的好用哎，起泡多，去油污清洁力也好，团购好划算。",2018-06-06 10:04:23
1108007,5,"心仪很久，终于下手，用来清洗洗碗巾，洗碗巾干净了，才能洗干净碗，薄荷清香，无添加质地，用起来很放心",2018-07-05 08:23:04
1108007,5,"还不错",2018-08-01 19:49:58
1108007,5,"这款皂确实是非常不错，问起来有一股非常清心的味道，不过洗起东西来貌似没有那么有效，用皂也确实没有洗洁精方便，貌似是一种“文艺”的方法，应该适合不经常做饭的人用吧",2018-05-23 20:03:28
1108007,5,"这个还没用不知道如何，但是觉得这个肯定不伤手，试试吧，总要尝试新的东西",2018-07-02 13:25:22
1108007,5,"这个肥皂以前买过，非常喜欢。我是用来洗抹布的，效果特好。就是19.9才一块，实在是太贵了。",2018-06-24 11:58:48
1108007,5,"超好的，一入严门深似海，这是第一单，后来一发不可收拾啊，我中了严选的毒",2018-05-12 04:34:39
1108007,5,"家里洗洁精还没用完 等用完了再试试看，第一次买洗碗皂，很期待效果",2018-05-18 10:13:18
1108007,5,"从来没有用过这么好的 去油很棒棒   值得买 我又买了五块准备送给家人",2018-04-26 10:06:21
1108007,5,"严选的东西太好了，洗碗皂薄荷味，好香，太喜欢了，物流也好快！以后买东西就上严选！",2018-04-11 14:15:19
1108007,5,"宝贝收到，包装完好，味道好闻，以后洗碗不怕伤手了而且洗的碗也环保，值得购买。",2018-04-05 18:07:10
1108007,5,"快递超级给力晚上买的第二天上午就到了 棒棒哒<U+0001F38A><U+0001F37E><U+FE0F>还没开始用 期待",2018-03-20 13:01:28
1108007,5,"用后才来说的，是日常必备的好东西，确实好用，喜欢飘着的淡淡的茶味儿和薄荷味儿。严选我喜欢。",2018-04-20 22:56:29
1108007,5,"刚收到货，还没用，但是相信严选的品质，不过看页面介绍真以为是三块18.9元，没记得让我选择数量，一直以为是三块呢<U+0001F62D>",2018-08-21 22:27:31
1108007,5,"迫不及待拆开包裹，看着不错啊!很自然很舒服的感觉!必须马上试试，呵呵<U+0001F60A>",2018-04-10 22:00:55
1108007,5,"这个真心不错，气味芬芳，洗的也干净，很好！觉得比洗洁精要好很多，比较环保吧，植物提取，这样餐具用起来也很放心！",2018-05-15 15:53:59
1108007,5,"味道很好闻的薄荷味，清洁能力没有洗洁精强，但是用的放心很喜欢",2018-05-17 20:17:53
1108007,5,"第一次使用洗碗皂，很好用，味道不错，洗碗很干净",2018-08-09 12:33:23
1108007,5,"专门使用过才来评价的。味道好闻而且清新。还不伤水。",2018-07-06 23:07:00
1108007,5,"",2018-08-15 00:11:22
1108007,5,"朋友强烈推荐这款洗碗皂，说非常好用！",2018-08-10 12:36:58
1108007,5,"试试这个，看好用不好用",2018-08-09 12:04:10
1108007,5,"第二次够买了，洗碗洗锅，很好用。",2018-08-06 08:10:01
1108007,5,"一口气买了好几块，送人了几块，好东西大家一起分享哦。不错，喜欢。",2018-06-18 09:51:39
1108007,5,"还不错哦！网易严选值得信赖！",2018-07-25 13:00:47
1108007,5,"多次购买这个洗碗皂用来给洗杯子",2018-07-22 20:48:03
1108007,5,"非常好用，这次第二次买，一下子买了4套，送给姐姐哥哥们，颜值高！质量好！超级喜欢！",2018-04-10 22:16:36
1108007,5,"特别好用，之前下架了，幸好又重新上架了，以后还会回购的",2018-04-10 11:15:28
1108007,5,"很好用的洗碗皂，生产日期比较新。",2018-07-18 23:35:15
1108007,5,"还没用，用后再评吧，严选满意率很高啊",2018-07-04 17:57:08
1108007,5,"用起来还不错喔，再给妈妈买一块",2018-07-18 14:26:48
1108007,5,"人在国外 买了好多东西 我是有多相信严选啊 使用后在评价",2018-04-06 03:47:50
1108007,5,"看着还是不错的 查了一下成分都是纯天然植物的 相信严选的品质",2018-04-05 13:53:18
1108007,5,"耳机很棒，音效听起来简直让人窒息般的好！哈哈，一用严选就中毒！",2018-04-04 10:48:24
1108007,5,"刚刚收到  还没有使用  外包装不错 用过再评价",2018-07-06 09:48:51
1108007,5,"用了一段时间才来评价，使用方便，去污力强，不伤手，非常满意！",2018-04-17 19:54:11
1108007,5,"好用再买",2018-07-03 09:50:35
1108007,5,"好用的，没有洗洁精方便，到时这个安全放心",2018-06-30 09:20:17
1108007,5,"这个皂特别好用，非常棒！无数次回购",2018-06-30 20:24:31
1108007,5,"超级无敌满意，去污去渍去油能力真的超赞，飘着淡淡的茶味和薄荷味，忍不住为它打电话，就是吧，有点小贵",2018-04-16 20:13:57
1108007,5,"挺好用的，相信严选健康性价比高。不过现在没有以前便宜啦。",2018-04-09 16:18:32
1108007,5,"加购价买的 还没用 包装很好 最近在严选买了很多",2018-04-09 12:41:18
1108007,5,"好用，很好用",2018-06-24 12:29:43
1108007,5,"特别喜欢非常好用，严选的质量真的太好了，爱上严选了，谢谢严选，之后还会继续支持，买买买，已经推荐给很多朋友了，朋友都很喜欢，可能以后家里的东西都要在严选买了，很齐全，东西也都很好吃，很高级",2018-06-17 15:29:43
1108007,5,"刷碗皂相当好用 之前买了 今天有补货了  去污能力很强  有一种特殊的味道  自从用了以后 厨房再也没有异味了",2018-04-28 09:36:43
1108007,5,"很棒，洗碗非常干净，而且味道很香，有一股淡淡的薄荷气味，非常满意！",2018-04-11 21:54:20
1108007,5,"一如既往的好，先前下架还有些惋惜，重新上架后先囤货起。",2018-03-17 20:29:04
1108007,5,"好闻，很有份量！一块重重的(安全感Max
应该能用很久吧(像我这种不爱洗碗的人……
     

  ――认定网易严选<U+2764>",2018-04-06 18:54:19
1108007,5,"去油能力挺强的，使用方便。没有奇怪的味道。感觉挺健康。",2018-04-29 07:54:52
1108007,5,"真不错，感觉安心，安全，放心！！！！健康！！！！还会再来的！！！！！",2018-05-15 10:42:09
1108007,4,"收到宝贝，就用来洗碗，非常好用，只是宝贝生产日期是去年7月10日，但产品保质期2年；心里有点不舒服<U+0001F62D>，之前这个产品断货过，等待已久的宝贝是去年",2018-05-17 13:47:47
1108007,5,"特意使用数周后才来评价，确实是很环保的产品，搭配同样环保好用的竹纤维洗碗布很好用，本人最讨厌那些有残留的产品，这款不错!感觉现在快要中严选的毒了，有买中好几款产品，加油严选，继续支持中",2018-05-17 10:14:21
1108007,5,"薄荷淡香，不错！",2018-05-15 23:15:25
1108007,5,"",2018-05-07 15:32:35
1108007,5,"这个拼邮的太超值了，1块钱还发顺丰，意外惊喜啊！",2018-04-13 18:19:25
1108007,5,"还没用，心里有点激动",2018-05-06 15:26:01
1108007,5,"一直买，但是现在好像买不到了。",2018-05-05 22:23:59
1108007,5,"用来去油洗碗效果真的挺好，用海绵擦上一点，很爱起沫，还不伤手。新手拼团购买的，合1元包邮，真的很实惠。",2018-04-15 12:28:23
1108007,5,"去油力很好，健康放心。",2018-05-03 07:14:25
1108007,5,"清新自然的精油味道，厨房里的又一个宝贝成员，稀饭稀饭**",2018-04-07 14:27:03
1108007,5,"茶籽薄荷味很浓，相信洗干净碗后，手留余香！",2018-04-06 11:44:41
1108007,5,"洗碗皂还没用，不过味道还不错。",2018-04-26 22:44:13
1108007,5,"确实很好用，油快很香不伤手，好",2018-04-18 20:54:05
1108007,5,"好用，味道好闻。",2018-04-24 22:40:18
1108007,5,"还没用，看着不错，用后再来评价",2018-04-22 07:56:50
1108007,5,"昨天下单今天就到了，浓郁薄荷香味，迫不及待要用了。",2018-04-09 15:25:37
1108007,5,"非常好用。还要回购",2018-04-22 10:52:53
1108007,5,"很好用！喜欢！",2018-04-21 08:43:53
1108007,5,"加购的，不错！好用！薄荷味，凉凉的味道！",2018-04-17 22:52:32
1108007,5,"还没用，味道很好闻，应该不会让我失望",2018-04-13 20:40:35
1108007,5,"很好的，用着方便，去油能力一般",2018-04-19 12:05:35
1108007,5,"以前买茶籽粉用很不错，现在有了皂更方便",2018-04-05 09:26:59
1108007,5,"香味和感觉都不错，还没有使用，期待好用。",2018-04-16 18:32:35
1108007,5,"很好，很清新，有股冰棒的味道！",2018-04-17 10:27:48
1108007,5,"气味芬芳，手感极好，尤物",2018-04-17 06:23:41
1108007,5,"喜欢",2018-04-17 12:19:28
1108007,5,"好用，好闻，好冲洗",2018-04-16 19:03:08
1108007,5,"准备试用，被介绍吸引",2018-04-16 14:26:25
1108007,5,"这个厨房皂买了N多快了，非常好用",2018-04-12 06:45:35
1108007,5,"图片是很大的肥皂，其实不然哦⊙<U+2200>⊙！",2018-04-14 20:48:55
1108007,5,"看起来还不错哦，挺漂亮的，还没用，期待使用效果",2018-04-08 09:41:18
1108007,5,"货真价实，照片跟实物相符 ，物流服务好，又一次愉快的购物。",2018-04-08 16:14:35
1108007,5,"快递员很可爱，态度很棒，东西也很好。",2018-04-13 15:35:36
1108007,5,"薄荷味道清新自然～",2018-04-14 09:43:22
1108007,5,"宝宝蛮好，快递服务态度很好送货上门。",2018-04-13 14:04:41
1108007,5,"味道清淡，去污效果不错。比洗洁精好清洗，感觉健康很多。",2018-03-22 18:22:52
1108007,5,"还没用小小一块看着挺舒服",2018-04-13 09:37:25
1108007,5,"洗碗非常的干净非常好用",2018-04-13 22:04:24
1108007,5,"闻着蛮香，还没用",2018-04-13 19:23:31
1108007,5,"挺好，物流很快。",2018-04-13 16:14:06
1108007,5,"还没用，期待",2018-04-13 15:18:43
1108007,5,"已买n次。",2018-04-13 09:01:35
1108007,5,"好用啊",2018-04-13 22:51:42
1108007,5,"",2018-04-13 14:45:42
1108007,5,"",2018-04-13 23:12:38
1108007,5,"很好，还没来得及用。相信严选的品质。很好，还没来得及用。相信严选的品质。很好，还没来得及用。相信严选的品质。很好，还没来得及用。相信严选的品质。",2018-04-09 00:05:38
1108007,5,"看中它可以洗瓜果",2018-04-12 14:17:14
1108007,5,"包装很好。",2018-04-12 11:33:02
1108007,5,"好闻！",2018-04-12 12:19:57
1108007,5,"好用",2018-04-12 15:32:22
1108007,5,"据说环保<U+267B><U+FE0F>无害，所以想试下
有待验证",2018-04-08 06:10:11
1108007,5,"外观包装不错，没使用不知道效果如何。",2018-04-11 21:35:11
1108007,5,"不知道效果怎么样，晚上洗碗看看",2018-04-11 19:20:39
1108007,5,"棒！还买",2018-04-11 14:14:11
1108007,5,"包装好，实物与图片相符，非常满意",2018-04-10 17:36:03
1108007,5,"味道好好闻，还没有用，",2018-04-10 19:05:31
1108007,5,"太黏，老是掰不开",2018-08-09 00:17:03
1108007,5,"信任严选，就是完完全全的",2018-04-09 12:53:30
1108007,5,"包装高大上，味道棒棒哒，期待效果～",2018-04-09 15:39:44
1108007,5,"宝贝超值总之就是棒棒棒",2018-04-09 12:44:48
1108007,5,"质量超好，物流也给力，",2018-04-09 17:20:01
1108007,5,"好用",2018-04-09 16:34:52
1108007,5,"比用洗洁精健康，洗碗布也可以拿这个来洗，挺好",2018-08-22 13:41:04
1108007,5,"无限回购的，中毒产品",2018-04-08 16:12:44
1108007,5,"看着挺复古的",2018-04-08 21:35:50
1108007,5,"感觉擦油烟很好用！",2018-07-24 23:30:43
1108007,5,"很满意",2018-04-08 13:51:27
1108007,1,"洗碗不好用，不分解油，冲碗的水上面漂的都是油，",2018-08-09 10:19:01
1108007,5,"很好用的洗碗皂，很好的价位。",2018-04-06 19:01:13
1108007,5,"很好用的洗碗皂，很好的价位。",2018-04-06 18:59:06
1108007,5,"昨天收到，仔细看了一下配方，比较放心了。试了一下，感觉洗的挺干净的，但是那个香味留在餐具上的感觉不好。",2018-07-05 17:13:48
1108007,5,"味道跟口香糖一个味，还没用，看着不错！",2018-04-07 22:26:37
1108007,5,"买的洗碗皂～不知道好不好用～",2018-04-05 19:55:43
1108007,5,"还没用，换购9.9，相信不错",2018-04-06 12:06:29
1108007,5,"包装精美好用，东西厚实不错，和洗涤灵说拜拜",2018-04-04 17:56:11
1108007,5,"好用，怎么不中奖啊大哥别浪费我时间",2018-06-29 09:49:30
1108007,5,"淡淡的香，闻上去很舒服",2018-04-05 21:21:02
1108007,5,"看了评论说好用买的 很神奇了 本来以为洗不干净 结果不锈钢的餐具洗的发亮 喜欢",2018-06-29 12:05:09
1108007,5,"很好闻的洗碗皂",2018-04-04 07:55:17
1108007,5,"没用，相信严选",2018-04-04 21:22:36
1108007,5,"香香的  很浓郁的薄荷味道",2018-04-03 10:40:39
1108007,5,"好",2018-04-03 11:19:11
1108007,5,"第一次用。但是用了以后会爱上介款洗碗皂，泡泡丰富，很容易气泡，清洁力度也很棒，除异味很棒，会回购",2018-06-29 08:15:25
1108007,5,"第一次用味道不错",2018-04-02 19:06:04
1108007,5,"感觉很天然很环保。先试一下看看效果如何～",2018-03-31 00:01:48
1108007,5,"很好用的洗碗皂，已买n次，囤货中。",2018-03-19 15:06:28
1108007,5,"很好用的洗碗皂，买上瘾了。",2018-03-31 09:58:32
1108007,5,"物流很快，包装很好，配了一个很大的盒子",2018-03-23 11:56:48
1108007,5,"洗的很干净，而且不伤手。",2018-03-30 20:34:16
1108007,5,"挺耐用的，也能洗干净油。因为没办法检测，所以不能多说别的。",2018-06-18 13:46:23
1108007,5,"去油效果真心不错",2018-03-30 02:21:23
1108007,5,"包装不错，待使用效果～",2018-03-30 16:18:11
1108007,5,"一块肥皂搞得像啥一样，高端大气上档次的样子",2018-03-22 01:13:08
1108007,5,"好用！",2018-03-28 15:22:23
1108007,5,"还行吧，清凉的味道，环保纯天然，就是不太好冲洗，用热水洗碗还可以。",2018-05-19 14:03:14
1108007,5,"一如既往的支持严选",2018-03-26 11:28:03
1108007,5,"不错，很清爽的感觉，感觉更想洗脸<U+0001F604>",2018-03-21 08:23:28
1108007,4,"太油的还是洗不干净，去油方面不如洗洁精",2018-05-17 18:05:07
1108007,5,"这是我购买网易严选货品以来包装最烂的一次  送人的茶盒子被压歪了 而且里面的一块洗碗皂居然被拆开了  好糟心",2018-05-18 22:10:21
1108007,5,"好用，买的很便宜",2018-03-23 07:58:30
1108007,5,"味道好闻，包装一如既往地喜欢！",2018-03-22 17:39:40
1108007,5,"不太好用",2018-05-17 19:14:43
1108007,5,"几天时间，买了好几堆！哈哈哈！不错！",2018-03-22 13:03:58
1108007,5,"很好用，已经回购好几次了～",2018-03-21 06:21:48
1108007,5,"包装严实，香味浓郁，舍不得使用。",2018-03-19 08:55:22
1108007,5,"很好用的货品，马上分享了。",2017-09-09 14:31:41
1108007,5,"挺耐用的，一块可以用好久",2018-05-08 06:54:42
1108007,4,"① 去油效果简直了，瞬间去油
② 味道比较浓
③ 相对来说还算耐用吧",2018-02-26 22:30:32
1108007,5,"洗完皂去油污很好，还易清洗干净，我用来洗擦油污的抹布，洗得很干净！",2018-06-25 18:29:46
1108007,5,"感觉不错，有点凉凉的薄荷味，之前都是用婆婆给的安利，但是不觉得不伤手啊……希望这个管用。",2018-02-11 13:44:28
1108007,4,"一次买了六块洗碗皂，洗碗用了五次，个人觉得清洁效果可以，再用用。",2018-03-12 12:47:33
1108007,5,"一直再购买严选物品没停过，这次买了这款床上用品，好看而且面料柔软．以后继续．",2018-01-07 16:48:51
1108007,4,"洗碗感觉不是很方便，洗手还行",2018-05-16 21:31:26
1108007,5,"淡淡的香味，就是去污能力一般",2018-05-01 14:06:22
1108007,5,"很不错，特别是接触肉之后用来洗手，洗的特别干净，不像洗洁精洗完之后还是油腻腻的",2017-12-18 19:59:38
1108007,5,"洗涤效果一般般",2018-04-25 14:43:59
1108007,5,"买了个皂托配在一起用，一般洗饭碗或者是蒸、煮菜之类油水少的还是可以哒，味道清新，不伤手；但炒菜类油水大的清洁力不够，还是要靠洗洁精。",2018-04-25 14:50:58
1108007,5,"很大一块，买给婆婆的，她说用起来感觉不错，比洗洁剂好，不是很伤手",2017-11-07 20:53:45
1108007,5,"两个包装盒都自然开了，到是省的动手拆了，东西还没用，用后在来追",2017-11-21 12:01:32
1108007,5,"诚信",2018-04-21 10:15:33
1108007,5,"京东物流快递，服务态度很好！速度快！希望能保护老婆的双手！给老婆最好的疼爱！",2017-11-18 12:31:16
1108007,5,"出乎意料的好，泡沫丰富，气味清凉。又补货5件，准备送给亲戚朋友",2018-07-20 04:25:50
1108007,5,"第二次购买啦，很好用哦。拿来洗各种杯子和宝宝的辅食用具。这次第二件半价，所以买两块<U+0001F604>",2017-09-22 10:14:21
1108007,5,"超级好，我还洗了几个李子吃，完美，我爱严选啊！停不下来，爱恨交织！",2017-10-16 18:01:37
1108007,5,"第二次买了非常好用，放在厨房洗碗洗手都好，淡淡的味道喜欢。",2018-06-02 18:29:13
1108007,5,"第一次在严选购物，顺丰快递，所有东西都非常满意，质感，颜值，实用性都很好，会继续买买买",2017-08-30 10:35:56
1108007,5,"5号下单的货，14号才收到，出货太慢了，很失望",2018-04-16 22:11:20
1108007,5,"还没用 应该还不错 是薄荷叶的味道 不是什么薄荷味 真的薄荷的感觉",2017-09-29 11:32:38
1108007,5,"收到宝贝感觉很兴奋，薄荷叶很浓，真的很喜欢这个味道，不过去污去油效果怎么样还不清楚，因为还没用呢<U+0001F60A>",2017-12-15 19:53:19
1108007,5,"评价有礼，10字好评，好评好评",2018-03-09 16:59:56
1108007,5,"这个好用，之前用的都是茶籽粉，看到严选做成肥皂还犹豫肥皂怎么洗碗，买回来以后发现肥皂和洗碗布配合刚刚好呀，很方便。
日常洗手也用这块，薄荷香很好闻。",2018-06-17 10:49:44
1108007,5,"这个皂不用多说了，用过都知道。去油，好冲洗，不伤手，还有很自然的味道。",2017-08-14 10:50:06
1108007,5,"这个皂真的好用！特别容易清洗干净，无残留的感觉！比洗洁精好太多了，又买了两块，一块给妈妈，一块屯着！",2018-04-17 08:56:36
1108007,5,"味道不错，但是，肥皂洗碗还是不太方便，我用来洗手了",2018-04-17 13:59:27
1108007,5,"洗碗和洗手都好用，不伤手，味道好闻。",2018-02-20 11:33:31
1108007,0,"非常好，以前一直在用茶籽粉，这个皂加了薄荷味道很赞，用起来又方便",2017-08-22 18:21:14
1108007,4,"洗不是很油的还可以，锅啥的清洁力就不太够。所以相对来说不那么伤手。",2018-04-16 09:25:21
1108007,5,"第一次用这种洗碗皂，薄荷香味很好闻，我用它来洗手去油污，去油效果很好，还有余香，希望严选能经常推出这种独特风格的东西。",2018-01-18 21:39:46
1108007,5,"东西不错，日常售价有点贵，只能在做活动的时候买，，感谢现在严选东西越来越多了，不知道好不好",2018-08-19 13:24:33
1108007,5,"第二次购买，洗的很干净,重要的是重要的是洗完手上没什么感觉，很舒服，而且去油能力也不错",2018-08-19 10:36:00
1108007,5,"谁会选用呢？肯定是家庭主妇。去油腻特别有效，据说不伤手。这是最有吸引力的。试试吧。",2018-08-17 01:19:43
1108007,5,"还没用，希望不错",2018-02-20 08:50:39
1108007,5,"质量好！非常非常赞！",2018-02-19 21:21:46
1108007,5,"好用，耐用，去油污效果不错，而且无异味",2018-02-15 11:49:03
1108007,5,"还没用，总觉得是用来洗衣服的。",2018-02-13 22:07:28
1108007,5,"洗碗必备良品，不过洗碗还是用洗洁精方便。不过网易严选的东西精致度是高的。",2017-08-01 21:53:38
1108007,5,"现在买什么东西都是先到严选上看，严选上有的就不在别的地方买了",2018-08-22 14:07:33
1108007,5,"闻着很清香 但愿好用",2018-02-13 19:55:34
1108007,5,"",2018-02-11 04:55:57
1108007,5,"",2018-02-10 11:22:25
1108007,5,"这个皂不好用",2018-04-13 22:37:02
1108007,5,"很好用 味道好",2018-02-09 10:36:31
1108007,5,"主要是用于洗擦碗布，以前都不知道该用什么来洗擦碗布，现在好了，非常好。",2018-08-03 21:57:49
1108007,5,"味道不错，就是泡沫不太丰富，需要不停用",2018-04-15 07:25:17
1108007,5,"今天才用，觉得还不错比较像肥皂！",2018-02-04 21:23:44
1108007,5,"很好",2018-02-01 08:19:56
1108007,5,"买了好几样东西，中了严选的毒，迷上严选了。洗碗皂好用，气味芬香，下次还会买",2018-08-03 21:51:47
1108007,5,"买三块了",2018-05-12 12:10:48
1108007,5,"很好用。",2018-01-23 00:06:32
1108007,5,"",2018-01-22 18:13:19
1108007,5,"味儿挺刺鼻的，不知道用起来怎么样",2018-04-13 19:49:04
1108007,5,"有了严选就变成败家娘们了，哎，啥都想买",2018-04-12 18:13:56
1108007,5,"送礼物用的，盒子很不错。味道也好，很期待。",2018-01-19 18:50:35
1108007,5,"用了一次，好像也不是太去油啊",2018-04-13 00:13:49
1108007,5,"非常环保，喜欢。",2018-01-21 19:00:03
1108007,5,"活动价买的，用着不错的。",2018-01-20 23:02:40
1108007,5,"第一次在网易严选上购物！很开心！很赞！",2018-01-15 20:35:42
1108007,5,"囤货",2018-01-15 09:56:47
1108007,4,"味道好闻 但去油能力一般 不如小苏打好用",2018-04-12 14:28:55
1108007,5,"洗碗用了，泡沫不多但去油污效果不错，挺好。",2017-12-28 21:47:17
1108007,0,"我是第一次严选购物，收到第一时间试用，立刻被洗碗皂圈粉了，推荐给家里很多亲戚，洗洁精扔了。",2017-07-12 16:40:19
1108007,5,"挺小一块",2018-04-13 11:25:16
1108007,5,"洗碗皂还没用，感觉不错",2018-01-12 18:11:22
1108007,5,"老妈说超好用，就又买了好几块",2018-01-08 20:41:14
1108007,5,"妈妈用着不伤手，真贴心",2018-01-10 17:16:51
1108007,5,"味道不错，应该好用",2018-01-10 10:43:29
1108007,5,"很精致的东西，家里越来越多网易严选的东西",2018-01-06 15:30:31
1108007,4,"一入严选深似海，从此攒钱是路人。我们的口号是：种草~吃土~买买买~",2018-08-19 19:38:51
1108007,5,"第二次买洗碗皂了～特棒！很好用！值得购买，下次还来，五分！",2017-10-14 13:20:30
1108007,5,"凑单买的，还没有用",2018-01-07 14:51:22
1108007,2,"去污力很一般。",2018-04-11 20:14:32
1108007,5,"",2018-01-07 16:05:47
1108007,5,"淡淡的薄荷香，好舒服。很大的一块，网易的皂盒显得太小了哦，哈哈",2017-08-27 11:43:55
1108007,5,"味道很好，但不知要怎么用",2018-04-09 23:10:10
1108007,5,"没用过洗碗皂，试试看",2018-01-06 14:40:31
1108007,5,"冬天不行，皂体发硬不起泡。天热还是很好用的，比洗洁精好用。就是天冷了就得放弃",2018-04-11 19:43:48
1108007,5,"第二次买，去油去污，味道特别好闻，赞",2018-01-03 18:29:04
1108007,5,"第一次用，效果好，不过算起成本来比洗洁精贵好多。",2018-04-10 22:52:53
1108007,5,"不错，比洗洁精要好，居家必备良器！",2018-01-05 22:21:50
1108007,5,"非常惊喜，抹点在洗碗海绵上，能揉出很多泡沫，洗的很干净也很放心",2018-07-21 10:49:49
1108007,5,"前段时间下架了，现在又上架了，赶紧囤货，很好用，就是小贵，希望多做活动。",2018-06-26 13:53:20
1108007,5,"很好很好",2018-01-03 13:01:55
1108007,5,"纯天然，用着放心，还有薄荷的清香，<U+0001F44D>",2018-01-01 14:05:24
1108007,5,"东西质量不错，合用，推荐！",2018-01-02 14:30:58
1108007,0,"很好～但是包装有待加强，不过小小细节，已经被光芒掩盖了～真的很棒，闻起来很清新",2017-07-16 18:11:06
1108007,5,"去污能力还是可以的，重点是不伤手，洗碗皂还是第一次用，挺满意的",2018-08-08 10:38:25
1108007,5,"",2017-12-29 17:17:10
1108007,5,"的确好，试用一块很脏的白布，随便一;洗就白了，很给力哦",2017-10-06 12:05:58
1108007,5,"很好用，比洗洁精好用，就是太滑了。",2018-04-10 16:30:56
1108007,4,"去油效果没有预期好，与温水一起好可能会好一点。",2018-04-09 16:37:00
1108007,5,"这款洗碗皂非常好用，淡淡的香味而且不伤手，推荐全家都在用。好物！值得买！",2018-06-27 19:09:04
1108007,5,"",2017-12-27 12:16:52
1108007,0,"搞活动一次买了两个，感觉还是买少了。下次做活动再多买几个，去油效果杠杠的。",2017-06-22 12:00:19
1108007,5,"这个洗碗皂强烈推荐啊，味道超级好闻，去油去污去油腥，只有最好，没有之一，强烈推荐购买啊",2018-07-23 13:03:53
1108007,5,"",2017-12-18 12:17:38
1108007,0,"发货速度很快，24小时就到达了。洗碗皂挺香的，还没用不知道效果如何。用过后再来评价。",2017-07-20 11:17:35
1108007,5,"刚收到，晚上洗碗时用用看，闻味道还是清香的",2017-12-01 12:15:21
1108007,5,"还没用，用完追评 ，京东的物流服务不错，送货的时候没接住电话，快递小哥给发了个信息放门卫了，下午又打电话问拿没拿到，真是负责任",2018-04-09 18:00:27
1108007,5,"容易化",2018-04-09 20:47:11
1108007,5,"温和不伤手，容易清洗，有一点薄荷味，值得拥有！",2017-12-11 11:30:00
