"itemId","star","content","createTime"
1110004,5,"其实看着像浅灰...和原木家具还是蛮搭的..还买了一套丁子灰的替换...有弹性很柔软很亲肤",2018-06-30 15:49:33
1110004,5,"现在就喜欢在严选买东西，中毒了",2018-06-18 22:23:09
1110004,5,"送个同事的搬家礼物，非常适合小青年的简约风格，清爽简约，最主要是手感棒",2018-08-12 17:43:11
1110004,5,"墨绿色很漂亮 触感柔软有点像内衣裤的手感 还没有洗 希望不会起球",2018-08-09 18:47:18
1110004,5,"比期待得还要柔软舒服！颜色跟家里的风格又一样，刚才洗了，等晒干就要铺上床啦！
打开的时候，觉得是收到了一份遥远的礼物，真是高兴！",2018-08-14 22:22:24
1110004,5,"和我的床搭在一起很好看吧，开心～没有其他味道，柔软！",2018-06-25 02:12:52
1110004,5,"质量非常好，棉好，厚，非常有质感。价钱秒杀富安娜等一干品牌。感谢网易严选。以后会再买的。",2018-08-19 19:15:57
1110004,5,"很好很舒服喜欢～",2018-05-27 18:04:15
1110004,4,"收到了，料子软，洗好了，不知道盖上去什么感觉，试试看看如何，在追评，和平时的不一样",2018-07-15 12:20:26
1110004,5,"很柔软..之前买了一套黄的，其实看着像浅灰..再买了一套深点灰的做替换哈有弹性超柔软",2018-06-30 15:44:50
1110004,5,"发货很快，京东物流第二天就到了。收到货马上洗了准备换上裸睡，哈哈，面料手感好，不错。",2018-04-24 12:45:55
1110004,5,"软软的，个人喜欢很素净的颜色，简单耐看经典。截止到现在，在严选选的每一样我都很满意",2018-04-18 21:48:56
1110004,5,"超棒啊！物流很快 然后快递员也超负责任 关键是产品质量好 性价比很高 推荐入手！",2018-04-11 12:36:17
1110004,5,"物流很快 虽然有点远 房子还没弄好 迟点拆封，左下角的箱子是四件套，哈哈",2018-04-16 10:10:22
1110004,5,"下单隔天就送到，真快，和水洗条纹的相比，要厚实多，不错，等洗了在用啦。",2018-04-05 10:46:34
1110004,5,"22cm厚度的床垫，贴合亲肤，洗完后再铺的，没起毛粒，没什么皱痕，夏天用厚度足够，值得入手",2018-04-24 09:15:42
1110004,5,"刚收到，感谢京东快递小哥太快啦！一下买了两套先下水，用了后再评",2018-05-15 18:20:36
1110004,5,"严选的质量一如既往的好，这个颜色很好看，我还要买多一款1.2米的单人款*^_^*",2018-05-04 17:05:25
1110004,5,"很喜欢，家里的东西都换成严选的了。京东快递都认识我了<U+0001F601>感谢严选，让我放心购物",2018-03-24 00:19:34
1110004,5,"简约大气又时尚，关键是除了颜值高还舒服，柔软又贴身，太满意了，以后家里床品就选它啦",2018-03-18 15:21:12
1110004,5,"摸上去就感觉特别舒服，虽然还没睡，觉得肯定不错，相信严选。搭配床垫保护罩和严选的枕头，完美",2018-03-20 21:16:26
1110004,5,"昨晚九点下单，一早就收到了，神速呀，快递小哥赞一个！四件套摸着舒服，还没有用，期待效果！支持严选",2018-04-13 09:33:08
1110004,5,"完美.！这个价格买到这个档次的红酒杯太超值了！买了两对，搬新家庆祝用，感谢严选的产品质感这么好，中严选的毒已太深",2018-07-18 18:10:46
1110004,5,"很棒的触感啦，买到新家了还没开始用，期待哦。很开心呢(<U+02F6>￣<U+1DC4> <U+207B><U+032B> ￣<U+1DC5><U+02F5>)越来越喜欢严选呐",2018-04-09 21:20:04
1110004,5,"非常不错",2018-08-21 12:36:49
1110004,5,"昨天下单今天就收到货了，超级棒
还没有拆开看
先给个好评",2018-04-08 20:14:47
1110004,5,"超级舒服~",2018-08-16 23:22:25
1110004,5,"嘿嘿哈哈哈哈哈哈哈哈宝宝别别扭扭男男女女呢叭裤好",2018-08-13 11:03:21
1110004,5,"",2018-08-14 11:38:13
1110004,5,"还没用，看起来很不错",2018-08-12 12:10:56
1110004,5,"面料舒适，价廉物美的床上用品。",2018-08-11 09:13:19
1110004,5,"睡起来舒服",2018-08-10 00:02:15
1110004,5,"有质感舒服适合裸睡",2018-08-05 07:55:30
1110004,5,"颜色很日式",2018-08-02 09:59:21
1110004,4,"棉的，比较软，形象点说有点像秋裤的料子",2018-07-22 09:34:12
1110004,5,"布料很舒服，就是怕时间长了或者洗次数多了布料没弹性，使用时间待定",2018-03-23 21:30:30
1110004,5,"超级裸感，太舒服了。会继续回购这一款。",2018-07-22 00:42:57
1110004,5,"床笠款第一美观、第二美观、第三美观、重要的说三遍，不仅美观，摸起来质感也非常好、很舒适、适合裸睡的小伙伴！由于赶时间没有干就换上去了、别在意细节哈！",2018-07-22 19:53:23
1110004,5,"买的1.8米的尺寸，对于我现在睡的床来说有点大，买1.5就足够了。灰色看起来有点太深了，不过摸起来蛮舒服，就像是薄的全棉保暖内衣的那种质感，弹性很大，被罩很厚，夏天可以直接盖了。总之还是物有所值的，今天又下单了另一款四件套，希望网易可以继续保持品质。",2018-07-21 09:50:45
1110004,5,"刚收到，感谢京东快递小哥太快啦！先下水，用了后再评",2018-05-15 18:21:14
1110004,5,"",2018-07-12 17:28:17
1110004,5,"一如既往的好，一如既往的好",2018-07-11 22:50:06
1110004,5,"挺舒服的",2018-07-11 07:40:32
1110004,4,"刚洗完 还没用 无印风格 略薄 手感还好 用过再追评",2018-03-30 09:23:11
1110004,5,"床品非常舒服，会回购的，对严选瞬间路转粉<U+0001F618><U+0001F618><U+0001F618>",2018-04-21 18:47:04
1110004,5,"质量非常好，与卖家描述的完全一致，非常满意,真的很喜欢，完全超出期望值，发货速度非常快，包装非常仔细、严实，物流公司服务态度很好，运送速度很快，很满意的一次购物，好不错可以的",2018-07-08 13:48:26
1110004,5,"是我想要的柔和面料，裸睡无忧",2018-07-06 11:13:00
1110004,5,"",2018-07-08 14:04:02
1110004,5,"挺好的，买给爸妈的，他们喜欢，但是我没有图",2018-06-21 17:14:22
1110004,5,"已经买了三套了，太舒服了，让人觉得可以裸睡的触感，就是颜色太少了~建议多出颜色哟，大爱呢",2018-03-19 09:18:26
1110004,5,"用了一年多了～还是我喜欢的模样～",2018-07-04 17:44:57
1110004,5,"",2018-07-05 16:54:05
1110004,5,"包装没毛病 颜色也是我喜欢的 已经下水了 期待铺上的样子",2018-04-17 12:38:43
1110004,5,"好看，家里好多严选的东西！",2018-07-03 16:11:45
1110004,5,"简约时尚。手感不错",2018-07-03 22:48:24
1110004,5,"针织的非常适合裸睡，老公说这是他睡过最舒服的四件套了，美美的照片来一张，喜欢严选简单的美",2018-04-02 22:33:11
1110004,5,"放沙发和卧室里，风格统一，抱枕很软，床单舒服",2018-06-17 11:44:55
1110004,5,"刚收到，还没洗，用了再来追评吧！但愿这种材质既舒适又耐用！",2018-03-18 09:21:25
1110004,5,"网易严选的东西性价比真的不错，我挺喜欢的，继续加油。",2018-05-17 15:35:03
1110004,5,"很满意，质地也很柔软",2018-06-25 11:07:55
1110004,5,"",2018-06-25 13:12:35
1110004,5,"非常满意，没得说",2018-06-24 11:44:24
1110004,5,"|量看起聿诲e，等不及想把它洗一洗，R上Q上",2018-03-17 17:51:51
1110004,5,"全是灰色 喜欢 有种鹅卵石的感觉呢",2018-06-23 21:22:00
1110004,5,"",2018-06-23 16:14:20
1110004,5,"料子摸了一下确实很舒服，先放着等到要换的时候再洗",2018-04-07 12:21:21
1110004,5,"这手感 这面料 要不要那么舒服 可以的 用起来吧",2018-06-07 12:30:53
1110004,5,"贴身柔和 感觉很不错 等用起来会不会不想起床",2018-06-07 12:32:11
1110004,5,"美好",2018-06-22 00:05:15
1110004,5,"挺好的，拿给爸妈的，他们喜欢",2018-06-21 17:14:29
1110004,5,"回购",2018-06-20 00:14:11
1110004,5,"超级舒服 睡眠都好了 而且很好看 简单大方",2018-06-14 23:18:56
1110004,5,"",2018-06-18 00:23:27
1110004,5,"我家妞妞也很喜欢哦。",2018-06-17 21:49:35
1110004,5,"很不错哦～简简单单的！小确幸",2018-06-16 16:11:41
1110004,5,"真的蛮好的，跟我家的装修风格很搭。物流也蛮快的。",2018-04-21 10:34:29
1110004,5,"不错 用了七八个月 很舒服",2018-06-13 18:32:27
1110004,5,"中午收到货，洗了一下，晚上就铺上了。非常柔软。喜欢喜欢",2018-05-18 12:34:35
1110004,5,"质量在我意料之中，挺好 就是不小心买成了床竖款了……",2018-05-03 13:25:46
1110004,5,"相信网易严选 质量还不错哈",2018-06-10 09:11:50
1110004,5,"",2018-06-10 17:14:57
1110004,5,"拿到手了，手感真好，包装也给力，严选没让我失望过",2018-03-24 16:29:04
1110004,5,"超级舒服，已经推荐给我同学了。",2018-06-06 16:31:54
1110004,5,"快递按时送达，全棉材质，手感柔软舒适，颜色也很满意，性价比很高！",2018-03-23 15:22:01
1110004,5,"质量做工用料绝对物超所值，信赖严选！",2018-06-03 16:56:59
1110004,5,"真的很爱这种性冷淡风四件套，已经在严选入手两套了，夏天铺开空调非常舒适，全棉亲肤，之前看别人评价用了严选根本停不下来，觉得呵呵<U+0001F642>。结果自己中了毒！大爱！",2018-05-31 21:21:19
1110004,5,"床单质感跟我衬衣差不多，睡上去很舒服，就是感觉有点薄",2018-04-05 10:17:37
1110004,5,"给哥哥买的，他说还不错。",2018-05-27 00:19:35
1110004,5,"给娃拍照绝佳背景。",2018-05-22 16:27:44
1110004,5,"很棒，颜色材质都很喜欢，已经是入的第二套了",2018-05-13 22:27:57
1110004,5,"感觉蛮细致的，针织就是舒服啊！应该还会回购的哦",2018-04-13 10:04:25
1110004,5,"很亲肤，很喜欢！",2018-05-19 06:02:16
1110004,5,"床单质量特别好 一直看别人说严选深似海 一入严选就难以自拔 我也切身感受到了 520的礼物想都没想就在严选上买的 不过很重要的一点是 希望严选一直能这么保持下去 不忘初心 方得始终 我会一直陪你们走下去",2018-05-19 18:20:28
1110004,5,"可以，这售后也太棒了，我已经成脑残粉",2018-05-09 09:09:25
1110004,5,"买了好几套了把家里的都换了 钱啊不够用",2018-04-09 21:03:38
1110004,5,"比较柔软，裸睡无压力，上次买的超满意，这次活动再买一件替换",2018-03-21 19:55:38
1110004,5,"全面的，睡起来舒服。不错的，网易严选。",2018-05-10 19:59:32
1110004,5,"非常亲肤，质量和muji一样，适合裸睡，没有色差",2018-05-06 22:58:46
1110004,5,"美美美～质量棒棒哒<U+0001F388><U+0001F388><U+0001F388>！",2018-05-05 07:47:19
1110004,5,"很好啊，很棒啊，很漂亮啊。床笠套上很干净整洁啊",2018-03-18 08:03:58
1110004,5,"很舒适，非常满意",2018-05-08 19:10:13
1110004,5,"适合冬天，自然暖和！",2018-05-07 07:48:36
1110004,5,"就这样吧……",2018-05-07 20:23:41
1110004,5,"还没打开用，手摸了下质感还是不错的",2018-04-29 17:44:21
1110004,5,"不错，柔软，触感好～",2018-05-06 22:06:07
1110004,5,"颜色很好看，粉粉的，料子也很舒服，特别满意的一次购物。",2018-03-31 21:40:23
1110004,5,"慵懒……亲肤……喜欢躺在被窝发呆，看书的日子……需要这样的被单",2018-03-15 20:06:44
1110004,5,"东西很好 性冷淡风真的很喜欢",2018-05-01 00:31:07
1110004,5,"家人帮忙签收的 还没看到实物 晚点再做评价 一直都相信严选的东西 真的都是严选出来的 好的生活质量美丽的价格 <U+0001F44D>",2018-04-12 10:13:09
1110004,5,"不错，不错，手感相当棒！",2018-04-29 11:35:13
1110004,5,"太喜欢啦 好想每套都买了 超超超超超超超超舒服。。。
 就是有点软 但就是这种软的舒适感让人欲罢不能 不想离开我的床 。 超舒服的裸睡四件套。 最爱最爱没有之一。",2018-04-29 01:16:48
1110004,5,"才收到货就看到降价",2018-08-10 12:51:01
1110004,5,"亲肤柔软，家里人说像盖t",2018-04-28 16:22:13
1110004,4,"颜色不太喜欢，尤其是洗了之后，跟照片还是有点差距",2018-08-05 10:15:50
1110004,5,"买了两套，还没用，但摸起来很舒服，颜色也满意。好评先！",2018-03-24 16:22:03
1110004,5,"买了两套，还没用，但摸起来很舒服，颜色也满意。好评先！",2018-03-24 16:22:24
1110004,5,"是真的非常好亲肤，唯一的问题就是颜色太统一分不清面",2018-08-12 18:53:40
1110004,5,"哈哈哈哈，手感超好啊。跟无印良品的质量有一拼，但是价格真心良心。非常满意的一次购物。朋友说包装很像军被，四四方方的，哈哈。真心重",2018-04-15 15:26:28
1110004,5,"颜色喜欢就是比较大，建议大家量好尺寸购买",2018-08-21 23:38:00
1110004,5,"非常舒服哦！",2018-04-26 16:11:30
1110004,5,"很软很舒服，舍不得换下来，现在家里全是严选的东西。",2018-04-01 10:42:16
1110004,5,"容易起球",2018-08-10 00:17:07
1110004,5,"非常舒服，颜色也好看，我喜欢",2018-04-23 22:45:10
1110004,5,"红红火火恍恍惚惚呵呵哈哈哈哈哈哈哈哈哈哈哈哈哈哈哈哈哈红红火火恍恍惚惚呵呵哈哈哈哈哈哈哈哈哈哈哈哈哈哈哈哈哈哈红红火火恍恍惚惚呵呵哈哈哈哈哈哈哈哈哈哈哈哈哈哈哈哈哈红红火火恍恍惚惚呵呵哈哈哈哈哈哈哈哈哈哈哈哈哈哈哈哈哈哈红红火火恍恍惚惚红红火火恍恍惚惚",2018-04-22 23:00:16
1110004,5,"太多了",2018-04-22 23:42:42
1110004,5,"不错 床单洗了看着还不错",2018-04-21 14:50:32
1110004,5,"粉色好美 好舒服",2018-04-21 19:51:35
1110004,5,"传说中的秋裤款四件套，看了很久有活动终于入手买了。手感确实很不错，柔软舒适，床品是和自己身体陪伴时间最长的一样居家物件，值得挑一些好的产品。网易严选的东西性价比确实高。",2018-04-21 21:44:04
1110004,5,"完美！床笠简直是最伟大的发明之一（<U+FF61>ò <U+2200> ó<U+FF61>）",2018-04-13 01:13:19
1110004,5,"吓唬吓唬洗洁精",2018-07-27 22:56:02
1110004,5,"平平整整，舒舒服服，是我要的",2018-04-20 09:14:25
1110004,4,"虽然全棉的。但是用了几个月后就会起球",2018-07-23 01:05:14
1110004,5,"很好，布料柔软，床笠很好看，老婆很喜欢",2018-04-16 20:05:55
1110004,2,"面料有点扎",2018-07-09 12:50:51
1110004,5,"很柔软贴肤，收到马上下水晾出了",2018-04-18 06:12:09
1110004,5,"嗯，非常舒服 就是有点味道 晾一晾就好了 很满意",2018-07-14 23:41:27
1110004,5,"非常满意，收到就洗过铺上了，简单舒适，已经推荐给朋友了。",2018-03-16 20:34:34
1110004,5,"最早买了这套条纹床单和抱枕，收到货后简直喜欢的不行，看到这套针织棉四件套做活动，毫不犹豫又入了一套，现在家里都是严选的东西，大爱呀，支持！！",2018-04-19 15:44:07
1110004,5,"好，质地，颜色都不错。价格也实惠。",2018-04-19 09:57:06
1110004,3,"比较柔软。但是质地松垮，容易起球。起球之后完全没有亲肤的效果",2018-07-08 13:13:42
1110004,5,"",2018-04-19 07:07:38
1110004,5,"",2018-04-19 17:41:06
1110004,5,"很软摸起来真的很舒服，真的可以裸睡了，不过套22cm厚的床垫上，感觉有点吃力，而且橡皮边拉的有点长了，感觉用不了很久，真的怕有一天拉断了。",2018-07-01 17:46:24
1110004,5,"真的质量超级棒，床笠款铺上去不会乱，非常满意",2018-03-15 16:02:34
1110004,5,"非常满意，舒服好看！",2018-04-18 15:19:37
1110004,5,"第一次在严选上购物，看图就知道宝贝品质不错，很愉快的经历，配送速度也很快，分两天购买的宝贝，居然同一天一起配送，很是合理，以后肯定还会光顾严选。如果严选活动再大一点那就更完美啦<U+0001F604>",2018-04-18 22:46:55
1110004,5,"网易出品，不会令人失望",2018-07-05 00:42:24
1110004,5,"床笠太好用 没有之一呵呵红红火火恍恍惚惚哈哈哈哈哈哈哈",2018-03-14 01:12:46
1110004,5,"货品已经收到，昨晚下单今天就收到了<U+0001F44D>，东西很好",2018-03-26 22:02:18
1110004,5,"非常棒，摸起来非常舒服，过一天就收到货了，京东快递就是给力，网易严选的品质还是非常不错的，之前买的东西也是非常的给力。",2018-03-29 12:45:50
1110004,5,"不错呀，柔软舒适，不透",2018-04-15 13:21:07
1110004,5,"好！挺好！",2018-04-15 17:46:18
1110004,5,"",2018-04-15 12:11:27
1110004,5,"好了，除了床架子以外，床垫、枕头、荞麦枕、四件套、床笠都是网易严选家的，集齐全套是不是可以召唤神龙了？床边那只拖鞋也是严选家的，中毒太深……颜色柔和、最满意的是床笠全包裹的四周，用料也舍得，把25cm厚的床垫子包裹的严严实实的，很棒！再多出一些颜色和花型呗！！",2018-04-15 12:29:07
1110004,5,"就像你电话电话电话",2018-07-01 12:05:35
1110004,1,"尺寸不对，质量不好。严选第一回买到这么差的东西。",2018-06-25 14:01:44
1110004,5,"挺好，就是床笠不太好叠<U+0001F601>",2018-06-18 13:43:19
1110004,5,"东西不错 发货速度也很快 一次满意的购物",2018-04-13 21:11:59
1110004,5,"布料不错，相较于muji还是会差一些",2018-04-13 20:45:49
1110004,5,"本来想买床单款的，同一颜色只剩下床笠款了。入手后发现质感不错，床笠款用起来也蛮方便的，网易出品必属精品，再接再厉，加油！",2018-03-28 23:17:19
1110004,5,"像是内衣的材质，挨身没有内衣舒适。",2018-06-19 08:29:20
1110004,5,"颜色搭配起来刚好，睡着也很舒服，满意，",2018-04-14 08:40:47
1110004,2,"用了没多少次，起了很多毛头，很多疙瘩疙瘩的很不舒服，估计不能用了，失望，也没有评论说得那么好，不如其他大牌子的纯棉款",2018-06-25 08:44:48
1110004,5,"挺好的。颜色还可以。跟我们穿的秋衣一样的感觉",2018-03-23 22:19:07
1110004,5,"没看清，被罩太大了，之前买的都是200*230，而且是洗了之后发现的，又特意买了床被芯来配，是真爱了",2018-06-18 14:26:41
1110004,5,"非常舒服，严选的东西真不错，好评",2018-04-14 15:00:21
1110004,5,"还可以，洗完也很舒服，放心购买",2018-04-13 00:05:47
1110004,5,"实物和图片差不多，质感和看图想象的差不多，用了一段时间，目前不会起球。",2018-06-14 18:25:21
1110004,5,"是想要的样子哦～柔软舒服～",2018-04-13 13:19:12
1110004,5,"非常舒服",2018-04-13 00:26:49
1110004,5,"",2018-04-13 22:33:10
1110004,5,"超级棒诶～～首先个人比较喜欢灰色的感觉很简约且雅致，然后材质真的超级赞，摸上去像是秋冬季节穿的秋裤那种很贴身很保温的材质，而且超级宽，但是可能节日活动购买的人多吧，等了超级久。。。总的来说购物体验超级赞，严选棒棒哒<U+0001F44D><U+0001F44D>",2018-04-13 18:14:29
1110004,5,"颜色漂亮，面料相当舒服，已经安利了好几个朋友来买",2018-04-09 22:10:47
1110004,5,"全棉四件套，盖在身上好舒服",2018-04-12 10:26:27
1110004,5,"一直在严选购买，送货很快",2018-04-12 21:14:40
1110004,5,"很柔软，睡觉很舒服",2018-04-12 00:47:22
1110004,1,"刚拿到手，枕套上居然有个洞？！大家千万别买啦。",2018-05-29 11:35:32
1110004,5,"之前买了一床自己用，再来给儿子买",2018-04-10 21:36:37
1110004,5,"不错不错，性价比很高",2018-04-11 18:50:01
1110004,5,"不错，喜欢粉粉的颜色！",2018-04-11 11:04:46
1110004,5,"相当好，床罩版第一次用，除了需要两个人一块套有点费劲以外，一切都很完美",2018-05-27 20:09:04
1110004,5,"这个面料很舒服，特地在其他网站上下单，最后留下网易的。主要还是一些细节的保证，所以说严选真的要做好品控，会吸引我们这些顾客",2018-05-16 20:53:43
1110004,5,"太舒服了，",2018-04-11 20:57:12
1110004,5,"很舒服，喜欢",2018-04-11 19:46:32
1110004,5,"还行吧",2018-04-11 01:27:20
1110004,5,"和想象的不太一样",2018-06-03 21:45:17
1110004,5,"严选已经中毒 尤其是床品 超级喜欢 买了两套了",2018-03-28 09:58:48
1110004,5,"摸着很舒服，超软",2018-04-10 08:33:01
1110004,5,"收到后看到包装就不错，简单但是不失精致，打开后也没有味道，摸上去就是很舒服的感觉，昨天刚洗完睡上之后觉得特别舒服，很软，像纯棉的睡衣一样，不错。",2018-04-09 09:07:03
1110004,5,"真棒",2018-04-09 06:49:20
1110004,5,"好柔软好舒服，包装严实，超赞<U+0001F44D>",2018-04-08 22:20:26
1110004,5,"好极。买了两套。还继续买。",2018-04-08 22:49:42
1110004,5,"摸起来很舒服，因为稍有色差所以退了",2018-05-30 09:21:52
1110004,5,"好看又好睡<U+0001F4A4>",2018-04-08 21:58:41
1110004,5,"颜值一般般，舒服程度爆棚
虽然不美丽，但舒适，总是让人体会喜悦
在漫漫的人生中，总是有不少的磕磕绊绊，
但是感谢你，
给了我三分之一生命中，
最接近婴儿的状态，
让我有动力不逃脱那三分之二的时光。",2018-04-08 22:06:01
1110004,5,"体感舒服，性价比好高啊！",2018-04-07 10:11:00
1110004,5,"比睡衣的料子舒服，所以，你懂的。",2018-04-07 18:58:32
1110004,5,"还行吧，用久了会起球的",2018-05-26 19:05:52
1110004,5,"买的时候还担心质量问题。到货后一看质量很好，手感舒服，立马洗了就用上，铺在床上，显得很有档次",2018-05-08 16:40:27
1110004,5,"被套和被子不合适，老吊出一团",2018-05-06 23:37:13
1110004,5,"很舒服，之前买不是全棉的，睡了之后，一对比，完全不是一个档次的",2018-05-17 10:08:08
1110004,5,"挺舒服，打算趁着打折再买一套",2018-04-07 14:11:41
1110004,5,"收到了，还没用呢",2018-04-07 23:30:32
1110004,5,"打开后手感不错摸着柔软，还没用，第二次购买了，之前买了磨毛的，盖着很舒服，像中了严选的毒，其他的都不想用了。",2018-03-20 10:03:17
1110004,5,"料子摸起来还是挺舒服的，就是男票嫌太重了，退了。。",2018-05-07 11:42:36
1110004,5,"棒，早上下的单 下午就到了，简直是超级惊喜额",2018-03-24 16:47:04
1110004,5,"非常好！手感超软！",2018-04-06 19:38:09
1110004,5,"不太喜欢",2018-05-14 10:08:14
1110004,5,"",2018-04-06 21:34:06
1110004,5,"很好的，洗了之后不缩水，合适1.5米的床",2018-03-29 12:48:01
1110004,4,"下单的时候看错了，收到后才发现，懒得退了，
拆开之后异味大，一遍漂洗不行，需要多漂洗几遍，品质没有想象中好",2018-04-29 13:18:07
1110004,5,"质量不错，颜色还可以",2018-04-05 11:33:14
1110004,5,"很满意，舒服",2018-04-05 23:00:52
1110004,5,"很好，洗起来很方便，很喜欢！",2018-04-03 22:06:43
1110004,5,"特别舒服特别棒，会再次购买",2018-04-03 16:12:44
1110004,4,"全棉的，与皮肤接触还是很舒服的。就是用久了容易结球",2018-05-04 11:32:43
1110004,5,"漂亮、舒适度高，喜欢",2018-04-03 12:03:33
1110004,5,"产品与描述的一样 柔软 素净 睡眠质量估计会提高不少啊",2018-03-19 20:34:52
1110004,5,"超喜欢，裸睡0束缚",2018-04-01 18:15:49
1110004,5,"非常适合",2018-04-01 00:16:51
1110004,5,"挺好用的，继续支持！睡觉啦",2018-03-31 23:58:19
1110004,5,"很好，不算贵！",2018-04-24 12:52:01
1110004,5,"挺舒服的。不知道有没有单卖床单和被套的~",2018-04-24 17:12:19
1110004,5,"非常舒服，还会再次选择严选",2018-03-30 23:50:39
1110004,5,"退换货方便，及时",2018-03-30 09:53:15
1110004,2,"用了三次就起球起毛了 质量不值这个价",2018-04-22 17:46:02
1110004,5,"买了一床试用，挺满意的，又追加了三床！",2018-03-28 14:27:09
1110004,5,"买了一床试用，挺满意的，又追加了三床！",2018-03-28 14:27:23
1110004,5,"买了一床试用，挺满意的，又追加了三床！",2018-03-28 14:27:28
1110004,5,"贴身盖感觉真舒服，不过还是太薄了，最惨的是被罩比我家的被大一号",2018-04-23 20:13:28
1110004,5,"差不多是这样的....很舒服哈",2018-03-29 10:39:49
1110004,5,"",2018-03-29 22:11:40
1110004,5,"手感像Tshirt很软，跟无印的很像",2018-03-29 06:28:47
1110004,5,"超级喜欢，柔软舒适，起球，买了第三套了",2018-03-28 06:58:04
1110004,5,"质量非常好，手感好，推荐",2018-03-28 17:54:46
1110004,5,"很舒服",2018-03-28 17:27:40
1110004,5,"不错，容易皱",2018-04-21 21:57:36
1110004,5,"颜色大爱，布料手感好，非常满意。",2018-03-27 18:50:42
1110004,5,"四件套收到了，老实说有点落差，面料好像秋衣秋裤的料子，有点尴尬啊",2018-04-23 16:24:32
1110004,3,"不太好看 我妈都不喜欢 真的就是秋裤的材质 没有质感 铺床上软塌塌的没有质感",2018-04-20 21:59:40
1110004,2,"没用几天破洞了……",2018-04-17 09:19:55
1110004,5,"新房乱糟糟的，已经是第四次买这款纯色四件套，给新房里卧室囤货。每次选在限时购买最划算。床品是最有效的改变家居风格的物品。打算把某宝买的妖艳货全都换掉。这款低调，朴实，重要的是舒服，不起球。",2018-03-26 21:42:28
1110004,5,"可以，有点粘毛，不知道会不会缩水呢",2018-04-19 13:43:08
