"itemId","star","content","createTime"
1130067,5,"这个青梅饼是一直买的，味道好，酸中带甜不腻，独立包装，包里放几粒开胃解渴卫生方便。",2018-08-21 20:47:57
1130067,5,"一早下单，为了免邮，加了一袋这个梅子，结果当天就到了，里面独立包装，干净",2018-05-23 18:10:37
1130067,5,"很好吃，开胃小零食，很赞！！！！",2018-07-15 18:15:08
1130067,5,"味道很不错，单独包装干净、方便，回购系列",2018-06-18 09:22:16
1130067,5,"好吃，发货快！",2018-04-27 17:57:17
1130067,5,"独立包装，卫生方便，味道适合，浓淡适宜。",2018-04-26 15:55:14
1130067,5,"每一粒都是单独包装，很好，又不怕打开弄脏又方便带，放包里随时拿取。酸甜爽口的个人比较喜欢",2018-08-01 11:53:07
1130067,5,"前前后后买了不知道多少包！尤其是陈皮梅，特别好吃！而且还是独立包装，携带很方便！就连包装袋都非常精美！",2018-06-16 18:33:21
1130067,5,"好吃，味道隽永，气息清雅。独立包装，干净卫生。马上要回购，等闺蜜从美国回来一起品尝小时候的滋味。",2018-05-04 17:16:37
1130067,5,"包装质量好，价格优惠多多，关键是味道很好<U+0001F44D>，好多同事都说很好吃，还会再来",2018-04-25 14:32:26
1130067,5,"日式梅饼特别好吃 也不是很咸而且每个都是独立包装 下次要把那个味道买一遍 很好吃",2018-04-29 08:16:46
1130067,5,"个人感觉单独吃起来没有陈皮梅饼好吃，但是拌饭吃很好吃，味道有点重，是老人喜欢的味道～",2018-04-28 18:23:51
1130067,5,"第一次严选购物，零食包装都很精致，感觉很有质感，价格也不贵，非常愉快，以后都想选用严选购物了",2018-05-16 22:48:35
1130067,5,"已经是第二次购买了，味道超级棒，还会再来，严选从没让我失望过",2018-06-06 14:51:27
1130067,5,"特别小一枚。独立小袋包装。发货物流快。挺好吃的。日期可以。",2018-08-14 12:00:28
1130067,5,"夏天吃很开胃，外面微咸的口感，梅肉酸酸的，很好吃。",2018-07-21 16:57:50
1130067,5,"99任选活动，还是很超值的，严选的品质没得说。",2018-08-22 21:19:26
1130067,5,"外包装小巧精致，内包装独立干净，味道当然也是我喜欢的喽！",2018-07-28 12:57:40
1130067,5,"第一次来。感觉挺好的。快递迅速。东西好好的，好吃再来哟",2018-07-18 22:03:28
1130067,5,"回购产品 非常好吃 独立包装也很方便去油解腻",2018-08-02 07:35:06
1130067,5,"好吃，婆婆很喜欢，小袋包装，出游携带很方便，买来送亲朋好友大家都很喜欢～",2018-05-11 23:07:04
1130067,5,"好吃，婆婆很喜欢，小袋包装，出游携带很方便，买来送亲朋好友大家都很喜欢～",2018-05-11 23:06:59
1130067,5,"独立包装带着很方便哦，试吃了一下酸酸的很开胃",2018-07-11 22:49:53
1130067,5,"第一次买，还没开吃，看包装应该不错，严选少有失望哈",2018-07-11 22:42:58
1130067,5,"总体来说还不错 习惯青梅的果冻 就是有点少 爆米花很实在 带着去电影院了 哈哈哈 带鱼和小黄鱼没有次 吃的肉质可以的 小梅饼棒棒的",2018-07-21 10:51:47
1130067,5,"买了很多都很好吃",2018-08-21 10:39:15
1130067,5,"好吃的梅饼，还会买",2018-08-20 14:28:17
1130067,5,"方便快捷，很满意",2018-08-18 15:45:34
1130067,5,"好吃好吃好好吃(<U+272A><U+272A>)
愿漂泊的人都有酒喝 愿孤独的人都会唱歌。愿相爱的人都有未来，愿等待的人都有回答。愿孤单的人不必永远逞强，愿逞强的人身边永远都有个肩膀。愿肩膀可以接住你的欢喜忧伤，愿有情人永生执手相望。愿你如阳光，明媚不忧伤；愿你如月光，明亮不清冷。愿你最爱的人，也最爱你。",2018-08-17 10:20:32
1130067,5,"酸甜、清爽、无核，出乎意料的好吃。",2018-08-16 17:17:55
1130067,5,"这个味道很喜欢，感觉比以前的梅怡馆好吃",2018-08-11 18:17:48
1130067,5,"口感浓郁，物流快捷。",2018-08-12 10:31:33
1130067,5,"好吃到买不停！",2018-08-10 15:30:24
1130067,5,"好味",2018-08-10 21:21:18
1130067,5,"好吃不贵",2018-08-04 15:59:40
1130067,5,"妈妈很喜欢，而且单独包装很方便，不怕梅子受潮。",2018-07-29 15:12:31
1130067,5,"很好吃！",2018-08-01 10:04:46
1130067,5,"回购",2018-07-31 11:15:48
1130067,5,"回购",2018-07-31 11:17:15
1130067,5,"多次回购的一款梅饼，非常喜欢！",2018-07-28 00:51:03
1130067,5,"",2018-07-26 16:29:44
1130067,5,"真正的严选粉，吃的都是严选的。",2018-07-24 14:23:26
1130067,5,"满意",2018-07-24 22:10:14
1130067,5,"严选质量一直很好",2018-07-23 14:57:22
1130067,5,"严选质量一直很好",2018-07-23 14:57:31
1130067,5,"很干净，酸酸甜甜的，还可以泡茶喝！",2018-07-18 09:14:12
1130067,5,"梅子非常酸甜可口，值得推荐",2018-07-17 10:56:34
1130067,5,"非常不错下次还会买！！",2018-07-17 18:53:49
1130067,5,"棒",2018-07-17 15:07:00
1130067,5,"上次买的陈皮梅饼，这次换个口味。酸酸甜甜，好吃。办公室必备！",2018-06-04 13:51:28
1130067,5,"立即拆开吃了，味道不错",2018-07-14 20:04:54
1130067,5,"不错",2018-07-13 22:50:49
1130067,5,"老包装不错~真的挺好吃的~信任严选~ 老包装不错~真的挺好吃的~信任严选~ 老包装不错~真的挺好吃的~信任严选~ 老包装不错~真的挺好吃的~信任严选~",2018-07-12 14:57:48
1130067,5,"老包装不错~真的挺好吃的~信任严选~ 老包装不错~真的挺好吃的~信任严选~ 老包装不错~真的挺好吃的~信任严选~ 老包装不错~真的挺好吃的~信任严选~",2018-07-12 14:57:50
1130067,5,"要中严选的毒了，物流快包装好价格便宜，不回头都难哦……",2018-04-23 20:52:10
1130067,5,"本来是等过几天踏青吃的，今天手贱打开了，好吃到停不下来！",2018-03-30 14:00:11
1130067,5,"粉略厚，口感可以。",2018-07-09 16:28:13
1130067,5,"很日式的感觉，独立包装，口味偏酸，回味很好",2018-06-25 07:38:30
1130067,5,"好好吃啊，我就喜欢酸的，就是太少了",2018-06-23 08:03:28
1130067,5,"每次都给孩子买一批，这些零食总比那些膨化食品好的多吧",2018-04-12 20:35:11
1130067,5,"家里几乎所有的零食都是严选的，一次买了好几款，但都很满意",2018-05-01 23:33:40
1130067,5,"跟同事一起拼的。不错。",2018-06-26 11:59:31
1130067,5,"超级好吃的梅饼，自从来了严选，已经不逛某宝",2018-05-29 11:05:33
1130067,5,"酸酸甜甜很好吃 就是太少了 吃起来不过瘾",2018-05-14 16:23:10
1130067,5,"入口绵软，回甘许久，口舌生津，不错不错<U+0001F44D><U+0001F44D><U+0001F44D>",2018-05-14 19:13:17
1130067,5,"不错挺好吃的，酸酸甜甜含着吃，量少性价比一般",2018-04-06 12:21:22
1130067,5,"收到这么一箱零食心里满足感爆棚，只是减肥计划估计要搁浅了",2018-04-26 13:42:59
1130067,5,"收到包装完整，还没使用，相信严选品质。用后再追评。",2018-05-24 18:21:21
1130067,5,"好吃好吃<U+0001F60B>里面都是有独立小包装的，日期也新，一拿到手就都拆来吃了，第一次买还怕踩雷，没想到都很棒，比别的是贵点，但好吃啊！值得买",2018-06-16 18:13:38
1130067,5,"好吃好吃<U+0001F60B>里面都是有独立小包装的，日期也新，一拿到手就都拆来吃了，第一次买还怕踩雷，没想到都很棒，比别的是贵点，但好吃啊！值得买",2018-06-16 18:13:42
1130067,5,"还不错",2018-06-13 19:36:35
1130067,5,"正好想凑单看到特价的它~发货挺快，第二天就收到略有点意外。一包梅饼单独过来一个包裹，包装很好看，独立包装不错，生产日期也ok，重要的是味道很合口，就是那个味。",2018-06-12 23:26:35
1130067,5,"之前从别的购物软件上也买过梅子饼，日式最爱，陈皮酸甜开胃，都是很好吃的，单个包装吃的时候很方便",2018-03-17 13:48:37
1130067,5,"多次购买了，好吃不厌，价格不够亲民，期待有活动",2018-05-22 19:59:35
1130067,5,"",2018-06-04 15:23:57
1130067,5,"梅饼好吃，一个一个装，干净卫生",2018-06-02 17:24:23
1130067,5,"味道很好！喜欢！",2018-06-01 10:55:13
1130067,5,"好吃吃不过瘾",2018-06-01 10:56:04
1130067,5,"超级酸特别喜欢，喜欢吃酸的买起来吧。",2018-05-23 11:20:28
1130067,5,"酸甜可口！",2018-05-25 16:39:42
1130067,5,"酸甜度合适！超好吃～公司下午茶严选没商量",2018-05-16 13:54:49
1130067,5,"吃了一个 好吃",2018-05-23 21:32:16
1130067,5,"这款话梅真的很好吃，酸酸甜甜的，非常开胃，而且独立包装的，非常干净卫生，一下午就消灭光了，严选的东西确实不错，还会继续回购",2018-05-07 20:18:28
1130067,5,"这款话梅真的很好吃，酸酸甜甜的，非常开胃，而且独立包装的，非常干净卫生，一下午就消灭光了，严选的东西确实不错，还会继续回购",2018-05-07 20:18:38
1130067,5,"好吃<U+0001F60B>，和在日本买的无差。",2018-05-19 11:55:04
1130067,5,"酸酸甜甜的，味道不错，就是量不多，快递很快",2018-04-26 18:49:49
1130067,5,"日式梅饼+柠檬片+雪碧/可乐，消夏良品",2018-05-18 14:10:25
1130067,5,"一段时间，中了严选的毒。几乎每天都要买上一单。我也是服了我自己。还是希望严选的产品更加多样化。这款梅饼独立包装，酸甜口味适中。居家办公旅游，携带方便。好评。",2018-05-17 10:59:38
1130067,5,"满意 包装极其干净",2018-05-16 11:44:56
1130067,5,"好吃哦！夏天喜欢吃点酸酸甜甜的东西，很地道！",2018-05-01 01:08:50
1130067,5,"第一次买，希望好吃",2018-05-15 14:36:40
1130067,5,"买了好多种，口感、味道都不错。",2018-05-12 17:09:15
1130067,5,"挺好吃的，真不错，小时候的味道",2018-05-11 13:29:01
1130067,5,"味道很不错，喜欢。",2018-05-11 14:00:56
1130067,5,"不错不错",2018-05-09 17:37:50
1130067,5,"酸甜口感蛮开胃的",2018-05-04 11:57:30
1130067,5,"好",2018-05-03 10:09:06
1130067,5,"去了果核的，果肉很软很细，口味咸甜，好吃<U+0001F60B>",2018-04-19 20:22:00
1130067,5,"上课困的来一颗，啊哈哈，上课好伴侣啊",2018-04-30 18:16:36
1130067,5,"好吃",2018-05-01 00:11:45
1130067,5,"好吃，还能说什么。",2018-08-22 21:07:17
1130067,5,"稍微有点咸。下次买日式的尝尝。",2018-04-29 12:06:00
1130067,5,"不错",2018-04-29 18:20:43
1130067,5,"不错",2018-04-29 18:21:10
1130067,5,"感觉陈皮味道更好些，日式的淡些，都好吃！",2018-04-15 10:34:44
1130067,5,"特别好的产品 相信严选",2018-04-28 10:30:42
1130067,5,"平时就很喜欢这个青梅饼，买两袋送一袋，很划算",2018-04-14 17:34:53
1130067,5,"好吃，发货快！",2018-04-27 17:57:07
1130067,5,"软软酸酸肉肉的梅饼，两种都好吃。",2018-04-22 20:46:35
1130067,5,"还没开吃",2018-04-25 18:06:10
1130067,5,"我要优惠券啊……………………",2018-08-19 23:15:06
1130067,5,"还可以",2018-04-25 00:39:22
1130067,5,"味道一般，有点贵了",2018-08-18 10:50:42
1130067,5,"",2018-04-25 07:47:43
1130067,5,"",2018-04-25 07:47:45
1130067,5,"味道很不错，也非常别致。",2018-04-24 16:07:46
1130067,4,"设计很唯美，独立包装喜欢，味道也不错。就是物流太久了，与以往的严选速度对比的话。而且都是食品，很担心，在炎热的夏天不知在路上被怎样暴晒过。",2018-08-03 10:24:02
1130067,5,"好吃脆脆的",2018-04-24 11:56:27
1130067,5,"颜值好高啊，家乡的青梅，把思念留给自己",2018-04-23 08:29:11
1130067,5,"梅饼好吃得让人忍不住不停地回购",2018-04-16 17:57:51
1130067,5,"梅饼很好吃，完全停不下来",2018-04-23 21:21:32
1130067,5,"梅饼很好吃，停不下来",2018-04-23 21:21:10
1130067,4,"吃点清淡的 休闲零食小吃",2018-04-23 11:02:41
1130067,5,"",2018-04-23 12:10:09
1130067,5,"好喜欢这种简单干净的包装！日式酸酸的，很好吃",2018-03-31 16:56:25
1130067,5,"看评价买的，确实很好吃",2018-04-21 21:32:28
1130067,5,"很适口，味道不是很重",2018-08-13 20:29:01
1130067,5,"买了两次了",2018-08-15 16:50:57
1130067,5,"我是贝尔・格里尔斯，我将向你展示如何才能在地球上最极端、最危险的评论区抢热评。我要面对无数陈独秀、段子手、数据帝等威胁的挑战，在那种地方如果你没有高超的语言技巧，你的评论甚至连一天都坚持不了",2018-07-29 23:01:39
1130067,5,"看评价买的，非常好吃",2018-04-21 21:32:50
1130067,5,"每颗单独包装，味道很喜欢",2018-04-21 22:37:31
1130067,5,"不够酸",2018-08-02 12:28:02
1130067,5,"好吃真好吃呀",2018-04-18 15:22:07
1130067,5,"好吃根本停不下来",2018-04-18 15:18:10
1130067,5,"这个已经不知道买过几次了，不是很甜，味道好",2018-07-31 10:37:06
1130067,5,"独立包装每个梅饼，感受很好，味道也不错",2018-04-16 10:21:56
1130067,5,"",2018-04-17 12:19:22
1130067,5,"味道超级不好，盐卖不掉了吗？弄的那么咸，真的很无语，严选的信誉度下降了！",2018-07-25 12:49:11
1130067,5,"",2018-04-15 11:19:31
1130067,5,"刚到还没吃，希望好吃",2018-04-12 17:10:26
1130067,5,"灰常好吃，会回购",2018-04-12 16:50:17
1130067,5,"还没吃，信赖严选",2018-04-12 20:23:20
1130067,5,"套装不错，优惠好吃",2018-04-11 14:46:05
1130067,4,"希望好吃 量有点小",2018-04-10 21:07:41
1130067,5,"好吃不干！限时购买划算！就喜欢独立小包装。",2018-04-02 17:55:36
1130067,5,"价廉物美！都挺好吃的",2018-04-09 19:48:46
1130067,3,"不好吃，甜蜜素加多了的味道",2018-07-26 15:39:29
1130067,5,"",2018-04-08 12:14:23
1130067,5,"宝贝已经收到了，真的是物有所值，非常的满意。卖家的服务态度很好，发货速度也很快，包裹得严严实实，没有任何破损。快递小哥送货速度快，总体来说是一次愉快的购物呀，下次有需要还会再来买买买！打开后让我惊喜的是，宝贝比我想象中的还要好！不得不得竖起大拇指。与卖家描述的完全一致，非常满意,真的很喜欢，完全超出期望值！",2018-04-08 20:58:54
1130067,5,"还不错，有点咸，所以能省着吃，一包里面没几颗，不然一下就没了",2018-07-22 12:36:42
1130067,5,"不太喜欢太酸了",2018-07-22 13:29:58
1130067,4,"一般一般",2018-07-25 07:06:09
1130067,4,"口味一般，有点咸",2018-07-25 07:05:51
1130067,5,"严选的物流是越来越慢了。原来是今天下单明天就能收到。现在是从下单到收货要4、5天。最早是顺丰快递现在是京东配送。还真不如一般快递来的快。真不满意。",2018-07-18 08:36:24
1130067,5,"好吃。。。。。",2018-04-06 08:38:23
1130067,5,"好吃好吃<U+0001F60B>",2018-04-02 18:21:19
1130067,5,"挂耳咖啡很棒！其他零食也很棒！会回购！",2018-03-24 19:01:46
1130067,5,"没有想象的好吃",2018-03-27 18:30:38
1130067,5,"这次的比上次买的大颗好多好多",2018-03-24 14:35:12
1130067,5,"不太好吃",2018-07-18 23:45:18
1130067,5,"东西好，物流快。",2018-07-14 07:54:09
1130067,5,"第一碣I，超M意！",2018-03-23 22:26:51
1130067,5,"严选的物流是越来越慢了。原来是今天下单明天就能收到。现在是从下单到收货要4、5天。最早是顺丰快递现在是京东配送。还真不如一般快递来的快。真不满意。",2018-07-18 08:36:28
1130067,5,"好吃，几天时间买了好几堆！",2018-03-22 13:05:21
1130067,5,"",2018-03-18 19:20:35
1130067,5,"表面一层糖霜中和了梅子的酸，吃起来酸甜有度。",2018-07-18 08:06:39
1130067,5,"含一颗在嘴里，什么烦心事都忘记了！",2018-07-01 14:11:12
1130067,4,"严选的梅好像都比较偏重口味，味道是好的",2018-07-02 23:12:06
1130067,5,"各种梅都买齐了，非常好吃！",2018-03-14 12:59:09
1130067,5,"很合口t",2018-03-13 21:32:25
1130067,5,"感觉不错",2018-03-13 21:32:16
1130067,5,"梅子都是是去核的设计，吃着超方便。每一颗梅子也是单独包装的，真的超好吃！",2018-02-02 16:19:43
1130067,5,"这个味道有点奇怪",2018-07-12 17:21:28
1130067,5,"好吃呀 就是量少 一袋里没几个 一会儿就吃没了",2018-07-02 16:49:54
1130067,5,"好吃，当然不能跟日本当地的比",2018-07-11 22:36:28
1130067,5,"在严选买了不少办公室零食，各种独立小包装，太适合了！严选的品质不用怀疑，京东快递送货上门，各种满意~~",2018-03-04 01:16:25
1130067,5,"在严选买了不少办公室零食，各种独立小包装，太适合了！严选的品质不用怀疑，京东快递送货上门，各种满意~~",2018-03-04 01:18:34
1130067,5,"酸酸软软的，口感很好，已经回购多次了，个人感觉这是一款特别适合夏天的零食",2018-07-27 08:20:49
1130067,5,"哈哈酸酸的超喜欢，比我想象中要小颗一丢丢，但是不影响我对它的喜爱哈哈哈",2018-02-19 22:22:00
1130067,5,"还行，味道和想象的不太一样",2018-07-03 09:27:29
1130067,5,"非常不错，春节前囤货，网易严选的东西给用户的体验感觉非常好，大爱云音乐，大爱严选……",2018-02-10 13:07:10
1130067,5,"东西不错，但我对北京仓库的包装不敢苟同，箱子破了，一起买的零食都压变形了，里面的东西第一层灰..",2018-06-27 17:21:26
1130067,5,"买的东西太多了，一个个想评论太麻烦了，所以这个评论虽然是复制粘贴的，但当你看到这个评论的时候，就意味着这件商品总体来说令我满意，没有什么问题。如果是商品有问题，我会直接写差评，给人示警，毕竟写缺点比较容易。",2018-06-25 08:47:37
1130067,5,"在严选购物就是放心，所购小食品口味纯正，孩子们喜欢得不得了，还会再买，买、买、买!",2018-06-21 18:03:13
1130067,5,"物流快，味道好！",2018-05-30 12:52:36
1130067,5,"超好吃，不是太咸。一口气吃了一包多，喉咙受不了，嘴巴还想吃。本来打算再买十几包，就怕控制不住都吞了，硬生生忍住。",2018-05-30 15:21:03
1130067,5,"口味很好，酸而不腻，津津有味。严选送货很迅速，包装完好，品质有保证，好吃在严选",2018-01-28 10:18:30
1130067,3,"一般般",2018-05-30 23:00:11
1130067,5,"物流快，味道好！",2018-05-30 12:52:43
1130067,5,"品质非常好，独立小包装携带很方便，酸酸的梅子味道特别喜欢，一袋一会儿就吃完了，再多一点就好了。",2017-12-09 08:06:53
1130067,5,"双十一那天晚上下单的。很快就到了。梅子包装很好。打开尝了下，挺好吃的。值得回购",2017-11-12 17:35:56
1130067,5,"太咸了，太不健康了！！！",2018-08-14 09:47:05
1130067,5,"有点咸，酸酸的，独立包装，很卫生，就是觉得量有点少啊，一会就吃没了",2017-12-18 16:58:20
1130067,5,"华味亨以前经常买，吃了艳选的才发现华味亨的真是巨咸！这个正好刚刚好",2018-05-20 09:46:10
1130067,5,"买二送一装很划算，吃起来口感很好，酸甜适口。还会再买",2018-02-01 09:18:24
1130067,5,"一如既往的好吃，断货过一段时间，想的很，这次看到有货就又买了。",2017-12-17 00:21:32
1130067,5,"好吃 严选的零食大部分都挺好吃的 主要是色素香精糖什么的比较少 符合我对食物的要求 很满意 隔一阵子就要来一箱 逐渐变胖",2018-07-25 10:25:38
1130067,5,"回购商品，好吃，每个单独包装，方便卫生。",2018-08-01 16:58:27
1130067,5,"有陈皮的味道，夏天天气热，来一颗，生津止渴～～",2018-07-24 15:34:12
1130067,5,"好吃~N多次的回购",2018-07-17 15:47:31
1130067,5,"买二送一，单个包装，味道也不错。比某品铺子的划算多了。",2018-01-25 09:11:44
1130067,5,"哈哈<U+0001F604>11号下的单，赶在14号到啦！<U+270C>耶！太棒了，超级好吃的，自己准备的孕妇零食~健康零食~这个过年应该够吃啦~太开心了！",2018-02-14 15:20:27
1130067,5,"很好吃 第一次在网易严选买零食总体觉得还是很不错的～无论是包装还是品质都nice 以后的零食也会多在网易严选买",2018-02-07 16:58:54
1130067,5,"挺普通的，没什么好吃或不好吃的，没有日本的好",2018-08-06 10:39:17
1130067,5,"好好吃哦 性价比超高的 味道比全家的好吃",2018-06-23 09:37:08
1130067,5,"第二次购买了，因为很合口味，又有618活动折扣，很值",2018-06-18 10:07:51
1130067,5,"很棒 就是有点咸",2018-03-12 13:47:16
1130067,5,"出门旅游必备的单品",2018-03-09 17:44:30
1130067,5,"买了n多 评价麻烦 看我名字就知道 严选的东西有多么诱人 以上评价为自创 看见此条 就知道我又剁手了。。",2018-06-18 19:26:07
1130067,5,"酸酸甜甜的 吃了几片也不口渴 说明盐不多 不错",2018-07-14 12:42:16
1130067,5,"单独包装，没有核，放在口袋里偶尔用来解馋很不错。比较干的那种味道，感觉外面那层白白的粉也是酸的。口感一般性吧(个人口味，因为我比较喜欢奶油话梅和类似老梅干那种话梅)",2018-03-08 14:18:39
1130067,5,"好吃",2018-03-07 21:10:38
1130067,5,"买了n多 评价麻烦 看我名字就知道 严选的东西有多么诱人 以上评价为自创 看见此条 就知道我又剁手了。。",2018-06-18 19:25:38
1130067,5,"颜值高，味道好！价格合适，配送迅速！整体购物体验非常满意！",2018-06-03 21:39:57
1130067,5,"第一次在朋友家吃到便迫不及待下了单，炎热的夏日，唯有这酸酸的青梅能激发一些食欲",2017-07-31 17:28:43
1130067,5,"包装完美，口味地道，性价比高，十分完美.........",2018-06-05 09:35:04
1130067,5,"酸酸甜甜听开胃，味道比较重，牙不好的人只能少少吃一点",2018-05-28 19:47:07
1130067,5,"比较甜，不太酸不太咸，湿的，一会就吃完。",2018-05-15 10:33:08
1130067,5,"过年囤货，对严选食品安全很放心",2018-02-13 10:58:23
1130067,5,"爱上严选",2018-02-10 15:41:17
1130067,5,"比进口零食店的要好，每一颗都比较精致",2018-05-20 09:23:54
1130067,3,"味道不好",2018-05-17 11:29:35
1130067,5,"还没吃，包装挺好的，京东快递送来的，送货师傅挺认真的",2017-12-19 09:17:32
1130067,5,"还没吃，包装挺好的，京东快递送来的，送货师傅挺认真的",2017-12-19 09:17:36
1130067,5,"好吃到停不下 然后发觉口渴狂喝水 （笑哭）",2018-05-21 16:42:15
1130067,5,"看上去很是不错，希望味道一样好哦",2018-02-02 10:52:57
1130067,5,"味道不错！独立包装！",2018-02-02 20:48:20
1130067,5,"一入口很酸但是下一秒就感觉不是很酸了 口感赞！会回购哈哈哈哈哈而且独立包装 容易携带",2018-08-04 15:59:22
1130067,2,"一般",2018-05-15 15:37:43
1130067,5,"太甜了",2018-01-29 09:32:06
1130067,5,"",2018-01-28 11:57:48
1130067,5,"不会太咸也不会太酸，挺好的",2018-05-19 12:04:22
1130067,5,"买了很多次，小孩子们都很喜欢的",2018-04-18 13:21:16
1130067,4,"陈皮梅饼，比‘日式梅饼’略干，也比较软，吃到最后口感差不多",2017-12-28 12:29:14
1130067,5,"买来这个是送人的，她很喜欢卖家的贴心让我感到很温暖以后我还会来选的",2018-07-19 14:09:01
1130067,5,"这不是准备再回购么 我就喜欢这种酸酸咸咸的 特别生津 宝宝也爱吃 哈哈",2018-07-18 23:33:19
1130067,5,"好吃，包装精细，独立个体，一袋约16个",2018-01-23 16:50:20
1130067,5,"",2018-01-21 12:52:42
1130067,1,"质量不错，这次下单和收货，中间的时间太长了.",2018-08-03 15:19:10
1130067,5,"一直都是最爱，但是忽大忽小",2018-05-14 20:21:54
1130067,5,"好次呀",2018-01-18 12:42:47
1130067,5,"有点咸的，但是味道挺好",2018-05-11 07:55:12
1130067,5,"颜值高，里面是独立小包装的，口感酸甜适中",2018-01-12 16:54:15
1130067,4,"很好吃，量不多但每一粒分量都很足。但我吃出来了一颗直径2毫米的石子<U+0001F642>",2018-07-08 02:15:07
1130067,5,"好吃是好吃，就是挺贵的",2018-01-11 13:20:45
1130067,5,"诏安的特产，四年前舍友的见面礼就是这个，没想到现在身价翻了好几倍。味道呢，还不错，就是不够酸",2018-08-19 23:11:57
1130067,1,"对严选的物流真是无语了，订单提交了4天，催了客服两次才发货，失望！",2018-05-03 21:05:00
1130067,5,"喜欢梅子。",2018-01-09 21:22:52
1130067,5,"满意",2018-01-09 12:27:35
1130067,5,"梅饼好吃，本来就不是特别能吃酸的，不过这个就很合我的口味，就是量略少",2018-07-03 22:07:36
1130067,5,"有点小贵，但是很惊喜，比在零食店里买的好吃很多，果肉饱满，也不是很酸。",2018-07-02 15:04:50
1130067,5,"",2017-12-29 16:28:46
1130067,5,"",2017-12-29 16:28:49
1130067,5,"好吃 独立包装很方便",2017-12-27 13:22:16
1130067,5,"父亲节的小礼物，老爸很喜欢吃，我是老爸的最爱，严选是我的最爱。",2018-06-21 18:09:12
1130067,0,"包装很精致细腻(*￣3￣)q<U+2661><U+2740>小花花砸你
味道也一级棒(<U+0E51><U+275B><U+1D17><U+275B><U+0E51>)",2017-06-21 22:47:31
1130067,5,"每次购买总归和日式梅饼搭着一起买，换着吃吃，不过老婆还是偏爱日式口味的。",2018-06-18 23:03:02
1130067,5,"偏甜了些，只能说一般般吧",2018-05-08 23:11:25
1130067,5,"高逼格的包装，个人觉得不够酸，但味道很好，这一包大概只够我加一次班～",2017-07-22 01:36:01
1130067,5,"有点儿太酸了",2018-04-30 23:06:50
