"itemId","star","content","createTime"
1130058,5,"梳妆台东西太多，不好打扫卫生，现在就规整多啦",2018-08-19 13:26:50
1130058,5,"抽屉柜很迷你可爱！",2018-08-11 09:10:14
1130058,5,"质量超好很好装，大小是想要的，放的小朋友的东东，很喜欢<U+0001F60D>",2018-08-08 18:03:43
1130058,5,"轻便无烟
快速加热

安全无毒
节约能源

健康耐用
易于清洗",2018-08-05 14:40:49
1130058,5,"轻便无烟
快速加热

安全无毒
节约能源

健康耐用
易于清洗",2018-08-05 14:40:14
1130058,5,"安装方便，质感好，颜色无色差，老婆乱七八糟的化妆品有地方放了，增加生活整齐度，好好好！",2018-06-09 13:01:21
1130058,5,"好棒的收纳柜，质量太好了，木质拉手很显档次哦喜欢极了，准备再入别的颜色<U+0001F60A>",2018-04-18 09:15:02
1130058,4,"真的很小咯，不过组装非常简易，价格确实太贵了，拼团的价格都太贵原价就不用说了",2018-04-17 08:31:45
1130058,5,"加价换购的超级划算呢，收纳柜比想象中厚实牢固，挺有质感的，容量也不算小，很不错。",2018-03-22 23:24:41
1130058,5,"很实用的收纳，可以把很多小东西理好，小朋友的袜子内裤小配件都进去了，台面就清净了",2018-03-17 12:20:05
1130058,5,"非常好就是太小了，所以说嗯，退了，希望有稍微大一点的这样的话可以说拿很多东西。",2018-03-21 23:44:05
1130058,5,"质感很不错，可以放护肤品，小东西，容易收纳，感觉颜色买深了，淡色的会更好看！",2018-04-23 17:47:28
1130058,4,"像个小家具，不知道用久了，布纸会不会粉，换购的，也很值了^_^",2018-03-26 21:18:36
1130058,5,"非常满意，盒子很大。
用起来不错，感觉空间一下子多出来好多。
总之，非常满意的一次购物！",2018-04-01 12:02:30
1130058,5,"抽屉间不是太吻合，但大小刚刚好，放办公室里很合适",2018-07-24 09:42:06
1130058,5,"",2018-08-13 12:04:00
1130058,5,"给妈妈买的，很喜欢。",2018-08-12 21:00:51
1130058,5,"质量很好，就是有点小了，大点就好了。",2018-07-29 11:55:56
1130058,5,"还不错，颜色好看。",2018-08-05 18:40:18
1130058,5,"",2018-08-05 22:37:13
1130058,5,"",2018-08-05 09:11:09
1130058,5,"非常满意，再大点更好，手边几乎全是网易严选，非常不错的产品。",2018-06-01 15:08:56
1130058,5,"轻巧方便 拿来用作日常药箱 分开收纳日常药与药用具",2018-07-08 22:37:52
1130058,5,"比我想象的小两倍都不止，哎，后悔",2018-07-13 22:46:57
1130058,5,"放在衣柜里，放小的内衣 还是不错的",2018-07-04 13:32:49
1130058,5,"非常喜欢",2018-07-04 10:17:34
1130058,5,"包装干净整齐
发货速度真的很快
售后也热情
转粉啦，哈哈",2018-03-20 22:54:09
1130058,5,"很好特别好客服特别用心反之就是特别好，布料也很好",2018-05-17 16:32:28
1130058,5,"一元加购来的，窃喜哦，喜欢的颜色",2018-06-20 12:59:53
1130058,5,"还不错还不错还不错。",2018-06-20 08:10:56
1130058,5,"很漂亮的收纳箱",2018-06-18 11:32:47
1130058,5,"不错，质地很好，严选的东西样样都是精品",2018-06-11 14:49:42
1130058,5,"边角收纳，还是很不错的。",2018-06-09 16:32:12
1130058,5,"超级好",2018-06-09 18:53:36
1130058,5,"好喜欢，质量非常好，女儿一个，我一个，装点小饰品太棒了，非常美观",2018-04-15 08:56:34
1130058,5,"质量还不错，就是感觉小巧了点",2018-06-06 23:01:42
1130058,5,"做工很精致，分袋装很细心，值得拥有",2018-06-04 19:16:20
1130058,5,"非常不错很好用",2018-06-02 14:01:04
1130058,5,"3.9换购的，但质量超好，给老公放内裤和袜子啦！颜色正。",2018-03-20 12:44:08
1130058,5,"组装起来很方便，不需要工具，没有异味，方便收纳还想再买几个放在客厅的桌上，这样可以减少东西散在外面，严选的东西，品质还是比较过关的",2018-05-13 14:14:45
1130058,5,"非常实用，目前基本上是非严不选了。",2018-05-31 07:58:42
1130058,5,"质量很好！",2018-05-31 23:13:32
1130058,5,"",2018-05-31 11:24:45
1130058,5,"好 一次买了2个 质量很好！",2018-05-25 21:08:38
1130058,5,"美观 实用 ！",2018-05-25 21:07:45
1130058,5,"不错！",2018-05-24 21:32:54
1130058,5,"",2018-05-23 20:10:12
1130058,5,"虽然没有想象中那么大，但质量很好，安装方便，放在桌上美观大方",2018-04-09 21:59:18
1130058,5,"加价购的一款商品，很满意，能放一些宝宝的玩具。值了。",2018-04-18 18:00:29
1130058,5,"这个3.80的换购太超值了，跟我原来的收纳箱还挺配套",2018-03-20 16:31:51
1130058,5,"很不错",2018-05-10 11:39:18
1130058,5,"",2018-05-06 20:11:48
1130058,5,"相当不错的收纳柜，妈妈放在床头觉得很方便",2018-05-04 08:27:27
1130058,5,"包装的很好，组装也非常简单，不需要看任何说明书，不需要工具，用手就非常容易的组装好，放在办公桌上很满意，琐碎东西放进去收纳起来，方便！",2018-04-23 09:38:09
1130058,5,"拼的，小巧可爱，装化妆品",2018-04-29 15:35:19
1130058,5,"这个颜色很耐看，质量不错，尤其是把手很方便。很实用。",2018-04-15 12:18:09
1130058,5,"挺好，精致的",2018-04-25 06:01:07
1130058,5,"漂亮实用，材质舒适耐磨。",2018-04-24 00:10:30
1130058,5,"",2018-04-24 08:37:49
1130058,5,"很有质感",2018-04-23 12:31:32
1130058,5,"真的也就值这个价格",2018-04-18 23:53:29
1130058,5,"很满意！！！",2018-04-16 21:53:04
1130058,5,"",2018-04-16 13:22:57
1130058,5,"很棒哦，放钥匙和门禁非常方便",2018-04-15 18:17:38
1130058,5,"一起两个，非常满意",2018-04-15 08:57:13
1130058,5,"",2018-04-12 19:38:10
1130058,5,"东西还可以，收纳一些小物件不错",2018-04-10 12:57:35
1130058,5,"一如既往的不错",2018-04-10 13:53:34
1130058,5,"很厚实，颜色特别好看，容量很大。",2018-04-09 10:08:58
1130058,5,"这个大爱，不然护肤品没地方放，颜值高，换购超值，喜欢",2018-03-26 11:31:05
1130058,5,"很喜欢，收纳让生活更简单",2018-04-07 10:50:47
1130058,5,"一直想买个小抽屉盒放桌上，这款性价比甚是不错，色彩又耐脏。实物比想象中重很多，所以组装起来蛮结实，抽屉钮居然是木质的，略意外，逼格又小小提升了一把",2018-04-07 15:21:24
1130058,5,"谢谢",2018-04-05 23:53:41
1130058,5,"",2018-04-03 21:40:04
1130058,4,"小巧方便 做功也不错 没气味 满意",2018-04-02 22:53:15
1130058,5,"还行",2018-03-31 21:36:04
1130058,5,"质量不错 花了8元换购 很喜欢",2018-03-30 07:42:53
1130058,5,"一下子拍了两件，用来收纳丝巾，刚刚好。爱人推荐的颜色，和家居环境相得益彰。喜欢网易严选的产品，花费不多却称心如意。有什么比只选对的更让人赏心悦目呢。非常满意，有需要，会再来。祝网易严选越办越红火，加油，么么哒！",2018-03-30 13:38:38
1130058,5,"小巧玲珑很可爱，收藏小杂物好找。正洁。质量很好。谢谢了。",2018-03-16 16:43:57
1130058,5,"喜欢这个颜色，大方好搭配",2018-03-25 16:37:43
1130058,5,"很精致的做工，特别喜欢这个颜色，百搭",2018-03-21 13:14:19
1130058,5,"有了它桌面瞬间整齐了",2018-03-22 07:49:52
1130058,5,"看着不错 还没有 颜色也可以 没有失望",2018-03-20 21:46:08
1130058,5,"3.8加价购买的，装点小东西还是不错的",2018-03-17 11:19:05
1130058,5,"可以",2018-03-20 20:02:35
1130058,5,"",2018-03-19 00:58:32
1130058,5,"很好看",2018-03-16 13:31:03
1130058,5,"质量不错，感觉有点小了",2018-03-15 19:26:07
1130058,5,"安装方便，不错，比想象中小",2018-03-15 09:34:54
1130058,5,"挺好看",2018-03-13 16:06:15
1130058,5,"没想到昨天才下的单，今天就收到了。很满意的一次购物。就是严选的东西都要运费。",2018-03-09 22:46:02
1130058,5,"很实用，收纳小巧轻便的物件，只是比自己预料中的小很多，大小高度跟塑料板凳差不多吧",2018-03-07 15:20:15
1130058,5,"颜色挺喜欢安装挺方便，收纳功能也挺强的，除了边上的布会露出来，别的都还可以。",2018-03-03 13:13:43
1130058,5,"颜值还是很好的，打算在妈妈家坐月子，临时利用一下空间，放些杂物，美美的看着心情好！",2018-02-26 09:02:57
1130058,5,"很实用的小抽屉，质感很好，解决了小东西的收纳问题，有点小贵，准备特价时再入手几个",2018-02-11 02:31:05
1130058,5,"我放在餐边柜上的，专门放置小零碎的东西。我是满500元换购得来的。",2018-03-12 10:39:58
1130058,5,"很精致的一款小宝贝，包装的细密工整，宝贝的精巧实用，严选，所以出奇制胜中有一种扎扎实实的投入……让人感动!",2018-06-15 22:44:01
1130058,5,"我这样的姑娘也可以很容易自己整理～超级喜欢，桌子不用乱乱的，要做一个精致美美的姑娘",2018-01-12 17:34:01
1130058,4,"实物比照片小呢，可以放点小物件，其实没啥大用处，为了凑单买插线板才买的。也还可以吧",2018-03-12 13:06:53
1130058,5,"质量很棒，包装也很用心，出差回来就收到了，物流很快，还会再次购买！",2018-08-08 13:20:46
1130058,5,"质量很好，比想象中要大一点，配件齐全，拼装也超级容易，简便，可以随时拆分带走，收纳也很将就，好评",2018-01-02 16:27:59
1130058,5,"丁三石果然货真价实，非常喜欢！有品位，时尚，性价比高！继续吧，实体店快来吧！",2018-03-10 14:03:59
1130058,5,"赠品，简单实用，准备用来放媳妇的化妆品和首饰，省的买首饰架了。",2018-06-24 06:20:58
1130058,5,"其实这款收纳盒不算大、但用来装首饰或者其他小东西足够了。刚好我用来装首饰。<U+0001F60A>",2017-10-22 00:32:16
1130058,5,"限时购抢到的 款式百搭 和化妆柜整体风格很搭 满分",2018-03-04 14:50:59
1130058,5,"软，设计不合理，一般满意",2018-08-08 18:00:58
1130058,5,"有了它之后桌子整齐多了，很好～! 现在已经彻底爱上网易严选了，品质有保证！",2017-10-10 13:35:55
1130058,5,"还不错，比名创优品的做工好很多，当然价格也贵了不少
1名创2严选",2017-09-23 14:56:37
1130058,5,"很好安装，可以放零钱名片充电线一切小东西，桌面瞬间干净了",2018-03-12 18:31:08
1130058,5,"质感很好，一如既往的支持严选，还要感谢京东小哥们的优质服务！",2018-03-07 15:09:43
1130058,5,"颜色质量都很好，感觉像到了无印良品那里买东西一样，已经第二次在严选买东西了，会继续购买。",2017-09-08 15:10:14
1130058,5,"简洁大方，大小合适，可以放充电器，卡包之类的物件，还不占地方。",2018-02-26 17:29:49
1130058,5,"实物比想象的小，做工不错，颜色好搭，收纳也方便，入了两个，以后还想慢慢入。",2017-09-25 19:54:16
1130058,5,"实物比想象的小，做工不错，颜色好搭，收纳也方便，入了两个，以后还想慢慢入。",2017-09-25 19:54:20
1130058,5,"质感很好，但是实物和图片比有点小",2018-08-08 22:48:12
1130058,5,"女王节的时候加3块8换购的，绝对的收纳小能手",2018-03-13 00:32:14
1130058,5,"是三月八号<U+0001F235><U+FE0F>换购，三块八就得到，超值",2018-03-13 10:30:47
1130058,5,"很赞的收纳柜，颜值高，质量很好，满额加价购的，很划算哦",2018-02-08 08:45:37
1130058,5,"质量很不错，没有异味。就是抽屉无法和外框完全贴合上，缝隙比较大。",2018-07-04 21:59:51
1130058,5,"还行，放太重物品不好拉",2018-08-19 05:15:20
1130058,5,"放床头还不错，去掉线天就更好了，再精致些",2018-03-07 13:50:49
1130058,5,"太袖珍了",2018-07-08 14:11:11
1130058,5,"试用中，简约风很好。无纺布容易风化脆裂，等用用看。买的时候注意提前关注下尺寸，我买小了。",2017-10-16 20:21:36
1130058,5,"小巧精致，颜值高，适合放一些小东西，也不占地方～",2018-03-11 11:46:07
1130058,5,"比想象中的小，不过安装简单，可以收纳些小东西！",2018-03-07 15:11:59
1130058,5,"好看，就是有点味道，然后抽屉缝隙有点大，可能会进灰，品质很好",2018-07-25 08:49:39
1130058,5,"用来放放袜子内裤什么的还挺合适的",2018-03-11 08:06:08
1130058,5,"感觉质量很好！没有味道！颜色要是更多就更好了！",2018-02-24 23:22:19
1130058,5,"超满意的，想把东西全换成网易严选的！",2018-03-10 21:45:50
1130058,5,"自己拼装的 很简单 实用 颜值也高 很不错",2018-03-10 15:41:47
1130058,5,"挺好颜色很正，味道不大，但是我洗了，不知道里面是纸板还是什么。等晾干，本来以为很小，想放门口装钥匙啥的，发现挺大的，最后决定装我的化妆品了。照片你们参考别人的吧，我是49拼团买的，觉得挺好。买了一堆严选加的，简单质量又很好，喜欢！",2018-07-07 15:22:28
1130058,5,"绝对的收纳神器，盒子支撑很好不易挤压变形，几种配色都绝美",2018-01-02 22:44:28
1130058,5,"容量挺大，能装不少东西，零碎不再吃灰了。",2018-03-08 20:25:28
1130058,5,"很好看，也实用，放一些小东西挺好～",2018-03-11 11:47:06
1130058,3,"1.色差 2.每次打开都要拿另外一只手扶着，特别不稳 3.盒子好小 综合评价，中看不中用。",2018-07-05 17:52:27
1130058,5,"质量很好，把零碎的东西都放好了，心情大好",2018-03-02 21:12:25
1130058,5,"这个换购太值了，果绿色真美。",2018-03-11 12:54:40
1130058,5,"几块纸板，不值这个价",2018-06-18 00:14:32
1130058,5,"太喜欢了，桌面整洁多了",2018-03-12 22:31:09
1130058,4,"被图片忽悠了！收到货后比相象中的尺寸小的多！将就吧！",2018-06-11 23:19:27
1130058,5,"好是好看，但是是很小的很小的喔…",2018-06-11 19:24:31
1130058,5,"用了也很久了，抽屉外观不错。就是抽拉的时候是没那么方便的。毕竟都是布艺的。",2018-06-20 10:47:47
1130058,5,"3.8元换购的，非常不错，好喜欢<U+0001F618>",2018-03-09 15:15:35
1130058,5,"还未弄，物流很快，售后服务好",2018-03-11 18:20:59
1130058,5,"很多小东西装进去方便多啦，性价比不错",2018-02-28 14:02:18
1130058,3,"不太牢固",2018-06-13 12:55:48
1130058,5,"",2018-03-11 09:09:29
1130058,5,"",2018-03-11 21:34:01
1130058,3,"这个抽屉最大的问题就是阻力太大，没法单手拉出来",2018-06-05 22:48:12
1130058,5,"加价购的小抽屉也很不错，儿子跟喜欢",2018-03-08 21:25:54
1130058,5,"四个颜色集齐了   可以召唤神龙了吗",2018-03-09 19:59:22
1130058,5,"挺好 给孩子一个我用一个",2018-03-10 21:16:46
1130058,5,"我的房间有了新家具了",2018-03-10 22:36:48
1130058,5,"无色差，室友都很羡慕呢",2018-03-10 08:38:16
1130058,4,"一般般吧，摸着小把手还是可以的，收纳的布料还可以，装好感觉没有那么合缝，不知道是什么原因。",2018-05-01 10:47:19
1130058,5,"四色集齐，可以召唤神龙了吗？",2018-03-09 13:11:20
1130058,5,"女神节活动3.8元到手，实惠又实用。",2018-03-08 13:01:23
1130058,5,"换购的 放在寝室挺实用的",2018-03-09 17:14:33
1130058,5,"一直在找这种放小物的抽屉，组装轻松，颜色清新，关键是不怕灰尘～很满意。美中不足的是抽屉合上后会有一条缝，契合度再好一些就更完美了。",2018-05-14 17:37:14
1130058,5,"非常好，容量很大，安装方便",2018-03-09 13:30:35
1130058,5,"组装方便，一切都不错，就是快递来的外包装纸箱味道太大，一开始一直怀疑收纳柜是不是也大味道，后来把纸箱扔了就好了....",2018-05-06 13:05:07
1130058,5,"四个颜色都集齐了",2018-03-09 19:58:22
1130058,5,"看着不错。",2018-03-09 13:20:13
1130058,5,"闲置了！",2018-04-24 01:52:53
1130058,5,"",2018-03-09 11:52:44
1130058,5,"质量好，也大。孩子用正好",2018-03-08 17:04:17
1130058,5,"还没有拼装 看着不错",2018-03-07 22:00:07
1130058,5,"质量好，细节很到位，满意",2018-03-07 20:55:24
1130058,5,"",2018-03-07 16:10:33
1130058,5,"不错，喜欢。",2018-03-03 17:36:55
1130058,5,"有逼格 但二三抽屉很紧 不好拉",2018-05-01 07:25:28
1130058,5,"安装很方便，质量不错<U+0001F44D>准备回购多一个",2018-02-27 20:46:41
1130058,5,"很好装也很好用",2018-06-12 09:21:00
1130058,5,"小朋友都会安装，很方便，就是…包装好大<U+0001F602>",2018-02-22 21:42:37
1130058,5,"非常喜欢，等再入手一个送姐姐！",2018-02-27 18:32:23
1130058,3,"质量一般，软趴趴",2018-05-03 12:50:59
1130058,5,"很喜欢，刚拿到手",2018-02-27 16:37:05
1130058,1,"这个评价是针对网易严选，不是针对这个商品。实话说，我网购经验很多，严选看着确实不错，所以在严选也买过不少。但现在打算把网易严选从本人的网购清单中删除，因为你的管理太乱，客服太笨，物流太慢，售后体验太差！最近买个床垫，因为太厚了，需要退货，为了这个退货，我算领教了网易的磨洋工了，拖着不退款，各种催，各种不清不楚的答复。",2018-04-14 16:00:15
1130058,5,"拼装很简单，抽屉的把手是通过十字螺丝固定的 不需要十字螺丝，用手就可以",2018-04-24 22:51:48
1130058,5,"木的小把手是自己旋上的",2018-04-16 14:02:57
1130058,5,"储物柜里之前乱糟糟摆了一堆杂物在里面。现在有了这个抽屉收纳柜，瞬间整洁了，里面连小的铅笔雨伞都能放进去，收纳功能非常强大。小空间收纳必备。",2018-02-19 00:45:32
1130058,5,"挺合适的，能装很多东西",2018-02-25 19:21:58
1130058,5,"喜欢 不错",2018-02-25 20:07:13
1130058,5,"很好啊 好评",2018-02-23 17:39:12
1130058,5,"质感很好，非常好，就是有点鸡肋，不知道放什么东西，因为抽拉的时候不是那么固定。",2018-04-10 10:21:49
1130058,5,"还不错，拿到手就安装了，颜值质量都不错",2018-02-11 13:26:29
1130058,5,"1元加价购，还不错啦，但如果不是家价购，不会买",2018-08-11 11:23:24
1130058,5,"没有味道，颜色很正",2018-06-03 19:12:00
1130058,3,"没有想像的好",2018-04-10 22:44:37
1130058,5,"很好很满意，尺寸刚刚好",2018-02-17 09:46:29
1130058,5,"拿来装小孩子射袜子！",2018-02-17 09:39:48
1130058,5,"不能更满意，严选的产品已经遍布家里各个角落",2018-02-14 22:56:41
1130058,5,"非常棒哦，和描述的一样",2018-02-12 22:25:31
1130058,5,"超级满意！超级好拼装！连我这种高级别手笨的人儿，没用两分钟就搞定了。放在床头还挺能装各种杂七杂八的东西呢！乱糟糟的地儿，顿时就清爽了。",2018-02-07 20:26:27
1130058,5,"",2018-02-06 12:54:26
1130058,5,"东西不错，喜欢",2018-02-05 17:26:41
1130058,5,"印度哲学家克里希那穆提说过：“不带评论的观察是人类智力的最高形式。”说的就是，聪明人之间的沟通，从来都只讲事实，不评论，不诛心。",2018-07-30 22:14:07
1130058,5,"买来这个是送人的，她很喜欢卖家的贴心让我感到很温暖以后我还会来选的",2018-07-20 16:32:53
1130058,5,"质量非常好很喜欢质量非常好很喜欢",2018-01-20 23:19:14
1130058,5,"网上购物这么激烈，没想到店家的服务这么好，商品质量好而价低廉，我太感谢你了!",2018-07-20 16:42:45
1130058,5,"特别膨，很好用",2018-01-11 17:16:45
1130058,5,"很好用的抽屉 放在书架上，高度进深都特别合适。用来放耳机手机充电器，非常好用，且养眼",2018-07-04 23:47:42
1130058,5,"我以为是床头柜那么大，结果还小的收纳柜<U+0001F604>",2018-04-07 17:11:37
1130058,5,"三个刚好挤进柜子上",2018-01-09 01:40:53
1130058,5,"送的小抽屉！",2018-04-09 02:59:15
1130058,5,"非常方便",2018-01-09 01:41:40
1130058,4,"质量还行，放在桌子上放点杂物，把手木质的感觉。",2017-12-30 10:46:14
1130058,5,"自己买了两个又安利给了小伙伴，质量出奇地好",2017-12-28 00:32:44
1130058,5,"很好很好～就是我把尺寸看错了，要放的地方放不下<U+0001F602>",2018-04-08 21:48:07
1130058,5,"质量不错，摆在电视柜里好看",2017-12-31 11:37:38
1130058,5,"正好",2017-12-31 18:49:07
1130058,5,"完美，非常好",2017-12-27 17:44:24
1130058,5,"非常好",2017-12-27 17:45:54
1130058,5,"不中奖吗",2018-03-31 11:17:42
1130058,5,"小抽屉柜不错，装些小东西很方便，放桌上也不占位子",2017-10-22 10:12:05
1130058,5,"一下子买了两个，还没安装，看买家秀还是不错的。",2017-11-24 11:02:37
1130058,5,"质感好。很喜欢。能收纳很多小东西。快递很快。但是装的盒子太大了，浪费的很。",2018-07-07 18:58:50
1130058,5,"做工不是很细腻，缝隙很大，也不是很稳",2018-03-26 10:26:01
1130058,5,"容易整个移动，抽的时候要扶住才行",2018-03-22 16:01:37
1130058,5,"换购产品，不太满意。",2018-04-06 13:21:36
1130058,5,"质量不错，就是小贵，东西放多了就不好抽拉了",2017-11-03 15:10:04
1130058,5,"比较软的柜子，顶上不能压重物。组装很方便。放书桌上很好看。",2018-03-21 20:07:33
1130058,5,"还行吧",2017-12-14 09:36:16
1130058,5,"真心不错  希望耐用些",2017-12-13 13:47:54
1130058,5,"这个收纳柜非常的实用，放放内衣内裤袜子刚好。如果放在桌面的话，桌面也被收拾得非常的干净。",2018-06-03 09:41:02
1130058,5,"收纳小件物品的首选，赞！",2017-12-11 13:18:51
1130058,5,"小了些，但是很精致，放在桌面上，收纳起来清爽多了！",2017-11-14 19:05:08
1130058,5,"很实用，灰色经脏，安装起来也非常方便，满满的逼格。最重要的是只要50块钱<U+0001F4B0>",2018-06-09 01:30:08
1130058,5,"非常满意，已经是回购了，这个绿色很好看。",2017-12-03 16:13:37
1130058,5,"满分，清爽干净！",2017-12-07 19:58:19
1130058,5,"回购的第二个，放床头柜上，很实用。",2017-12-06 20:59:39
1130058,5,"这个一般",2018-03-19 21:13:54
1130058,5,"非常好，可以放些小饰品。桌子干净整洁",2017-12-05 15:14:01
1130058,5,"以为是木制的，不过仿布的也不错挺精致小巧的，给娃装袜子之类的足够了",2018-06-19 09:00:16
1130058,5,"挺好的，就是比想象中的大好几圈，还有就是不那么好拉开",2017-09-16 20:27:34
1130058,5,"超值换购买的，颜色心水，摆在桌上又好看又能收纳，让桌面更整洁",2018-08-06 09:10:53
1130058,5,"方便收纳，又有颜值！",2017-12-03 13:51:20
1130058,3,"没有想象中那么好用，一般。",2018-03-19 07:17:46
1130058,5,"哈哈哈很可爱啊，正好放到衣柜里放袜子什么的，严选拼团更实惠",2017-10-23 16:30:25
1130058,5,"比预想的要小一些，不过放在衣柜里做小件收纳也是可以的。质量确实不错，很有份量感，亚麻质地配上复古小抽屉钮扣很美貌。如果更便宜些就多入两个好啦（V<U+3268>V）",2017-12-02 11:07:58
1130058,5,"真不错，就是挺小的，看我手掌的比例，供参考",2017-11-16 18:26:48
1130058,1,"甲醛严重超标，国家标准是0.08",2018-03-17 23:21:31
1130058,5,"主体框架是要拉链拉起来的，在凑成一个框，所以整体不是很稳，应该改进为只用支架的来会稳固，要是原价买估计我马上退货。还好只是加3.8元送的。",2018-03-13 11:05:23
1130058,5,"产品质量几好",2017-12-02 19:38:30
1130058,5,"很喜欢",2017-12-02 18:25:32
1130058,5,"收纳控 特别喜欢 看着都开心",2017-11-30 16:03:36
1130058,5,"挺好的，放内衣袜子很合适，最喜欢这晶莹的拉手哈哈哈哈",2017-10-19 22:10:25
1130058,5,"",2017-11-26 20:02:24
1130058,5,"黄绿搭配，很赞，能装不少东西",2017-11-23 12:15:15
1130058,5,"质量不错",2017-11-23 09:25:44
1130058,5,"拼装简单，好了，这下东西都有地方放了。",2017-11-10 09:40:23
1130058,5,"一般般味道有点大",2018-03-17 19:58:31
1130058,5,"这个不是很方便拉开抽屉",2018-03-18 23:46:43
1130058,5,"这个有点小",2018-03-13 12:34:11
1130058,5,"比较小，异味很重",2018-03-11 22:59:44
1130058,3,"有点小。",2018-03-16 18:45:59
1130058,5,"很赞",2017-11-18 21:41:37
1130058,5,"",2017-11-18 16:28:45
1130058,5,"收到还没打开，相信严选品质",2017-11-17 22:36:35
1130058,5,"整体不错，就是有一格抽屉稍微一些紧",2018-03-12 13:51:42
1130058,5,"收到还没打开，相信严选品质",2017-11-17 22:37:15
1130058,5,"之前活动买了好多东西赠送了几个，放在儿子的房间收纳玩具，文具都很实用。颜值也挺好的，跟家具白搭。",2018-05-28 13:29:03
1130058,5,"收纳很方便",2017-11-16 10:59:24
1130058,5,"",2017-11-16 15:27:42
1130058,5,"质量很棒，包装也很用心，出差回来就收到了，物流很快，还会再次购买！",2018-08-08 13:19:23
1130058,5,"质量很棒，包装也很用心，出差回来就收到了，物流很快，还会再次购买！",2018-08-08 13:19:28
1130058,5,"质量很棒，包装也很用心，出差回来就收到了，物流很快，还会再次购买！",2018-08-08 13:20:41
1130058,5,"质量扎实，不过抽拉不方便",2017-11-11 17:37:13
1130058,3,"算是赠品了，整体还行，颜色也不错。
主要是味道，很大味道，晒了2天还是有胶水味（甲醛吧）。",2018-03-09 16:48:07
1130058,5,"味有点大",2018-03-12 20:45:47
1130058,5,"不错！",2017-11-11 13:08:01
