"itemId","star","content","createTime"
1130057,5,"很好啊",2018-03-21 17:25:29
1130057,5,"还不错",2018-03-21 21:49:44
1130057,5,"质量不错",2018-03-21 21:09:46
1130057,5,"很满意",2018-03-21 19:06:46
1130057,5,"很好",2018-03-21 20:43:47
1130057,5,"小号真的太小了，要买的可考虑了",2018-03-17 09:43:01
1130057,5,"美貌，大小放春夏秋装合适！",2018-03-20 21:37:48
1130057,5,"美貌，大小放春夏秋装合适",2018-03-20 21:38:09
1130057,5,"非常好，大爱网易严选！",2018-03-20 10:49:36
1130057,5,"可以哦，放宝宝的衣服。",2018-03-20 17:57:14
1130057,5,"很不错，跟照片一样",2018-03-20 21:51:27
1130057,5,"很漂亮，质量可以",2018-03-20 10:59:49
1130057,5,"相信严选的品质",2018-03-20 11:28:34
1130057,5,"相信严选的品质",2018-03-20 11:28:39
1130057,5,"满意，质感不错",2018-03-20 10:59:54
1130057,5,"超级好用",2018-03-20 14:16:14
1130057,5,"超级好用",2018-03-20 14:16:19
1130057,5,"好用",2018-03-20 14:16:54
1130057,5,"好东西",2018-03-20 14:17:03
1130057,5,"好用",2018-03-20 14:17:09
1130057,5,"好用",2018-03-20 14:17:14
1130057,5,"我们的",2018-03-20 17:50:22
1130057,5,"不错",2018-03-20 09:55:11
1130057,5,"不错",2018-03-20 01:33:36
1130057,5,"可爱",2018-03-20 18:56:29
1130057,5,"不错",2018-03-20 01:00:07
1130057,5,"漂亮",2018-03-20 18:52:10
1130057,5,"很好很好哦，收集杂物小小东西刚刚好",2018-03-18 13:47:12
1130057,5,"做工好无异味 如果有更大的就好了",2018-03-16 19:36:09
1130057,0,"速度很快，昨天拍的今天就到啦",2017-05-22 14:29:09
1130057,0,"没有味道特别赞～又下单了两个哈哈哈～期待",2017-05-21 14:42:58
1130057,5,"非常喜欢，如果有大款就更好了！",2018-03-19 21:16:48
1130057,5,"严选的包装太浪费，看着心疼",2018-02-28 13:09:29
1130057,5,"这个感觉有点色差，不过很有质感。",2018-02-28 08:21:31
1130057,5,"还不错 就是没有想象中那么大",2017-11-13 22:21:04
1130057,5,"还没用。看着还可以。",2018-03-19 17:41:23
1130057,4,"怎么说，够大，还好，其实翻盖也得设计一个小开关易于开合~",2017-09-02 00:11:41
1130057,5,"还行，做工可以。结实",2018-03-19 11:17:27
1130057,5,"质量挺好的",2018-03-19 10:35:59
1130057,5,"还行",2018-03-19 14:30:50
1130057,5,"材质好",2018-03-19 15:17:27
1130057,5,"美丽",2018-03-19 13:24:04
1130057,5,"颜值高",2018-03-19 14:57:27
1130057,5,"好",2018-03-19 23:18:24
1130057,5,"好",2018-03-19 23:18:29
1130057,5,"好",2018-03-19 10:45:17
1130057,0,"特喜欢，追加的哈哈哈～",2017-05-22 14:28:41
1130057,5,"还可以，没有异味，这点很棒",2018-03-18 09:08:53
1130057,5,"宝贝性价比很高，值得推荐",2018-03-18 18:22:02
1130057,5,"非常好，大小适中，收纳方便",2018-03-18 11:20:25
1130057,5,"盒子挺厚实，颜色很漂亮",2018-03-18 21:47:42
1130057,5,"大小正好，可以装很多东西",2018-03-18 21:47:59
1130057,5,"这个很棒，五星好评。",2018-03-18 10:10:06
1130057,5,"收纳盒质量不错",2018-03-18 14:57:40
1130057,5,"颜值太赞",2018-03-18 23:13:40
1130057,5,"一般",2018-03-18 16:45:19
1130057,5,"不错",2018-03-18 00:07:13
1130057,5,"不错",2018-03-18 19:27:55
1130057,5,"严选商品必是精品，说的一点不错<U+0001F44D>，不管在严选里面买的什么，质量都挺好的，会一如既往地支持严选，希望多上新，有更多的选择！",2018-03-13 22:10:25
1130057,5,"很满意，家里有三个同类型的收纳盒了",2018-03-16 13:52:47
1130057,5,"虽然是赠品～但是真的质量很好",2018-03-17 09:46:59
1130057,5,"买了4个了，都挺好的",2018-03-17 20:54:15
1130057,5,"超大一个 可以放很多东西了",2018-03-17 19:51:36
1130057,4,"比想象的要小",2018-03-17 11:10:00
1130057,5,"好看，第二次买了",2018-03-17 13:51:29
1130057,5,"感觉略小一点",2018-03-17 10:57:14
1130057,5,"颜色美丽 实用",2018-03-17 10:04:49
1130057,5,"一如既往的好",2018-03-17 01:51:48
1130057,5,"挺好的！",2018-03-17 02:02:56
1130057,5,"挺好的！",2018-03-17 02:03:01
1130057,5,"好不错。",2018-03-17 22:09:29
1130057,5,"很好",2018-03-17 02:03:18
1130057,5,"很好",2018-03-17 02:03:22
1130057,5,"很好",2018-03-17 13:42:59
1130057,5,"一般般",2018-03-17 16:14:53
1130057,5,"超好。",2018-03-17 22:08:22
1130057,5,"真的质量非常好，严选中毒已深。",2018-03-16 09:25:48
1130057,5,"大小正好，用来装零碎的东西。",2018-03-16 23:51:14
1130057,5,"收纳东西很棒，还要买几个",2018-03-16 12:39:38
1130057,5,"特别好 和家具也配",2018-03-16 11:59:01
1130057,5,"好，不错，满意，送货快，好评。",2018-03-16 14:05:52
1130057,5,"这个收纳还不错",2018-03-16 10:42:08
1130057,5,"来了，还可以",2018-03-16 10:06:11
1130057,5,"质量很不错",2018-03-16 10:40:29
1130057,5,"实用好看",2018-03-16 15:06:59
1130057,5,"好",2018-03-16 22:04:48
1130057,5,"不错",2018-03-16 18:33:05
1130057,5,"很好看，又实用，可惜没大号了",2018-03-15 21:00:56
1130057,5,"很精致就是小了些",2018-03-15 13:22:50
1130057,5,"没有味道，小巧精致",2018-03-15 15:49:04
1130057,5,"第二个了，质量很好！",2018-03-15 16:15:33
1130057,5,"空间挺大的",2018-03-15 13:38:18
1130057,5,"喜欢<U+0001F60D>",2018-03-15 12:48:26
1130057,5,"很不错",2018-03-15 15:15:33
1130057,5,"可以",2018-03-15 17:06:00
1130057,5,"东东挺好，以后就上严选了",2018-03-14 13:42:32
1130057,5,"盒子不错啊 小号也很能装",2018-03-14 23:38:37
1130057,5,"挺大的，木把手很好",2018-03-14 22:30:45
1130057,5,"越来越喜欢严选了。",2018-03-14 15:26:27
1130057,5,"好威武支持有希望！！！",2018-03-14 18:52:45
1130057,5,"好用",2018-03-14 15:42:07
1130057,5,"偏贵",2018-03-14 21:22:07
1130057,5,"不错",2018-03-14 10:41:51
1130057,5,"好",2018-03-14 21:55:18
1130057,5,"好",2018-03-14 21:55:35
1130057,5,"好",2018-03-14 21:55:39
1130057,5,"不错",2018-03-14 13:42:42
1130057,5,"好",2018-03-14 21:55:43
1130057,5,"不错",2018-03-14 13:42:57
1130057,5,"不错",2018-03-14 13:43:01
1130057,5,"不错",2018-03-14 13:43:06
1130057,5,"满意",2018-03-14 11:34:10
1130057,5,"盒子颜色很喜欢，比想象的大很多",2018-03-13 16:52:11
1130057,5,"本来觉得小贵～～实物确实值回价格",2018-03-13 18:39:35
1130057,5,"好小啊，太小了",2018-03-13 17:51:15
1130057,5,"简单好用，质量也不错～",2018-03-13 22:19:01
1130057,5,"挺大的还行",2018-03-13 17:51:10
1130057,5,"还行的",2018-03-13 21:57:00
1130057,4,"还行吧",2018-03-13 17:24:49
1130057,5,"质量还不错",2018-03-13 18:13:09
1130057,5,"质量还不错",2018-03-13 18:13:16
1130057,5,"无味",2018-03-13 23:38:29
1130057,5,"很好",2018-03-13 22:05:05
1130057,5,"方便收纳",2018-03-13 14:42:07
1130057,5,"好",2018-03-13 14:28:53
1130057,5,"好",2018-03-13 23:50:29
1130057,0,"做工不错，挺漂亮。。。",2017-05-16 12:48:24
1130057,0,"第二个了，质量很好结实，推荐。",2017-05-15 20:18:00
1130057,5,"有点太大了 其他都好",2018-02-23 00:22:49
1130057,5,"袜子收纳盒贼好用，普通的收纳盒有点贵了，裤子收纳架完全没有差别和图片",2018-02-22 12:14:38
1130057,5,"还不错 稍微有一点粗糙",2018-02-19 20:15:57
1130057,0,"质量非常好！乱糟糟的柜子一下子变整齐了！",2017-05-12 22:39:39
1130057,5,"颜色有偏差，功能不错",2018-02-20 19:20:58
1130057,0,"颜值与实用并存",2017-05-10 07:27:26
1130057,5,"还行吧，没那么大",2018-02-13 17:59:46
1130057,5,"打开还是有点味道 需要散散",2018-02-25 20:44:12
1130057,0,"安装很简单，这个颜色搭配喜欢喜欢",2017-05-03 21:27:25
1130057,5,"入坑网易严选",2017-08-27 10:27:26
1130057,0,"搭一起好看，大小也刚好",2017-05-03 21:28:08
1130057,5,"一用便爱上。",2018-02-21 22:12:29
1130057,5,"还不错，原价偏贵，搞活动价格还行",2017-11-04 23:06:54
1130057,5,"颜色有一点色差，但还算好用",2018-02-22 20:22:42
1130057,0,"好好好",2017-05-03 21:57:33
1130057,0,"棒",2017-05-03 21:27:40
1130057,5,"发错浅绿色给我了，不过也蛮好，没换了",2018-02-21 08:23:42
1130057,5,"总体不错，但不知道内衬是啥材料，是否防水。不然，要清洗咋办？",2018-02-08 08:44:08
1130057,0,"不错，很喜欢，木柄的质感也不错",2017-04-26 23:41:34
1130057,5,"质量还不错，没什么味道，有少许线头，也正常",2018-02-06 13:06:14
1130057,5,"还不错，原价偏贵，搞活动价格还行",2017-11-04 23:06:48
1130057,0,"箱子质量很好  很厚实",2017-04-26 23:44:05
1130057,5,"还行，木头手柄挺好的，没有想到是自己组装的，挺好",2018-02-07 23:01:35
1130057,5,"很好用，就是刚拿到的时候要散下气味",2018-01-30 22:12:02
1130057,5,"感谢售后客服不厌其烦耐心的服务",2018-02-05 15:35:42
1130057,5,"换了一次，比上次好一点，不过感觉网易的东西越来越不怎么样了",2017-11-06 10:28:41
1130057,5,"质量很好，容量也挺大的，可以放几件比较厚的外套，或者放一些夏天盖的被子，很实用。",2018-03-05 20:51:35
1130057,5,"非常喜欢这种颜色，颜值很高很漂亮，做工也很精致，很实用，用起来很舒适，强烈推荐。",2018-02-25 21:29:00
1130057,5,"大小是我想要的大小呢 质量当然没话说 严选的质量真的太好了",2018-02-24 01:51:33
1130057,5,"箱子很硬挺，]用上，打算^滋齑叱后_始使用，感X不e<U+0001F44D>",2018-01-28 08:00:34
1130057,5,"哇哇，无意中买的，还不错，把手需要起子上，随意宿舍狗没工具的注意了，十字起子。",2018-02-02 11:00:23
1130057,0,"一打开就闻见一股很浓重的工业原料味，散了两周才敢用，自行安装好把手，实用性和美观兼具。",2017-08-16 20:29:24
1130057,4,"原来不能洗的啊，洗了之后就变形了...",2018-02-07 20:27:04
1130057,3,"还可以，性价比不高",2018-02-05 17:09:00
1130057,5,"不想多说中严选毒太深满屋子严选纸盒。主要老婆还不舍得丢。一如既往支持严选。",2017-12-18 20:56:55
1130057,5,"很好很好很好很好很好很好很好很好很好很好",2018-03-09 19:05:03
1130057,5,"搞活动时买的，质量非常好，不是那种软塌塌的，很有型也很好和其它收纳搭配，喜欢",2017-12-11 22:57:00
1130057,5,"还行，就是盖子不太好盖。适合衣柜收纳，不适合其他经常要打开的",2018-02-08 14:13:11
1130057,5,"小巧漂亮，颜值担当，分门别类放些零碎物蛮好的。加价购的，29元一个，多买几个放在一排整洁整齐。",2017-11-30 16:39:08
1130057,5,"小巧漂亮，颜值担当，分门别类放些零碎物蛮好的。加价购的，29元一个，多买几个放在一排整洁整齐。",2017-11-30 16:39:41
1130057,5,"小巧漂亮，颜值担当，分门别类放些零碎物蛮好的。加价购的，29元一个，多买几个放在一排整洁整齐。",2017-11-30 16:40:20
1130057,5,"很好安装，颜色吧其实是偏黄的，并不是真正意义的果绿色，但是无伤大雅，希望可以出再大一点的尺寸，",2018-02-05 23:48:00
1130057,5,"不错哦，颜色不是很喜欢",2018-02-01 16:15:35
1130057,5,"还不错哦，有点线头",2018-01-10 17:58:54
1130057,5,"必须五星好评，我人在欧洲，被海关收了VAT，严选却非要把VAT返还给我，这服务，还有谁？",2017-12-08 10:36:25
1130057,5,"严选已中毒，每天都在买买买，真上瘾，买了太多东西了，非常喜欢，每一样质量都超级好，推荐了好多朋友了！",2018-03-11 14:54:37
1130057,5,"已经多次购买这款收纳盒了，简洁大方，卡其色特别温馨，百搭，是很好的收纳帮手！",2017-12-19 13:38:24
1130057,4,"图片看着大，其实实物并不是那么大，大家买的时候建议量一下……比超市买的一般的箱子都小一点。质量还凑合吧。",2018-02-04 18:23:33
1130057,5,"质量不错，还有个木头把手。",2018-02-02 20:38:12
1130057,5,"喜欢，非常喜欢！天天都上严选购物。但愿严选一直保持高品质中价位一如即往吸引人。好评！",2017-11-18 18:51:40
1130057,5,"这个限时购买的，结果双11还便宜了，严选还给退了差价，真不错，继续买买买！",2017-12-11 22:46:32
1130057,5,"这款盒子定价偏高了，活动价还勉强可以。",2017-12-18 22:00:42
1130057,5,"颜色是我最喜欢的，尤其是和墨绿搭配，非常有品，箱子结实又带把手，非常好用，推荐",2017-11-15 09:29:46
1130057,5,"买了各种规格的收纳盒 家里东西越来越多 收纳盒可以让家里变得整洁",2018-03-01 16:40:09
1130057,0,"样子好看，容量不错，就是有一点味道",2018-01-31 14:36:45
1130057,5,"非常赞<U+0001F44D>，本来没我有报多大期望，可是收到货非常满意，尤其拉手显档次，细节决定优劣",2017-11-03 19:04:44
1130057,5,"家里买了两个，叠起来放。颜色很好看，如果再有多一些小的收纳盒子就好了，那个放抽屉里更实用",2018-02-08 13:31:45
1130057,5,"刚拿出来的时候有点味道，散一散就好啦，装了一盒子零食，安全感倍增",2017-11-23 11:41:01
1130057,5,"一直想入手的宝贝！终于四个颜色都凑齐了，严选的收纳物品我都深深中毒了……",2017-12-18 10:05:37
1130057,5,"质量挺好的，比那种单纯无纺布靠谱。把东西整理了一下房间整齐多了。哦也！",2017-11-07 15:26:19
1130057,5,"买了一大堆，正在装修新家，反正每天上严选选购是必做功课了",2017-12-16 22:09:04
1130057,5,"满额加价购的，算上这个买了三四个了吧，给家里衣柜中放袜子什么的，希望好用",2017-11-22 21:34:24
1130057,5,"盒子不错，和家里的装饰风格也挺搭，非常满意，严选真的很不错，赞赞赞！",2018-01-10 11:12:26
1130057,5,"箱子质量非常好，很喜欢，买了两个放在车里，一个放在柜子里，放在那里都是完美",2017-12-11 12:36:48
1130057,5,"除了不够大，其它都满意",2018-01-14 00:05:09
1130057,5,"反正就是收纳盒，趁降价买",2017-11-23 10:47:53
1130057,5,"尺寸和网上描述的不一致，提醒之后的买家注意。不过质量非常好，摸着很有质感",2018-01-12 10:40:07
1130057,5,"跟我家柜子一样大，可是隔了一个移门",2018-01-15 15:01:25
1130057,5,"尺寸和网上描述的不一致，提醒之后的买家注意。不过质量非常好，摸着很有质感",2018-01-12 10:40:13
1130057,5,"比想象中的要小  但是做工很好，细节之处十分精致  感觉很结实   很喜欢这种风格的箱子",2017-10-24 13:46:26
1130057,5,"很小巧，方便放在角落里收纳杂物，不占地，而且收纳空间也不小，是偏硬的材质，质量很棒。",2017-10-23 17:54:32
1130057,5,"尺寸和网上描述的不一致，提醒之后的买家注意。不过质量非常好，摸着很有质感",2018-01-12 10:40:03
1130057,3,"盖子上有线头被挑出来了，本来想换的，怕麻烦就算了",2018-01-11 12:54:31
1130057,3,"木有想象中的大，盒盖两边侧面压扁了。每次都需要手动掰开，卡主两边，费事。。。唯一感觉不错的也就是把手了。。。。不如隔壁小伙伴买的河马箱好用。",2017-11-06 09:20:06
1130057,5,"尺寸和网上描述的不一致，提醒之后的买家注意。不过质量非常好，摸着很有质感",2018-01-12 10:39:58
1130057,5,"给孩子当储物箱用的，商品品质很好，做工到位，拉手安装简便，很不错的东西，五星好评",2017-10-31 22:23:01
1130057,5,"给孩子当储物箱用的，商品品质很好，做工到位，拉手安装简便，很不错的东西，五星好评",2017-10-31 22:24:41
1130057,5,"质地很好，多次购买了。收纳比较实用。就是活动太少，性价比不高。",2018-02-07 10:41:21
1130057,5,"已经第二次入手了，上次买的是卡其色，这次买的是墨绿色，因为双十一有活动，半价，实在合算",2017-11-15 17:56:35
1130057,5,"有了这个收纳盒，孩子的小玩具就不会乱放了，屋里整洁美观多了",2018-01-03 05:03:47
1130057,5,"不错 做活动买了两个 逛名创优品发现了同款 大号才29买了个对比了下 网易的稍微厚一点 名创的颜色亮一点、木质把手打磨的光滑点也便宜很多……",2017-11-24 13:23:52
1130057,5,"挺好的 就是把手那里要自己拧",2018-01-15 15:03:36
1130057,5,"盒子质量非常好，没有任何味道，包装也很满意！严选的品质真的值得信赖！双十一继续买起来！",2017-11-12 21:06:19
1130057,5,"质量不错，没有味道，不过买小了点，用来放衣服可以，再大的就放不下了",2017-11-12 18:29:02
1130057,5,"盒子质量非常好，没有任何味道，包装也很满意！严选的品质真的值得信赖！双十一继续买起来！",2017-11-12 21:06:15
1130057,5,"第一次用这样的收纳箱，小号用来装夏装，还挺能装的，把手质量很好，希望材质能耐久",2017-10-18 16:46:49
1130057,5,"一个人要注意的事情还是不要见怪吧？我家宝宝在家睡觉<U+0001F4A4>",2018-03-05 16:08:55
1130057,4,"赠品吧，只能说还好，不太牢固",2018-01-11 19:50:24
1130057,5,"箱子还不错 拿来放衣服  刚刚好
也可以用来搬运小物件",2018-02-12 00:46:27
1130057,5,"买东西加价购的小收纳盒，还有木质把手，一下子感觉很有质感",2018-03-12 14:42:12
1130057,5,"盒子整理好后很挺实，比较有质量，颜色也很正，和图片一样",2018-03-12 09:51:24
1130057,5,"比想象中的小一些，不过很好看，很厚实，没什么味道，准备用来放宝宝衣服。",2017-11-13 17:44:20
1130057,5,"特别好 每次严选都不会失望！！！特别好 每次严选都不会失望！！！特别好 每次严选都不会失望！！！特别好 每次严选都不会失望！！！",2018-02-13 11:49:22
1130057,5,"暂时还没用。看评论好多姐姐都买来放宝宝衣服的，那我再等两年吧……",2017-11-07 21:43:32
1130057,5,"暂时还没用。看评论好多姐姐都买来放宝宝衣服的，那我再等两年吧……",2017-11-07 21:43:45
1130057,5,"比我想象的小一些，还行",2017-11-15 14:01:54
1130057,5,"原先家里有个是买东西的赠品，觉得使用下来真的不错，这次又另外买了一个配对，质量超级好，又防灰，太赞了。",2017-12-20 20:32:11
1130057,5,"我是严选的老客户了，目前买的这么多东西还没有碰到败笔的，给严选点赞",2017-09-27 17:07:49
1130057,5,"东西很好，质量不错，喜欢东西很好，质量不错，喜欢东西很好，质量不错，喜欢",2018-01-26 20:08:42
1130057,5,"@|量行，有c味道",2017-11-06 10:04:53
1130057,5,"黄很满意，灰色绿色都很好看，看起来没有很大，但是容量还是挺大的",2017-11-24 09:55:36
1130057,5,"还不错稍微有些味道",2017-11-28 11:14:37
1130057,5,"买了两个了，好用，颜色也喜欢，实用的不要不要的！",2018-03-11 14:53:19
1130057,5,"很性冷淡风，才在桌子上，感觉桌子的风格立马不一样了。",2018-03-11 19:42:12
1130057,5,"这个比我想象的要小，不知道用来放什么，价格好像也有点偏贵",2017-11-20 10:31:13
1130057,3,"尺寸感觉略微小了点，质量挺好的，只是打开来气味实在太大，里面用的什么材料？如果是环保的，不应该这么大的气味啊，先放两天看看，还有气味就退货",2017-11-16 20:45:59
1130057,5,"领的试用装，很好，用来放小零食了，书桌从此干干净净了",2018-03-02 15:56:04
1130057,5,"之前买其他东西附送了一个，规格和品质都很好，就果断的再入手",2017-12-12 07:50:30
1130057,5,"之前买其他东西附送了一个，规格和品质都很好，就果断的再入手",2017-12-12 07:50:39
1130057,5,"质量不错，颜色好看，要是能把里面的无纺布换成棉麻的就更好",2017-12-12 08:19:58
1130057,5,"好看，颜色棒，还有个把手",2018-01-08 22:08:46
1130057,5,"快递超快的，赞赞～还没用哦，不过看起来质量很好<U+0001F44D>",2018-02-27 17:47:39
1130057,5,"很好看的颜色，没有色差，虽然是自己组装的，但性价比挺高的，希望严选越做越好<U+0001F60A>",2017-09-05 09:56:10
1130057,5,"拿回来的时候有点味道，要散味，其他还行",2017-12-15 11:21:31
1130057,4,"图片上看很美 实际有点小了即使是大号",2017-12-28 07:21:53
1130057,5,"还不错，比想象中小一些，装东西一般吧，不过是真好看啊",2018-01-26 10:57:29
1130057,5,"箱子不太大，但质地不错，盖得也很严密，没味道。装一些小物件比较适合。",2017-11-03 01:56:34
1130057,5,"真的不错.我是拿来作为寝室收纳用的。里面可以放很多东西，书或者一些衣服。",2017-10-06 22:51:37
1130057,5,"尺寸太小，不实用，退二个",2017-12-31 14:04:36
1130057,5,"比那个亚麻色的大号小",2017-12-28 10:55:55
1130057,5,"大小放在宿舍的床上作为收纳箱正好合适   可以用来收吗一些零碎的东西   再也不用担心掉到床下了",2017-10-24 13:46:23
1130057,5,"小号的没有什么用",2017-12-29 00:35:46
1130057,5,"有点味道",2018-01-02 19:21:36
1130057,5,"就是盒子小点，别的都挺好",2017-12-12 11:09:57
1130057,5,"新家整理使用的。质量非常好。做活动买的绿色，合适的。",2018-03-01 00:00:45
1130057,5,"我现在右手正拿着严选的牙刷刷牙
身上穿着是严选的睡衣
脚上踩着严选的地毯
房间点的是严选的精油蜡烛
左手拿着严选的手机 
哦 不 是苹果手机拍照
换行打字跟作诗似的",2017-12-07 10:54:26
1130057,5,"把手是木质的还不错 大小刚好是一件衣服的放下 下次要买一个大的",2017-10-26 10:24:11
1130057,5,"挺好的。比乐扣的布厚实。质量不用说，一如既往的好 中了你们的毒",2017-11-22 10:17:07
1130057,5,"很方便的一个小盒子，而且是还能折叠的，没有气味",2018-03-09 03:37:29
1130057,5,"拿到手后很不错，没有味道，收纳衣服很方便实用，超级推荐^_^",2018-02-22 00:02:23
1130057,5,"整理方便，质量好，就是没出系列产品，落在一起大小不一。",2018-03-05 18:35:34
1130057,5,"质量好，颜色满意，大号尺寸符合自家放置空间，非常愉快的购物体验！",2018-02-19 14:23:35
1130057,5,"这个非常好，要是有再大一点size的就好了",2018-03-04 22:44:15
1130057,5,"颜色很漂亮，收纳好用，放衣柜里还有装饰效果",2018-03-12 21:07:36
1130057,5,"严选东西棒棒哒，性价比高，活动还丰富，买到停不下来",2017-12-14 22:18:48
1130057,4,"配的螺丝有点问题，",2017-12-27 15:20:09
1130057,5,"试用品，颜色很美，并且比较结实，做桌面或衣柜收纳很好。",2018-03-01 09:32:51
1130057,5,"能放不少东西，颜色也好看，是我喜欢的款，好，赞",2018-02-27 23:04:22
1130057,5,"看了评论再买的，结果到手对我来说还是小了点，只能装点小东西吧，衣服被套之类的要买大号的",2017-12-29 00:02:26
1130057,5,"用起来很方便，小东西都收纳起来，柜子不在乱",2018-03-05 23:44:14
1130057,5,"喜欢，有点瑕疵懒得退还了",2018-01-02 19:22:17
1130057,5,"大小合适，收纳个人小衣服物件，重要是没味道。这个很好。",2018-02-24 19:01:07
1130057,5,"还没装，但是是换购的。物超所值",2018-03-10 08:37:30
1130057,5,"收纳盒在严选上买了第4个了，尽管东西比某宝上贵，但质量真心不错，严选使用京东快递了，速度更快了",2017-11-01 08:46:38
1130057,5,"质量很好啊 网易的东西买到没有后悔的 很满意",2018-02-11 13:13:12
1130057,5,"没色差，但是有点后悔买这个色。总体还行吧，如果现在还可以退货的话，我想退…",2017-11-16 21:19:55
1130057,5,"组装非常简单，可以用来放些杂物，挺好用的。",2018-03-04 15:59:22
1130057,4,"还好吧，宽度合适，但是矮，所以空间还是不够大。比塑料盒子便宜，但是没法消毒啊，怎么放内衣～还是买塑料盒子吧(<U+0E51>&gt;<U+0602>&lt;<U+0E51>）这个就放杂物好了～比实体店里的贵，质量嘛，就是无纺布。那个拉手算是卖点，但是，有毛线用？还没看出来。也就是活动价买吧，不然50多一个真心不合适",2017-12-29 22:43:39
1130057,5,"第二次买了，两个，收纳小东西很好用！",2018-03-12 20:55:39
1130057,5,"收纳盒木手柄，质量不错，放到储物格尺寸刚刚好",2018-03-12 16:32:43
1130057,5,"放在公司用的 简直赞爆 从此我的柜子整齐了起来 省了不少事儿",2017-12-07 10:33:01
1130057,1,"赠品都垃圾",2017-12-31 10:14:18
1130057,5,"质量倒是很不错颜色也正，就是比我想象中小了一些，给好评",2017-11-10 19:36:55
1130057,4,"还可以 有一点点味道",2017-12-31 04:18:25
1130057,5,"真的质量不错，结实容量又大，外观也好看，早就想买类似产品了，可是不是贵就是不好，终于在这里买到了",2017-11-23 10:15:34
1130057,5,"春节期间送亲朋好友，倍有面子。泡茶，喝酒很有日本风",2018-03-03 14:40:20
1130057,5,"不错，颜色比图示深些，没有麻布的那种质感好。",2018-03-08 15:11:34
1130057,5,"太实用啦！感觉买小的方便分装",2018-03-13 08:52:35
1130057,5,"太实用啦！感觉买小的方便分装",2018-03-13 08:52:46
1130057,5,"赠品，这个质量也很好，放东西不错",2018-03-13 08:45:12
1130057,5,"实用，好看。",2018-03-13 08:33:20
1130057,5,"很好",2018-03-13 07:02:18
1130057,5,"方案",2018-03-13 09:30:50
1130057,5,"不错哦！质感很好，看着也很上档次的，然后又回购了一款",2017-12-31 08:32:25
