"itemId","star","content","createTime"
1130069,5,"非常舒适型，颜色清雅，做工很好，居家外出散步都不错。严选就意味着质量的保证！",2018-03-12 13:35:06
1130069,5,"质量很棒，手感极好。但是号码和普通衣服比偏大！想换M号的，可惜还没货",2017-11-26 21:11:10
1130069,5,"穿着很舒服，睡觉，居家都好，但穿出门还是需要一定的自身颜值撑起来。",2017-12-28 09:49:57
1130069,5,"号称病号的颜色，但自己喜欢。面料也是很舒服。长度刚刚好，最长的地方到小腿。",2017-12-26 17:51:51
1130069,5,"买了xs码还是宽松，但质量很好，加一条腰带就好很多，触感也很好。继续支持。",2017-11-02 12:46:59
1130069,5,"超舒服的料，很柔暖，自从有了它，现在别的睡衣都不想穿啦<U+0001F60A>",2017-12-16 14:33:29
1130069,5,"品质还好，尺码偏大，建议减少一个码买",2018-01-01 16:25:42
1130069,5,"很好看，也很舒服，质地很适合贴身穿，颜色淡雅，外穿也可以，一下买了两种颜色",2017-11-20 15:59:07
1130069,5,"很好看，也很舒服，质地很适合贴身穿，颜色淡雅，外穿也可以，一下买了两种颜色",2017-11-20 15:59:13
1130069,5,"质量好，舒服，买严选东西不用担心质量不好，绝对让你惊喜，只希望有更多商品！",2017-11-19 09:13:21
1130069,5,"衣服很舒服，看评论说偏大，试穿后感觉尺码正好喔。相信自己的判断才是正确的",2017-11-18 13:14:30
1130069,5,"衣服太大了，颜色比图片深很多，质地还可以",2017-12-19 22:07:03
1130069,5,"宽松偏大。穿大码的我买了中码。长度略长一点点，符合我的预期。柔软而舒适。",2017-10-31 11:24:02
1130069,5,"双十一买的，真是赚到，手感柔软，和某品牌睡衣一样的面料，价钱只有三分之一",2017-11-15 18:51:41
1130069,5,"超宽松，还是得换小一码",2017-12-10 19:07:18
1130069,5,"手感柔软，个人认为夏天露腿穿比穿丝袜更好看。当睡裙也好，做工很精细。",2017-11-13 14:07:11
1130069,5,"不错不错不错不错不错不错不错不错不错不错不错不错不错不错不错不错不错不错不错不错，第二次买的只能这样评价了哈",2017-11-26 15:58:01
1130069,3,"穿上身没那么好看",2017-12-30 14:01:39
1130069,5,"质量非常好，摸起来手感很柔软，穿上是休闲的风格，扎个腰带会更好看。",2017-11-27 19:27:01
1130069,5,"跟之前在无印良品买的一样 非常好质量棒棒的 发货很快 昨天晚上下单今天上午就到了 真是给力",2018-01-12 09:26:04
1130069,0,"很舒服，很舒服，很舒服，不透不走光～都直接穿出门，旅行。觉得很小清新。性价比超高。",2017-10-08 23:39:00
1130069,5,"面料非常柔软舒服，质量非常好， 就是自己太自信没看详情尺寸，结果买太大了，送人也是好的礼物。",2017-11-17 20:28:18
1130069,5,"衣服是纯棉，质量不错，我身高1.61体重57买xs正好，犹豫的可以出手了。",2017-11-17 06:49:52
1130069,5,"号码严重偏大呢，不过退换程序很便利，给严选点个大赞。图片是我换货之前的L号，里面还穿了一件针织连衣裙。平时衬衫我都穿170的，这次换了s号，挺好。换后就没上图了，供参考。",2017-11-21 17:36:58
1130069,5,"质量真的很好，穿着不变形，不缩水，身高一米六，体重54kg，应该买中码，大码真的超级大",2017-10-10 03:55:32
1130069,5,"这款相对于原来那款没领的差一点点，还是没领的好，但是还是很舒服的。",2017-12-10 20:27:44
1130069,5,"一如既往地好！蓝白是五月入的。都喜欢！我想说 xs 和s区别不大，大小。都能穿。",2017-10-25 14:56:07
1130069,5,"睡裙超级舒服，偷懒时候也可以穿出去，朋友说好看看不出是睡裙",2018-01-08 21:32:49
1130069,5,"质量不错，多功能，可当睡衣，也可系条细腰带外出，还可内搭中长款外套。",2017-11-11 21:35:02
1130069,5,"料子很好 直接穿出去 热天可以当裙子 秋天加一条打底裤出去就行了",2017-12-07 22:58:52
1130069,5,"直接买了XS，还真心不小，不过超长，160到小腿，面料感觉超柔软！",2018-03-03 03:12:22
1130069,5,"挺软的，只能当家居服穿，外出穿觉得不好看，应该是纯棉的",2018-02-02 18:01:33
1130069,5,"很好～物流很快，走之前拿到，带着去旅游～当睡衣穿，很舒服，很亲肤。",2017-11-07 11:37:13
1130069,5,"第二次买了。这款质地柔软舒适，设计雅致方便，两件轮流穿，以前的睡衣被淘汰了",2017-12-03 21:37:59
1130069,5,"严选第一单  性价比真的很高   做工精细  包装高端  快递神速  购物体验真心不错  看准直接下单不犹豫",2017-11-02 13:50:03
1130069,5,"留意很久了，双十一价格很优惠，不容错过，比母鸡的便宜很多，质量没差",2017-12-01 12:13:43
1130069,5,"最爱这个性冷淡风的长裙，减龄不少，双层纱布，舒服，排气又保暖",2018-02-27 20:06:44
1130069,5,"好喜欢 很舒服 手感好 我个子小 略长了 不过其他地方都很喜欢",2017-12-29 14:33:28
1130069,5,"很柔软，拆包的时候这件衣服包装袋没有密封好就掉了下来。",2017-11-18 14:46:38
1130069,5,"已经穿着睡觉了，很舒服。准备再入手。",2017-12-09 01:14:25
1130069,5,"舒服棉。不想当睡衣，严选东西总是买买买从没退货过……某宝买了总退，这是中了严选的毒？",2017-11-18 08:14:59
1130069,5,"非常喜欢，只是码数偏大，换货记得一定要选上门自提，不要自己垫邮费。",2017-12-10 18:30:32
1130069,5,"第一次购买严选的衣服。料子特别好。穿着很舒适。柔软。我身高163。体重92斤。XS宽松刚刚过膝盖。在家当家居服穿很好。",2017-11-17 19:58:47
1130069,5,"蓝色的实物没有图片上那么亮，不过我喜欢衣服的质感",2017-11-17 12:56:19
1130069,5,"给老婆买的，冬天有暖气了屋里穿。质量很好。再也不拉我的衬衣穿了",2017-10-27 23:17:51
1130069,4,"东西质量一如既往地好，赞一个！只是袖口不是我想的那种衬衣袖口，而是平口的，一点儿小遗憾，不过还是蛮喜欢",2017-11-22 13:59:21
1130069,5,"感觉在严选买东西都不考虑，质量杠杠滴，物流也快，赞赞赞",2018-02-13 11:59:58
1130069,5,"得到大家一直赞扬，真是颜值高又实用舒服的睡衣，感觉穿出去也没问题的呢",2017-11-15 10:04:53
1130069,5,"还没收到就搞活动了。哈哈，很舒服，只是有xl就好了，哈哈，喜欢更宽松",2017-10-20 14:38:54
1130069,5,"手感柔软，很舒服的感觉。我还是很喜欢的，希望下次多上些宝宝睡衣，睡袋",2017-11-12 04:58:36
1130069,5,"多小个子女生来说 这个加小号穿上都比较长 不过质量很好 摸起来很舒服",2017-11-08 08:39:26
1130069,5,"面料超软，超舒服。就是蓝白太像病号服了不过当睡衣没人看见",2017-12-05 14:28:42
1130069,5,"不同色的买了两件，超级好穿，当睡衣家居服出门穿都没有问题，很喜欢",2017-11-25 07:53:14
1130069,5,"拿来当睡衣的，关键词就是舒服，超级舒服。差不多款在全棉时代看到300+。",2017-11-25 17:14:46
1130069,5,"非常漂亮，非常舒服，内搭外穿都可以，非常满意的一次购物！",2018-02-25 11:37:31
1130069,5,"料子很舒服，就是比较软，没什么型，也比较宽松，整体来说还可以吧",2018-01-13 15:09:29
1130069,5,"衬衫超级好 穿起来特别舒服 外面搭一个蕾丝吊带估计会很好看 喜欢",2017-10-23 21:52:56
1130069,5,"料子是和p蛹的睡衣套b一拥模很喜g，柔，透狻",2017-10-23 09:30:53
1130069,3,"袖子真心不好看，质量也一般",2017-11-21 10:24:10
1130069,5,"165高，102斤小号穿着很合适，袖子有点短，手感很好，很柔软，就是这个条纹衬衣穿的时候最好卷起袖子不然像病号服。限时购买的，天气冷了也没穿，就赶上双十一又便宜了二十，呜呜",2017-11-20 17:48:23
1130069,5,"左边袋子烂的，太失望了",2017-11-16 19:09:30
1130069,5,"第二次买了，面料很舒服，穿上宽松舒适，比某印良品便宜很多，质量却没差",2017-10-22 16:34:54
1130069,5,"衣服很柔软，穿着特别舒服，所以用来当睡衣了",2018-03-12 09:03:03
1130069,5,"大爱，当睡衣穿太舒服了，和女儿一人一件",2018-03-11 16:25:14
1130069,5,"衣服很不错，给媳妇儿买的。很漂亮，很柔软，长度刚好。严选，错不了",2017-11-16 09:50:09
1130069,5,"裙子非常柔软舒适。码数宽松，我157，体重51，买的S码还有空间，做居家服穿",2017-09-25 21:51:47
1130069,5,"一直想买这类型的裙子，太棒了，质量好，价格也实惠",2018-02-27 12:54:07
1130069,5,"穿上超级舒服，号码也合适，版型也不错。",2018-03-12 13:10:23
1130069,5,"穿着舒适、做居家服和睡衣都合适",2018-03-13 09:52:11
1130069,5,"买了两个颜色，在家穿非常舒服，品质不输无印良品",2018-03-03 13:38:39
1130069,5,"裙子太长了，怎么搭配很尴尬。估计只能单穿了。布料还是很好的，超舒服。",2017-11-17 15:18:36
1130069,5,"手感很好！就是我个子矮了点<U+0001F60A>",2018-03-08 20:53:13
1130069,5,"emmmmmmm...穿着确实有点儿像病号服，不过好在我瘦呀(<U+204E><U+204D><U+0334><U+031B><U+1D17><U+204D><U+0334><U+031B><U+204E>)",2017-09-20 23:26:35
1130069,5,"很好，可惜冬天了不能穿，看了很久还是抵不过喜爱买下了",2017-11-16 14:05:03
1130069,5,"喜欢<U+0001F60D>",2018-03-12 11:29:22
1130069,5,"哈哈，有点像病号服",2018-03-11 09:42:05
1130069,5,"很森女风不错",2018-03-11 16:19:58
1130069,5,"舒服，透气。喜欢",2018-03-11 20:54:28
1130069,5,"不错，舒服",2018-03-11 15:39:30
1130069,5,"不错",2018-03-11 15:52:18
1130069,5,"手感相当舒服 比较长 在家穿很自在 这件送朋友了 准备自己再入一件～",2017-11-07 12:06:26
1130069,5,"很柔软，感觉不错",2018-03-10 13:50:35
1130069,5,"哎呦，不错哦。",2018-03-10 19:46:46
1130069,5,"真是舒服，163cm、58kg穿S码合身，想宽松款可选M码",2017-12-03 09:19:47
1130069,5,"款式漂亮，老婆很喜欢",2018-03-09 12:01:10
1130069,5,"很喜欢，轻柔型。",2018-03-09 19:42:44
1130069,5,"很舒舒服！",2018-03-09 22:20:42
1130069,5,"非常合适",2018-03-09 18:25:16
1130069,5,"质量不错",2018-03-09 15:23:10
1130069,5,"手感很好！<U+0001F337><U+0001F44D>",2018-03-08 20:53:26
1130069,5,"当睡衣穿",2018-03-08 03:30:15
1130069,5,"好舒服",2018-03-08 18:08:34
1130069,5,"好",2018-03-08 19:51:10
1130069,5,"好",2018-03-07 13:21:15
1130069,5,"喜欢这个式样，合身的当裙子穿，大了的当睡袍穿。",2018-02-02 01:06:28
1130069,5,"一如既往的好支持严选",2018-03-05 00:08:18
1130069,5,"留着囤货",2018-03-05 10:49:29
1130069,5,"超舒服，性价比很高",2018-03-04 08:41:26
1130069,5,"双层纱布的材质 很舒适",2018-03-03 08:55:01
1130069,5,"好",2018-03-03 04:54:08
1130069,5,"很舒服的材质",2018-02-28 23:33:42
1130069,5,"衣服很舒服 荣登最爱家居服",2018-02-26 17:02:03
1130069,5,"身高高的穿才合适",2018-02-26 21:06:09
1130069,5,"很柔软的质地，非常舒服",2018-02-26 23:09:25
1130069,5,"喜欢",2018-02-25 21:23:49
1130069,5,"很舒服，棉纱材质，买大了一号，做家居服穿",2018-02-19 09:03:13
1130069,5,"双层纱布软，穿着舒适。",2018-02-24 08:09:35
1130069,5,"舒服",2018-02-24 13:19:17
1130069,5,"这件衣服贴身真舒服，睡衣就只它了",2018-02-21 12:25:31
1130069,5,"东西非常好",2018-02-23 21:03:36
1130069,5,"超级好哦 朋友们也很喜欢 严选不会出错",2018-02-17 22:10:18
1130069,5,"很好很舒服",2018-02-22 10:17:29
1130069,5,"好",2018-02-21 21:41:56
1130069,5,"舒服",2018-02-21 10:35:17
1130069,5,"衣服摸起来很舒服，看起来也很漂亮，尺码偏大",2018-02-10 12:39:45
1130069,5,"非常好，很舒服，穿着很有气质",2018-02-20 20:54:48
1130069,5,"一直想买，看到限时特惠，终于买下来了。165cm，55kg，M号正好。",2017-10-22 14:52:41
1130069,5,"感觉更适合在家里穿，料子特别舒服！……外穿的话料子不够垂，感觉会有一点显胖。瘦妹子随意哦！",2017-08-03 13:31:16
1130069,5,"小清新，推荐购买",2018-02-16 09:40:38
1130069,4,"一般",2018-02-16 20:06:15
1130069,5,"买了做家居服的，特别清爽，可以外穿很休闲",2018-02-10 19:01:52
1130069,5,"很舒适，版型也好！不比muji差！但就是买大了，已提交售后换小一号。",2017-08-15 00:30:34
1130069,5,"喜欢喜欢",2018-02-15 13:31:10
1130069,5,"满意",2018-02-15 13:05:00
1130069,5,"还没有拆，但是严选出品质量应该是一如既往的吧",2018-02-04 23:55:14
1130069,5,"太大了……",2018-01-15 20:39:46
1130069,5,"衣服质量很好",2018-02-14 07:30:17
1130069,5,"非常满意，开始很怕蓝色的会很亮，收到实物很满意，颜色柔和，适合家居",2017-11-13 13:14:50
1130069,5,"质地透气亲肤，款式休闲。满意。",2018-02-13 20:46:14
1130069,5,"担心",2017-11-17 22:14:30
1130069,5,"非常柔软，喜欢！",2018-02-12 15:58:50
1130069,0,"料子非常非常舒服，穿上就不想脱下来的感觉，严选的产品非常值得购买，从来没有失望过。",2017-07-24 10:58:34
1130069,5,"已经买过一件了，特别舒服",2018-02-11 22:24:23
1130069,5,"质量不错，适合家居",2018-02-11 16:46:40
1130069,5,"满意",2018-02-11 15:12:54
1130069,5,"超级满意，衣服舒适",2018-02-10 08:21:17
1130069,5,"质量很好，手感很好，双层设计，很柔软，宽松版，家居外穿都可。",2017-12-04 12:50:47
1130069,5,"衣服很好，柔软舒适。还会再来。",2018-02-09 09:52:40
1130069,5,"性价比高，手感不错",2018-02-08 14:02:05
1130069,5,"好穿，又买了一件",2018-02-08 17:34:04
1130069,5,"喜欢的式样、给女儿买的。布料是棉的，舒服。",2018-02-02 01:07:07
1130069,5,"啊对我来说，有点太长了啊～",2018-02-07 00:55:54
1130069,5,"满意",2018-02-07 14:23:25
1130069,5,"穿起来很舒服",2018-02-06 12:19:22
1130069,5,"很舒服很软",2018-02-05 17:21:58
1130069,5,"很舒适",2018-02-05 17:22:44
1130069,5,"洗后很柔软，质量很赞",2018-02-04 18:48:01
1130069,5,"相当喜欢，就是有点薄",2018-02-04 16:47:26
1130069,5,"这是宽松款式的长裙，一定要看清尺寸参数，纯棉面料舒适。",2017-11-29 13:57:16
1130069,5,"特别的好，和muji的有的一拼",2018-02-03 11:08:14
1130069,5,"要贴身才好看，不然就真的是病号服了",2018-01-29 10:50:41
1130069,5,"满意",2018-02-03 11:49:17
1130069,5,"满意，试穿了很凉快，夏天居家穿应该超级舒服",2018-01-31 11:10:49
1130069,5,"真的很好啊",2018-02-02 00:00:42
1130069,5,"喜欢，穿着舒适",2018-02-02 20:29:58
1130069,5,"很好啊",2018-02-02 00:01:23
1130069,5,"非常满意！",2018-02-02 21:43:43
1130069,0,"买的xs还是偏大，退货太麻烦了，还是留着吧，整体还是挺不错的，可惜了太大！",2017-07-24 07:15:21
1130069,5,"好喜欢！！！！感觉物超所值！！！",2018-02-01 11:03:35
1130069,5,"做家居服很合适。就是M号大了，懒得换",2017-11-16 17:14:57
1130069,5,"再次购买 真的非常好",2018-02-01 23:57:21
1130069,4,"衣服挺长的，穿着有点点大，衣袖有点点短，整体还好吧，衣服摸着挺柔滑的，质量还可以",2017-11-07 22:06:21
1130069,5,"夏天的衣服现在穿不上了以后再评价吧先给个好评",2017-12-16 01:45:03
1130069,5,"很喜欢，穿着很舒服，又给女儿买了一件",2018-01-25 21:55:31
1130069,5,"很舒服",2018-01-29 11:54:03
1130069,5,"超级喜欢的衣服，每次穿都很柔软舒适还会再来喔",2017-12-30 08:31:11
1130069,5,"穿上感觉不错，纯棉面料，比想象的长。",2018-01-23 14:28:57
1130069,5,"好穿得不得了，喜欢",2018-01-28 14:42:00
1130069,5,"质量好5分",2018-01-28 23:22:19
1130069,5,"喜欢",2018-01-28 21:19:03
1130069,5,"睡衣也行 柔软 细腻 出去穿也使得 好极了",2018-01-25 10:25:05
1130069,5,"东西很棒，我上了严选",2018-01-27 19:38:01
1130069,5,"满意的一次购物",2018-01-27 21:42:48
1130069,5,"质量超赞",2018-01-27 08:48:32
1130069,5,"哈",2018-01-27 13:28:35
1130069,5,"穿着很舒服",2018-01-26 08:43:01
1130069,5,"质量不错，喜欢",2018-01-26 14:04:23
1130069,5,"非常0k",2018-01-25 19:10:04
1130069,5,"超级舒服 很居家穿，会回购",2018-01-24 00:22:05
1130069,5,"很舒服，冬天也在穿。",2018-01-24 13:09:33
1130069,5,"好",2018-01-24 15:50:33
1130069,5,"好",2018-01-24 10:09:15
1130069,5,"很喜欢这件睡衣，孕期穿，已经临产了，M码仍然扣的上。",2017-12-09 11:36:24
1130069,5,"质量非常好，非常好相当于，市场上三四百元的，穿上也非常舒适。",2017-12-09 14:12:41
1130069,5,"非常喜欢，买了三件换着穿",2018-01-23 18:27:31
1130069,5,"喜欢，买的灰白色没有蓝白那么像病号服，很舒服",2018-01-13 03:36:51
1130069,5,"很好穿",2018-01-23 13:41:05
1130069,5,"当睡衣穿",2018-01-23 10:35:53
1130069,5,"很柔软",2018-01-23 23:12:14
1130069,5,"不错",2018-01-23 23:25:40
1130069,5,"有点偏大，但是很不错，喜欢！",2018-01-22 10:36:54
1130069,5,"169，120，合身舒适，清新素净，喜欢推荐(^_^)",2018-01-20 20:29:49
1130069,5,"纯棉的质地 穿着舒服透气 喜欢严选 品质有保证",2018-01-02 12:22:45
1130069,0,"第一次给爱人在网上买衣服，没想到尺寸神马的都刚刚好~物流也给力，点赞",2017-07-16 09:56:19
1130069,5,"棉质，亲肤",2018-01-19 21:09:09
1130069,4,"很薄",2018-01-19 16:58:31
1130069,5,"第二件了，有点瑕疵，申请换货了，很舒服",2017-11-15 20:52:32
1130069,5,"是我想要的，穿着舒适，质量很好，是全棉的，准备当睡衣穿",2017-10-23 20:28:09
1130069,5,"质量非常好。双十一买的，相当实惠。",2018-01-18 14:13:53
1130069,5,"比较有文艺范儿",2018-01-18 18:38:53
1130069,1,"客服电话永远打不通，差评，发票一个月了到现在还没有邮寄。没有服务的公司就等着倒闭吧",2017-11-13 16:10:51
1130069,5,"我爱的调调",2018-01-17 01:05:55
1130069,5,"很好穿",2018-01-17 21:45:25
1130069,5,"好",2017-11-17 11:10:40
1130069,5,"一直心仪的一件衣服，趁有活动赶快买，过季了还没穿",2017-12-02 10:31:47
1130069,5,"还好吧，感觉不能穿出去。",2018-01-16 23:07:01
1130069,5,"看气质，不是谁都能穿出味道的",2018-01-13 16:43:17
1130069,5,"超级舒服！",2018-01-15 22:11:56
1130069,5,"吊带内衣是第四件 绝对好评 
家居衬衫 简直没有话说 好极了 犹豫的伙伴下手准没有错",2017-07-25 22:40:13
1130069,0,"这是我买的第二件了，实在是太满意了，喜欢的亲们可以下手了，感恩",2017-08-11 09:28:19
1130069,5,"买来当睡衣穿，感觉可以买更大号",2018-01-13 09:08:53
1130069,5,"舒服随意，配开衫很撒，适合166以上的高度，我166，106斤，Ccup，觉得应该买L码！脚上拖鞋、后面和旁边的箱子收纳都是严选的",2017-10-31 20:19:18
1130069,5,"全棉的，穿着舒适",2018-01-14 21:21:53
1130069,5,"很舒服做睡衣和家居服都很棒",2018-01-13 21:04:18
1130069,5,"赞，性价比超高的；以后居家衣就上严选买，希望好品质要保持",2017-09-24 08:51:56
1130069,5,"重量轻盈，亚麻面料的，开春后穿了",2018-01-12 18:48:50
1130069,5,"穿着舒服",2018-01-11 21:18:38
1130069,5,"很喜欢",2018-01-11 10:23:31
1130069,5,"囤着，夏天穿，不过质量很好，爱不释手",2018-01-10 11:13:07
1130069,5,"没穿，等夏天了",2018-01-10 17:03:18
1130069,5,"等到穿了在评价",2018-01-10 05:53:44
1130069,5,"打折季太便宜，不下手觉得对不起自己，到现在还没机会穿",2018-01-19 10:11:35
1130069,5,"忒别舒服",2018-01-10 12:32:24
1130069,5,"舒服，喜欢",2018-01-10 12:32:21
1130069,5,"柔软舒适 赞",2018-01-09 12:38:27
1130069,5,"质量很好",2018-01-09 13:25:56
1130069,5,"非常好穿",2018-01-09 23:12:11
1130069,5,"ok",2018-01-09 13:22:11
1130069,5,"好",2018-01-09 08:38:42
1130069,5,"舒服",2018-01-09 01:00:24
1130069,0,"第二次严选购物，买了13件物品，太赞了 太赞了，物流巨快 质量超好，哈哈哈哈哈哈 以后爱严选",2017-07-03 14:39:16
1130069,5,"这个真心不错，衣服穿起来绵软舒适，很有文艺范，很喜欢！",2017-12-11 23:48:24
1130069,5,"布料双层绵质，贴身舒适，不错<U+0001F44D>",2018-01-08 13:51:13
1130069,5,"买了两件，超级好穿，当睡衣家居服出门穿都没有问题，很喜欢",2017-11-25 07:54:13
1130069,5,"不错",2018-01-08 10:42:54
1130069,5,"挺有型的，料子做工也很好，活动买的很优惠",2017-12-21 23:11:53
1130069,5,"很舒服",2018-01-07 13:03:30
1130069,5,"舒适，很喜欢，家居穿。最喜欢的是袖子是八分袖，很方便",2017-12-09 22:24:18
1130069,5,"还没穿，但是洗了不变形，不缩水，很喜欢",2017-11-06 11:48:29
1130069,5,"非常舒服的料子，做睡衣最好了，外穿有点儿软",2017-12-20 08:51:08
1130069,5,"很舒服",2018-01-06 13:41:38
1130069,0,"质量好的不要不要的，看评价，拍的小一码，正合适！注意！严选有毒~哈哈哈…已经停不下来了",2017-07-18 16:14:15
1130069,5,"还可以，就是买小了，我穿刚合适，可是我喜欢宽松点的",2017-12-22 22:35:55
1130069,5,"料子舒适柔软，就是不太好搭衣服，穿的睡觉到蛮好的！",2017-11-23 12:40:48
1130069,5,"这是第二次购买了，配大衣美美的",2018-01-04 20:55:13
1130069,1,"这件衣服109元，尺寸偏大，布料也不好，想退掉，要扣掉59元汽水赠品，再把汽水和衣服退掉，估计等十几二十天反复和严选沟通后才要回50元，但寄去顺丰快递费估计要70-80元，所以这都是商家设计的小伎俩",2017-11-07 04:53:13
1130069,5,"东西很棒，第一次买严选的东西，质量上乘！",2018-01-04 18:21:13
1130069,5,"双层、舒适，推荐<U+0001F339><U+0001F339>",2018-01-04 21:23:41
1130069,5,"非常好 柔软 舒适 唯一不足 像病号服<U+0001F602>
我系了腰带 外出了",2017-10-11 08:10:04
1130069,5,"穿的很舒服",2018-01-04 20:28:32
1130069,5,"穿着像病号服但是确实很舒服",2018-01-03 21:38:24
1130069,5,"质地柔软细腻柔滑，非常舒服",2018-01-03 01:46:48
1130069,5,"长裙收到了，质量挺好的，但是就是码子感觉还是大的，按照上面选的码子感觉好像太大了，这个不是很理想，其他都挺好的，还是不错的一次购物",2018-01-07 13:11:27
1130069,5,"质量很好",2018-01-03 12:44:08
1130069,5,"好",2018-01-03 17:20:18
1130069,5,"还可以了   懒得选 所以在严选买",2017-12-20 09:07:35
1130069,5,"这个衣服过季了，看着很舒服，配个皮带可以外穿",2017-12-05 11:10:35
1130069,5,"与无印良品质量同，但价格低了很多，非常亲肤，强烈推荐",2017-11-19 20:41:43
1130069,5,"挺好的啊，就是大了一点，不过颜色低调，可能多次几次会旧，因为全面的嘛。",2017-08-02 01:31:29
1130069,5,"很不错，很舒服，果断入手两件，喜欢！",2018-01-01 08:24:19
1130069,5,"很不错，很舒服，果断入手两件！",2018-01-01 08:23:28
1130069,5,"穿着舒适。",2017-12-31 19:55:13
1130069,5,"老婆大人非常满意。
老婆满意就是网易最大的动力<U+0001F602><U+0001F602><U+0001F602>",2017-08-01 08:58:20
1130069,5,"质量非常好，物流越来越快，网易严选真的讲究品质。",2017-12-25 16:08:21
1130069,5,"现在快递越来越慢越来越慢慢慢慢慢慢慢慢慢慢慢慢慢慢慢慢慢慢",2018-01-04 20:16:26
1130069,5,"值得拥有，品质完全无忧",2017-12-30 23:47:56
1130069,5,"非常喜欢，面料舒服",2017-12-30 10:40:14
1130069,5,"当睡衣十分舒服",2017-12-30 20:36:45
1130069,5,"面料舒服，好评",2017-12-30 10:38:47
1130069,5,"衣服面料很舒服。但此衣服仅适合居家。有点小贵。",2017-12-19 11:57:38
1130069,5,"还不错 无线回购",2017-12-28 10:49:35
1130069,5,"舒服的",2017-12-28 15:22:15
1130069,5,"好",2017-12-28 21:21:09
1130069,5,"不太适合我老婆",2017-12-31 00:42:04
1130069,5,"好",2017-12-28 21:21:12
1130069,5,"好舒服，布料超柔软，配根腰带穿出去妥妥的",2017-12-18 21:54:00
1130069,5,"衣服非常舒服，双十一买的很值，以后就双十一购物了",2017-12-18 23:02:31
1130069,5,"感觉还不错",2017-12-27 22:41:52
1130069,5,"很好",2017-12-27 20:26:56
1130069,5,"不错",2017-12-27 14:04:20
1130069,5,"质量非常好!",2017-12-26 11:28:53
1130069,5,"衣服面料舒服，但是款式确实不适合穿出去，在家当睡衣比较合适！",2017-11-28 10:03:57
1130069,5,"衣服很舒服，贴身穿没问题，颜色也很好",2017-12-23 10:20:01
1130069,5,"很舒服，当睡衣穿的，纱布很吸汗",2017-12-24 12:56:06
1130069,5,"喜欢，就是袖口有个小扣就好了",2017-12-27 08:25:53
1130069,5,"质量好做睡衣舒服",2017-12-25 15:39:39
1130069,5,"非常好",2017-12-25 11:40:37
1130069,5,"喜欢",2017-12-25 04:38:09
1130069,5,"喜欢",2017-12-25 04:30:18
1130069,5,"衣服柔软舒服，很棒。换的衣服也用顺丰快递很快收到，购物体验很棒。",2017-09-09 20:07:10
1130069,5,"棉质好，适合家居穿",2017-12-24 23:44:17
1130069,5,"不错",2017-12-24 22:09:20
1130069,5,"这个睡衣超级舒服！无敌！又赶上双十一两件一件的钱太划算了。",2017-11-26 10:37:10
1130069,5,"太大了",2017-12-24 09:11:34
1130069,5,"这个很喜欢，质地不错，舒适度好，颜色什么的也很赞",2017-12-14 11:52:04
