"itemId","star","content","createTime"
1134066,5,"不错",2017-09-29 06:58:42
1134066,5,"发货很快，厚实的一大包，非常好。严选的第一单，以后除了考拉也会经常用这个了。",2018-06-09 20:25:18
1134066,5,"拼团一元买的，包装很用心，感觉比其他app的包装 走心，爱上严选了，会支持会回购。",2018-06-07 19:14:41
1134066,5,"团购买的，严选的东西真的好，没有一点酒精味哪来擦汗，洗手很方便",2018-08-07 00:40:12
1134066,5,"物流很快，是京东物流，不方便下楼小哥还给送上来了，很赞！",2018-07-29 20:26:13
1134066,5,"一包很充足，很容易拉取，湿度刚好，不干也不湿，质量不错，包装也不错",2018-06-15 20:17:54
1134066,5,"很不错，一直在严选买东西，关键是一元钱，还包邮，超级超级便宜，包装很清新，无异味，物流很快，只等一天就到家啦！",2018-05-21 11:23:46
1134066,5,"非常不错的活动，宝贝收到啦质量很好，一次还来购买…",2018-08-01 17:38:04
1134066,5,"凑八折优惠，买了一包婴儿手口湿巾，看起来不错，相信网易严选的质量！",2018-05-21 11:22:50
1134066,5,"已经收到物品，非常非常好看，快递小哥非常给力，谢谢，下次还来～",2018-06-12 20:49:17
1134066,5,"无限次购入的一款湿巾，性价比非常合适，而且婴儿用的感觉更健康，相信严选的质量。推荐买买买买买买买买！",2018-05-24 15:07:47
1134066,5,"质量很好，还是顺丰包邮，",2018-08-03 13:19:49
1134066,5,"一元拼团购的，包装很可爱，非常满意",2018-08-03 12:31:53
1134066,5,"好喜欢这包装，颜色看着很舒服，纸巾也很柔软呢",2018-06-19 14:17:59
1134066,5,"宝宝一直用，没有味道，皮肤也没问题",2018-07-01 09:38:06
1134066,5,"好 严选品质杠杠的  一看就不是俗气的货",2018-06-03 23:15:55
1134066,5,"没想到湿纸巾真的很好",2018-06-13 09:55:43
1134066,5,"今天收到哒！真的很意外，新用户专享呦……颜色看着就特别清爽的感觉，整整80片很实惠。上面带小盖子，用起来方便，湿巾不会干掉。生产日期，厂家都有标注用起来放心……",2018-06-12 14:15:13
1134066,5,"质量扛扛滴，非常满意的一次购物",2018-06-11 21:55:16
1134066,5,"拼团买得，物超所值。非常好用。",2018-06-09 19:20:18
1134066,5,"第一次在严选买东西，印象很好！",2018-06-07 18:39:55
1134066,5,"看起来还可以，先用着试试。",2018-06-02 22:50:59
1134066,5,"挺大一包，值得入手",2018-05-28 17:53:45
1134066,5,"非常好，第一次用，感觉很好，以后就你啦。",2018-05-25 09:01:02
1134066,5,"在朋友的推荐下第一次在网易严选上买东西。这个是新人1元拼的，还包邮。真的是超级赞。",2018-08-07 21:43:05
1134066,5,"好   拼团拼得   看见实物准备晚上继续拼！",2018-05-24 18:14:24
1134066,5,"湿巾真的很棒，而且物流超快，一天就收到了。和别的湿巾一对比，真的是好到爆。",2018-08-03 17:31:08
1134066,5,"参与的团购，转天就到啦！很好，就算不是团购价格，也是十分合适的！之后会回购！",2018-08-02 15:37:47
1134066,5,"1元 太划算了",2018-05-21 13:29:43
1134066,5,"很好  ，设计是不连抽的 ，
湿巾质量也好，纯水无添加
包装也好  
完美",2018-08-14 04:36:32
1134066,5,"非常厚实的湿巾，抽取方便，不用的时候还可以扣上扣子，防止水分流失，下次会回购哦⊙<U+2200>⊙！",2018-08-11 11:29:56
1134066,5,"很不错，一直都在严选买东西，大品牌值得信赖，花很少的钱过上棒棒的生活",2018-07-18 16:02:34
1134066,5,"很好用，与严选纸巾盒配套使用放在桌上很方便。抽纸口O很好密封卫生。大",2018-07-07 08:31:13
1134066,5,"好大好沉的一包，新用户团购的，非常合适，已经推荐给了很多朋友！昨天下单今天就到了，非常快！好评！",2018-07-29 13:39:16
1134066,5,"不错的！以前家里用的是连抽设计，每次都会把后面一张拉出来，很不方便。现在这个挺好的。",2018-07-12 16:26:43
1134066,5,"回购，宝宝未出生时买了三包试用，性价比高，这次活动正好宝宝出生囤货。买了一箱<U+0001F601>",2018-06-30 12:35:17
1134066,5,"严选非常棒，快递也非常赞，第二天就到了，商品也非常好，就喜欢这样的购买体验",2018-07-13 11:25:52
1134066,5,"质量特别棒   很信赖严选上的东西，质量有保障，物流还是发的顺丰，很满意",2018-07-30 15:25:04
1134066,5,"第一次在网易严选买东西，东西收到以后很开心，价格便宜且好。快递服务态度也很好。给个赞<U+0001F44D>。",2018-06-07 14:52:46
1134066,5,"拼团买的每种东西都只花了一块钱，湿巾还没用，不过真的超喜欢严选，超级喜欢！",2018-06-07 17:37:44
1134066,5,"小包装买了 又买了大包装 唯一不足 刚买完又涨价了 还想再买一箱 给宝宝囤着用",2018-06-10 11:11:48
1134066,5,"非常棒，拼团买的，买到就是赚到！！！严选就是品质的保障啊～质量太好了",2018-05-21 20:18:03
1134066,5,"趁特价买了好多，不得不说严选的东西真是“严选”的，很多都喜欢，简约而不简单。注重品质。",2018-05-13 19:36:35
1134066,5,"超级合算！真想多买一些！朋友推荐说质量好价格便宜，正好赶上1元购，真是幸运",2018-06-07 20:39:09
1134066,5,"在严选买很多次这个湿巾啦 特别棒 没有特殊的香气  皮肤用起来也不刺激  抽取方便 很赞",2018-04-24 23:17:52
1134066,5,"真是良心啊    快递也很满意京东    网易真的是良心啊
1元  高品质的生活！",2018-06-03 11:01:22
1134066,5,"东西收到啦 昨天一元拼团刚拍的今天就收到了 好快 送货员也挺好的",2018-06-02 13:26:11
1134066,5,"用过最好的湿巾了！厚度足不易变形，水分合适，无香味成分纯净，插手擦嘴放心，最喜欢的就是不连抽设计。",2018-08-01 09:34:02
1134066,5,"宝宝用的湿巾一直都是严选的，虽然换了包装，但用起来放心",2018-08-10 13:46:31
1134066,5,"很大一包了，哈哈，时不时拿来擦桌子什么的很合适，偶尔还可以擦个脸和手  划算",2018-04-17 21:56:26
1134066,5,"评价说很好，宝宝出生后就给她用，希望找到了物美价廉的实用好货",2018-07-10 10:48:04
1134066,5,"这个湿巾真心不错，挺有分量的，里面有80片，可以用好久了，不错，不错",2018-08-03 21:30:31
1134066,5,"这款湿巾纸质较细腻 不过很芦荟那款比较 这款比较干",2018-06-29 10:56:45
1134066,5,"真的重严选的毒了，根本停不下来。哈哈！这次活动买了好多。包装更规矩、严密了。相信严选，希望保持、越来越好！",2018-06-18 10:39:13
1134066,5,"第一次买，包装完好，实惠！相信严选，应该靠谱！发货很快，送货更快，隔天就送到了，用的是京东快递，满意",2018-07-08 23:12:23
1134066,5,"我是用来给宝宝洗屁股的，很厚实，自己也可以洗脸用，一块钱拼的，还包邮，棒棒哒！严选值得信赖！",2018-06-09 13:22:04
1134066,5,"自己买，帮朋友买，一直回购中，不连抽，纸张又好，妈妈们的最爱！多种用途",2018-03-30 00:16:30
1134066,5,"湿巾性价比很高，颜值也高，小清新。比较厚实，水分不是很多。没有特殊的味道，适合新生儿使用。",2018-03-14 13:49:56
1134066,5,"超级好用，不透又厚，无限回购。严选东西就是好。",2018-08-20 00:29:58
1134066,5,"第一次买网易严选的东西。挺好的 价格合适 东西味道也还好吧",2018-07-12 18:59:21
1134066,5,"挺好的 挺喜欢 淡淡的味道 令人放心 用来随手擦点什么都是ok的",2018-04-26 20:00:05
1134066,5,"不像抽纸一样的层叠方式，干净卫生又整洁！1元秒杀很给力！",2018-06-14 00:43:00
1134066,5,"包装配色看着挺舒服的，还不错，没用，一直用好孩子的湿巾。",2018-07-02 14:42:10
1134066,5,"没有香味，很纯净，湿度也刚好，很适合婴儿还有巨婴日常清洁",2018-08-06 20:29:48
1134066,5,"拼团买的，才一块钱，太实惠了！还没用，看着就好喜欢！",2018-06-07 11:34:52
1134066,5,"宝宝六月出生，为他囤货，相信严选！每一样东西都很有质感，软软的，包装严密，快递也很给力！非常喜欢！",2018-03-24 10:25:35
1134066,5,"很厚的一包诶，还没有开始用，但我本人用湿巾这种东东特别快(浪费)，所以应该可以用很久了呐",2018-04-12 23:18:23
1134066,5,"给即将出生的小宝宝准备的，用了之后会再来评价～相信严选～",2018-06-28 21:47:41
1134066,5,"满满的一大包 真的中了严选的毒 每周都要买买买",2018-06-05 14:45:54
1134066,5,"包装很萌，湿巾质量很好，1元买的很划算，值得拥有",2018-07-31 08:51:09
1134066,5,"凑单买的，但比想象中的好太多了",2018-08-16 08:34:48
1134066,5,"快递叔叔真的特别好，京东还真的送货上门呀",2018-08-18 16:24:07
1134066,5,"很满意很喜欢",2018-08-22 19:41:23
1134066,5,"严选一直相信它的品质，",2018-08-21 16:29:00
1134066,5,"质量很好，非常实惠。",2018-08-21 18:13:10
1134066,5,"包装和物流都超棒 用起来用起来",2018-08-20 11:10:26
1134066,5,"很好",2018-08-20 15:00:18
1134066,5,"",2018-08-19 17:13:34
1134066,5,"",2018-08-19 17:11:00
1134066,5,"",2018-08-18 22:29:11
1134066,5,"很好",2018-08-17 10:36:12
1134066,5,"",2018-08-17 23:35:45
1134066,5,"",2018-08-17 17:43:20
1134066,5,"",2018-08-17 17:43:32
1134066,5,"湿巾灰常好哦 很大很厚实 被严选的品质吸粉了",2018-06-16 14:02:42
1134066,5,"一块钱拼的，这个真心划算，又实用八十片也太多了，而且很重",2018-06-15 00:52:35
1134066,5,"好用不贵，超值之选。",2018-08-13 23:15:34
1134066,5,"很好，活动价格很棒。",2018-08-13 19:25:18
1134066,5,"竟然很快就用完了，又要买新的了，因为当时买的很便宜结果甚是挥霍，哭唧唧",2018-08-21 19:58:55
1134066,5,"严选品质，值得信赖",2018-08-13 09:57:41
1134066,5,"666666666666",2018-08-13 14:47:05
1134066,5,"",2018-08-13 12:05:09
1134066,5,"包装很好看，带盖的比较方便，纸巾也很厚实，划算，下次再来",2018-06-12 15:34:37
1134066,5,"外包装也是高大上，纸巾也是没得说，非常喜欢",2018-08-03 14:11:23
1134066,5,"很满意了 果断五星好评  好大一包哦",2018-08-11 18:49:34
1134066,5,"试试严选的湿巾，反正价格真的是便宜呢耶。",2018-08-07 14:36:36
1134066,5,"还可以，之前买过的，感觉不错",2018-08-10 20:22:33
1134066,5,"很好用，一抽一张，没味道，放心用",2018-08-20 15:58:58
1134066,5,"原本以为很小一包 没想到很大 装包很有意思  喜欢",2018-08-01 01:04:30
1134066,5,"系统默认好评",2018-08-02 02:01:16
1134066,5,"产品不错，制作精良，包装卡通，气味淡雅，同比其他产品略便宜一点，好！",2018-06-27 11:50:52
1134066,5,"以前基本没有认真评价过，不知道可惜了多少积分，这个剁手党福利真心好用。这是第N次严选种草拔草了，棒棒棒，东西好好好品质优优优，放心买，买买买，根本停不下来。包装好无损坏，有幸未体验售后服务。好评模版完美无缺，因为小姐姐很懒，每件东东都要脑动大开来好评真心脑力不够。重点是产品无论质量还是样貌肯定是小姐姐喜欢的，否则收到货就运费险送走了，自然就看不见这个好评了，也给每一位剁手党供参考，这件东东值得购买，小姐姐的眼光一向洋气精准，难得失误。来自地球懒惰的只爱购物不爱写评语却决心换积分的小姐姐。",2018-08-08 08:28:22
1134066,5,"一直在用的产品，好用便宜不用多说",2018-08-03 10:31:35
1134066,3,"积分兑了四包，有一个竟然有个口子！满意度降低",2018-08-18 15:11:56
1134066,5,"很大一包，随身带不太方便",2018-08-13 21:32:08
1134066,5,"自己买，帮朋友买，一直回购中，不连抽，纸张又好，妈妈们的最爱！",2018-03-30 00:16:04
1134066,5,"纸巾收到了，首先分量很足，其次纸巾也很润，物超所值。",2018-06-26 15:47:06
1134066,5,"这个湿巾纸买了好多次了，物美价廉，没有味道，这一点很好。",2018-06-26 17:11:11
1134066,5,"一块九一包，居然还包邮，我还能说什么，以后还有请call",2018-08-17 20:02:24
1134066,5,"特别好，1元拼团超值",2018-08-07 12:48:08
1134066,5,"好用，而且实惠，家里一直给宝宝用这个",2018-08-06 09:22:03
1134066,5,"一直在用，还不错",2018-08-07 17:21:58
1134066,5,"超棒的",2018-08-07 13:08:23
1134066,5,"很可爱哦，物流很快，快递小哥的态度很好",2018-08-02 10:58:34
1134066,5,"一个字!!值!!!",2018-08-16 14:01:12
1134066,5,"严选真<U+0001F402>，质量真不错<U+0001F44D>，包装也很严谨",2018-08-02 19:56:55
1134066,5,"湿巾很好用，买了快一百来包了，有了严选的湿巾没再其他地方买过了",2018-08-07 20:14:21
1134066,5,"特别厚的纸，拼团买的，才一块钱",2018-08-04 12:00:56
1134066,5,"非常不错可以放心使用购买",2018-08-06 15:03:50
1134066,5,"商品一般，客服的处理问题能力十分佩服，一个问题十天都没解决，来回踢皮球",2018-08-13 21:50:08
1134066,5,"包装很好<U+0001F44C>",2018-08-06 16:52:04
1134066,5,"质量真不错，以后会再回购",2018-08-05 22:06:53
1134066,2,"水分少，不会再买了。",2018-08-10 08:21:32
1134066,5,"挺好的，很好用，会继续回购",2018-08-04 15:51:33
1134066,5,"好用好用好用",2018-08-05 13:22:37
1134066,4,"宝贝到了，可以喜欢，下次在来",2018-08-04 11:50:37
1134066,5,"超级快就收到了，超级快，超级快。",2018-08-04 19:15:12
1134066,5,"收到收到评价有什么快点来来阿里阿里啊",2018-08-12 14:24:22
1134066,5,"收到收到评价有什么快点来来阿里阿里啊",2018-08-12 14:23:46
1134066,5,"无限次的回购，无味好用",2018-08-04 06:25:09
1134066,5,"棒棒哒。1元购，真的超级划算。",2018-08-03 09:35:34
1134066,5,"拼团的湿巾很好，太赞了",2018-08-03 20:01:21
1134066,5,"网易严选高大上，速度超快，湿巾颜值高的我都不舍得用了@_@",2018-05-13 09:49:14
1134066,5,"很好",2018-08-03 18:23:01
1134066,3,"质量可以，价格太贵，跟全棉时代差不多！",2018-08-09 10:26:36
1134066,5,"不干不湿，淡淡的，没有酒精味。",2018-08-02 12:32:54
1134066,5,"包装特别好，点赞。",2018-08-02 12:16:35
1134066,5,"",2018-08-02 22:13:23
1134066,5,"",2018-08-02 22:14:19
1134066,5,"",2018-08-02 22:14:26
1134066,5,"",2018-08-02 22:14:39
1134066,5,"",2018-08-02 22:15:07
1134066,5,"记忆深处里，小时候体育课，老 师组织我们男生搞了一个跳高比赛，标竿上升到90厘米时，总有几个男生跳不过，这样就受到别的同学一片嘘声，再这嘘声中，也有无地自容的我，因为我正是这跳不过的男生当中的一个。 后来，为了让所有男生体育成功目标，就再讲成长心态迷失",2018-08-06 20:33:51
1134066,5,"这个湿巾真的很不错，不论是擦拭身体还是脸部，还是擦桌子以及灶台，都非常干净，我妈中性皮我油皮，用起来完全无刺激很安心，推荐购买～",2018-07-18 16:30:13
1134066,5,"物流快！",2018-08-03 21:32:43
1134066,5,"挺好的，快递也高效率。第一次1元拼团成功。",2018-08-03 14:48:38
1134066,5,"给孩子擦屁屁，别别的牌子厚，抽取方便，别的牌子有时一抽能抽出来好多张，严选的就不会，不错",2018-08-04 00:07:46
1134066,5,"很好，虽然很优惠，但是包装不优惠，很结实牢固，第一次用严选，发现现在控制不住了",2018-08-04 13:58:28
1134066,5,"一直用的这个给小朋友擦手口屁股 有一定厚度 不错",2018-07-16 17:19:25
1134066,5,"好好",2018-08-01 13:26:06
1134066,5,"",2018-08-01 17:24:30
1134066,5,"一块钱你买不了吃亏你买不了上当
一块钱你却可以买到一大包湿巾
在这个炎炎的夏天 居家必备之物
一个字 真的值！",2018-07-30 18:08:00
1134066,5,"挺好的，一大包，感觉经济适用",2018-07-31 18:14:00
1134066,5,"首单1元团购的，很大一包",2018-07-31 22:30:47
1134066,5,"",2018-07-31 15:32:37
1134066,5,"更好好好好好好好好好好好好好好好好好好好好好好",2018-07-20 17:34:01
1134066,5,"打开闻了下，没啥味道，日常擦手擦桌子用！",2018-07-20 11:37:45
1134066,5,"买了多次了 很好哟",2018-07-29 18:19:51
1134066,5,"",2018-07-29 11:32:29
1134066,5,"宝宝湿巾，不连抽，水量足，让宝宝使用我是放心的！推荐够买",2018-05-08 08:32:20
1134066,5,"价格实惠 特别大一包 网易的产品已经遍布家中了",2018-07-19 10:28:53
1134066,5,"快递很快哦  第二天就到了 用了几天感觉挺好",2018-08-04 17:17:17
1134066,5,"很好用 一张就是一张 不会因为是抽拉的影响到下一张 还要塞回去",2018-08-04 16:14:08
1134066,5,"意想不到的好 ，一箱我老公都抱不动，太沉了， 看我拍的图片，比全棉时代的还厚一倍。真的是太赞了",2018-03-15 15:25:29
1134066,5,"超级喜欢这款湿巾，很厚一包，没有刺鼻的香气。一直回购。",2018-06-15 11:18:18
1134066,5,"送货速度很快，而且纸巾质量很好，1元秒杀到真的很划算！",2018-06-14 17:08:38
1134066,1,"太不准了，左耳朵36.9右耳朵37.7，我没办法去医务室量的，38.2
买了这么久了才第一次用，不知道这样的垃圾质量能不能退货！！！！！！",2018-08-03 20:17:44
1134066,5,"",2018-07-23 10:00:50
1134066,5,"方便方便，一大包，实惠又实用，严选是个毒",2018-07-18 10:14:03
1134066,5,"家庭装，很合算",2018-07-22 18:44:54
1134066,5,"湿巾不错，身边的朋友同事都推荐严选，想来是有原因的！",2018-06-10 12:29:46
1134066,5,"凑单买的湿巾没有让我失望",2018-08-05 08:03:36
1134066,5,"挺好用",2018-07-20 17:32:23
1134066,5,"虽然是凑单买的，但是质量没有让我失望，真的不连抽，没味，用着很舒服！孩子用的东西，这样的让人放心",2018-05-06 16:22:40
1134066,5,"一直用严选的纸巾，好！",2018-07-17 11:04:50
1134066,5,"很好的购物体验，昨天下的单今天就到了，很给力",2018-06-06 18:26:34
1134066,5,"湿巾很不错哦 不输某棉时代 性价比太高了",2018-06-05 19:19:45
1134066,5,"很好用，也很合算，推荐一个",2018-07-15 10:29:01
1134066,5,"一直很喜欢网易",2018-07-14 13:42:43
1134066,5,"难道你的呢",2018-08-01 19:12:00
1134066,4,"开封久了会变干",2018-07-29 12:54:43
1134066,5,"宝贝特别喜欢用，好评",2018-07-12 19:33:55
1134066,5,"很厚的一包，不错，搞活动的时候买的挺划算",2018-07-03 16:56:14
1134066,5,"严选出品必属精品！！",2018-07-11 21:55:25
1134066,5,"物流很有速度，囤货中，一包很重手<U+0001F600><U+0001F600><U+0001F600>",2018-05-13 18:14:04
1134066,5,"凑单买的，家里的湿巾全部严选的。以前用全棉时代，性价比太差",2018-07-31 22:08:42
1134066,5,"湿巾也是明星产品，性价比超高",2018-07-08 11:35:41
1134066,5,"收到还没有使用，相信严选的质量，不会让我失望的",2018-06-21 19:45:54
1134066,5,"非常满意的一次购物，东西质量很好",2018-07-06 07:30:31
1134066,5,"看着不错呦！",2018-07-05 16:02:31
1134066,5,"1块钱团购服务质量还这么好，包装这么好。",2018-07-20 10:41:49
1134066,5,"不了一张",2018-07-23 22:15:56
1134066,5,"人嘛，也都有情怀的，即便可能你还“足够年轻，情感部分不能拿捏透”，但追求物美价廉也是普世价值观嘛",2018-07-31 15:07:34
1134066,5,"超级厚实了！一张顶俩张！好用！",2018-07-04 11:04:57
1134066,5,"很好，就是水分不太足，可能是因为天气热的原因把。",2018-07-31 08:54:00
1134066,5,"第一次买严选湿巾，先用用看",2018-07-03 10:18:33
1134066,5,"一元购得纸巾。第一次从严选买东西，听一个宝妈在群里说不错，果然没有失望，快递是京东物流，第二天就到了，给力。赞一个，还会继续支持。",2018-06-13 11:55:52
1134066,5,"赶上活动挺实惠的，湿巾厚度也还可以。",2018-07-01 12:31:57
1134066,5,"很大一包，很满意",2018-07-03 14:20:08
1134066,5,"满意，物流很快，一次愉快的购买",2018-07-01 19:06:10
1134066,5,"很喜欢、很好用",2018-07-01 18:06:03
1134066,5,"湿巾很好用，很不错，值得拥有。",2018-06-30 23:27:19
1134066,5,"囤货中。。。还没开始用，期待效果。",2018-06-30 11:50:06
1134066,1,"一次买了三箱，发过来竟然一箱是散装，散装就算了，这包装简直不敢恭维，压的东倒西歪的，这包装绝对差评，完全颠覆我对网易严选的好印象。",2018-07-13 21:37:58
1134066,3,"水分少",2018-07-18 13:25:18
1134066,5,"光包装的颜色就很喜欢啊",2018-06-30 17:55:47
1134066,5,"囤货一箱",2018-06-30 11:07:48
1134066,5,"合作愉快，已经确认付款，请查收!",2018-07-20 23:15:32
1134066,5,"",2018-06-30 06:59:17
1134066,5,"虽然有点麻烦。。但是诚信拉!",2018-07-20 12:41:20
1134066,5,"用自己敏感肌的脸做了测试，没有过敏，最起码不含酒精。一次性囤货了24大包，给宝宝用来搽屁屁。物流很快很赞。值得购买~",2018-06-09 16:08:29
1134066,5,"很大一包，一元拼团买的，日期很新，包装也很好，不错。",2018-05-20 20:15:19
1134066,5,"免费的，在朋友家看她给她儿子用，发现非常好用",2018-06-02 17:01:25
1134066,5,"这个好用，放在卫生间，有时候用来擦马桶盖",2018-07-14 22:43:48
1134066,5,"在严选上买的质量超级好，很快就收到货。",2018-06-22 16:20:22
1134066,5,"后面也",2018-07-14 21:05:14
1134066,5,"非常快，不错",2018-06-26 10:58:01
1134066,5,"严选有毒，严选有毒，严选有毒…",2018-06-24 22:53:24
1134066,5,"不错的 抽取很方便的",2018-06-24 12:24:06
1134066,5,"感觉用了一段时间以后，有点干了。",2018-07-06 16:20:10
1134066,5,"蛮不错的 挺好用的 以后还会继续买",2018-06-18 14:21:40
1134066,5,"感觉质量挺好的",2018-06-21 13:42:38
1134066,5,"产品高大上，包装也精致，物流速度快",2018-06-18 09:08:11
1134066,5,"还不错，就是出库发货时间还是需要提高，第三天才有物流",2018-07-05 13:24:34
1134066,5,"质量不错，没有味道，好用",2018-06-20 20:27:59
1134066,5,"还可以吧 有点味道",2018-07-05 13:53:20
1134066,5,"好实惠",2018-06-20 23:02:30
1134066,5,"东西收到了。很便宜。应该有酒精。消毒的",2018-06-19 21:22:57
1134066,5,"虽然是凑单买的，但是没有异味，而且物流很快。",2018-06-11 12:33:59
1134066,5,"价格实惠又非常棒的湿巾 之前买了两大箱",2018-06-04 10:14:53
1134066,5,"纸有点硬，这个不是很适合婴儿用。",2018-07-04 10:11:42
1134066,5,"第二次买了，主要是便宜",2018-06-19 15:26:16
1134066,5,"性价比很高，厚实",2018-06-19 13:14:44
1134066,5,"一直用这款，满意。",2018-06-19 23:17:44
1134066,4,"好厚实的一包，物美价廉",2018-06-19 19:19:42
1134066,5,"赠品 湿巾没有人工添加的香味 不会过敏",2018-07-03 13:02:40
1134066,5,"挺不错的，用的还好，能长时间保持住水分",2018-06-10 15:06:11
1134066,5,"纸巾很不错，特别是包装第一眼看上去就让人很nice。",2018-06-10 16:07:41
1134066,5,"以前买过小包装的，很不错。",2018-06-18 20:38:49
1134066,5,"湿巾很不错，水分可以，满意",2018-06-18 13:42:46
1134066,5,"买了很多很多回了，首先说他抽取方便，封口做的也很好，多次开关都不存在关不利落，颜色很小清新，摆在桌上很好看，一包能用半个月，擦脸擦手擦嘴巴，都OK。无敌回购款",2018-06-18 15:15:57
1134066,5,"非常好用！1元组团！",2018-06-18 03:59:36
1134066,5,"非常好",2018-06-18 08:03:04
1134066,5,"本地制造的，同学的公司！<U+0001F600>",2018-05-20 19:02:35
1134066,5,"在网易上买的第一单，限时购便宜了几十块。刀具锋利，木质搁板有一点点味道。总的来说不错湿巾物美价廉",2018-06-30 19:40:13
1134066,5,"",2018-06-18 07:12:27
1134066,5,"买了一堆婴儿用品，巴适！",2018-07-02 09:09:08
1134066,5,"一如既往好用，便宜，第n次回购了",2018-06-17 14:39:11
1134066,5,"特别好用，上次猴买后中间有段时间缺货，终于又上架了，毫不犹豫买两箱先囤着，水份多，布厚实，中了严选的毒，生活用品统统严选搞定，哈哈哈",2018-06-15 10:41:51
1134066,5,"实惠，但是纸纹理比较没那么细腻，可能粗糙点擦宝宝屁屁刚刚好…",2018-06-22 15:15:24
1134066,5,"挺厚实，大小合适，偶尔会掉棉絮",2018-06-17 14:41:17
1134066,5,"超超超超超好用",2018-06-17 12:36:31
1134066,5,"好用超好用 推荐",2018-06-17 12:36:08
1134066,5,"这个纸巾包装上很严密，贴合的封口部分很紧。撕开之后，采用的不是连抽，每一张都需要自己重新拉出。不过这很卫生。湿巾本身很不错，很舒服，手感很好。",2018-06-23 10:32:35
1134066,5,"很好，新号买的",2018-06-17 19:41:31
1134066,5,"物美价廉！对皮肤无刺激！",2018-06-17 11:22:41
1134066,5,"买了两次了",2018-06-23 15:48:21
