"itemId","star","content","createTime"
1135063,5,"同上。希望网易严选再接再厉，百尺竿头。不要走我们企业走过的老路。",2018-04-27 11:26:46
1135063,5,"料子舒服弹性好",2018-08-01 21:54:55
1135063,5,"170/70公斤大小刚刚好！非常好穿！质量保证！",2018-07-25 15:40:48
1135063,5,"跟我的Calvin Klein 材质差不多，剪裁还过得去",2018-06-21 20:36:52
1135063,5,"内裤合适，和ck的款式一样，值得入手",2018-05-24 17:11:29
1135063,5,"速度快！质量好！摸起来很舒服！希望穿起来也很赞！不知掉透气不透气！希望能有机会回购！",2018-07-26 13:27:35
1135063,5,"第二次购买了，料子真的非常舒服，jj前面好像有人用手轻轻捂着一样，囊袋设计太好了，一点都不嘞。",2018-08-15 14:50:54
1135063,5,"第二次购买了，料子真的非常舒服，jj前面好像有人用手轻轻捂着一样，囊袋设计太好了，一点都不嘞。",2018-08-15 14:50:04
1135063,5,"质地柔软，尺码合适，在网上比较难买到那么合适的内裤，一上身马上就喜欢得不得了，马上就下单购买其他颜色。",2018-08-15 18:59:04
1135063,5,"款式很潮和很性感，手感也很好，很期待试穿的感觉，而且还打折了！",2018-07-12 21:37:33
1135063,5,"已经是回购了，穿着很舒服，手感特别好，质量也不错，最近有折扣，性价比还是很不错的，物流速度也很快！",2018-08-19 20:42:17
1135063,5,"内裤很舒服，但是买大了一号，应该买xl的，一直穿严选家内裤，已经买了严选家十多条内裤了，合适。<U+0001F604>",2018-06-06 14:06:48
1135063,5,"好东西，限时购又超级合适，赞赞赞赞赞赞赞赞赞赞赞赞",2018-05-28 14:18:50
1135063,5,"好&#39;纯棉的&#39;穿着很舒服以后就在这里买了&#39;好好好好好好好好好好",2018-03-16 10:19:31
1135063,5,"质感很好，很薄，弹性非常好。只是价格也还是不便宜。。。总的来说很好，",2018-06-09 12:44:46
1135063,5,"质感很好，很薄，弹性非常好。只是价格也还是不便宜。。。总的来说很好，",2018-06-09 12:44:41
1135063,5,"不错，腰身材质很好，整体手感也很好，",2018-08-22 10:07:37
1135063,5,"包装整洁，值得信赖",2018-08-22 10:06:58
1135063,5,"超级舒服，严选好物！",2018-08-21 17:12:33
1135063,5,"175cm  60kg  穿着舒服合适  不夹pp 包裹性好 布料舒适 在宿舍以前都是平角  突然穿三角 觉得略微有点骚<U+0001F602>",2018-05-14 09:09:31
1135063,5,"外观美丽，手感美丽，是大牌感觉！",2018-08-17 14:11:45
1135063,5,"",2018-08-08 10:08:14
1135063,5,"质量不错。穿后再评价",2018-08-01 12:55:27
1135063,5,"",2018-08-01 21:54:39
1135063,5,"看到促销回购的，内裤款型包裹感很好，很贴肌肤！",2018-07-06 19:09:20
1135063,5,"合适，做工很好，应该买大一号",2018-07-21 10:20:16
1135063,5,"非常好的品质，绝对推荐！",2018-07-21 01:22:57
1135063,4,"掉毛！可劲掉！",2018-07-21 08:59:06
1135063,5,"是带点顺滑而又有质感的料子，很舒服～",2018-07-05 00:12:17
1135063,5,"是带点顺滑而又有质感的料子，很舒服～",2018-07-05 00:12:12
1135063,5,"是带点顺滑而又有质感的料子，很舒服～",2018-07-05 00:12:09
1135063,5,"是带点顺滑而又有质感的料子，很舒服～",2018-07-05 00:12:02
1135063,5,"可以",2018-07-11 14:26:16
1135063,5,"挺不错的",2018-07-08 00:44:34
1135063,5,"手感不错，穿上去应该也不错",2018-07-07 14:41:00
1135063,5,"手感不错，穿上去应该也不错",2018-07-07 14:40:43
1135063,5,"手感不错，穿上去应该也不错",2018-07-07 14:40:27
1135063,5,"穿一次就知道是自己想要的",2018-07-05 15:16:14
1135063,5,"质量不错，摸着很舒服，穿着舒服，透气性不错！",2018-06-27 18:56:30
1135063,5,"以前很少穿三角的，纯粹是看模特图片觉得也可以尝试",2018-06-03 09:44:13
1135063,5,"摸着就超级舒服的料子，老公稀罕，就是想买红色没有货",2018-05-28 14:17:46
1135063,5,"好品质",2018-06-11 22:03:56
1135063,5,"不错不错，摸起来很舒服，款式也是很简单",2018-06-03 09:44:50
1135063,5,"面料没有莫代尔的舒服透气不好",2018-06-04 18:51:22
1135063,5,"跟ck的款式一样，质量也不错，性价比高，值得入手",2018-05-20 20:01:32
1135063,5,"跟ck的款式一样，质量也不错，性价比高，值得入手",2018-05-20 20:01:19
1135063,5,"好好看看，很好",2018-05-14 12:56:14
1135063,5,"不错，多次购买",2018-05-14 12:55:46
1135063,5,"很好很赞，穿上很舒适",2018-05-13 22:42:39
1135063,5,"很好很赞，穿上很舒适",2018-05-13 22:42:35
1135063,5,"很好很赞，穿上很舒适",2018-05-13 22:42:31
1135063,5,"质量超级好，先生说，有史以来穿过最舒服的。",2018-05-10 06:46:55
1135063,5,"里昂 男式三角内裤须质量非常不错非常给力！",2018-04-29 18:01:25
1135063,5,"里昂 男式三角内裤质量非常不错非常给力！",2018-04-29 18:01:48
1135063,5,"里昂 男式三角内裤质量非常不错非常给力！",2018-04-29 18:01:43
1135063,5,"里昂 男式三角内裤质量非常不错非常给力！",2018-04-29 18:01:38
1135063,5,"质量很好！穿着舒适，不比CK差，但尺寸偏大。",2018-04-22 15:41:47
1135063,5,"最便宜的东西免费送的礼物<U+0001F381><U+0001F381><U+0001F381>",2018-04-13 13:58:36
1135063,5,"挺有质感，挺性感，腰部有点松",2018-04-26 18:15:07
1135063,5,"内裤很舒服，洗了也没有掉色，很不错！",2018-04-23 17:32:16
1135063,5,"内裤很舒服，洗了也没有掉色，很不错！",2018-04-23 17:32:07
1135063,5,"这是回购的！非常好！网易严选值得信赖！",2018-04-14 16:09:21
1135063,5,"布料很舒服等老公试穿",2018-04-15 20:31:42
1135063,5,"买来试试 手感体感都不错啦  老婆也称赞",2018-04-11 21:44:49
1135063,5,"这是回购！网易严选值得信赖！",2018-04-14 16:09:18
1135063,5,"相信严选的品质",2018-04-14 15:26:58
1135063,5,"很好",2018-04-14 15:28:28
1135063,5,"一如既往地的好，不过同时购买的玩色很失望。",2018-04-08 11:47:26
1135063,5,"一如既往地的好，不过同时购买的玩色很失望。",2018-04-08 11:47:14
1135063,5,"非常不错",2018-04-09 13:09:23
1135063,5,"",2018-04-07 04:23:25
1135063,5,"标价好贵的内裤。。没啥太特别的。。。感觉一般般",2018-03-18 16:19:16
1135063,5,"质量摸起来不错，但是尺码偏大了点",2018-03-20 18:28:38
1135063,5,"好 质量手感特别好",2018-03-18 14:42:34
1135063,5,"里昂 男式三角内裤非常给力！",2017-11-18 13:55:57
1135063,5,"不错不错，换货客户MM态度蛮好，174 80 L码差不多质感可以，刚洗了，上身感觉一下再追加",2017-12-12 23:00:35
1135063,5,"不错不错，换货客户MM态度蛮好，174 80 L码差不多质感可以，刚洗了，上身感觉一下再追加",2017-12-12 23:00:28
1135063,5,"不错不错，换货客户MM态度蛮好，174 80 L码差不多质感可以，刚洗了，上身感觉一下再追加",2017-12-12 23:00:22
1135063,5,"不错不错，换货客户MM态度蛮好，174 80 L码差不多质感可以，刚洗了，上身感觉一下再追加",2017-12-12 22:58:39
1135063,5,"不错不错，换货客户MM态度蛮好，174 80 L码差不多质感可以，刚洗了，上身感觉一下再追加",2017-12-12 22:58:32
1135063,5,"不错不错，换货客户MM态度蛮好，174 80 L码差不多质感可以，刚洗了，上身感觉一下再追加",2017-12-12 22:58:23
1135063,5,"活动价买的，非常划算，质量做工都比较好，穿的也舒服。原来就比较小贵。。。。。",2017-12-09 20:15:14
1135063,5,"我男朋友说这是他穿过的最舒服的内裤<U+0001F602>",2018-07-28 23:41:52
1135063,5,"质地柔软、穿着舒适。",2018-07-31 16:55:48
1135063,5,"用了色魔张大妈的值友专享券免单入手的，品质的确没的说。",2017-10-15 19:20:30
1135063,5,"物流很棒，换货过程体验也很好，客服非常贴心。支持严选。",2018-01-27 00:10:21
1135063,5,"",2018-03-12 14:22:54
1135063,5,"",2018-03-12 14:20:55
1135063,5,"第二次购买了，网易的品质值得推荐！",2018-06-20 10:05:37
1135063,5,"第二次购买了，网易的品质值得推荐！",2018-06-20 10:05:26
1135063,5,"质量挺好的，不过不适合肉多的屁股",2018-08-18 21:12:56
1135063,5,"占据兔、一定、一定是因为有人患了绝症患者都不会知道你有一定值的大小来了？我是你自己不会好受",2017-10-23 07:35:20
1135063,1,"同上。",2018-08-18 09:23:59
1135063,5,"款式和手感都不输大牌，赞",2018-06-05 09:27:49
1135063,5,"老公说还不错很舒服",2018-06-05 07:16:08
1135063,3,"第一次买男士内裤，尺寸掌握的不错<U+0001F60A>",2018-08-21 10:47:38
1135063,5,"一直在穿这个，但断码了想买多点也没有，请问什么时候有货？通知一下",2018-08-15 23:52:30
1135063,5,"可以，如期而至",2018-02-19 17:54:22
1135063,5,"可以，如期而至",2018-02-19 17:54:16
1135063,5,"嗯嗯嗯嗯 手感很好 莫代尔 腰头也不硬 总之很不错哦
就是有点贵了",2018-08-15 12:31:31
1135063,5,"非常不错，穿起来贴身，凹凸有致，性感完美，马上又下单再买，好货怕错过！",2018-08-15 09:43:49
1135063,5,"老公一直穿CK的，给他买的严选一直看不上眼。穿了一次就爱上了。哈哈，省了一大笔。",2018-08-14 20:45:25
1135063,5,"老公一直穿CK的，给他买的严选一直看不上眼。穿了一次就爱上了。哈哈，省了一大笔。",2018-08-14 20:45:23
1135063,5,"老公一直穿CK的，给他买的严选一直看不上眼。穿了一次就爱上了。哈哈，省了一大笔。",2018-08-14 20:45:20
1135063,5,"一如既往的舒服，以后内裤都在这买了",2018-05-22 11:33:16
1135063,5,"内裤质感很好，跟300-400的CK质感一毛一样，这个价位买到这样的质感太划算了！",2018-08-05 02:13:54
1135063,5,"看见这么大的优惠，立刻再次下手购买囤货。非常好穿的内裤，凉爽透气。款式经典，颜色大气。",2018-08-22 17:28:30
1135063,5,"看见这么大的优惠，立刻再次下手购买囤货。非常好穿的内裤，凉爽透气。款式经典，颜色大气。",2018-08-22 17:28:25
1135063,5,"看见这么大的优惠，立刻再次下手购买囤货。非常好穿的内裤，凉爽透气。款式经典，颜色大气。",2018-08-22 17:28:08
1135063,5,"红色超级正 合适 舒服",2018-01-30 23:32:59
1135063,5,"哎，买回来就放在那里摆看。太大了，又穿不了然后也不能退货，你说我送给谁呀？我们家就没有胖子怎么办呢？哎，难道用来当抹布，当抹布又觉得心疼了，这么精致的吗？不哎。",2018-08-08 15:32:27
1135063,5,"布料非常光滑",2018-01-30 15:34:25
1135063,5,"质量和做工都很棒，就是腰带有点偏大，但是穿着后非常舒服，没有松垮的感觉！",2018-07-30 10:57:56
1135063,5,"穿着舒服，要是没这几个字就更好了",2018-01-20 18:14:53
1135063,5,"拿到手中发现裤子的质量是非常的好，非常的精致，但是我很郁闷的事情就是我真的买大了，这个内裤的尺码真的让人捉摸不定啊，很难很难很难买到非常准确地啊，完全是大了两个尺码，哎，你说我怎么穿呢，好郁闷，只能摆在那里看的。",2018-08-08 15:31:50
1135063,5,"还不错，只不过这个价格，我真是懵了，第一次买59，两天以后买45…",2018-08-02 00:20:45
1135063,5,"",2018-01-24 23:46:25
1135063,5,"从尺码看，大号有点饱满，买的加大号，感觉有点大，晚上试试
质量是没得说的，第一次买这个品牌！",2018-08-11 18:45:20
1135063,5,"还不错，只不过这个价格，我真是懵了，第一次买59，两天以后买45…",2018-08-02 00:20:50
1135063,5,"质量真好，摸起来都很说话，透气，边角都整齐。相信严选，我需要的，严选有的，我都会买。",2018-07-17 18:59:31
1135063,5,"质量真好，摸起来都很说话，透气，边角都整齐。相信严选，我需要的，严选有的，我都会买。",2018-07-17 18:59:20
1135063,5,"手感不错，不过建议买平角的，穿着舒服",2018-01-20 18:13:47
1135063,5,"害羞的说，我老公说非常舒服，像我的手捂着一样……",2018-01-17 22:35:26
1135063,5,"内裤质感很好，跟300-400的CK质感一毛一样，这个价位买到这样的质感太划算了！建议多出点颜色",2018-08-05 02:14:12
1135063,5,"手感很好，应该是很舒服的",2018-01-14 10:05:16
1135063,5,"面料挺舒服的，很喜欢！",2018-01-14 19:41:53
1135063,5,"不能",2018-07-28 10:52:14
1135063,3,"一般吧，没有基础的舒服，但基础的牛筋太差",2018-07-19 14:46:11
1135063,5,"非常好看！很时尚！",2018-01-10 18:48:53
1135063,5,"老公说超级好穿，决定再买两条，这条买的59，后来买的45…这价格浮动的…",2018-07-27 20:09:38
1135063,5,"合适",2018-01-02 12:30:22
1135063,5,"合适",2018-01-02 12:30:16
1135063,1,"设计师是根据自己的尺寸设计的吗？自己小就觉得全世界的都小，袋囊勒的难受",2018-07-23 18:46:20
1135063,5,"朋友介绍的，第一次穿网易内裤，质地滑滑的跟肌肤很贴",2017-11-18 17:50:54
1135063,5,"活动价买的还挺划算",2017-12-30 10:22:39
1135063,5,"活动价不错",2017-12-30 10:23:37
1135063,5,"不错",2017-12-30 10:23:21
1135063,5,"五颗星好评，以前一直买优衣库的，买了这款以后，优衣库的被老公全扔了………",2018-07-15 12:21:59
1135063,5,"还好吧，穿着舒服，不过洗几次有点变形，可以接受",2018-07-17 16:00:09
1135063,5,"一直都在穿的三角内裤，质量很好，以后还会光顾。",2017-12-09 10:20:49
1135063,5,"一直都在穿的三角内裤，质量很好，以后还会光顾。",2017-12-09 10:20:23
1135063,5,"非常棒的内裤哦，我儿子很喜欢！感谢网易这个购物平台！",2017-11-28 19:55:11
1135063,3,"尺寸有点小，面料一般",2018-07-09 17:01:51
1135063,5,"不错…………………………………………………………",2017-12-23 00:09:05
1135063,5,"不错…………………………………………………………",2017-12-23 00:08:45
1135063,5,"应该再买个白色的，严选的质量和设计风格很不错，多推出优惠活动会更好！",2018-07-30 10:59:04
1135063,5,"不是全棉的",2018-07-08 21:36:48
1135063,5,"真是看的不错",2017-12-20 13:25:00
1135063,5,"真是看的不错",2017-12-20 13:24:57
1135063,5,"这种业务流程和",2018-07-14 20:19:24
1135063,5,"103选3，买了几条试试看。质量不错，挺舒服。棉质很舒服。颜色也不错。回继续回购。",2018-06-18 10:29:06
1135063,5,"摸着还行，等穿了再补",2017-12-17 11:21:38
1135063,5,"摸着不错，穿了再补评",2017-12-17 11:22:23
1135063,5,"手感柔软细腻光滑，下水也没有掉色.",2017-12-07 22:03:55
1135063,5,"手感柔软细腻光滑，下水也没有掉色.",2017-12-07 22:03:48
1135063,5,"为啥一直掉色呢",2018-06-13 23:41:57
1135063,5,"东西是还不错，可是6号买的139三件，9号看到就109三件。也降太快了。",2018-06-09 16:26:30
1135063,5,"非常满意严选质量",2017-12-15 09:29:44
1135063,5,"手感，材料，都是这个价位所很难买到的，除了号码选大了点，有点遗憾不得不送人穿了。",2018-06-05 22:48:57
1135063,5,"第二次购买了，大号没了，买的加大号，稍微大了一点点，也没关系。料非常舒服，好评！！",2018-08-18 09:18:30
1135063,3,"掉颜色，已经是二次回购了，没想到掉颜色，直接接触私密皮肤的内裤竟然掉颜色。",2018-06-11 16:46:05
1135063,5,"看外观不错，棉质也比较密实。穿了在追评。",2017-12-02 17:58:46
1135063,5,"看外观不错，棉质也比较密实。穿了在追评。",2017-12-02 17:58:27
1135063,5,"收到了，还没穿",2017-12-11 18:36:05
1135063,5,"给老公买的，老公喜欢穿这种的，透气又舒适，囤货中",2017-11-11 02:18:45
1135063,5,"给老公买的，老公喜欢穿这种的，透气又舒适，囤货中",2017-11-11 02:18:36
1135063,5,"给老公买的，老公喜欢穿这种的，透气又舒适，囤货中",2017-11-11 02:18:30
1135063,5,"这个和ck的一样手感，已经没有区别了。",2018-08-15 08:03:20
1135063,5,"88元三件比原来便宜，买来囤货",2017-12-07 22:34:22
1135063,5,"88元三件比原来便宜，买来囤货",2017-12-07 22:34:17
1135063,5,"材质不错，尺寸偏小一个码",2017-12-07 18:43:40
1135063,5,"多次回购中",2017-12-04 11:20:40
1135063,5,"质量超好，柔软丝滑！！穿身上好性感！发光！大赞<U+0001F44D>！",2017-11-07 09:36:10
1135063,5,"非常合穿！！以前的稍微有点紧的内裤都可以丢掉啦，以后肯定回购！以前穿棉质的建议买小一码。",2018-07-03 22:37:50
1135063,5,"非常合穿！！以前的稍微有点紧的内裤都可以丢掉啦，以后肯定回购！以前穿棉质的建议买小一码。",2018-07-03 22:37:41
1135063,5,"布料很舒服 但感觉size小了 165 60 选M稍微有点紧 供参考 也可能是我的屁屁肥了点吧 希望这种88任选3件的活动多一点 哈哈",2017-11-13 15:29:36
1135063,5,"这个质感非常好，只是尺寸同样是xl要比另外买的两条装的腰款了一些",2018-05-27 23:31:37
1135063,4,"其他款式买175，这款就得买180，正合适，有弹性，手感好，不过排汗性一般",2018-07-01 18:37:03
1135063,5,"不错，穿着挺舒服",2017-11-24 11:30:24
1135063,5,"不错，穿着挺舒服",2017-11-24 11:30:20
1135063,5,"不错，穿着挺舒服",2017-11-24 11:30:16
1135063,5,"回购的，洗了一下，掉色很严重！",2018-06-11 10:45:33
1135063,5,"感觉只能穿一年",2018-06-07 15:56:39
1135063,5,"发错货，不补货，耽误很长时间，沟通推委，退货流程超繁琐，差！差！差！",2018-06-06 11:30:03
1135063,5,"内裤还是一如既往地好，已经是第三次购买了。第一次买是试探性的，毕竟不知道大小是否合适。后面两次就直接下单了。",2018-05-27 13:42:25
1135063,5,"摸上去手感非常好！一分价钱一分货！满意！",2017-11-22 19:37:54
1135063,1,"按照之前的尺码买大了，下次麻烦尺码调整的时候请用高亮提醒",2018-05-26 10:51:18
1135063,5,"质量很好，很有质感！",2017-11-22 19:39:03
1135063,5,"183，80公斤，185的有点儿松，看来下次得买180了。",2017-11-12 21:15:02
1135063,5,"氨纶的材质透气性不好不舒服没莫代尔的舒服",2018-06-04 18:54:49
1135063,5,"大小合适，穿着舒服",2017-11-20 12:35:49
1135063,5,"大小合适，穿着舒服",2017-11-20 12:35:09
1135063,5,"料子真的太舒服了 物超所值了 完全不止59的感觉",2017-09-23 15:47:10
1135063,5,"里昂 男式三角非常给力！",2017-11-18 13:56:02
1135063,5,"买大了，郁闷",2018-05-28 23:08:57
1135063,1,"这么多好评可能是评价有礼换来的吧！穿了一段时间来评价的，群众的眼睛是雪亮的，看图吧！起球，严重起球，近五十块一条的内裤，我想成本最多也就几元钱，真是买出了天价，好评有礼我也不要了，送我返现又去买这种天价垃圾吗！",2018-06-21 10:00:28
1135063,5,"试穿了 很舒服",2017-11-16 20:45:55
1135063,5,"试穿了 很舒服",2017-11-16 20:45:47
1135063,5,"试穿了 很舒服",2017-11-16 20:45:37
1135063,5,"之前买的平角裤，这次买的这个。质量不错。103选3件。挺划算。关键是质量好舒服。",2018-06-18 10:28:16
1135063,5,"东西很好，值得购买。",2017-11-10 19:20:14
1135063,5,"早就想买了，这次看到有活动果断下单了！",2017-11-05 12:27:51
1135063,5,"买小了郁闷",2018-05-24 10:32:19
1135063,5,"质量超级好",2017-11-06 14:17:45
1135063,5,"好满意",2017-11-04 16:10:52
1135063,5,"短裤还行",2018-06-04 11:53:54
1135063,5,"在张大妈上用兑换码撸的，质感很顺滑，很有弹性，不错。本人170，72kg，腰围80，臀围67，常年健身，买的m码挺贴身，腰带也不会很紧，刚刚好，不会觉得勒，各位可以参考一下。",2017-10-29 16:02:37
1135063,5,"在张大妈上用兑换码撸的，质感很顺滑，很有弹性，不错。本人170，72kg，腰围80，臀围67，常年健身，买的m码挺贴身，腰带也不会很紧，刚刚好，不会觉得勒，各位可以参考一下。红白蓝各买了一条，都不错，白色最性感，而且湿水后会透哦",2017-10-29 16:06:26
1135063,5,"在张大妈上用兑换码撸的，质感很顺滑，很有弹性，不错。本人170，72kg，腰围80，臀围67，常年健身，买的m码挺贴身，腰带也不会很紧，刚刚好，不会觉得勒，各位可以参考一下。红白蓝各买了一条，都不错，白色最性感，而且湿水后会透哦",2017-10-29 16:05:36
1135063,5,"做特价买的，料子很棒，买给爸爸的，结果买大了，又不能退，好可惜。",2018-06-21 09:46:37
1135063,5,"做特价买的，料子很棒，买给爸爸的，结果买大了，又不能退，好可惜。",2018-06-21 09:46:27
1135063,5,"舒服",2017-10-25 15:38:54
1135063,5,"只选对的，相信严选，就是品种、货源再多一点会更套住我们。",2018-08-12 14:59:48
1135063,5,"摸着质感好舒服，还没穿",2017-10-24 19:56:35
1135063,5,"面料很舒服！包装很好看，质量不错，弹性很好。",2017-10-17 11:15:14
1135063,1,"褪色！好明显",2018-04-24 12:09:39
1135063,5,"很不错，本命年求转运",2017-10-19 16:31:05
1135063,5,"好东西要分享，好看又好用！！<U+A242> <U+0CED>(<U+02F5>ˉ<U+0334><U+0352><U+A1F4>ˉ<U+0334><U+0352><U+02F5>)<U+0C68>”哇哈哈",2018-04-25 15:23:09
1135063,5,"橡筋弹性挺好的，料子也舒服，内内基本都是在严选买了！",2018-07-30 15:51:05
1135063,5,"是谁说这个号码偏大的，你过来，我保证不打死你",2018-04-26 18:13:09
1135063,5,"和之前一样，不错不错。",2017-10-15 22:26:38
1135063,5,"和之前一样，不错不错。",2017-10-15 22:26:34
1135063,5,"和之前一样，不错不错。",2017-10-15 22:25:46
1135063,5,"有点大，红色老是缺货",2018-05-01 23:58:12
1135063,3,"洗的时候掉色很严重，洗好几次了还掉色，不知道为卅",2018-04-30 17:11:13
1135063,5,"质量很好",2017-10-13 10:18:08
1135063,5,"质量很好，希望码子再分细一点。",2017-10-12 23:30:49
1135063,5,"一直在严选家买短裤，我的，老公的，宝贝的，这次一如既往的来购买，非常舒服，面料和款式都很不错。买了三个颜色的，很喜欢。",2018-07-12 15:34:39
1135063,5,"一直在严选家买短裤，我的，老公的，宝贝的，这次一如既往的来购买，非常舒服，面料和款式都很不错。买了三个颜色的，很喜欢。",2018-07-12 15:34:35
1135063,5,"一直在严选家买短裤，我的，老公的，宝贝的，这次一如既往的来购买，非常舒服，面料和款式都很不错。买了三个颜色的，很喜欢。",2018-07-12 15:34:29
1135063,5,"收到货品，缝线和材质都很棒！推荐一下呗",2017-10-07 21:10:55
1135063,5,"质量不错哦，就是商标改下",2018-04-22 11:16:15
1135063,5,"手感还不错 还没穿 刚洗 后续追评",2017-10-08 23:53:26
1135063,5,"特别舒服，一点不磨，透气，软滑。找了这么久，就这款最舒服。",2018-08-15 23:17:11
1135063,5,"特别舒服，一点不磨，透气，软滑。找了这么久，就这款最舒服。",2018-08-15 23:17:05
1135063,1,"内裤有线头，洗的时候掉颜色，我这都是第二次洗了，还掉颜色！！！伤心<U+0001F494>严选在我心中一直都是好东西，但是这个内裤太让人伤心了！丁磊老板，你给我回个话啊！！！！！",2018-04-18 10:45:08
1135063,5,"摸起来手感很好，料子柔软，还没有试穿。",2017-10-07 20:53:03
1135063,5,"摸起来手感很好，料子柔软，还没有试穿。",2017-10-07 20:52:56
1135063,5,"已经收到还没有拆开来看，看着还可以不知道穿起来怎么样！以后再追评呗",2018-04-13 10:04:21
1135063,5,"175.64 正常体型，L裆部大的像纸尿裤，M稍微勒大腿，愁人",2017-07-26 10:36:42
1135063,5,"内裤料子很软很舒服，但是赶脚设计不太科学，接缝处很粗很硬，而且都是在里面，穿起来有点不舒服。",2018-04-16 15:31:07
1135063,5,"非常满意！总是听人说网易严选不错，今天第一次在网易严选上面购物，感觉很好，名不虚传。",2018-04-27 11:25:56
1135063,5,"裤子质量很好，码子貌似有点偏大。",2018-05-29 23:12:29
1135063,5,"摸起来手感很好，锦纶和氨纶，没有棉质，穿起来挺舒服的。",2017-07-24 16:43:50
1135063,0,"跟商场里买的CK的手感差不多，发现也非常合适，喜欢这种红，没有图片那么亮，适合男生！",2017-05-04 22:35:12
1135063,5,"质量看起来不错，手感很好，不过码数比平时买的其他品牌有点偏大",2018-07-07 18:14:25
1135063,5,"非常非常满意，非常非常满意，非常非常满意。超满意。我已经买了N次了。",2018-07-07 18:58:11
1135063,5,"系统默认好评",2018-08-09 02:32:05
1135063,5,"包装很好看，质量不错，弹性很好，上身很舒适，会再买",2017-08-31 15:34:04
1135063,5,"包装很好看，质量不错，弹性很好，上身很舒适，会再买",2017-08-31 15:34:23
1135063,0,"穿在身上，有一种冰爽的感脚，很适合夏天穿，很舒服，很性感<U+0001F648>",2017-06-27 00:25:56
1135063,5,"好吧，是我看错了，以为有两条，质地是不错的，就是贵了点～",2018-05-29 21:30:37
1135063,5,"好吧，是我看错了，以为有两条，质地是不错的，就是贵了点～",2018-05-29 21:30:45
