"itemId","star","content","createTime"
1136012,5,"好吃好吃，这才是真正的甘薯条。上次在粒上皇买了一包，像是橡胶一样咬不动",2017-11-17 00:05:46
1136012,3,"不怎么好吃，起码扔了半包",2017-11-19 11:11:39
1136012,5,"感谢快递小哥晚上八点多还是给送到家了，真是辛苦他了！",2018-03-10 10:06:15
1136012,5,"甘薯条很好吃，软软的，甘薯很糯，就是量太少了，一包不够吃啊<U+0001F60D><U+0001F60D><U+0001F60D>",2017-12-09 11:26:50
1136012,5,"买了N次了，比华堂超市的还好吃，软软糯糯甜甜的，一次两包吃不够阿！！影响了我的减肥计划",2018-02-24 15:05:57
1136012,5,"买的东西还没到，赠品已经收到了，还有什么不满意的，香香的糖的味道吃起来很软",2017-11-13 14:46:38
1136012,5,"袜子棉质很好，比较柔软，这个价格买到这种质量的产品很满意，刚到严选买东西，非常好",2017-11-13 18:11:20
1136012,5,"一般吧，不爱吃这玩意，可能是我个人口味的问题。",2018-01-08 17:16:12
1136012,5,"甘薯条很软，就像煮熟的番薯切条，如果再有韧性一点就更好吃了",2017-12-05 08:51:19
1136012,5,"我觉得这个小粉软软的，用起来特别舒服，很喜欢，谢谢送的小礼物番薯干很好吃",2017-11-18 18:14:33
1136012,5,"不怎么好吃",2017-12-06 08:47:42
1136012,5,"味道很不错，不过如果能像黄桃干和芒果干的袋子是能二次封口的那种就更好了",2017-11-17 00:39:17
1136012,5,"好吃<U+0001F60B><U+0001F60B><U+0001F60B><U+0001F60B><U+0001F60B><U+0001F60B><U+0001F60B><U+0001F60B><U+0001F60B>",2018-02-28 19:42:51
1136012,5,"又精致又好吃，感觉以前买的叫做零食，今天的叫做甜点，第一次来严选买，很不错",2017-11-08 19:31:03
1136012,5,"不是很甜，偶尔有些会有发酸的感觉，是防腐剂的味道吗，保质期两年是不是太长了？",2017-12-11 19:30:11
1136012,5,"还好，有点甜，不是我喜欢的味道",2018-03-10 14:38:29
1136012,5,"很好吃 买了好几袋 分给整个办公室人吃 同事都说好 她们正在下载严选APP呢",2017-11-15 11:46:17
1136012,3,"还行吧",2018-03-06 14:22:46
1136012,5,"一般般！不怎么样！下次不买了！",2018-03-11 15:06:12
1136012,4,"买了整整一箱。好想每样都打开次。但是囤了过年饬的。等等。再等等。",2018-01-22 22:36:09
1136012,5,"双十一赠的，很好吃，给办公室的女同学很喜欢，被吃完啦，没有照片啦哈哈<U+0001F604>",2017-11-13 23:16:42
1136012,5,"很一般",2018-03-09 11:58:30
1136012,5,"严重中了严选的毒，家里越来越多严选的东东，什么都想试试。。。",2018-03-12 22:52:24
1136012,1,"难吃",2018-03-13 14:25:30
1136012,5,"实物卖相平平，吃了一根比看上去的好，回味很纯的甘薯原味",2018-03-06 16:53:13
1136012,5,"还可以 有点粗 还是喜欢吃传统的",2018-03-10 20:02:16
1136012,5,"所有买到的东西，质量上都好评，唯独早餐机买贵了，双十一才155元，多花了几十块，能退差价吗",2017-11-11 23:33:06
1136012,1,"可以说偷工减料，这也能叫红薯干？？？干……这么湿，90g在干点就45g吧，尽然敢卖这么贵，也是醉了…再也不会来什么严选什么鬼东西了。",2018-03-03 00:38:05
1136012,1,"不好吃",2018-03-10 12:59:06
1136012,3,"口感一般，对不住这个价格",2018-03-09 10:54:49
1136012,5,"不是特别甜，软糯的感觉，没有添加剂。很原味！",2018-03-11 23:08:03
1136012,5,"没有添加任何添加剂",2018-03-12 00:17:19
1136012,1,"难吃",2018-03-07 21:56:57
1136012,4,"味道还行哦，需要严选提高哦",2017-11-19 12:18:23
1136012,5,"还不错，但是口感没想象中那么好",2018-03-03 20:23:57
1136012,5,"这个好硬好，不是想象中的软糯的口感 ，不推荐购买。",2018-03-01 10:38:26
1136012,5,"个人感觉再干一点会更好吃",2018-03-03 10:42:39
1136012,4,"一般一般一般",2018-03-06 13:33:44
1136012,4,"不算好吃",2018-03-06 12:14:59
1136012,5,"薯条不是很好吃没什么嚼劲，太软了",2018-03-09 23:15:44
1136012,5,"严选的物质就是不错，买了两条了，给朋友们推荐了很多，点赞",2018-02-20 13:30:32
1136012,5,"味道还不错，不会太甜，就是不够干，太软了，再干点口感会更好。",2017-12-18 10:20:25
1136012,5,"不是那种硬的晒的很干的红薯干，味道一般，还行。",2018-03-06 18:21:09
1136012,3,"卖相不好，量也少，小贵",2018-03-05 00:16:48
1136012,5,"这个一般，不是我想要的那种",2018-03-06 06:59:51
1136012,5,"这个甘薯跟平常在超市买的真的不一样，吃起来真的就像平常在家吃的甘薯没有任何添加剂的感觉。强烈推荐大家购买。",2018-03-02 20:30:37
1136012,5,"没有图，哈哈，收到就已经吃点啦，挺好吃的，也不是特别甜，刚刚好，快递速度超快的，好评！！",2017-11-07 18:42:16
1136012,5,"好吃～天热原味香甜，来不及吃完饭的时候来一包就饱啦(づ′`)づ",2018-01-14 10:19:21
1136012,4,"这个比较失望，和想象中的不一样",2018-03-02 10:51:38
1136012,5,"两会物流慢了，有点甜",2018-03-04 21:25:19
1136012,5,"这个口味一般，但是应该比较健康，没啥添加剂",2018-03-03 09:09:20
1136012,5,"不太喜欢，里面有丝丝",2018-02-24 20:28:16
1136012,4,"一般，有点硬。",2018-01-21 15:14:56
1136012,3,"好小一包， 不是很好吃。。。呵呵。。。",2018-03-02 22:49:32
1136012,5,"发货很快，小包但是是送的，味道不错，不是那种甜到发腻中，比较自然的味道。",2017-11-06 11:06:12
1136012,5,"小袋，偏贵。不过里面的东西很不错，吃的出来是无添加的，这点很重要",2017-12-10 21:15:07
1136012,5,"这个一般，有点太干了",2018-01-19 19:27:08
1136012,5,"软软粉粉的非常好吃，就是量少了点，三包不到一小时就消灭光了",2017-11-16 10:02:37
1136012,3,"不够甜。应该多加糖。",2018-03-02 15:35:30
1136012,5,"味道刚吃觉得怪怪的。不过吃多了还好",2018-03-01 14:47:18
1136012,5,"味道不错。我弟说很好吃。有点软，不是特别甜。也不干，稍微有点点粘牙",2017-11-16 12:20:58
1136012,5,"一般般不会回购",2018-02-18 22:53:25
1136012,5,"有点像碳火考熟的",2018-02-19 21:22:39
1136012,3,"味道一般吧",2018-02-28 14:13:48
1136012,5,"不好吃 甘薯是不是番薯？吃起来没有番薯那个嚼劲，口感粉粉的很奇怪",2018-02-24 23:09:49
1136012,3,"有些太硬",2018-02-23 23:27:13
1136012,5,"这个不是想象中的味道，太湿了",2018-02-16 10:23:34
1136012,3,"味道一般 不怎么好吃",2018-02-23 00:27:30
1136012,5,"衣服大小刚刚合适，零食就不用多说了，已经掉进严选这个坑里了！",2017-12-09 13:58:24
1136012,5,"呃，貌似是赠品来着，量比较小，但是蛮好吃的，很快就吃完了～",2018-03-10 22:18:08
1136012,5,"甘薯条蛮好吃的 但有的会有甘薯末端带筋的部分 口感不太好
总体来说还不错 软硬适中",2017-12-01 10:54:54
1136012,5,"好吃不上火",2018-02-27 07:54:40
1136012,5,"很天然的味道，不像市面上的那么甜",2018-02-23 03:36:31
1136012,5,"颜值非常高，比想象中更好！信赖严选品质，没让我失望过啊！",2018-03-04 01:32:45
1136012,5,"薯条是煮熟的红薯阴干的味道，还不错，对于吃红薯长大的人来说，久违的味道。",2017-12-01 08:51:22
1136012,5,"一般般，不太好吃",2018-02-17 10:27:30
1136012,5,"这个是我在严选下的第一个订单产品，用完继续回购，从此迷上严选。",2017-12-26 21:54:43
1136012,3,"还可以吧，不是很满意，但是不沾牙",2018-02-24 21:33:03
1136012,5,"不合我的胃口 但是感觉挺健康的 没有太多添加剂和甜蜜素 吃的就是健康。二送一挺划算的",2018-02-19 22:09:19
1136012,3,"一般一般",2018-01-21 20:02:51
1136012,5,"下午就收到货了，便迫不及待的回家打开看了下，真的很好看，质量绝对保证，大家走过路过不要错过哦，穿上美美哒",2018-03-06 22:37:17
1136012,5,"差评，我没吃过比这个再差的干薯条了",2018-02-23 14:18:35
1136012,5,"每次都买这个，其实一包才半个番薯，价格也不便宜，但做得好吃",2018-02-23 11:40:48
1136012,5,"最爱严选的地瓜干，很喜欢，每次都买很多，刚吃完又想吃了",2017-12-20 09:23:52
1136012,5,"东东不错，不会华丽的词语，但真的可与实体店的无印良品可作比较！",2017-11-21 11:30:40
1136012,5,"不错不错不错！这是第二次买了一次买了十包<U+22EF><U+22EF>感觉有点疯狂啊！",2018-01-17 10:21:09
1136012,5,"原生态干薯条，健康，没有添加，我不喜欢吃甜食，觉得味道很好，估计喜欢吃甜食的人不喜欢，因为没什么味道",2017-10-12 15:38:06
1136012,3,"口味不好，没味，太软，不喜欢",2017-12-04 21:01:25
1136012,5,"还蛮好吃的，地瓜很甜，就是有的湿软有的干硬，硬的口感不算太好，嚼的满嘴渣",2017-10-24 13:02:13
1136012,5,"我个人口味不太喜欢，薯条水分充足，不是很甜",2018-02-17 00:04:11
1136012,5,"不错，有个别不太好的",2018-02-10 10:00:29
1136012,5,"没有添加剂",2018-02-06 14:24:32
1136012,5,"不是很好吃",2018-02-12 17:04:19
1136012,5,"不是很甜，不过吃了很容易饱。",2018-02-16 20:28:12
1136012,5,"味道还是蛮不错的，一送来就吃了，就没图了。就是量不多",2017-11-15 19:35:08
1136012,5,"挺好吃，八月份买的，不过天热拆袋要趁早吃完，否则放两三天就会发霉了！",2017-10-09 21:20:52
1136012,4,"味道不错，就是不是想象中的晒干了的薯条，有点烤红薯的味道。",2017-11-11 10:58:54
1136012,5,"退货退赠品退货退赠品",2017-11-19 00:42:09
1136012,5,"这个很一般 没有红薯条好吃",2018-02-06 22:45:27
1136012,5,"口感不好",2018-02-05 11:30:43
1136012,5,"甜甜糯糯的，超喜欢，又不会腻，又绿色安全感觉偶尔吃一口就文艺了一把～",2017-10-24 12:48:55
1136012,3,"我觉得一般吧 有点过甜了",2018-02-05 09:36:15
1136012,5,"不好吃，不会回购。",2018-02-08 15:03:09
1136012,2,"保质期是六个月前的了，品控麻烦做好一点吧",2018-02-06 14:05:15
1136012,3,"这一包吃出来三根苦的，不知道是不是不新鲜的。都怪自己吃的时候没有看，只顾往嘴里送。",2018-02-07 10:34:19
1136012,5,"双十一免费爱心蛋，不太喜欢吃",2017-11-13 20:54:53
1136012,5,"还好吧，感觉就那样吧，和我老家晒的还是差很远",2018-02-08 09:05:25
1136012,5,"无功无过，就是还凑合。不是每个都特别软乎。也许有人喜欢有嚼劲的，每个人一个样子",2017-10-22 11:22:34
1136012,5,"瞬间吃光，不是那种特别干的薯条，湿润饱满，很抗饿，感觉出门远足可以带着。一人份就可以吃饱。",2017-11-09 19:05:35
1136012,5,"赠品好吃，不过要吐槽发货速度和快递。5日晚上十一点下的单，九号凌晨才发货，客服回复搬仓库！！！京东快递还天津北京的跑了一圈。也是醉了。。。",2017-11-13 21:17:11
1136012,5,"很难吃<U+0001F611>",2018-02-03 22:58:03
1136012,5,"不怎么样",2018-02-07 17:36:58
1136012,5,"这次的薯条太粗，但是很软",2018-02-06 16:41:03
1136012,5,"送的福袋，都是一样的",2017-11-09 20:34:00
1136012,5,"买来就吃了一袋，甘薯味非常的香，非常的新鲜，很纯很好吃，不甜腻",2017-10-21 22:26:10
1136012,5,"东西还没吃，但是毛巾确实好用，柔软不掉毛，吸水性也很不错，网易严选值得信赖，还想买一个乳胶枕头，期待下次活动。",2017-12-26 16:24:15
1136012,3,"个人喜好一般般",2018-02-04 22:36:25
1136012,4,"不太好吃。没有自己老家做的好吃。口感（嚼劲）弱，番薯味弱",2018-02-05 00:49:32
1136012,5,"特别好吃，很满意，网易有毒。这次买了一大箱，买了会上瘾下次还来囤。",2017-10-19 17:53:11
1136012,5,"挺好吃的 没加糖 但是里面的甜度不大统一 估计这就是无添加的味道",2017-10-18 23:16:54
1136012,5,"不得不说很失望，就买了一包，吃了两块都有一股烂红薯味，然后整包丢掉了",2018-02-05 12:18:38
1136012,4,"还行吧 不是很好吃",2018-01-30 21:39:59
1136012,5,"确实是原汁原味，只是东西有点少，没几根，不过瘾",2018-02-04 08:20:20
1136012,5,"很一般，觉得不太好吃，不甜",2018-01-28 16:24:05
1136012,5,"吃了一包有虫子吃过的味道，比较湿不够干，个人不太喜欢。",2018-02-02 20:11:05
1136012,5,"没有买二送一，只给了我两包。可能配货遗漏了",2018-01-31 08:52:36
1136012,5,"哥太软了。",2018-02-04 16:08:25
1136012,5,"包装也太好了吧！外面超级大箱子，里面还有个盒子，保护好非常好。",2018-01-03 11:34:21
1136012,5,"有点红r糖的味道  也不知道是我在吃之前一直吃面包奶油     就感觉太甜了",2017-10-14 14:05:45
1136012,3,"不是很甜的那种，这个还可以，但是红薯的味也没有了，说不上来什么感觉，我个人不是很喜欢",2018-01-24 10:38:57
1136012,5,"挺好，物流也很给力。。。",2018-01-29 09:26:35
1136012,5,"<U+0001F618><U+0001F618><U+0001F618><U+0001F618><U+0001F618><U+0001F618><U+0001F618><U+0001F618><U+0001F618><U+0001F618><U+0001F618><U+0001F618><U+0001F618><U+0001F618><U+0001F618>",2017-12-18 10:23:34
1136012,5,"这个开封后要尽快吃完 不然感觉有点回潮",2018-01-24 14:42:23
1136012,5,"不太喜欢，有点干感觉不香，可能有其他人喜欢",2018-01-31 09:53:46
1136012,5,"今天才看到，这个包裹太小，当时忘记收了",2018-01-29 11:06:37
1136012,5,"为啥有点苦？原材料的问题？好吧 吃了半袋终于吃到不苦的了 所以我是什么运气？味道凑合吧 不过比起超市卖的是很纯天然了 再也吃不到小时候的味道了",2018-01-29 15:45:12
1136012,5,"不太好吃",2018-01-25 14:20:01
1136012,5,"最近中了严选的毒，每天都想要看看买点什么，天天剁手。",2018-02-23 18:56:40
1136012,5,"这个我自己不太喜欢，但是东西还是实在的",2018-01-24 21:17:15
1136012,5,"挺好吃的，感觉纯天然无添加，就是有的有点湿湿的整体还是好评哒！",2017-11-27 11:08:19
1136012,4,"这个味道不如果蔬干",2018-01-30 22:57:06
1136012,3,"有点硬，吃不出来红薯的味道",2018-01-27 18:10:36
1136012,0,"非常喜欢吃这种有点湿湿的红薯干 很香 吃的出红薯自然的甜味～ 好吃！会回购",2017-09-14 09:16:04
1136012,5,"一般，不会再买了",2017-10-18 23:18:03
1136012,1,"质量有问题 地瓜条里面有沙子 不会回购",2018-01-30 14:10:17
1136012,5,"这次没有第一次买的好吃",2018-01-30 10:37:41
1136012,5,"甘薯条太好吃啦，又甜又香，又不会太硬！喜欢！",2018-03-11 13:12:09
1136012,3,"好容易坏掉。一下子就发霉了。",2017-10-15 21:58:52
1136012,5,"这个第三次回购了～味道口感依然很赞，有小时候家里自己晒的薯干的味道，秒杀超市里那些颜色鲜艳的红薯干～",2017-11-13 13:40:37
1136012,3,"这应该是到目前为止在严选买得觉得最不值的一次，小失望。不过本来就是拿来拼单的东西，也就不较真的。看来不可避免要从全好评，添加第一个不太满意了",2018-01-26 21:02:03
1136012,3,"一共三袋,有一袋打开就已经有点变味,而且烂糊糊的,感觉不新鲜。",2018-01-20 23:38:17
1136012,5,"甘薯是比较湿软的那种，蛮好吃的，就是量比较少，不过瘾呀～",2017-12-17 19:59:07
1136012,3,"很一般",2018-01-28 09:31:29
1136012,5,"这个真的好吃，不会很干，湿润柔软。就是太小包了很快就吃完了",2017-10-23 23:14:01
1136012,5,"这个味道不咋滴，还不如乡下买的",2018-01-27 02:28:39
1136012,5,"啦咯啦咯啦咯啦咯啦咯啦咯啦咯啦咯",2018-03-06 18:01:45
1136012,5,"超好吃！薯条口感肉肉的，一点都不干柴，一打开就有一阵香味。这次是严选赠送的，双十一打算自己买点吃啦。",2017-11-10 18:25:37
1136012,5,"薯条好吃，保持了原滋原味，就是一袋少了点，一会儿就吃没了",2018-02-10 09:13:52
1136012,5,"这个一般吧",2018-01-22 11:22:31
1136012,3,"这个口感一般…偏干，但也不是特别干……没啥本来的味道",2018-01-25 02:06:41
1136012,5,"好次！能感觉到不是很多添加剂的类型，不会假甜，很糯很好吃",2017-10-20 23:25:21
1136012,3,"味道一般，性价比不高，不如天猫超市。",2018-01-20 11:21:29
1136012,5,"虽然是赠送的小包零食，但口感不错，味道也可以，量比预想中要多。",2017-12-11 11:03:15
1136012,3,"不好吃",2017-10-27 22:12:38
1136012,5,"非常好，我觉得也选的东西，质量都是有基本保证的，只看中了就随便买就是了，基本上不会失手。最近发现并不是所有东西都在线，有一些卖完了就不再上架了，所以有一些东西想买没有买到还比较可惜，然后另外就是东西的尺寸不是很全，就一种尺寸，东西就不是很合用。",2018-01-24 10:33:00
1136012,1,"不好吃，这是在严选买的最失败的一回",2018-01-20 20:46:07
1136012,3,"不是特别的好吃",2017-12-27 08:44:35
1136012,4,"味道还行 不知道为何严选食物总有一股包装味道",2018-01-19 23:22:33
1136012,3,"口味感觉一般，可能不太适合我。",2018-01-16 22:59:39
1136012,4,"<U+2795>了蜂蜜，跟平常家里晒的番薯干不一样，味道不咋的。",2018-02-26 10:10:15
1136012,5,"这个好好吃！比韩国cj的那个还要好吃比淘宝上的临安小红薯干还要好吃！总之就是hin好吃",2017-09-04 07:33:11
1136012,5,"开启后要放冰箱，说明里没写，放在外面几天就发霉了",2018-01-19 12:58:24
1136012,5,"原汁原味超满意，如果能稍微硬一点就更棒了，第一次到严选上买东西，包装帮帮哒！！！！",2017-10-15 19:37:13
1136012,5,"脚感不错。平时不穿有跟的鞋子，这鞋子穿上表示无压力!美美的",2017-11-09 15:40:42
1136012,3,"什么鬼玩意，就是家里红薯煮熟了切成条放那里干了后的味道，一样的。",2018-01-17 02:13:36
1136012,5,"吃了一袋，里面有两根有点发黑，吃起来有点点苦啊，希望严选在品质上能把控更严些！",2018-01-18 13:40:20
1136012,5,"这个真的很好吃，还会再买，那种软软的糯糯的味道",2018-02-23 12:50:11
1136012,5,"很难吃，同时也家里人都说难吃，不推荐！",2017-10-28 07:30:51
1136012,5,"好好吃，严选的质量非常好，满足<U+0001F609>",2017-08-31 18:31:56
1136012,1,"难吃",2018-01-10 12:25:19
1136012,5,"很好很好很好很好很好很好很好很好很好",2017-12-31 20:26:54
1136012,2,"薯条有点药味 估计红薯是坏的",2018-01-18 22:20:17
1136012,4,"质量不错，就是嚼劲儿不足，含水量过高了！",2018-01-20 18:59:37
1136012,5,"在严选上买了四百多块钱的零食，到家后感觉只有二百块钱的量，证明严选的零食性价比很低……就包装好而已，不会回购！",2018-01-14 15:18:47
1136012,5,"这个味道真心一般，感觉湿的，跟刚蒸出来的一样",2018-01-17 22:07:17
1136012,5,"好吃的要死啊，吃光光！可惜哦忘了拍图！",2018-01-17 14:38:38
1136012,5,"不会再回购了，没什么味道",2018-01-17 20:57:06
1136012,5,"求高温！求暴晒！求四十度！求木有雨！我们苦点没关系！一定要让大一的孩子们得到锻炼啊！",2017-08-30 18:50:09
1136012,5,"这个一般，没有别的好吃",2018-01-13 09:07:22
1136012,4,"确实湿度有些大，不够Q弹",2017-10-25 22:11:37
1136012,5,"薯条不是很好吃，一般般",2018-01-10 17:16:37
1136012,5,"地瓜干我觉得味道不是我喜欢的",2018-01-17 08:59:19
1136012,3,"干点就好",2018-01-15 16:53:47
1136012,5,"口味一般，没想象的好",2018-01-11 13:53:18
1136012,3,"有点干不是很喜欢",2018-01-17 00:47:36
1136012,5,"跟其他的不太一样，不过做法和良品铺子的相似，感觉还是良品铺子的更好吃一些",2017-10-25 15:00:54
1136012,5,"不甜，吃着不担心添加剂",2018-01-15 20:50:16
1136012,5,"这个就是有些有点硬不好吃，软的还是挺好的",2018-01-14 23:42:01
1136012,5,"一般般，略微有点干",2018-01-16 19:46:05
1136012,5,"牛肉干味道不错，生产日期5月27日，保质期180天太短，一个月内要吃完时间紧了点",2017-10-10 15:58:50
1136012,5,"味道很好，煮的时候很香，胃里暖暖的，适合天冷的时候。喜欢",2017-12-01 14:04:45
1136012,4,"不是很干，干一点肯定会更Q",2018-01-15 19:30:51
1136012,5,"有些感觉有点霉点。",2018-01-07 09:19:40
1136012,5,"有点湿湿的红薯干",2018-01-14 15:15:01
1136012,5,"太硬了，不好吃",2018-01-12 21:28:26
1136012,5,"软糯可口，不是很甜也不沾牙，回购过好几次啦，好吃",2017-12-27 14:39:37
1136012,5,"严选吃的做的不如用的",2018-01-11 20:28:42
1136012,4,"味道一般，不过很健康原始，无添加剂",2018-01-10 22:39:50
1136012,5,"还没吃。物流很给力！",2018-01-11 15:16:52
1136012,5,"一般，有点苦",2018-01-10 22:25:52
1136012,5,"上次吃过很好吃，这次再买，实在是量太少了",2018-03-04 23:43:51
1136012,5,"偏甜啦，挺小一包的。我更喜欢有嚼劲的红薯干。这个一般哦",2017-11-27 00:21:03
1136012,5,"不太好吃",2018-01-12 09:32:15
1136012,3,"口感一般。",2018-01-09 17:45:45
1136012,5,"比较一般",2018-01-09 15:12:05
1136012,5,"合作愉快，已经确认付款，请查收！",2018-01-06 17:53:39
1136012,5,"新鲜，味道正，软软甜甜糯糯。。。比市场上卖的甘薯条好吃上百倍阿！！春节小食、茶点买的全是严选的，吃上根本停不下来！！",2018-02-24 15:07:33
1136012,5,"一小包一小包的独立包装，量挺多的，可以每天一包，在公司下午饿了的时候吃！！",2017-08-24 14:04:53
1136012,5,"味道很纯，很干净，相信是无添加的，要是再便宜点就好了",2018-01-17 14:34:57
1136012,3,"这个吃起来，很一般，真的很一般，比市面上大多数薯条口感都要差～～",2018-01-01 00:06:09
1136012,5,"很香，不是很甜，上午肚子饿的时候正好可以垫一垫",2018-02-08 21:39:33
1136012,5,"小时候的味道，喜欢吃红薯，保持了原汁原味，很喜欢",2018-01-28 10:17:41
1136012,5,"严选果然没有让我失望，以后就是网易粉了",2018-01-06 20:37:53
1136012,5,"口味一般",2018-01-08 22:32:50
1136012,4,"买了两次，没有添加剂感觉没那么好吃啊。。。",2018-01-09 22:32:45
1136012,3,"一般，口味口感都太一般。",2017-12-30 10:22:37
1136012,5,"地瓜干很天然的味道，打开后要尽快吃掉，不然会发霉，可能是没添加防腐剂的原因吧",2018-01-04 09:07:43
1136012,5,"还没吃，但是包装很好，解馋用",2018-01-05 10:38:54
1136012,5,"不是特别软那种",2018-01-08 23:49:02
1136012,1,"日期不新鲜，7月份的，里面有好多臭的，不能吃",2018-01-04 09:30:45
1136012,5,"一般般，没有想象的好吃",2018-01-02 20:43:25
1136012,5,"这个一般，不是我喜欢的口味。",2018-01-05 15:02:05
1136012,5,"相当的完美!非常好吃!后悔买少了!一下三包全没了!",2018-02-22 16:11:46
1136012,5,"甘薯条味道不错，开始还以为是地瓜干呢，感觉味道不错，整体还是美滋滋的。",2017-11-20 09:59:40
1136012,2,"不是很好吃",2018-01-05 10:27:58
1136012,2,"被我妈妈扔了，说是不能吃，都黑了",2017-12-28 22:52:29
1136012,3,"不符合个人口味，不甜，湿湿的.略失望",2017-12-29 18:01:28
1136012,5,"【可转债申购】
众信发债（072707）
申购上限1万张（100万元）。
众信旅游最新股价11.46元，略高于11.12元的转股价。",2017-12-03 12:09:19
1136012,3,"没有传说中那么原香，一不小心吃到了一块很苦的红薯，很苦。。。",2017-09-04 11:30:03
1136012,5,"这个不是很对我胃口",2018-01-06 10:38:10
1136012,5,"不怎么好吃",2018-01-05 00:53:30
1136012,5,"没有色素香精添加剂，干湿度正好，分量也刚好，下午饿了吃一包，健康又美味。",2017-12-16 19:58:57
1136012,5,"这个吃起来QQ甜甜，没有香精的感觉，棒！",2017-12-29 12:57:20
1136012,5,"第一次严选下单，严选物流最棒顺丰和京东，从此入了严选坑",2017-11-18 13:50:03
1136012,5,"一般，没什么红薯味道",2018-01-04 13:20:51
1136012,5,"好吃不上火",2017-12-10 07:46:45
1136012,5,"一般般的好吃",2018-01-02 20:25:44
1136012,5,"孵蛋孵出来的，免费地瓜条。就一小包还单独发货，挺好吃的。",2017-11-18 10:41:59
1136012,5,"加工过度，没啥红薯的味道了",2018-01-02 10:24:38
1136012,1,"没吃过这么难吃的",2017-12-14 19:09:06
1136012,5,"已经吃完，甜度一般吧。",2018-01-03 16:55:26
1136012,3,"说不上好吃",2017-12-28 12:28:04
1136012,1,"服务太差",2018-01-02 16:09:33
1136012,5,"味道不好",2017-12-09 14:44:17
1136012,5,"味道不错<U+0001F44C><U+0001F44D><U+0001F44D><U+0001F44D><U+0001F44D>……就是量少了点",2017-12-15 15:41:39
1136012,5,"一般，不会回购。",2017-12-30 10:22:45
1136012,3,"是赠品，味道果然一般",2017-12-31 23:41:51
1136012,1,"不好吃",2017-12-28 20:52:59
1136012,5,"出差中，我姐收的快递，跟我说等我回去她也差不多吃完了。看来又得买买买",2017-08-23 17:28:33
1136012,5,"吃完了已经，我还说什么呢，反正挺好吃的，就说少了点",2017-11-14 12:13:50
1136012,5,"双十一活动抽到的，包装一点也不差，严选自营的食品还是不错的",2017-11-14 23:03:55
