"itemId","star","content","createTime"
1136012,5,"软软的，没有过多的添加剂，淡淡的甜味，好吃",2018-05-29 03:29:24
1136012,5,"品质非常好，买的放心，用的省心，吃得开心，质量有保障。以后常来光顾，欢迎大家常来光顾，哈哈哈哈哈哈哈哈哈",2018-06-08 22:53:59
1136012,5,"打开来就知道不错，很纯正的高品质的番薯味道，只是不够弹牙，但已经很好吃了。",2018-05-17 14:25:59
1136012,5,"发货迅速，缓冲填塞，包装结实，京东配送，快递安心，口味甘甜，值得购买，网易严选，品质保证。",2018-07-26 15:14:36
1136012,5,"本来自己比较喜欢吃红薯干，看到严选有先买一小包试试，好吃再来买",2018-06-14 11:51:23
1136012,5,"不会很硬，口感很好，香甜粉。打开吃了一条就感觉有点收不住，放在办公室备着挺好。哈哈，要回购！！",2018-06-27 12:08:25
1136012,5,"买二送一，很划算，而且用了优惠券，红薯条超级好吃，一包一会儿就吃完，好吃好吃，满意～～",2018-04-20 08:49:18
1136012,5,"好吃，就是有点湿，在干一点就更好了。包装大气有档次，价格也美丽。值得购买",2018-05-02 09:58:21
1136012,5,"番薯干收到了，家人品尝后感觉还可以，现在给个好评，等本人品尝再追评吧",2018-04-10 14:24:06
1136012,4,"不是以往买的那种干的，湿湿的糯糯的不是很甜",2018-07-09 19:17:39
1136012,5,"超级好吃，好吃，好吃，吃上瘾了。下次再来买，好吃好吃好吃好吃好吃！",2018-08-21 23:11:53
1136012,5,"买了一大堆零食准备出去旅游吃，就不一一评价了，相信严选。",2018-06-26 13:17:00
1136012,5,"收到的食品全部七月生产日期 很新鲜 满意
口感评价后补",2018-08-22 13:51:46
1136012,5,"非常满意 严选品质值得信赖 衣服鞋子 眼镜吃的 好多东西都在严选买",2018-06-19 19:03:39
1136012,4,"也许我的冲泡不够细致，汤色二泡后仍很浑浊，换了细网筛茶依旧，不是很好的购物体验哦。便利装不错，适合出差旅行携带。",2018-08-12 09:20:32
1136012,5,"甘薯干挺软的 和小时候吃的那种带白霜的不太一样 味道也不错 甜度适中",2018-04-20 08:27:02
1136012,5,"这个软软的原汁原味",2018-08-22 15:42:47
1136012,5,"不错不错，值得购买",2018-08-21 14:48:01
1136012,5,"回购N遍了",2018-08-13 12:07:42
1136012,5,"好吃，但是有点软，如果能再干一点会更喜欢。",2018-08-07 20:53:48
1136012,5,"不错，软糯微甜，明细无添加，绿色食品。",2018-08-08 09:14:44
1136012,5,"好吃，不错。",2018-08-08 12:09:58
1136012,5,"",2018-08-07 16:11:53
1136012,5,"味道不错<U+0001F60A>",2018-08-04 12:04:14
1136012,5,"还没吃，第二次购买了，甜而不腻",2018-08-02 19:47:40
1136012,5,"不好吃。",2018-08-03 10:29:33
1136012,5,"味道尚可",2018-08-01 10:06:20
1136012,5,"宝贝超好！",2018-07-31 10:37:51
1136012,5,"量足味甘，认真负责的物流一条龙，顾客满意，商家放心，支持网易严选",2018-05-31 14:40:16
1136012,5,"果冻已经买了几次了  番薯条第一次买  好好吃软软的",2018-07-11 18:10:31
1136012,5,"喜欢哦",2018-07-27 13:27:01
1136012,5,"感觉很不错",2018-07-23 11:01:26
1136012,5,"严选的东西质量一直没得说，真的好用",2018-07-18 21:55:06
1136012,5,"",2018-07-20 10:58:35
1136012,5,"质量非常好，与卖家描述的完全一致，非常满意,真的很喜欢，完全超出期望值，发货速度非常快，包装非常仔细、严实，物流公司服务态度很好，运送速度很快，很满意的一次购物",2018-07-13 13:48:47
1136012,5,"还没吃，感觉不错",2018-07-16 08:44:39
1136012,5,"严选的质量真的很好",2018-07-15 12:17:09
1136012,5,"66666666666",2018-07-13 15:37:06
1136012,5,"蜂蜜花生好吃  甘薯条不咋滴 芒果干还阔以 <U+0001F633>",2018-06-16 16:15:28
1136012,5,"太少，价格也不美丽",2018-07-11 08:18:34
1136012,5,"",2018-07-11 20:55:35
1136012,5,"",2018-07-10 23:35:09
1136012,5,"一",2018-07-09 19:36:53
1136012,5,"那几天不爱去学校食堂打饭的我，肚子饿了就吃它，嘻嘻，",2018-03-24 11:35:42
1136012,5,"吃着不错",2018-07-02 11:01:17
1136012,5,"物流很快，东西很棒，一直在严选买东西，很不错的购物平台。",2018-05-20 11:08:54
1136012,5,"一如既往的好。快递也惊人的快",2018-06-25 09:47:34
1136012,5,"起先因坚果种草严选，从此一发不可收拾。快递还蛮给力的，吃的东西从杭州发货的，隔天就收到了。不过没想到是这么小包的～软软的，不干，还原番薯的原味，挺好吃的",2018-06-24 15:45:37
1136012,5,"好吃啊<U+0001F60B>，软软的，水分足，味道保持的很好",2018-06-15 19:12:25
1136012,5,"天然成分",2018-06-23 19:17:56
1136012,5,"",2018-06-23 16:27:35
1136012,5,"可以，东西不错，是赠品来的，不量少，吃吃的没了。",2018-05-26 19:12:53
1136012,5,"同样是红薯  严选的却吃出了品质和美好",2018-06-14 20:55:52
1136012,5,"好吃的小食",2018-06-17 16:57:40
1136012,5,"确实很好吃",2018-06-14 12:00:25
1136012,5,"好吃  经常回购 很原味  赏个大的优惠券呗，老板",2018-05-29 11:35:07
1136012,5,"",2018-06-13 12:52:03
1136012,5,"",2018-06-09 11:12:20
1136012,5,"神奇的口感，介于番薯和番薯干之间...不弹，有点软...",2018-05-28 14:25:58
1136012,5,"太棒了，再买再买",2018-05-30 18:38:46
1136012,5,"好小一袋<U+0001F60B>",2018-05-28 12:26:15
1136012,5,"好吃，回购～",2018-05-28 17:43:22
1136012,5,"非常非常好<U+0001F44D>",2018-05-26 00:14:45
1136012,5,"很棒包装很好也很好吃已经不是第一次购买啦",2018-05-02 15:45:52
1136012,5,"买一堆零食真是太美好了<U+0669>(<U+2022><U+0324><U+0300><U+1D55><U+2022><U+0324><U+0301><U+0E51>)<U+1D52><U+1D4F>",2018-03-31 08:44:52
1136012,5,"",2018-05-21 12:44:37
1136012,5,"这个买的还没吃，不过相信严选的品质",2018-05-17 19:12:24
1136012,5,"好吃软的",2018-05-15 11:51:34
1136012,5,"不错",2018-05-14 14:35:19
1136012,5,"味道不错，就是太少了不够吃，一下就吃光光了",2018-04-13 10:00:30
1136012,5,"美味",2018-05-02 19:06:14
1136012,5,"尝尝",2018-05-01 13:00:09
1136012,5,"",2018-05-01 21:11:10
1136012,5,"不错",2018-04-29 16:09:24
1136012,5,"不错",2018-04-27 12:19:38
1136012,5,"好吃，好吃，好吃到停不下来，一次性吃完了一包薯条",2018-04-10 20:15:00
1136012,5,"味道还不错，就是分量少",2018-04-23 18:41:20
1136012,5,"嗯 没有任何香料添加剂 一包的容量刚刚好",2018-04-21 02:03:01
1136012,4,"味道很淡，甘薯的甜味，应该是没有添加的。软软的。",2018-04-14 13:07:19
1136012,5,"回购好多次了 软硬度刚好 还会再来",2018-04-13 15:40:00
1136012,5,"收到后就迫不及待的打开了，味道特别好，继续囤货",2018-04-13 15:37:14
1136012,5,"",2018-04-18 21:44:30
1136012,5,"一直买 不错吃 送货超快 可以～",2018-04-17 22:39:37
1136012,5,"",2018-04-17 13:37:26
1136012,5,"每天下单",2018-04-14 12:24:46
1136012,5,"一直在回购 好吃",2018-04-13 15:42:15
1136012,5,"",2018-04-09 10:56:09
1136012,5,"好吃，好吃，好吃，好吃，好吃111",2018-04-07 10:40:30
1136012,5,"很棒，很原始的风味，软糯！值得回购",2018-04-05 21:44:38
1136012,5,"味道还不错",2018-04-06 12:31:44
1136012,5,"软软的.味道很不错.很喜欢网易严选",2018-04-04 09:12:16
1136012,5,"为加班准备的口粮",2018-04-04 21:01:54
1136012,5,"",2018-04-04 11:39:43
1136012,5,"",2018-04-04 12:35:12
1136012,5,"已经回购了很多次，味道正宗",2018-04-02 18:14:14
1136012,5,"好吃好好吃",2018-04-02 22:24:35
1136012,5,"N次购买了",2018-04-01 11:54:00
1136012,5,"好吃，好评",2018-04-01 23:15:58
1136012,5,"很好发货很快质量很好发货很快质量很好发货很快质量很好发货很快质量很好发货很快质量很好发货很快质量很好发货很快质量很好发货很快质量很好发货很快质量很好发货很快质量很好发货很快质量很好发货很快质量很好发货很快质量很好发货很快质量很好发货很快质量很好发货很快质量很好发货很快质量很好发货很快质量很好发货很快质量很好发货很快质量很好发货很快质量很好发货很快质量很好发货很快质量很好发货很快质量很好发货很快质量很好发货很快质量很好发货很快质量很好发货很快质量很好发货很快质量很好发货很快质量很好发货很快质量很好发货很快质量很好发货很快质量很好发货很快质量很好发货很快质量很好发货很快质量很好发货很快质量很好发货",2018-03-30 17:59:32
1136012,5,"yummy",2018-03-29 09:21:01
1136012,5,"买了好口次",2018-03-23 13:23:02
1136012,5,"还好，分量太小",2018-03-15 08:51:12
1136012,5,"给男票买的一箱 15袋 上班零食 我自己平时很喜欢 他收到也很爱吃 一个星期就吃没了。。。前两天还想下单买结果没货了。。。薯条软软的糯糯的 很接近红薯的原味 第一次朋友买的吃了以后就停不下来 健康零食不错不错～过段时间有货了再来～每次发货送货都还蛮快的 这点继续保持～",2018-03-15 11:34:58
1136012,1,"味道已经发酸了。而且很潮湿",2018-08-21 17:14:19
1136012,5,"敲好吃的 特别是严选的包装 简约 muji风 大爱严选 已入坑",2017-12-10 11:51:31
1136012,5,"很好吃，已经吃完了，哈哈哈哈好的生活，就在严选",2017-10-13 20:40:12
1136012,5,"包装很好看，薯条很好吃，有一种天然的味道，关键是价格还便宜，比超市卖的好多了",2018-02-12 00:34:16
1136012,5,"这个味道我刚吃还有点不适应，感觉怪怪的，吃了一会儿就觉得不错，很好吃",2018-03-03 13:26:06
1136012,5,"为了凑单一起拍的甘薯条，之前也买过，试过味道还可以，口感也不错，每次要拼单的食品之一。",2017-12-21 15:16:11
1136012,5,"包装严实，一点也没损坏，味道也是杠杠的！严选的东西从来没有让人失望过。就是价格小贵！",2017-11-23 10:01:09
1136012,5,"买了红薯条和甘薯条，本人还是觉得红薯条脆脆的比较好吃点",2018-01-23 10:41:52
1136012,5,"特别满意的购物，卷纸质量特别赞，特别为新生儿买的这个纸巾特别好用，还会再来",2017-11-13 11:07:07
1136012,5,"天冷就要吃东西补充热量d<U+FF89>R<U+2200>Q)o
囤货中，买了满满一箱面包零食，好吃没得说！",2017-12-12 10:54:45
1136012,5,"味道还行，是有点湿的那种，不是很干",2018-08-08 10:29:38
1136012,5,"买了一堆，都吃了一边，竟是出奇意外的不错，关键基本都是独立包装的，很方便。",2017-11-29 19:47:56
1136012,5,"薯条蛮好吃的，是严选给的赠品，太给力了，下次购物时，多赠送几包。<U+0001F604>",2017-11-03 11:55:14
1136012,3,"不够干，感觉黏黏糊糊的，快递速度可以",2018-07-31 09:24:06
1136012,5,"好吃，不是很甜这点很好，个别有点硬都是软糯的就好了",2017-10-22 15:16:25
1136012,4,"很粉，好吃，但从袋子拿出来比较难拿。",2018-07-27 16:34:21
1136012,5,"包装一如既往的好，吃上去跟其它的甘薯条有点不一样，严选的软软的，以前买的都是有点硬的那种。",2017-11-25 14:42:24
1136012,5,"经常买严选的东西，吃的，用的都会买，希望严选能一直保持品质！",2018-06-11 10:32:52
1136012,1,"打开没几天就发霉了",2018-07-26 22:48:21
1136012,5,"还没来得及品尝，看起来不错，越来越相信严选的眼光了，干薯条很可口",2018-03-08 13:35:04
1136012,5,"收到就拆开吃了，确实是地瓜做的，软软的很有嚼劲，不是那种干巴巴脆脆的，好像小时候吃的那种味道！",2017-11-08 10:39:38
1136012,5,"挺好的，活动价，6元买了3袋，很划算，顺丰物流也很快，非常满意。",2017-12-11 10:36:36
1136012,4,"还不错",2018-07-24 08:35:31
1136012,5,"日期还可以，类似地瓜干，不过这种粉粉的，甜度刚好，一包刚好可以下午茶呢！",2017-10-12 15:09:42
1136012,1,"有股怪味 不新鲜",2018-07-27 09:55:54
1136012,5,"甘薯条吃起来很软，味道可以，就是量有点少，其他方面都还不错",2017-12-06 17:16:42
1136012,5,"严选的零食是个巨坑！每天要打开严选看看有没有上新好吃的",2017-11-07 11:29:53
1136012,5,"味道好极了，吃过才知道！",2018-03-03 22:25:42
1136012,5,"好吃",2018-03-06 10:30:32
1136012,5,"超爱的一款甘薯条，每次买吃的都想捎两包",2018-05-31 20:07:16
1136012,5,"严选严选，不二之选",2018-03-03 16:03:47
1136012,5,"严选的东西非常好，瞬间被圈粉，一单又一单",2018-02-10 09:50:55
1136012,5,"第二次购买，一如既往的好! 爱吃地瓜的小伙伴千万别错过而且买后绝对不会后悔!这款不是常吃的那种特硬特艮的地瓜条，它最大保留了地瓜原味，口感q，没有任何添加剂，真的非常非常喜欢。而且我发现这次购买的甘薯条表面更佳干净了!看到了严选的不断努力、改进!祝严选越来越好~会一直支持你的<U+0001F618>",2018-07-27 23:32:35
1136012,5,"包装不错，还没吃呢，看着挺好的",2018-02-25 11:38:46
1136012,3,"不喜欢这种口味，因人而异吧，吃了一条就放弃了。",2018-07-12 21:28:25
1136012,1,"不好吃",2018-07-15 10:36:19
1136012,3,"有点硬，不是太喜欢吃。",2018-07-02 11:04:00
1136012,5,"确实一般",2018-07-11 09:11:24
1136012,5,"超好吃 准备回购",2018-02-27 17:13:13
1136012,5,"中了网易的毒呦 搞活动囤了一堆零食 看看钱包 好气呀～",2017-11-21 01:04:28
1136012,5,"质量好！非常非常赞！",2018-02-19 21:22:22
1136012,5,"这个薯条我打99分，家乡薯的味道！！！狂点赞！！！",2018-02-13 13:10:01
1136012,5,"挺软的，不像别的贼硬，还挺甜，好吃好吃！小孕妇也能吃！",2017-11-16 08:50:19
1136012,5,"没吃呢 相信严选 最近买的一直没停 限时购的东西好像都值得买",2017-09-03 15:59:50
1136012,5,"挺好吃的越嚼越有劲",2018-02-14 01:13:25
1136012,4,"吃完了，就没配图了不过这是我在严选买失望的第一次，这哪里是原汁原味，分明加了糖，而且很多，然后价格贵，不过想尝鲜的可以试一下，，",2018-07-02 22:20:31
1136012,0,"确实是原香原色，味道也很好吃，就是太软了，要是能够烘干点会更有嚼劲，希望下次的更美味",2017-09-18 18:45:56
1136012,5,"好吃",2018-02-13 08:27:59
1136012,5,"还不错啊，就是得一顿吃完，因为不能密封",2018-06-26 17:27:03
1136012,4,"还可以",2018-02-11 12:37:25
1136012,5,"第一次在严选上买东西，很满意，包装也很好，顺丰快递送货到家很好很好",2017-08-12 09:17:14
1136012,5,"甜甜的，糯糯的，QQ的，值得回购",2018-02-08 18:08:29
1136012,5,"湿的，没有其他地瓜条那么干，但是我喜欢吃不干的，而且没有其它地瓜条的甜味，回购款",2018-08-03 22:35:52
1136012,3,"质量一般，用了两个月，坏了，辣鸡！什么严选，辣鸡产品，后台售后也没有！",2018-06-24 10:27:42
1136012,5,"很好吃啊 <U+0001F60B> 反正吃喝用丢在严选买 方便 也不用担心产品质量问题  支持严选",2018-08-01 12:28:07
1136012,5,"应该好吃吧，还没打开。",2018-02-05 19:30:55
1136012,5,"",2018-02-04 12:26:08
1136012,5,"喜欢 好吃",2018-02-03 14:03:55
1136012,5,"买的小点心",2018-02-02 09:33:09
1136012,5,"这个一般",2018-06-23 21:51:42
1136012,5,"这个不好吃，不建议购买",2018-06-26 09:10:44
1136012,5,"香软可口，没加糖，自然的味道，真正自然的薯条。",2018-01-22 13:13:55
1136012,5,"非常好<U+0001F44D>",2018-01-31 09:53:56
1136012,5,"",2018-01-30 11:54:45
1136012,3,"一般",2018-06-15 18:45:41
1136012,5,"一般吧，里面有一根番薯有一小颗绿色颗粒……自行脑补制作过程",2018-06-01 17:44:13
1136012,5,"淡淡的甜味 味道非常不错哦 上班下午饿了吃正好 不担心长胖",2017-12-14 15:29:16
1136012,5,"很香，好吃！软软的，也适合小宝宝吃，打开一下就吃完了，80克量少了一点，会再回购",2018-07-21 08:17:10
1136012,5,"甜甜糯糯的感觉好好吃啊，不会超级甜，就是分量少了点。",2017-10-29 11:23:41
1136012,5,"在一起时总是那么短暂",2018-06-08 23:07:04
1136012,5,"",2018-01-25 16:30:23
1136012,5,"还可以 就是一袋里面吃到一个苦的<U+0001F622>",2018-06-01 17:14:00
1136012,5,"这个甘薯条真的好吃，没有添加其他东西，和超市买的不能比，就是甘薯做的，无限回购呀～",2018-07-17 08:31:19
1136012,5,"<U+0001F44D><U+0001F44D>味道不摆的",2018-01-21 22:38:29
1136012,5,"东西还没到赠品到啦，包装高大上，还没有吃，应该很好吃",2017-11-15 13:44:59
1136012,5,"忠心地感谢严选，让我买到了梦寐以求的宝贝，太感谢了！",2017-12-04 14:46:01
1136012,5,"蛮好的",2018-01-17 14:24:38
1136012,5,"挺好吃的啦啦啦
赠送的东西很实在也很喜欢",2017-12-03 15:22:51
1136012,5,"回购噢~味道很不错，所以很喜欢~软软糯糯的，超级棒！！！",2017-12-18 21:16:50
1136012,5,"",2018-01-15 13:28:45
1136012,0,"不加糖原味的，不是特别干，湿度正合适，小袋也适合零食，棒棒哒",2017-09-02 09:20:10
1136012,5,"不怎么甜",2018-05-31 21:16:02
1136012,5,"味道不错哦。-吃了停不下来。就是太少了。一会就吃完了。不过瘾。",2017-09-02 17:41:10
1136012,5,"昨天就收到货了，福袋有惊喜，是藕粉，早上尝了下味道不错",2017-11-11 08:54:55
1136012,5,"味道不错，不是特别的干！",2018-01-14 13:11:43
1136012,3,"甘薯条不好吃",2018-06-01 11:12:48
1136012,5,"有点软",2018-01-13 15:32:29
1136012,3,"不好吃",2018-05-27 07:05:22
1136012,5,"软软的，很筋道，口感不错",2018-01-09 20:09:00
1136012,4,"一入严选深似海，从此存钱是路人。我们的口号是：种草~吃土~买买买~",2018-08-20 19:59:13
1136012,5,"",2018-01-08 16:43:05
1136012,5,"这种难以接受、",2018-05-25 17:06:38
1136012,5,"相信严选",2018-01-07 10:09:48
1136012,5,"品质一般，不会回购",2018-05-29 15:48:06
1136012,5,"质量非常好，版型舒适，可惜买小了，申请换货中",2017-12-20 22:13:58
1136012,5,"好吃好吃，软硬适中，根本停不下来，一包一下子吃完了，中了严选的毒。",2017-09-19 07:23:15
1136012,5,"这三样东西不知道回购多少次了！健康饱腹，活动时要多囤，没活动时馋了也会买，买了不后悔。",2017-09-08 20:22:09
1136012,5,"买给宝宝吃的，看着成份应该不错，无添加",2017-12-29 00:07:31
1136012,5,"软硬适中，适合牙口不太好的，纯天然的味道，甜甜的，量大点就好了。",2018-08-11 10:08:25
1136012,5,"甘薯条就是那种本真的味道，应该是没有加过糖调味，但是有种自然的甜，甜度吃着恰到好处啊，口感也好，软硬适中，就算牙不太好咬起来也不费劲，而且很放心。好久没吃到那么好的红薯干了，开心！！还好买了两袋，一袋已吃完，嘻嘻",2017-12-30 09:25:22
1136012,5,"还可以，有点甜甜",2017-12-28 10:13:07
1136012,5,"还是有味道的",2018-05-20 18:30:51
1136012,0,"囤货的，之前评过了，懒得打字了<U+0669>( <U+02C3><U+0336><U+0348><U+0300><U+0BF0><U+02C2><U+0336><U+0348><U+0301> )<U+0648>￥买买买!!",2017-06-25 11:52:27
1136012,5,"很软，就算牙口不好的人也能吃，不像传统的甘薯条那么废牙！",2018-05-23 11:22:20
1136012,5,"凑单买的小零食，味道不错。没有糖精。",2017-12-26 13:51:59
1136012,5,"评论抽奖！",2018-04-25 22:13:36
1136012,5,"不够干，没有嚼头",2018-05-21 12:16:34
1136012,5,"这个有点贵，一袋很少，只是吃的出没有过多的去放糖，",2018-05-18 23:35:39
1136012,5,"这个甘薯条，只能说，很原汁原味，感觉没添加，当然，也没什么甜味<U+0001F602>，个人口味啦，我觉得一般",2018-04-23 16:12:11
1136012,5,"囤货",2017-12-27 10:06:23
1136012,5,"",2017-12-27 12:08:52
1136012,5,"经常网购，总有大量的包裹收，感觉写评语花掉了我大量的时间和精力！ 所以在一段时间里，我总是不去评价 或者随便写写！ 但是，我又总是觉得好像有点对不住那些辛苦工作的卖家客服、仓管、老板。 于是我写下了一小段话，给我觉得能拿到我五星好评的卖家的宝贝评价里面以示感谢和尊敬！ 首先，宝贝是 性价比很高的，我每次都会先试用再评价的，虽然宝贝不一定是最好的，但在同等的价位里面绝对是表现最棒的。",2018-04-18 09:11:39
1136012,5,"红薯条吃着很棒，很喜欢，很划算！好次好次～",2017-12-10 12:17:17
1136012,5,"不很甜，吃下去很在。",2017-12-26 21:07:00
1136012,5,"不甜，略干，拼单买的",2017-12-25 11:39:35
1136012,5,"口感教软，不粘牙，不像有的网红店有粘牙的情况，甜度也适中，不腻。挺好的，就是一包里面量太少。",2018-08-03 10:07:01
1136012,0,"一百多块钱的订单给分了三个顺丰快递发货，严选赞一个！薯条好吃，不会太甜！被严选圈粉了啊！",2017-07-10 12:18:20
1136012,4,"女儿说好吃，我觉得一般，因为我喜欢更有嚼头的",2017-11-27 19:52:26
1136012,5,"没有什么添加剂，就是红薯，没有糖，感觉很健康。口感比较软，很喜欢。",2017-11-12 13:14:38
1136012,5,"挺好吃的，原滋原味，不硬有嚼劲",2017-12-22 09:19:58
1136012,5,"健康的休闲零食 比什么薯片油炸的健康的多 味道呢也不是很甜",2018-08-02 11:28:15
1136012,5,"包装严谨，还没吃过，但应该会好吃的还送了甘薯条",2017-11-11 23:02:20
1136012,5,"非常满意的一次网购！喜欢网易严选的东西！",2017-12-20 13:13:44
1136012,5,"非常好快递叔叔人也很好送货速度也快五星不可少",2017-11-24 16:43:09
1136012,5,"还行吧，量不是很多，不太甜不太干的口感",2018-04-14 09:56:21
1136012,5,"终于找到我想要的，大爱啊<U+0001F604>",2017-12-19 19:01:11
1136012,5,"刚拿到就迫不及待的品尝了一下，口感软糯，味道鲜美，值得推荐！",2017-11-08 12:21:46
1136012,5,"",2017-12-19 21:47:18
1136012,5,"严选的品质确实不错，但现在的新品定价确实比以前高了，学一下名创优品吧，微利扩张，毕竟还在打市场。",2018-07-02 22:15:54
1136012,5,"还可以，买来凑单哈哈。",2017-12-17 23:51:02
1136012,5,"没有添加剂原味，不是很干好吃",2018-04-13 21:24:00
1136012,4,"不会再回购",2018-04-06 14:12:04
1136012,5,"和我以前吃的红薯条不一样，这个真的超级软，红薯的味道很正，不像外面的那些都是甜味，而且还有红薯丝，严选超级棒！",2017-11-24 14:19:13
1136012,5,"挺好吃的，应该没放什么奇奇怪怪的添加剂",2018-04-10 14:55:14
1136012,5,"挺好吃的，量在大点更好了",2017-12-12 23:15:04
1136012,5,"",2017-12-13 11:23:04
1136012,5,"还没吃但是严选的零食没有失望过",2017-12-11 14:19:28
1136012,5,"东西还好，没有添加防腐剂，很健康的食品",2017-12-10 09:08:37
1136012,5,"非常好吃",2017-12-11 10:54:04
1136012,5,"开了两袋，可以，不像风干的那么硬，是软的含水量比较大的那种，适合孩子吃，条能再细一圈最好。",2018-04-06 17:10:52
1136012,5,"感觉太粉，不是我的菜",2018-04-10 17:05:27
1136012,5,"",2017-12-11 23:20:01
1136012,5,"真的是一单接一单，严选不错推荐身边朋友了",2017-11-23 22:27:09
1136012,5,"很划算，还没吃，买来试吃一下。",2017-12-07 18:55:33
1136012,5,"很好看！颜色洋气，要是有中跟款就更好了",2017-11-10 23:33:16
1136012,5,"纯天然到无印良品的甘薯条都比它好吃。不会再买了，实在是太天然了不好吃。",2018-04-01 09:12:10
1136012,5,"有些比较软，有些比较硬，整体来说还可以",2018-03-31 09:30:56
1136012,0,"软软糯糯的口感，烘干未干的地瓜条，饱腹感明显，代餐优选，会回购c(<U+FF9F><U+2200><U+FF9F>)<U+FF89>",2017-06-17 07:41:49
1136012,5,"物流很快，东西也非常好吃，赞一个！！！",2017-12-04 14:53:21
1136012,5,"",2017-12-05 16:43:54
1136012,5,"好吃，当下午茶不错。",2017-12-03 13:51:55
1136012,5,"不是很干 容易吃",2018-04-02 19:25:32
1136012,5,"干湿适中，口感很好，吃上就爱上了",2017-11-27 11:15:52
1136012,5,"好吃，刚买来就已经拆开了，软软糯糯，不是油炸的，这一点很赞",2017-07-31 17:05:53
1136012,5,"配茶最佳零食",2017-12-01 00:40:18
1136012,5,"买了一大堆零食，估计要好吃得停不下来啦",2017-10-21 15:55:56
1136012,4,"小包装，太软了",2017-11-30 15:51:51
1136012,5,"很好吃的。今年刚学会网购，在淘宝上买了不满十件东西，就在网易上买买买...",2018-05-20 11:21:26
1136012,4,"严选赠礼~小清新Mini包装，还没吃，不好随意评价~",2017-11-20 15:32:37
1136012,4,"口感柔软，但是有股淡淡的怪味",2018-03-03 17:19:41
1136012,5,"零添加，原味，很好，三石哥再来点优惠啊，想剁手总是那么难",2017-08-20 16:25:40
1136012,5,"自从用上严选之后就喜欢上了  甘薯条很好吃 室友抢着吃  不过就是量太小 不过谁让甘薯好吃呢 满意！！",2017-09-16 12:01:19
1136012,3,"这个一般般",2018-03-16 17:16:56
1136012,0,"非常好吃，软软的，不是很甜，口感纯正，就是很小一包，不够吃呀！已经回购啦！",2017-06-05 17:06:22
