"itemId","star","content","createTime"
1141011,5,"睡衣特别柔软，薄薄的，应该很凉快。囤货，买来夏天坐月子穿，棒棒哒！",2018-04-25 17:17:45
1141011,5,"质量好，料子柔软舒服，做工细致，物流快，物有所值",2018-06-03 18:21:16
1141011,5,"给小伙伴买的说穿着很舒服。她家猫都会挨着她衣服蹭舒服的打呼噜和放屁。一张咪咪和睡衣合照。",2018-07-15 10:25:13
1141011,5,"第二次购买了，衣服很舒服很适合月子里在空调房里穿，就是我本人买的稍微有点大，裤子改短了点。",2018-07-27 16:50:14
1141011,5,"手感软糯舒服 颜色素雅 款式大方 客服推荐的码数刚刚好 限时购买的 堪称完美<U+0001F60A>",2018-04-23 14:35:47
1141011,5,"这衣服是真爱呀！超级无敌舒服，这才是真正的睡衣啊！云朵一样的感觉，没有图随便凑的图",2018-04-25 05:38:45
1141011,5,"我没记错的话这种面料俗称棉绸，柔软细滑，不贴身，以前夏季常穿这种面料的家居服，很舒适凉快",2018-04-14 22:21:53
1141011,5,"超级舒服，超级优雅，颜值担当，睡觉居家做饭三不误。老公孩子都说好看。现在无论买什么，都优先选择严选的产品了。",2018-06-04 17:28:34
1141011,5,"质地如丝般一样顺滑，穿着非常舒服，绝对物超所值！",2018-08-13 14:03:09
1141011,5,"舒服清薄贴肤 空调房穿着很舒服 158 100斤XS合适 支持网易严选！",2018-06-14 10:07:50
1141011,5,"舒服，有型，超出期待。",2018-08-22 13:40:15
1141011,5,"包装快递很快很好.质量款式都喜欢.严选会一直支持",2018-08-08 07:46:28
1141011,5,"严选的产品质量很好",2018-08-08 08:45:41
1141011,5,"",2018-08-07 00:50:34
1141011,5,"凉凉的，很舒服，很滑，很满意！希望严选越做越好不要让大家失望",2018-04-15 12:51:52
1141011,5,"衣服面料挺舒服的，穿上去也很舒服，夏天在空调间穿着也不热，蛮好的，严选的东西就是好，反正现在要买什么先看严选有没有",2018-07-11 12:50:25
1141011,5,"看到有折扣立刻再买啦，之前买了粉色，这次再买浅灰，穿着好舒服，物流很快，昨天下单，今天就收到，非常满意",2018-04-23 20:52:55
1141011,5,"好",2018-07-21 16:30:18
1141011,5,"好评",2018-07-20 23:35:43
1141011,5,"超正 睡衣薄薄的才好",2018-07-13 17:30:36
1141011,5,"还可以。",2018-07-11 07:45:21
1141011,5,"真好",2018-06-30 11:15:56
1141011,5,"限时购174买的～等着夏天坐月子穿，布料很舒服，凉凉的",2018-04-07 22:21:36
1141011,5,"轻柔亲肤，女儿很喜欢，这个天穿着正好，已经穿上了。",2018-05-26 19:41:46
1141011,5,"好评",2018-06-12 09:20:52
1141011,5,"好评",2018-06-11 08:42:17
1141011,5,"买来送给朋友的礼物，手感相当好",2018-06-05 00:01:58
1141011,5,"也太快了！上午拍的，下午穿上了，舒服，严选太棒了！",2018-05-09 19:01:48
1141011,5,"也太快了！上午拍的，下午穿上了，舒服，严选太棒了！",2018-05-09 19:01:43
1141011,5,"舒适柔滑，可以和真丝媲美！回购一套！",2018-06-01 16:22:26
1141011,5,"还不错哦！有惊喜。",2018-05-25 22:09:30
1141011,5,"特别好",2018-05-25 21:23:25
1141011,5,"好喜欢！料子舒服极了！赶紧把灰色也收了！嘿嘿<U+0001F601>！",2018-05-10 13:18:01
1141011,5,"非常满意",2018-05-23 14:16:56
1141011,5,"包装开了，衣服没事！衣服穿上很舒服，薄款！",2018-05-14 18:17:22
1141011,5,"料子很舒服",2018-05-18 16:04:40
1141011,5,"睡衣收到了，真的性价比太高，100多块钱，买到一套这么舒服的睡衣真的超值！赞赞\(RQ)/
睡衣很薄很柔软，夏天穿一点都不会热，反而因为把肉跟肉之间隔开会更凉快。以前喜欢在家裸奔<U+0001F602>因为很轻松，有种回归大自然的感觉<U+0001F606>但是收到这套睡衣之后，就一直穿着睡衣在家里，因为和没穿的感觉没什么不同，除了不会让我的肉互相粘上之外<U+0001F643>",2018-05-15 11:12:47
1141011,5,"给妈妈买的礼物，尺码合适，也很舒服！",2018-05-14 08:27:44
1141011,5,"喜欢哦，薄薄的夏天穿正正好",2018-05-14 12:52:59
1141011,5,"质量还可以，等洗了试试",2018-05-12 20:06:31
1141011,5,"",2018-05-11 22:13:01
1141011,5,"一次买了俩套，最满意的一次网上购物",2018-05-10 13:28:17
1141011,4,"面料很舒服，轻薄，很容易皱，居家穿不错，要是有深灰色就更好了",2018-05-09 10:40:11
1141011,5,"好舒服的睡衣 包装也很讲究 严选的东西真心不错",2018-05-01 00:06:46
1141011,5,"东西收到就洗了，柔软舒服",2018-04-29 17:33:14
1141011,5,"很舒服！感觉像真丝！妈妈很喜欢！这天气可以穿了。",2018-04-15 13:16:21
1141011,5,"很清新美好，相当薄，腰带容易",2018-04-25 09:31:02
1141011,5,"哈哈哈哈哈哈哈哈哈哈",2018-04-21 00:11:42
1141011,5,"料子超舒服，两套",2018-04-20 13:03:30
1141011,5,"回来清洗过，穿着质感舒适，夏天适合。",2018-04-15 11:12:39
1141011,5,"衣服非常的舒服，很薄。春夏季在家里穿正合适。",2018-04-07 10:25:40
1141011,5,"物流快、穿上舒服，第一次试穿，不错，严选没失望。",2018-04-08 11:22:21
1141011,5,"睡衣很舒服，赞一个！",2018-04-02 23:42:38
1141011,5,"非常柔软的睡姿，更好",2018-03-31 11:49:53
1141011,5,"面料非常非常好，很轻薄适合春夏秋，穿着很凉爽，做工质量也很精良。相比之下同款的产品在商场里要贵很多，素雅色显得非常的高档。",2018-03-18 16:02:52
1141011,5,"买给妈妈的 布料很舒服",2018-03-29 11:26:21
1141011,5,"不错，就是面料不是我想象的那种棉绸，感觉熨烫过会效果好一些，希望袜子好穿并且保暖",2018-02-12 20:11:42
1141011,5,"买了两套，粉色和灰色，送了一套给妈妈。衣服手感很好，很柔软，穿起来特别舒服。",2018-05-24 23:28:05
1141011,5,"五星好评!宝贝与图片相符，快递也很给力!已购长袖长裤的，非常舒适，与闺蜜分享一致好评!现在再购!",2018-05-22 10:57:38
1141011,5,"买了两套，粉色和灰色，送给妈妈一套。衣服手感很好，很柔软，穿起来凉凉的，特别舒服。",2018-05-24 23:26:38
1141011,5,"买给妈妈，妈妈很喜欢～",2018-07-16 02:02:48
1141011,5,"夏季的家居服，现在在北方穿不是很适合到海南穿可以的！",2018-01-31 13:36:01
1141011,5,"很舒服的面料，很凉快，也很好看。",2018-06-18 14:09:17
1141011,5,"夏季特惠 176买来的 我是坐月子穿的 材质真心凉快轻薄 样式也不错 很满意",2017-08-16 07:42:47
1141011,5,"面料很舒服，夏天也可以穿，很凉快！",2018-05-28 22:35:02
1141011,5,"质量很好，轻薄透气，我是买了准备夏天坐月子穿的，特价商品，137买的，很划算",2018-07-10 16:02:57
1141011,5,"很喜欢这个衣服的布料，夏天穿着很舒服.就是感觉上衣稍微短了一点点，买M号的就好了.",2018-07-04 09:19:17
1141011,5,"卖家推荐的尺码正合适，超级喜欢这衣服。",2017-12-15 07:01:25
1141011,5,"送给闺蜜的 她很喜欢 颜色很美",2017-12-13 11:44:51
1141011,5,"东西不错,,不过现在活动少了,价格贵了,理性消费吧,,,现在相似类型的网站很多",2018-08-17 17:42:30
1141011,5,"颜色正，面料亲肤，很舒服，自己买了两套，还买了两套送两个姐姐，评价都很好。",2018-06-26 19:08:54
1141011,5,"帮妹妹买的一套家居衣服，她收到后说正是她想要的。凉快不沾身，做睡衣也舒服。",2018-05-31 10:38:29
1141011,5,"100斤 165cm 选的m号 宽松舒适 衣服布料很舒服 薄薄的 但是就是会漏点 居家服里面需要穿背心",2018-06-06 10:26:57
1141011,5,"薄 软 坐月子穿的 反正会穿哺乳背心 应该不会走光 蛮舒服的 给婆婆也买了一身",2018-05-29 10:58:15
1141011,5,"九月天气依然燥热难耐，此时穿着舒适透气，正合时宜。",2017-09-09 15:47:23
1141011,5,"很舒服，这个应该是穿过最舒服的睡衣了。棉质薄款，贴身，又没有丝质的冰冷感",2018-05-28 13:08:43
1141011,5,"好用好用好用的，好用好用好用的，好用好用好用的",2018-07-04 11:34:02
1141011,5,"质地很软，很舒服，但是很薄，有点透，所以凉爽是一定的，但是要考虑到有点透哦",2018-06-08 21:23:56
1141011,5,"空调房穿着很舒服，质感很高档，如果搞活动考虑再囤一套。身高158，体重130。",2018-07-24 10:30:07
1141011,5,"衣服高端大气上档次，舒服，谁说既漂亮又舒适的衣服找不到，严选，以后网上购物就你了",2018-05-10 13:26:32
1141011,5,"衣服收到了，布料柔软，还没洗，试了一下就是裤子和衣袖太长了",2018-08-09 13:20:59
1141011,5,"非常轻盈的睡衣，没有重量的感觉穿在身上，特意买大一个号，穿起来真心舒服",2018-06-15 14:40:26
1141011,5,"买回来就洗了，面料很舒服，很轻薄，下雨时穿正好。163cm,105斤，M码刚好。",2018-07-08 22:01:07
1141011,5,"亲肤，穿着很舒适，不过裤子绑带有个缺点上卫生间不方便，哈哈！原谅我懒",2018-06-11 15:25:51
1141011,5,"挑剔的女儿看到我在严选所有的购物都大赞<U+0001F44D>尤其是这套睡衣，我开心啊<U+0001F604>",2018-04-27 18:21:10
1141011,5,"目前为止买到过的最舒服的睡衣，一点都不热，特别亲肤<U+0001F60A>",2018-07-31 11:47:02
1141011,5,"很满意，价格也不错，由衷的评价，穿上舒适，显好，粉色非常适合自己的肤色。估计另外一个颜色也不错，很心动。",2018-05-15 22:34:00
1141011,5,"很好！非常薄！很适合夏天穿！材质也不会透～但就是是非常容易皱的料子～居家的话也无所谓啦～",2018-06-02 18:59:15
1141011,4,"还没拆包装，看起来还可以，不是棉质的但手感还好，试穿后追评",2018-07-01 12:08:49
1141011,5,"很舒服，软软的，薄薄的夏天穿着凉快，值得购买，只是又点缩水，拍大一点就好",2018-06-03 13:43:02
1141011,5,"还可以 给婆婆买的这个码 过段时间要坐月子 住一起 就给她也买了一身 材质很薄 略透",2018-05-29 10:54:41
1141011,5,"163厘米，53公斤，稍有点肥大，不过家居穿可以，料子是我想要的，开空调时穿着舒服",2018-05-09 11:38:19
1141011,4,"质地柔软舒适，但裤腰松紧带太松了，得自己重新调整。买大了一码，反正是睡衣，不影响",2018-04-24 12:13:19
1141011,5,"很软糯，夏天穿会很舒服",2017-10-28 10:56:19
1141011,5,"买大了。。。",2017-10-23 14:04:04
1141011,5,"材质很好，给妈妈和婆婆每人买了一套，很舒服的料子～刚拿到会有点皱，不过过一遍水就好了。好评！",2018-06-30 21:50:13
1141011,5,"买来送人的，收到后很喜欢！快递速度超快，下单第二天就收到了。爱上严选 爱上精致生活",2018-04-24 18:26:36
1141011,5,"面料很滑爽，颜色好看，穿着睡觉很舒服，特别适合在空调房里穿着，接待客人也可以穿着，适用的场合比较多。",2018-05-31 05:24:14
1141011,5,"第一次体验了严选优质的售后，更加坚定了我对严选的信任和喜爱。",2018-07-02 13:33:17
1141011,5,"质量很好，而且很清凉，夏天坐月子或者有风湿腿的人很合适。颜色也好看。",2018-06-05 16:46:19
1141011,5,"夏天穿着很舒服，火速下单给母上大人也买了一套，她很满意",2018-06-26 14:38:50
1141011,5,"家居服拿到很喜欢，款式简单，利落，颜色很喜欢，有点透，里面要穿个吊带",2018-07-20 10:48:59
1141011,5,"面料很舒服，可是很透，无奈之下只好退了。上门退货很方便，一如既往的支持严选",2018-05-01 01:52:00
1141011,5,"衣服非常轻薄，很适合空调房里穿。就是裤头是带子有点点不方便。",2018-06-20 09:33:44
1141011,4,"很薄 有点透 特别容易皱",2018-08-12 17:22:01
1141011,5,"衣服做工非常好，料子也很舒服，就是腰部是系带的，如果是松紧带就更好了",2018-04-09 10:44:28
1141011,5,"送妈妈的，很合身，颜色也挺好看，穿着舒服。严选值得信赖<U+0001F60A>",2018-06-17 14:28:52
1141011,5,"衣服非常舒服，很有质感，已经买了两套了",2017-09-30 16:05:10
1141011,5,"很舒服，性价比很高，商场里单上衣都要129",2017-09-12 16:16:24
1141011,5,"中码大小合适，料子很薄，夏天的长袖睡衣，海南9月份坐月子穿穿",2018-07-02 08:54:54
1141011,5,"挺薄的，夏天穿也不怎么热",2018-07-28 09:11:35
1141011,1,"",2018-08-09 13:27:32
1141011,5,"穿的舒服，柔软舒适透气，大爱",2017-09-23 11:54:28
1141011,5,"已经是第二次购买这套衣服了，两个不同地点的家各放一套，舒服，是最好的感受，价格也实惠，物流好快！",2018-04-22 23:44:48
1141011,5,"太舒服了，|地薄而柔，色也非常淡雅，我喜g",2018-08-15 15:26:43
1141011,5,"面料舒服，只是尺码比其他略微大了一些。",2018-08-10 09:56:10
1141011,5,"超级舒服的睡衣，非常满意的一次购物，希望严选保持这样的品质",2018-07-26 20:52:40
1141011,5,"一共买了四套，实在是质量太好、尺码合适，空调房间穿再好不过，只要严选上有的东西不上其它地方去买。希望严选一如既往保持好品质。",2018-08-14 14:32:28
1141011,5,"一共买了四套，实在是质量太好、尺码合适，空调房间穿再好不过，只要严选上有的东西不上其它地方去买。希望严选一如既往保持好品质。",2018-08-14 14:32:22
1141011,5,"真丝太难打理，而这款的舒适度刚好可以媲美真丝，性价比很高",2018-05-16 09:56:17
1141011,5,"物流快，包装精致，质量更没得说，超薄超舒服，空调房必备",2017-08-05 07:39:34
1141011,5,"送给妈妈的礼物，妈妈说中码也有点大了，但是她还是很开心",2018-05-13 20:11:24
1141011,5,"非常舒服的一套睡衣，还想买一套，大小也刚好，168，50M.码合适，颜色我也喜欢，裤子不是弹力的，是集绳子的。透气软糯",2018-07-02 17:31:10
1141011,5,"雅致，朴素，简约，淡泊。",2017-09-05 10:35:26
1141011,5,"舒服，太适合空调房了，月子里一直穿着，很舒服",2018-08-12 21:47:54
1141011,5,"很薄很柔软，适合夏天空调房穿，妈妈再也不怕我受凉了",2018-07-15 00:18:25
1141011,5,"太棒了！穿在身上轻若无物。可惜没尺码了，不然再买一套。",2018-06-24 20:19:15
1141011,5,"质量很好，是我喜欢的样式，布料软软的",2018-08-21 12:53:08
1141011,5,"厉害 好棒好喜欢 哈哈(<U+0CA1>ω<U+0CA1>)hiahiahia",2018-08-22 13:04:42
1141011,5,"超级舒服了！特别亲肤，再买一套！",2018-08-22 23:09:06
1141011,5,"这面料真的很凉快，薄薄的，凉凉的，贴在皮肤上非常舒服，堪比真丝啊",2018-05-05 14:01:41
1141011,5,"面料舒适，就是扣子，哺乳期穿脱多，扣子会把面料扯破。穿一次都要熨烫，有些麻烦",2018-08-18 13:15:57
1141011,5,"大小合适，面料也还行，活动价格还可以",2018-08-20 19:04:15
1141011,5,"不错，严选的商都很好。",2018-08-21 23:29:57
1141011,5,"很好，很软很丝滑",2018-08-21 15:09:39
1141011,5,"布料好舒服，很喜欢哦",2018-08-21 23:28:35
1141011,5,"按平时尺码购买。",2018-08-21 20:52:56
1141011,5,"布料很舒服，感觉洗之后有点缩水，170买M有点短了",2018-08-22 11:32:17
1141011,5,"好",2018-08-21 23:45:35
1141011,5,"好",2018-08-21 14:04:14
1141011,5,"面料轻薄，没有太透，挺好的，睡觉穿很舒服，比纯棉的还要舒服，这件物超所值。平时穿S的衣服，身高168，体重52，买的M，睡衣穿宽松，裤子的腰只有一点儿弹力，不会掉下来很高，还有一条带子可以自己系，挺人性化的设计。",2018-08-17 13:24:22
1141011,5,"轻薄透气，月子里用很舒适，入了两个颜色。",2018-08-18 09:23:55
1141011,5,"非常好！实用！",2018-08-20 11:56:43
1141011,5,"还不错",2018-08-20 13:07:48
1141011,5,"舒服",2018-08-20 23:15:11
1141011,5,"满意",2018-08-20 11:34:03
1141011,5,"色彩淡雅，|地柔舒m，很喜g<U+0001F495>",2018-08-15 15:27:45
1141011,5,"色彩淡雅，|地柔舒m，很喜g<U+0001F495>",2018-08-15 15:27:38
1141011,5,"舒适柔软，透气性好",2018-08-19 11:32:43
1141011,5,"非常满意！",2018-08-19 12:48:56
1141011,5,"舒适自然",2018-08-19 11:32:58
1141011,5,"舒服",2018-08-19 21:42:21
1141011,5,"舒服",2018-08-19 21:42:20
1141011,5,"真的很轻很舒服啊，有种薄如蝉翼的感觉，因为很轻很薄所以透，但是还好上衣后面长到盖过了臀部，挺好的",2018-07-05 17:41:19
1141011,5,"很好，一如既往支持！",2018-08-18 19:40:59
1141011,5,"很好，一如既往支持！",2018-08-18 19:40:52
1141011,5,"非常满意",2018-08-18 16:09:32
1141011,5,"好",2018-08-18 22:35:09
1141011,5,"好",2018-08-18 22:35:05
1141011,5,"好",2018-08-18 11:26:29
1141011,5,"料子很舒服，上衣太透了些，如果胸口两边都设置口袋，就完美了。我163，52，穿s合适",2018-07-16 01:15:12
1141011,4,"尺寸不对",2018-08-17 22:03:48
1141011,5,"很舒服",2018-08-17 16:51:13
1141011,5,"好！！！！！！",2018-08-17 10:23:36
1141011,5,"好！！！！！！",2018-08-17 10:23:30
1141011,5,"发货速度惊呆我了，太快了，昨晚下单，今晚都用上了",2018-07-05 20:11:02
1141011,5,"不错的选择",2018-08-16 15:07:45
1141011,5,"不错的选择",2018-08-16 15:07:41
1141011,5,"还不错，很舒服的，穿着睡觉合适",2018-08-15 10:33:48
1141011,5,"料子脆弱，舒服是真的舒服，但身为一条睡衣，你必须小心翼翼对待的那种反差真心有点……无言以对",2018-07-26 07:45:51
1141011,5,"很喜g",2018-08-15 15:27:00
1141011,5,"质量好 划算",2018-08-15 09:02:50
1141011,5,"质量好 划算",2018-08-15 09:02:43
1141011,5,"有点脱线，有点不是很满意，和客服沟通了，补偿了券",2018-07-10 20:13:05
1141011,5,"妈妈说衣服很舒服，终于买到性价比高又满意的啦",2018-07-03 17:45:15
1141011,5,"尺码偏大，换了最小码，合身。售后超好",2018-08-05 18:25:17
1141011,5,"面料相舒服，好喜g<U+0001F495>",2018-08-14 16:03:28
1141011,5,"买过一套粉色，再来一套灰色",2018-08-14 12:50:20
1141011,5,"料子很舒服，轻柔透气，老婆很喜欢。",2018-08-14 07:44:42
1141011,5,"157.102,s码正正好",2018-08-14 22:48:31
1141011,5,"又薄又软又轻",2018-08-14 20:56:43
1141011,5,"很舒服",2018-08-14 00:19:36
1141011,5,"质量非常不错 便绿色 好看 穿着舒服",2018-08-13 12:15:42
1141011,5,"非常舒服，很满意的一次购物",2018-08-13 22:37:56
1141011,5,"很好的产品",2018-08-13 22:24:54
1141011,5,"质量很好",2018-08-13 12:10:53
1141011,5,"非常舒服，尺码偏大",2018-08-12 12:36:40
1141011,5,"很好的东西",2018-08-12 19:12:54
1141011,5,"料子舒服",2018-08-12 20:12:31
1141011,5,"真的是特别舒服，亲肤，透气，热天穿的话是非常舒服的，就是洗衣机洗的话，这个面料容易皱，粉色会透的，不知道另一个色会不会透，优惠价真的很划算，下次有活动的话还会再买一件的。",2017-08-24 10:39:40
1141011,5,"质感很好柔软",2018-08-11 16:34:03
1141011,5,"不错！很舒服！",2018-08-11 14:24:46
1141011,5,"不错！很舒服！",2018-08-11 14:24:28
1141011,5,"满意的很",2018-08-11 09:43:23
1141011,5,"很喜欢！",2018-08-11 15:01:46
1141011,5,"半价买的，先囤着，料子很舒服",2018-08-10 14:20:13
1141011,5,"这套衣服上身舒服，是那种棉绸。只是洗完后很皱很皱。",2018-05-19 09:42:13
1141011,5,"料子脆弱，舒服是真的舒服，但身为一条睡衣，你必须小心翼翼对待的那种反差真心有点……无言以对",2018-07-26 07:46:02
1141011,5,"非常舒服，面料很爽滑，透气还吸汗",2018-08-09 20:36:21
1141011,5,"摸上去有真丝般顺滑细腻的感觉，没有色差，满意！以后就只买严选了。",2018-04-01 16:31:17
1141011,2,"衣服收到例行清洗一次，发现两个洞，一个在底部扣子位置，一个在袖子手臂。可以退货吗？",2018-08-13 19:51:12
1141011,5,"超级无敌好穿  又很美很美",2018-08-09 20:56:39
1141011,5,"超级无敌好穿  又很美很美",2018-08-09 20:56:31
1141011,5,"超级无敌好穿  又很美很美",2018-08-09 20:56:17
1141011,5,"超级无敌好穿  又很美很美",2018-08-09 20:56:10
1141011,5,"还可以，很薄很软，价格小贵",2018-08-09 10:28:43
1141011,5,"真的非常舒服凉快啊，裤头是抽绳的不是松紧带，坐月子穿很合适，颜色也显气质",2018-07-13 09:49:00
1141011,5,"性价比高",2018-08-09 16:56:38
1141011,5,"面料柔软舒适",2018-08-09 17:25:53
1141011,5,"从来没有经历过这么多大的过山车，10天竟然价格掉了100块；补差价也是退到礼品卡中，还希望我下次继续入坑。跟N个朋友推荐过严选，也买了超级会员，结果还是被坑了…",2018-07-10 10:03:10
1141011,5,"穿着舒服，真的很实用，非常推荐",2018-08-08 06:57:27
1141011,5,"试穿后感觉非常舒服！",2018-08-07 21:36:15
1141011,5,"柔软，看上去蛮舒服的。",2018-08-07 15:05:16
1141011,5,"舒服 物有所值",2018-08-07 11:15:41
1141011,5,"好用，舒服",2018-08-07 08:40:10
1141011,5,"158cm 90斤 xs大小正合适 很凉快 已经买了两套睡衣了",2018-07-10 08:21:24
1141011,5,"很好，之前买了一套M码，肩膀有点紧，这次买大了一码，非常合适。舒服",2018-03-29 15:51:30
1141011,5,"好穿～",2018-08-06 16:26:54
1141011,5,"好",2018-08-06 20:28:22
1141011,5,"薄",2018-08-06 09:44:47
1141011,5,"送妈妈的。自己先买了一套，穿着挺舒服的，夏季空调房里正好。",2018-05-15 09:52:59
1141011,5,"很喜欢，看其使用持久性",2017-08-20 13:55:56
1141011,5,"柔软亲肤，开空调穿正好",2018-08-05 18:23:52
1141011,5,"颜色好看，面料柔软，凉爽",2018-08-05 14:10:31
1141011,5,"买了长短2套",2018-08-05 20:55:07
1141011,5,"轻薄 质量很不错。 严选很满意。   真心不错。",2018-08-04 12:42:25
1141011,4,"还可以，衣服领太低了",2018-08-04 14:30:20
1141011,5,"的女孩子肉",2018-08-04 18:17:04
1141011,5,"超级无敌舒服<U+0001F60C>，手感质感柔软细腻光滑，空调房必备",2018-07-25 10:57:44
1141011,5,"很舒服，就是领口有点低",2018-08-03 21:32:41
1141011,5,"舒适柔软，睡觉时衣服的质感，助力一夜安眠",2018-08-02 06:49:52
1141011,5,"很薄，穿起来很舒服",2018-08-03 16:45:31
1141011,5,"好",2018-08-03 00:56:24
1141011,5,"此刻家居服必须给给五星好评。漂亮，好穿。舒服。是我最喜欢的，没有之一",2018-05-12 08:11:44
1141011,5,"睡衣非常透气，舒服",2018-08-02 09:06:17
1141011,5,"给妈妈买的  不合身就退掉了    衣服料子很舒服",2018-07-16 09:48:40
1141011,5,"特别喜欢喜欢喜欢 质量非常好 颜值很高 一看做工就不一般 大牌质量 价格很便宜 性价比很高 好的生活没那么贵 推荐了很多朋友 都夸严选的东西 口碑不错 严选赞赞赞",2018-08-01 16:36:59
1141011,5,"面料轻薄，穿着舒服",2018-08-01 00:54:38
1141011,5,"很矛软，",2018-08-01 09:17:49
1141011,5,"好",2018-08-01 10:58:01
1141011,5,"",2017-08-17 11:34:43
1141011,5,"宝贝简直是没得说，舒服好看，一直相信严选",2018-07-27 19:05:01
1141011,5,"差，不是这里坏就是那里坏",2018-07-05 10:59:53
1141011,0,"非常轻薄透气颜色粉粉的舒服非常喜欢",2017-08-16 19:25:36
1141011,5,"超级好穿，舒服，轻薄，质量一级棒，一次买两套，还会再入，囤货。",2018-06-01 22:03:49
1141011,5,"质地挺软的，舒服。但无弹力",2018-07-31 09:11:21
1141011,5,"质地舒服，但无弹力",2018-07-31 08:55:41
1141011,5,"好",2018-07-31 08:11:27
1141011,5,"还行，凉快。就是后片窄，架胳膊，。而且买贵了，现在便宜多了，有点缩水。",2018-07-13 18:11:56
1141011,5,"很薄很素雅，基本上是浅绿色的，夏天空调房穿着还是很舒服的也不怕着凉，就是裤腰带没有松紧带，只能用腰带系紧有点，衣服码子有点偏大，买的s码标签上显示是160的，我158、47，穿上衣袖偏长了不少，快把手都盖住了，裤子也长了一些，衣服和裤子都很宽松，本来以为洗完会缩点水就没有换货，结果洗了以后还是挺长的，最后决定送给老妈穿了",2018-07-01 11:31:40
1141011,5,"料子很薄很舒服",2018-07-28 16:30:46
1141011,4,"有点薄有点透",2018-07-28 21:24:17
1141011,5,"适合夏天，料子很薄很亲肤，空调房里穿正好。唯一的缺点是容易皱，不过在家里穿无所谓了",2018-07-28 23:40:18
1141011,5,"衣服收到了，发货快，衣服质量很好。很柔滑，适合热一些的春夏秋穿着。品质很好，价格合理，大赞<U+0001F44D>",2018-04-05 11:40:56
1141011,5,"严选品质一直很好，质量好",2018-07-27 14:20:07
1141011,5,"很好，不错",2018-07-27 16:08:07
1141011,5,"夏天穿清凉透气，有点透，自己在家穿比较适合",2018-07-22 20:34:32
1141011,5,"妈妈很喜欢，凉快～可惜粉色没码了",2018-07-26 16:45:57
1141011,5,"手感、做工都不错<U+0001F44C>",2018-07-26 15:08:22
1141011,1,"质量太差，轻轻一使劲就这样了",2018-08-04 11:27:09
1141011,5,"网易严选产品，值得信赖!!!",2018-07-26 08:47:34
1141011,3,"很一般，走线太粗糙",2018-07-11 20:18:48
1141011,5,"面料舒服，很好穿，下次继续购买",2018-07-25 14:19:35
1141011,5,"非常亲肤",2018-07-25 20:27:29
1141011,5,"麻麻很喜欢",2018-07-25 20:19:37
