"itemId","star","content","createTime"
1145002,5,"朋友表示很好用，吹气也蛮方便的。那个眼罩的小袋子很萌。",2018-05-30 19:10:51
1145002,5,"还不错，很柔软呀！旅行必备咯！",2018-06-27 16:46:16
1145002,5,"买给男朋友的 他说很舒服，质量好，包装精致，很希望，入了严选的坑，心甘情愿",2018-08-10 18:21:56
1145002,5,"对比了几个购物网站的这种东西，最后选择了严选，质量没的说，出去玩带着方便",2018-05-26 05:13:23
1145002,5,"这个旅行枕头设计的相当人性化！充气收纳十分方便。棉织物外壳易于清洁，同时又对塑料内枕有一定的保护作用。",2018-05-02 08:45:01
1145002,5,"使用了几次才来评价。非常满意，充气放气都很方便，收起来也不占地儿。",2018-06-22 09:19:26
1145002,5,"非常棒，物超所值！质感非常好！独特的阀门设计，真的三口就吹满了，阀门按下去就放气了，很方便！",2018-06-08 22:00:53
1145002,5,"颜色很粉嫩，大概是纯棉的所以看起来很舒服，几口气就吹起来了，携带方便，",2018-04-18 15:49:17
1145002,5,"这个打折款，粉白条纹，白色的条纹泛黄，但是质量还是很过关！眼罩材质柔软，戴上不松不紧很舒服",2018-04-01 16:26:37
1145002,5,"面料很软，材质是棉的，带起来很舒服",2018-08-18 18:58:42
1145002,5,"每次买东西前总是想先看看严选，有活动的时候买真的超划算！希望以后多搞活动，严选的东西真的用的放心！",2018-06-20 21:52:20
1145002,5,"送人了～哎 可惜了 那个妹子突然有男朋友了",2018-08-13 16:00:55
1145002,5,"方便携带。眼罩松紧非常适合，带着舒服。颈枕气孔略为粗大，没有宜家的巧妙。",2018-04-30 06:35:32
1145002,5,"真的很舒服很有用！出差立马用上，睡了个美美觉！",2018-07-18 13:02:21
1145002,5,"想要提高自己和家人的生活品质吗？不用辛辛苦苦挑选众多国外品牌，也不用在朋友圈里找代购费口舌，只用打开严选，在分类中浏览一下，就搞定了哦！希望严选的品类更加齐全，彻底不用再为购物而翻各种平台了哦！",2018-08-11 17:05:59
1145002,5,"钱包皮质不错，高度稍微差一点，不用卡包将所有卡塞进去，略显臃肿，总体来说不错，皮质柔软，长期摩挲会不会包浆啊<U+0001F60B>",2018-06-13 17:08:26
1145002,5,"一人一个，外出坐车ok！方便清洗，这个设计好！",2018-07-31 19:21:54
1145002,5,"非常好",2018-08-02 11:50:50
1145002,5,"买了两个。长途旅行方便自己。",2018-07-31 19:20:19
1145002,5,"纯棉质地的颈枕和眼罩非常的舒适。纯棉质地，亲肤柔软不刺激皮肤，颜色非常柔和，淡淡的绿色，清新自然。孩子非常喜欢备着，留着旅行来用非常喜欢，谢谢严选的产品。",2018-07-30 21:11:35
1145002,5,"布料很柔软，试了试不错，吹起和放气都不难",2018-07-01 22:08:12
1145002,5,"真的是三口气吹鼓，以后出差可以带了，还不占空间！真好！",2018-05-14 21:07:54
1145002,5,"这几天旅行都用了，非常好，可以收纳，不占空间",2018-06-24 20:26:46
1145002,5,"这次旅游就用它了，非常满意的一次购物<U+0001F44D><U+0001F3FB>",2018-06-03 11:23:56
1145002,5,"还不错，很柔软呀！旅行必备咯！",2018-06-27 16:45:42
1145002,5,"1.面料摸着确实很舒服.
2.我基本上是一口气就吹满了头枕算不算肺活量很大.
3.出差的时候带上，坐在高铁上的时候试一试。",2018-06-18 18:51:46
1145002,5,"好评",2018-06-17 06:54:01
1145002,5,"枕头很舒服，牙刷看起来也很好",2018-06-15 10:33:45
1145002,5,"因为信任，所以购买。",2018-06-12 20:08:58
1145002,5,"不错的旅行装备，每次转车几小时睡的都不舒服，原来有个眼罩太紧了戴了眼睛疼，这个面料比较舒服，头枕加眼罩配套，再加个耳塞就完美了",2018-06-08 15:25:06
1145002,5,"很容易就吹起来了，包装严实，可以感觉到材料的厚实。赞",2018-05-09 15:26:31
1145002,5,"这次带出去徒步，一路坐车，给娃用睡觉用很棒",2018-05-06 21:50:16
1145002,5,"哈哈，用着非常体贴，好用啦！！！",2018-05-28 10:22:25
1145002,5,"",2018-05-25 09:14:54
1145002,5,"3口气吹满，放气也很快，太棒了，旅行必备",2018-05-07 14:23:36
1145002,5,"办公室午睡专用，收纳方便，完美好评
<U+0001F44D>",2018-05-14 10:00:25
1145002,5,"好货！爱上",2018-05-13 16:59:57
1145002,5,"真的三口气就吹起来了。",2018-05-08 13:01:18
1145002,5,"可以",2018-04-29 20:33:45
1145002,5,"挺好的！",2018-04-23 10:25:18
1145002,5,"东西不错，充气很方便",2018-04-15 20:12:34
1145002,5,"很棒的快递，很棒的手感，很棒的严选",2018-04-01 17:15:49
1145002,5,"肥肠好用，很方便，颜色很好看，超级喜欢",2018-04-09 10:46:09
1145002,5,"第二次买，感觉很赞<U+0001F44D>",2018-04-07 19:59:13
1145002,5,"",2018-03-23 08:53:55
1145002,5,"很好看，很实用，",2018-03-17 01:08:22
1145002,5,"不错",2018-02-17 22:30:19
1145002,5,"还不错。",2017-12-19 13:05:23
1145002,5,"体积很小，很方便，准备带了在飞机上用的，希望十几个小时飞机旅程能舒服一点。",2018-02-27 21:53:52
1145002,5,"给同学买的，买了粉色的同学想打我23333好有意思hhhh不过确实蛮舒服的，也挺好用的",2018-01-07 19:19:13
1145002,5,"质量很好，免单送的。很实惠。等有钱了去旅游坐火车也许用的着。小清新的风格",2017-12-18 21:50:46
1145002,5,"摸起来手感超级好的，充气也很快，就是有点硬，颜色也很好，很喜欢",2018-02-03 15:59:55
1145002,5,"果然吹三口就好了，放气也轻轻松松，不用时收到小收纳袋里也不占空间，棒棒哒！！",2017-11-06 19:49:49
1145002,5,"针织棉面料，亲肤舒适，床单被套一下子买了4套，抱枕直接当枕头了，棒棒哒<U+0001F44D>",2017-11-08 11:46:18
1145002,5,"收到东西打开一看没有我想像中的完美。还是满满<U+0001F60A><U+0001F60A><U+0001F60A><U+0001F60A>",2017-11-06 16:30:45
1145002,5,"非常满意，包装很漂亮，很实用，有个小袋子很好，省的弄脏了，刚到我就试用了，很好用。",2017-11-20 14:59:24
1145002,5,"颜色很正，没有色差，眼罩带着很舒服。小布袋很精致，出去旅游带起来很方便，很满意，值得购买。",2017-11-03 15:39:50
1145002,5,"可爱的小包装，超喜欢的简洁风，出门携带太方便！网易的东西让你爱到骨子里！",2017-11-04 12:29:03
1145002,5,"充气很方便，硬度可以，坐飞机<U+2708><U+FE0F>可以用了，还不知道怎么放气<U+0001F607>",2017-12-15 20:58:28
1145002,5,"很方便很柔软，触感也很棒。两口气就充满了。出行旅游出差必备之良器。",2017-10-18 13:43:08
1145002,5,"舒服，用了一次，还行吧",2018-07-20 08:03:48
1145002,5,"很小巧，出门携带方便，吹气设计很新颖呀。不过因为是塑料吹气的，稍微硬一些。还没有在旅行中使用，希望有好的效果。",2017-12-27 00:15:18
1145002,5,"下单第二天就收到了要不要这么快…非常方便非常舒服，正好坐火车用得到，两口气就吹满真棒～",2017-08-16 16:03:26
1145002,5,"质量不错，用着舒服。感谢严选！",2018-03-10 20:31:00
1145002,5,"bie送给别人了，后悔了",2018-03-08 21:15:55
1145002,5,"比我之前买的都要好，布面很柔软舒适，充气孔很大，吹几下就满了，密封性看起来也不错！",2017-08-20 00:25:31
1145002,5,"颈枕真的是三口就能吹起来，非常不错",2018-06-06 18:56:16
1145002,5,"纯棉很柔软很舒服<U+0001F60C>眼罩遮光性很好 颜色很粉嫩",2018-01-07 17:24:59
1145002,5,"一共买了三个，送给朋友两个，她很喜欢。我自己也留了一个，期待下次出去玩的时候用。",2018-08-18 09:41:45
1145002,5,"面料柔软舒适，外面还有一个小布套子，很好！",2018-05-31 19:55:55
1145002,5,"纯棉材质，使用起来非常舒服，用过一段时间才来评价的，眼罩不透光，带起来很舒适。颈枕充气放气都很快，方便，办公室和出差都可以用，推荐",2018-02-08 08:20:17
1145002,5,"果然两口气就吹满了，挺好用的，方便携带，布料也是一如既往地舒服，中严选的毒太深了",2017-07-30 10:43:44
1145002,5,"果然是吹三口气就能充满的 放气也是超迅速 立马给家人都来一套 适合长距离旅行",2018-07-29 06:04:58
1145002,5,"|感超好吹庖稽c都不M牛。√喜g了～肋x就是！",2017-09-16 17:52:24
1145002,5,"比muji便宜很多，而且还有活动，超值。世界这么大，我想去看看。",2017-11-04 11:53:24
1145002,5,"一直在严选买东西，非常好用，旅行必备～",2018-01-31 14:32:39
1145002,5,"物流很快，包装精美大气，完好无损，枕头和眼罩质量很好，摸上去很舒适，很透气的感觉。",2017-08-23 22:09:49
1145002,5,"三口气就能吹好",2018-01-28 17:52:00
1145002,5,"旅行十分方便",2018-01-28 17:51:40
1145002,5,"充气型，经常出差，携带方便，气密性不错。如果充气内胆能再软一些就更方便折叠了。",2018-07-30 23:01:18
1145002,5,"粉粉的颜色，手感柔软，充气和放气都十分方便，很好用，不占地方携带方便，旅游神器！",2018-07-20 11:37:25
1145002,5,"吹气式的设计有效地压缩了体积，方便携带。眼袋遮光度很高，不送不紧很合适！",2018-07-28 12:46:49
1145002,5,"面料亲肤，舒适，但气囊略硬，估计时间久了会难受，收纳袋略小，折叠好放进去不是很规整。",2017-08-15 18:46:09
1145002,5,"观察了好久，活动买的很合适，粉粉很少女，用了再来追加",2017-11-19 17:20:35
1145002,5,"还没有，质地柔软，感觉不错！",2018-01-22 22:45:32
1145002,4,"质量还可以三件套。",2018-01-22 08:02:34
1145002,5,"放在包里，去图书馆看书的时候用，很方便，既可以做腰部靠垫，又可以做枕头。",2018-08-21 14:27:32
1145002,5,"真的是只吹三口气就够了，携带也很方便",2017-12-29 11:41:44
1145002,5,"实用，出差专有，但是催气的空好难打开（ &#39;<U+25BF> &#39; ）",2017-12-19 05:32:48
1145002,5,"很好，就想要这种，终于找到了",2018-01-03 20:15:46
1145002,5,"还好，不耐脏……
吹气好累呀(o′ω`o)
枕着挺舒服的",2018-08-13 14:43:34
1145002,5,"包装很好，真的只要三口气就可以吹好，出门携带特别方便，第一次在严选买东西，瞬间就被圈粉<U+0001F600><U+0001F600><U+0001F600>",2017-10-17 18:32:26
1145002,5,"文件袋好评，质量好，以后就买严选的东西了",2017-12-27 13:19:58
1145002,5,"三口气真的可以吹满，颜色跟图片色一样，面料柔软。",2017-12-12 15:23:30
1145002,5,"不愧是严选的东东，好看又好用，充气也很方便，不用的时候便于收纳，这次旅行一定要带上。",2018-06-28 10:25:06
1145002,5,"外出旅行用上了，放包里不占地方，用起来简单又方便，车上飞机上睡觉必备",2018-08-07 22:34:17
1145002,5,"好东西，面料很舒服，收纳也挺好，坐车午休应该都好用",2017-11-15 22:59:07
1145002,4,"主要是买来平常出差用，有专门的收纳袋，放包包里也不碍地方。舒服好用！",2018-06-27 12:42:51
1145002,5,"感觉蛮实用的",2017-12-25 12:13:25
1145002,5,"挺好的，价格不便宜，但是品质有保证，买得放心。",2017-12-12 18:02:29
1145002,5,"舒适柔软，更喜欢这种充气的颈枕，托力好又不会太硬",2017-11-22 18:47:53
1145002,5,"面料很柔软，舒服，很轻便。塑料内心很厚实，结实。",2017-12-13 19:05:00
1145002,5,"由于要长途飞行，立马入了一个，果然可以三口气充满很是好用，外面棉质面料很舒服",2018-06-14 20:28:55
1145002,4,"面料很舒服
就是要一天要吹气一次",2018-08-16 10:40:15
1145002,5,"网易严选送的购物券，免费赠品，太幸运了！",2017-12-12 19:01:04
1145002,5,"本来像我这么懒的人…是从来不评价的。要出去旅行带着乳胶的旅行枕实在占位置，而之前又一直对充气枕无好感。无意中逛到被颜值吸引，想着那再买来试试吧，今天到手谈谈感受，首先外面棉质的布套质量是不错的，枕头吹气的确像评论里说的几口气就吹起来了，比较轻松。试了枕的感受，肯定是没有泡沫粒子和乳胶填充的舒服，但是同样没有那种饱满，可自行调节吧。亮点在于图二的一键式放气，十分方便。总之还是挺满意的。",2017-12-14 15:34:12
1145002,5,"很轻便，价格有点高",2017-12-13 18:03:43
1145002,0,"棉质外套手感不错，三口气能吹鼓起来，不漏气，没异味，按中间圆纽直接放气，很方便。总之满意！",2017-06-28 11:51:18
1145002,5,"眼罩对我来说有点大，不过摸的是真的舒服，另外一个叠起来放进去感觉有点困难",2018-05-28 20:14:51
1145002,5,"质量不错质量不错质量不错质量不错质量不错质量不错质量不错质量不错质量不错质量不错",2018-08-09 22:45:39
1145002,5,"",2017-12-04 20:28:30
1145002,5,"超级实用 旅游用很棒 平常睡觉这个眼罩也很舒服 比较薄也不是很压 准备再买一个给老公",2018-05-31 12:00:09
1145002,5,"虽然没有记忆棉那些那么舒适，不过充气的确实出行带着很方便，颈部总算也有个托靠了，惊喜的是还有个收纳袋~棒",2017-10-21 12:54:49
1145002,0,"质量可以，就是感觉里面的pvc材料有点硬，外面的针织布外套有脏迹，懒得换了，自己洗一下吧",2017-06-14 10:58:44
1145002,5,"",2017-12-01 23:00:43
1145002,5,"颜值高，都是棉表面很舒服。眼罩设计可以保证鼻子不透光，颈枕还没用上过，凑单买，充气的总是担心不能抗压，没用不敢说效果，匿了匿了",2018-08-07 08:43:55
1145002,5,"有股塑料味 吹一段时间再用比较好",2018-08-14 15:18:58
1145002,5,"颈枕质量特别好，确实是三口气吹满啊～～大小合适，送给朋友的～朋友反馈说很好",2018-06-14 09:32:03
1145002,4,"还好，就是眼罩有点松",2018-08-01 18:06:39
1145002,5,"买错了，不过也不错，携带方便，几口就吹起",2017-11-24 19:31:30
1145002,5,"非常实用，方便携带，操作起来很简单～从此旅程变得没那么难熬啦～",2017-09-29 04:59:47
1145002,5,"真的非常好  触感极其舒服  还贴心送了收纳袋  棒",2017-10-30 10:16:12
1145002,5,"超级喜欢，严选的质量没得说，就是已经中了严选的毒啦！！d(`<U+FF65>ω<U+FF65>′)b赞赞赞赞",2018-05-15 08:54:39
1145002,5,"退货容易",2018-08-05 20:08:39
1145002,5,"很漂亮实用的。用料百分之百棉很柔软，质量杠杠的！",2017-11-20 14:59:37
1145002,5,"舒服，一股奶香味，喜欢",2018-08-12 23:41:19
1145002,5,"严选的东西还好吧",2017-11-22 12:51:17
1145002,5,"真的吹了3口气就够了，买给先生出差用的，他很麻烦，携带够方便",2018-06-24 22:56:33
1145002,5,"非常满意",2017-11-20 13:08:17
1145002,5,"好用，很好收纳，但是有点漏气",2018-08-06 14:27:38
1145002,5,"便携，同时也非常好用",2017-11-19 22:35:18
1145002,5,"眼罩很轻，很舒服，戴上以后非常的服帖，和这个护颈一走使用非常好。",2018-07-18 13:04:09
1145002,5,"颈枕蛮好的，收纳方便，大小正好，一切满意！",2017-11-16 15:42:20
1145002,4,"不太舒服感觉",2018-07-31 09:20:38
1145002,5,"",2017-11-18 11:12:18
1145002,4,"一般，用了两次就漏气了",2018-07-25 04:27:09
1145002,5,"",2017-11-18 11:06:30
1145002,4,"一开始很好用，但一周不到开始漏气，原因不明。",2018-07-30 11:06:50
1145002,5,"虽然还没使用，但看上去很不错，非常有质感，希望过几天用的时候能不负众望！",2018-06-20 22:34:39
1145002,5,"虽然还没使用，但看上去很不错，非常有质感，希望过几天用的时候能不负众望！",2018-06-20 22:34:53
1145002,4,"眼罩很好，护颈有点僵，因为是塑料充气。便利性牺牲了舒适度",2018-06-29 13:35:12
1145002,5,"带去马尔代夫用，很合适
美国时间一般被认为是美国本土的时间。美国本土横跨西五区至西八区，共四个时区，每个时区对应一个标准时间。从东向西分别为东部时间(EST)（西五区时间）、中部时间(CST)（西六区时间）、山地时间(MST)（西七区时间）、太平洋时间（西部时间）(PST)（西八区时间）。[阿拉斯加时间(AKST)（西九区时间）和夏威夷时间(HST)（西十区时间）]按照“东早西晚”的规律，各递减一小时。美国从每年3月的第二个星期日至11月的第一个星期日采用夏令时，夏令时比正常时间快一小时。
中文名
美国时间
外文名
EST、CST、MST、PST等
解释
美国本土的时间
包括
东部时间―太平洋",2018-07-25 10:04:55
1145002,5,"一买回来就试着感觉一下挺好的<U+0001F44C>，以后去旅行就可以带上它既方便又实用",2018-05-06 11:46:25
1145002,4,"换了一次，一般，不联系购买",2018-06-28 19:12:41
1145002,5,"质量杠杠的",2017-11-12 12:42:18
1145002,5,"很好的U型枕头哦，出差带着也不占地方而且还有眼罩，真的很不错了啊",2018-05-01 09:52:34
1145002,3,"条纹要对齐啊！不然怎么叫“严选”。",2018-06-22 12:41:12
1145002,5,"简约好看",2017-11-10 08:55:59
1145002,5,"质量真的很好，喜欢<U+0001F496>一直想买一个无印良品家的这款充气枕来着，看到严选有卖，套装价格还便宜了一半不止，就想着下手试试看！不行还能退了，结果拿到手真是惊喜！！三口气就能吹<U+0001F235><U+0001F604>放气也很方便，按住中间那个圆○按钮就OK",2017-11-09 07:39:08
1145002,5,"商品 很好，就是物流不是顺丰，差评。",2018-06-29 19:44:09
1145002,5,"很好 性价比很高 用起来舒服",2017-11-04 18:25:47
1145002,5,"还可以",2017-11-04 23:53:34
1145002,5,"方便，有点味道，不知用用会不会消失，期待着。",2018-06-19 10:14:44
1145002,5,"很好用，吹几口气就吹起来了 也不漏气 也很好放气",2018-06-27 08:17:15
1145002,5,"颜色好但颈枕要吹，有z味",2018-06-22 00:24:20
1145002,5,"可以",2017-11-01 14:53:31
1145002,5,"可以",2017-11-01 14:53:56
1145002,5,"这是第二套了 非常好用 两三口气就吹起来了，携带方便  现在家里好多东西都是严选的。",2018-04-19 06:15:57
1145002,5,"还行，只是u型枕是要吹气的，用起来不是很方便",2018-06-24 09:09:37
1145002,0,"用起来还可以，自己吹气进去，中午睡觉的时候靠着脖子没有压力，整体感受不错",2017-07-07 13:09:08
1145002,5,"吹了一下，我这个肺活量不费力五下也够了，放也很方便，适合旅游出行",2018-07-20 21:30:48
1145002,5,"手感很好，可收纳，",2017-10-28 18:31:29
1145002,5,"很方便，吹气几口，还挺简单，便携，质量可以。希望以后带出去也好用。",2018-07-13 21:14:36
1145002,0,"非常舒适的颈枕，十分的贴合。而且还可以折叠放入袋子中，便于收纳。",2017-07-20 21:48:17
1145002,5,"布料很柔软细腻，戴在眼上不勒舒适，颈枕软硬适度，充气便捷",2018-08-06 07:34:49
1145002,5,"一般相当一般，不要买，不要买",2018-06-01 22:17:11
1145002,4,"吹气有点麻烦其他还可以，有点味道",2018-06-14 21:21:18
1145002,0,"非常好的套装！充气真的很快，两口就搞定而且不会漏气。包起来很小，完全不占空间。完美的旅行神器！",2017-06-22 00:07:05
1145002,5,"摸着很舒服了，带着也方便，只可惜出去玩了一次丢在火车上了，很憋屈",2018-04-09 09:12:49
1145002,5,"",2017-10-15 22:34:46
1145002,5,"居然是吹气的枕芯，第一次见",2018-06-07 10:47:44
1145002,5,"继电动牙刷之后的第二单，好舒服，买来坐飞机<U+2708><U+FE0F>用",2017-09-08 09:14:22
1145002,5,"",2017-10-12 12:52:21
1145002,5,"买了朋友的，自己很喜欢，买了两三次了，吹气放气都很方便",2017-08-02 21:41:50
1145002,5,"很不错，非常方便，收纳很方便",2017-10-10 09:04:19
1145002,5,"两口气吹满，便携，提高旅行生活，赞",2017-10-06 12:49:00
1145002,5,"出门很方便携带 这是惊喜 希望内胆比较结实的
值得购买",2017-09-01 21:48:34
1145002,5,"严选脑残粉～很小巧方便携带。放办公室午睡用～很喜欢。高颜值又实用",2017-07-27 12:59:05
1145002,4,"买了不怎么用得上，充气很方便很容易",2018-05-11 15:33:13
1145002,3,"夏天不透气",2018-06-03 20:04:32
1145002,5,"用着很舒服！棒棒哒",2017-10-03 21:12:44
1145002,4,"吹气和放气都特别方便，气不用太饱满枕着就刚刚好。
眼罩的弹力带有点松，用了两次就松掉了哦。",2018-07-16 13:31:47
1145002,5,"很舒服 用的真心不错 中午趴桌子可以垫下面 充气的",2017-09-13 00:10:28
1145002,5,"眼罩很舒服~颈枕虽然没有另一款舒服，但胜在方便携带！经常坐高铁，很方便",2018-04-20 22:14:50
1145002,5,"是囤货来的，还没用，经常在外面野的我，用处很大滴",2018-07-03 22:05:22
1145002,0,"手感很不错，然后吹气很快，我大概吹了四口气就鼓起来了。很满意，这样出差坐飞机动车就可以小憩一会儿了",2017-07-09 16:46:44
1145002,5,"塑料味有点重。。。没有普通的柔软，临时用用还是可以的，常用还是用类似于无印良品那款吧",2018-05-12 11:10:13
1145002,5,"设计很棒，就是有一股游泳圈的味道<U+0001F602>",2018-05-15 09:39:10
1145002,5,"严选有毒  我已经停不下来了    话说 这个是真的舒服 也没味道",2018-06-06 13:24:09
1145002,5,"",2017-09-24 01:02:23
1145002,5,"好东西好东西，旅行过程中特别实用，用起来也非常方便，可以充气，折叠起来也很简洁。",2018-04-12 23:33:06
1145002,4,"布料舒服，充气方便，但是整体用起来感觉不是很符合人体工学。",2018-08-05 14:07:13
1145002,5,"赞赞赞赞赞，超级喜欢，好用的很，严选购物，可直接下单，不用怀疑！",2018-04-09 22:52:43
1145002,5,"买给老妈的，说质量还不错，不过价格不算便宜，性价比一般般。",2018-05-27 18:26:53
1145002,5,"特别便捷，小布袋很可爱塑料内胆微硬，用前需要散散味儿",2018-06-18 20:58:08
1145002,2,"这个东西，用第二次开始出现跑气问题，爆废了，买的时间比较久了咨询了客服不能退换货了，给了我优惠券作为补偿，没有办法。但是质量差还是要说出来，U型枕一般不会用，第一次旅行用没问题，优点是充气很快，携带方便，外面的裹布感觉不错，缺点是硬邦邦的不够舒适。今年五一出去第二次用就出现了问题，开始跑气，也不知道哪里原因。眼罩是很舒适的没有问题。",2018-05-09 16:58:08
1145002,5,"旅行K枕充yХ奖愫苜、但眼罩太建h{整o",2018-03-30 20:10:19
1145002,1,"买了不到一年  漏气   客户说重新买  呵呵",2018-07-18 13:06:30
1145002,5,"出差必备，买这个商品的途中出了一点小问题，客服非常耐心地帮我做了两次调整，态度真的非常棒。",2018-03-26 20:02:16
1145002,5,"很好用哦！在办公室午睡超级合适！",2017-09-06 16:25:43
1145002,5,"真的三口气搞定，外面的外面很柔软还可以清洗",2018-08-12 05:34:57
1145002,5,"真的是三口气就吹满了，方便携带，面料舒适",2017-08-31 14:16:39
1145002,5,"这个包装真的好精致 颈枕材质是棉的 有点弹性 手感很好 两三口就吹起来了 放气也很迅速 好方便 眼罩是纯棉的 但是戴着偏松一点 无碍",2017-08-31 10:22:20
1145002,5,"使用很久，感觉非常不错！不漏气，充气简单",2018-08-22 16:39:49
1145002,5,"非常好的宝贝，严选一如既往地可靠",2018-08-22 11:40:15
1145002,5,"旅行神器，便携又很舒服",2018-08-22 16:32:09
1145002,5,"特别喜欢喜欢喜欢 质量非常好 颜值很高 一看做工就不一般 大牌质量 价格很便宜 性价比很高 好的生活没那么贵 推荐了很多朋友 都夸严选的东西 口碑不错 严选赞赞赞",2018-08-22 10:49:00
1145002,5,"<U+0001F914><U+0001F914><U+0001F914>",2018-08-22 13:22:55
1145002,5,"很好用也很舒服",2018-08-22 23:17:39
1145002,5,"纯棉的，颜色我喜欢",2018-08-22 04:12:48
1145002,5,"还行",2018-08-22 09:43:04
1145002,3,"不是很顺滑。但比较方便。",2018-08-22 13:22:21
1145002,5,"发货速度超快，很好收纳，方便出差",2018-08-21 22:24:05
1145002,5,"还没用，不过相信严选",2018-08-21 13:08:18
1145002,5,"非常方便",2018-08-21 10:40:06
1145002,5,"相当棒",2018-08-21 06:40:26
1145002,5,"不错",2018-08-21 19:55:39
1145002,5,"给老妈的很好用！",2018-08-20 19:05:22
1145002,5,"好，没从不失望。",2018-08-21 11:16:52
1145002,5,"买了一直没有，这次旅行终于用上了。第一次用这小东西问题多多，扣子脱掉了，还漏气，没用一会儿就瘪了些。一直以来对严选东西的质量都信心满满，号称中严选毒呢<U+0001F60A>这次的体验解毒啦<U+0001F604>",2018-08-21 11:22:01
1145002,5,"挺厚实希望不会漏气",2018-08-20 22:13:07
1145002,5,"非常满意",2018-08-20 11:19:23
1145002,5,"不错",2018-08-20 17:52:22
1145002,5,"满意",2018-08-20 17:11:03
1145002,5,"好，没从不失望。",2018-08-21 11:16:53
1145002,5,"有些味道，需要放放味再用。昨天下单，今天到，明天飞机。来得及真好",2018-05-27 17:18:06
