"itemId","star","content","createTime"
1145031,5,"感觉挺好用，防滑，然后胶状的比塑料的看着更有质感，满意",2018-05-24 15:40:14
1145031,5,"挺好",2018-07-26 21:55:47
1145031,5,"做工不错，底面防滑",2018-07-05 01:36:46
1145031,5,"买了许多个 这次送朋友 质量好 外观也好看 不溢水 香皂放上面也很干爽。很赞",2018-07-10 13:44:26
1145031,5,"这个硅胶皂盒是第二次购买了，特别好用，放上去肥皂拍照的效果也特好看！",2018-07-20 19:20:16
1145031,5,"钨I的，硅z的]有味道，下面是整w的，O大方。",2018-06-04 22:48:12
1145031,5,"质量相当好啊！~软质的，防滑~色泽也好看！准备再回购一只粉色的~~",2018-06-26 09:41:03
1145031,5,"非常棒，特别舒服，赶紧又下一单，给爸妈也买了一个，太享受了，连小孩都想多洗几次。",2018-03-16 15:05:06
1145031,5,"非常棒，特别舒服，赶紧又下一单，给爸妈也买了一个，太享受了，连小孩都想多洗几次。",2018-03-16 15:04:29
1145031,5,"挺好用的吧，小东西大用处，颜色也是自己喜欢的，用起来也方便，上档次",2018-05-08 08:26:26
1145031,5,"鞋子特别舒服 价格实惠 质量好 以后孩子买鞋就严选了",2018-08-03 22:15:25
1145031,5,"第一次在严选上买东西，想看看严选有多严选，从小小的肥皂盒就可见一斑！好东西！质软，没有杂质看着舒服，这很严选！",2018-07-01 16:38:12
1145031,5,"好评",2018-08-21 15:51:44
1145031,5,"爱网易严选 爱他的包装",2018-08-16 14:47:35
1145031,5,"挺小巧的，不知道肥皂水多久会溢出。",2018-08-13 17:12:09
1145031,5,"入手两个，颜色超喜欢",2018-08-12 11:12:36
1145031,5,"棒棒的",2018-08-10 21:06:16
1145031,5,"",2018-08-10 16:55:38
1145031,5,"很好用颜值高推荐购买",2018-08-07 11:22:19
1145031,5,"还不错",2018-08-06 10:53:56
1145031,5,"实用～",2018-08-06 10:05:40
1145031,5,"喜欢严选的品质，也喜欢严选的格调",2018-08-04 14:15:21
1145031,5,"小巧，精致，实用，材质也很不错哦！",2018-08-02 12:26:04
1145031,5,"好着呢",2018-08-01 17:15:19
1145031,5,"",2018-08-01 19:50:53
1145031,5,"非常赞。短袖质感很好，跟300左右ua差不多。后天跑10km回来再来补充下；盒皂也很赞，放在浴缸旁；小柑普已经是第N回购买了，口感还可以，主要是性价比高。",2018-06-29 21:46:23
1145031,5,"还不错，但动作稍大快点会滑出去",2018-07-21 10:05:19
1145031,5,"看似平淡简单的小物，却很快在使用过程中体现出它的优势。它不怕干不怕晒，不会像塑料制品那样脆化，也可以及时沥干水份，手感也很不错，如果价格再亲民些，受欢迎程度会越高吧",2018-07-22 11:40:31
1145031,5,"已入严选的坑 东西实在太棒 颜值高质量好 每天都要刷个几十遍",2018-04-08 20:53:58
1145031,5,"买花洒送的。没在用，应该还好吧 软软的，还以为是硬的。",2018-04-07 19:43:54
1145031,5,"放在角落，安定稳妥。小巧防滑，做工精致。非常满意。",2018-07-12 05:58:26
1145031,5,"",2018-07-11 15:33:03
1145031,5,"不错，质感比塑料的要好上许多",2018-07-09 18:37:51
1145031,5,"很实用价格又便宜一分钱一分货",2018-07-05 18:33:43
1145031,5,"严选的东西颜值都超高，包装很用心，大爱严选",2018-06-19 20:24:21
1145031,5,"以为底下是镂空的，不知道会不会积水，颜值不错",2018-06-13 08:48:39
1145031,5,"安安静静的呆在你的新家",2018-06-21 13:11:32
1145031,5,"硅胶皂盒材质好，柔软细腻！",2018-06-20 10:01:46
1145031,5,"感觉不错，还没有使用",2018-06-19 23:16:54
1145031,5,"挺好的",2018-06-16 16:23:05
1145031,5,"好宝贝",2018-06-08 19:31:40
1145031,5,"小巧漂亮 夜色也是我喜欢的 最为赠品 实在满意！",2018-06-03 20:49:20
1145031,5,"很好！防滑，易清洗",2018-06-07 08:25:53
1145031,5,"很实用！",2018-06-05 14:12:46
1145031,5,"皂盒是赠送的，质量没话说",2018-06-04 11:13:29
1145031,5,"",2018-06-03 20:24:55
1145031,5,"宝贝好好用严选品质一级棒<U+0001F44D><U+0001F44D><U+0001F44D>",2018-05-17 22:04:36
1145031,5,"挺好、以后还会卖、包装很精致",2018-05-19 21:29:50
1145031,5,"质量非常好，与卖家描述的完全一致，非常满意,真的很喜欢，完全超出期望值，发货速度非常快，包装非常仔细、严实，物流公司服务态度很好，运送速度很快，很满意的一次购物",2018-05-16 09:08:35
1145031,5,"不e！低下面是不透水的！有颖”〉哪ぃ",2018-04-27 21:08:56
1145031,5,"不错不怕会被水浸湿呢",2018-05-11 23:38:27
1145031,5,"肥皂非常香，有净化空气的功效，哈哈",2018-05-09 18:22:12
1145031,5,"做工精细美观",2018-05-07 21:54:10
1145031,5,"",2018-05-07 21:55:15
1145031,5,"",2018-05-04 18:31:25
1145031,5,"很软，感觉不错，颜色也不错。",2018-04-27 19:00:41
1145031,5,"用着还好，不占地方。",2018-04-27 11:19:01
1145031,5,"蛮软的，还不错哦！",2018-04-24 14:31:11
1145031,5,"蛮软的，还不错噢！",2018-04-24 14:30:52
1145031,5,"还没用不过参照之前的另一款，应该好用",2018-04-16 15:09:27
1145031,4,"比较小巧，感觉做工还是不错的",2018-04-18 16:32:00
1145031,5,"",2018-04-16 16:22:26
1145031,5,"感觉还不错，先用用再追评。",2018-04-15 21:47:10
1145031,5,"质量不错",2018-04-15 19:52:38
1145031,5,"还不错",2018-04-15 04:41:35
1145031,5,"质量非常好，与卖家描述的完全一致，非常满意,真的很喜欢，完全超出期望值，发货速度非常快，包装非常仔细、严实，物流公司服务态度很好，运送速度很快，很满意的一次购物",2018-04-11 07:10:52
1145031,5,"好",2018-04-14 18:28:44
1145031,5,"好",2018-04-14 18:30:06
1145031,5,"",2018-04-14 14:36:19
1145031,5,"很漂亮，做工精致，无味防滑，便于清洗，真心不错，特推荐给大家！",2018-03-22 23:47:37
1145031,5,"很好看，软软的，不错",2018-04-13 09:07:02
1145031,5,"不错哦，很好，中了严选的毒了。",2018-04-12 15:56:04
1145031,5,"很好，很满意。中了严选的毒了。",2018-04-12 15:56:32
1145031,5,"好，最满意的皂托",2018-04-11 10:43:18
1145031,5,"漂亮",2018-04-11 17:45:03
1145031,5,"",2018-04-10 10:36:32
1145031,5,"看着很小资，也很漂亮。",2018-04-09 22:15:50
1145031,5,"东西不错！",2018-04-09 22:16:13
1145031,5,"买花洒赠送的皂盒，质量很赞，颜色小清新。",2018-04-01 19:24:25
1145031,5,"手感舒适  包装严谨",2018-04-06 22:41:02
1145031,5,"不错，质地很软",2018-04-06 18:49:15
1145031,5,"材质，外观，手感都非常好，用着非常满意",2018-04-04 10:21:19
1145031,5,"这皂盒真的是很有质感，而且很好清理，也很结实。",2018-03-14 23:40:50
1145031,5,"超级好用的，严选的质量果然很好，物美价廉，值得推荐",2018-03-28 09:44:47
1145031,5,"网易出品必是精品！",2018-04-04 17:15:52
1145031,5,"颜值高",2018-04-03 09:22:50
1145031,5,"阔以嘛",2018-03-31 09:23:44
1145031,5,"喜欢，很不错，颜值高，哈哈",2018-03-30 12:03:31
1145031,5,"赠品，感觉设计一般，用处不大。",2018-03-26 09:35:54
1145031,5,"第二次购买",2018-03-26 08:44:37
1145031,5,"",2018-03-26 19:12:38
1145031,5,"这个很实用，小巧超薄，美观不占地方，容易清洗。",2018-03-23 13:23:08
1145031,5,"很喜欢，无味防滑，很好用！",2018-03-22 23:46:16
1145031,5,"没有异味，材质柔软，好评",2018-03-22 02:08:19
1145031,5,"第二次购买",2018-03-22 21:08:28
1145031,5,"在木制的肥皂盒和这个硅胶的比较了下 少女心买了粉色的 设计很大方 很赞呀 底下还有防滑硅胶 整个触感是软的 放个保宁宝宝皂刚好 竟然是made in 我们大汕头 厉害了我的姐(<U+2022><U+0300>ω<U+2022><U+0301>)<U+2727>  颜值高质量好还便宜 哇咔咔 中毒太深",2018-03-20 10:10:08
1145031,5,"很漂亮",2018-03-19 11:35:14
1145031,5,"不错",2018-03-19 19:02:12
1145031,5,"真漂亮的粉色，我非常满意",2018-03-18 18:59:28
1145031,5,"搞活动时送的赠品，无异味，挺好的",2018-03-14 21:38:22
1145031,5,"软软的，硅胶，不错很喜欢，颜色很好看",2018-03-14 11:23:15
1145031,5,"很漂亮，也非常喜欢，已经开始用上了，蓝颜色也是很正的颜色，与图片没有色差，感谢严选！",2018-02-14 22:28:20
1145031,5,"比想象中好",2018-08-14 23:04:00
1145031,5,"软软的，防滑，最关键颜值高！一开始家人还猜不出来干嘛用的，哈哈。棒啊棒棒！",2018-01-13 19:26:27
1145031,5,"粉嫩粉嫩的，软软的，大小合适，质量也好，非常满意！今晚回家就可以用起来啦…",2018-03-05 16:45:28
1145031,5,"摸起来软软的，手感不错，放在单层镂空吸盘肥皂架正合适，等用后追加评论，不知道产生的积水多不多。",2017-12-28 09:04:12
1145031,5,"物流公司的态度比较差，建议换一家!不过掌柜人还不错!",2018-08-10 20:09:25
1145031,5,"买喷头送的赠品很实用！比一般市面买的设计要合理多了，架空隔离水渍，可以让皂体保持干燥。颜色也很少女，哈哈。",2018-06-08 09:37:22
1145031,5,"盒子大小很适中，造型简单挺好看，不足之处是会会积水，要时不时倒一下。",2017-11-14 21:08:15
1145031,5,"满意，赠送的礼品<U+0001F381>超赞",2018-07-31 13:30:51
1145031,5,"还可以，但没有另一个皂盒好！",2018-08-18 21:18:34
1145031,5,"商品虽小设计却很精细，材质很好软软的，让人喜欢",2018-03-05 21:57:21
1145031,5,"软绵绵的非常好用，解决了家里镂空的肥皂架漏水的问题。",2018-02-20 11:48:27
1145031,5,"软绵绵的非常好用，解决了家里镂空的肥皂架漏水的问题。",2018-02-20 11:48:33
1145031,5,"我买的灰色，发给我的是粉色",2018-08-03 14:22:29
1145031,5,"包装很好，东西很好看，关键价格也实惠，中了严选的毒了",2018-05-07 04:32:21
1145031,3,"不如硅藻土的，肥皂放上去到处跑，太滑了",2018-08-10 11:08:31
1145031,5,"东西不错，物有所值。赞一个",2018-03-10 23:08:55
1145031,5,"虽然是赠品，质量很好。",2018-03-09 08:04:14
1145031,5,"很好看",2018-03-08 17:14:17
1145031,5,"送的硅胶盒颜值也很高",2018-03-07 22:26:56
1145031,5,"看上去让人满意，有一点味道，先放几天。",2018-08-03 10:02:03
1145031,5,"",2018-03-07 13:26:15
1145031,5,"很简易的盒子，香皂不会粘上面",2018-08-04 22:21:46
1145031,5,"买了第四个，颜色漂亮手感好，放香皂非常好，很满意。",2018-02-15 18:38:00
1145031,5,"买了很多个了，非常好用，颜色有很漂亮，好喜欢。",2018-02-15 18:46:12
1145031,5,"挺好的",2018-03-06 20:28:02
1145031,5,"好",2018-03-04 18:28:15
1145031,5,"用起来非常舒适，真的不错，柔软方便",2018-03-02 16:52:58
1145031,5,"不错",2018-03-02 13:09:16
1145031,5,"有点滑溜溜存不住香皂",2018-08-05 20:52:47
1145031,3,"无色差，轻便，就是下面格子久了容易积水发霉不好清洗",2018-07-21 00:41:33
1145031,5,"简洁实用，严选的眼光不错，经常来逛逛～简洁实用，严选的眼光不错，经常来逛逛～简洁实用，严选的眼光不错，经常来逛逛～简洁实用，严选的眼光不错，经常来逛逛～",2018-02-04 14:15:48
1145031,5,"挺好的 粉嫩的颜色",2018-02-28 12:56:33
1145031,3,"皂托太浅了 容易积水",2018-07-14 09:33:34
1145031,5,"颜色很好看，还耐脏",2018-02-27 00:32:57
1145031,5,"颜色好看，显干净",2018-02-27 00:36:12
1145031,5,"硅胶很软，底部不透水，肥皂架在上面干燥的很快，也方便拿取，会再回购。",2017-08-08 15:17:30
1145031,5,"质感不错！还不错，就是有些贵，感觉买的不太值！",2018-07-09 22:14:20
1145031,5,"这个我觉得有点鸡肋啊，水出不去，香皂都泡软了",2018-07-23 16:43:43
1145031,5,"货到了，没有色差，材质很柔软",2018-02-24 23:47:06
1145031,5,"放严选的洗碗皂 棒棒哒",2018-02-17 13:38:07
1145031,5,"软软的，放干的可以，湿的会有点滑",2018-02-11 13:46:32
1145031,5,"太喜欢这款皂托了",2018-05-31 18:00:01
1145031,5,"放香皂 硅z材|很很",2018-02-14 18:24:44
1145031,5,"小巧精致，拿着很舒服，自从有了严选，我的生活用品不用担心了！",2017-10-19 15:57:26
1145031,5,"很好用，香皂不会浸在水里。",2018-06-22 15:30:43
1145031,5,"感觉不太容易清理",2018-06-26 17:31:01
1145031,5,"",2018-02-11 04:05:31
1145031,5,"第一次在严选上买东西，很满意，包装也很好，顺丰快递送货到家很好很好",2017-08-12 09:15:22
1145031,5,"尺寸小了一点哦",2018-06-23 22:28:36
1145031,5,"老弟推荐的严选App，实如其名，一定是经过严格挑选的，每一样都是精品，看着特别舒服，很心怡。看着暖暖的，价格实惠，性价比超高，真心很喜欢，还会再来。推荐更多朋友。。。",2018-02-10 22:34:35
1145031,5,"还成，抓地力还好，但是湿肥皂放上去有点打滑",2018-07-03 08:23:56
1145031,5,"原先选的皂架是镂空的，非常不实用一直都闲置， 结果无意看到这个， 又便宜又实用， 哈哈拯救了我家闲置的皂架。颜色是我喜欢的 ，很洋气 ，摆在卫生间里显得很有档次 ，软软的 ，很好用。",2018-02-09 23:53:08
1145031,4,"包装扎实，产品不错，配送速度快，优惠力度大。",2018-02-07 00:00:19
1145031,5,"简洁实用，严选的眼光不错，经常来逛逛～",2018-02-04 14:15:41
1145031,5,"一般一般",2018-06-26 10:37:41
1145031,5,"小巧轻便不错",2018-01-30 11:58:34
1145031,5,"和皂很搭，这个材质很耐用",2018-01-25 15:05:32
1145031,5,"颜色很不错.我很喜欢.还没用.希望不长霉",2018-01-10 08:47:38
1145031,5,"你在我心中你最喜欢我吗、这么多年我一直觉得很有意思了……这么多年都没见过世面了我",2018-06-10 00:38:54
1145031,3,"肥皂放在上面不好拿",2018-05-28 16:34:01
1145031,0,"肥皂盒蛮好用的，本来想买木的，看来还是硅胶的更合适放在浴室，不怕受潮发霉，实用",2017-07-10 23:49:54
1145031,3,"不建议购买，容易积水",2018-06-20 11:18:27
1145031,5,"比塑料皂盒好",2018-06-17 16:14:24
1145031,5,"谁在用琵琶弹奏一曲，可以弹的",2018-01-14 15:17:02
1145031,5,"质量很好 特别喜欢喜欢喜欢 颜值高 买的东西都很好用 零食也好吃 所有的都喜欢不错不错不错不错",2018-07-15 02:15:51
1145031,5,"第二次买了，质量很好，软软的，颜色清爽",2018-01-12 09:01:21
1145031,5,"包装的很好，全部一起到达，质感也不错",2018-01-12 16:59:23
1145031,5,"包装仔细，宝贝都很可爱，很新奇。喜欢，大爱。",2018-01-05 10:22:28
1145031,5,"不好用，太软了。个人喜好吧",2018-06-07 08:26:51
1145031,5,"还算不错 设计有硬伤 沟沟坎坎太多 容易积累皂液不好清洗",2018-06-05 20:04:02
1145031,5,"很软，也不滑，不过更适合放方型肥皂",2018-01-02 19:45:42
1145031,5,"秒到的很划算",2018-01-07 20:17:08
1145031,5,"不错，买了好几个了，就是容易吃灰",2018-06-09 22:11:48
1145031,3,"一般吧，太软了，口太浅，肥皂和香皂特别容易滑出来",2018-05-29 12:59:03
1145031,5,"",2018-01-07 23:05:05
1145031,5,"666666666666666666666666666~",2018-01-06 13:14:46
1145031,5,"时间久了有点发霉",2018-05-11 18:59:16
1145031,5,"软软的，很弹",2018-01-05 08:30:50
1145031,5,"广东汕头，出品！

年底1元抢购，超级开心",2018-01-03 08:30:34
1145031,5,"东西还没有用，但是这个快递收到的可真不容易。竟然说我是空号3天没派送。真是令人感到绝望的借口。",2018-06-04 18:40:14
1145031,5,"一般，肥皂会打滑，上面的弧度不管用",2018-06-04 00:44:45
1145031,5,"柔软舒适，物超所值",2018-01-02 22:11:39
1145031,5,"不错",2018-01-02 12:15:27
1145031,2,"不好用，很容易积水，倒也倒不干净，也不好清洁漏下去的肥皂水造成的皂迹。",2018-05-24 15:19:36
1145031,5,"很好用，材质柔软，大小合适。",2018-01-01 11:33:15
1145031,5,"",2017-12-29 17:17:06
1145031,5,"",2017-12-24 16:26:41
1145031,5,"造型很漂亮，材质是硅胶的，很舒服，也很防滑，很软，清洗非常方便，不怕脏。赞<U+0001F44D>",2018-06-20 19:02:51
1145031,2,"肥皂放上去很容易就滑落了。最好放在平的地方",2018-05-08 09:20:32
1145031,5,"有些浅，肥仔容易滑落",2018-05-10 18:55:27
1145031,5,"挺好的，材质是软的，颜色清爽",2017-12-19 13:03:40
1145031,5,"使用方便，硅胶无异味，极简风格很喜欢，尤其放在不锈钢置物架上非常稳固，不会滑脱，淋浴房里使用合适。",2018-07-03 02:38:30
1145031,5,"肥皂盒小了点放孩子的肥皂刚好",2017-12-17 13:07:32
1145031,5,"",2017-12-17 13:07:39
1145031,5,"软的很好",2017-12-16 18:07:25
1145031,5,"好 等到补货就买了",2017-12-12 14:19:12
1145031,5,"皂托，肥皂沾水不怎么防滑",2018-05-09 12:33:42
1145031,5,"摸起来很舒服，都不忍心放肥皂了。",2017-12-10 21:46:08
1145031,4,"容易滑",2018-04-30 00:42:10
1145031,5,"一点都不积水，很好用，大小也正好。",2017-12-05 12:30:33
1145031,5,"东西不错。",2017-12-05 14:27:19
1145031,5,"太平了",2018-04-14 15:39:22
1145031,5,"简洁大方，弹性好，看着就很上档次的包装",2017-12-02 23:32:00
1145031,5,"非常非常非常非常非常非常的好 又满意 质量又好 而且物流速度也很快 很开心 哈哈哈哈哈 特别棒哦呢",2018-06-16 22:15:27
1145031,5,"还没用",2017-12-04 09:48:10
1145031,5,"",2017-12-02 12:51:31
1145031,5,"还行吧。说是4-11店庆当天有惊喜，结果不但礼包也没了，惊喜也没见着<U+0001F937><U+0001F3FB><U+200D>♀<U+FE0F>",2018-04-13 12:54:00
1145031,5,"做工好，无异味，漂亮。",2017-11-30 22:04:12
1145031,4,"一般般，尺寸略小，用湿的肥皂放上去会滑下来",2018-04-19 11:38:43
1145031,5,"",2017-11-30 13:09:27
1145031,5,"",2017-11-30 13:09:34
1145031,5,"",2017-11-30 13:09:42
1145031,5,"",2017-11-28 13:37:56
1145031,5,"用这个不会浪费香皂",2018-04-13 07:10:05
1145031,5,"好好好好好好好好",2017-11-27 18:41:19
1145031,5,"锅不错，适合炖汤，冬天了，来一锅排骨汤喝！",2017-11-18 18:24:17
1145031,5,"质量不错，简洁。有两层不会漏水，硅胶的材料。",2017-11-23 08:34:41
1145031,5,"漂亮，本来以为是个平板的，没想到有孤度，设计完美",2017-11-08 18:47:38
1145031,5,"非常好，日用百货基本都在严选买，真的是印证了那句slogan好的生活真的不贵。",2018-06-05 09:25:49
1145031,0,"严选的东西，价格不贵，质量保证，看得出来是在用心做产品。给网易严选和网易点赞！",2017-06-02 14:42:04
1145031,5,"这是又回购的 喜欢 柔软 防滑 肥皂放上面还会保持干燥 很棒",2017-08-14 20:03:55
1145031,5,"第二次买了，放香皂能很快沥干又不积水，不像塑料的那种总泡在水里，好东东",2018-05-11 23:29:17
1145031,5,"买的每一样东西都很喜欢，一样一直严选下去，不要丢了品质。好用不贵。",2018-06-22 09:04:36
1145031,5,"方便好用不积水",2017-11-18 18:51:40
1145031,5,"比想象的大，但真的很美也很好用，要是粉色还有就更好了",2018-08-15 08:41:40
1145031,4,"容易积肥皂水后黏糊糊的，但颜值高",2018-07-07 02:07:51
1145031,5,"好的很",2017-11-16 23:56:25
1145031,5,"质量挺好，产品体积只能放香皂，放肥皂小了点",2018-05-29 16:35:26
1145031,5,"非常满意，很精致！喜欢的都舍不得用，嘻嘻！618买了一大堆喜欢的东东，中了严选的毒，哈哈",2018-06-14 21:08:22
1145031,5,"满意。",2017-11-15 20:45:55
1145031,5,"1. 不漏水不会弄得台面很湿，赞！2. 硅胶方便清洗，用手一翻开就可清洗",2018-05-27 21:17:57
1145031,5,"看着比较舒服",2017-11-14 14:02:04
1145031,5,"设计有不可理的地方，底部还是密封还是会积水。可以改进",2018-06-15 14:51:31
1145031,5,"很软，不错，有创意，严选中毒呀！",2017-11-12 11:59:57
1145031,3,"尺寸太小",2018-04-10 18:09:54
1145031,5,"湿了水以后，底下有些滑，总得来说颜值使用都到位~",2018-04-11 09:43:19
1145031,5,"产品已经退回，未收到",2018-04-06 18:01:12
1145031,5,"还可以 香皂不会泡在水里 不过还是要经常清洗的",2018-04-10 13:47:53
1145031,5,"手感很软，还没用呢～",2017-11-12 17:06:47
1145031,5,"非常不错，网易严选，值得信赖！",2017-11-12 16:54:23
1145031,5,"质量很棒喜欢严选",2017-11-08 12:11:21
1145031,3,"都是很不错的产品，用心制造和挑选的，网易加油，更进一步。",2018-04-07 21:42:14
1145031,5,"有弧度，很好用(<U+272A><U+272A>)",2017-11-10 13:12:51
1145031,5,"不好清理",2018-04-07 10:28:30
1145031,5,"很好哈",2017-11-09 13:52:40
1145031,5,"物美价廉给",2017-11-09 09:24:21
1145031,5,"面料舒服！",2017-11-09 19:27:15
1145031,5,"很美腻呢，特别喜欢硅胶。",2017-11-08 21:07:35
1145031,5,"简洁又方便，底下不是镂空的，颜色也很好看",2017-10-30 21:06:22
1145031,5,"很好的一款香n盒！！！！！！！",2017-11-07 18:51:20
1145031,5,"这么搭配挺好",2017-11-07 12:35:06
1145031,5,"刚好家里洗碗皂没地方放，用杯子装容易融化，这个很实用，刚好够大又很容易晾干。",2018-05-03 18:23:16
1145031,5,"单层不漏底，平放用很合适",2017-11-06 19:17:01
1145031,5,"很美丽就是有点容易积水",2018-03-20 06:40:45
1145031,4,"底下没有开孔。。",2018-03-19 22:00:03
1145031,5,"",2017-11-06 17:21:24
1145031,5,"还没用，是不是会积水",2018-03-25 11:04:19
1145031,5,"不错！考虑再购买几个，把卫生间肥皇都换了。使用后再评价",2017-09-28 12:49:25
1145031,5,"很好",2017-11-05 12:12:13
1145031,5,"",2017-11-05 13:42:33
1145031,5,"皂盒是满多少金额以后加钱买的，还没有开始用，等会找一块香皂来试试，缝隙很多，看着容易藏污纳垢，估计得经常清洗",2018-03-25 10:05:21
1145031,5,"之前肥皂总是被泡烂，用了这个皂盒以后干得很透。好评",2017-09-10 15:42:12
1145031,5,"还可以 喜欢",2017-11-04 13:02:27
1145031,5,"很小巧，轻便，大小合适，就是隔栅中有积液的情况下需要及时清理",2018-07-28 09:51:24
1145031,5,"不得不说严选的东西非常好 从外包装 到快递 都非常重视 还有做功方面也达到标准",2018-05-14 18:28:27
1145031,5,"搭配皂架来用挺搭的",2017-11-01 03:28:55
1145031,5,"中了严选的毒啦……",2017-11-01 12:41:11
1145031,5,"你在家我内心那你快睡了看那些年我们7@对你的",2018-07-22 11:52:29
1145031,5,"不错，很喜欢",2017-10-30 18:20:01
1145031,5,"喜欢哦，洗衣皂放上正好，拿取方便，控干方便。",2017-10-17 19:53:17
1145031,5,"",2017-10-24 11:35:06
1145031,5,"第一次在网易严选购物，是被极果安利的，非常养眼，希望好用",2017-08-30 18:27:30
1145031,5,"样子不错，但是肥皂盒底部没有孔，需要经常清洗",2018-03-08 19:00:43
1145031,5,"积水",2018-03-20 17:59:11
1145031,5,"软软的，没有任何异味，用料很好。",2017-10-21 09:06:10
1145031,5,"家里领导说，这个有点鸡肋，还是会积水的<U+0001F613>",2018-05-20 23:11:32
1145031,5,"质量很棒，值得推荐。总之，同等价位中，很难找到更好的...下次还要继续补货",2018-05-19 21:46:42
1145031,5,"太好用了，手工皂福利。逼格也甩传统皂盒好几条街，下次还会来。",2018-06-12 07:44:41
1145031,5,"买了俩，一个白色，一个蓝色，都很喜欢",2017-10-19 15:58:58
1145031,5,"我的居家用品大多数都是严选买的，质量非常好，拖鞋，底垫，居家短裤，短袖，香皂，洗衣液，牙刷，抹布，香皂盒，套套……",2018-05-10 11:11:08
1145031,5,"我的居家用品大多数都是严选买的，质量非常好，拖鞋，底垫，居家短裤，短袖，香皂，洗衣液，牙刷，抹布，香皂盒，套套……",2018-05-10 11:11:31
1145031,5,"有点小，装不下欧舒丹香皂",2018-08-09 23:18:38
1145031,5,"感觉棒棒的。",2017-10-16 13:18:39
1145031,5,"特别小的一个皂盒，软绵绵的手感很细腻。买花洒送的，好大一包装盒，完全没有必要，还是环保点好。",2018-03-18 20:56:52
1145031,5,"硅胶手感不错，希望边缘能再高点，皂放在上面就更不容易掉了",2018-03-06 12:27:53
1145031,5,"质量好，满意。
但是一个皂盒都单独发货，包装材料加运费都超出皂盒的价值了。挺浪费的，也不环保。",2018-03-08 16:16:02
1145031,5,"质量特别好，硅胶的防滑，而且不容易发霉。",2017-10-13 21:00:16
1145031,5,"尺寸略小，放肥皂小了点，质量不错。",2017-10-14 12:54:38
1145031,5,"颜值很高的皂盒 放在洗手台上很好看 质量很好 很喜欢",2017-08-22 19:14:12
1145031,5,"东西不错很满意，真的时硅胶的，软软的，香香的肥皂在上面很舒适哦。物流很快。。。。。。。",2018-04-15 08:21:36
1145031,5,"宝贝收到了，非常喜欢，质量很好，卖家热情，物流给力，非常愉快的一次购物，好评！",2018-06-24 00:17:13
1145031,5,"还好 应该买另一种平的那种的 这种积攒的水都挺脏的",2018-07-19 09:20:03
1145031,5,"第二次购物就中了严选的毒<U+0001F618><U+0001F618>，会一直来回购的，好的生活品质，真的没有那么贵<U+270C><U+270C>",2018-04-28 14:24:25
1145031,5,"蓝色的已经开封使用，粉色的打算放洁面皂，很愉快的一次购物！",2017-08-15 22:40:00
