"itemId","star","content","createTime"
1156013,4,"充电时有点声音 过些日子再看看吧",2018-04-12 20:49:32
1156013,5,"第一次买严选的宝贝，算喜欢，不论是包装还是产品，都挺满意的，看来以后都会在这看了，希望严选的产品越来越好！",2018-08-18 17:43:48
1156013,5,"黑色比较耐脏，很好用，轻便小巧，电量就充手机2次左右正合适，不喜欢电量太大的",2018-05-27 20:57:57
1156013,5,"买的第二个了，这款轻便充电快！超级满意！",2018-06-27 10:14:06
1156013,5,"超级好用，轻便，方便携带，磨砂摸起来也很舒服。",2018-06-19 23:38:52
1156013,5,"超级好用，轻便，方便携带，马卡龙粉也很好看。",2018-06-19 23:38:23
1156013,5,"很精美好看，粉红的，充电速度也快，美美哒",2018-06-11 23:02:10
1156013,5,"非常满意！我支持你哦严选！",2018-06-09 10:17:48
1156013,5,"之前买过送朋友，据说很好用，充电快，大小合适。于是自己趁618加价购也入手一个！",2018-06-19 13:40:46
1156013,5,"挺好用的小的比较好装包里，容量大改能充两次手机吧。",2018-08-14 18:46:34
1156013,5,"长草已久，颜值高，相信严选所有商品都不会让我们失望的，用后追评。",2018-06-14 21:28:37
1156013,5,"被颜值吸引买的，刚充满了电，还没用。大小重量都满意，就是容量大点就好了<U+0001F601>",2018-05-08 20:54:24
1156013,5,"有手掌那么大，很轻很薄，我的放在包里随身携带都非常方便，冲电大概能充一次半，还不错的，值得推荐",2018-07-05 17:46:18
1156013,5,"很轻，手感很好。打开那会以为型号不配用不来，现在试用了一下可以用。出门带轻巧特省力",2018-04-11 14:20:04
1156013,5,"充电宝粉粉的颜色，小巧的身板颜值高，就是线有点短，带出门方便好用，值得购买",2018-04-18 07:56:20
1156013,5,"之前的充电比较大，出门不方便，收到这个很惊喜，很小巧，而且很好看，可以充2次，出去玩刚刚好，",2018-04-07 16:20:02
1156013,5,"小巧携带方便，由于一直放在背包里外面有点脏了，5500mAh的，平日里外出携带够用了！",2018-04-28 11:02:55
1156013,5,"很轻小巧，物流很快，包装很好，嗯，对于我这种基本上不出远门的人来说大小够用比较满意的购物",2018-04-26 23:29:40
1156013,5,"第一次在严选买东西..哈哈..充电宝这个大小我太喜欢了方便、小巧、也很轻，就为了年休出去玩准备...期待..",2018-04-15 22:13:11
1156013,5,"特别迷你特别可爱的电宝，触感摸起来不像金属品很舒服，虽然容量小了点但是携带很方便！",2018-03-18 21:41:57
1156013,5,"小巧轻便，表面还是糯糯的磨砂，颜色暖暖的，一切都搭配地完美。很赞。",2018-04-10 13:10:18
1156013,5,"马卡龙色的充电宝，手感好，颜色好，是我买的充电宝最好用的，点赞",2018-04-05 15:18:08
1156013,5,"很可爱的颜色，这已经是买的第二个了",2018-08-21 10:15:14
1156013,5,"到货了，很满意，小巧精致，携带方便",2018-08-10 16:17:16
1156013,5,"蛮好的，简单轻便，满意一百分",2018-07-23 13:14:10
1156013,5,"",2018-07-17 21:02:32
1156013,5,"搞活动买的，携带轻便，小巧，一直都想买个这样的移动电源，终于如愿了。",2018-03-29 11:02:53
1156013,5,"小巧携带方便",2018-07-06 14:37:43
1156013,5,"",2018-07-01 15:30:48
1156013,5,"",2018-06-30 14:36:43
1156013,5,"已经用了很久了，才来评价，我一直叫它“江湖救急”虽然小，但是带着很没有负担，所以出门在外救急很棒哒！而且够用了！",2018-05-06 01:16:51
1156013,4,"好用，好携带",2018-06-29 12:44:16
1156013,5,"漂亮",2018-06-29 15:05:20
1156013,5,"自己贴个贴纸，很漂亮的马卡龙色，好用",2018-06-19 17:48:43
1156013,5,"赠送的东西，也能这么牛逼！！！",2018-06-20 22:59:19
1156013,5,"小巧可爱～",2018-06-19 10:16:27
1156013,5,"轻巧使用，自用送人都很好",2018-06-17 09:59:43
1156013,5,"真的很小巧方便",2018-06-13 14:31:32
1156013,5,"",2018-06-13 16:26:11
1156013,5,"价格实惠质量不错，准备再买一个换着用",2018-06-10 16:23:49
1156013,5,"很好很不错小巧，好看",2018-06-12 11:54:02
1156013,5,"不错哦，颜值在线，手感也挺好，很轻巧",2018-06-08 21:44:21
1156013,5,"小巧精致又方便，大爱大爱
严选的东西一直信赖",2018-05-26 22:06:47
1156013,5,"外观精致，手感一流！网易智造，非常喜欢！",2018-06-03 13:01:58
1156013,5,"容量大，轻便易携，很好用。",2018-05-27 07:06:35
1156013,5,"给女儿买的充电宝，她拿到后爱不释手，特别喜欢它清新可人的蓝色，小巧轻薄的外型，还有不同寻常的触感。看不出任何缺点的一款充电宝。",2018-05-19 08:52:14
1156013,5,"网易出品，必属精品！真的是很小巧，也很薄！非常非常满意！",2018-04-16 20:09:37
1156013,5,"比想象中好看，就是厚了一点",2018-05-21 21:35:02
1156013,5,"很棒，以后再也不用担心手机没电了",2018-05-19 09:57:40
1156013,5,"材质十分舒服，充电快，严选值得信赖！",2018-05-12 09:44:28
1156013,5,"超帅",2018-05-09 16:45:49
1156013,5,"还不错，挺漂亮的，就不知道好不好用。",2018-05-04 19:38:40
1156013,5,"用过之后才来评价的，一次可以充满魅族Pro6s和苹果se，很满意，颜色也是炒鸡好看的薄荷绿，就是不太耐脏啦",2018-04-10 07:11:17
1156013,5,"轻便，能充两次",2018-05-02 23:32:30
1156013,5,"超级棒",2018-05-01 12:31:20
1156013,5,"超级Q，粉嫩粉嫩的，也很小巧，手掌大小。携带会很方便",2018-04-13 16:56:55
1156013,5,"很好",2018-04-24 22:14:37
1156013,5,"比较轻，方便带走，比手机还轻。",2018-04-20 15:47:12
1156013,5,"喜欢",2018-04-20 14:50:18
1156013,5,"真的很棒，用了一段时间觉得非常好",2018-04-18 12:50:18
1156013,4,"薄，小，颜色也好看",2018-04-18 09:49:02
1156013,5,"颜色特别适合夏天，体积小，很轻薄，方便携带。网易棒棒哒",2018-04-10 19:06:26
1156013,5,"小巧轻便、拿在手上感觉不错、严选值得信赖啊！",2018-04-10 14:39:48
1156013,5,"很有质感，小巧轻便。",2018-04-17 11:50:45
1156013,5,"很好用，充电很快呢！",2018-04-15 22:20:52
1156013,5,"质量都非常好，非常满意",2018-04-15 21:29:01
1156013,5,"很轻巧，摸起来质感还可以，5500的容量算小的。",2018-04-06 22:21:09
1156013,5,"小巧可爱",2018-04-13 10:27:30
1156013,5,"可以的，漫小巧的",2018-04-12 17:30:10
1156013,5,"很小巧可爱，就是味道有点大。",2018-04-11 23:53:12
1156013,5,"很轻薄，便于携带。",2018-04-11 21:51:00
1156013,5,"非常非常喜欢",2018-04-10 16:39:22
1156013,5,"不错<U+0001F44D>",2018-04-10 00:53:31
1156013,5,"非常满意！！！！！！！！！！！！！！！！！！！！！！！！！！！！！！！！！！！！！！",2018-04-10 16:15:19
1156013,5,"",2018-04-10 22:29:47
1156013,5,"很好",2018-04-08 14:50:47
1156013,5,"很好用，大小合适，方便",2018-04-07 09:21:33
1156013,5,"充电速度快<U+0001F44D>",2018-04-07 10:06:01
1156013,5,"比较小巧精致，适合女人用",2018-04-05 22:35:24
1156013,5,"特别好  轻便  好看",2018-04-05 19:53:12
1156013,5,"颜色棒棒，手感棒棒…物流棒棒…美滋滋",2018-04-04 22:36:40
1156013,5,"很轻 带着方便",2018-04-04 08:10:40
1156013,5,"好轻 适合短距离小挎包带着 实用又好看",2018-03-31 11:30:53
1156013,5,"售后简直完美~严选一生推~",2018-04-03 11:11:09
1156013,5,"颜值妥妥滴，大爱",2018-04-03 12:31:35
1156013,5,"不大不小，很轻，颜色漂亮",2018-04-03 15:21:59
1156013,5,"",2018-04-03 13:06:53
1156013,5,"喜欢好看.携带比较方便",2018-04-02 11:35:09
1156013,5,"良心产品",2018-04-01 20:06:44
1156013,5,"又轻又薄，我的苹果6，可以充三次，赞<U+0001F44D>",2018-03-17 20:38:48
1156013,5,"很轻巧，还没试。总体要给满分，质量追加",2018-03-26 19:24:02
1156013,5,"好轻巧，太实用了",2018-03-27 21:22:08
1156013,5,"好用好用",2018-03-27 09:47:19
1156013,5,"非常满意，外观漂亮，很轻，大小正合适",2018-03-26 17:23:51
1156013,5,"质量一如既往的好，赞美<U+0001F44D>一个",2018-03-26 12:01:15
1156013,5,"不错",2018-03-26 16:46:51
1156013,5,"轻便，好用。一块可以给两个手机充电",2018-03-21 21:34:49
1156013,5,"刚刚拿到，还没开始用，样子很不错",2018-03-19 19:56:02
1156013,5,"轻巧轻薄轻便，很满意",2018-03-18 23:06:31
1156013,5,"",2018-03-16 08:58:49
1156013,5,"第二次购买了，体积小也很轻便，很不错",2018-03-15 09:51:12
1156013,5,"手感还不错，基本上可以一次电吧",2018-03-13 18:23:13
1156013,5,"手机充电很快",2017-12-07 10:09:57
1156013,5,"轻巧，好看，很是满意。试用了一下，充满电后，可以给我的se充电两次。",2018-02-06 14:58:32
1156013,5,"颜色很漂亮，东西设计的很小巧！",2018-02-05 13:57:30
1156013,5,"东西特别小巧 本来也想买一个小一点的充电宝 方便携带还够用 和朋友拼团很划算",2018-03-12 15:58:34
1156013,5,"充一次电，用一次就没电了",2018-07-01 14:39:59
1156013,5,"粉粉的很可爱，挺小的，我很喜欢<U+0001F495>
磨砂材质摸起来也有质感，很棒哦",2018-03-09 08:39:52
1156013,5,"颜色很漂亮，蒂凡尼绿，重量轻，方便携带，容量一般，但是够用，iPhone x从10％充满一次。",2018-03-07 12:23:34
1156013,5,"喜欢，颜色很正，非常轻便，以前一直都不用移动电源的，嫌太重，这次买完就可喜欢啦",2018-02-22 21:29:17
1156013,5,"很小巧，手感不错，之前买的一个小米，第一天用就不能充电，联系了还不肯退，一气之下取关小米任何产品，顺手买两个网易制造支持一下！",2018-07-06 09:34:29
1156013,5,"有活动，团购很合适，价格低还包邮，网易严选的品质，没的说，相信他的产品质量！",2018-03-08 09:40:15
1156013,5,"一元加购的，但不是全新的，包装盒外的圆封条都是拆过一次然后又贴了一个上去的",2018-06-30 08:37:13
1156013,5,"还不错，虽然是赠品，但质量看起来还是过硬的，这个容量貌似充起来很快，再用用看",2018-01-19 09:07:48
1156013,5,"买过几个充电宝，这款是我用过性价比最好的。选严选选择对的",2018-06-11 21:07:40
1156013,5,"放包里用了不到一个星期 简直伤痕累累",2018-06-20 08:56:18
1156013,5,"小巧玲珑，出门不带包放在西装口袋都没有问题，6可以充两次，出门够用了。手感好。",2018-03-04 20:20:46
1156013,5,"为春运备的，在火车上显摆，单程1600kM无忧，移动。比我手机小码，来趟说走就走的旅行。",2018-02-27 00:16:20
1156013,5,"色彩艳丽，小巧精致，已开始使用。感觉我每天都有网易货收，停不下来的买买买。",2017-12-19 19:55:43
1156013,5,"很轻巧，颜色粉粉的，线有点短，不过我觉得也还够用。挺好的，喜欢！",2018-02-27 14:02:53
1156013,5,"颜色很漂亮，满足了少女心，就是连接线太短，太短，还没用，不知道蓄电好不好",2017-12-09 07:34:39
1156013,5,"非常粉嫩，符合我的一颗老少女，电量足，充电快，满意度五颗心。不是只有伊能静有少女心，永远保持少女心，呵呵哒",2018-03-10 21:14:59
1156013,5,"看起来高大上，手感也不错，就是容量太小了，没看清楚，感觉不够用",2018-03-02 20:08:58
1156013,5,"小巧，非常好用，充电速度也没问题，便于携带，通常来说电量也足够用了",2018-07-26 07:20:27
1156013,5,"以前买的充电宝都太重，还好这次的颜值和重量都很靠谱。",2018-01-11 16:57:33
1156013,5,"感觉有点小，小口不是双面一样的，不适合华为P10Plus和mate10pro",2018-06-21 19:06:53
1156013,5,"很满意 一直相信 网易 玩网易 大话西游II 10来年了 网易出的 绝对没错",2017-11-13 17:37:00
1156013,5,"粉色是那种淡淡的嫩粉色，很少女。数据线很短，超级短，总体来说满意。试用后来追评。",2017-11-13 17:00:38
1156013,5,"这个还好。。。我的已经坏了。。",2018-06-19 17:28:26
1156013,5,"超级少女心的颜色，很喜欢<U+0001F60D>方便小巧。还没用，不知道充电效果怎么样，想想不会差的吧<U+0001F604>",2017-11-11 14:17:13
1156013,5,"不耐zhang",2018-06-24 17:52:18
1156013,5,"很粉嫩！个头也很小巧轻便，就是线略短，不过也能克服，比较好收纳",2018-01-01 08:59:53
1156013,5,"好得很好得很好得很好得很好得好得很好得很得很。。。。。什么时候给我雪童子",2017-11-28 16:52:18
1156013,5,"物流非常给力，隔天就收到了，特意试用了2天才评价的，充电非常快 ，很喜欢 大小便于携带。 颜色很赞 ，很满意<U+0001F604>",2018-02-10 13:41:18
1156013,5,"用起来倒是方便，可不知道为什么，给它本身充电的时候会有很大的电流声",2018-06-10 11:30:12
1156013,5,"外形还可以，是我喜爱的颜色！至于好不好用，过一段时间再来评价",2018-01-24 18:58:41
1156013,5,"这个我超级喜欢，很轻，方便携带而且比苹果6（4.7寸）要小小点哦。",2018-02-19 23:56:42
1156013,5,"能冲两次",2018-06-16 17:51:40
1156013,5,"很喜欢的颜色 而且小巧精致 很轻巧携带方便 早就看好了 上次绿色没货 所以现在才拿到 么么哒",2017-11-13 20:46:05
1156013,3,"容量太小了 不使用",2018-06-14 14:51:27
1156013,5,"很小巧的一个，携带很方便，充电速度也不错，严选的东西质量真的不错",2018-02-12 16:45:30
1156013,5,"不错 就是白色容易脏",2018-06-19 00:21:09
1156013,5,"好喜欢这个颜色，手机用的时间长了，出门必须带电池，心累。好在这个充电宝小巧，带着不重，颜色看了就舒服！",2018-01-23 11:25:41
1156013,5,"第一次在这个平台购物 期待好用后会继续关注 颜色很好看 喜欢",2018-03-07 12:46:12
1156013,5,"又好看、又轻盈，严选择过的物品放心买。太喜欢严选了！",2018-03-03 23:14:46
1156013,5,"手感和颜色都超棒！比i7小一圈可以说是很便携了！再次强调颜色超好看！",2017-11-02 17:04:59
1156013,5,"垃圾",2018-05-22 22:25:11
1156013,5,"挺好的，买了好几次了",2018-05-21 22:12:51
1156013,5,"这个是赠品吧，一般般，很少用",2018-06-10 01:28:11
1156013,5,"颜色粉嫩，满足我这少女心。大小也刚刚好，小包里也放的下。适用中。拍照光线问题，实物很好看，价格也美丽。",2017-12-08 12:42:05
1156013,5,"这颜色我就给满分，还没用不知道一次能充多少手机的电。就是数据线有点短了。",2017-09-11 11:40:56
1156013,5,"真是马卡龙的颜色，萌萌哒，就是盒子被压到了，连接线确实比较短",2017-10-22 10:42:52
1156013,5,"第二次购买了，给老婆买的，质量很好",2018-08-04 20:55:06
1156013,5,"触感不错，试了一下还有两个格电，喜欢这个小小的充电器，给我好心情!",2017-12-14 21:16:11
1156013,5,"好用",2018-08-02 22:40:07
1156013,5,"充电宝手感很好，大小合适很喜欢",2018-07-30 08:03:18
1156013,5,"毫不犹豫选了原谅绿<U+266A>(′ε｀ )实物到手后还是很好看呀、作为颜控被满足了少女心?？？",2017-09-05 21:29:11
1156013,5,"很好用外表光滑。最重要的是马卡龙色系很好看。就是线短了一些。",2017-10-15 10:15:22
1156013,5,"好看，就是再大点就好了，只能充一次",2018-05-10 17:18:22
1156013,5,"颜色和大小都是我喜欢的，真的很轻，以前用的牌子都是好看的但厚重。第一次尝试买网易的充电宝，之后看看它的寿命吧。",2018-03-07 21:39:42
1156013,5,"好看，但是电量小",2018-05-29 15:24:37
1156013,5,"好看，颜值高，小巧，很轻便，去哪里放在包里也不会沉，挺好的",2018-05-22 10:41:59
1156013,5,"这个还是很不错的！颜色特别好看，少女，试了一下充电很快，而且大小正好，拿着比较方便，也可以带上飞机，喜欢",2017-11-19 09:57:10
1156013,5,"很好用 plus能充两次",2018-05-24 22:40:35
1156013,5,"这是我在严选中的第三个，也是第三款的移动电源，赞！",2018-02-23 15:54:20
1156013,5,"很满意，出门带方便<U+2795>快递速度<U+2795>服务<U+2795>、下次，下下次还会光顾严选",2017-11-20 10:12:25
1156013,5,"非常轻薄的一个充电器，应急用足够了，非常喜欢这个嫩绿色。",2018-02-19 00:30:26
1156013,5,"外观简洁大方，就是充满后只能充一次手机",2018-05-07 14:45:21
1156013,5,"用了很久了，不错，就是容易脏",2018-04-18 17:38:22
1156013,5,"比想象中的要mini啊 哈哈 媳妇大人说挺Q的 放在包里不占地方 5000毫安的应急用没问题 主要是配上严选的线充电也很快。",2018-03-05 17:50:08
1156013,5,"不够冲",2018-05-14 21:33:13
1156013,5,"宝贝刚收到，颜色很是漂亮，试了一下很好用。",2018-03-11 14:16:19
1156013,5,"早就想买充电宝，但是又不敢乱买网上的，正好这次严选限时购有活动，果断入手，因为质量有保证。颜色特好看，非常喜欢",2017-11-28 12:19:34
1156013,5,"一直就想买了，这次趁着拼单终于下手了，没让我失望，小巧，时尚，方便携带～好评～",2017-09-20 23:36:14
1156013,5,"小可爱，很招人喜欢。",2018-03-12 08:26:07
1156013,5,"之前先买了个粉色，试了下挺好用的，便于日常携带。5500毫安的出国上飞机的话可以带俩，都挺轻的<U+266A>本来想买青色，结果青色无优惠<U+266A>只好凑粉蓝CP",2018-03-11 19:34:30
1156013,4,"有时候手机不识别，不知道是它的问题还是线的问题",2018-04-19 10:29:13
1156013,5,"比较轻，不过跟我想的有些差距。",2018-04-19 10:25:17
1156013,5,"迷你，手感不错，还没用，严选出品，应该没问题。",2018-03-05 13:21:37
1156013,2,"差评，这个充电宝带了一个充电线，丑就不说了，还短，好吧，为了三石哥，我忍了，你TM居然充不进去电，也就是说，这个充电宝的数据线是断路的，我去，无法忍受，我拿什么冲充电宝，。。。生气中",2018-04-16 13:39:43
1156013,5,"宝贝收到了挺好的，颜色我也喜欢",2018-03-09 11:50:38
1156013,5,"手感很不错，很秀气，颜色超赞！",2018-03-10 14:29:38
1156013,5,"孕期囤货，还没有用看着挺好的呢",2018-03-04 13:06:28
1156013,5,"性能优异，价格合理，值得拥有！",2018-03-09 12:12:43
1156013,5,"看起来还不错，小点，",2018-03-09 22:23:39
1156013,5,"满意满意",2018-03-09 17:33:30
1156013,5,"喜欢，耐用",2018-03-09 02:52:31
1156013,5,"小巧玲珑，非常好的充电宝，物美价廉，飞镖不错。测试了是5500。推荐购买。",2018-01-17 16:21:10
1156013,5,"超级好 手感我喜欢 好好体验一把",2018-03-07 19:28:15
1156013,5,"比想象的体积更小，大概一个安卓手机能充满两次电的电量。颜色也很鲜艳，喜欢。外壳是那种有一点摩擦力的舒适手感的，哑光，质感很好。",2018-04-10 16:58:02
1156013,5,"蛮小巧的，携带方便，这个颜色好看",2018-03-07 13:29:41
1156013,5,"还可以，挺轻薄的，出差带着不重，可以充电2次。还不错。就是插口那有点不流畅，其他还OK",2018-04-18 13:10:33
1156013,5,"还行 自从有了它 上课就不怕了",2018-03-05 19:47:39
1156013,4,"还行吧，同类同价有更好的，不会回购。",2018-04-14 11:18:49
1156013,5,"歪瑞纳爱斯！以后就严选了！<U+0001F609>",2018-03-03 23:29:32
1156013,5,"粉色的漂亮。小巧。做活动买的划算",2018-03-05 18:32:55
1156013,5,"小巧轻便，居家旅行必备良品。",2018-03-05 13:39:13
1156013,5,"这个真的购物体验不好，买到手盒子是已经拆封过的，感觉像是别人退货不要的，还有一丢丢赃，算了，退回麻烦就算了。",2018-04-14 00:15:57
1156013,5,"很好",2018-03-05 10:36:51
1156013,5,"充电速度很快，拿着很轻便，摸着手感也好",2018-02-26 11:54:59
1156013,5,"小小的而且很轻，带着不会有负担，充电能力现在还没用，不过相信不会差的。粉色的真的很好看超级少女心！！！",2017-11-14 17:19:55
1156013,1,"相当垃圾，电量不足，还有不知道怎么开，没变化弄的，垃圾垃圾，对严选失忘因为他",2018-04-12 20:56:49
1156013,5,"很小巧，不错",2018-03-02 18:42:01
1156013,5,"插口不灵活",2018-04-11 22:04:15
1156013,5,"容易染色",2018-04-12 21:38:53
1156013,5,"喜欢的蓝色，小巧轻便，还没用，应该不错。",2018-02-28 21:11:04
1156013,5,"这个真的很鸡肋了。基本上充电我觉得没什么用。续不了多少电的感觉。至今扔抽屉里。",2018-04-10 15:00:15
1156013,5,"这个真的很鸡肋了。基本上充电我觉得没什么用。续不了多少电的感觉。至今扔抽屉里。",2018-04-10 15:00:22
1156013,5,"好好好，随身携带小巧不占空间！",2018-03-01 18:16:41
1156013,5,"为畅行无忧提供全方位的服务",2018-03-01 16:28:14
1156013,5,"颜色好看，很轻，就是脏了不太好擦干净。",2018-04-07 13:08:15
1156013,5,"轻巧便携，颜色与图片相符。希望性能稳定好用。",2018-02-22 19:37:45
1156013,5,"颜色真的超美，很少女心，很相信严选",2018-02-22 14:49:31
1156013,5,"小巧玲珑，携带方便，网易严选的东西质量总是如此给力哈哈哈",2018-02-08 13:54:43
1156013,5,"质感很好，手感也不错。",2018-02-26 18:49:45
1156013,5,"未使用，还可以",2018-02-26 21:20:14
1156013,4,"只能充一次手机",2018-04-05 20:34:13
1156013,5,"体型小巧，马卡龙粉特别可爱，质量好，实用！",2018-02-25 21:05:12
1156013,5,"这个真的很鸡肋了。基本上充电我觉得没什么用。续不了多少电的感觉。至今扔抽屉里。",2018-04-10 15:00:09
1156013,5,"粉色非常漂亮，而且小巧，不重。很适合携带。不过充电有些发热，不知道是不是充电宝都避免不了的发热？",2018-04-07 22:21:28
1156013,3,"1.标称5000mAh，但iPhone充一次就快没电了；
2.充电速度有点慢。",2018-04-03 09:55:38
1156013,5,"很棒 ！  比较小巧",2018-02-25 20:37:34
1156013,5,"不错不错不错不错",2018-02-25 14:08:35
1156013,5,"",2018-02-23 23:26:11
1156013,5,"粉嫩的充电宝，小巧方便携带。",2018-06-06 06:26:05
1156013,5,"小巧轻便",2018-02-19 22:46:51
1156013,5,"东西收到了，巴掌大小，很小巧，放包包里不占地方，很方便<U+0001F618>",2017-11-17 20:07:36
1156013,3,"外观轻巧酷炫，但给iPhone充电发热还是很厉害。",2018-04-07 14:39:06
1156013,5,"颜色漂亮，重量轻，携带方便，很可爱的小玩意儿",2018-02-10 09:37:24
1156013,5,"还没开始用，颜色很鲜艳，喜欢",2018-02-15 12:55:49
1156013,5,"颜色不错，很轻，但是5500ma估计只能充一次",2018-04-03 12:25:34
1156013,5,"只能充两次不到，感觉一般般",2018-04-06 22:41:14
1156013,5,"颜色很漂亮，很少女心<U+2764>可用于苹果手机充电一次",2018-01-24 10:34:13
1156013,5,"充电器很好用，赠送的数据线是宽扁的很有趣。磨砂质感非常舒服，颜色也不错，很心水。",2017-07-24 17:14:58
1156013,5,"之前买过一个黑色的，电源轻便、携带方便、不愧是严选的产品",2018-01-11 08:35:04
1156013,5,"颜色很好看，很喜欢。充电一般情况下可以充一个手机，从没电到充满。储电稍微有点少。",2018-08-15 08:51:19
1156013,5,"产品质量一般",2018-04-02 00:05:27
1156013,5,"还不错，建议够买。",2018-03-29 21:42:03
1156013,5,"很小巧，方便携带，帮同事也买了一个，她很喜欢。就是数据线太短了点。",2017-08-29 17:58:58
1156013,5,"很小巧，方便携带，帮同事也买了一个，她很喜欢。就是数据线太短了些",2017-08-29 17:58:44
1156013,5,"昨天下的单，今天就到货了，速度超快！很轻，也就巴掌大，携带很方便了，果断把之前的那个抛弃了，粉嫩粉嫩的好看，试了下充手机，目前感觉还不错",2018-02-06 20:03:10
1156013,5,"不错 很小 方便携带",2018-02-08 21:33:53
1156013,5,"冲着颜值买的，大众点评积分换的杯子，凑免邮买的移动电源，质感不错。",2017-08-28 16:57:09
1156013,5,"非常感谢严选，买了好久才用，结果发现充不进电，抱着试试看的心态，与客服联系，没想到居然给换了一个，非常满意的购物，感谢如此体贴的售后服务",2018-03-27 07:48:32
1156013,5,"东西还不错  做工很精细  可惜买错了，我以为是10000",2018-01-20 12:26:38
1156013,5,"拿上手感觉很好，方便携带的同时还能减重，电芯一流，手机充电的时候也不太会发热了，总体满意",2017-09-13 11:31:43
1156013,5,"充满不知道要充多久，充手机从没电到充100%需要点时间，里面还有电还可以再充。",2018-03-28 12:32:30
1156013,5,"小巧，轻",2018-02-07 13:40:36
1156013,5,"小小的还不错，方便带出去玩",2018-02-06 13:40:58
1156013,5,"宝贝及时收到，还没用过，外观小巧精致",2018-02-03 01:24:19
1156013,2,"感觉不好 有电流声 用了两次 老公就不让用了 已经重新买了别款 不推荐",2018-03-26 10:23:21
1156013,5,"白、粉，蓝各入了一个，买三免一。很轻薄，不错。",2018-01-18 10:20:56
1156013,5,"漂亮，小巧，手感很好。颜色比较正",2018-02-05 19:39:13
1156013,5,"薄薄的很轻便~就是容易弄脏，呵呵呵呵呵呵呵呵呵",2018-03-23 22:05:52
1156013,5,"颜色正，特别轻巧，物流也快",2018-02-05 16:11:13
