"itemId","star","content","createTime"
1165064,5,"材质，耐高温，耐严寒。经试验：贴在车前挡风玻璃两年后揭下，无残留。如下图:",2017-11-29 20:49:14
1165064,5,"袜子不错线头不会让脚指头难受冷的时候保暖中午热的时候也不闷热我这边的温差大，保暖衣也很保暖舒适",2018-03-11 21:17:48
1165064,5,"质量挺好，保暖性也可以，就是比想象的薄一点，均码，穿着稍微大了点",2017-11-27 09:55:54
1165064,5,"质量好好哦 就是是单买我都觉得挺好的诶 可以那货要退围巾 那我这是不是也要一起退？我哭……",2017-12-31 16:12:31
1165064,5,"很好<U+0001F44D>很好<U+0001F44C>！袜子<U+0001F9E6>的质量非常棒！相信严选！还有京东快递的小哥真是太棒啦！",2017-12-16 15:35:18
1165064,3,"好的我就不晒了，我老婆说我已经彻底中了严选的毒，但是这次买的这个袜子真的有点不满意，穿了一天就成这样了。",2017-11-30 20:59:11
1165064,5,"性价比相当高啊，品质了得，严选上有的东西基本不会在别的网站买",2018-01-18 18:54:37
1165064,5,"性价比相当高啊，品质了得，严选上有的东西基本不会在别的网站买",2018-01-18 18:55:24
1165064,1,"千万不要加价购袜子 因为如果你不小心碰到要退换货 他就是一个解决不了的bug 如果你想同时退了它 你会发现它是不可退商品 如果你想留下它 并且愿意承担差价 你会发现 退货商品单上会默认勾选它 所以快递小哥来收货的时候会说没有袜子我不收的哦不然我不赔钱的 而客服小姐姐却会跟你说 没关系的 你就把要退的商品给小哥哥就可以了 我们收到货品以后会扣差价的～",2017-12-31 12:02:10
1165064,4,"买围巾送的，特地选了男袜送给老爸。袜子还可以吧，并不是特别厚或软。颜色挺好的。",2017-11-24 15:00:56
1165064,5,"摸起来手感不错，我是冬天脚就寒的厉害的人，这袜子穿上后舒服多了",2017-11-25 18:36:44
1165064,5,"高品质，高包装，高颜值，好服务。
就是外箱质量太好了，而且尺寸都好大，里面加的空气袋很多，感觉很不环保(^_^)a，要是网易愿意，我可以提供无偿回收纸箱，自己留着没用，卖也不值钱，扔了更可惜，因为箱子太新了，有罪恶感啊……",2017-11-25 23:54:30
1165064,5,"质量很好，价廉物美，在严选买了几次东东，每次都很满意，爱上严选了。",2018-01-16 23:06:57
1165064,5,"很厚实的袜子，穿上很暖和。应付南方的冷天足够了。北方的话我就不清楚了。",2017-11-22 10:32:15
1165064,5,"袜子买给爸爸穿的，挺厚实的，冬天不用担心爸爸脚给冻了，严选值得信赖",2017-12-11 21:09:23
1165064,5,"非常舒服，现在一买东西，首先要到严选看看，只要有，买就是了，绝对不用担心质量，严选让生活简单舒服",2017-12-07 22:37:26
1165064,5,"有点大了，买过其他的船袜，运动袜都不觉得大，就这款大了",2017-12-07 11:16:46
1165064,5,"女款最大码估计穿小了，所以买了男款。试了很好，儿子也想要，只有再买了。",2017-11-12 21:25:11
1165064,5,"没想到这么好，抱着试试看的态度买的，出乎意料的好，特别舒服，又买了2！",2017-12-06 21:27:51
1165064,5,"容易出脚汗",2017-12-30 21:35:08
1165064,5,"这个蛮好的，很厚实，但是穿久了会松松的",2017-12-30 22:11:39
1165064,1,"松松垮垮的，一点弹性都不带，穿到鞋里就全褶一起了，非常差，退货运费又多出了",2017-11-18 08:46:57
1165064,5,"很厚实的赶紧，稍厚，冬天穿很舒适。网易严选多精品，更有毛袜免费赠。耶!",2018-01-02 08:58:38
1165064,5,"袜子很厚
而且也不会掉
吸汗性也很好 质地很软
而且搞活动的时候  价钱也很划算",2017-12-25 12:07:11
1165064,5,"质量很好，老公很喜欢。四个颜色各一双就好了，多出几盒四个颜色的吧~",2018-02-02 10:59:47
1165064,5,"不错吧，我自己买了两打觉的很暖心，所以又买了一包给老公",2018-02-02 18:25:00
1165064,5,"比之前买的袜子略厚一点，摸起来毛茸茸的，颜色很好，等天冷了穿上试试。",2017-11-11 14:39:10
1165064,1,"一般，性价比不高",2017-11-17 15:43:46
1165064,5,"给老公买的，他说很舒服，很暖和又不扎脚，家里现在缺什么都会来严选看看，严选的忠实粉丝",2017-11-29 08:12:11
1165064,5,"袜子不是纯棉的但是穿起来感觉很舒服。冬天也不冷打个赞",2017-12-31 00:55:11
1165064,5,"这个颜色挺好看，袜子还没有穿，不知道质量到底如何。穿了后再来评价。",2017-12-31 12:16:47
1165064,5,"太贵了，本想打算买保暖的了，玮武不取，贫贱不移，富贵布梦衣服不错，袜子不是纯棉的！",2017-11-08 00:52:18
1165064,5,"不知起球不 看起来很不错",2017-12-30 21:39:35
1165064,5,"看着不错，质感还可以，工作性质决定了要穿正装，袜子买的也多咯！",2017-12-30 14:59:53
1165064,5,"第一次上网易严选，收到货很满意，比京东，天猫还好。拼多多是最差的，网易严选还会继续，拼多多再也不上！",2017-12-22 12:33:17
1165064,5,"客服的态度很好，我是要换货的，免邮费还上门取件，真的很贴心",2017-12-01 23:42:16
1165064,5,"袜子是赠品，不知道价值，穿起来是舒服，不知道一天穿下吸汗效果如何，期待",2017-12-29 12:04:52
1165064,1,"袜子成份和网站描述不一致，欺骗消费者",2017-11-18 20:03:20
1165064,5,"还可以哦<U+0001F61A><U+0001F61C><U+0001F61E><U+0001F620><U+0001F621><U+0001F622><U+0001F623><U+0001F601><U+0001F602><U+0001F603><U+0001F604><U+0001F609><U+0001F60A><U+263A>",2018-01-15 11:31:20
1165064,5,"贵有贵的道理，选择严选就是相信严选的品质，希望严选能一直保持产品的高品质",2017-11-28 09:38:05
1165064,5,"容易出脚汗",2017-12-30 21:35:17
1165064,2,"袜子质量还行，但好像不太吸汗，穿完一天汗味太重。",2017-12-13 20:36:59
1165064,4,"质量很好，保暖不错，就是不知道穿的时间长了保暖效果会不会变差。",2017-12-25 21:44:06
1165064,5,"挺好的 符合我的所有要求 网易严选省去了我自己去淘的很多时间 逼格很高的东西 我喜欢",2017-11-22 11:28:57
1165064,5,"脚出汗的建议考虑购买。",2017-11-16 15:28:17
1165064,5,"天啊这袜子真的太舒服了。提高生活质量啊。满意 这个冬天再买几盒 过冬了，太舒服",2017-10-18 23:28:14
1165064,5,"质量还可以，不厚，但是弹性不是很大！下水洗过了，不掉色！",2018-02-23 22:18:11
1165064,5,"质量还可以，不厚，但是弹性不是很大！下水洗过了，不掉色！",2018-02-23 22:18:32
1165064,5,"真的是物美价廉，比我在楼下买的长袜要厚也要暖和，关键是还便宜！",2018-01-22 16:22:11
1165064,5,"个人感觉袜子收口处稍紧，其他没毛病",2017-12-30 21:25:44
1165064,4,"打折39时候买的，27%的羊毛就说自己是羊毛袜，我觉得有点牵强，毕竟还有70%多可都是人造纤维啊！！！而且厚度一般，搭配雪地靴是还ok，其他普通的没那么厚实的鞋子冬天我怕是要悠着点咯",2017-12-29 21:47:13
1165064,5,"买了2份，确实比普通袜子暖和，在办公室会比较热，给父母也买了羊毛的，不错",2017-11-24 15:40:47
1165064,5,"买了2份，确实比普通袜子暖和，在办公室会比较热，给父母也买了羊毛的，不错",2017-11-24 15:40:51
1165064,5,"起球",2017-12-30 00:35:38
1165064,5,"质量非常好，超预期。男款的能不能再有小一号的商品，26到28的均码对我来说，还是稍大",2017-12-13 19:08:28
1165064,5,"袜子质量很好，很满意的一次购物。物流也非常的快。下次还会来购物。",2018-01-20 08:14:44
1165064,5,"严选买了几次东西，品质一如既往的好。这次的物流最给力，总算用航空件了。早该如此",2017-10-16 13:05:29
1165064,5,"有穿有破的，穿了几双都是这样，可能脚不适合这个袜子吧",2018-02-19 15:12:46
1165064,5,"好好好好好好好好好好好好好好好好好好好好好好好好好好好好好好好好好好好好好好好好好好好好好好好",2017-10-07 10:27:49
1165064,5,"买羽绒服，送的四双袜子，真心不错，质量比其它品牌好多了，也不臭脚",2018-01-18 15:53:55
1165064,5,"质量超级棒，之前没在严选买，买过之后决定以后都在严选买东西了，真是物美价廉",2017-10-14 19:03:05
1165064,5,"不错不错，价格合适，快递太快了",2017-12-29 19:57:13
1165064,5,"质量特别好，有弹性但是也不太勒腿，但是没有根据易磨部位而加厚。",2018-01-17 10:13:59
1165064,1,"补差价呗",2017-12-29 07:00:15
1165064,5,"天冷了 老公穿了秋裤  这个长筒的袜子正好可以把秋裤围起来了",2017-11-20 05:50:44
1165064,5,"福田中心区不了几天后就可以走得了什么的都是",2017-12-29 22:07:56
1165064,5,"摸着良心说，这是我穿过最舒服的袜子，一句话形容，有种帝王般的享受",2017-11-19 16:58:26
1165064,5,"那时候是送的，不过很好，保暖，舒适，有弹性，就是有点容易起球。",2017-12-30 08:12:45
1165064,5,"先生说，穿上明显比棉质袜热",2017-12-28 19:33:46
1165064,5,"这个袜子，刚刚收到。做工不好。不满意。起丝！差评",2017-11-15 19:44:01
1165064,4,"论手感，确实不行，可能是加了羊毛的原因，所以看起来材质很一般，不过倒是比较保暖。",2017-12-29 11:10:23
1165064,5,"衣服和袜子都很好，想再来1件时，价格回复了你价又没货，哎早知一下多买1件，等呗",2017-11-13 07:12:56
1165064,1,"洗了发现完全不吸水，不是棉的，怕捂脚没敢穿，浪费了",2017-12-29 20:19:01
1165064,5,"买了好多严选的袜子了，质量太好了，都不坏怎么办……想买新的",2017-12-13 20:35:56
1165064,5,"羊毛袜子，不臭脚，很好啊",2017-12-28 16:14:25
1165064,5,"袜子穿的很舒服，不起毛，也不脚臭",2017-12-28 21:23:36
1165064,5,"袜子有点厚的那种，在广州只能冬天穿了",2017-12-29 10:17:29
1165064,5,"赠品这样已经很好了",2017-12-29 10:36:20
1165064,5,"袜子是惊喜呀，穿着很舒服，挺厚实适合冬天穿，关键是不怎么起球，这是我穿过的最舒服的袜子！",2017-11-12 19:25:22
1165064,5,"穿了脚出汗了？没有特别暖的样子",2017-12-29 10:45:58
1165064,5,"袜子很厚很紧致，也不粘灰，很商务范。喜欢严选产品。祝生意兴隆！",2017-12-12 15:22:10
1165064,5,"穿过觉得不错，保暖，跟脚，就是有点起球，总之觉得满意。",2018-02-08 10:08:14
1165064,5,"买了4套，送给家人，适合老家比较冷的地方冬天穿。明年继续来看看。",2018-03-12 15:08:45
1165064,1,"快到货的时候才发现原来可以买3免1，而我下单是2件……因为没有看到这个优惠活动。严选总是喜欢推多种优惠策略，但是在结算的时候，因为页面设计，所有的优惠策略都变成了小小的一行。这是我最后一次在严选下单，因为感觉自己一直被算计了。",2017-12-14 08:09:29
1165064,5,"一次买了好多袜子，有点厚，可以穿好久了",2017-12-29 10:19:27
1165064,5,"厚度正好，不厚不薄，袜子摸起来就很舒服，上脚不下滑，舒适度很好。",2017-12-11 10:04:01
1165064,5,"穿着挺舒服的，适合冬天穿着，感觉有脚气的人穿久了，味道比较大",2017-12-11 10:43:29
1165064,5,"手感舒适柔软，有温度也很透气，好洗。颜色很好，男士穿着很显干净。",2018-01-10 09:32:10
1165064,5,"我先买了两盒，老公看到了也要！只能给他又买了一个盒啦！",2018-01-10 13:56:21
1165064,5,"严选的活动非常丰富，我最喜欢N件任选，还送礼物，尤其礼物也非常棒",2018-01-09 20:05:38
1165064,5,"袜子做工非常棒，厚度适中，穿着舒适，不起球，非常耐穿，严选值得推荐！",2018-02-08 12:05:25
1165064,5,"还没用，但我个人是比较相信严选的东西，我也推荐给好朋友，希望严选不会让大家失望，我会继续支持的。",2017-12-27 13:42:40
1165064,5,"这个袜子，如果可以，我会无限回购，很好穿，厚薄适中，弹性好，不掉色，喜欢。",2018-02-06 01:13:19
1165064,5,"袜子保暖不错，但容易掉毛",2017-12-29 00:36:04
1165064,5,"会起毛球（黑色的）",2017-11-15 00:12:41
1165064,5,"摸着很柔软，穿上脚更舒服，又暖又软，这个冬天有它真好",2018-01-04 11:33:31
1165064,5,"一直想买铁锅，这次下手，看着还不错，使用后看效果，保养应该比较麻烦",2018-01-04 14:05:15
1165064,5,"袜子很舒服，同事说也要买，整个办公室都怪我让他们中了严选的毒",2017-12-05 09:56:52
1165064,5,"袜子很一般",2017-12-28 21:59:32
1165064,5,"羊毛比例不高，摸上去比较厚，有待穿上检验质量",2017-11-15 07:51:14
1165064,5,"还不错，就是感觉有点硬有点扎，不知道穿上后的感觉怎么样，等深秋降温了试试",2017-10-01 08:22:43
1165064,5,"这个商品我非常满意，保温效果好，各个方面还都挺不错呃呃呃。",2018-03-01 08:47:03
1165064,5,"给爸妈买的，他们很喜欢。说好暖和。网易现在是越来越贴心了哈",2018-01-01 09:43:28
1165064,5,"袜子穿上很舒服的。不得不说网易严选同价位的东西比其他的好多了。",2017-12-02 09:29:36
1165064,5,"质量很好，很厚实，价格实惠，严选真的很棒，解除了我的选择恐惧症，但愿品种越来越完善！",2017-10-15 22:23:08
1165064,5,"不错，自己用，合脚，柔顺贴脚，保暖效果好，没有明显的起球，推荐购买。",2018-01-30 10:25:59
1165064,5,"买严选的东西有点上瘾，产品质量确实好，价格还便宜。先给自己买了，无论颜色还是材质都非常满意，必须给老公买。",2017-12-18 11:05:01
1165064,5,"床垫品质很不错，是印尼乳胶床垫价格的1/3！估计以后是严选控啦！",2017-11-16 19:04:32
1165064,5,"手感很好噢 还未上脚<U+0001F609> 应该不错 相信网易O(∩_∩)O",2017-12-29 20:05:47
1165064,5,"包装很好，袜子穿着很舒适，尤其袜口的设计很合理，松紧适中",2018-02-24 18:09:43
1165064,5,"哦哦哦摸摸",2017-12-23 11:50:11
1165064,4,"这袜子没有全棉那个49的好",2017-12-27 19:16:40
1165064,5,"袜子穿了三双了，不起球，很柔滑，不紧绷，弹力还不错，保暖性也好，质量和20块一双的袜子差不多，价格合理，赞",2017-12-14 10:23:08
1165064,5,"挺暖和的，唯一就是起球！",2017-12-27 22:18:45
1165064,5,"第二次购买，东西确实不错，性价比较高，缺点是稍稍薄了一点，总之比较满意",2017-12-25 18:15:09
1165064,5,"有点起球",2017-12-26 06:57:09
1165064,5,"给媳妇买了一堆，她全都喜欢，只有这一件是我的，我也很喜欢",2017-12-24 13:40:24
1165064,5,"还是滴滴死的绝对绝对娇滴滴的家",2017-12-27 19:41:17
1165064,5,"第一次买严选的东西 ，质量确实好，包装特别夸张，几双袜子用了好大一个箱子。",2017-12-23 21:46:21
1165064,5,"质量好，物流快，相信严选。最近还买了内衣裤、拖鞋等，质量都很好。",2018-01-20 14:24:32
1165064,5,"很好的袜子，已经第二次购买，不起球，穿上又暖和，买了三盒了，很满意",2017-11-22 11:47:48
1165064,5,"很好很不错，但是容易起球，毕竟羊毛。",2017-12-26 22:54:33
1165064,5,"很舒服，适合冬天穿，就是颜色太单一了，希望出一些骚一点的花色",2018-01-17 14:32:46
1165064,5,"买羊绒围巾送的羊毛袜，看起来很不错，天冷了，正好可以穿上，很喜欢",2017-11-19 23:05:45
1165064,5,"很满意，手感很好，做工也非常好，摸上去就觉得很暖和",2018-03-08 20:28:53
1165064,5,"质量很好，手感不错，就是稍微有点厚。如果跟秋天袜子厚薄就好了，毕竟现在屋里都有暖气空调，出面有车，不太冷。",2017-12-31 12:57:24
1165064,5,"材质和尺寸都还不村不呢，加油哦，大有回购可能",2018-03-07 20:16:35
1165064,5,"自从使用网易严选的袜子，就再也没有到其它地方买过袜子，袜子真的相当的好，物廉价美，选择严选没错的！",2017-12-30 16:15:01
1165064,5,"自从使用网易严选的袜子，就再也没有到其它地方买过袜子，袜子真的相当的好，物廉价美，选择严选没错的！",2017-12-30 16:15:07
1165064,5,"一拆快递直接丢洗衣机洗了，忘记拍照了，质量非常好，非常满意！网易严选值得信赖！",2017-11-17 09:48:49
1165064,5,"刚穿时天不太冷    很暖和    今年超冷    换上就没再脱过",2018-01-13 17:41:33
1165064,5,"袜子比较厚，一口气买了4盒。满500送1盒。手感还不错，穿着也很舒服。",2017-12-14 22:44:56
1165064,5,"袜子比较厚，一口气买了4盒。满500送1盒。手感还不错，穿着也很舒服。",2017-12-14 22:45:02
1165064,5,"袜子比较厚，一口气买了4盒。满500送1盒。手感还不错，穿着也很舒服。",2017-12-14 22:45:17
1165064,5,"毛线袜子！不好穿.越穿越大.上次买的短裤也穿2次就变型了.去年999买的大衣现在也收水了！根本不能穿！准备卸载严选了",2017-12-27 00:10:36
1165064,5,"很舒服，暂时没发现起球的情况",2017-12-27 23:04:10
1165064,5,"觉得化纤成分比较多，但是免费领的，还要什么自行车。",2017-12-26 18:34:16
1165064,5,"相信严选的品质，摸上去质量不错，做工都很好，快递速度很快，穿上很暖和。",2017-11-15 21:20:39
1165064,3,"袜子容易起球，，，什么双十一双十二怕都是假活动，双十二比平时限时购要贵十几块",2017-12-26 14:31:15
1165064,5,"摸着手感还是很OK的。这是严选的第一单。",2017-12-26 23:43:39
1165064,1,"这个真的是在严选买过最不推荐的东西了 买之前没看百分之五十多的化纤 一点汗都不吸 奉劝各位脚容易出汗的还是考虑清楚再买",2017-12-25 23:52:18
1165064,5,"有点像尼龙的，不过穿着还行",2017-12-27 09:19:58
1165064,5,"非常好很好吃呀，女朋友很喜欢，都转圈圈了，让我一顿开心哈哈哈",2017-12-13 14:56:54
1165064,5,"好暖和好舒服 就是有一丢丢短 坐着时容易露腿",2018-02-07 21:07:31
1165064,5,"鞋子非常满意，质量，脚感，造型都非常好，上脚一穿就知道咋回事",2017-12-12 13:43:40
1165064,5,"一般般，不柔软",2017-12-25 16:00:32
1165064,5,"质量非常好，好的品质上手就能感觉出来，好的生活，其实不贵，让我这个网购比较少的人都化身剁手党。",2018-01-18 12:23:22
1165064,5,"还行吧，挺厚实的，严选一直偏贵，也没有买过类似的袜子，好评吧。",2017-11-12 07:58:55
1165064,5,"起球",2017-12-26 13:51:31
1165064,5,"很舒服保暖的棉袜，稍微有点起球",2017-12-14 08:50:19
1165064,3,"穿着舒服，但是穿了几天就起球了",2017-11-18 13:09:04
1165064,5,"穿一次起一次球 糟心 这一款需要改进一下",2017-12-26 21:07:15
1165064,4,"袜子质量很不错，但是我42的脚，穿着有点大",2017-11-13 15:50:58
1165064,5,"没袜子了 买了感觉 很不错 以后的袜子都在网易上买了",2018-01-06 23:16:05
1165064,5,"买给男朋友的，他说很温暖很舒服，其实他从来不穿羊毛混纺的觉得很不舒服，但是这款袜子他觉得完全没问题",2017-11-26 16:21:42
1165064,5,"质量非常好！先买了女袜，再来买的男袜，下次再来~",2018-01-31 22:25:01
1165064,5,"质量非常好！先买了女袜，再来买的男袜，下次再来~",2018-01-31 22:25:07
1165064,5,"质量非常好！先买了女袜，再来买的男袜，下次再来~",2018-01-31 22:25:15
1165064,5,"袜子很大很舒服，哈哈哈，特别好用，很暖和，网易严选很棒，一直在支持",2018-01-04 13:18:05
1165064,5,"很厚，很柔软，里面也很细致，比淘宝的东西好太多了，严选的东西每件都很满意，早就想找这么一个良心店了！",2017-12-20 16:23:48
1165064,5,"我很喜欢这些要不舒适的小配件，这个看起来很赞， 连外包装都舍不得扔。做得很好~~ 做的很好，很暖和",2017-11-25 10:07:29
1165064,5,"很好，很不错，非常满意，信任网易，中了严选的毒了",2018-03-13 10:23:38
1165064,5,"袜子质量好，暖和。儿子试了一天，剩下三双都被他抢去了",2018-01-30 16:11:22
1165064,5,"还没穿，感觉不错的，不管冬天还是夏天，都喜欢一天换一双袜子",2018-01-30 19:42:14
1165064,5,"质量特别好，严选家的东西用一次就知道是你想要的",2018-02-22 08:51:20
1165064,5,"袜子很瓷实，抗造，吸汗性稍微查了一点，但好在好像有防异味功能，严选的内衣什么的还是很有质量把关的，买着放心",2018-02-20 08:42:28
1165064,5,"买回来办公室同事摸了摸手感，直接回了我一句：帮我买一盒.",2018-01-29 23:31:21
1165064,5,"给老公买的，穿着舒适，很不错的。
下次还会来的。",2018-02-21 08:12:33
1165064,5,"感觉还可以，包装不错，袜子目前穿着还比较舒服，四季袜子不厚不薄。",2017-12-31 11:37:03
1165064,5,"很舒服棒棒哒，很舒服棒棒哒，很舒服棒棒哒，",2018-03-09 11:20:49
1165064,5,"很舒服棒棒哒，很舒服棒棒哒，很舒服棒棒哒，",2018-03-09 11:21:03
1165064,5,"老公不经常换袜子，给他多买几双，让他一天一换",2018-03-08 10:34:43
1165064,5,"袜子的质量非常好，用了55元的券，每双才6元多，太划算了！",2017-12-29 11:03:28
1165064,5,"老公穿了说很舒服，严选的东西可以闭着眼睛买了，质量都不错。",2017-12-29 22:23:54
1165064,5,"颜色稳重，有条纹，商务穿不错，混了羊毛，手感并不刺手，耐穿会回购。",2017-11-30 15:52:24
1165064,5,"质量不是一般的好！真是故有其名啊！棒棒哒！没有异味，没有损坏，没有不属实！大家都来选择吧",2017-10-05 16:16:55
1165064,5,"不够吸汗",2017-12-26 19:21:23
1165064,2,"这个真的不太好，不吸汗，容易臭",2017-12-03 00:14:53
1165064,5,"宝贝收到了，非常满意，试穿一下很合脚，比以前买的袜子不同，穿着很舒服又保暖一次明智的选择，下次还会光顾。",2017-11-19 23:59:18
1165064,5,"质量还是蛮不错的，感觉有点长，卷起来穿穿试试",2018-02-15 10:01:30
1165064,5,"为了凑单买的几样小物件，没想到质量都好棒！意外的满意",2017-12-27 17:19:50
1165064,5,"First time to buy wool socks in such a nice price. Hope it work really will. Guess I&#39;ll give it try tomorrow morning. Dame freezing cold in Hunan.",2017-11-18 22:11:24
1165064,5,"刚刚拿到手，基本还可以，就是袜子貌似丑了点。对我来说紧了。",2017-11-27 19:28:18
1165064,5,"袜子不错，就是物流速度一般，虽然用的是京东的物流。支持严选！",2017-12-24 21:48:36
1165064,5,"袜子不错，就是物流速度一般，虽然用的是京东的物流。支持严选！",2017-12-24 21:48:42
1165064,3,"怎么全是一个颜色呢",2017-12-22 15:57:37
1165064,5,"袜子还算不错，比较厚实。相对也比较大，有起球现象。",2018-02-27 19:58:21
1165064,5,"挺不错的，自己买了一组，这是第二次买，送给爸妈。",2018-03-12 14:28:30
1165064,5,"还不错，挺厚的，适合冬季穿，不用怕冻脚腕了<U+0001F604><U+0001F604>",2017-12-21 22:44:04
1165064,5,"不错，有点小贵了。不过穿起还是不错的。继续在严选上买。。。",2018-01-16 14:12:49
1165064,5,"袜口有点松，其他还好",2017-12-25 11:56:10
1165064,5,"东西很不错，网易严选现在已经成为了主要的购买地了，希望以后在保证更优秀的质量同时，提供更多的货物种类，祝蒸蒸日上。",2017-12-06 14:01:26
1165064,5,"穿着挺好的，舒服脚感不错，包装也很用心，就是收口有点松",2017-12-20 12:12:04
1165064,5,"严选上的商品质量就是好，淘宝上假货太多了，满意的一次购物",2017-12-20 11:04:25
1165064,5,"质量很好，穿着也很舒适。
比超市卖的三四十的都好。",2018-01-15 18:14:32
1165064,5,"晴纶含量太高了。",2017-12-24 13:57:59
1165064,5,"还没看，无条件的相信严选的质量，发的还是顺丰，棒棒哒",2017-11-22 09:05:01
1165064,5,"双十一买的，送的福袋有不少惊喜，很喜欢在严选买东西，诚信的厂商。",2017-11-22 07:20:02
1165064,5,"质量还不错，如果能有羊毛和纯棉混纺的更好了。",2018-02-24 20:35:16
1165064,5,"严远真的没让人失望过，价格实惠，东西品质很不错，真的用心做网商！",2017-11-21 10:27:03
1165064,3,"看着不错，但是穿了一次就开始起毛球，越穿毛球越多。",2017-12-25 09:39:21
1165064,5,"真是没想到网易严选的质量比高几倍价格的大牌还要好",2018-01-13 18:16:53
1165064,5,"袜子质量不错，是有羊毛的，适合这个季节穿，第一次在网易严选买东西，好评。",2017-12-18 10:49:00
1165064,5,"质量真心不错，以前只在实体店里购买，现在多了一个选择",2018-02-22 15:43:30
1165064,5,"严选的东西很赞，省得挑来挑区，直接上严选就行。",2018-02-21 12:45:37
1165064,5,"多次购买了，认准你们家的，价格质量没话可说的",2018-02-21 13:16:24
1165064,5,"袜子质量非常好，老公很喜欢，就严选了，下次还会来的。",2018-02-03 09:33:39
1165064,1,"才穿一次就起球成这样了，不开心",2017-12-03 00:04:25
