"itemId","star","content","createTime"
1199021,2,"质量不太好，轮子上的挡泥板居然是塑料的，而且还很薄。组装麻烦，实物与说明书不一样，把手和说明书上的不一样，弄了半天没装好。感觉问题好多！几百块钱有点不值。发货是两个物流，一个京东，一个顺丰，而且是赠品先发的货！",2018-04-13 22:05:08
1199021,5,"严选的质量一直很放心，一如既往的好",2018-05-26 09:12:36
1199021,5,"车子看着还不错啦",2018-05-26 21:57:55
1199021,5,"很好，很漂亮，小朋友很喜欢",2018-05-23 18:38:01
1199021,5,"哈哈哈哈哈哈哈哈哈<U+0001F44C>",2018-05-23 20:50:05
1199021,5,"好玩，有点大",2018-05-22 19:51:42
1199021,5,"座椅调高后2岁半孩子还挺合适的，车子很稳，孩子很喜欢",2018-03-29 11:14:13
1199021,5,"售后非常好......本来想说一下细节，夸夸你们，天知道怎么会有哪句话是敏感词，都是平常话啊！",2018-04-05 10:09:36
1199021,5,"车子很结实不错",2018-05-16 01:05:13
1199021,5,"给小外甥买的，他很喜欢，质量没得说呀，不错！",2018-05-01 17:14:06
1199021,5,"挺好的 安装也还是比较方便",2018-05-13 10:01:14
1199021,5,"服务周到，年前买的小车，但快递过来时造成车篮破损，年后直更换了新车篮过来。",2018-03-14 01:39:59
1199021,5,"质量非常好，儿子很喜欢，就是车子有些沉，搬起太辛苦",2018-04-19 11:19:16
1199021,5,"质量很好，颜值高，很满意",2018-05-12 21:15:34
1199021,5,"很酷，儿子很喜欢，就是后面的挡泥板少了个螺母，没法装",2018-04-05 21:43:58
1199021,5,"东西很棒很有质感。 就是缺少后轮泥瓦挡板的螺丝螺母。后轮泥瓦挡板没法安装。",2018-03-27 22:18:23
1199021,5,"材质不错，做工精致，颜色很正！",2018-05-10 22:33:47
1199021,5,"宝宝喜欢，第一天就上手了",2018-05-07 16:47:25
1199021,5,"自行车很酷，宝宝很喜欢，爱不释手",2018-05-07 10:06:06
1199021,5,"很有质感，车身也很重，质量和淘宝上的两百的完全不同，就是后轮上的挡泥板不是特别合理，容易碰到车轮，不过总体好评",2018-07-12 12:45:49
1199021,5,"快递员速度一如既往的快 ，送人的，网易的质量无可挑剔",2018-04-11 18:29:08
1199021,5,"女儿很喜欢，每天骑。",2018-05-02 20:24:12
1199021,5,"这车质量真是没得说，做工也够精细，感觉很安全",2018-04-09 08:58:27
1199021,5,"东西是还行，但这刚买你们就降价，有考虑过消费者情绪吗？你们这平台运营也太乱了吧？都是618活动购买，有意思吗？",2018-06-17 22:25:12
1199021,5,"自行车很棒，很沉，轮胎也宽",2018-05-01 21:18:54
1199021,5,"还没有开始用，但是一定不会让我失望的，很信严选",2018-04-15 17:26:05
1199021,5,"好",2018-04-28 12:12:45
1199021,5,"自行车质量很好，唯一的不足是辅助轮不是静音的，可以改进",2018-06-04 14:07:34
1199021,5,"还不错，就是刹车线没从洞里穿。",2018-04-24 15:48:52
1199021,5,"很高大上",2018-04-23 13:14:15
1199021,5,"质量很好，网易严选很不错！",2018-04-22 08:54:06
1199021,5,"质量不错，装起来废了一些功夫，自行车有些沉，孩子现在骑起来有些费劲",2018-04-17 10:25:14
1199021,5,"车子不错",2018-04-21 22:41:40
1199021,5,"好",2018-04-21 17:29:34
1199021,5,"给侄子买的，还没图呢，据说很不错",2018-04-18 16:09:59
1199021,5,"质量挺好的，只是后面轮胎的挡板小朋友容易碰到，就会擦到轮胎",2018-04-17 17:53:26
1199021,5,"超级太好骑了，儿子天天都要坐……",2018-04-19 00:19:51
1199021,5,"很不错的车子",2018-04-19 19:36:16
1199021,5,"样子挺漂亮的，就是后挡泥板安装好像不牢固，没设计好",2018-06-08 09:44:13
1199021,5,"小朋友挺喜欢",2018-04-19 12:43:38
1199021,5,"闺女比较喜欢",2018-04-19 02:07:58
1199021,5,"还不错",2018-04-19 18:36:41
1199021,5,"质量非常好，车身牢固可靠，硬度很高而且很重，轮胎很大加厚耐磨防滑，抓地力强，很安全耐用，座椅可以调节很舒适，外观也很漂亮酷炫，非常满意，宝贝很喜欢，值得拥有！",2018-04-18 16:38:19
1199021,5,"车子质量不错，就是安装时不知道是不是螺丝放错了，后轮挡泥板怎么也固定不紧，最后自己换了颗螺丝搞定了！",2018-04-12 10:29:11
1199021,5,"还不错，送人的",2018-04-16 11:35:34
1199021,5,"小朋友很喜欢",2018-04-16 15:43:22
1199021,5,"很漂亮，质量还行",2018-04-15 18:46:41
1199021,5,"总体来说还是不错的，自行车有些瑕疵后来通过沟通也解决了",2018-05-24 15:15:31
1199021,4,"很不错！后瓦磨轮胎，处理一下就好。",2018-04-14 07:43:40
1199021,5,"孩子挺喜欢",2018-04-14 18:54:34
1199021,5,"小车很漂亮",2018-04-14 12:47:06
1199021,4,"颜色很好看，装好后，后挡泥板有些问题，与轮胎摩擦。",2018-05-31 00:03:03
1199021,5,"好",2018-04-14 00:01:52
1199021,5,"不错",2018-04-14 11:59:29
1199021,5,"质量很好！只是刹车有点紧，不会调…",2018-06-09 14:10:58
1199021,5,"收到货马上组装，一个小时搞定，满意",2018-04-13 18:55:20
1199021,5,"质量很好的车子，很酷，儿子很喜欢！",2018-04-13 22:05:46
1199021,5,"还没拆包装，先好评",2018-04-13 15:14:24
1199021,5,"很好、质量杠杠滴、",2018-04-13 18:19:36
1199021,5,"质量很不错，但是挡泥板装上以后有点低。",2018-06-02 13:05:09
1199021,5,"货已收到，谢谢老板。",2018-04-12 07:31:34
1199021,5,"好玩",2018-04-11 00:33:12
1199021,5,"就是有些部位安装之后比较奇怪 会晃动",2018-05-26 08:19:50
1199021,5,"一般般",2018-04-10 20:54:57
1199021,5,"很好",2018-04-10 18:10:23
1199021,5,"非常棒！",2018-04-08 00:04:20
1199021,5,"东西很好，可是小孩子还要等着长大才能使用",2018-03-31 12:26:36
1199021,3,"骑起来很重。后轮端起来，猛踩一脚转不了几圈。",2018-04-01 08:24:58
1199021,5,"质量非常好，儿子喜欢的不得了",2018-04-06 23:33:54
1199021,5,"很满意，性价比相当高。",2018-04-05 23:26:14
1199021,5,"不错，高大上！！！",2018-04-05 22:09:09
1199021,5,"小车子整体很不错！
说几点意见让厂家改进下：
1) 坐垫掉色比较明显
2) 坐凳调节不便，传统的螺丝，应更换成共享单车那种的
3) 后挡泥板安装后，使用十分不便，没办法还得卸了
4) 两个辅助轮总拧紧后总是一前一后的，车子歪歪斜斜的
5) 附送的扳手，扣子偏大了，使用很不便！",2018-05-02 17:24:03
1199021,5,"好",2018-03-31 01:37:36
1199021,5,"质量很好，宝宝喜欢，送人的，没来得及拍照",2018-03-29 18:19:20
1199021,5,"正4岁没问题。质量很好。非常满意",2018-03-30 13:52:07
1199021,3,"自行车没有想象中的好，一般般，做工不精细，不值得推荐",2018-04-13 08:23:05
1199021,5,"宝宝非常喜欢",2018-03-30 08:40:30
1199021,5,"非常非常非常的不错非常非常非常的不错",2018-03-29 07:11:27
1199021,5,"非常满意",2018-03-29 22:39:39
1199021,5,"安装有点声音 奇怪 得去修车那看看",2018-04-16 09:25:27
1199021,5,"不错",2018-03-28 23:11:48
1199021,5,"好",2018-03-23 15:59:59
1199021,5,"质量好",2018-03-21 17:43:42
1199021,4,"车身重，车头轻，孩子说骑着还行。后面挡泥板的安装螺丝没发，不过也没打算装，就算了。前挡泥板固定的铁皮软，常常掉下去了，要自己掰起来。改天也卸掉。重要的是，我家孩子已经不用辅助轮了，但是没用车撑子，不好停车。小区自行车店25装了一个。其实应该配车撑子，14寸的自行车，很多孩子都不用辅助轮了。",2018-04-16 13:54:49
1199021,5,"非常漂亮",2018-03-20 11:40:27
1199021,5,"很好！小朋友非常喜欢！
做工很精细！！",2018-03-17 10:47:14
1199021,5,"车子挺重的 看起来不错",2018-03-17 11:04:08
1199021,5,"收到货时已基本安装好，孩子很喜欢。几个小问题：牙盘转动时在固定一个地方有卡顿、两条刹车线未从车篮安装架中间的孔穿过、后轮刹车好像有点紧，工艺有待提到。",2018-04-15 07:03:13
1199021,5,"宝宝很喜欢",2018-03-16 15:50:03
1199021,5,"质量很好，宝贝很喜欢",2018-03-14 22:22:39
1199021,5,"物有所值。",2018-03-14 09:09:10
1199021,5,"努力半天，装了，支撑轮不太好",2018-04-14 17:45:47
1199021,5,"做工扎实，对得起严选品质。孩子很喜欢",2018-03-13 22:08:04
1199021,5,"不错 组装了下",2018-03-13 13:52:46
1199021,5,"好",2018-03-13 19:55:36
1199021,4,"一、后轮挡泥板装不稳，螺丝长太多 螺帽转两圈就转不下去了，无法固定住；二、篮子那也存在同样的问题，螺丝长 螺帽无法很好固定 导致篮子摇摇晃晃的
样子还不错 挺好看 就是觉得这价钱 产品零部件做工应该更准确精细",2018-04-14 01:31:10
1199021,5,"刚组装好 看起来挺有品质 还需要使用一段时间检验 儿子挺喜欢的 不错 说明书再详细点应该",2018-02-23 21:00:11
1199021,5,"很好，车身比较重，因此很稳重！小孩之前没骑过自行车，第一次骑就会了，很兴奋！",2017-12-27 16:29:02
1199021,5,"车铃铛少了一个螺丝钉，客服很耐心地解决了，服务满分！质量满分！",2018-03-03 16:32:10
1199021,5,"组装相对简单，看了一遍视频，就组装出来了。但是感觉踩动起来，不是那么顺滑，同时，辅助轮好像也不是很平，不知道是不是组装的问题。",2018-03-17 18:09:24
1199021,5,"孩子三岁半，14英寸的自行车非常合适。做工优良，车身非常重。就是后轮的挡泥板老是碰到车轮。整体来讲，非常满意。相信严选的品质",2018-02-01 15:40:18
1199021,5,"质量杠杠的，孩子很喜欢，严选让我停不下来肿么办？<U+0001F648><U+0001F648>",2017-12-19 21:15:12
1199021,4,"质量蛮好的，值得选购。就是太难装了，指南针加响铃装坏了。",2018-01-16 10:05:24
1199021,4,"车子的质量应该是不错的，但是安装说明极其简陋，需要自己摸索一下，而且有些细节，比如车闸和轮子的间隙，挡泥板的轮子的间隙，做的不好，不过一分钱一分货，对得起这个价格",2018-03-16 11:51:02
1199021,5,"外观漂亮，质量不错，
后雨挡太翘了，能平些感觉更好",2018-02-03 00:40:17
1199021,5,"真的很酷的自行车，一看就是质量很好，女儿很喜欢",2018-02-27 13:40:27
1199021,5,"这款儿童车颜值很高，但就是比较重外出有点不方便",2018-02-07 02:09:02
1199021,5,"车子挺扎实的 有几个螺丝确实不太合适",2018-03-13 13:49:41
1199021,5,"严选直接真是杠杠滴，外甥女很喜欢<U+0001F618>",2018-03-11 23:49:38
1199021,5,"看起来质感不错",2018-03-12 12:39:10
1199021,5,"还不错",2018-03-11 16:02:40
1199021,1,"缺一个螺丝，都不给我补寄，客服让我去五金店买，然后要五金店开收据才给报销。差评！！！！！！！",2018-02-22 14:02:28
1199021,5,"特别好，孩子喜欢。质量很好。值得信赖",2018-03-09 13:23:55
1199021,5,"宝贝挺喜欢的，也很重",2018-03-09 20:39:16
1199021,5,"不错，赞一个",2018-03-09 10:09:06
1199021,5,"儿子特别喜欢，就是安装比较麻烦，自己组装的不放心
如果商家配个视频下载安装就好了",2017-12-03 23:57:49
1199021,5,"很好",2018-03-09 14:25:20
1199021,5,"非常棒的自行车，比较重，很稳，外形也拉风，男宝女宝都适合",2018-01-16 22:33:21
1199021,5,"质量很好，颜值高，孩子非常喜欢！",2018-03-06 23:32:10
1199021,5,"自己完全不会安装，后来找了个自行车摊花十块钱装好了，下次可以把安装视频直接放在产品描述里吗",2018-01-02 13:08:05
1199021,5,"质量很好，安装也很简单",2018-03-05 11:31:52
1199021,5,"不错好看",2018-03-04 18:41:15
1199021,5,"很亮眼，非常不错",2018-02-27 08:40:20
1199021,1,"安装问题，产品经理自己安装过吗？所有的螺母都是封了胶圈的，没有辅助工具根本扭不上，用了辅助工具就一定弄花车，又弄痛手，这是在网易体验最差的一次，安装过程和视频中的安装过程完全不匹配",2017-12-29 10:37:07
1199021,5,"质量很好",2018-02-27 06:05:39
1199021,5,"超级好，送人的",2018-02-25 16:59:23
1199021,5,"质量很好，非常不错",2018-02-24 23:48:26
1199021,5,"质量很好，组装示意图基本是垃圾，很难装",2017-12-24 13:36:50
1199021,5,"安装简单，材质结实！",2018-02-24 11:14:57
1199021,5,"挺好的小车",2018-02-24 10:42:50
1199021,5,"已经安装好了，很漂亮！",2018-02-17 13:01:39
1199021,5,"车子不错，就是装起来非常费劲",2017-12-18 01:11:11
1199021,5,"不错！",2018-02-16 11:26:07
1199021,5,"好",2018-02-12 16:27:30
1199021,5,"不错",2018-02-11 10:16:53
1199021,5,"车身还是蛮扎实，就是两个挡泥板看着比较脆弱，容易晃动，铃铛习惯用右手，已经安装在左手边有点别扭。",2018-03-03 21:45:47
1199021,5,"特别好，颜值质量都无可挑剔，就是比较难组装",2018-01-31 09:47:11
1199021,5,"质量很好，安装方便，早买了，今天才用，评价迟了。",2018-01-22 23:12:04
1199021,5,"必须滴赞<U+0001F44D>一个，总体感觉扎实，商家良心厚道。产品漆面亮滑，接头焊接技术好，颜值高大上。工具配套齐备，安装简单容易。宝宝拿到东西就爱不释手了。",2018-01-22 11:00:37
1199021,5,"安装了一个小时 篮子少了一个螺丝螺帽 客服说会寄过来 不过要等一段时间",2018-03-13 09:39:52
1199021,5,"I硭团笥训暮⒆樱]用，不^真是沉。",2018-01-08 17:09:09
1199021,5,"满意",2018-02-06 21:00:58
1199021,5,"高端大气上档次！娃很喜欢",2018-02-04 16:39:20
1199021,5,"宝宝很喜欢。质量很好。安装有点累。另外设计有点小缺陷，链条会磨保护壳。但瑕不掩瑜",2018-01-09 17:26:40
1199021,5,"女娃1.08身高，很合适。安装方便。",2018-02-03 13:41:10
1199021,5,"买给外甥 她很喜欢",2018-02-03 11:59:47
1199021,5,"质感很强，颜色漂亮，小朋友喜欢",2018-02-01 19:09:45
1199021,4,"组装还是有点小细节问题，比如车筐有点歪，车铃不太适合三四岁小朋友用等，当然整体还是不错的，希望以后做的更好",2018-03-12 22:41:34
1199021,5,"儿子很喜欢，质量也不错！",2018-01-28 12:32:54
1199021,5,"挺重的 还可以吧",2018-01-27 15:05:13
1199021,5,"侄子很喜欢哪",2018-01-18 18:06:44
1199021,5,"没有想象中质量好，有些螺丝根本拧不进去，后面的档沙板也装不上",2017-11-23 16:13:34
1199021,5,"侄女生日礼物，特别喜欢",2018-01-16 01:14:01
1199021,5,"宝宝很喜欢",2018-01-11 21:55:18
1199021,5,"特别满意",2018-01-11 09:12:37
1199021,5,"不知是否没调好的原因还是其他，不太好骑",2018-02-28 12:39:58
1199021,5,"很好组装",2018-01-10 22:45:23
1199021,5,"特别好",2018-01-10 10:01:41
1199021,5,"质量不错，宝宝喜欢",2018-01-06 12:38:56
1199021,5,"车子非常重，大人搬都很费劲，感觉宝宝骑起来有些费劲，在家里瓷砖上还能骑几圈，户外水泥地基本要靠大人推着走了，也许宝宝大一点就好了，现在宝宝还不到3岁。除了这一点，其他都还满意，这个价格挺划算的，还送了一个宝宝吸管杯，虽然是赠品，质量也是很好，确实是好的生活没那么贵<U+0001F604>",2018-02-21 14:39:31
1199021,5,"很棒的产品，小宝宝很喜欢，很酷炫",2018-01-04 14:53:59
1199021,5,"商品质量好，很满意！",2018-01-02 17:27:29
1199021,5,"质量不错",2018-01-05 21:18:34
1199021,5,"很扎实，孩子超级喜欢",2018-01-04 12:00:15
1199021,5,"车还不错，就是后面的挡泥板做的不太好，总是碰到轮胎，有摩擦",2017-11-18 20:00:59
1199021,5,"送给朋友孩子 全家满意，严选值得信赖",2017-12-31 11:30:00
1199021,5,"很好，重一点好，货真价实，儿子非常喜欢",2017-12-30 10:54:07
1199021,5,"好，就是安装有点麻烦",2018-02-03 21:40:43
1199021,5,"满意",2017-12-30 19:31:56
1199021,5,"质量和颜值都非常好",2017-12-28 12:19:32
1199021,5,"颜值超高，很棒",2017-12-28 13:02:16
1199021,5,"有点小问题退了",2017-12-31 22:48:18
1199021,5,"很好，送的水壶也很喜欢",2017-12-27 10:53:23
1199021,5,"够重，没打气的东西",2017-12-27 21:23:30
1199021,5,"不错，挺好！",2017-12-26 19:01:32
1199021,4,"链条太紧了 小孩子踩着有点费劲",2017-12-08 08:09:31
1199021,5,"hao",2017-12-26 23:49:06
1199021,5,"不错，质量很高，很时尚，",2017-12-25 13:16:04
1199021,5,"自行车太好了，看着就接解释牢固并且对法拉利制造商的信任是肯定的，所以宝贝非常喜欢，宝贝身高113CM体重19KG，着自行车非常合适，赞",2017-11-23 08:59:45
1199021,5,"挡泥板无法安装，售后服务界面完全没考虑用户方便，要我订单号，我就要退出，然后再进去就是排队等待，网易严选的程序产品经理是脑袋有问题吗",2017-11-21 12:30:42
1199021,5,"挺重的，",2017-12-24 09:50:49
1199021,5,"还不错，女汉子妈妈装好了，娃很喜欢",2017-12-21 15:27:40
1199021,5,"自行车绝对",2017-12-23 14:05:15
1199021,5,"质量很好，就是高了点，小孩不敢骑。",2017-11-20 12:34:01
1199021,5,"还没安装，看起来还行",2017-12-16 16:37:32
1199021,5,"不错 孩子喜欢",2017-12-18 08:13:23
1199021,5,"不错",2017-12-18 10:02:37
1199021,1,"这个车后面的挡板一直装不上，螺丝有问题",2017-11-18 08:29:54
1199021,5,"不错不错，非常好",2017-12-13 09:02:49
1199021,5,"不错，值得一买",2017-12-12 18:09:00
1199021,5,"很赞。",2017-12-12 16:18:39
1199021,3,"说明书跟实物不一致，小朋友骑起来很费劲",2017-11-18 14:05:14
1199021,5,"还可以，就是太重了，略笨",2018-08-13 12:00:04
1199021,5,"宝贝不错，挺值得购买的",2017-12-11 10:04:10
1199021,5,"质量超赞 侄子很喜欢 胎比其他童车粗 完美",2017-12-06 08:16:32
1199021,5,"送朋友孙子的，相信会喜欢",2017-12-08 11:25:34
1199021,1,"踏板安装不了，已退货。车身太重。",2017-11-16 12:38:22
1199021,5,"哈哈哈还好还好好",2017-12-08 23:18:38
1199021,5,"不错",2017-12-08 00:20:11
1199021,5,"后轮的两个平衡轮建议改小一点，目前平衡轮和后轮都在一个水平线，地面不平的时候后轮容易悬空，后轮空转就没法前进了。",2018-07-16 16:46:33
1199021,4,"质量嗯好，如果配套头盔就更好了",2017-12-06 21:29:49
1199021,5,"不错，很快组装好了",2017-12-06 23:29:01
1199021,5,"孩子很喜欢 非常好的一款自行车",2017-11-30 07:59:37
1199021,5,"不e，很，BB超垩健",2017-11-28 23:48:25
1199021,5,"质量很好",2017-11-27 23:58:39
1199021,5,"车子很好，有点重。",2017-11-23 11:08:01
1199021,5,"还可以，有点重。价格适中",2017-11-22 20:08:57
1199021,5,"刚收到",2017-11-22 09:02:09
1199021,5,"不错",2017-11-21 11:35:32
1199021,5,"很棒的儿童自行车，大品牌",2017-11-19 11:38:19
1199021,5,"非常好",2017-11-19 20:10:06
1199021,5,"孩子很喜欢，很值",2017-11-18 17:31:44
1199021,5,"一入严选深似海！无论是价格还是产品质量还是物流环节，整个消费体验感十足的让人感动！于是带着同事朋友一起买买买买买！不光自己要努力过上好的生活更要让身边的家人朋友一起感受这一份美好！希望严选能够坚持下去做更好的产品让我们过上严选style life！",2017-11-18 21:48:38
1199021,5,"挺好的",2017-11-17 19:12:22
1199021,5,"很不错",2017-11-17 00:42:26
1199021,5,"不错",2017-11-17 12:09:27
1199021,5,"颜值很是拉风。中间由于运输问题，出了点小插曲，客服也耐心的给解决了。",2018-07-21 08:58:16
1199021,5,"选择严选，网购事半功倍！",2017-11-16 23:31:06
1199021,5,"还不错",2017-11-16 13:48:39
1199021,5,"非常满意！稍后上图",2017-11-13 06:55:49
