"itemId","star","content","createTime"
1221006,5,"太硬了点，还是退了",2017-11-21 10:08:27
1221006,5,"身高189背上正合适",2017-09-29 23:39:04
1221006,5,"绝对的一模一样",2017-09-29 19:05:59
1221006,0,"质量很好，物超所值",2017-09-28 21:27:24
1221006,5,"好帅呀，给儿子买的，自己也想要",2017-09-23 21:57:49
1221006,5,"还没用，看着不错，挺结实！",2017-09-23 00:04:19
1221006,5,"讲真，设计有些复杂。还有如果不是翻盖式的就好了，书包比较深，加上是翻盖，那拿东西不方便。还有后面装电脑或衣物的空间如果装东西稍微多了，容易挤压前边。总之，看着大。",2017-11-15 10:09:04
1221006,5,"物流很快，包特别帅",2017-09-23 01:40:04
1221006,5,"确实好看",2017-09-23 12:17:43
1221006,5,"其实很大很能装东西啊！",2017-09-22 00:34:45
1221006,5,"还行",2017-09-22 12:56:36
1221006,5,"容量很大，很满意。",2017-09-21 09:18:00
1221006,5,"包还不错，型还是有的，不过里面没有大的夹层，不能放电脑",2017-10-06 19:06:20
1221006,5,"比我想象中的大....包装挺好~",2017-09-19 12:28:09
1221006,5,"男票喜欢",2017-09-19 22:53:35
1221006,5,"很满意！！",2017-09-19 07:47:00
1221006,5,"包装好。短期出差很合适哈，希望耐用。",2017-09-18 12:31:46
1221006,5,"好，很喜欢",2017-09-18 17:19:19
1221006,5,"物流快到不行。。。。一天就到了",2017-10-26 12:31:55
1221006,5,"超赞",2017-09-18 00:43:15
1221006,5,"儿子好喜欢，容量也够大",2017-09-17 19:43:54
1221006,5,"做工精细，用料考究",2017-09-17 07:51:35
1221006,5,"喜欢",2017-09-17 12:22:51
1221006,5,"质感很好设计也很棒物流也很快",2017-09-14 10:17:11
1221006,5,"包包真的不错。只是想吐槽一下 选择两种版型，一种黑色 一种拼接皮 无论点哪一种都是显示拼接皮的照片 鬼使神差的选中了黑色 结果换货重发。虽然网易退了运费 但是心里不爽 望改进",2017-09-26 07:03:25
1221006,5,"双肩包很好",2017-09-10 12:41:50
