"itemId","star","content","createTime"
1233001,5,"燕窝很干净，质量很好，还会再买",2018-04-10 20:45:53
1233001,5,"挺干净的下次还会买",2018-04-10 21:00:40
1233001,5,"还想买，怎么没了",2018-04-16 16:59:54
1233001,5,"泡发出来还是很洁净的，有很细小的毛，不过火候不好掌握。隔水炖不能时间太久，总感觉没有人家炖好的那么好，一盏泡发出来没多少，最多吃两顿",2018-04-15 09:51:41
1233001,5,"泡发率很高，炖煮有一股鸡蛋清的味道.信赖严选",2018-04-14 13:47:58
1233001,5,"大盒更划算",2018-04-10 17:26:29
1233001,5,"大盒更划算",2018-04-10 17:26:18
1233001,5,"品质好，服务好！",2018-04-10 10:16:12
1233001,5,"回购的",2018-04-10 15:36:31
1233001,5,"哈哈哈哈哈",2018-04-10 10:16:47
1233001,5,"很好",2018-04-10 03:33:16
1233001,5,"很好",2018-04-10 03:32:31
1233001,5,"燕盏很完整，是好东西，棒棒的",2018-04-09 01:33:54
1233001,5,"送美国回沪的大姐，促销划算！相信严选的品质<U+0001F44D>",2018-03-27 18:52:28
1233001,1,"买这个给老婆补补的，但不是很好，有点失望。 侧面背面明显看出来比较散，这个质量还卖这个价钱，不值。",2018-04-14 11:17:38
1233001,5,"包装有心思，感觉干净有品质。",2018-04-09 10:57:41
1233001,5,"燕窝很好 应该是正品",2018-04-09 08:27:25
1233001,5,"还没吃",2018-04-09 20:16:16
1233001,5,"这款燕窝性价比非常高，品质很好！",2018-04-07 20:05:05
1233001,5,"等待煮 看上去很干净 不过确实一盏也很小",2018-04-07 16:49:37
1233001,5,"还行吧，也就那样，只要不假就行。",2018-04-07 01:45:46
1233001,5,"不错哦！早已经吃完了。",2018-04-08 19:16:49
1233001,5,"买了好多 信任严选",2018-04-08 11:37:21
1233001,5,"不错，个大完整，就是有些许碎片，不知是不是为了凑分量。盒子里其他的是我原来药店买的小三角，三十一克，大家可以自己辨别下。",2018-04-13 09:18:12
1233001,5,"试吃中",2018-04-08 19:24:00
1233001,4,"好评",2018-04-08 21:34:44
1233001,5,"好评",2018-04-08 21:34:26
1233001,5,"不错",2018-04-08 19:28:52
1233001,5,"很好 还没吃 吃了再来评价 看着不错",2018-03-31 13:34:32
1233001,5,"吃过不错，再次购买的，淡淡的蛋香味",2018-04-07 19:04:33
1233001,5,"网易品质可靠，搞活动很划算",2018-04-07 22:26:41
1233001,5,"口感非常好<U+0001F44D>值得信赖",2018-04-07 18:54:31
1233001,5,"好吃，操作简单，很方便",2018-04-07 19:07:29
1233001,5,"回购的",2018-04-07 23:52:00
1233001,5,"非常好",2018-04-07 10:11:21
1233001,5,"商品质量好！已经第二次购买了！还会继续购买的！",2018-04-03 18:09:09
1233001,5,"以前没买过，觉得严选的可以放心。",2018-04-06 12:11:36
1233001,1,"一般般",2018-04-12 21:40:27
1233001,5,"买了一盒30克的，下单前没看仔细周年庆活动规则，应该再凑个几十块的，就可以送个50元无限额券了<U+0001F602>等到11号抢了个50元红包，又给断货了，太不合理了！",2018-04-11 22:17:58
1233001,4,"一般，都有点碎了。",2018-04-11 15:38:50
1233001,4,"有点破碎了，一般。",2018-04-11 15:40:01
1233001,5,"一直买的这款燕窝 很棒",2018-04-06 15:45:50
1233001,5,"买了好几次了，一如既往的好",2018-04-06 10:16:25
1233001,5,"感谢严选让生活更美好",2018-04-06 15:07:19
1233001,5,"东西很好，赞",2018-04-06 16:52:53
1233001,5,"很棒",2018-04-06 16:52:32
1233001,5,"燕盏的形态不算上乘，但煮好后味道很正，很赞，应该是注重了实际品质，没有让消费者把钱花在不实用的地方，性价比非常高，真真正正的良心制品。",2018-04-05 10:40:34
1233001,5,"很好，不错，味道可以",2018-04-05 12:52:55
1233001,1,"说没刷胶的站出来，我打死他！！买了两次，品质明显是不一样的。说实话第一次是好的泡出来没有这个情况，煮出来还挺香。第二次有很大块的胶，明显是产品批次有问题！",2018-04-05 23:22:11
1233001,4,"价格比之前有所上涨，而且较碎，泡发结果倒差不多",2018-04-09 11:38:13
1233001,5,"还好啦",2018-04-05 15:27:09
1233001,5,"挺好的",2018-04-05 15:26:08
1233001,5,"品质优良！",2018-04-05 21:36:58
1233001,5,"质量信得过",2018-04-05 07:57:11
1233001,5,"比起刘嘉玲代言那个品牌还是差些",2018-04-09 23:43:23
1233001,5,"还好，碰上活动还算实惠。送给别人的",2018-04-04 11:25:13
1233001,5,"基本没毛。燕条还不错",2018-04-04 22:54:02
1233001,5,"买来送人的。<U+0001F60E>",2018-04-04 00:12:59
1233001,5,"到货快，物美价廉，东西不错！",2018-04-04 20:01:35
1233001,5,"送人的，不错",2018-04-04 22:33:55
1233001,5,"干净，总体还不错",2018-04-04 10:12:45
1233001,5,"好",2018-04-04 10:13:03
1233001,5,"还没吃呢，不过看着品相很好",2018-04-02 14:29:56
1233001,5,"特别好，没怎么碎，自己掉地上摔碎了一个，说明没刷胶",2018-04-08 17:51:25
1233001,5,"不错 很纯",2018-04-03 18:30:55
1233001,5,"第二次购买了。",2018-04-03 09:49:45
1233001,5,"不错，就是燕毛越来越多了……",2018-04-07 20:13:29
1233001,5,"很满意",2018-04-03 21:53:18
1233001,5,"还不错",2018-04-03 10:15:27
1233001,5,"很好",2018-04-03 10:12:25
1233001,4,"好多毛",2018-04-03 09:52:51
1233001,5,"吃了两次了，很赞，准备坚持下去。",2018-04-02 13:42:24
1233001,5,"期待美美哒",2018-04-02 11:49:26
1233001,5,"第一次买，非常不错，很干净，准备再次囤货。推荐购买！",2018-03-29 10:06:23
1233001,5,"多次购买，泡发率还可以，挑毛没那么困难",2018-03-29 09:01:53
1233001,5,"挺大盏的，还没泡发来看。",2018-04-01 20:42:26
1233001,5,"不错，还会再次购入！",2018-04-01 14:25:57
1233001,5,"还没吃",2018-04-01 09:49:07
1233001,5,"满意",2018-04-01 15:10:10
1233001,5,"老婆说质量很好，虽然价格有点高了",2018-03-30 18:20:09
1233001,5,"很小的两盏，还没吃呢，看上去不错，但很容易碎，拿起来有小碎碎掉出来。特价买的，自己吃的话还是感觉有点小贵，吃完再来加评。",2018-04-06 09:14:54
1233001,5,"确实很干净，买了几次了，不过喝燕窝到底能怎样我也不确定啊，就是心里安慰吧",2018-04-08 10:34:56
1233001,5,"买到家就发了，晚上炖好早上吃，口感不错",2018-03-24 09:30:49
1233001,5,"第二次买给爸爸，希望他能好起来",2018-03-31 13:50:22
1233001,5,"还没有吃，等吃了再评价",2018-03-31 08:36:53
1233001,5,"第二次买，没有问题，再买",2018-03-31 13:53:34
1233001,5,"第四次购买了，很干净",2018-03-31 21:47:39
1233001,5,"很好，很干净",2018-03-31 17:55:51
1233001,5,"还不错",2018-03-31 13:08:57
1233001,5,"哦",2018-03-31 17:10:00
1233001,5,"好",2018-03-31 06:56:13
1233001,5,"非常迷你！",2018-03-30 17:30:53
1233001,5,"妈妈很喜欢，包装很好！品质看起来也不错，值得购买。",2018-03-22 21:05:01
1233001,5,"第三次买的挺满意的",2018-03-29 11:34:54
1233001,5,"严选的产品质量放心！",2018-03-29 22:59:55
1233001,5,"还没吃",2018-03-29 22:18:14
1233001,5,"发得很",2018-03-29 21:46:56
1233001,5,"比想象的小一些，不过看着比较干净。",2018-03-28 10:31:15
1233001,5,"燕盏很大，口感浓稠，非常好",2018-03-28 18:20:39
1233001,5,"网易的老客户 多次购买 好评好评",2018-03-28 13:30:12
1233001,5,"好昂贵，但为了爱人和爱子，值了，支持网易",2018-03-21 22:17:27
1233001,5,"买了两次了，都很好。孕期和产后吃吃",2018-03-21 11:26:14
1233001,3,"燕窝比较干所以容易碎，这个倒不是大问题。关键是内侧补了很多碎，泡完外层一半是丝状，内侧满满燕碎，这个价格也说不上多便宜，还不如淘宝的水平，有点失望，本来还想说好的话长期在这买呢。",2018-01-31 08:18:58
1233001,5,"第一次购买燕窝，感觉还不错，会关注",2018-03-28 20:59:18
1233001,5,"我没有挑毛，泡好有点小毛，这种要挑吗？",2018-04-05 07:44:19
1233001,5,"已经买了好多次了",2018-03-28 22:05:37
1233001,5,"质量非常不错，将再次购买",2018-03-28 10:29:31
1233001,5,"好东西",2018-03-28 21:45:02
1233001,5,"最爱严选，搞活动还会回购",2018-03-27 11:11:51
1233001,5,"包装拿到之后好小",2018-03-27 12:23:35
1233001,5,"还没吃，包装不错",2018-03-27 11:05:08
1233001,5,"非常干净，非常喜欢",2018-03-27 07:08:45
1233001,5,"挺好",2018-03-27 09:22:15
1233001,4,"礼品盒不够精致，东西拿在手上轻飘飘的不尊贵，希望改进！",2018-04-04 05:49:22
1233001,4,"第一次买燕窝，有些碎了，不是很满意",2018-04-02 18:29:07
1233001,3,"特意又买了个大盒验证会不会碎，大盒果然没碎的问题，不过老感觉没最初买的好，现在的都偏黄，没最初的紧致，由于不太懂燕窝，也就只能说说直观感受了",2018-04-02 17:53:13
1233001,5,"好",2018-03-27 20:41:27
1233001,5,"好",2018-03-27 10:27:07
1233001,5,"燕窝很干净，发泡后就可以直接炖了",2018-03-25 17:45:12
1233001,5,"严选质量就是过关 希望永远保持",2018-03-26 10:10:22
1233001,5,"还是瓶装浓缩更适合上班族",2018-04-03 10:52:39
1233001,5,"吃了一盏 里面有毛 弄不干净啊",2018-04-02 09:25:08
1233001,5,"可以说是hin棒棒咯",2018-03-26 23:21:26
1233001,5,"很好吃 严选值得信赖！",2018-03-26 18:17:18
1233001,4,"搞活动328元两盏，纸包装盒里有泡沫，但还是有两盏压碎了一些，纸盒还是软。",2018-04-01 13:12:53
1233001,5,"不用挑毛，很干净",2018-03-26 04:32:26
1233001,5,"还不错",2018-03-26 13:02:10
1233001,5,"不错",2018-03-26 09:30:38
1233001,5,"浓浓的蛋青味，还是自己做最好吃",2018-03-25 10:39:00
1233001,5,"还没食用，看着质量可以",2018-03-25 13:46:57
1233001,5,"多次回购了，品质保证",2018-03-25 12:45:39
1233001,5,"多次回购，吃着放心",2018-03-25 12:41:46
1233001,5,"第一次尝试做，似乎有点失败",2018-03-29 18:25:06
1233001,5,"看着不错",2018-03-25 17:04:49
1233001,5,"满意",2018-01-16 00:17:16
1233001,4,"比较容易碎，浸泡后还是一坨一坨的，与小时候吃的印尼燕窝口感有差",2018-03-29 19:22:28
1233001,4,"限时特价买的，然后现在又降价，我是真心把握不好这“三石”的脉啊！！",2018-03-27 21:22:56
1233001,5,"好吃",2018-03-24 14:18:50
1233001,5,"ok",2018-03-24 13:22:52
1233001,1,"拍完第二天降价不补差，抄你的妈",2018-03-28 17:53:24
1233001,5,"很好，很干净。几乎没有杂毛。",2018-03-23 09:47:41
1233001,5,"相信严选",2018-03-23 15:25:28
1233001,5,"还好",2018-03-23 09:14:56
1233001,5,"赞",2018-03-23 16:22:56
1233001,5,"好",2018-03-23 08:20:38
1233001,5,"很好哦，严选买的放心，吃的安心！",2018-03-22 07:16:17
1233001,5,"多次购买，足克，干净无需挑毛",2018-03-22 12:28:11
1233001,5,"多次购买，很干净，不用挑毛",2018-03-22 12:26:26
1233001,5,"多次购买，很干净，不用挑毛",2018-03-22 12:26:20
1233001,5,"看着挺好，应该不错",2018-03-22 23:18:21
1233001,5,"看着不错",2018-03-22 15:14:00
1233001,5,"<U+0001F44C>",2018-03-22 23:33:56
1233001,5,"买了好几次了，一直吃，感觉很好",2018-03-21 15:13:53
1233001,3,"第一盒使用感觉很好煮完有浓浓的蛋白香味。第二盒刚拆使用发现有一盏泡发后有很大一块的凝胶。之前的一盒没有发现这个问题。产品疑似混有层次不同的产品",2018-03-31 11:28:23
1233001,5,"质量不错 相信严选 会再买的",2018-03-21 12:02:49
1233001,5,"多次购买 看上去不是很白 很小一个",2018-03-21 10:24:21
1233001,3,"吃了两次，一次早上一次晚饭前。不知道为什么，吃了1-2小时会出现短暂的大概持续10分钟的乏力和头晕，走路时会突然脚步不稳。之前没吃过干燕窝，也没出现过头晕脚步不稳 。也许是个人不适应吃燕窝，希望不是商品问题。",2018-03-25 15:00:30
1233001,3,"包装太差，回来全碎了，跟客服沟通，还说正常现象，不知道说一下以后改进什么之类的，400多10克的燕盏，我还不如买燕碎了。同样买的燕窝，价格差不多，30克的价格网易还贵100多快。我是买来对比，结果网易价格高还被比下去。不会回购",2018-03-26 14:51:03
1233001,5,"燕窝收到了，看着还不错还没开始煮，期待中……",2018-03-14 22:31:31
1233001,5,"已经是第二次买了，希望优惠多多",2018-03-21 11:22:53
1233001,5,"非常不错还会购买",2018-03-21 10:03:27
1233001,5,"多次购买",2018-03-21 10:26:18
1233001,5,"好",2018-03-21 17:36:29
1233001,5,"好",2018-03-21 17:14:36
1233001,5,"好吃",2018-03-21 09:46:56
1233001,5,"好",2018-03-21 00:08:09
1233001,5,"包装非常严实，已经迫不及待按照说明浸泡了，貌似分量不少",2018-03-17 14:51:45
1233001,5,"泡完发的很好，能发1倍吧，杂质少。",2018-03-26 09:35:34
1233001,5,"特别干净，很满意，买来送人",2018-03-20 17:54:25
1233001,5,"还没有试吃。看起来应该不错",2018-03-20 07:14:12
1233001,3,"太小、太贵了",2018-03-24 18:31:26
1233001,5,"口感很好，蛋白香浓郁",2018-03-20 11:40:07
1233001,5,"不错，跟儿子一起吃",2018-03-20 16:34:12
1233001,5,"还没吃看起来不错",2018-03-20 14:30:30
1233001,5,"有活动很划算",2018-03-20 21:41:43
1233001,3,"不知道是运输时碎了还是把碎的填充重量，比在香港买的小多了。",2018-03-31 14:39:56
1233001,5,"很好额",2018-03-20 20:54:17
1233001,5,"很好满意",2018-03-20 13:39:23
1233001,5,"非常好",2018-03-20 11:18:53
1233001,5,"！！！！！！",2018-03-20 22:50:44
1233001,5,"不知道什么感觉",2018-03-23 13:27:25
1233001,5,"这是第二次购买了，是相信严选的品质",2018-03-19 00:03:43
1233001,5,"还不错，有折扣划算些",2018-03-19 18:27:17
1233001,5,"2017年10月的 保质期三年",2018-03-19 10:01:23
1233001,5,"打开闻着有蛋清的香味，有一些很小的毛。总体还行！",2018-03-24 14:43:36
1233001,5,"两片竟然颜色不一样，不知道到是什么情况，哪种是好的？",2018-03-23 09:25:17
1233001,5,"干净好泡发",2018-03-19 17:39:53
1233001,3,"买过30g这次买的10g，这种的包装不行，燕窝都是碎的，跟很多买家反馈一致，看了下果然是10g买家们。所以要买还是直接买30g比较好，包装的不会碎，为了验证下，我打算再买次30的，不然对网易印象要不大好了",2018-03-31 09:36:14
1233001,5,"还不错哦",2018-03-19 22:13:51
1233001,5,"不错<U+0001F44C>",2018-03-19 15:38:39
1233001,5,"完整的盏",2018-03-19 11:18:02
1233001,3,"Ok",2018-04-02 21:52:37
1233001,5,"不错啊",2018-03-19 23:25:05
1233001,5,"应该不错",2018-03-19 17:38:51
1233001,5,"和在香港买的差不多、不过很干净",2018-03-18 19:13:03
1233001,5,"喜欢、下次再购",2018-03-18 00:31:43
1233001,5,"不错、应该很好",2018-03-18 00:31:23
1233001,5,"很好",2018-03-18 13:03:54
1233001,5,"不错",2018-03-18 18:16:17
1233001,0,"特别好，熬来一家人一起吃，准备再买",2018-03-16 11:44:51
1233001,5,"还是有挺多细小的燕毛，挑起来挺费劲的，有种挑不干净的感觉。",2018-03-22 11:25:14
1233001,5,"还没吃，吃完再评",2018-03-17 22:01:13
1233001,5,"性价比高 适合送人",2018-03-17 19:08:30
1233001,5,"性价比高 信赖严选",2018-03-17 19:08:26
1233001,5,"先留着，打开包装，看看不错",2018-03-17 19:03:17
1233001,5,"好吃 常回购 品质有保障",2018-03-17 11:59:59
1233001,5,"帮朋友买的，应该不错",2018-03-17 06:00:17
1233001,5,"不错，物流也够快！",2018-03-17 13:15:11
1233001,5,"特别好，一直吃",2018-03-17 13:33:58
1233001,5,"特别好，一直吃",2018-03-17 13:33:42
1233001,5,"呵呵哈哈哈",2018-03-17 19:03:17
1233001,5,"买完就降价了，郁闷",2018-03-21 11:17:08
1233001,5,"挺好",2018-03-17 16:07:45
1233001,5,"好袖珍",2018-03-17 14:08:10
1233001,5,"不错",2018-03-17 13:42:49
1233001,5,"不错",2018-03-17 10:19:26
1233001,5,"燕窝好贵啊",2018-03-16 16:10:56
1233001,5,"相信严选品牌",2018-03-16 15:31:55
1233001,5,"性价比超高",2018-03-16 11:06:50
1233001,5,"看不出燕窝好坏，不怎么懂。煮了反正有蛋清味",2018-03-20 23:04:20
1233001,5,"吃了一次了，好吃，有活动又买了",2018-03-15 20:23:02
1233001,5,"很不错，准备下回有活动时候再来购买！",2018-03-15 00:14:27
1233001,5,"很满意",2018-03-15 22:44:15
1233001,5,"很干净",2018-03-15 22:34:17
1233001,3,"燕窝碎了 整体还发黄 不知怎么回事",2018-03-19 17:44:31
1233001,5,"不错",2018-03-15 22:16:07
1233001,5,"媳妇还没品尝，看起来不错。",2018-03-14 21:41:35
1233001,5,"非洲满意",2018-03-14 13:08:12
1233001,3,"泡发力一般，比起香港楼上买回来的，严选的还是要差点，不会再回购了。",2018-03-20 12:47:03
1233001,5,"赞",2018-03-14 19:56:17
1233001,5,"一般",2018-03-14 00:05:02
1233001,4,"东西送人的不知道料怎么样，不过包装不够好，还要更加改进",2018-03-19 23:17:17
1233001,5,"质量好 还会再来",2018-03-13 15:45:16
1233001,5,"非常干净，值得推荐！！！",2018-03-13 21:51:40
1233001,5,"应该不会回购了，有些碎，泡发率低，而且小毛毛很多～",2018-03-19 13:35:03
1233001,5,"春节期间下的单，还担心会延时，没想到还是和平时一样的快～赞个大大的赞",2018-02-20 12:25:33
1233001,5,"买了很多次了，严选的东西真心感觉不错。这次参加活动还有冻干银耳汤送，超值。",2018-02-03 15:00:17
1233001,5,"先泡3小时再蒸30分钟，出锅时一股蛋清香，每天吃一勺一盏可以吃1星期比瓶装划算很多",2018-02-12 16:09:21
1233001,5,"这个在看了众多好评之后买了一盘，也买了瓶装即食型的，相比之下，还是这个合算，这次是回购",2018-02-03 11:28:41
1233001,2,"泡发率很低，而且有很多细小的杂毛～没有隔水煮，觉得不是很好吃。<U+0001F622>",2018-03-19 12:53:17
1233001,5,"已经收到，京东小哥一直很棒，因怀孕每次送到楼上，燕窝还没食用，用后在反馈",2018-01-02 14:33:16
1233001,5,"不错，包装严实有安全感，爸妈已经做了吃啦～福袋是藕粉，我妈觉得太甜啦",2017-12-12 23:40:18
1233001,3,"产品刚推出的时候我尝鲜买了一个，洁净度挺好的，都不用挑，第二次购买商品价格上涨更多，洁净度没之前好了，肉眼看的很明显",2018-03-17 23:37:24
1233001,5,"特意等吃了后再来评价：好商品，很干净，煮后有清香，是正品。还想继续购买，可惜没货了。",2017-11-22 12:08:32
1233001,5,"燕窝就吃了一个 毛比较多比较费劲 顿起来 所以还没炖第二次",2018-01-20 22:20:48
1233001,5,"东西非常、非常好、干净、味道更好、中了严选的毒了、下次还会购买",2018-02-18 16:55:59
1233001,5,"比我在别家买的小，平均5克左右一盏，不过最近燕窝涨价太多，这个价位不算贵",2017-11-13 14:37:13
1233001,5,"性价比很高还送了礼品，还没吃不知道毛多不多",2018-01-29 09:39:10
1233001,3,"怎么说呢！太精致了！",2018-03-19 18:27:05
1233001,3,"品质一般，不如到大药房买的个头大",2018-03-18 08:56:37
1233001,5,"哈哈哈，无意之中发现的严选，却成了生活中最重要的购物途径。",2018-02-21 21:46:56
1233001,1,"看了好评才买的，实际收到的是这样的，不敢恭维！不值！",2018-03-19 11:33:46
1233001,5,"很不错的东西，性价比高，颜值也不错，我们全家都很喜欢，下次还会来？",2017-11-18 22:25:49
1233001,5,"看起来不错，正好无聊拿天平称了称，重量很足，带塑封膜32克，已很满意",2017-11-10 14:14:05
1233001,5,"燕盏不大 很密。底座目测比较大。跟价位相符，应该是相当于同仁堂二级品质。溯源码跟同仁堂的不是一个体系，是马来的系统，只能扫出有效期重量等，同仁堂的能扫出产地，级别。但价格只是同仁堂的一半，泡开再看看",2018-03-18 10:12:24
1233001,5,"的确是蛋清香味，清晨吃过后感觉一天抖元气满满。回购，坚持吃满三个月",2017-11-08 22:59:38
1233001,5,"发货速度，包装仔细，产品生产日期新鲜，活动时购入，还赠送一个双肩背包……",2018-01-27 09:27:21
1233001,5,"在几个地方买了，对比了下，这里买的还是最好的，",2018-02-13 09:04:44
1233001,5,"还没吃，包装很好。看着品质不错，吃过来追评",2018-03-02 16:13:32
1233001,5,"包装得很完美 而且没有胶 每片都能查到原产地 很棒",2018-01-12 16:38:11
1233001,5,"还没有食用，碎的有些多，快递京东小哥很棒，感谢每次送楼上",2018-01-04 05:48:22
1233001,5,"第一次买，不错的。老婆吃了脸都亮一点了。",2018-03-11 09:23:49
1233001,5,"包装很好 每个燕窝都有条形码和保质期 看着也很干净 最近吃吃试试",2017-11-11 02:13:35
1233001,5,"给媳妇儿买的，还没有吃。很小一个",2018-03-11 16:42:11
1233001,5,"燕盏很不错，严选值得信赖",2018-03-12 06:24:10
1233001,5,"一点点，还是买大包装",2018-03-12 21:37:30
1233001,5,"还没吃，看上去不错",2018-03-12 20:00:26
1233001,5,"应该不错，相信严选",2018-03-12 16:05:04
1233001,5,"还没吃，应该不错。",2018-03-12 10:13:03
1233001,5,"第一次购买，还没吃",2018-03-12 10:11:12
1233001,5,"品质高，很好",2018-03-12 18:55:32
1233001,5,"很精致的",2018-03-12 18:53:54
1233001,5,"东西很好",2018-03-12 16:32:31
1233001,1,"燕窝煮出来是条状的。泡发跟炖煮时间都是对的。感觉像假的。客服说正常。",2018-03-20 08:08:31
1233001,5,"可以！",2018-03-12 20:58:23
1233001,5,"不错！",2018-03-12 20:57:53
1233001,5,"好",2018-03-12 20:42:33
1233001,5,"非常不错的燕窝，干净，吃起来很方便",2018-03-11 19:48:53
1233001,5,"挺好，第二次买了",2018-03-11 12:13:59
1233001,5,"燕窝的品质很一般，价格也不算便宜",2018-03-14 10:42:34
1233001,5,"质量上乘，价格适中",2018-03-11 20:44:59
1233001,5,"还没吃呢",2018-03-10 22:37:11
1233001,2,"包装拆卸很不合理，很容易燕窝就破了，另外泡出来以后很多都是碎碎的那种，不是一整条的和我之前其他地方买的有差距",2018-03-16 11:07:19
1233001,5,"看上去不错，相信严选的品质，实在实惠拿得出。",2018-03-07 21:00:40
1233001,5,"还没吃呢，那么贵，希望质量好啦",2018-03-08 23:16:04
1233001,5,"还没吃，五克一盏，比想象中小好多",2018-03-08 08:46:03
1233001,5,"对燕窝了解不多，属于小白级别。收到后打开是小小的一盏，比想象中小好多，形状挺完整但是有碎的燕窝。泡发了三个小时左右，应该是泡开了，闻了闻有淡淡腥味，也有小细毛但是不算太多吧，懒得挑就直接炖了，炖好腥味很重，这应该是好现象？总之感觉严选的东西不会错，性价比高不高就不敢妄下结论。",2018-03-15 12:54:53
1233001,5,"第二次购买了，很好",2018-03-09 10:39:26
1233001,5,"包装很用∽",2018-03-09 20:52:53
1233001,5,"好东西，期待效果",2018-03-09 17:48:04
1233001,5,"很好",2018-03-09 17:31:36
1233001,1,"包装挺好的，但是感觉是假燕窝，发泡了八个小时，都碎了。煮好了，还是一点点，没有碎毛，就只有一点点类似小石头一样的脏东西而已。",2018-03-13 20:01:20
1233001,5,"非常好，包装简介。东西应该不错。中毒了网易严选",2018-03-06 11:41:45
1233001,5,"三八节给自己买",2018-03-08 09:45:51
1233001,5,"好货，值得再次购买",2018-03-08 08:12:25
1233001,5,"好货，值得再次购买",2018-03-08 08:11:42
1233001,4,"还行，泡发之后一坨一坨的不是丝丝分明的，口感不是特别好，但比较比较便宜，也算物有所值了",2017-11-18 18:10:55
1233001,5,"会再回购的，就是没上次优惠力度了",2018-03-02 21:36:40
1233001,5,"妈妈说不错，价格也算实惠了，就是我喝不惯，还是放弃了",2017-12-26 01:59:14
1233001,5,"很干净，几乎不用挑毛",2018-03-07 18:37:29
1233001,5,"很干净，给老婆吃。",2018-03-07 17:08:07
1233001,5,"盒子太小了，只能自用。送人的话四百多块钱的东西这个肥皂盒大小的包装实在拿不出手。",2018-03-08 15:30:15
1233001,5,"回购的",2018-03-07 18:38:14
1233001,5,"口感不错，只是展好像不是很大，泡发程度也一般，但是吃着放心",2017-11-03 18:00:21
1233001,5,"还没炖，真的好小额",2018-03-05 19:12:44
1233001,5,"送朋友的，反馈很好",2018-03-05 11:42:59
1233001,5,"好泡率高",2018-03-05 22:34:27
1233001,5,"不错，不错，不错，不错，",2018-03-05 20:12:28
1233001,5,"盒子真的太小了，只能自己吃，不能作为礼品送人",2018-03-08 15:35:46
1233001,5,"燕窝很好 真的有一股蛋清的清香 做冰糖燕窝就超好吃了",2017-11-29 13:38:59
1233001,5,"还没来得及熬，看评论不错。",2018-03-04 12:42:33
1233001,5,"还没吃，相信严选的品质",2018-03-04 11:47:06
1233001,5,"还没有吃，相信严选的品质",2018-03-04 11:46:39
1233001,5,"包装很严实",2018-03-04 23:25:26
1233001,5,"还没用，希望好，就是好小啊，两个就一点点",2018-02-26 12:41:32
1233001,4,"不用挑毛  挺好的",2018-03-03 16:10:12
1233001,4,"泡发率不高，不算干净，性价比一般",2018-03-07 20:51:09
1233001,2,"包装不好，有缺口而且碎了，打开散落到桌子和地上，浪费了不少。",2018-03-05 21:55:32
1233001,5,"包装很好",2018-03-03 23:18:30
1233001,5,"包装无损，但是有一片碎成渣，拆拿时包装被家人扔了无法退货，有些失望",2018-03-05 19:57:01
