"itemId","star","content","createTime"
1242014,5,"做工不错，就是脚背部分较低，穿着走路很打脚",2018-06-17 20:22:02
1242014,5,"好穿，又很好看。",2018-08-09 15:38:25
1242014,5,"还可以",2018-08-09 23:20:11
1242014,4,"给妹妹买的伴娘鞋子，很好的。",2018-08-08 09:09:07
1242014,5,"一直在等这款蓝色，看到立马下手，好看",2018-08-06 10:55:31
1242014,2,"皮特别硬，平时穿36鞋子的脚，我担心鞋子皮革问题特意买大一码，没用，今天第一次穿就把脚磨的生疼不能走路。只能临时去买双鞋子把这双扔了吧。尽管便宜，只穿一次也太浪费了。第一次在严选买东西就遇到这么坑的品质。太失望了。",2018-08-07 18:31:41
1242014,5,"穿了不累脚，鞋子上脚效果也不错",2018-08-06 07:27:49
1242014,4,"太挤脚，显得脚长，退货了。退货速度很快。",2018-08-09 09:51:46
1242014,5,"脚感很不错，内垫软，走路不辛苦",2018-08-07 21:47:30
1242014,5,"鞋跟比想象的高点 总体感觉还不错",2018-08-07 22:27:15
1242014,5,"很舒服，满意",2018-08-08 18:28:27
1242014,5,"鞋子很棒",2018-08-08 18:57:46
1242014,5,"非常满意",2018-08-08 07:47:51
1242014,5,"挺好",2018-08-08 06:39:55
1242014,1,"皮质很硬，打脚打的厉害。不好穿",2018-04-03 19:39:01
1242014,5,"鞋子样子不错，有点硬啊",2018-08-07 23:29:45
1242014,5,"很轻盈，稍微偏大一点",2018-08-07 22:59:48
1242014,5,"非常小女人的感觉  ！喜欢喜欢喜欢！非常好打理",2018-08-02 09:42:57
1242014,5,"鞋子很漂亮，比较适合脚瘦的人穿",2018-08-05 11:12:01
1242014,2,"第一天穿，左脚后跟磨了一大片皮，疼了一个多星期。哎，严选上少见的败笔",2018-06-09 18:49:20
1242014,5,"很喜欢",2018-08-05 23:45:59
1242014,5,"舒服好看",2018-08-05 10:05:32
1242014,5,"颜色很正，只是尺码不适合我，又没有36，只好退了，期待出新品",2018-05-14 16:16:05
1242014,5,"底很软",2018-08-04 12:27:59
1242014,5,"听同事介绍第一次上严选买的，质量杠杠滴！值得信赖。下次继续光顾。",2018-06-04 11:52:16
1242014,5,"很职业，也舒适",2018-08-03 23:15:27
1242014,5,"不错",2018-08-03 22:21:51
1242014,4,"有一点色差，和图片有点不一样",2018-08-09 22:54:57
1242014,5,"鞋子不错哦 很好看 鞋跟也不会很高",2018-07-29 08:17:38
1242014,5,"颜色很好看，穿着也很合脚，性价比超级高的",2018-06-22 11:35:20
1242014,5,"忽略我的黑腿吧，雾霾蓝真好看，适合裙子裤子都挺好的，小猫根也不累，唯一就是脚有点宽，第一天穿的稍微有点紧",2018-08-09 10:44:48
1242014,5,"还行，我穿36小，37大，就退了",2018-07-31 08:28:30
1242014,5,"经典大气的猫跟鞋，穿着很舒服，高度也刚刚好",2018-07-06 19:12:21
1242014,5,"样式很喜欢，就是容易掉跟，特别下楼得时候",2018-08-04 16:43:54
1242014,5,"挺好，淑女",2018-08-02 21:50:52
1242014,5,"挺好的，走路还比较舒服",2018-08-01 13:44:12
1242014,5,"很好的，买小了一码，换了打点的，严选的服务棒棒哒",2018-05-11 14:25:54
1242014,5,"放办公室里穿，高度合适。关键显脚白。",2018-07-31 19:02:16
1242014,5,"鞋底很舒服，新鞋穿久了有点磨脚，不过也很好穿而且好看",2018-08-02 01:06:00
1242014,5,"尺码刚刚好，满意",2018-08-01 15:33:47
1242014,5,"稍微有点大",2018-08-01 14:22:26
1242014,5,"已经买过杏色穿上非常舒适，再购黑色。",2018-07-27 08:39:40
1242014,5,"码数买小了吧，刮脚，疼",2018-08-06 11:33:14
1242014,5,"特别舒服，显脚瘦，挺好，严选真的特别不错，一开始买小了，顺丰上门取件，哎，严选服务真好，赞赞",2018-03-19 19:46:40
1242014,2,"虽然很喜欢严选，但这次真心给不了好评，鞋子穿上后二十分钟脚就磨的很痛，而且我的脚是瘦瘦的，磨的痛死了。再也不在严选家买高跟鞋了。之前也穿过跟还高的也没事，但这次真是不好的体验。",2018-07-21 10:30:26
1242014,5,"之前买的36感觉好小哦，换了37舒服多了，很满意的一次购物",2018-04-17 22:22:10
1242014,5,"鞋子超级舒服，非常好穿，可以穿一天都不觉得累",2018-07-22 21:26:43
1242014,5,"穿了不舒服，退了",2018-07-31 21:23:03
1242014,5,"质量很好，可惜的是我穿起来有点大了。",2018-08-06 09:05:57
1242014,5,"新鞋子有些打脚，不过样子很美丽，有些重鞋子整体",2018-08-06 10:32:08
1242014,5,"好",2018-07-31 18:24:48
1242014,5,"不好穿，感觉重心前倾，脚掌整个着地，走起来啪啪响。而且好几处磨脚，都擦了好几处白酒了",2018-07-01 23:13:22
1242014,5,"鞋里是皮的 脚感舒服 随鞋配了半垫和备跟儿",2018-05-10 18:51:45
1242014,5,"宝贝质量不错，可惜39码穿着仍有点小，只能退了",2018-06-19 09:24:34
1242014,3,"码数偏小，有点硬，上脚不是很舒服，多处同时磨脚",2018-07-11 12:37:19
1242014,5,"粉粉的，很好穿！喜欢<U+0001F618>",2018-07-30 15:00:10
1242014,5,"很稳，码数准",2017-08-16 19:32:24
1242014,5,"好评，质量真不错，喜欢",2018-07-30 10:43:46
1242014,5,"有点刮脚耶",2018-08-02 08:28:21
1242014,5,"超美的",2018-07-30 22:04:31
1242014,5,"还好",2018-07-30 18:50:50
1242014,5,"很棒",2018-07-30 05:47:10
1242014,5,"c",2018-07-30 15:34:28
1242014,5,"满意",2018-07-30 15:25:54
1242014,5,"质量很好，也较柔软，上脚很舒适，严选的质量信得过！好评！",2018-07-03 20:38:47
1242014,5,"尖头鞋的缘故吧，特别卡脚，我已经算比较窄的脚了，小脚趾受不了……",2018-07-06 20:38:18
1242014,3,"不知道是不是脚的问题，鞋子不跟脚，也比较硬",2018-07-28 22:38:15
1242014,5,"挺漂亮的鞋子，估计因为是漆皮，比我买的另一双金属跟鞋子稍微硬一点。",2018-03-23 17:20:14
1242014,5,"颜色好看，跟的高低合适舒服",2018-07-29 11:39:05
1242014,5,"鞋子号偏小一码，整体不错，超级实惠",2018-07-28 18:29:34
1242014,5,"好看",2018-07-29 10:00:01
1242014,5,"好",2018-07-29 08:43:15
1242014,5,"好看，有点挤脚",2018-07-03 23:10:36
1242014,5,"质量好，舒适，很棒",2018-07-28 10:42:53
1242014,5,"很好看",2018-07-28 18:33:50
1242014,5,"回头客了，帮别人买的，很满意",2018-07-27 22:53:52
1242014,5,"鞋子好穿，不过六码的后跟稍有点松，不过垫了还是可以的，好评",2018-04-13 19:13:19
1242014,5,"快递特别速度，中午拍下的下午就到家啦，鞋穿着也舒服，不过有两个地方一个鞋感觉总是歪的，还有个地方磨脚，都拍下了，供大家参考，",2018-07-26 20:57:31
1242014,5,"很好",2018-07-26 12:02:07
1242014,5,"好",2018-07-26 00:15:25
1242014,5,"质量不错",2018-07-25 03:34:47
1242014,5,"质量很好",2018-07-24 10:48:31
1242014,5,"很好看，又便宜，穿上很舒服",2018-07-23 21:10:21
1242014,5,"女朋友1米7，运动鞋穿38，这款买38也正好。很喜欢款式，做工也非常不错。好评。",2018-03-18 01:41:49
1242014,5,"感觉不错，还没有用",2018-07-23 19:11:14
1242014,5,"鞋挤脚，退货了。售后很好",2018-07-29 18:33:34
1242014,5,"尺码有点点偏大",2018-07-29 10:36:12
1242014,3,"有点磨脚指头",2018-07-28 12:45:48
1242014,5,"皮子有点点硬，感觉不能穿太久。",2018-07-28 14:09:13
1242014,5,"不错",2018-07-23 14:09:05
1242014,5,"好",2018-07-23 22:35:50
1242014,5,"好穿，舒服",2018-07-22 08:46:01
1242014,5,"很好的卖家，绝对支持",2018-07-21 22:44:36
1242014,5,"舒服",2018-07-21 11:09:26
1242014,5,"很女人的一双鞋，鞋面质感很好，鞋跟挺特别的",2018-06-24 00:33:37
1242014,5,"鞋子很软，故意买大一码，谁让我脚胖呢。走路多了小脚趾会磨，还是不习惯有跟的鞋子",2018-07-28 14:02:12
1242014,5,"质量太好,穿一次磨脚一次，痛死我了",2018-07-13 20:59:27
1242014,5,"很磨脚。。。。",2018-07-27 05:58:36
1242014,5,"好的，呵呵，以后继续光顾",2018-07-20 15:21:46
1242014,5,"鞋子颜色不错，无色差",2018-07-20 08:57:44
1242014,5,"第一次买的粉色，穿着真舒服，再来一双黑色",2018-07-15 20:18:00
1242014,5,"不错吧，试穿了，搬家放乡下去了。",2018-07-19 13:16:45
1242014,5,"鞋型秀气，皮质闪亮，夏天搭裙子效果非常不错，蝴蝶结凸显柔美气质。买了两双。",2018-04-07 03:39:17
1242014,5,"看着就挺喜欢，也不贵",2018-07-19 19:20:13
1242014,5,"还可以吧",2018-07-19 09:43:26
1242014,3,"买了一个被别人退回的鞋子，带子那里都折了，没空换了，只能先这样吧。",2018-04-19 10:15:59
1242014,5,"看图片以为鞋带是可调的，实际不是，尺码正常买就可以了",2018-04-04 11:05:57
1242014,5,"妈妈很喜欢，走路不累脚，颜值高",2018-07-18 12:49:08
1242014,5,"舒服好穿",2018-07-18 00:33:43
1242014,5,"感谢严选推出的商品，质量超好，样式非常棒。",2018-07-13 14:46:14
1242014,5,"好",2018-07-17 18:39:29
1242014,5,"款式好看也很合脚，美哒哒",2018-07-16 04:50:42
1242014,5,"鞋穿上很舒服",2018-07-16 09:44:15
1242014,5,"穿的很舒服！",2018-07-16 22:11:14
1242014,5,"质量还可以的",2018-07-16 08:26:38
1242014,5,"其他的鞋子39大了，这双39竟然小了，严选是苛刻我吗？",2018-07-18 18:07:30
1242014,5,"优雅   颜色美",2018-07-16 17:47:33
1242014,5,"穿了一段时间来评价，真的很不错，满意，还会来",2018-07-07 21:37:18
1242014,5,"颜色很好雾蓝很正，穿着也比较舒服",2018-07-11 13:20:56
1242014,5,"非常好穿的鞋子，严选的鞋子越买越多",2018-07-11 23:02:56
1242014,5,"超好",2018-07-15 11:43:32
1242014,5,"很好看的藕粉色  高度也正好  价格实惠  就是买小了一码  已经申请换货  售后也超级方便",2018-07-17 21:42:06
1242014,5,"不错",2018-07-15 22:34:48
1242014,5,"第一次穿打脚，后面就舒服了",2018-07-17 17:23:58
1242014,5,"好看，就是码子买小了一号，不过买大的估计不跟脚，皮子很软",2018-04-03 05:24:07
1242014,5,"很优雅的，也比较舒适",2018-07-14 19:40:50
1242014,5,"鞋子不错，<U+2764><U+FE0F>",2018-07-14 23:17:05
1242014,5,"走路还挺舒服，跟的高度比较合适，就是鞋口不是浅口，看起来不太精致时髦",2018-07-18 16:49:12
1242014,5,"还可以不错",2018-07-14 12:25:35
1242014,5,"鞋子很好看，大小也合适，但是多少也有点磨脚",2018-04-25 12:08:27
1242014,5,"漂亮，但还是会磨脚",2018-07-17 12:50:50
1242014,5,"非常好！在严选买东西从来没失望过！",2018-07-13 22:47:35
1242014,5,"第二次，购买，样式棒棒的，质量杠杠的。",2018-07-13 14:46:59
1242014,5,"非常好，穿上很舒服，可惜黑色的小了，只能退了！",2018-06-17 13:00:28
1242014,4,"鞋子材质稍微有点硬，磨脚，穿久了也不软",2018-07-16 17:33:50
1242014,5,"质量好，到货快",2018-07-13 13:30:13
1242014,5,"很上脚，不错",2018-07-13 20:51:19
1242014,1,"买了个刑具，穿了半小时两个脚都破皮了。",2018-07-18 22:30:02
1242014,5,"好",2018-07-13 21:54:58
1242014,5,"总算把三种颜色都集齐了！还看没话说！",2018-07-04 06:13:54
1242014,1,"谁说宽脚不怕的 谁说皮质很软的  出来 看我不打死你 我穿了一个小时 好几个地方磨泡了",2018-07-13 08:47:55
1242014,5,"自从有了网易严选，简直不能停，淘宝可以卸了",2018-04-02 21:46:39
1242014,4,"磨脚",2018-07-01 23:37:43
1242014,5,"这个蓝色很优雅，刚穿上有点挤脚，后面会好很多，实物很满意",2018-04-01 14:08:55
1242014,5,"相信严选所以采购，没有失望！",2018-07-12 23:38:21
1242014,5,"相信严选所以采购，没有失望！",2018-07-12 23:40:07
1242014,5,"非常好看，嗲嗲的",2018-07-12 11:17:57
1242014,5,"鞋子不错，喜欢。",2018-07-12 14:21:54
1242014,5,"挺好的",2018-07-12 01:37:30
1242014,5,"哈哈，超快，一天收到，已穿上，坡度很好，不累",2018-07-03 13:46:07
1242014,5,"鞋跟很稳，鞋型不错，刚开始有点硬，边上会磨脚，还没穿出门。不过累了的话可以当拖鞋穿，这样不会太累",2018-04-04 10:08:20
1242014,5,"好看",2018-07-11 08:49:04
1242014,5,"很好看，但是高跟鞋还是不如平底鞋舒服啊…",2018-04-03 18:34:27
1242014,1,"掉跟，磨脚相当严重。千万不要买。磨脚相当相当严重，穿一次磨一次",2018-07-12 22:25:05
1242014,5,"很好很满意很好很满意很好很满意",2018-07-06 15:10:21
1242014,5,"非常漂亮，特别舒适，完全可以媲美商场的牌子正品货，从来没穿过合脚的单皮鞋，居然一点儿都不磨脚，而且还这么便宜，简直爱死严选了",2018-06-26 17:07:24
1242014,5,"不错啊，很洋气",2018-07-10 15:19:09
1242014,5,"东西不错",2018-07-10 08:25:34
1242014,2,"就半天啊！我的双脚多了七个泡，钻心的疼",2018-07-11 20:06:13
1242014,5,"好",2018-07-10 17:40:31
1242014,5,"买了两双了，真的好穿，严选的鞋子质量真不错。",2018-07-01 10:20:07
1242014,5,"质量超级好，就是不适合我穿",2018-07-09 13:45:56
1242014,5,"还不错",2018-07-09 22:40:15
1242014,5,"好",2018-07-09 11:20:07
1242014,5,"第一次穿高跟的，很舒适，再也不惧高跟",2018-07-04 16:05:19
1242014,5,"总算把三种颜色都集齐了！好看没话说！",2018-07-04 06:14:12
1242014,5,"走路很稳，显脚小，也不磨脚。陪裤子裙子牛仔都好看。",2018-06-11 11:52:09
1242014,5,"好",2018-07-08 17:33:07
1242014,5,"温柔漂亮，小猫跟高度合适，适合上班族<U+0001F469><U+200D><U+0001F4BC>日常穿搭。",2018-05-11 12:39:41
1242014,4,"这双没有尖头细带方根，轻砂蝴蝶结5cm好穿",2018-06-22 17:34:42
1242014,5,"不错，大牌即视感",2018-07-07 07:48:49
1242014,5,"很不错的一双鞋",2018-07-07 14:46:34
1242014,5,"服务好",2018-07-07 09:33:33
1242014,5,"好",2018-07-07 00:15:27
1242014,4,"退货了，穿上去的效果跟想的不一样，性价比还是可以的",2018-03-27 08:08:21
1242014,5,"这个鞋从买来就穿，每天站5个小时，没有觉得脚疼，同时也没有显得跟儿矮，比起家里买的2千大洋的鞋还要舒适一二分，准备再回购一双，当工鞋穿",2018-07-05 13:37:18
1242014,5,"非常好 舒服",2018-07-05 18:04:32
1242014,5,"还可以",2018-07-05 09:12:11
1242014,5,"尺码偏小，但是很稳，颜色样式都好看。",2018-07-04 14:04:18
1242014,5,"穿了一次，感觉还行吧，没有不舒服",2018-07-02 10:04:08
1242014,5,"上脚非常舒服，就想穿平底鞋一样，大爱",2018-07-02 07:59:06
1242014,5,"鞋子很舒服，搞活动的时候买的，喜欢",2018-07-03 18:26:55
1242014,5,"挺好的，本来太小了转给我朋友，她超级喜欢",2018-06-25 11:12:56
1242014,5,"质量还可以，新鞋穿上都有些打脚。",2018-07-08 12:24:31
1242014,2,"反正我穿上不舒服。前面挤脚，后面袋子不停的掉。都穿了就不退了，扔了。",2018-06-25 14:58:04
1242014,5,"我的脚比较大，平时穿最大码，第一次穿前面有点紧，挤得有点痛，后面穿好一些，穿起来还是很有女人味的",2018-07-02 11:25:16
1242014,5,"试穿很舒服，还没走长路，应该不会磨脚。",2018-06-25 11:09:09
1242014,5,"非常好<U+0001F44D>！物有所值！就是我穿大了。",2018-06-25 10:06:57
1242014,5,"鞋子很漂亮，鞋掌前面软软的，穿上很舒服，老婆很喜欢穿。不过穿时间久了小脚趾和大拇指会磨的有点疼，可能需要再适应一段时间。",2018-07-08 13:15:22
1242014,5,"很漂亮，老婆非常喜欢！",2018-07-03 22:22:56
1242014,5,"很漂亮 颜色显白",2018-07-03 09:43:04
1242014,5,"鞋一般吧",2018-07-03 10:44:22
1242014,5,"好看",2018-07-03 03:54:16
1242014,5,"好",2018-07-03 12:03:53
1242014,5,"好",2018-07-03 12:04:02
1242014,5,"有点硬 还没穿 但看着还行",2018-07-02 16:23:06
1242014,5,"不舒服 所以退货了 好看确实好看",2018-07-02 19:38:01
1242014,2,"严选的忠粉，买了那么多件来说，这双鞋子真的是差评！鞋子本身有点重，穿了一天脚趾磨烂了。真心不推荐。第一次差评",2018-07-02 21:39:36
1242014,5,"穿起来太舒服了！",2018-07-02 15:16:27
1242014,5,"这双鞋第一天穿真心脚疼，但是第二天就好了不疼了。鞋型很好，前脚掌软书，尖头缺不挤脚，这个价格买到非常划算，一直在关注严选的鞋子，尤其是这家制造商出的鞋，又好看又合脚",2018-07-02 15:21:43
1242014,5,"比实际尺寸大一些",2018-07-04 12:51:17
1242014,5,"很漂亮",2018-07-02 23:37:08
1242014,5,"很；漂亮，一下买了两双不同颜色，穿上很舒服，跟也不高",2018-05-23 14:45:28
1242014,5,"还有吗？这袜子真心很好。",2018-07-01 23:22:27
1242014,5,"太好了！颜色好看尺码合适！平时穿37码真好！",2018-06-22 20:23:31
1242014,5,"还行，就是有点英",2018-06-30 12:25:38
1242014,5,"雾霾蓝，跟很特别，穿着很舒服颜色很好看满意好好好，开心开心",2018-04-13 15:29:48
1242014,5,"穿了一次，右脚磨的疼，没再穿，差点忘记了它的存在",2018-06-29 21:36:17
1242014,5,"感觉有点硬，不能穿太久了！总体感觉可以吧",2018-06-25 21:44:33
1242014,5,"不太跟脚",2018-06-10 21:28:56
1242014,5,"鞋子质量非常好就是我买小了一号，不合适非常可惜",2018-05-21 01:06:15
1242014,4,"有点硬，码偏小，退了",2018-06-29 17:44:08
1242014,5,"颜色非常好看 穿着舒服",2018-05-21 10:43:20
1242014,5,"好，很舒服，",2018-06-29 21:42:38
1242014,5,"舒适，好看",2018-06-29 06:52:51
1242014,5,"鞋子不错 质量很好 颜色很正  就是我个人不太适合这个鞋子",2018-05-03 14:30:32
1242014,5,"鞋子不错 质量很好 颜色很正  就是我个人不太适合这个鞋子",2018-05-03 14:30:34
1242014,2,"磨脚磨脚磨脚",2018-06-27 09:14:15
1242014,5,"这绝对是性价比超高的鞋子！跟舒服，样子漂亮！",2018-06-20 19:57:49
1242014,5,"真舒服，高跟里很舒服的一双",2018-06-28 10:02:38
1242014,5,"好",2018-06-28 13:20:51
1242014,5,"儿子帮我选的颜色<U+2022><U+1D17><U+2022>不错！很好",2018-06-27 22:25:58
1242014,5,"物超所值<U+0001F44D>",2018-06-27 18:37:51
1242014,5,"可以说很舒服了",2018-06-27 11:42:39
1242014,5,"平时是39的脚，有些挤",2018-06-29 13:36:47
1242014,5,"喜欢",2018-06-27 09:13:12
1242014,5,"非常好穿，鞋里面穿着也特别舒服",2018-06-26 05:58:09
1242014,5,"穿着不累，不知道走久了会不会累，后跟不算高，高个子无压力！配仔裤应该不错！",2018-06-20 13:03:14
1242014,4,"漆皮的，还不错，就是对我而言鞋跟太高了些，退货了。",2018-06-22 18:28:24
1242014,5,"我的脚有点肥，上图暴露脚丑，然后鞋子简直完美舒适，漂亮，合穿，大爱！！！",2018-03-19 14:33:26
1242014,5,"帮姐姐追加的！特价优惠把她乐坏了！",2018-06-24 09:54:56
1242014,5,"打脚啊，穿一次磨了6个泡",2018-06-27 09:13:37
1242014,5,"质量好，价格便宜，穿着舒适",2018-06-26 09:19:04
1242014,5,"鞋子质量不错，穿起来很舒服",2018-06-26 14:06:27
1242014,5,"还是比较精致小巧的",2018-06-26 07:12:40
1242014,5,"评价有礼",2018-06-26 07:13:29
1242014,5,"非常喜欢",2018-06-26 23:20:13
1242014,5,"退货方便",2018-06-26 14:23:19
1242014,5,"漂亮",2018-06-26 23:16:04
1242014,5,"质量不错，不符合我脚型，退货了",2018-07-02 09:03:39
1242014,5,"好",2018-06-26 02:56:47
1242014,5,"好",2018-06-26 07:32:55
1242014,5,"上脚很舒服，适合宽脚、厚脚背，颜色很美！",2018-06-21 08:09:29
1242014,5,"很好，合脚。",2018-06-25 09:48:53
1242014,5,"很有女人味",2018-06-25 16:51:23
1242014,1,"这个鞋子真的不好穿，一天都坚持不了，后跟，脚背，脚底全磨破，太痛苦了",2018-06-26 18:13:10
1242014,5,"质量很好",2018-06-25 15:08:36
1242014,5,"好",2018-06-25 15:08:50
1242014,5,"好",2018-06-25 16:40:42
1242014,4,"款式好看，但穿上才半小时，脚后跟起了两个大泡。
我看了大牌原版，后跟没这个宽，而且是软棉布材质的。",2018-07-01 08:39:47
1242014,5,"右脚大脚趾挤疼,可能鞋子买小了。内里脚感舒适,但可惜只能退货了。",2018-06-24 10:42:49
1242014,1,"鞋子早买了，的确很漂亮，一直没有机会穿，今天孩子幼儿园毕业典礼，穿去了一下，脚上起泡磨破了七处，实在疼得不能再走路了，回来时老公开车接回家的。到这会儿了，还钻心疼啊！奉劝各位美女慎重，毕竟鞋不合脚，脚很受罪，尤其是脚有点宽的，要穿着走点路的。如果只是站着不走路，脚又很瘦的，可以考虑，毕竟鞋漂亮，也稳。图一图二是我血的教训。",2018-06-29 16:30:48
1242014,5,"不好穿，脚趾磨得痛，穿上才感觉到，又不能退了，严选不应该是这样的吧！晕",2018-06-23 15:09:47
1242014,5,"款式好看，但真的需要买大一码，穿久了脚痛",2018-05-30 22:54:52
1242014,5,"大小合适，鞋跟很舒适，长时间走路也很稳",2018-06-22 05:47:47
1242014,5,"非常喜欢，以后也会再买。",2018-06-24 16:45:27
1242014,5,"穿上有lady风范，我喜欢！",2018-06-24 09:55:21
1242014,5,"喜欢就赶快下手吧",2018-06-24 07:15:23
1242014,5,"尺码不太合适 退换货啦",2018-06-26 10:54:10
1242014,5,"鞋子好看，质量可以",2018-06-24 23:16:05
1242014,5,"感觉是否偏小一点点，第一天穿脚好痛，第二次穿松一点就好一些了",2018-06-27 13:24:08
1242014,5,"退货了虽然很划算但是我脚大不太舒服",2018-07-01 11:05:56
1242014,5,"很优雅～",2018-06-24 12:27:41
1242014,5,"很棒",2018-06-24 11:08:07
1242014,5,"好看",2018-06-24 06:12:00
1242014,5,"超级喜欢，很合脚，走路不会掉跟",2018-06-23 07:45:27
1242014,5,"喜欢这个灰蓝的颜色。漆皮质感好。鞋比较窄。",2018-06-15 14:39:54
1242014,5,"很好看 就是容易脏",2018-06-25 09:32:20
1242014,5,"鞋子很好看，鞋子很软，穿起来已经走了半个小时不累。",2018-04-28 18:40:10
1242014,5,"很好走鞋底软",2018-06-23 12:29:55
1242014,5,"超级喜欢，很舒服",2018-06-23 19:02:28
1242014,2,"鞋带跟鞋帮的连接处，鞋尖位置均磨脚，穿过一次磨了三个泡。",2018-06-27 11:43:08
1242014,5,"很好看",2018-06-23 22:25:12
1242014,5,"鞋子很不错！",2018-06-23 21:38:09
1242014,5,"偏小",2018-06-23 19:21:16
1242014,5,"很好",2018-06-23 10:06:22
1242014,5,"物美价廉",2018-06-23 19:05:32
1242014,5,"严选的鞋子和牛仔裤都是不错的选择",2018-06-22 13:12:50
1242014,5,"大小合适，颜色很正，非常时尚，老婆很喜欢!",2018-06-22 18:30:29
1242014,5,"老婆说我很贴心，穿着很舒服",2018-06-22 01:38:20
1242014,5,"一直相信严选，鞋子不错，美美哒",2018-06-22 14:46:04
1242014,5,"这个十分喜欢，很有质感。",2018-06-22 21:55:25
1242014,5,"非常好，一下入手两双",2018-06-22 10:39:18
1242014,5,"有点小了",2018-06-22 08:56:53
1242014,5,"不错，有白色的就更好了",2018-04-07 10:10:00
1242014,5,"还行",2018-06-22 12:42:37
1242014,5,"很漂亮",2018-06-22 10:41:10
1242014,4,"不适合",2018-06-22 23:58:22
1242014,5,"不错",2018-06-22 20:28:47
1242014,5,"鞋带稍短，换大了一码就舒服了。这个年纪已经不愿意委屈自己了",2018-03-15 08:33:39
1242014,5,"不好穿 退了",2018-05-19 12:25:08
1242014,5,"严选的包装一直很完善。鞋楦很舒服 。跟不高。走路很稳。脚胖。瘦脚穿会更美。",2018-06-22 12:00:07
1242014,3,"打脚打到你哭",2018-05-09 20:18:08
1242014,5,"买过一双蓝色，上了年纪的阿姨又炒鸡心水粉色<U+0001F917><U+0001F917>",2018-04-06 06:18:13
1242014,2,"真的不知道为什么那么多好评，，，大家都是上脚试一下就评价么。第一次穿，穿了没五分钟，大脚趾头和倒数第二个脚趾头磨了三个泡。我脚型很正常啊，穿别的鞋子顶多磨脚后跟，磨脚趾头这么严重这种情况还是第一次遇到问了客服说不能退了超出退换期，也很理解。之前买过的一双很不错，但是这双鞋子请大家慎重选择，只中看不实用。",2018-06-20 18:58:21
1242014,5,"鞋子码有点小，已换",2018-06-21 09:51:25
1242014,5,"颜色漂亮，尖头鞋",2018-06-21 09:30:04
1242014,5,"买大了",2018-06-21 07:14:58
1242014,5,"买大了",2018-06-21 07:15:36
1242014,5,"很漂亮",2018-06-21 16:33:25
1242014,5,"不磨脚，但因为本身脚比较宽，头那还是有点夹脚",2018-04-03 20:23:37
1242014,5,"鞋底很软穿起来很舒服，蓝色的实际看起来比图片感觉要好，很棒棒！",2018-03-14 21:37:58
1242014,5,"本来很喜欢这个颜色可惜没有小一码的了。",2018-06-05 20:47:37
1242014,4,"特别硬，走路板脚不舒服，之前买的那双也一样，以后再也不在严选买鞋了，其他的生活用品还是可以滴",2018-06-20 13:41:16
1242014,5,"看起来不错，待ld穿后9再做细评",2018-06-18 15:15:39
1242014,5,"一如既往的好，穿上很舒服，性价比高",2018-06-18 12:30:09
1242014,5,"很好看，穿了也挺舒服的，不会觉得鞋底很薄。",2018-05-26 11:04:54
1242014,5,"很好漂亮",2018-06-20 18:30:43
1242014,5,"好看！",2018-06-20 12:30:14
1242014,5,"漂亮",2018-06-20 13:36:24
1242014,5,"大了一点点",2018-06-21 06:22:20
1242014,4,"漆皮皮质还是偏硬的，确实磨脚啊，两只脚都磨破了",2018-06-21 09:47:25
1242014,5,"鞋子颜色很正。穿着很舒服",2018-06-19 22:17:05
1242014,5,"京东快递真好！",2018-06-19 12:36:28
1242014,5,"性价比高",2018-06-19 04:01:23
1242014,5,"不错，穿着舒服",2018-06-19 10:54:25
1242014,5,"鞋子有点紧",2018-06-19 00:22:47
1242014,5,"还不错",2018-06-19 00:00:39
