"itemId","star","content","createTime"
1242014,5,"颜色很漂亮，接近肤色，显腿长，穿上也很舒服的，鞋跟高度适中，特别好配衣服。感谢严选，希望多推荐好东东！",2018-07-27 14:47:08
1242014,5,"嘘，别说话，看图。柔软好穿，连高脚背和宽脚都没在怕。",2018-05-20 16:26:29
1242014,5,"第一次在这买鞋 精致 漂亮 也很合脚 满意！",2018-06-06 08:34:29
1242014,5,"同事介绍的，说严选上的东西质量很好，价格也公道，最近鞋子坏了，正好来试试，先说价格，新用户打过折一百多块钱真的是非常良心了，收到货之后质量非常好，从包装到物流都非常专业，码数也很正，走路很舒服，同事试了也说好",2018-06-12 10:20:55
1242014,5,"不错！不错！漆皮很亮，大方精致",2018-06-07 17:47:46
1242014,5,"非常满意，价格实惠，品质还不错，颜色和图片一样！",2018-05-30 17:51:16
1242014,5,"哇哇哇，猪里皮的哇，哇哇哇，好舒服，胖脚丫子阔腿裤穿出瘦子的赶脚^_^",2018-08-12 13:48:37
1242014,5,"难道随着年龄增长脚也会长大吗？39码的非常舒服，换货速度非常快，全程免费，服务太好！完全无忧！",2018-07-26 12:41:37
1242014,5,"质量不错。包装略简单了些。第一次穿打脚痛到变形。。。质量和颜值还是很不错",2018-07-11 18:31:46
1242014,5,"很漂亮的鞋子，半码垫也很贴心，不过容易掉，要是换成可以贴的半码垫就完美了",2018-05-18 19:38:12
1242014,5,"第一次在严选购买鞋子，鞋子很好看，尺码合适，舒服，跟的高度也合适，售后服务也是棒棒哒<U+0001F44D>",2018-05-16 16:54:35
1242014,5,"跟高度正好合适，上班休闲都适用。稍稍偏大一丁点儿。。。。色度柔合，皮质不错。继续严选买买买！",2018-06-04 09:20:05
1242014,5,"中了严选的毒了，质量真的是严格选用的，价位也适中，某宝已被冷落了，哈哈哈！",2018-05-20 17:50:55
1242014,5,"平时38的，这次也是38的稍微有点大。要是有37.5的就更好了。",2018-05-18 19:10:17
1242014,4,"大小刚好，皮质柔软，周年庆价格150+实惠，第一次严选买鞋， 还没有穿着走路希望走路舒服，先给好评",2018-04-22 17:05:40
1242014,5,"穿上很舒适，很淑女、优雅，颜色好搭配服饰，鞋跟高度合适，走路不累人，超级喜欢<U+0001F495>",2018-05-25 22:43:23
1242014,5,"夏天配职业装不错呦！还送半垫哩，等待夏天！玖熙制造商卖这个价，不抢不行啊！",2018-05-02 16:50:08
1242014,5,"很喜欢我的脚是肉肉的宽脚型，买的大一码，这个鞋子很显瘦，超爱",2018-04-08 12:36:58
1242014,5,"最喜欢这种简洁大方的款式了 而且后面又透气 搭配裤子裙子都好看 感觉黑色也会很漂亮",2018-04-12 18:45:22
1242014,5,"平时平底鞋运动鞋都是36码，这款36有一点点大，贴个半码垫正合适。皮质很软。",2018-04-11 21:49:16
1242014,5,"鞋子的质量非常好，皮质很柔软，走起来很舒服。而且鞋型也很不错这个价格已经算超值了！",2018-03-29 15:50:48
1242014,5,"非常美貌，也轻便。要是有34码就更完美了，略大了点。还送了半码垫，贴心！",2018-03-27 19:38:56
1242014,5,"很美的鞋子～有非常有质感～良心做工～～我自己觉得码正～喜欢的的小伙伴别犹豫了",2018-04-03 20:31:19
1242014,5,"不错，就是鞋跟稍微有点晃，适应一下吧。女朋友比较喜欢，严选不错呦。<U+0001F60F><U+0001F60F><U+0001F60F>",2018-04-03 19:22:22
1242014,5,"鞋子已经收到了 女朋友很满意 上脚舒服位置也比较正 跟也很舒服走路不会累 网易严选一直很满意",2018-04-15 09:07:46
1242014,5,"质量很好，性价比超高，脚显瘦，走起路来也不累，非常满意。",2018-06-23 15:36:24
1242014,5,"拍得暗了，其实很暖的雾岚色，小猫跟很女人很性感，期待夏天穿裙子，一定美美哒",2018-03-21 13:59:24
1242014,5,"没想到我这个超级大脚也能穿这么秀气的鞋子，惊喜啊！超舒服的，跟也很稳！",2018-04-10 20:10:00
1242014,5,"中了严选的毒了，每样都好喜欢，超漂亮的鞋子，还送了半码垫和替换钉，好贴心。",2018-03-26 10:09:57
1242014,5,"很合脚，颜色好看，显脚白。平时37、38，这双是尖头鞋，要选38码。",2018-05-19 17:56:25
1242014,5,"很舒服，跟很舒服，我觉得码那还，平时39，40这个还行，刚穿有点紧，再穿还行",2018-03-14 18:46:45
1242014,5,"包装很用心，商品质量扛扛的，打开迫不及待的试穿上，很喜欢哦！推荐同事一起买买买！大爱严选！",2018-03-15 22:16:28
1242014,5,"鞋跟看起来是斜的，但上脚很舒适，感受不到坡度。很好看，超满意",2018-05-05 00:44:08
1242014,5,"质量很好，不累，适合瘦脚的，适合脚瘦的，穿的时候最好穿船袜",2018-04-10 15:58:10
1242014,5,"非常喜欢，质量很好，颜色很正，穿鞋也很舒服，希望天气快点暖和起来可以穿了",2018-03-21 21:49:50
1242014,5,"还好还好，没有失望，第一次买鞋头这么尖的，很喜欢！百搭款",2018-06-21 10:51:20
1242014,5,"还是顺丰更快，喜欢～我穿37，这双也选了37，正好。小尖头漆皮，挺舒适，性价比挺高",2018-03-15 12:58:22
1242014,5,"简约而不简单，码数也很正，非常合脚，还贴心的送了半码垫，钟意！",2018-04-03 14:21:17
1242014,5,"尺码标准，我这个板寸脚都很适合，试着舒服，真的挺喜欢！价格也很美！",2018-04-03 10:49:37
1242014,5,"码正好，漂亮，舒服，小细跟在夏天也这么轻盈。严选，不用操心，放心买",2018-06-11 14:35:46
1242014,5,"送给妈妈的，妈妈很喜欢，跟的高低刚刚好，很舒服
最想表达的是感谢快递小哥，太牛掰了，十分好评",2018-03-20 15:34:44
1242014,5,"非常喜欢，不累，就是我脚背宽，前面有点挤，质量很好，很漂亮",2018-06-24 21:29:45
1242014,5,"好看又好穿，追加了一双蓝色的",2018-08-19 17:59:36
1242014,5,"今晚送给她了，非常喜欢",2018-08-15 01:14:21
1242014,5,"鞋子很漂亮！有一点点的不跟脚，但是并不影响我对鞋子的喜欢<U+0001F495>！还会一如继往地在严选购物。",2018-03-30 18:24:07
1242014,5,"上班时换上和欢喜的粉鞋
幸福感包围着我们 
在上班的时候 透气又酥服的你是我夏天不二选择
愿你今天被优雅包围 被幸福宠溺",2018-08-12 11:46:42
1242014,5,"第一次买小猫跟鞋子，穿上很性感，买的百搭的裸藕粉，不错<U+0001F44D>",2018-04-04 14:24:57
1242014,5,"鞋子很漂亮，穿上也舒服",2018-08-13 11:18:54
1242014,5,"这双买的时候挺犹豫，但是上脚后特别舒服，感觉37码稍微有一丢丢偏大。穿起来还显脚瘦",2018-04-14 20:30:52
1242014,5,"",2018-08-06 18:29:57
1242014,5,"穿起来脚感让人惊喜啊，一百多块钱很少能买到这么舒服的鞋子",2018-03-27 18:06:13
1242014,5,"好看 黑色百搭",2018-08-01 14:08:13
1242014,5,"特别满意。跟很稳，很舒服，穿着它可以奔跑，一点都不累。",2018-06-20 12:15:22
1242014,5,"好看！",2018-07-31 10:46:45
1242014,5,"啊～好好看～底比较舒服。平时穿37.5的运动鞋，这个38刚好，前脚掌比较宽",2018-04-13 20:56:27
1242014,5,"好评",2018-07-23 07:13:36
1242014,5,"还行",2018-07-21 18:51:54
1242014,5,"好评",2018-07-21 06:14:02
1242014,5,"好评",2018-07-20 07:21:53
1242014,5,"特别粉嫩很好看，喜欢，夏天配裙子超赞啊！就是我买了就降价了",2018-03-15 18:11:19
1242014,5,"一起买了严选好多鞋，就是舒服，最低的价格买到最好的东西",2018-04-21 11:13:30
1242014,5,"舒服，好看",2018-07-02 18:27:52
1242014,5,"码子很正，皮子比较硬，但是把脚包裹得很好，上脚感觉还不错",2018-04-09 21:12:36
1242014,5,"到了立马上脚，真心喜欢～颜色天蓝调了灰调，知性又清爽，小巧的猫跟，皮子不会太硬，很好穿的感觉～大爱严选了～",2018-06-01 10:57:32
1242014,5,"美美哒，记不清在严选买了第几双鞋了。都不错",2018-06-15 12:15:45
1242014,5,"快递真是快啊，比较合脚，应该穿起来走路不累，过几天天气转暖就可以试试了，到时候再来追评哦",2018-03-22 20:55:53
1242014,5,"要是有半码的就好了，秀气",2018-06-16 10:37:35
1242014,5,"尺码略大，比平时穿的小半码吧，就刚好。颜色很好，也好穿",2018-04-21 22:56:24
1242014,5,"喜欢！",2018-06-14 00:08:06
1242014,5,"非常惊喜，码数很准也不掉鞋，特别漂亮，这个价格真是太值了",2018-03-29 19:35:51
1242014,5,"特别喜欢，版型很好，不知道遇水会不会滑，颜色比较百搭",2018-03-29 00:22:42
1242014,5,"很舒服，颜色也漂亮，被老公拐着成严选忠粉",2018-06-06 17:24:28
1242014,5,"很好看，可惜码数太小",2018-06-10 02:29:42
1242014,4,"鞋底太硬 建议买大一码 穿个保护脚掌的袜子会舒服一些",2018-04-12 19:38:49
1242014,5,"很久没有买百元的鞋子，不输大品牌，要接着出美鞋哦",2018-04-11 22:14:32
1242014,5,"第一次在严选买鞋子，穿着舒适，好",2018-06-04 13:05:00
1242014,5,"非常好穿，之前买的蓝色觉得不是特别好搭衣服就换了粉色，棒棒哒，上<U+2B07><U+FE0F>班走路也ok，大爱严选～",2018-03-28 23:35:42
1242014,5,"一如既往的相信严选。品质保障，非常满意的购物喔！",2018-05-29 11:07:21
1242014,5,"好穿呢，刚好合适，超满意！",2018-06-02 15:03:58
1242014,5,"超棒哦，严选每双鞋子的性价比都超级高",2018-05-08 22:56:54
1242014,5,"好看，穿起来也很好哟，配裙子很洋气",2018-05-27 11:47:58
1242014,5,"尖尖的头，很俏皮，走起路来也比较舒适～",2018-05-20 13:25:23
1242014,5,"大小合适，高度也不累脚，满意。",2018-05-26 10:44:39
1242014,5,"蓝色显白，穿着舒适",2018-05-26 10:08:48
1242014,5,"穿上美美哒，获得不少好评",2018-05-23 00:13:27
1242014,5,"第一次晒实物图<U+0001F605>，鞋子超级漂亮的<U+0001F60D><U+0001F60D><U+0001F618><U+0001F618>，准备再入手两三双换着穿了<U+0001F60E><U+0001F60E><U+0001F60E>",2018-03-17 10:29:54
1242014,5,"质量没的说，稳稳的，颜色也好看",2018-05-19 14:33:17
1242014,5,"好评ghhbvgjbbggbhgffgggggggggggggggg",2018-05-18 08:21:34
1242014,5,"凑单买的，喜欢、颜色也好，等等穿上配我的裙子",2018-05-15 19:40:11
1242014,5,"物流很快，鞋子做工很细致，时尚百搭，好评",2018-05-15 22:26:37
1242014,5,"真当好看的",2018-05-16 10:09:29
1242014,5,"很显瘦啊，穿着也很好舒服",2018-05-15 13:26:28
1242014,5,"穿上很美，脚显瘦，跟的高度正合适",2018-05-10 14:38:34
1242014,5,"很好穿 舒服",2018-05-13 16:06:53
1242014,5,"漆皮鞋，很漂亮。跟的高矮也很舒服。一直信任严选，真心的不错",2018-03-20 13:46:42
1242014,5,"质量超好，造型独特，还有备用的根，还有半垫。穿着也舒服",2018-04-03 18:51:54
1242014,5,"颜色正、穿着舒服、角度好，比在商场买的400+的都舒服！",2018-04-03 14:38:05
1242014,5,"做工好上脚稳 不错",2018-05-07 20:29:31
1242014,5,"正当季，裸藕色很跟肤色，穿着合脚",2018-05-03 15:08:07
1242014,5,"37裸色换成36蓝色，其实两个颜色都超级喜欢。作为 一个运动鞋控，发现高跟鞋真是好看。个人认为，鞋码偏大，可以买小一号哦。",2018-03-29 11:19:56
1242014,5,"品质到位了，就是码号有些小。",2018-05-03 15:10:49
1242014,5,"美美的，色素雅，很喜g。
舒m度也高，裸色好搭配，感X是接下月出勤最高的一p鞋子。",2018-03-14 17:34:32
1242014,5,"已经穿了好几天了，真的是不错，很舒服，走起路来不费脚，我喜欢！！",2018-05-02 18:18:41
1242014,5,"轻便好走，实物颜色更深，显脚脏，漆皮亮光不够闪，也不够亮，显得没有档次",2018-08-21 09:09:12
1242014,5,"鞋跟高度比较舒适，鞋的带子稍微有些松，由于是尖头鞋，鞋的前脸有些长，我是宽脚，穿上果然有些挤。总体来说鞋子性价比可以。",2018-08-17 13:53:16
1242014,5,"上脚超好看，我脚太瘦了有丢丢大，可能穿丝袜会好点，码数很正，鞋底很舒服，一点也不薄、超赞超赞",2018-03-26 17:02:19
1242014,5,"好评",2018-05-01 10:38:37
1242014,5,"很好看的鞋子，和想象中一样漂亮，会继续支持严选的。",2018-04-17 18:21:45
1242014,5,"好看，有点顶脚",2018-04-30 12:11:23
1242014,5,"非常漂亮，可惜我穿长了，希望严选可以出34码的鞋啊。",2018-03-25 08:25:25
1242014,4,"活动价买的，跟不高，穿着不累，但是鞋子有点硬，穿一点时间看能不能软一点",2018-08-17 11:29:33
1242014,5,"有些硬，可能是第一次穿得原因，还没有穿袜子，结果脸都磨破了。鞋子有点偏小，也可能是夏天穿凉鞋的原因，脚会比冬天大点",2018-08-16 11:46:24
1242014,3,"磨脚",2018-08-17 11:30:41
1242014,5,"鞋型好，很舒适，内里真皮，特别柔软。就是这个裸色不太显白，肤色不够白的慎选。平时运动鞋38，这双也38，很合适。最近爱上严选的鞋子，楦型都特别棒，高跟重心很稳，材质很良心，价格也很良心。希望可以继续保持下去。",2018-04-29 12:13:43
1242014,5,"很不错，居然不累脚，码很准",2018-04-28 15:52:19
1242014,5,"蛮好看的，就是开始有点磨脚",2018-08-12 15:51:21
1242014,5,"舒服",2018-04-27 22:50:28
1242014,5,"",2018-04-24 07:33:20
1242014,5,"质量很好，颜色也不错。",2018-04-22 20:20:38
1242014,5,"胖脚丫穿了依旧显脚小，非常女人味，满足，点赞！",2018-04-08 18:31:07
1242014,3,"鞋子超级超级磨脚哦，穿了一早上就磨了四个水泡<U+0001F62D><U+0001F62D><U+0001F62D>",2018-08-17 12:03:14
1242014,5,"鞋子上脚很舒服，这个价格买到这个鞋子，心里在偷笑。颜色很耐看，一入网易深似海啊，什么都来买了，质量细节都不错。",2018-03-26 21:30:46
1242014,5,"皮质有点硬，会磨脚。跟不高，走起来很平稳。",2018-08-14 09:40:58
1242014,5,"很不喜欢，穿第二天就磨破皮了。",2018-07-20 07:40:04
1242014,5,"很仙很美哦 37码 裸色简直不要太淑女啦",2018-04-07 10:27:29
1242014,3,"我能说这双鞋子有点压脚吗？
穿着不是非常舒服。",2018-07-04 14:50:06
1242014,5,"可以说是非常感动的一次严选购物了，相中很久了，就买回来了，不过尺寸不敢确定，结果买的平时穿的高跟鞋尺码38，结果买回来不行，太挤了……刚好收到就去兰州出差了，我以为是下午脚会有点大，就带着去了，结果第二天早起见客户之前穿着下去吃了点早餐，几百米路实在不行，就申请了退换，结果约好的快递等我出差到家刚好没赶上，就直接去了顺丰物流点，连鞋盒等都没来得及拿就直接寄过去了，没想到两天就收到这双鞋子了，配件等一应俱全，太开心了，穿上刚刚好，很舒服，已经成了妥妥的严选粉",2018-07-27 19:05:35
1242014,5,"我是瘦脚，第二个脚趾长，应该选38.5，怕松，所以选了38。刚试了脚底感觉很舒服，但是脚趾有点挤，希望穿穿能够松一点。",2018-07-20 19:56:51
1242014,5,"超级喜欢 显得脚瘦，包装精美",2018-04-20 09:39:26
1242014,5,"给孩子他妈妈买的，码数应该没问题！等试试再说吧！",2018-03-16 16:09:10
1242014,5,"颜色好款式老气了",2018-07-29 23:03:39
1242014,5,"很不错的，谢谢！",2018-04-19 16:05:43
1242014,3,"磨脚后跟",2018-07-20 15:17:16
1242014,5,"好看，颜色也是很漂亮的粉色，大爱！就是刚穿有点紧",2018-03-14 12:51:16
1242014,5,"搭配牛仔裤也好看，超美！",2018-04-17 17:32:35
1242014,5,"买的有点大了，不过质量还是不错的的",2018-04-09 23:21:19
1242014,5,"大小很合适  码子正   颜色和款式不错  脚感稍微有点硬",2018-04-03 10:38:41
1242014,5,"看了很久了，有一次看见只有一双，尽管拿的不是最低价，但是也毫不犹豫拿下了…尖头的有点难受，因为我脚胖…如果买大一码可能舒服一点吧，看评论说掉跟，那正码应该也行！",2018-07-22 20:08:16
1242014,5,"买大了一码，挺好的…感觉变温油了",2018-04-12 10:15:03
1242014,5,"非常美丽，发现也很合适，这个季节穿正好哦",2018-04-14 12:30:20
1242014,5,"实物颜色无色差，鞋子很收脚，不过尖头鞋还是有点磨脚",2018-07-03 09:06:40
1242014,5,"上脚效果好，鞋号标准，喜欢，打算活动再入一双浅色的",2018-03-24 17:46:58
1242014,5,"喜欢 码数感觉稍微有点小 下午脚撑起来穿着有点挤，不过还是貌美的。自己一双 买了一双送妈妈。要是松紧带再多点弹力就好啦",2018-04-02 19:23:09
1242014,5,"不知道咋退的，反正已经退了，觉得颜色不适合我，另外，我是宽脚，看评论说可以hold住，其实不行，还是挤脚。",2018-06-15 18:24:42
1242014,5,"非常好，尺码偏大，换了小一码刚刚好",2018-04-10 19:25:00
1242014,5,"很舒服，跟不高，走路一点都不累！",2018-06-10 19:09:04
1242014,5,"脚肥的就算了 鞋型不合适 大一码嫌长刚刚合适的码数卡脚",2018-06-10 09:14:07
1242014,5,"样子很漂亮，但是我脚丫偏胖，不合适退货了",2018-06-17 08:54:16
1242014,5,"很好看，很舒服，哈哈哈",2018-04-13 22:10:05
1242014,5,"还不错哦，款式很漂亮",2018-04-13 22:02:28
1242014,5,"有点儿不太舒服，退货了",2018-06-09 18:16:38
1242014,5,"颜色很好看，穿着一点不累",2018-04-12 10:20:02
1242014,5,"我真的很满意很满意非常满意！！第一次在严选买东西，鞋子很好看，码也很正。我是按照平时的码数买的，其实加了半码垫也不会很紧。物流超快，昨天下午下的单，今天就到了，速度和品质杠杠的。入坑了不行了。。这鞋子是我准备做伴娘的鞋子！祝各位好运！",2018-04-12 20:39:38
1242014,5,"鞋跟很稳，高度舒适，很百搭。",2018-04-11 16:45:01
1242014,5,"自己买了一双，又给同事买了一双，效果棒棒哒",2018-03-28 13:48:36
1242014,5,"颜色不错，不抢眼。样式也好看。平时运动鞋穿39，船鞋、尖头鞋穿38，但这双买的38有点小，稍微有点挤脚。但估计买39的会大吧。买了个鞋楦撑一撑。希望会好。",2018-04-10 19:54:46
1242014,5,"很喜欢，漂亮",2018-04-09 22:57:05
1242014,3,"穿了两次，每次脚趾前面都被磨破脚。。。。。",2018-06-08 19:59:39
1242014,5,"我开始按平常36拍的，可能脚有点宽，所以换了一双37，喜欢这种气质款，真是中了严选的毒了，每天都想买点东西，以后鞋子就咱家了",2018-04-03 12:06:52
1242014,5,"好看，只是有些硬",2018-06-02 11:09:58
1242014,5,"穿着磨脚，磨了两个大水泡",2018-06-06 18:19:43
1242014,5,"这个价格满意到无话可说",2018-04-08 12:48:15
1242014,5,"特别好看！",2018-04-07 18:47:10
1242014,5,"很舒服，大小合适，样式清新靓丽",2018-04-06 10:08:36
1242014,5,"走路舒服！",2018-06-02 17:16:53
1242014,5,"外观漂亮",2018-04-06 23:26:29
1242014,5,"真心特别棒，颜色很喜欢，而且穿上跟也特别稳，跟平底鞋似的，特别喜欢，已经买了玖熙制造商的好几双鞋子了，最近听说玖熙破产了，还挺难过的，万一以后没有这么稳的高跟鞋穿了怎么办、那就抓紧时间赶紧买买买吧",2018-04-06 19:23:06
1242014,5,"样子很匹配，挺好看的，但第一天穿有点刮脚，第二天好些了。",2018-06-04 19:13:03
1242014,4,"退了。不偏的尖头漆皮不适合我，而且比较小点，建议加大一码。鞋有些硬，不喜欢。",2018-06-01 16:13:35
1242014,5,"非常满意的一次购物体验！鞋子一般在网上天不太好的。但此鞋码正，跟脚，颜色文静不俗穿着舒服！还贴心送了半码垫！快递给力！还会再买！",2018-04-04 18:23:30
1242014,5,"鞋底是猪皮的，很软。穿的不累，第一次在严选买鞋子，舒服，性价比极高。夏天到了，小姐姐们可以买起来了，小裙子的百搭鞋<U+0001F483>包装很精美",2018-04-04 13:40:29
1242014,5,"尺码发错啦！！！！给我发的37难怪穿大了！",2018-06-05 08:27:10
1242014,5,"非常满意，网易严选赞",2018-04-05 12:33:06
1242014,5,"虽然很遗憾退了，但是严选服务真是棒",2018-06-02 10:52:43
1242014,5,"第一天穿，很好看，可能是因为很少穿高跟鞋的缘故，脚趾上还是磨起了泡，每个脚三个泡，明天可能不敢穿了",2018-05-29 12:36:58
1242014,5,"好看 舒服",2018-04-05 15:32:30
1242014,5,"很舒服的鞋子，穿着很稳。",2018-04-04 13:40:32
1242014,5,"很好，包脚，颜色也百搭，就是觉得旁边的蝴蝶结多余。",2018-06-02 01:17:06
1242014,5,"美丽，脚宽的也能好看",2018-04-04 11:01:37
1242014,5,"样子非常好，只是我不习惯穿高跟鞋",2018-06-01 20:13:10
1242014,5,"鞋型颜色都不错，大方百搭，小猫跟不累，唯一缺点是漆皮还是略硬，走路多了还是有点磨脚的。",2018-06-01 11:29:00
1242014,5,"好看秀气，但磨脚，需要穿袜子",2018-05-27 22:01:59
1242014,5,"鞋子很漂亮，还送备用跟和半码垫！",2018-04-02 15:54:06
1242014,4,"鞋底容易滑，其他都好",2018-05-21 12:19:22
1242014,5,"免费换了尺码，性价比超高，以后就严选啦！",2018-04-02 14:24:00
1242014,5,"买小了，售后服务不错",2018-05-19 21:50:14
1242014,1,"鞋子很硬很磨脚，走路十分钟就磨破了。",2018-05-26 11:11:16
1242014,3,"只能说样子还行，但是真的不舒服，底滑，皮质硬，后面的松紧带很容易掉",2018-05-16 09:44:36
1242014,5,"Nice，为了拍婚纱照购入的鞋子。完美",2018-04-03 17:20:02
1242014,5,"好看，也很舒服",2018-04-03 20:57:14
1242014,5,"鞋面有点挤脚，颜色很美，也许是新鞋的缘故吧……但愿穿穿就好了",2018-05-25 12:37:41
1242014,5,"买了三双，打七折，价格比较实惠。之前买过蓝色款，挺喜欢的，这次又追加买裸色款两色都喜欢。夏天赤脚穿着去上班也很职业。",2018-03-22 22:17:26
1242014,5,"美美哒",2018-04-02 16:50:23
1242014,5,"我的脚属于特别瘦的类型，一般穿37、38号，这双鞋买了37号，一开始穿稍微有点顶，但鞋子都是越穿越大的，所以脚瘦的小仙女还是不要买太大～还没穿出去过，但真的超好看！裸色超显腿长～",2018-05-23 11:59:45
1242014,5,"小猫鞋今年流行的款式，漂亮个<U+0001F604>",2018-03-31 14:18:00
1242014,5,"网易的质量都很好很好，就是这款鞋子容易磨脚，穿着上课，就在学校范围内走，就给我打下了六个大水泡，真心是疼啊～～",2018-05-21 10:35:50
1242014,5,"鞋子是朋友推荐来买的，很舒服。",2018-04-01 23:36:01
1242014,5,"很美质量也好，穿着很舒适",2018-03-31 20:48:12
1242014,5,"严选忠粉，过程有些小插曲！不过愉快的解决了！",2018-03-27 10:55:35
1242014,5,"好美哦！！",2018-03-30 11:06:07
1242014,4,"款式很漂亮，穿上也很舒服，不磨脚。有点小瑕疵的是跟有点重，总的来说性价比颇高",2018-05-04 03:55:30
1242014,5,"非常满意",2018-03-29 13:49:42
1242014,5,"好看哎",2018-03-29 12:31:28
1242014,5,"鞋型挺满意，第一次穿的时候有点挤脚，第二次穿久了有点累，不过没有挤脚了，希望越穿越舒服",2018-05-13 19:33:57
1242014,5,"很喜欢，是我喜欢的类型，不过严选的鞋子有个弊端，就是鞋底不防滑",2018-05-18 21:13:00
1242014,5,"真皮，我前脚掌宽一些。有点挤。还是很满意的。",2018-05-04 09:49:23
1242014,5,"很美的鞋，脚肥一点也能穿的",2018-03-27 17:00:53
1242014,5,"低调的奢华，简单，漂亮，喜欢这种风格，穿着也舒服",2018-03-25 10:43:54
1242014,5,"很舒服，性价比很高。",2018-03-28 14:01:05
1242014,5,"合脚真心喜欢",2018-03-28 19:38:57
1242014,5,"喜欢喜欢！这两年最流行的小猫跟！而且夏天穿脚踝也透气哒！浅粉色好搭配又显气质。而且性价比也特别高啊，是我最便宜的一双皮鞋了。严选不得不说 真是赞！成为粉色也把朋友家人带成了粉丝！",2018-03-28 23:42:58
1242014,5,"颜色跟图片里有差异，相对深一些，穿起来很舒服，相比鞋跟，鞋前掌声音更大",2018-04-28 23:35:10
1242014,5,"不错，很有型，不过就是有点气味",2018-05-04 10:55:40
1242014,5,"鞋子美",2018-03-27 09:12:27
1242014,5,"几年没买高跟鞋了，主要怕加重我的腰椎间盘突出，但是还是没忍住剁手了，试穿了15分钟才确认收货，感觉还可以，具体需要穿多一天才能保证，不管了，好不好都买一对尝试下吧。颜值的确高，穿上马上显腿长。",2018-03-27 20:48:16
1242014,5,"鞋非常漂亮的，期待下次特价再入手一双换着穿",2018-03-19 13:25:44
1242014,5,"好看 看图",2018-03-26 18:44:13
1242014,5,"这个之前买36吗，偏小送人了，结果重买一双37的，又有点松，不跟脚，这些都不是问题，关键是后面的带子磨脚，半天一个大血泡，不推荐！！",2018-05-07 23:50:24
1242014,5,"颜色很棒",2018-03-26 02:01:49
1242014,5,"",2018-03-24 12:37:18
1242014,5,"颜色及鞋型都非常好，但是后面磨皮了",2018-05-07 22:01:42
1242014,5,"很美的颜色 就是穿久了有点打脚",2018-04-29 20:48:54
1242014,5,"鞋子超级舒服，而且鞋跟一点儿不累。显脚瘦，特别范儿！",2018-03-16 22:44:14
