"itemId","star","content","createTime"
1242014,5,"码数偏小送人了",2018-05-07 23:50:52
1242014,5,"颜色好看，穿着平稳，美中不足的是前脚掌比较硬，走起路来会累，宽脚板的可以买。",2018-05-08 12:02:50
1242014,5,"朋友说很好看",2018-05-07 13:25:47
1242014,5,"很满意",2018-05-07 16:33:28
1242014,5,"<U+0001F44C>",2018-05-07 22:24:26
1242014,5,"不错",2018-05-07 17:11:53
1242014,5,"发货及时，包装物料很结实，产品更合我心意",2018-05-05 21:04:39
1242014,5,"感觉有点小，但是大一码肯定会大，不换了，质量对得起价格",2018-03-16 19:00:24
1242014,5,"挺合适的",2018-05-06 16:40:46
1242014,5,"还好吧",2018-05-06 10:04:09
1242014,5,"好穿",2018-05-06 22:36:14
1242014,5,"非常漂亮",2018-05-06 23:58:33
1242014,1,"超级硬，退了已经",2018-05-07 11:34:09
1242014,5,"不错",2018-05-06 09:58:02
1242014,5,"松紧带有些紧，得穿一阵子才能合脚。试穿很稳当。",2018-04-22 22:27:58
1242014,5,"试穿了一下，松紧带这里有点刮脚",2018-05-01 22:01:10
1242014,5,"颜色粉嫩，穿上脚显瘦，跟有特色不太累，是上班族首选。",2018-03-31 08:50:39
1242014,5,"还不错，唯一一点脚尖比较尖可能有点磨脚",2018-05-04 12:35:57
1242014,5,"鞋子性价比还不错，很女人，跟感觉和平底差不多，穿着高度适合。不过，个人感觉鞋有点硬，鞋头有点太尖了，因为245的脚，太尖了，前面长了，看上去脚大。图四的跟，还有其他细节处理的有点粗糙了。整体还行吧。",2018-04-30 22:10:46
1242014,5,"严选不负我之期望！老婆满意就是硬道理<U+0001F601><U+0001F601>",2018-03-31 07:53:57
1242014,3,"鞋子前面挤脚，后面又不够跟脚，码号偏小。好看是很好看的，可以不太好穿",2018-05-04 22:25:41
1242014,5,"真的很棒，但是小了，只能退了",2018-05-01 23:12:07
1242014,5,"鞋子好看，尖头鞋码选大一点好",2018-05-05 08:51:26
1242014,5,"非常喜欢",2018-05-05 23:07:53
1242014,5,"不错",2018-05-05 21:19:03
1242014,5,"还算好穿，平时穿这种鞋比较少。",2018-05-04 23:37:51
1242014,5,"样子很好了，就是hangchua不习惯",2018-05-04 12:29:56
1242014,5,"有点小了，已协调换大一码，服务挺好",2018-04-30 14:49:51
1242014,5,"款式非常精致，也很女人。",2018-05-04 11:25:18
1242014,5,"不习惯穿高跟还是会觉得有点高 不过这个价格很不错了",2018-05-10 12:30:02
1242014,5,"舒服，不磨脚，很职业",2018-05-04 10:55:37
1242014,5,"很好，她很喜欢",2018-05-04 22:33:53
1242014,5,"平常37码的鞋，这个大半码，但有送半码垫。鞋子很舒服，我属于宽脚，平时也不怎么穿高跟，试了试很舒服。",2018-05-12 21:07:23
1242014,5,"还没穿",2018-05-04 22:25:02
1242014,5,"一般",2018-05-04 11:07:02
1242014,5,"质量不错 跟很舒服 偏大一点垫上半垫正好。",2018-04-26 13:53:08
1242014,5,"买了蓝色的，又买了裸色的，因为百搭因为好穿。",2018-03-29 18:00:35
1242014,5,"这个退了，因为脸太长了穿上去不太秀气，浅色的留下来了",2018-05-04 14:48:30
1242014,5,"超划算。质量又好又好看",2018-05-03 07:18:20
1242014,5,"不合脚，退掉了",2018-05-06 12:25:18
1242014,5,"很漂亮，第一次穿有点磨脚，希望穿穿会好",2018-05-10 15:02:12
1242014,5,"鞋子很漂亮，码字买小了，上班族坐久了容易水肿，鞋子应该买大半码或者一码好，天热的时候不敢穿了，磨脚，冷一点的时候刚好",2018-05-05 12:12:20
1242014,5,"鞋不错，穿着挺舒服",2018-05-03 11:04:05
1242014,5,"非常漂亮，老婆很喜欢",2018-05-03 07:09:49
1242014,5,"还没穿，应该合适",2018-05-03 13:49:38
1242014,5,"好看，但偏小。",2018-05-03 17:06:10
1242014,4,"首先 鞋子非常稳，一点不像细跟的，非常棒
另外就是鞋子穿起来不高，不累
就一点 太磨脚 第一天磨出大水泡 大概是我脚型不合适。。？
颜色没有图中那么嫩，是正经裸色",2018-05-10 14:49:13
1242014,5,"昨天下午5点下单，今早9点多就到，太快了！鞋子不错",2018-03-28 11:55:40
1242014,5,"挺喜欢的，一直纠结要不要买，买回来没有让我失望，但是我的脚太大了，穿上去前面脚趾还是有点挤脚，但喜欢不想退了，毕竟已经买的39码了，退了就没有办法要这款鞋子了",2018-05-02 15:04:11
1242014,3,"鞋子穿时间略长还是不舒服",2018-05-04 12:11:09
1242014,5,"好，试了试，还没穿",2018-05-02 10:57:07
1242014,5,"好看 前掌舒服有软垫",2018-05-02 09:10:26
1242014,5,"很合脚，时髦又舒适",2018-05-02 20:12:26
1242014,5,"挺优雅的，不错。",2018-05-02 11:16:10
1242014,4,"脚肥的不合适，卡脚。",2018-05-04 23:07:46
1242014,5,"买小了，",2018-05-02 15:51:05
1242014,5,"很舒服",2018-05-02 12:47:56
1242014,5,"偏大",2018-05-02 21:08:29
1242014,5,"不错，喜欢",2018-05-02 12:50:38
1242014,5,"非常舒服",2018-05-02 23:45:33
1242014,5,"很好，很显气质，送给婆婆的，严选真的很称心",2018-05-01 18:47:37
1242014,5,"很好，我穿小了，送同事了~",2018-05-01 13:37:35
1242014,5,"限时购买的，不错，很漂亮，值得拥有",2018-05-01 17:28:52
1242014,5,"跟不太稳，而且有些磨脚",2018-05-01 06:40:44
1242014,5,"这双很漂亮，白搭，舒服",2018-05-01 12:55:36
1242014,5,"非常不错，其实刚开始买了一双38号的给退了，因为感觉太尖怕会夹脚就忍着有点心爱退掉了，然后就开始每天都惦记这双鞋了，因为真的喜欢，穿着也挺舒服就念念不忘了，然后终于没过多久又打折了，就下手了双39的！简直心头发爱啦<U+2764><U+FE0F>无论样子，舒适度还是价格都简直了！哦对，裤子也是严选的，东西确实不错。就是样子都太少啦啦",2018-05-10 15:50:16
1242014,5,"还没穿，应该不错",2018-05-01 07:22:47
1242014,5,"百搭，质量很好",2018-05-01 12:20:31
1242014,5,"很舒服，但是没有我的码了",2018-05-02 12:47:23
1242014,5,"好看有品位",2018-05-01 10:52:17
1242014,5,"质量超赞",2018-05-01 13:56:46
1242014,5,"好",2018-05-01 21:16:24
1242014,5,"好",2018-05-01 21:09:49
1242014,5,"漂亮",2018-05-01 04:00:06
1242014,5,"一直那么好用，中了严选的毒了哈哈",2018-04-29 10:49:33
1242014,1,"十分失望的一款商品，看评论都是清一色的好，难道把差评删了？这款鞋子抄袭大牌，但是只有模样，而里子完全没可比性，出于好奇和期待下了单，然而我就走”下楼买包瓜子都不愿意再穿上楼，直接脱了放车内，不敢想象如果穿去上班得多么痛苦，附上你抄袭大牌的照片，别把山寨产品放上来了！好自为之！",2018-04-30 23:45:09
1242014,5,"很漂亮，颜色很正，大小也合适，很值得购买",2018-04-29 10:18:36
1242014,5,"码数偏小，平时穿38，换了39码，正好，舒适度很高",2018-04-08 13:03:29
1242014,3,"鞋的角度很好，不累。但是，漆皮太硬，磨脚太厉害。穿过国内很多品牌的高跟鞋，还有Mk，这双鞋无疑是真皮鞋里最夹脚的一双。本人脚瘦，运动鞋37.5，以往买尖头鞋只买36.5的，而这双是37的，竟然连夹带磨无法忍受。不知道里面那些百分百舒适的评价是怎么来的。",2018-04-30 14:07:37
1242014,5,"鞋子很漂亮，只是我穿着有点夹脚，没有多远就不舒服了。希望可以把鞋头做的再舒服一点，这样就更完美了，h",2018-04-30 19:22:21
1242014,5,"平时37，38码的脚，脚偏瘦，买了37码的大，换了36码的，可以带住，前面稍挤脚，鞋跟高度舒适，颜色也漂亮，夏天必备",2018-04-04 14:39:10
1242014,5,"很漂亮，穿的很舒服，很喜欢！",2018-04-30 19:31:01
1242014,5,"高矮合适 在家走了一圈不累",2018-04-30 11:57:51
1242014,5,"很好，大小合适，舒服。",2018-04-30 19:46:31
1242014,5,"非常满意的购物",2018-04-30 01:15:43
1242014,2,"穿了两个小时，脚上起了六个泡，后来光脚回来了，再不在严选买鞋子了",2018-04-29 22:46:54
1242014,5,"好漂亮",2018-04-30 19:16:29
1242014,5,"舒服，好看",2018-04-30 16:20:53
1242014,5,"合脚",2018-04-30 14:02:49
1242014,5,"好",2018-04-30 11:40:29
1242014,5,"尺码偏大，样式看起来还可以",2018-04-29 23:28:24
1242014,5,"超好看，也喜欢",2018-04-29 09:56:00
1242014,5,"款式好看",2018-04-29 22:23:19
1242014,5,"特别好。",2018-04-29 18:18:36
1242014,5,"漂亮",2018-04-29 10:04:20
1242014,3,"鞋子硬 会打脚 样子不错 没有7cm那一款舒服",2018-04-11 02:17:16
1242014,5,"非常轻巧的感觉，从式样，到颜色以及穿上的感觉，很好！",2018-04-06 21:53:55
1242014,5,"鞋子造型不错，要是头再长一点就更帅了",2018-04-15 08:39:23
1242014,5,"鞋头太尖，脚疼啊",2018-04-08 12:51:46
1242014,5,"颜色很白搭，配什么的好看，还送了半码垫，很贴心",2018-04-06 20:52:41
1242014,5,"换货痛快，这次没瑕疵，鞋跟虽然细但是上脚很稳",2018-04-10 18:09:53
1242014,5,"鞋子很好看，穿了一天，竟然磨出了水泡，看来，要买比平时稍大一码",2018-05-13 08:46:17
1242014,5,"好漂亮的鞋子，好喜欢<U+0001F618>",2018-04-28 14:03:05
1242014,5,"质量很好，款式好看，老婆喜欢！",2018-04-28 23:55:59
1242014,5,"不错，还没穿，希望好穿",2018-04-28 22:44:36
1242014,5,"简洁大方，穿着舒适",2018-04-28 18:24:57
1242014,5,"鞋子好看，好穿，喜欢",2018-04-28 15:58:59
1242014,5,"退货快速",2018-04-28 15:44:52
1242014,5,"很舒适",2018-04-28 16:36:31
1242014,5,"对于严选迷来说什么都是好的",2018-04-27 06:10:07
1242014,5,"严选的鞋，一如既往的好！",2018-04-27 20:38:44
1242014,5,"还好还好哈",2018-04-27 23:03:59
1242014,5,"挺不错的",2018-04-27 07:57:11
1242014,5,"高度合适",2018-04-27 23:49:06
1242014,5,"很好",2018-04-27 20:50:34
1242014,5,"很合适",2018-04-27 16:07:57
1242014,5,"神舒服，如履平地，一下入了两双，",2018-04-26 14:37:08
1242014,4,"不错，性价比高。适合春夏",2018-04-26 22:03:08
1242014,5,"很漂亮，穿着正合适",2018-04-26 14:00:56
1242014,5,"蓝色很好看",2018-04-26 14:37:23
1242014,5,"穿着舒适！",2018-04-26 11:33:37
1242014,5,"质量看上去不错",2018-04-26 20:05:58
1242014,5,"ok",2018-04-26 20:32:03
1242014,5,"还可以，不错，就是我自己脚有点瘦",2018-04-25 20:15:55
1242014,5,"好喜欢，就是号偏大，送人了，再买一双",2018-04-18 10:44:27
1242014,5,"确实值这个价钱，猪皮稍微有点硬，但不影响我喜欢它",2018-04-24 20:46:32
1242014,5,"有点挤脚，穿穿看吧",2018-04-26 09:18:13
1242014,5,"颜色很喜欢，高度适合，不喜欢高跟的盆友可以试试",2018-04-12 18:40:06
1242014,5,"脚后跟带子磨脚",2018-04-24 14:48:50
1242014,5,"非常漂亮，很淑女！用来变化风格！",2018-04-25 15:10:01
1242014,5,"非常好，性价比超高，脚宽特意买大了一码有点不跟脚，加个前脚掌垫应该会好一些。鞋跟高度合适，走路不累，很淑女",2018-04-27 13:05:27
1242014,5,"穿着舒适，买比平时大一码的就好",2018-04-21 14:29:16
1242014,5,"很舒服，还会再来！",2018-04-25 16:41:28
1242014,5,"非常喜欢，回购商品",2018-04-25 16:19:42
1242014,5,"质量很赞！",2018-04-25 20:56:36
1242014,5,"很好",2018-04-25 20:21:36
1242014,5,"特别好看的鞋子，而且上脚也很舒服！就是感觉我这肥脚丫买小了，感觉前面有点夹脚，结果退了又换的39号，到了以后上图分享！",2018-04-27 16:07:36
1242014,5,"满意",2018-04-25 21:17:27
1242014,5,"好",2018-04-25 20:20:27
1242014,5,"好看",2018-04-25 21:43:03
1242014,5,"不错，就是觉得后跟的带子有点松",2018-04-11 09:30:35
1242014,5,"鞋很漂亮，跟高舒适",2018-04-24 11:45:10
1242014,5,"可以 很合适",2018-04-24 21:20:50
1242014,5,"很漂亮",2018-04-24 13:48:49
1242014,5,"买大了，可惜没有35码了，真的很喜欢，质量非常好",2018-04-10 16:05:45
1242014,5,"很舒服，我的脚挑鞋的，但这双真的很舒服",2018-04-10 15:06:01
1242014,5,"雾蓝色很好看，也很好搭配，穿着显瘦，平时穿37.5，这个37码差不多，右脚稍有点挤，但38码太大，挂不住，蓝色37不参加活动也真是奇葩",2018-04-15 13:34:17
1242014,5,"拿到后试了一下，大小合适，就是皮质稍硬了点。",2018-04-01 14:01:03
1242014,5,"质量非常好，性价比太高了",2018-04-23 17:22:41
1242014,5,"很美丽，穿起来不卡脚，不错！",2018-04-23 10:08:25
1242014,5,"有点挤脚，建议买大一码",2018-04-23 20:54:43
1242014,5,"之前有个地方线头会打脚，自己修剪了一下就解决了问题，原本想换货的。本次购物非常愉快，鞋子很合脚。",2018-04-23 22:27:00
1242014,5,"还没穿，但是看起来酷酷的，希望不磨脚",2018-04-19 12:26:45
1242014,5,"平时运动鞋穿39，38码大了，换了37合适",2018-04-19 18:44:49
1242014,5,"超爱，皮的，尺码标准",2018-04-23 12:47:24
1242014,5,"合脚，码数正常",2018-04-23 11:49:58
1242014,3,"先买的37码，太紧了穿着难受，因为后鞋襻是固定的，没法调大小，款式还是挺好的，所以退了重新买了38码，刚穿上脚觉得蛮好也不松，可是第一天穿，白天穿没有怎么走路，晚上去超市过了一个马路，后跟就掉襻，就和穿拖鞋一样，<U+0001F613>啊！希望严选改进，下次再也不能买这种款了",2018-04-23 12:45:47
1242014,5,"职业，舒服",2018-04-23 10:07:44
1242014,5,"还行",2018-04-23 01:22:43
1242014,5,"换过一次货，还是有点大，鞋是好看的，只是不大合自己的脚。",2018-04-23 13:13:31
1242014,5,"喜欢，物美价廉",2018-04-23 16:43:55
1242014,5,"好看，舒服！",2018-04-23 11:10:52
1242014,5,"好",2018-04-23 18:09:02
1242014,5,"鞋子颜色很漂亮，但是拍大了，因为喜欢所以没有退。",2018-04-15 09:09:05
1242014,3,"磨脚磨的疼哭了。就穿了半天。。。<U+0001F62D><U+0001F62D>",2018-04-20 21:35:57
1242014,5,"颜色很好看，漆面是亮色光滑的，只是我脚大穿不了退掉了",2018-04-24 00:37:11
1242014,5,"还可以，问题是磨脚，第一天穿就大拇指小拇指合两个血泡，后跟也磨破了。现在想到穿就害怕，暂时闲置。其实款式挺ol的。39脚这个码刚好，还有点掉脚，就是不知道为什么磨脚。",2018-04-25 15:20:59
1242014,5,"百搭的黑色，码数正常不挤脚，穿着舒服，值得买",2018-03-31 15:03:27
1242014,5,"非常不错！穿起来非常显气质",2018-04-22 11:52:26
1242014,5,"样式一般，质量看着还行",2018-04-22 08:07:27
1242014,5,"质量很好，不磨脚",2018-04-22 11:36:24
1242014,5,"挺好看de",2018-04-22 17:25:44
1242014,5,"小巧玲珑，很喜欢",2018-04-22 00:09:00
1242014,5,"老婆很满意",2018-04-22 18:13:31
1242014,5,"非常好",2018-04-22 12:43:46
1242014,5,"好",2018-04-22 20:11:24
1242014,5,"喜欢",2018-04-22 18:42:06
1242014,1,"看着质量不错，脚感也不错，所以试穿了一天，结果走路声音特别响，还会掉跟，走几步就会掉后面。烦死人，要是能退，立马退了。一直相信严选，怎么可以这样对待我们客户",2018-04-23 02:36:59
1242014,4,"还行吧。说是4-11店庆当天有惊喜，结果不但礼包也没了，惊喜也没见着<U+0001F937><U+0001F3FB><U+200D>♀<U+FE0F>",2018-04-13 12:50:01
1242014,5,"鞋子非常好，就是稍大一点，建议买小一码",2018-04-14 08:25:57
1242014,5,"刚试了一下有点大 但皮很舒服 不硌脚",2018-04-08 14:24:59
1242014,5,"一丢丢粉色，几乎裸色
看别的图片那个蓝色的太蓝了
就按原码数，我脚瘦也是按原码数
显脚宽，不过还挺好穿的",2018-04-10 15:55:46
1242014,5,"脚感不错，也不掉跟，非常满意",2018-04-21 11:05:28
1242014,5,"鞋子穿的很舒服，只可惜买小了一码，已经申请换货了",2018-04-20 17:00:26
1242014,5,"新鞋，穿得我起了几个水泡…",2018-04-21 21:50:41
1242014,5,"一如既往，质量棒棒哒",2018-04-21 23:42:54
1242014,5,"还没机会穿",2018-04-21 19:51:23
1242014,5,"质量还可以",2018-04-21 16:30:57
1242014,5,"穿着舒适",2018-04-21 20:07:20
1242014,5,"质量很好",2018-04-21 11:33:07
1242014,5,"质量很好",2018-04-21 00:21:40
1242014,5,"很好",2018-04-21 20:31:48
1242014,5,"貌美的鞋子。第一天穿磨脚了，歇了两天再穿就好很多。一开始买了36，太小，换37，换货过程也很顺利，物流很给力。严选真是太好了！",2018-04-22 13:28:28
1242014,4,"还好",2018-04-21 17:43:36
1242014,5,"bhmjkjmkjilk",2018-04-21 19:16:29
1242014,5,"号正，个人觉得底薄走路硬，退了。颜色，形状，后跟都还不错",2018-04-22 15:05:13
1242014,5,"鞋子挺漂亮，很没穿不知道舒不舒服",2018-04-19 16:52:48
1242014,5,"穿着很舒服，颜色很好看，很喜欢！",2018-04-20 15:35:23
1242014,5,"买大了一码，穿着比较宽松，舒服",2018-04-20 11:34:39
1242014,5,"鞋子非常好，老婆很喜欢",2018-04-20 12:34:55
1242014,5,"样子好看，颜色很搭衣服",2018-04-20 15:25:07
1242014,2,"1，鞋子并不软，非常一般。2，快递虚假送件，无通知提前给报签收。",2018-04-19 13:13:51
1242014,5,"很好<U+1555>(<U+141B>)<U+1557>",2018-04-20 12:16:23
1242014,5,"颜色很正",2018-04-20 08:42:42
1242014,4,"穿着有点挤脚，退货了",2018-04-22 13:25:12
1242014,5,"五星哦",2018-04-20 16:59:19
1242014,5,"质量不错",2018-04-20 11:01:29
1242014,5,"美美哒",2018-04-20 09:19:38
1242014,5,"我到现在只穿过一次，比起高跟鞋算是比较舒服了，因为跟不高，但是我的脚太大了， 第一次穿还是会挤到小拇指，质量是很不错，一百多买到，我觉得很便宜，过几天再来穿",2018-04-20 22:15:49
1242014,5,"好",2018-04-20 13:44:24
1242014,5,"好看",2018-04-20 21:25:03
1242014,5,"鞋跟适中，不高，皮质有点硬，软一些会更舒适",2018-04-16 17:31:34
1242014,5,"很好看，码偏大一号，建议选小一号的",2018-04-12 12:30:31
1242014,5,"很好看啊！轻巧舒适柔软透气优雅，唯一大了半码",2018-04-12 23:53:41
1242014,5,"挺好的，走路有点响",2018-04-19 20:32:41
1242014,5,"给儿媳买的，非常漂亮，上脚效果非常好(<U+272A><U+272A>)抬色。",2018-03-16 00:21:42
1242014,5,"漂亮，是软的漆皮，应该很好走吧，一口气整了两双！",2018-04-06 20:07:17
1242014,4,"这个退掉了，以我的试穿来说鞋型不算特别好看，有点掉跟和刮脚后跟。",2018-04-07 08:49:44
1242014,5,"质量挺好，就是太大了，需要退货，强烈建议出34",2018-03-31 19:13:53
1242014,5,"很女人味的一双鞋，喜欢的很",2018-04-19 12:26:47
1242014,5,"又买了一双黑色的，好喜欢",2018-04-19 21:03:55
1242014,5,"很喜欢，吃着逛街不累",2018-04-19 14:13:58
1242014,5,"质量好，严选值得信耐",2018-04-19 11:49:54
1242014,5,"很惊喜的一款鞋子，好看",2018-04-19 12:43:43
1242014,1,"试穿时候觉得还行，但是真正穿的时候非常不舒服……脚一直往前跑……穿了走了十分钟的路就把脚趾头磨破皮了，完全没法再走了……临时买了拖鞋……",2018-04-19 18:36:31
1242014,5,"退了，小了",2018-04-19 23:15:03
1242014,5,"性价比不错，鞋跟高低也舒服，我的脚丫子太瘦了吧，穿鞋脚底有点疼，适合脚上有肉肉的人穿，鞋码标准，脚宽的可以选大一码",2018-04-20 11:52:23
1242014,5,"好穿，好看",2018-04-19 13:17:38
1242014,5,"鞋子很漂亮",2018-04-19 21:06:44
1242014,5,"质量很好，穿上很舒服，非常信任网易严选，会继续关注",2018-04-05 17:06:51
1242014,5,"鞋子很漂亮，显得脚很小巧。",2018-04-18 11:23:45
1242014,5,"很好看，跟也不累",2018-04-18 11:38:40
1242014,5,"鞋子很漂亮，穿着也舒服",2018-04-18 21:18:32
1242014,5,"换货收到了，穿的很舒服很好看，本身脚很宽，穿这个鞋不显得脚肥，很满意",2018-04-20 17:01:25
1242014,5,"质量不错，肥脚丫慎入",2018-04-18 23:06:24
1242014,5,"蓝色粉色都买了，蓝色37不特价但是打8折，粉色37有特价，其实差不多，穿着很好看，平时37.5，这个37号就行，38的后跟带不住",2018-04-20 08:58:26
1242014,5,"非常漂亮，物流非常快！",2018-04-18 10:37:21
1242014,4,"好看，但是很硬，小脚指挺难受的。只能偶尔穿一下了。",2018-04-19 11:02:14
1242014,5,"不错，挺淑女。",2018-04-18 10:01:09
1242014,5,"款式不错",2018-04-18 13:37:02
1242014,5,"鞋子偏大。然后容易显脚长。塞了个半码垫稍微好一点点。没有35码了也没办法哈",2018-04-19 09:51:38
1242014,5,"赞",2018-04-18 09:01:58
1242014,5,"满意",2018-04-18 23:28:00
1242014,5,"平时穿37号半，这次蓝色37不特价就买了38，果不其然大了，小后跟带不住，只能忍痛退了，买了双不特价的37，还好打8折也差不了太多，穿着很好看",2018-04-20 08:57:13
1242014,5,"好",2018-04-18 08:30:54
1242014,5,"漂亮",2018-04-18 21:37:24
1242014,5,"漂亮",2018-04-18 11:54:06
1242014,5,"有点压脚背",2018-04-19 10:09:45
1242014,1,"穿上十分钟，后脚跟磨的鲜血淋漓，犹如一大钢排针扎，寸步难行，接下来上班和下班都困难。
我的脚算是好买鞋的，一般不磨脚的。
拜托把写文案和做广告的功夫投一点到产品质量上，不是第一次失望了",2018-04-18 10:55:34
1242014,5,"质量好，从未失望过，要是能往新疆发展就好了！期待中",2018-04-18 14:21:16
1242014,5,"鞋子质量很好，物超所值，舒服，标准尺码！",2018-04-16 10:45:41
1242014,5,"喜欢，第二次购买，买大了一码，舒服些",2018-04-17 18:11:11
1242014,5,"码数标准，鞋子漂亮，小猫跟舒服不累脚，好评",2018-04-10 11:23:32
1242014,5,"朋友介绍的严选过人不错，以后购物就是你了……",2018-04-10 21:46:20
1242014,5,"头一次选这个颜色和鞋根的鞋子，挺喜欢",2018-04-10 17:03:45
1242014,5,"漆皮鞋会硬，穿一次打了好多泡……不敢穿第二次了",2018-04-15 13:20:11
1242014,5,"试穿了一下非常舒服，前面看起来尖尖的，但是不挤脚",2018-04-04 17:47:49
1242014,5,"非常漂亮，只是没想到穿上去还大了半码",2018-04-04 16:08:18
1242014,5,"好看，但是真没觉得走路舒服，后面的带子磨脚，我也有心理准备，这种款普遍都不是特别跟脚，网易买的第二双鞋，做工都不错，但是舒适性有待提高",2018-04-17 10:26:45
1242014,5,"限时购买的，很优惠，穿着很舒服也很漂亮，码数正常",2018-03-14 21:02:18
1242014,5,"鞋底跟软走路舒服走路不累",2018-04-17 14:20:41
1242014,4,"鞋跟高度刚好，不累，但是走多了还是磨脚，鞋底感觉不防滑",2018-04-17 16:54:56
1242014,5,"鞋子很好看，就是有点硬",2018-04-17 22:19:15
1242014,5,"很漂亮，今年流行的小猫跟",2018-04-17 10:02:42
1242014,5,"这双穿着很舒服，不累。",2018-04-17 10:12:02
1242014,5,"非常漂亮的鞋，很舒适",2018-04-17 00:30:44
1242014,5,"还没穿，质量很好",2018-04-17 20:21:01
1242014,5,"质量不错看起来有质感，不过尺码有点偏小，无法穿所以退了，可能是怕后面带子掉跟的缘故，建议大家大一码",2018-04-13 10:59:40
1242014,5,"超值",2018-04-07 11:11:08
1242014,5,"很好看",2018-04-17 10:10:11
1242014,5,"特满意",2018-04-17 08:30:48
1242014,5,"舒适度可以",2018-04-17 10:34:05
1242014,5,"真的好",2018-04-17 16:43:19
1242014,5,"好",2018-04-17 11:18:00
1242014,5,"大小正合适，样子也不错，小猫跟比较有特色",2018-04-13 01:19:35
1242014,5,"很不错很喜欢，脚背有点紧，穿穿应该会松",2018-04-13 00:43:38
1242014,5,"后悔了，，，我就该知道的的大脚丫子。。。。",2018-04-16 14:00:44
1242014,5,"36码半的脚买了37，非常合适",2018-04-16 08:48:33
1242014,4,"走路底有响声，只能说物有所值，但没有评价那么舒服，平时35-36码，买了36的前面挤，后面松，比起娜然与玖熙还是有差距",2018-03-30 16:20:27
1242014,5,"这个还是瘦脚好看 主要没有一双女人味的凉鞋 所以买这个",2018-04-15 19:07:24
1242014,5,"鞋码偏小，而且又是尖头的鞋，感觉要加大两码，退了",2018-03-29 19:15:57
1242014,5,"物流超快 鞋子很好穿 不打脚 就是有点尖",2018-04-03 18:39:39
1242014,5,"款式好看，脚感舒服，到货很快！满意！",2018-04-16 12:25:57
1242014,5,"质量很好，鞋楦很合脚",2018-04-16 15:07:56
1242014,5,"脚宽穿起来不好看",2018-04-16 12:00:52
1242014,5,"皮质软，性价比很高",2018-04-16 22:09:09
1242014,5,"第一次穿，两只脚八个泡……我……真的无语了",2018-04-16 23:36:22
1242014,5,"不错，好看，性价比高",2018-04-16 10:13:42
1242014,5,"鞋子不错。脚小的推荐。",2018-04-16 09:17:54
1242014,5,"一直都相信严选的",2018-04-16 09:10:46
1242014,5,"性价比超高",2018-04-16 09:40:33
1242014,5,"穿着舒服",2018-04-16 10:56:02
1242014,5,"前面还是有点硬的，鞋底很舒服。不知道能不能穿习惯样子还是不错的",2018-04-21 11:51:24
1242014,5,"蓝色好看",2018-04-16 20:22:37
1242014,5,"特别舒服～",2018-04-16 20:13:19
1242014,5,"鞋子穿着非常舒服，我的脚是属于那种偏瘦脚掌偏宽的那种！卖家好贴心，还送了一对半码鞋垫，鞋子码数有点偏大，垫上鞋垫刚好，试了一下，走路一点压力都没有，脚偏瘦的建议可以买小一个码！",2018-04-12 18:41:50
1242014,5,"好",2018-04-16 08:54:07
1242014,5,"good",2018-04-16 07:25:09
1242014,5,"good",2018-04-16 07:25:16
1242014,5,"good",2018-04-16 07:26:19
