"itemId","star","content","createTime"
1251043,5,"很好的椅子，宝宝和我们一起吃饭，终于吃饭不用分开三趟了",2018-08-08 13:33:19
1251043,5,"产品质量上乘，之前一直在京东和淘宝上挑，一直也没有下定决心买，因为感觉不靠谱。所以才上了严选。毕竟给孩子用的东西，质量最重要。价格有点贵，用了优惠券，觉得也挺值的。宝贝对得起这个价格。宝贝，到手后，摸索了下，就装上了，没有异味，挺满意的。",2018-08-11 00:30:06
1251043,5,"餐椅很棒，看了很久终于决定买这款餐椅，颜色选了蓝色的，很漂亮，舒适度高，小朋友很喜欢，安装很简单，一买回来就试用了，很棒，很稳，小选服务态度真棒",2018-08-08 15:18:31
1251043,5,"很喜欢的米色，宝宝还小，吃饭的时候躺一下，很是喜欢",2018-06-27 09:30:31
1251043,5,"送给朋友女儿的，说小朋友做在里面很开心呢，能自己玩自己的，不哭不闹。安全系数很高，拆开没有味道，材质摸上去很舒服。同时解放了朋友双手，不用一直抱着了，喂饭方便！yeah，朋友说可以留给我孩子呢，哈哈哈哈哈哈哈哈哈。",2018-06-29 10:05:04
1251043,5,"送给姐姐家的小孩，姐姐很满意，说着是豪华版的。",2018-06-12 20:49:27
1251043,5,"宝宝喜欢，喂哺食舒服方便。",2018-06-23 18:28:31
1251043,5,"挺好挺好",2018-06-11 10:54:30
1251043,5,"非常非常好，本来在淘宝找了好久，挑得眼花缭乱，各种纠结，后来灵机一动想到可以试下严选，这还是第一次在严选买东西，非常满意，椅子方方面面都无可挑剔",2018-05-20 22:17:16
1251043,5,"不错，宝宝可以看着我们一起吃饭，不用抱着吃饭，解放了双手，这个价格还是很满意的",2018-08-12 20:50:21
1251043,5,"非常棒！宝宝刚四个多月，可以当小床躺…大了再加支板吃饭…操作方便，功能多…推荐购买！",2018-08-05 12:53:01
1251043,5,"在自己家 奶奶家 姥姥家买了三个座椅，网易的感觉味道最小，性价比最高。",2018-08-05 14:21:58
1251043,5,"餐椅非常漂亮，没有异味非常的喜欢！希望严选能一直把品质保持下去～放眼家里都是严选的东西<U+0001F602>",2018-05-14 14:19:20
1251043,5,"买给儿子的，挺好的质量，期待使用，相信严选，现在家里都是严选的东西",2018-06-19 15:16:31
1251043,5,"比想象中的大一点，不错，椅子的不知道是PU还是真皮，不怕闷着",2018-07-30 07:19:34
1251043,5,"不错，颜色也好看，就是是不是有点窄，现在宝宝才五个月，再大点可能会挤。",2018-06-30 11:28:44
1251043,5,"宝宝2个月的时候已经可以躺在餐椅上了，吃饭的时候就不用抱着，而且可以一起在餐桌边，满意",2018-05-05 16:46:27
1251043,5,"很好，应该早点买早点用的，非常满意吧，就是不知道安全带能不能拆出来洗",2018-06-03 22:14:07
1251043,5,"真的不能再好，没有异味，漂亮，结实！我对比了很多牌子还是选了严选，没选错哦！",2018-03-26 11:21:49
1251043,5,"东西不错，挺重的应该耐用，没什么异味。，活动的时候买的，便宜很多",2018-08-16 09:18:22
1251043,5,"餐椅真心不错，高端大气上档次！！周年庆抢到的，赚大了！！现在售罄了，补货后帮同事再买一个",2018-04-12 21:12:48
1251043,5,"嗯，不错宝宝挺喜欢的的，坐着吃米糊也很乐意。坐垫不喜欢，不够柔软。但是没有味道这点很强大！",2018-04-11 06:41:35
1251043,5,"一直纠结蓝色和米色，最后觉得蓝色比较清新，买了蓝色的，塑料很软很舒服",2018-06-10 11:02:22
1251043,5,"已经到家，看着不错，因孩子还小，4个半月，所以前面吃饭的盘子没有装，等外孙坐了后再追评。",2018-04-10 12:04:30
1251043,5,"这个餐椅可以躺着   也可坐着    有几个档位   按钮开关非常方便    宝宝很喜欢坐   ……",2018-03-25 08:40:41
1251043,5,"性价比很高的餐椅，用餐时间解脱了全家。宝宝4个半月，坐在里面很开心",2018-03-19 20:31:36
1251043,5,"颜色很美丽，做工很精细，很喜欢呢",2018-08-18 15:39:55
1251043,5,"不错，性价比超高。",2018-08-14 17:07:20
1251043,5,"质量棒棒哒。",2018-08-14 17:58:17
1251043,5,"质量非常好啊 和老公都很喜欢 给宝宝买东西一定买严选 质量放心 我才放心 而且颜色也非常赞 白蓝配 干净靓丽 之前一直担心不稳 今天安装完以后 非常稳当 孩子吃饭不再担心",2018-08-10 21:42:25
1251043,5,"餐椅看起来不错，但是确实如评论所说似乎有点小，六个月的宝宝坐进去刚刚好，还是夏天，等到冬天穿多一些不晓得能不能坐进去了。另外安全带外面没有套一个保护袋，怕割到宝宝。档位调节和高度调节都特别方便，简单灵活。",2018-08-10 12:06:52
1251043,5,"买了米色，收到是蓝色",2018-08-05 18:13:59
1251043,5,"细节做得很好，座椅，脚蹬，餐盘全都可以调节，颜值也高",2018-06-10 11:13:45
1251043,5,"非常满意",2018-07-05 19:52:53
1251043,5,"皮感十足，冬暖夏凉；座椅角度调节方便，适合宝宝玩耍、进食、睡眠；无异味，用材安全，宝宝经常会啃座椅把手，让大人放心；值得一提的是稳定性，安全感强；严选，好品质！",2018-06-16 22:29:04
1251043,5,"非常满意，再买一个",2018-06-17 21:20:37
1251043,5,"豪华",2018-06-17 10:47:07
1251043,5,"颜色很好看，质量不输大牌，可以调节高矮，收纳方便，很实用的餐椅",2018-03-30 21:06:00
1251043,5,"大体满意，安全带感觉有点次",2018-06-11 08:49:44
1251043,5,"宝宝准备三个月了，吃饭的时候总要有一个抱着，等换手了来吃饭，饭菜早冷了，这款餐椅标是六个月以上宝宝使用，犹豫了好久正好有优惠活动还是下单了。拆出来没有什么味道，椅子不需要组装，宝宝还小没有装餐盘，调到躺着的那一档，又能解放大人的手，宝宝也可以在桌边，真是后悔下手慢了<U+0001F604><U+0001F604>，大赞一个<U+0001F44D>",2018-06-08 22:17:06
1251043,5,"超级无敌好的餐椅 宝贝特别喜欢 而且收纳方便 不占地方！点赞",2018-05-01 00:27:04
1251043,5,"高颜值，高质量，宝宝第一次坐表示很开心，看了很多款餐椅，最终还是从严选买，相信的就是严选产品高品质的追求。",2018-03-09 21:07:59
1251043,5,"比较方便 不错",2018-05-27 10:05:00
1251043,5,"质量很好，送了小侄子的。家人很满意。",2018-05-21 16:40:08
1251043,5,"宝宝很喜欢 满意 颜值很高呀",2018-05-17 12:15:34
1251043,5,"超级棒的，想买的时候缺货了，这次一有货赶紧买了，质量很好，没什么味道，宝宝用的东西几乎都是网易严选买的，以后还会买买买，哈哈哈",2018-05-10 18:51:32
1251043,5,"很好 无异味 良心货 400出头",2018-05-15 22:26:42
1251043,5,"很棒！没有味道，宝宝坐着开吃了",2018-05-14 18:32:18
1251043,5,"餐椅很好",2018-05-09 14:15:08
1251043,5,"宝宝椅特别棒，质量看着并不像几百元东西，真的很有质感哦",2018-03-14 13:28:50
1251043,5,"颜值很高的一款餐桌，安全因素考虑的很到位，就是略感空间挤一点，抱出来有一点费力，可能出于安全的考虑，总体不错<U+0001F44D>",2018-03-16 10:30:36
1251043,5,"质量刚刚滴 没用味道 高大上呀 等宝宝睡醒 坐上试试",2018-04-10 10:37:08
1251043,5,"质量没得说，就是宝宝有点胖，可能再长大些，宽度不够。",2018-03-31 10:03:59
1251043,5,"好用，儿子喜欢，我就喜欢",2018-04-20 15:48:51
1251043,5,"性价比高!",2018-04-07 19:55:17
1251043,5,"宝宝坐上去挺好",2018-04-01 10:34:34
1251043,5,"宝宝还蛮喜欢的，棒棒哒！性价比超高！",2018-03-25 20:56:49
1251043,5,"椅子很不错。第二次购买。给朋友
价格也很优惠",2018-03-24 15:00:48
1251043,5,"颜值很高，妹妹和哥哥抢的坐。很稳当。",2018-03-20 15:40:31
1251043,5,"完美，太好了，好东西",2018-03-20 07:23:51
1251043,5,"这是我在严选买的最棒产品哦！非常实用哦！宝宝四五个月的时候，可以躺在上面互动，每次吃饭的时候可以躺在上面欣赏大人吃饭，真是解放双手的好物！小宝宝躺在上面合适的高度舒适的座椅全身放松自由活动四肢真是棒极了！<U+0001F633>哈哈，好像从来没有这么认真地码这么多溢美之词作为评价过！还有颜色很赞，很春天哦！面料PU的不用担心弄湿啦菜汁啦！目前已收到家人无数次的赞美哇哈哈！建议安全带的材质改进一些哦，这个不影响使用，只是觉得看起来有些单薄而已！",2018-03-20 07:56:17
1251043,5,"颜值高，质量好。我家双宝都很喜欢",2018-03-13 13:05:10
1251043,5,"颜值高，质量好。我家双宝都很喜欢",2018-03-13 13:05:17
1251043,5,"宝贝很满意，观察一阵子了，性价比当下选择应该是不错，半年后来用。限时购时候买便宜不少",2018-03-08 12:31:04
1251043,5,"和之前买的晨辉的一模一样 质量很好 用八折券买的 和那之前特价的价格差不多",2018-01-21 15:46:41
1251043,5,"再也不用抱着宝宝吃饭了，高品质，处处都是按钮，特别方便。大爱留着第二胎用 <U+0001F601>",2018-01-07 18:03:44
1251043,5,"超高级的评价送给你！！！这个跟peg perego的zero3有啥区别啊！！！便宜这么多！！！赶紧买，不要犹豫！！！！！快抢啊！！！",2018-06-13 11:06:20
1251043,5,"做工挺好，宝宝很喜欢，非常满意的一次购物，就是物流有点慢，不过正好赶上使用",2018-03-03 10:01:03
1251043,5,"家人都说这个餐椅买得很成功！娃六个月，能坐的住。吃辅食就坐在这上面吃，很好。",2017-12-30 21:58:53
1251043,5,"质量好到没话说，颜色也超级美，毫无色差，相信严选，大爱严选",2018-02-26 12:16:35
1251043,5,"颜值非常高的儿童餐椅。无论做工还是功能，都很人性化。一键操作，简单顺手。",2018-06-17 21:02:39
1251043,5,"好评！！！！质感很好，很光滑，上档次，就是有点晃荡，颜色也超级喜欢<U+0001F60A>宝宝吃饭方便多了",2017-11-17 13:40:45
1251043,5,"打开包装没有味儿，做工精细，狠牢稳用起来也很方便，是个不错的选择。",2018-03-02 06:40:01
1251043,5,"质感非常的好，把宝宝放上去也不闹了，餐桌刚开始不会安装，看了说明书后觉得太巧妙了，拆装都很方便",2018-01-14 10:58:15
1251043,5,"终于等到绿色有货，过年前抢到优惠券买的，相当于打了八折。年后收到货，包装严实，安装简单，宝宝睡上面可以解放双手，不错不错",2018-03-02 07:55:05
1251043,5,"实物很不错，颜色我很喜欢！最重要的是宝宝喜欢坐，培养好习惯的开始！",2017-12-05 16:35:38
1251043,5,"期待已久的餐椅终于收到啦！颜色很好看，设计很合理，也很稳。宝宝很喜欢坐在上面。现在14个月，应该早点买的。",2017-12-01 11:02:17
1251043,5,"质量好。材质易擦洗。舒适柔软",2018-06-30 10:18:31
1251043,5,"质量非常好非常好 为孩子预备的 物有所值 太太好了",2018-01-31 20:05:39
1251043,5,"很好",2018-02-13 17:39:30
1251043,5,"颜色清新，虽然是pu，看起来还是很有质感，餐盘有两个方便清洗，打算再买一个放家里，这个放在外婆家了，赶快补蓝色啊，赶快赶快上架",2018-01-01 00:25:29
1251043,5,"后背有点歪",2018-08-22 06:57:24
1251043,5,"凳子质量还是可以的 我们家娃不胖 坐着刚好 目前七个月了 不知道可以到多大",2018-01-13 20:42:40
1251043,5,"做工精巧，座椅舒适，除了颜色，都非常满意",2018-01-21 22:42:12
1251043,5,"颜色美丽，高矮坐躺都可调节，牢固无毛刺，宝宝喜欢坐着活动价非常好赞赞赞",2018-08-09 15:39:09
1251043,5,"棒棒哒<U+0001F388>宝宝喜欢<U+0001F495>自己坐着玩，吃辅食也方便妈妈喂宝宝，高度调节方便，包装好大，拆开就可以直接用了，餐盘是双层的，拆装也很方便！",2018-01-08 21:35:31
1251043,5,"结构稳固，塑料材料无异味、有韧劲，皮革用料也很不错，给小宝贝用还是比较放心的",2018-08-21 17:53:30
1251043,5,"非常好好好好好好好好好好好好好好好好好好非常好好好好好好好好好好好好好好好好好好",2018-07-27 13:17:18
1251043,5,"很少评论，这次要打call了。第一眼感觉就很棒，米色座椅搭配白色铁杆逼格高，结实耐用，宝贝坐着感觉很舒服，推荐推荐～要是有蓝色的就更棒了",2018-01-05 21:04:22
1251043,5,"质量做工精细c，可以调节，非常值得入手啦！",2018-01-04 20:16:18
1251043,5,"很好用的东西。",2017-12-31 10:49:58
1251043,5,"终于可以解脱双手吃饭了",2017-12-28 07:33:35
1251043,5,"啥都挺好，就是没有轮子不太方便",2018-06-23 16:33:28
1251043,5,"还不错。",2017-12-27 16:35:42
1251043,5,"就是移动不方便，其它的都蛮好",2018-06-28 09:06:33
1251043,5,"同事推荐的，很满意，只是自己拍错了颜色。",2017-12-16 08:20:03
1251043,5,"这个东西得到了我们全家的肯定，网易严选，值得点赞，",2017-12-09 13:13:46
1251043,5,"真是好东西！宝宝躺在上面很开心！",2017-12-15 19:28:25
1251043,5,"不错，很方便",2017-12-15 21:15:24
1251043,5,"只能说好！好！好！",2018-06-10 16:51:10
1251043,5,"超级棒哦 稳稳的 有很舒服 还送了皮座套",2017-11-13 11:30:31
1251043,5,"桌板不好拆卸。其他都很好",2018-07-06 20:39:44
1251043,5,"不错，质量挺好",2017-12-08 15:40:20
1251043,5,"特别好用，网上买了一个自己用，店里买了一个给侄女。颜值高，好清洗，方便收纳。",2018-07-14 12:52:30
1251043,4,"总体不错。但觉得椅子上半部分有点晃，不知道是不是个别情况",2018-06-25 22:12:11
1251043,5,"挺好",2017-12-06 19:39:51
1251043,5,"看他开心的小样，值了！",2017-12-03 12:48:30
1251043,3,"前面托盘有点不稳，比较低",2018-08-16 10:53:34
1251043,5,"买给表妹女儿的！表妹拍照发到朋友圈后他的朋友都问哪里可以买哈哈哈哈",2018-06-16 00:22:24
1251043,5,"性价比超高，惊艳！",2017-12-01 06:45:01
1251043,5,"整体质量还不错，就是安全带真的是可以弄到宝宝的颈肩和脸的，怕割伤。",2018-07-04 17:05:02
1251043,5,"质量整体很不错。就是小宝宝坐。座位有点挤了。宝宝手脚被挤住了，有点抗拒，能再宽一点最好。",2018-06-10 17:01:42
1251043,5,"非常棒！强推！宝宝6个月多，坐上去就不想下来了！说明舒适度指数高！关键是很稳当！调节功能也不错！颜色是我喜欢的马卡龙色，男女宝都适合！可以留给二胎使用！(=<U+FF9F>ω<U+FF9F>)<U+FF89>没有异味是想不到的！拆完装上就能用！！！靠背倾斜度也是好赞！ψ(｀<U+2207>′)ψ这是买到过最超乎预期的东西！",2017-11-28 00:37:00
1251043,5,"很赞，买回来就用了，只是我家娃儿比较大，可能用不了很长时间",2018-05-30 17:02:09
1251043,5,"超级惊喜，宝宝很喜欢",2017-11-22 09:01:43
1251043,5,"挺好的，对于刚刚满六个月孩子太合适了，可以躺着，对他脊柱也好",2018-08-18 16:52:47
1251043,5,"棒棒棒！",2017-11-17 20:39:23
1251043,5,"很不错，结实",2017-11-14 20:07:16
1251043,5,"挺好的，坐的挺稳，解放双手",2017-11-12 07:25:57
1251043,5,"送朋友的，她很喜欢……",2017-11-11 23:06:34
1251043,5,"这个餐椅性价比很高，方便收纳，而且餐椅的靠垫是不容易闷热去！很喜欢，细节方面都很到位，很愉快的一次体验！",2018-07-26 14:11:26
1251043,5,"餐椅质量很好 宝宝喜欢坐  款式也漂亮  同时买了一个一千多的  两个对比后留下严选的",2018-06-10 14:15:34
1251043,5,"等了很久才有货了，没用过其他的餐椅，反正这个用起来是可以的",2018-07-03 14:10:10
1251043,5,"家里人都以为是上千的餐椅，结果只要400，好用不贵，真的不错。",2018-07-16 10:26:30
1251043,5,"买给朋友家的礼物，感觉性价比很高，颜值高手感好，希望他们家宝贝能喜欢，健康快乐成长",2018-04-03 22:51:03
1251043,5,"还未拆封，待安装完再做评价哦，相信质量一定不会错的",2018-08-21 06:22:17
1251043,5,"又一神器，可高可低，可坐可躺，颜色好看，材质放心，666",2018-08-21 00:21:10
1251043,5,"严选的东西现在多了起来。希望出新品。
喜欢众筹的。因为第一批货要好很多",2018-05-05 14:07:51
1251043,5,"已经用了一段时间，质量很好，颜值高，宝宝很喜欢坐在里面吃饭、玩玩具，解放双手！",2018-05-05 19:53:23
1251043,5,"质量好 调节方便 宝宝快六个月了 用着合适。夏天需要垫凉席要不然太热了",2018-05-27 21:39:15
1251043,5,"还不错 比想象中沉 脚架比较稳 座位手摇的话稍微会有点晃 应该没什么影响",2018-04-15 13:20:26
1251043,5,"质量有问题，退了，售后非常好",2018-04-16 13:55:32
1251043,5,"很好看呢，质感也好，拆开没有味道感觉给孩子用着也放心。组装非常简单，挺牢靠的，棒。",2018-03-31 17:07:27
1251043,5,"质量还可以，宝宝四个月了，回来试了下，不错，喜欢躺，我们吃饭的时候就把她放宝宝餐椅里，她乖乖的看着我们吃",2018-07-06 13:50:57
1251043,5,"非常好。两个月的毛毛躺着看我们吃饭。高兴的很。很好",2018-08-07 16:58:15
1251043,5,"两条安全带很容易脱落，感觉不安全",2018-05-16 22:59:28
1251043,5,"看着不错介绍给朋友，然后朋友果断让我帮下单了！",2018-08-21 17:22:55
1251043,5,"非常好，现在每天都做，吃辅食，休息都可以用，难得全家人都夸买的好",2018-04-21 15:19:58
1251043,5,"很好用，宝宝吃饭可以自己坐了，不用一直抱着了",2018-08-17 21:31:14
1251043,5,"包装看起来很好，包得很用心，相信货一定很好，谢谢了!",2018-07-21 12:06:17
1251043,4,"还行，小孩容易爬出来，，绑起来不太方便",2018-08-05 21:25:06
1251043,5,"无意中来到你小铺就淘到心意的宝贝，心情不错!",2018-07-20 12:48:56
1251043,5,"和介绍的功能一样 做工比较细致 收纳不占地 米色显干净",2018-08-10 09:30:19
1251043,5,"第二次购买了，颜值很高，可以收放所以不占地方，很好",2018-07-29 13:19:43
1251043,5,"送给朋友的，看似质量非常不错，严选是我最佳的选择",2018-08-13 22:12:42
1251043,5,"非常好 质量可靠",2018-08-22 00:20:51
1251043,5,"质量很好，颜色也是喜欢的，物流也挺快，五星好评",2018-08-05 14:30:54
1251043,5,"简直太好了",2018-08-21 20:46:06
1251043,5,"很好",2018-08-21 15:43:57
1251043,5,"好",2018-08-21 12:37:26
1251043,5,"不错<U+0001F44D>",2018-08-20 16:21:51
1251043,5,"好",2018-08-20 10:31:52
1251043,5,"还不错，宝宝一开始不愿意坐，适应以后在里面吃饭，玩玩具挺开心，大人轻松不少",2018-03-18 09:43:48
1251043,5,"好看，就是不好清洗",2018-08-19 15:39:49
1251043,5,"很好",2018-08-19 22:33:24
1251043,5,"好",2018-08-18 22:23:21
1251043,5,"好",2018-08-18 23:29:49
1251043,5,"忠心地感谢你，让我买到了梦寐以求的宝贝，太感谢了!",2018-07-21 12:06:15
1251043,5,"送朋友家小孩的礼物，质量好！",2018-08-17 19:03:39
1251043,5,"满意满意，小朋友吃饭不用抱着了",2018-08-17 23:08:21
1251043,5,"很好很满意",2018-08-17 20:21:45
1251043,5,"很不错",2018-08-17 20:05:50
1251043,5,"还不错",2018-08-13 06:15:16
1251043,5,"喜欢这款椅子的设计，材质好基本没有味道。",2018-08-10 17:08:25
1251043,5,"如果底座处能设计四个轮子就更完美了",2018-08-10 23:32:39
1251043,5,"质量不错，一点异味都没有。",2018-08-12 23:13:55
1251043,5,"总体还不错。挺漂亮。",2018-08-11 23:52:19
1251043,5,"很好哎！结实！",2018-08-11 15:23:54
1251043,5,"值得购买",2018-08-11 01:02:57
1251043,5,"很高大上，质感不错，可以调整高低和不错",2018-08-08 22:21:07
1251043,5,"8个月大，座着合适，可以解放双手了",2018-08-09 21:27:21
1251043,5,"很不错，物有所值！",2018-08-10 21:59:45
1251043,5,"特别高大上 颜色也特别喜欢，有差价活动还给退差价",2018-07-13 15:05:31
1251043,5,"东西今天收到很满意谢谢老板!下次来的时候记得优惠咯!",2018-07-23 15:16:40
1251043,5,"特别喜欢喜欢喜欢 质量非常好 颜值很高 一看做工就不一般 大牌质量 价格很便宜 性价比很高 好的生活没那么贵 推荐了很多朋友 都夸严选的东西 口碑不错 严选赞赞赞",2018-08-08 15:23:21
1251043,5,"实用也漂亮",2018-08-08 16:12:53
1251043,5,"包装很好，质量很不错，特别满意",2018-08-06 13:39:20
1251043,5,"质量好，美观大方",2018-08-06 21:09:14
1251043,5,"很好，没有味道，质量不错",2018-08-05 00:13:09
1251043,5,"朋友很喜欢。第二次买啦！",2018-08-05 18:28:20
1251043,5,"送朋友的 还没打开看",2018-08-04 21:28:28
1251043,5,"给宝宝买的，看起来很不错<U+0001F44D>",2018-08-03 14:38:57
1251043,5,"haf",2018-08-04 14:42:37
1251043,4,"我看包装得已经很小心了，可还是脏了，擦不干净，应该是磨了",2018-08-03 15:22:30
1251043,5,"挺不错的 解放双手的利器 唯一一点就是下面没有轮子 有轮子会更方便",2018-08-03 16:18:03
1251043,5,"宝宝还小，备着，看起来很不错",2018-08-03 14:51:43
1251043,5,"还要再买",2018-08-03 17:59:27
1251043,5,"看",2018-08-02 22:41:00
1251043,5,"一直都是严选的粉丝，非常喜欢这个餐椅",2018-07-30 14:36:05
1251043,5,"好",2018-08-01 18:02:27
1251043,5,"多",2018-07-31 15:38:40
1251043,5,"我妈根本不信我300多块钱买了这么好的餐椅。物超所值。",2018-08-04 23:29:50
1251043,5,"这个椅子感觉非常棒，可高可低",2018-07-30 22:00:51
1251043,5,"宝宝很喜欢 坐在上面很舒服",2018-07-30 16:21:59
1251043,5,"好",2018-07-30 19:59:39
1251043,4,"安全带不太方便",2018-08-02 22:52:41
1251043,5,"好",2018-07-30 19:57:48
1251043,5,"餐桌很好，这是买的第二个，奶奶家和姥姥家各一个。",2018-07-03 21:47:08
1251043,5,"很实用，非常好！",2018-07-29 12:09:16
1251043,5,"送人的，很大一个盒子包装，看着不错。",2018-07-26 13:55:38
1251043,5,"首先网易的快递服务非常好，送到家，包装完好。退货时上门取件，运费直接有网易出，这个整体服务非常好，而且退换货有30天时间。
再者这款餐椅偏小，现在七个月坐进去刚刚好，还不带轮子，使用起来不方便，所以退了，不过做工质量还是不错的，坐垫皮质还不错。换了爱音的餐椅，更宽敞，带轮子，使用方便。",2018-07-28 14:30:22
1251043,5,"卖家的服务挺好的，以后还能做上买卖#",2018-07-23 11:11:42
1251043,5,"很好的产品，之前有人说这种座椅小孩都不错的，但是我觉得，严选的这个产品做的质量是相当好的，设计也非常贴心。",2018-04-25 23:16:58
1251043,5,"如果再在底部加上轮子，餐板旁边设置玩具，就真是完美了",2018-05-18 07:51:05
1251043,5,"用了一段日子，总体还不错，不过现在天气热起来了，座位上的PU垫子不知道能不能拆下来，因为坐着很热。",2018-05-17 12:17:53
1251043,5,"挺不错的，椅子是皮套着的，就是浅色的得注意卫生，比较容易脏。
座椅高度调节起来挺方便，牢固程度也不错。
整体还是可以的",2018-06-26 18:45:22
1251043,5,"功能丰富做工精良没啥能挑剔的，精品",2018-07-25 18:56:14
1251043,5,"好",2018-07-25 21:40:15
1251043,5,"卖家服务真周到。以后带同事一起来。",2018-07-23 10:32:14
1251043,5,"掌柜发货很及时阿，谢谢啦!",2018-07-23 10:32:14
1251043,5,"昨天拿到的，谢谢!",2018-07-23 15:18:02
1251043,5,"性价比很高",2018-07-23 19:12:13
1251043,5,"好",2018-07-23 19:34:14
1251043,5,"好",2018-07-23 15:12:45
1251043,5,"质量超级好，清洁起来也方便！",2018-07-22 07:15:12
1251043,5,"服务质量好，态度热情，值得推荐!",2018-07-21 01:36:36
1251043,5,"比图片是漂亮多了~",2018-07-21 12:06:20
1251043,5,"东西很实惠哦，支持卖家",2018-07-21 01:35:44
1251043,5,"好",2018-07-21 00:20:31
1251043,5,"满意",2018-07-19 23:23:03
1251043,5,"送给姐姐家的，很喜欢，质量超好，颜色也非常喜欢。",2018-07-09 12:37:22
1251043,5,"好",2018-07-17 12:05:36
1251043,5,"你多久才看到肯定你的内心觉得妈妈说妈妈",2018-07-12 00:04:16
1251043,5,"好",2018-07-16 00:43:25
1251043,5,"质量很好，侄儿很喜欢坐",2018-07-14 14:46:01
1251043,5,"还可以吧",2018-07-14 11:35:26
1251043,5,"非常满意",2018-07-14 12:26:48
1251043,5,"好",2018-07-14 11:08:06
