"itemId","star","content","createTime"
1283007,5,"上色度很高啊",2018-06-14 21:00:03
1283007,5,"还行吧还行吧还行吧还行吧",2018-07-07 16:37:36
1283007,5,"还好",2018-06-14 10:37:41
1283007,5,"颜色漂亮，上档次，不过女儿用了一次就断了",2018-07-09 11:12:07
1283007,5,"买了两支，一支长放包里，一支睡前涂。颜色好看，就是太软容易断。",2018-07-23 16:56:45
1283007,5,"很润、淡淡的色彩",2018-07-11 19:50:42
1283007,1,"第一下，心碎的声音，以后只能靠唇刷了，另附个颜色参考，最近买的几件商品真是越来越失望了",2018-07-29 11:28:38
1283007,5,"很喜欢，不输大牌品质",2018-07-10 13:38:57
1283007,3,"一打开试一下就断了，是天气太热还是掉地上过就不得而知。希望改进吧。",2018-07-23 14:15:53
1283007,5,"送老婆的，很喜欢！",2018-07-10 18:38:36
1283007,5,"心动买来试试，很滋润，颜色很自然，没有其他买家说的断裂问题，用时还是小心些，只需转出一截就可。好的话再来。",2018-07-02 10:43:34
1283007,5,"好用",2018-07-10 20:55:29
1283007,1,"我是严选的忠实客户，一直非常喜欢，比较懒，第一次评价，是因为这个唇膏第一次用，它就断了<U+0001F923>怎么处理......我是正常使用的啊",2018-07-31 04:38:34
1283007,5,"好",2018-07-10 10:03:34
1283007,1,"本来是不想评价！但是申请售后没人处理！产品收到的时候，唇膏膏体是晃动的，完全影响使用！感觉马上就要断掉！",2018-06-15 09:49:12
1283007,5,"不错哦，发货也快，性价比可以的",2018-07-09 10:17:17
1283007,3,"唯一一次这个不好，都化了，歪掉了，没错开盖子都会刮到。",2018-07-12 15:10:59
1283007,1,"听说容易断，放入冰箱冷冻后才拿出来用，特别小心的使用，结果第二次用就断了，这质量…特别震惊，不是严选应该有的风格。",2018-07-26 14:15:11
1283007,5,"很喜欢，满意，支持严选！",2018-07-09 18:04:38
1283007,5,"润唇用的，还不错",2018-07-09 12:33:44
1283007,3,"这个唇膏真的容易断，不推荐，用的第二次就齐跟断掉了",2018-07-02 14:15:39
1283007,5,"喜欢！满意！支持严选！",2018-07-09 18:04:10
1283007,1,"差评！！！在严选买了那么多东西，这次是最失望的！早上第一次用，才抹了一半就断了！也不算便宜，质量竟然这么差！感觉不会再爱了……",2018-07-25 07:44:33
1283007,5,"好不输Dior",2018-07-09 22:14:29
1283007,1,"唇膏上有类似数字的标记，还不能退货。找客服体验差",2018-06-23 13:48:37
1283007,4,"颜值高，膏体滋润，但是膏体易断，中评吧",2018-07-04 09:55:24
1283007,1,"。。。。。断了。。。。。。",2018-07-18 00:28:31
1283007,5,"不错，颜色很漂亮，本身纯色偏深，省去口红了",2018-07-04 22:39:51
1283007,1,"刚到手，断了。自认不是大力士。",2018-07-16 12:02:37
1283007,5,"又润颜色又好",2018-07-08 18:01:34
1283007,1,"旋转到图一位置涂上就断了……让我怎么办？",2018-06-19 22:48:13
1283007,5,"很好",2018-07-08 22:46:38
1283007,1,"用一次就这样…太软了吧！",2018-07-03 09:39:20
1283007,5,"非常不错的选择，值得拥有。",2018-07-07 22:20:26
1283007,3,"没用几次就断了。",2018-07-03 13:33:38
1283007,5,"不错，滋润，颜色自然",2018-07-07 03:24:37
1283007,1,"质量太差,没用两次折的一塌糊涂",2018-06-28 12:59:45
1283007,5,"很喜欢",2018-07-07 21:15:09
1283007,1,"收到这个唇膏竟然膏体是歪的……把它摆正涂两下又倾斜回去了……然后用几次膏体中间已经歪的磕了几条坑……作为网易的资深脑残粉，这个东西有点失望啊",2018-06-23 14:13:20
1283007,5,"好",2018-07-07 10:15:19
1283007,1,"买回来就这样，售后也没什么表示，体验看得见。",2018-06-17 13:40:54
1283007,5,"哎哎哎哎膏体太软 断了！！！",2018-07-06 09:56:26
1283007,5,"物流非常快，但是到货就已经断了！后来联系售后，又发了个新的，物流依然很快",2018-07-08 16:35:16
1283007,5,"已使用，很滋润很香，颜色也喜欢。",2018-07-06 11:35:40
1283007,5,"这唇膏真不错，润，变色很完美。超喜欢，但是很容易断，太软了，商家改良一下，要不用刷的？",2018-07-02 13:14:06
1283007,5,"滋润，不沾杯",2018-07-06 09:47:58
1283007,5,"天太热，唇膏冻了两天还是断了，客服很好，直接退货了，满意满意满意！",2018-07-05 22:39:04
1283007,5,"好用",2018-07-06 17:21:31
1283007,4,"夏天真的不能买口红，一用就歪了，大概太软了。然后吧，就都在管壁上了。但是，其他一些品牌就没这个现象。",2018-07-13 10:56:57
1283007,5,"好好哈哈哈哈哈哈哈哈哈哈哈哈哈哈哈哈好",2018-07-05 21:32:50
1283007,5,"真的很想要滋润02色，可是客服说不会上架了，你们都没卖啊这一只，其他的买完等了几个月了。",2018-06-23 11:17:38
1283007,5,"超级好用！",2018-07-05 16:04:00
1283007,5,"不错，颜色自然",2018-07-05 22:52:38
1283007,5,"物流快，之前断了，这是又发的，售后还是很快的",2018-07-08 16:36:33
1283007,5,"我是严选的粉儿，但是今天这个口红必须给差评，买来用了三次底部就断掉了，本着勤俭持家精神我居然继续用了很多天，直到今日。。。。。。不得不抛弃，因为已经惨不忍睹。。。。。。
建议改良口红偏软的质地，特别是夏季根本没法用",2018-07-31 16:20:06
1283007,5,"我嘴唇属于挺干的，刚涂感觉比较滋润，颜色挺淡，时间长了嘴唇还是会干，颜色会变深。总体不错，只是包装太浪费了。一点个唇膏用那么大个盒子。",2018-07-23 08:55:07
1283007,5,"服务不错",2018-07-05 23:11:24
1283007,5,"服务到位",2018-07-05 23:12:04
1283007,5,"效果挺好的，就是用了一次之后找不到惹。。。",2018-07-07 09:31:37
1283007,5,"喜欢",2018-07-05 23:07:31
1283007,5,"没用多久就断了，平时也没转到最底下",2018-07-07 18:01:01
1283007,5,"同事说淡雅清新",2018-07-04 10:48:48
1283007,5,"唇膏本身是很好用的，滋润，根据皮肤的温度变色，颜色很自然，不留杯，确实很棒。美中不足的就是收到是断的，客服很负责给换了一个，这次打开特地看了看是没问题的，可是使用时轻轻一碰又断了，断的位置都一样，是唇膏跟管的接口处。由于已经换过一次，嫌麻烦就没换了，估计是工艺问题，不然总在接口处断。",2018-07-07 09:24:20
1283007,5,"很好用",2018-07-04 19:21:49
1283007,4,"颜色很好，粉嫩嫩的，持久性也不错，但是，第一次涂到唇上它就断了，断了，断了(⊙o⊙)，心好塞，可能是天气太热了。勉强修复了一下，但还是好丑，涂的时候也得非常小心(<U+0CA5>_<U+0CA5>)~但东西是真的好，以后的小仙女们记得不要太用力",2018-06-17 13:33:13
1283007,5,"价格实惠，家里人喜欢，质量非常好，我介绍朋友一起买",2018-06-29 23:15:57
1283007,3,"第一次用唇膏就从根部断裂了，体验感瞬间下降",2018-06-26 07:50:48
1283007,5,"非常好",2018-07-03 10:03:34
1283007,5,"呃，刚涂就断了，可能天气太热了吧？",2018-06-15 19:01:41
1283007,5,"收到就放冰箱里冻了下，下午用过还是歪倒了，好可惜，唇膏倒是滋润，颜色又适合我。",2018-06-27 23:55:11
1283007,5,"好",2018-07-03 23:22:58
1283007,5,"不错",2018-07-03 07:47:44
1283007,2,"坦白讲，并不好
首先颜色很浮
滋润效果只能算一般
买来用一次就断掉了……",2018-07-13 14:03:53
1283007,5,"颜色很提肤色，还不扎眼，好",2018-07-02 20:26:08
1283007,3,"第一次给产品差评，客观的说，颜色滋润度都非常好，不过才用了两天就发现唇膏从根部断掉了",2018-07-26 10:35:14
1283007,5,"没用……看起来挺好的",2018-07-02 16:47:49
1283007,5,"很好，清爽不油腻",2018-07-02 15:19:40
1283007,1,"满心欢喜的打开用，刚抹到嘴上就断了一半，真是扫兴，在网易严选买的最不满意的东西。",2018-07-02 11:27:50
1283007,3,"太小支，刚涂第一次就断了。建议改进！谨慎购买！！这还是第一次在严选碰到的，产品质量还是要保持初心！",2018-07-22 00:27:01
1283007,5,"还不错吧",2018-07-02 09:02:57
1283007,5,"一如既往的好评，涂上颜色很好，不过太软了，膏体容易倾斜",2018-07-31 10:57:26
1283007,5,"侬好",2018-07-02 12:03:38
1283007,3,"颜色是真的好，滋润度也够，可是才用了两天，膏体就断掉了<U+0001F616>客服应该出来说点什么吧",2018-06-27 09:04:54
1283007,5,"太热了，没用就断了",2018-07-26 17:17:25
1283007,5,"很滋润",2018-07-02 07:17:57
1283007,5,"好喜欢",2018-07-02 19:13:37
1283007,5,"这个颜色太难看了吧",2018-07-24 13:33:34
1283007,5,"好",2018-07-02 10:07:36
1283007,5,"膏体太软，很好用。",2018-07-22 09:28:56
1283007,5,"很好的唇膏，又滋润颜色也很自然",2018-07-01 10:58:27
1283007,3,"膏体实在是太软太软了，才涂了一下，就歪了。滋润度和颜色还可以……",2018-06-20 22:29:38
1283007,5,"送给女朋友的 她还蛮喜欢的 好评",2018-07-01 12:05:29
1283007,5,"额，怎么说呢，唇膏的颜色有些粉嫩，",2018-07-17 11:12:10
1283007,5,"颜色很好看，稍许有一点点儿干",2018-07-01 00:50:40
1283007,5,"颜色很适合我的 唇色",2018-07-16 22:37:45
1283007,5,"好润，味道好闻",2018-07-01 08:43:22
1283007,5,"超级好用，超爱",2018-07-01 07:45:47
1283007,5,"有一点玫红色的感觉，适合皮肤比较白的妹子",2018-07-04 21:02:02
1283007,5,"买了两次。",2018-07-04 10:54:26
1283007,5,"面料好，样子经典",2018-07-01 09:32:29
1283007,5,"中奖了，没有防备打开就断了",2018-07-01 15:38:10
1283007,5,"很好用",2018-07-01 14:41:04
1283007,5,"好滋润唇膏就是容易断",2018-07-01 14:28:15
1283007,5,"还没试。",2018-07-01 17:47:40
1283007,5,"唇膏不错，就是盒子设计不喜欢，旋转开的，使用不方便",2018-06-14 13:51:00
1283007,5,"好",2018-07-01 10:04:29
1283007,5,"刚抹就断了，伤心",2018-06-29 00:12:54
1283007,5,"货已收到，还没用，用后再追加评价",2018-06-28 01:33:19
1283007,5,"东西不错，就是开盖不方便，旋转式的。",2018-06-28 00:50:57
1283007,5,"不是软毛的啊",2018-06-27 07:13:16
1283007,3,"这个不满意。发现网易上的不是所有都有商品都是质量好的。膏体太软了，都不敢使劲用。不建议购买。",2018-07-26 22:08:59
1283007,5,"挺好的",2018-06-30 11:31:31
1283007,5,"变色唇膏，magic！",2018-06-22 20:36:52
1283007,5,"喜欢",2018-06-30 01:03:42
1283007,5,"颜色不是我喜欢的太粉了",2018-06-17 10:16:36
1283007,5,"非常不错，买给女朋友的，她很喜欢，再买一支送老婆",2018-06-14 16:55:45
1283007,2,"不知道是不是温度太高的原因，第一次用竟然断了，断了……",2018-07-27 17:28:32
1283007,5,"颜色还行，刚拿到试用一下就断了…",2018-06-27 21:15:59
1283007,2,"滋润度很好，颜色自然，适合夏天用，只是因为膏体是不牢固一动就会掉给差评，这样的质量不是严选该有的啊",2018-06-20 07:34:52
1283007,5,"喜欢，很滋润，颜色也漂亮",2018-06-29 19:11:28
1283007,3,"没用几天就断了，天气热归热，但是其他品牌唇膏好好的啊",2018-06-27 22:43:19
1283007,5,"很好",2018-06-29 22:58:26
1283007,1,"买了唇膏，第二次用就断了，产品质量不过关，联系客服没有好的解决方案，我本是忠实客户，通过这次售后我很怀疑严选的评论",2018-07-11 14:09:10
1283007,5,"好",2018-06-29 19:17:53
1283007,1,"唇膏太软了，回来用一次就断了，后台又不给处理",2018-07-13 14:46:30
1283007,5,"果然和微商那个188的味道一样，真划算！",2018-06-26 15:24:42
1283007,1,"易断",2018-07-24 02:48:58
1283007,5,"很滋润，效果好！",2018-06-28 17:22:23
1283007,3,"就用了一下，口红就断了，真不值这个价钱",2018-07-14 17:26:40
1283007,3,"产品：1.我想膏体是很软的，所以第一次刚拿到手才转了两圈吧，就发现已经断了，连碰到嘴唇的机会都没有。。。和客服反应后补寄了第二个，我真是超级小心的打开，俯看会发现膏体是歪的，所以旋转的时候会和外壳摩擦到，导致膏体有刮痕，这次没断了，但我也不敢用，打算放到冰箱里冻一下再说。2.在给第一支唇膏拍照的时候，手上不小心擦到了一点唇膏，过一会就发现已经变色。我觉得颜色更偏桃色，比图片上看到得更艳，当唇彩完全没问题。还有就是用水洗不掉，由此判断持久性应该可以。
服务：客服中规中矩，不轻易许诺啥，基本上也没说什么有用的话，给我的整体感觉是“没温度”。快递很快，这点很满意。
综上：不会再轻易尝试严选了。",2018-07-23 09:57:15
1283007,5,"细润，唇色自然",2018-06-26 11:17:44
1283007,2,"打开第一次用就断掉了，质量太差了，",2018-07-13 12:54:06
1283007,5,"漂亮的口红，喜欢",2018-06-26 10:26:15
1283007,5,"太好用了",2018-06-26 06:56:38
1283007,1,"口红<U+0001F484>是断的，第一次用就中间断裂了",2018-07-05 22:25:08
1283007,5,"会变色，不错",2018-06-26 18:01:11
1283007,3,"用了几次就断了",2018-07-11 20:35:08
1283007,5,"好",2018-06-26 11:05:58
1283007,1,"口红来了就是断的，申请退货换货都不通过，可以可以，在严选花了一万多块，安利身边好几个人，最后一个99块的口红商品质量有问题不给换，果断卸载，再也不来了！",2018-07-07 14:00:00
1283007,5,"严选服务很不错，支持，唇膏很好",2018-06-25 15:45:38
1283007,1,"这个唇膏非常不满意，收到时膏体已经连根断掉，我把膏体往下摁摁，由于膏体太软，一摁就烂了，100的唇膏完全没法用！买了不少东西了，最差的一次体验！！！",2018-07-07 13:33:44
1283007,5,"还没用  看着还可以",2018-06-25 23:04:31
1283007,3,"很容易断............",2018-06-29 10:17:34
1283007,5,"老婆太喜欢了",2018-06-25 21:46:02
1283007,2,"外壳手感不错，但是第一次用就断了，断了",2018-06-23 08:01:55
1283007,5,"质量很好",2018-06-25 12:19:38
1283007,5,"用了两次就断了，无语",2018-06-23 11:19:10
1283007,4,"一般般。",2018-06-25 13:33:32
1283007,3,"商品存在缺陷 刚收到一试用就断啦  好在客服很迅速的联系解决了 希望商家能改进此产品  免放更多消费者遇到同样的困扰.
再次为小选的解决问题态度表示感谢。望越做越好！",2018-06-22 22:22:52
1283007,5,"好",2018-06-25 06:55:58
1283007,5,"才用两次就断了，感觉质量不行",2018-06-19 19:29:35
1283007,5,"颜色很自然。",2018-06-24 09:02:34
1283007,1,"第一次用就断了",2018-06-19 18:34:49
1283007,5,"很棒",2018-06-24 16:21:30
1283007,5,"不知道是天太热的原因还是其他的，膏体跟部都快断裂了，不能退货，勉强收下吧",2018-07-30 08:47:51
1283007,5,"滋润度还可以，可惜用第一回就断了",2018-06-23 18:13:56
1283007,4,"颜色与滋润度很好，就是旋到底口红根部就有一圈断裂的，所以现在用就是歪的",2018-07-09 10:14:17
1283007,5,"不e，挺滋，上唇成淡淡的粉色",2018-06-19 21:21:11
1283007,5,"唇膏很滋润，颜色也好看，就是太软，才用一次就断了还没敢往外拧太多！",2018-06-22 13:10:17
1283007,5,"偏粉色  蛮滋润  比普通唇膏看起来更自然",2018-06-21 15:59:17
1283007,5,"原来有问题的口红重新更换。有问题得到及时处理<U+0001F44D> 希望严选
还是要严把质量关、免得彼此麻烦！",2018-06-22 13:22:52
1283007,5,"挺滋润的，颜色也挺好，但是正如有些评价说的。很～容～易断，没用几次就齐根断了，不知咋办",2018-07-13 22:51:45
1283007,5,"很好用",2018-06-23 13:56:06
1283007,5,"质量很好",2018-06-23 14:51:11
1283007,5,"包装很好，东西好用，快递很给力。",2018-06-22 19:49:08
1283007,5,"用过迪奥，纪梵希的变色，没啥差别，好用！就是夏天爱断！客服周到！",2018-07-21 19:54:28
1283007,5,"非常好用，比D牌的好用又便宜",2018-06-20 15:44:01
1283007,5,"感觉还行，不是我想要的那种颜色，可能是我本身嘴唇颜色太深了",2018-07-05 16:13:52
1283007,5,"还没用 用呢在评价",2018-06-22 20:59:14
1283007,5,"变色之后还蛮显色的，滋润度就是普通唇膏的滋润度，还是要打好底。",2018-07-04 20:36:41
1283007,5,"有巧克力的味道，颜色很淡",2018-06-22 18:13:47
1283007,5,"膏体有点歪 确定没有断 可是涂口红时膏体有晃 好怕断掉",2018-07-02 13:10:56
1283007,5,"太好用了，大爱",2018-06-22 00:54:34
1283007,5,"好用好用好用！",2018-06-22 11:52:01
1283007,4,"收到就放冰箱冷藏，结果忘在冰箱里两天了，不知道好不好用",2018-07-04 11:55:06
1283007,5,"放冰箱里冷藏了结果拿出来用了一天还是断裂了伤心难过",2018-07-04 10:31:09
1283007,5,"看评价有点揪心.zijihamwiyiu",2018-06-22 18:30:07
1283007,5,"持久度和滋润度很好，很舒服，不过膏体容易松动，不牢固，希望改进",2018-06-28 15:31:24
1283007,5,"颜色很好看",2018-06-22 19:16:17
1283007,5,"感觉不错、就是用了两次，好像从根部断了，是天热的缘故吗",2018-06-23 06:35:03
1283007,5,"好用啊",2018-06-22 10:36:32
1283007,5,"不好用！擦完之后会拔干！唇膏歪斜很容易断掉！",2018-07-31 22:08:06
1283007,5,"不错",2018-06-22 10:26:27
1283007,5,"颜色自然，看评论说很多断了的，就没敢拧出来",2018-07-29 16:29:44
1283007,5,"味道很香，滋润度不错，总体还可以",2018-06-21 13:47:24
1283007,5,"唇膏颜色、滋润度都还不错，就是用了没两天就断了",2018-07-25 13:55:31
1283007,5,"好看。颜色很不错。很元气啊",2018-06-21 22:02:29
1283007,4,"颜色还不错，就是涂上以后感觉油腻，夏天用着不太舒服",2018-07-09 23:02:55
1283007,5,"第二支，最近随身携带",2018-06-21 13:56:57
1283007,5,"很滋润，但是并不怎么显色，怀孕了也不敢经常用",2018-07-03 10:39:00
1283007,5,"真心不错，颜色粉嫩",2018-06-21 10:49:24
1283007,5,"很无语啊，唇膏是断的！唉，天气热也无奈啊",2018-07-11 11:04:32
1283007,5,"很好",2018-06-21 10:22:11
1283007,5,"断了，有点无语",2018-07-24 18:43:34
1283007,5,"好",2018-06-21 22:09:37
1283007,5,"非常好就是容易断",2018-07-21 22:52:42
1283007,5,"看着好玩买的，效果不错，也很滋润",2018-06-20 22:44:33
1283007,4,"收到货就迫不及待打开了，打开膏体都在晃，我那么小心翼翼地涂（之前看评论说易断）还是断了……涂上凉凉的，滋润，颜色也不易掉。",2018-06-19 22:45:34
1283007,5,"用了两次，感觉还不错",2018-06-20 23:23:06
1283007,5,"味道太大了，还要适应下",2018-07-19 22:30:01
1283007,5,"喜欢。价廉物美。",2018-06-20 21:27:32
1283007,5,"很少评论，怕个人观点误导别人，第一眼这款唇膏外观不错，挺上档，价有所值，可试用一次，从底部断裂了，联系客服，说天气热，软化了，让放冰箱试试，我一再说明断裂位置及程度放冰箱无用，客服人员态度很好，不断说让放冰箱，感觉我是首次用唇膏，我也是醉了…有这工夫，我还是努力搬砖再买一支<U+22EF>结局是，我真放冰箱了，过两天拿出来试，彻底断了",2018-07-05 11:04:50
1283007,5,"不错",2018-06-20 23:16:37
1283007,5,"这个唇膏在南方太容易熔断了。已经退货",2018-07-04 12:27:13
1283007,5,"看着还不错",2018-06-19 22:52:00
1283007,5,"颜色，持久度，包装都还不错。唯一遗憾的是拿到手膏体就是断的。幸好有补口红的经验，但断过的容易再断，将就了，懒得换。另外只有2.8克，只有普通口红的70%的量，做为润唇膏确实有点小贵。",2018-07-01 14:16:36
1283007,5,"很滋润啊",2018-06-19 09:51:26
1283007,4,"颜色好但是当天就断开了",2018-06-27 01:16:40
1283007,5,"一用就断，是真的",2018-06-27 15:09:12
1283007,5,"还没用，囤货中，相信严选品质。",2018-06-18 21:55:10
1283007,1,"垃圾",2018-06-22 23:27:19
1283007,5,"意外惊喜！小东西做工精细，淡淡的颜色，自然！",2018-06-18 00:15:57
1283007,2,"建议下架",2018-06-21 16:04:17
1283007,5,"还没开始用，颜值不错",2018-06-18 09:54:08
1283007,5,"膏体太软，快断了，唇膏挺好",2018-06-20 09:38:34
1283007,5,"手感不错，品质很好！",2018-06-18 21:29:31
1283007,5,"失望了 今早打开用时发现断头 了 、在细看中间就有断裂痕迹……这样的东西还能当新货发出。入严选的坑很久真心这次东西太让人心寒和失望",2018-06-17 14:48:31
1283007,5,"粉嫩粉嫩滴",2018-06-18 09:15:36
1283007,5,"颜色漂亮，就是滋润度不够久",2018-06-19 20:09:55
1283007,5,"很好用，就是容易断",2018-06-19 20:22:06
1283007,5,"可以",2018-06-18 21:13:20
1283007,5,"手上有迪奥变色唇膏001色，两支对比一下。膏体颜色一样，但是上唇后比迪奥001更加粉，如果是黄皮会显得有点土。膏体比迪奥更加软，涂上感觉更加轻薄但是滋润度差一点。涂上有点染唇液的效果，颜色保持还是挺持久的。总体这个价格是迪奥变色润唇膏的一半，性价比还可以。",2018-06-17 18:18:20
1283007,5,"唇膏特别润，颜色也不错！",2018-06-17 00:27:37
1283007,5,"太喜欢了<U+0001F618>",2018-06-17 20:28:50
1283007,5,"很喜欢这个颜色",2018-06-17 18:14:50
1283007,5,"还没用应该不错的",2018-06-17 21:19:06
1283007,5,"颜色不错",2018-06-17 12:11:37
1283007,5,"外壳设计到味道都好，也滋润",2018-06-16 11:21:46
1283007,5,"刚收到 用后追评",2018-06-16 09:33:21
1283007,5,"已经涂了，好看",2018-06-16 15:03:42
1283007,5,"老婆喜欢",2018-06-16 20:00:46
1283007,5,"美美哒",2018-06-16 13:01:57
1283007,5,"还不错",2018-06-16 20:41:26
1283007,5,"好",2018-06-16 20:48:12
1283007,5,"好",2018-06-16 23:11:26
1283007,5,"这个最喜欢了，淡淡的，好看而自然",2018-06-15 23:50:55
1283007,5,"很好看，粉粉嫩嫩",2018-06-15 13:35:33
1283007,5,"很好",2018-06-15 20:30:35
1283007,5,"迄今为止，用的最喜欢的润唇膏。",2018-06-14 08:27:22
1283007,5,"滋润度不错，颜色也好",2018-06-14 13:58:10
1283007,5,"颜值高又好用！",2018-06-14 08:01:35
1283007,5,"这个好用",2018-06-14 14:31:53
1283007,5,"和迪奥的差不多",2018-06-13 11:07:10
