"itemId","star","content","createTime"
1283003,5,"好吧",2017-12-02 12:44:40
1283003,5,"好吧",2017-12-02 12:45:04
1283003,2,"产品问题：
收到新货，鞋子前面明显有三块污渍，颜色不均，用手擦不掉，质量问题严重影响外观。此外，鞋底内侧有像泥一样的斑点，但是用手试着擦也不掉。
还没试穿，但是新鞋皮质已经有明显褶痕。担心未来如果穿了得是什么样子。
试穿完以后，样式和外观还是不错的，但是鞋底硬是网易鞋子的通病，这款也不例外，鞋底硬，穿着不舒适。
买过另外一款网易鞋子，今天第一天正式穿，走路带响……底子奇怪的材质，好澹",2017-10-20 12:47:44
1283003,5,"总体不错，性价比很高，喜欢！",2017-12-01 17:33:50
1283003,5,"鞋子好穿又划算，赶上8折促销，两百零几块入手，穿上很舒服",2017-11-15 11:51:37
1283003,3,"鞋穿着不舒适，很累脚，脚大的同志会有点丑",2017-11-02 14:24:42
1283003,5,"大小合适，满意",2017-12-01 16:01:43
1283003,5,"好",2017-12-01 09:49:10
1283003,4,"这个是本来买了棕色但是太浅换的 眼线服务很好 就是鞋很滑 真的滑 好好走路摔了三次了 平底就能滑",2017-12-06 09:03:11
1283003,5,"鞋子特别好看，穿着也舒服，不过，我不会穿鞋带，哎～～～",2017-11-11 00:34:18
1283003,5,"质量非常棒，跟我以前买的品牌的没什么区别",2017-11-26 07:18:37
1283003,5,"很好",2017-11-30 17:10:19
1283003,5,"有点薄，挺好看的，显脚小～",2017-11-10 23:35:41
1283003,5,"好评",2017-11-30 19:35:54
1283003,5,"物超所值，不磨脚。就是走路响声大了点儿",2017-11-14 19:02:06
1283003,5,"不穿丝袜有点难进去，但进去之后不小，刚好合适，鞋带的系法其实拿不准，整双鞋很有质感！",2017-12-03 22:23:57
1283003,5,"鞋的样子好、质量好，相信严选，会回购。",2017-11-25 19:21:05
1283003,5,"满意！！！",2017-11-29 22:04:00
1283003,5,"第一次订大了，要求换货，很顺利换，穿着很舒服,皮子也很好，不胩脚。",2017-11-10 16:52:55
1283003,5,"稍微有点紧，",2017-11-28 14:18:21
1283003,5,"鞋跟合脚，舒服，比店里一两千的舒服。",2017-11-27 09:05:38
1283003,5,"顺丰快啊 星期五买呢 星期天就到了 
有几个小灰点 不过算了 
底不硬 
没得图片上亮",2017-12-03 15:46:31
1283003,5,"鞋子很不错！优惠额度很大！",2017-11-27 19:50:03
1283003,5,"鞋子皮子很好，穿着很舒适，支持严选",2017-11-24 13:21:32
1283003,5,"很好看的，不过很显脚长…也可能是我脚真的长…呜呜呜
底有点硬，感觉是木底之类的，应该走不了远路。",2017-11-15 12:55:30
1283003,5,"穿着很舒服 一次满意的体验",2017-11-26 08:23:03
1283003,5,"很舒服",2017-11-26 10:14:57
1283003,5,"做工特别好，颜色也美，一百多能买到真是赚到",2017-11-10 16:32:24
1283003,5,"最近一直在穿的鞋，便携舒适，很喜欢。",2017-11-23 03:47:45
1283003,5,"很好穿，尺码刚刚好，就是鞋底很硬",2017-11-23 12:26:00
1283003,5,"刚穿有点硬，连鞋带也硬，脚背高的人慎买。",2017-11-17 11:16:07
1283003,5,"挺好看的，皮也还可以",2017-11-25 14:30:26
1283003,5,"大小合适，但是颜色比图片上的要浅，浅变色更明显",2017-11-13 08:30:32
1283003,5,"很好哦，使用率超级高",2017-11-25 10:28:03
1283003,5,"限时购很划算",2017-11-25 10:28:19
1283003,5,"皮的成份太少",2017-11-25 09:50:35
1283003,5,"从这双鞋要上架之前，我就开始关注了。上架之后只有黑色，没有棕色，我又等了好久。棕色上架之后立即入手。每次都有或大或小的问题，质量问题，或者做工瑕疵。换货就换了三次，契而不舍，可见我有多喜欢这双鞋。这双鞋版型经典，皮质非常柔软，几乎没有新鞋的磨合期。外形秀气精致，内部空间却足够大，对胖脚很友好。另外说一下，我的脚每次穿新鞋，脚后跟必定磨烂磨流血的，这次居然没有磨脚，意外惊喜。非常非常满意。",2017-11-28 21:00:42
1283003,5,"好看",2017-11-25 15:44:00
1283003,3,"鞋子舌头处太硬，第一天穿磨破两个脚踝",2017-11-22 23:22:33
1283003,5,"搞活动买好划算啊 希望不要刮脚",2017-11-24 17:04:15
1283003,5,"这是最最满意的一次网购，严选真有其名",2017-11-09 23:40:30
1283003,5,"京东快递很快收到，就是鞋订大了，我的脚运动鞋穿23号，船鞋穿24号的，不知是否可以换，还有鞋带外侧的皮子是褶皱，两只都有。",2017-10-24 18:00:56
1283003,5,"非常满意，皮质柔软，不磨脚，尺寸很正，性价比超高",2017-11-09 08:22:42
1283003,5,"刚收到货，迫不及待试穿一下，很不错，很舒服也很好看",2017-11-09 20:45:53
1283003,5,"鞋子是经典样式没得说，脚底的垫儿也比较软，很舒服，但是鞋底太硬，走在地板上太响。一分钱一分货。另外吐槽一下发货速度，一个多星期不发货也不通知用户，客服联系过好几次都不积极，最后说没货了建议我退款，转天系统提示又发货了，真是没见过这么垃圾的系统，严选可以好好做一下客户体验了",2017-11-20 13:23:41
1283003,5,"比我想象中好，质量好，上脚也舒服。",2017-11-22 18:27:46
1283003,5,"上脚特别舒服，很有英伦风",2017-11-24 20:09:50
1283003,5,"颜色感觉太浅就又换了一双 黑色的 严选态度很好包来回运费 但是这双鞋太滑了 已经在我好好走路的时候滑了两三回了 平底滑！害怕过马路摔倒<U+0001F611>",2017-12-06 09:01:30
1283003,5,"拿出来看觉得做工有点粗糙 皮质也有些折痕  但是挺好看的  尤其是鞋头看起来很好  质量对得起价钱  完美主义者就不要选啦  另外试穿一下  不磨脚  尺码就是正常尺码  没有偏小",2017-11-11 10:41:51
1283003,5,"不错，性价比高！",2017-11-24 16:39:19
1283003,5,"穿着很舒服",2017-11-24 21:54:21
1283003,5,"希望细节方面能改进呢",2017-11-09 14:12:31
1283003,5,"好好好好好好",2017-11-24 14:09:04
1283003,5,"好",2017-11-24 07:39:25
1283003,5,"穿着合适，但会捂脚臭脚",2017-11-04 10:35:14
1283003,5,"好看！",2017-11-24 13:23:47
1283003,5,"宽脚也能穿哦，很舒服，这个价位真是太惊喜了",2017-11-08 21:13:33
1283003,5,"性价比超高，皮质和款式都挺大气.刚开始穿的时候以为买小了，然后把鞋带松绑了以后穿进去正好。鞋带有点麻烦。现在穿有点闷热，等11月穿差不多，坐标上海。",2017-10-20 21:49:40
1283003,5,"买给妈妈的鞋子，她很喜欢",2017-11-23 13:47:11
1283003,5,"皮鞋有点硬，但穿着还舒服",2017-11-23 19:57:01
1283003,5,"买了严选两双鞋子，我来说一下，这一双很多人评价码数偏小，我是挺标准的230，我觉得他不是小，他是紧……入口处太紧了，很难塞进去，没有那双红色的好穿。我脚也不算胖，就正常，塞进去之后除了入口处有点勒脚，就还好了。拿不准要不要换。
给大家参考一下我的脚真的是正常胖瘦……",2017-10-22 12:47:52
1283003,4,"满意质量！满意款式！满意严选！",2017-11-23 16:16:34
1283003,5,"非常好，上班穿刚合适",2017-11-23 14:44:33
1283003,0,"可以，就是感觉舌头那有点磕脚背，鞋带穿脱不方便，鞋子总体还是可以，显的脚秀气。平时穿38码，买38穿棉袜合适。值得购买，现在基本都在严选买，希望严选出更多宝贝。",2017-10-22 21:42:53
1283003,5,"鞋型很好。",2017-11-23 21:39:34
1283003,5,"好",2017-11-23 10:29:12
1283003,0,"首先值得表扬的是质感，鞋型还不错。但是我依然不推荐购买，因为最大的问题，第一是鞋子很硬，穿着不舒服，第二，鞋子走路会有咯噔咯噔的声音，非常尴尬。如果还是想买，我建议如果要穿厚袜子的，一定要买大一码，我是瘦脚，如果穿比较厚的袜子，会觉得很挤！",2017-10-19 22:47:37
1283003,5,"穿了今天鞋子，鞋子穿的轻松，。好评",2017-11-22 21:18:17
1283003,5,"尺码合适，但是要等到春天才能穿了",2017-11-20 12:53:42
1283003,3,"款式还行，但是鞋子有很深的褶痕，明显是被胖脚穿过的",2017-10-20 10:40:42
1283003,5,"还没穿，感觉还行",2017-11-22 18:35:42
1283003,5,"穿着舒适，没有怪味！",2017-11-22 11:15:45
1283003,5,"款式经典工艺尚好  表层牛皮似薄易伤

前掌底应有防滑纹   己无棕色令人遗憾",2017-10-22 13:14:43
1283003,5,"超级好看 超值",2017-11-22 00:24:17
1283003,5,"好看。",2017-11-22 21:23:27
1283003,5,"哈哈 我不想那么高调，鞋子太响啦，第一次确实难穿进去，后来就好了，平时穿37脚背高脚宽38合适，性价比很高的一款鞋",2017-11-30 21:38:27
1283003,5,"我这个人比较懒，很少评论。但这是我在网易严选上买的第二双鞋了！不得不说一下。我的脚很挑鞋，以前很多鞋买回来穿着脚疼就不穿了！这两双鞋都非常惊喜！一点也不磨脚！真是惊喜加感动！以后看到款式喜欢的都不犹豫了！！",2017-11-22 21:17:28
1283003,5,"尺码质量都挺合适的，已经穿上了。",2017-11-21 15:56:35
1283003,5,"外型挺好看的，就是这个底担心下雨天会不会滑",2017-11-09 21:49:31
1283003,5,"皮鞋很软。穿着还挺舒服",2017-11-21 19:36:15
1283003,5,"挺好的，穿着也舒服",2017-11-21 18:49:09
1283003,5,"鞋子很漂亮，鞋面很软。就是鞋底有点硬，走路咔咔的……",2017-10-23 15:42:47
1283003,5,"非常满意，质感棒得无法形容",2017-11-21 14:36:43
1283003,5,"鞋子很好，穿着舒服",2017-11-21 22:04:03
1283003,5,"非常喜欢！还想再买！",2017-11-21 13:30:18
1283003,5,"满意，脚背高的要把带子松一松就能穿进去了",2017-11-22 13:02:32
1283003,5,"质量好，符合购物要求！",2017-11-21 19:25:37
1283003,5,"感觉皮料有点薄。其他还好吧",2017-11-29 01:18:29
1283003,5,"大小刚好，上脚好看～",2017-11-21 10:05:59
1283003,5,"不适合胖脚",2017-11-21 10:21:59
1283003,3,"鞋底硬 滑，给人感觉怪异。内部舒适不卡觉，比较好。",2017-11-13 22:07:20
1283003,5,"底很硬",2017-11-21 12:33:50
1283003,5,"质量还可以",2017-11-21 19:29:34
1283003,5,"鞋子码正，舒服。就是鞋头再尖点会洋气些。",2017-11-11 15:18:39
1283003,5,"很舒服",2017-11-21 22:16:24
1283003,5,"很喜欢，没穿袜子穿稍微偏大一点",2017-11-20 20:12:51
1283003,5,"鞋子稍微有点显脚长，但是质量不错",2017-11-26 21:15:18
1283003,5,"很喜欢，要明年春天才能穿了。",2017-11-20 12:45:18
1283003,5,"颜色很浅，好像没上完油?",2017-11-20 12:44:43
1283003,5,"鞋子太秀气了，图片的跟要高些，大气些",2017-11-21 07:57:32
1283003,4,"美观大方但尺寸有点小，",2017-11-20 07:35:23
1283003,5,"很好很棒棒",2017-11-20 11:48:12
1283003,5,"鞋底略硬，其他还行",2017-11-21 11:52:56
1283003,5,"鞋子很好穿",2017-11-20 20:01:38
1283003,5,"好穿 实用",2017-11-20 22:35:01
1283003,5,"<U+2764>好喜欢",2017-11-20 22:05:46
1283003,5,"鞋底比较硬
其他OK",2017-11-20 19:37:20
1283003,5,"好",2017-11-20 16:22:50
1283003,5,"还行吧，跟必要比质量还是有差距，不过价格也便宜些",2017-10-21 16:23:58
1283003,5,"好皮鞋，穿上很有范，好好的",2017-11-19 10:04:11
1283003,5,"鞋子超好！超舒服！鞋底也够厚！超值！",2017-11-17 13:04:58
1283003,5,"脚背高，有点紧，其他不错",2017-11-13 11:19:38
1283003,5,"皮软，第一次穿都不磨脚！",2017-11-19 20:58:48
1283003,5,"很棒!!!!!超级喜欢",2017-11-19 19:48:07
1283003,5,"鞋子不错 就是鞋底不防滑",2017-11-10 18:00:02
1283003,5,"非常满意！",2017-11-19 13:04:23
1283003,5,"鞋子里面较宽松，皮面质地是硬面，看着很有型，很喜欢",2017-10-24 09:50:34
1283003,5,"超级舒服啊，感觉半年没穿过如此舒服的鞋子了，我是脚宽胖型的，很难买到舒服的鞋子。这个皮质软，内里不掉色，穿一天走一天也不累脚，鞋面也没有折痕，版型还超级显瘦。我要去回购一双黑色！！！太好穿了！！！！！还有，很多人都说不好穿进去，倒也还好，鞋带稍微松松，如果穿丝袜会更好穿一点。",2017-11-10 09:26:20
1283003,5,"皮子很软，鞋头很有型，合脚，超级好看",2017-11-14 08:03:13
1283003,5,"175cm平时穿运动鞋38码.穿这个也蛮好，有高跟鞋的感觉哈哈哈哈，走起路来很高调的。声音很大。同学说很帅气的一双鞋。",2017-10-20 17:12:59
1283003,5,"很舒服，只是底有点滑",2017-11-08 13:41:37
1283003,5,"喜欢的很。布洛克雕花女鞋。很舒服",2017-11-18 19:38:34
1283003,5,"很好 穿着很舒服",2017-11-18 09:06:58
1283003,5,"样子百搭，之前商场买过一双有牌子的穿烂了，这次再严选入一双，皮子不硬，穿着很舒服，不会卡脚，关键价钱只有商场的几分之一，超值！",2017-10-22 07:01:35
1283003,5,"还行，穿着舒适",2017-11-18 21:32:44
1283003,5,"质量挺好的",2017-11-18 17:17:43
1283003,5,"东西不错，穿了两天都没味道",2017-10-25 15:13:24
1283003,5,"喜欢，基础款",2017-11-18 17:02:36
1283003,5,"好穿",2017-11-18 09:37:58
1283003,4,"鞋还行，鞋底没有纹路是平的，冬天不好穿容易滑，鞋带是个鸡肋，很难拽，穿脱都很麻烦",2017-11-23 10:41:53
1283003,5,"好",2017-11-18 23:01:15
1283003,5,"左右脚松紧情况不太一样，其他均满意。各位网友注意，第一次穿一定要记着撕掉鞋底的白色纸商标。",2017-11-18 23:22:20
1283003,5,"买给婆婆的，她很喜欢，质量不错<U+0001F44D>",2017-11-15 12:07:13
1283003,5,"皮软。穿着舒适！样子也好！",2017-11-17 09:34:57
1283003,5,"在严选买了两双鞋子都算满意。什么鞋子我也穿不了一季准踢坏了。在严选买没心理负担",2017-12-02 13:16:55
1283003,5,"皮质量很好，大小合适。",2017-11-17 19:38:18
1283003,5,"比较轻，比想像中软",2017-11-17 00:16:50
1283003,3,"鞋底太硬，走路响得很厉害。这鞋底真的不知道怎么设计的。后悔没有退货了。",2017-11-19 23:40:37
1283003,5,"很洋气的小皮鞋",2017-11-17 23:25:31
1283003,5,"大小合适，底子略硬",2017-11-17 18:59:22
1283003,5,"第一次买这种风格的鞋子，穿上以后感觉不错。就是走路时候，根的声音比较响",2017-11-19 14:16:55
1283003,5,"有点紧，偏小",2017-11-17 21:54:31
1283003,5,"还行，有点小",2017-11-17 20:26:47
1283003,5,"鞋子很好看，价格也很实惠，就是鞋带太紧了，穿和脱都有点麻烦。",2017-11-11 23:16:58
1283003,5,"很好",2017-11-17 16:32:01
1283003,5,"还好",2017-11-17 07:50:54
1283003,5,"鞋子质量很好，只是不太适合脚背宽的人，我平时穿38，这款前面有点窄，脚后跟还有一指宽的空隙。",2017-11-14 14:58:44
1283003,5,"好",2017-11-17 13:19:02
1283003,5,"好",2017-11-17 22:33:52
1283003,4,"能看出是别人退的货，但是想想自己穿一两次也有皱子也懒得换了",2017-11-19 08:11:34
1283003,5,"码数还是比较正的，穿上增高效果明显，英伦风范足。",2017-10-22 18:20:02
1283003,5,"皮子软，穿着舒适。不错！",2017-11-16 19:51:31
1283003,5,"严选真正的惊喜在于鞋子，脚背厚脚掌宽轻松驾驭，唯一不足就是鞋底硬了一点",2017-10-23 19:06:52
1283003,5,"鞋子还可以，留下了。",2017-11-16 22:56:01
1283003,5,"买大了，穿厚袜子吧，舒服",2017-11-15 10:32:11
1283003,5,"正常都是穿37，但是这个款式号码偏小，36需要硬塞，很不舒服，申请换37。",2017-10-20 16:12:47
1283003,5,"鞋子非常好，老婆很喜欢",2017-11-15 08:43:02
1283003,5,"性价比太高了",2017-11-15 12:42:44
1283003,5,"收到时刚拆开有点失望，没有预想的满意，侧面的皮有点皱皱的，可是试穿一下觉得脚感不错，挺舒服 就收下了。",2017-11-27 19:36:52
1283003,5,"上脚很秀气，不错。",2017-11-15 12:10:13
1283003,5,"鞋子不错，穿着舒服",2017-11-15 13:05:32
1283003,1,"不喜欢，这个鞋子看起来笨笨的。显得脚很长，鞋底也不是一体成型的。鞋底会卡脚，走路走多了肯定不舒服。",2017-10-24 18:04:56
1283003,5,"喜欢 穿着舒服",2017-11-15 23:06:30
1283003,5,"舒适挺括",2017-11-15 14:12:08
1283003,5,"鞋子还是舒服的，可是鞋底声音大，我在考虑要不要换鞋底",2017-12-03 10:34:32
1283003,5,"皮好，款式好上脚挺秀气的好评",2017-11-14 00:07:12
1283003,5,"好看好看，中了严选的毒，物有所值",2017-11-14 11:08:34
1283003,5,"做工粗糙，后来退了，不过态度还算好。如果不粗糙还是挺喜欢的，无奈实物和图片有差距。严选，这鞋要换个加工企业啦",2017-12-02 21:30:45
1283003,5,"蛮好的蛮好的蛮好的蛮好的～～～～～～～",2017-11-10 15:01:01
1283003,5,"这鞋子底很软，穿着很舒服",2017-11-14 20:32:29
1283003,5,"原买大了，申请换货，客服很好，新鞋子很满意",2017-12-01 12:14:05
1283003,5,"给妈妈买了双大号的，她很喜欢",2017-11-12 14:58:31
1283003,5,"很漂亮，很舒服，物超所值。",2017-11-14 12:14:47
1283003,5,"颜色有点偏白，光泽度没有图片那么好，但是穿起来很舒服。",2017-11-30 14:58:31
1283003,5,"非常好，舒服，漂亮！物超所值！",2017-11-14 12:12:39
1283003,5,"穿着舒适，尺码合适",2017-11-14 10:55:42
1283003,5,"挺好的，比较透气，比较适合瘦长脚，虽然我不是，凑合着把脚挤进去穿，穿两次就变宽点，穿进去的过程容易多了",2017-11-13 23:12:29
1283003,5,"老婆，很喜欢",2017-11-14 22:23:41
1283003,5,"好",2017-11-14 18:26:46
1283003,4,"鞋子很好看，就是鞋跟太硬，瓷砖上走要小心，很滑",2017-11-12 12:31:12
1283003,5,"皮质看起来不错，号码准确，穿起来很有范儿",2017-11-13 22:53:08
1283003,5,"鞋非常舒适！颜色也很不错！",2017-11-13 11:16:38
1283003,3,"不喜欢这个鞋带的设计，且感觉偏小，看了一眼就退货了",2017-10-22 17:40:45
1283003,5,"好穿显脚小",2017-11-13 23:43:36
1283003,5,"质量很好。",2017-11-13 21:15:27
1283003,5,"颜色比照片上的要浅点，考虑要不要买双黑色的",2017-11-07 22:21:59
1283003,5,"好好好",2017-11-13 08:49:17
1283003,5,"很好",2017-11-13 15:20:41
1283003,5,"鞋子很舒服，及时是新鞋子也不磨脚。呵呵，不过可能和皮革的材质有关，鞋帮有点硬，没有皮的软。不过也对得起这样的价格了",2017-11-03 15:11:04
1283003,5,"皮子真是算到没话说，连着在严选买了三双鞋了，每一双都很满意，这个鞋还是买正合适的码，不要买大了",2017-10-23 06:38:12
1283003,5,"非常合适 质量很好 穿着舒服",2017-11-12 23:27:05
1283003,3,"本来打算退的 因为鞋子太长了 ，显得脚特别大
试的时候不小心把吊牌弄掉了 只能收下了...
质量还可以 穿脱不方便",2017-11-28 16:45:28
1283003,5,"平底走路很舒服，样子款式不错",2017-11-12 07:59:12
1283003,5,"很漂亮，家婆很满意",2017-11-12 10:19:36
1283003,5,"颜色、皮质、做工都非常好",2017-11-12 14:34:36
1283003,5,"大小合适，很舒服，家人满意",2017-11-12 11:57:29
1283003,5,"颜色比图片浅，不太满意，不过算了，偶尔穿穿",2017-11-30 12:51:55
1283003,5,"有小瑕疵，忍痛割爱了，严选真是不错，售后无忧啊",2017-11-29 00:15:27
1283003,5,"好看的鞋子，柔软舒适",2017-11-12 20:25:40
1283003,5,"鞋收到很快，不过鞋帮特别硬，穿着不太舒服，退了",2017-11-08 12:32:38
1283003,5,"好看(●<U+25E1>●)<U+FF89>",2017-11-12 15:33:01
1283003,5,"看起来不错，试穿也合适。",2017-11-12 12:42:09
1283003,3,"内里并非全部羊皮，大部分是衬布，有点闷脚",2017-12-02 18:24:50
1283003,5,"质量不错，鞋底舒服",2017-11-12 17:38:11
1283003,5,"合脚，皮质柔软",2017-11-12 08:24:38
1283003,5,"非常满意，喜欢！",2017-11-12 16:36:14
1283003,5,"很好只是穿脱不太方便",2017-12-03 10:35:01
1283003,5,"还行",2017-11-12 19:38:03
1283003,5,"鞋子只能说是凑合吧。样式挺美，就是鞋底用料看的出来非常敷衍。是那种质量非常差的橡胶底。特别硬邦邦的一点质感都没有。走路的时候把地磕得非常想。我都不敢在办公室穿这个鞋了。",2017-12-03 09:20:11
1283003,5,"好",2017-11-12 10:44:51
1283003,5,"好看",2017-11-12 00:43:35
1283003,5,"严选的质量还是不错的，价格也合适",2017-11-11 21:30:45
1283003,5,"鞋子很好看，就是系带有点麻烦",2017-12-01 14:02:34
1283003,5,"大小合适，不磨脚，不错的选择。",2017-11-11 21:48:12
1283003,5,"很好看，质量质感都很好",2017-11-11 15:33:40
1283003,5,"换了好几次，做工始终不满意，粗糙，比不上买过的其他几双鞋，后来退了。不过态度很好，换货退货也很顺利，方便。冲着这态度严选的毒继续喝，不过希望以后做工精细些，鞋子一旦粗糙就没品了。",2017-12-02 21:27:04
1283003,5,"款式很好看，喜欢",2017-11-11 11:40:38
1283003,5,"第一次买，品质不错",2017-11-11 13:01:53
1283003,5,"181的价格买这么有型的真皮，还有啥可说的。尺寸非常合适。看到备注说建议选大一码，其实不需要。我的脚都很难买鞋的，没想到这里的鞋码这么合适。看到这种不太好的评论一直犹豫，但是这个价格实在值得一试，没想到这么好。严选的各种皮鞋都买了，可以召唤神龙了。",2017-12-02 17:56:15
1283003,5,"我觉得挺好",2017-11-11 02:44:40
1283003,5,"很软，舒服的",2017-11-11 15:25:46
1283003,5,"老婆说还行",2017-11-11 09:47:32
1283003,5,"不够秀气",2017-12-02 00:00:28
1283003,5,"很满意",2017-11-11 20:50:12
1283003,5,"鞋子不错",2017-11-11 14:56:20
1283003,5,"脚好舒适，不磨脚，缺点是走路声音比较大。",2017-11-22 15:35:11
1283003,5,"物美价廉",2017-11-11 23:42:50
1283003,5,"好看…就是声音有点大",2017-11-29 07:29:14
1283003,5,"穿着非常有型，好看，再次相信严选",2017-11-10 22:50:27
1283003,5,"穿了一段时间了，很舒服，超值",2017-11-10 11:56:03
1283003,5,"太硬了，穿了不是很舒服。",2017-11-27 09:11:00
1283003,5,"鞋非常喜欢比想象的舒服。",2017-11-10 20:21:42
1283003,5,"质量比之前黄色的那双好些。",2017-11-27 11:32:21
1283003,5,"质量很好，性价比高。",2017-11-10 19:59:21
1283003,4,"皮软  但是感觉显脚长",2017-11-10 22:57:22
1283003,5,"好<U+0001F44C>",2017-11-10 15:07:35
1283003,1,"不知道什么时候确认收货了，但是这鞋子试穿不舒服，申请退货三四次都拒绝了。这鞋子太硬了，很难穿，我穿了千百度的一双类似皮鞋才知道还有那么舒服的皮鞋。",2017-11-26 12:08:29
1283003,4,"还行",2017-11-10 23:15:43
1283003,3,"走路有声音，鞋底质量需要改进。",2017-11-25 17:16:58
1283003,5,"不错",2017-11-10 17:52:29
1283003,5,"好",2017-11-10 11:57:05
1283003,5,"舒服    脚瘦平时37半这个37可以的",2017-11-09 23:20:04
1283003,5,"一般 皮质还可以 鞋型太宽 鞋舌太硬 太长 脚腕那里能割出血 穿厚棉袜都能隔得慌 建议改善鞋型 或者将鞋舌位置的皮料换更好的软皮",2017-11-24 18:57:02
1283003,5,"真不错呢，大小合适，穿着也很舒服，美美哒，物美价廉哦",2017-10-25 21:41:51
1283003,5,"严选上的第二双鞋子，非常棒！",2017-11-09 09:44:36
1283003,5,"鞋子太单薄，跟图片看起来有些差别",2017-11-23 23:15:01
1283003,5,"鞋子很好，穿得舒服",2017-11-09 14:34:56
1283003,5,"鞋子大小合适，很舒服。",2017-11-09 06:08:34
1283003,4,"穿了几天来评价一下 一型半的鞋子宽脚板也能穿。码正皮软穿着舒服。缺点么就是鞋底略滑 走起路来鞋跟有声响。如果是牛筋底就好了 还有穿脱有点费劲。总体性价比高 值得入手",2017-11-23 16:10:33
1283003,5,"皮质软，很舒适。",2017-11-09 21:07:18
1283003,5,"穿着舒服",2017-11-09 21:35:39
1283003,5,"看提示长一码，结果有点长了",2017-11-20 10:51:24
1283003,5,"nice",2017-11-09 11:59:44
1283003,5,"对得起价格，除了硬一点，真的非常好",2017-11-08 18:41:42
1283003,3,"鞋子比较硬，穿潜袜会磨脚",2017-11-20 17:07:51
1283003,5,"穿着舒服，走路也不累",2017-11-08 20:20:25
1283003,5,"又舒服又好看，有腔调，老喜欢了！推荐。",2017-11-05 09:01:09
1283003,5,"鞋底有点点薄",2017-11-18 20:48:08
1283003,5,"这个穿脱不方便，我退了",2017-11-07 22:50:08
1283003,5,"鞋子很舒服，不磨脚",2017-11-07 09:08:58
1283003,5,"很好，品质优良价格实在",2017-11-07 15:26:18
1283003,5,"舒适，鞋带不太好系。",2017-11-16 19:51:56
1283003,5,"样子很好",2017-11-07 19:32:24
1283003,5,"不好，鞋底那么响怎么穿！而且皮子薄",2017-11-14 16:34:13
1283003,5,"第二天就穿上了，很软",2017-11-06 03:19:27
1283003,5,"品质好 不磨脚 很舒服",2017-11-06 09:33:03
1283003,5,"鞋面蛮软底，鞋底比较硬，穿起来比较舒服，至于鞋底走路有响声我觉得是可控的，大部分鞋子走路都有一定的声音，只是这双鞋大一点，也没什么大碍，总体满意。",2017-11-13 09:37:17
1283003,5,"大小不合适，但鞋子还不错",2017-11-05 13:46:39
1283003,5,"货真价实，物有所值",2017-11-04 10:30:20
1283003,5,"有点压脚面只能裸脚穿",2017-11-13 22:44:40
1283003,5,"很漂亮",2017-11-04 11:33:58
1283003,5,"棒！",2017-11-04 18:21:08
1283003,3,"底太滑！色差较大。凑合穿吧",2017-11-12 22:59:40
