"itemId","star","content","createTime"
1283003,5,"穿的很舒服 非常喜欢",2018-04-08 22:07:25
1283003,5,"鞋子最满意，特别好",2018-04-08 15:24:23
1283003,5,"挺好",2018-04-08 13:18:46
1283003,5,"好",2018-04-08 10:38:57
1283003,5,"不错，码数合适，显得脚型比较长。",2018-04-07 16:32:03
1283003,4,"左脚鞋头染色有点不均匀，鞋底橡胶脚后跟处分别有个小裂缝。总体感觉还不错，皮质挺软的，但鞋底觉得有点硬哦。",2018-04-09 08:15:31
1283003,5,"鞋子挺舒服，脚背高不合适",2018-04-07 10:33:01
1283003,5,"不太好看，比较普通，可能也的看衬什么吧",2018-04-07 15:35:17
1283003,5,"样子好看，穿着舒适",2018-04-07 14:27:56
1283003,5,"虽然邮寄错了但是还是继续相信严选",2018-04-06 17:00:16
1283003,5,"最强卖家秀了，没有之一，哈哈哈，严选应该夸我一下",2018-03-24 15:31:49
1283003,5,"还不错，挺软的，外观和clarks基本一致，但是clarks有脚后跟和脚板的防磨缓冲垫，鉴于严选家的价格只是clarks家一半不到，就不纠结这些细节。只要不打脚就行。",2018-04-07 18:01:27
1283003,5,"皮质很好，也很轻便",2018-04-06 21:08:52
1283003,5,"好质量就是好",2018-04-06 14:19:29
1283003,5,"好穿。大小合适。",2018-04-06 13:34:38
1283003,5,"试下感觉满意",2018-04-06 12:26:35
1283003,5,"上脚很秀气！",2018-04-06 10:03:37
1283003,5,"好",2018-04-06 21:56:24
1283003,5,"好高好高好好好好好好好高好高好好好好好好",2018-03-23 16:16:31
1283003,5,"很不错",2018-04-05 16:47:00
1283003,5,"很百搭的",2018-04-04 22:18:50
1283003,5,"鞋盒太菜了，第一次鞋盒挤压鞋子都变形了，换货依然如此，只比第一次好一些。希望能改进。",2018-04-07 20:23:59
1283003,5,"非常漂亮，这个价太值",2018-04-03 23:13:43
1283003,5,"不好配衣服 磨练后跟",2018-04-03 22:07:17
1283003,5,"很好，舒适",2018-04-03 09:51:11
1283003,5,"都没浪费穿了上班了很实用",2018-04-06 06:02:13
1283003,5,"试穿了一下，很舒服，不硬不磨脚。平时穿旅游鞋运动鞋比较多，穿皮鞋容易磨脚或觉得拘束，但这双鞋完全不用担心。但愿网易能多出些鞋样，以后买鞋就不去别地方买了。",2018-04-05 18:06:47
1283003,5,"好好好啊好啊边看千千哦",2018-04-02 22:10:37
1283003,5,"还不错啊，手感比较软，颜色也好看",2018-04-02 14:29:21
1283003,3,"难穿 已退货",2018-04-05 21:55:10
1283003,5,"就是码数有点小",2018-04-02 22:02:52
1283003,5,"百搭款啊，最爱",2018-04-02 12:53:29
1283003,4,"质量还可以，不错。",2018-04-02 10:27:55
1283003,5,"颜值高，建议给多些穿搭建议",2018-04-06 11:06:54
1283003,5,"不错",2018-04-02 19:26:47
1283003,5,"很好穿，也很好看，买大了一些～",2018-03-31 09:48:14
1283003,5,"听惊喜的，很好穿",2018-04-01 20:01:01
1283003,5,"很好，很漂亮也很舒适。就是走路有点响",2018-03-28 23:10:28
1283003,5,"不错",2018-03-31 18:48:19
1283003,5,"很舒服，下次有看到合适的还来买",2018-03-30 10:49:02
1283003,5,"非常好，皮质软。有型。不磨脚",2018-03-30 17:25:17
1283003,5,"鞋子还算是很舒适的，鞋底有点薄，要是再厚一点就好了，还有就是穿上这双鞋走路的时候特别响，穿别的鞋真不这样。刚买来的时候觉得鞋型不太好看，后来穿了几次，看习惯了，也觉得还好。皮质柔软，穿着很舒服，有点容易被刮伤。",2018-04-02 13:14:00
1283003,5,"穿着挺舒服的",2018-03-30 08:53:54
1283003,5,"买了之后去日本穿的，走路半天都不累，上脚很舒服，在日本也可以hold住～",2018-04-05 00:36:38
1283003,5,"很好舒服好看",2018-03-30 10:01:33
1283003,5,"皮质很软，颜色比照片浅一些，穿上很舒服",2018-03-26 10:42:42
1283003,5,"颜色款型都好，新鞋有点硬，但不磨脚。",2018-03-26 18:42:18
1283003,5,"开口稍微有点小，鞋舌边缘会有点磨脚踝，大小很合适，穿着比较舒服",2018-04-01 00:42:45
1283003,5,"鞋子质量很好，但是不太适合我的脚！退了",2018-03-31 19:30:28
1283003,5,"鞋子质量不错，就是鞋带有点怪异",2018-03-30 21:46:20
1283003,5,"穿上走路很舒服，但是棕色存在色差",2018-03-30 19:41:22
1283003,5,"穿出了高跟鞋走路的声音，性价比还可以。。。鞋底不是特别软",2018-04-01 11:53:40
1283003,5,"还可以，有一点硬",2018-03-29 10:35:20
1283003,5,"鞋子有些大，质量好",2018-03-29 11:21:37
1283003,5,"喜欢，穿起来有范儿",2018-03-29 09:56:31
1283003,5,"特别舒服，没有磨合期",2018-03-29 13:27:01
1283003,5,"非常满意，OK！",2018-03-29 19:14:27
1283003,5,"神速啊！",2018-03-29 13:02:10
1283003,5,"好",2018-03-29 15:16:17
1283003,5,"鞋没问题就是有点照了再定大一号德，好过生完孩子，脚得",2018-04-03 09:09:19
1283003,5,"挺好的，外表和clarks一样，皮质略有差距",2018-04-02 23:20:05
1283003,5,"适合我这种大脚买不到鞋的，穿着很舒服！",2018-03-21 11:19:41
1283003,5,"虽然色差真的挺大但是穿起来蛮软的就留下了.不明白为啥都用这么好的皮子了颜色要染这么奇怪...",2018-03-29 18:07:53
1283003,5,"鞋子不错，黑色大气，偏大一点点。",2018-03-28 19:30:58
1283003,5,"很好很好很好",2018-03-28 09:12:06
1283003,5,"超喜欢  质量也很赞",2018-03-28 12:40:53
1283003,5,"OK",2018-03-28 14:15:38
1283003,5,"简直大爱！超值",2018-03-27 09:18:57
1283003,5,"穿着挺秀气，适合脚窄和小的女生穿。",2018-03-23 11:48:18
1283003,5,"鞋子鞋口很紧，特别难穿进去。得用鞋拔子。但是太喜欢样式了，才留下来了。",2017-12-30 09:44:27
1283003,5,"工作学成非常好非常满意。",2018-03-26 10:39:25
1283003,5,"不合适退货了，但是包装很好，而且摸起来质量很不错",2018-03-29 11:21:08
1283003,5,"大小合适，穿着舒服",2018-03-26 17:43:44
1283003,5,"皮质比想象中硬一点，然后穿的时候还是要当心点，鞋头比较容易磨损，也会有折痕。",2018-04-03 19:21:34
1283003,5,"鞋子特别好看，柔软漂亮，很喜欢。",2018-03-24 16:27:46
1283003,5,"物流很快，东西质量不错",2018-03-24 11:23:24
1283003,5,"鞋型漂亮，满意。鞋码偏大，平时39穿着大又换了一双38正好。只是鞋带孔小比较紧，每次穿脱略微不便",2018-04-02 13:43:08
1283003,5,"很不错～～",2018-03-24 22:09:45
1283003,5,"不错",2018-03-24 13:18:27
1283003,5,"太满意了，宽脚无压力，走路舒适，业界良心",2018-03-20 21:27:39
1283003,5,"按自己平时的尺码选，非常合脚，是皮的",2018-03-20 09:39:49
1283003,5,"非常适合好",2018-03-23 23:20:41
1283003,5,"挺好",2018-03-23 14:53:43
1283003,5,"整体精巧满意。鞋底有点硬，没有什么齿，容易滑。",2018-03-28 00:11:40
1283003,5,"非常漂亮",2018-03-23 10:30:16
1283003,2,"今天刚穿上，太硬了，不舒服，走路噶脚，而且鞋跟还特别响。",2018-03-27 10:53:03
1283003,5,"好",2018-03-23 11:33:49
1283003,5,"质量挺好的，物美价廉！",2018-03-22 21:49:11
1283003,5,"好看 买大了一码还比较合适，就是鞋带有点难搞",2018-04-01 21:38:13
1283003,5,"质量还行，鞋子显得较小",2018-04-01 22:32:03
1283003,5,"可以的",2018-03-22 11:12:59
1283003,5,"喜欢",2018-03-22 09:39:20
1283003,5,"买第三双了，觉着质量不错",2018-03-21 09:33:50
1283003,5,"很软 性价比高",2018-03-21 11:44:27
1283003,5,"工装鞋不错",2018-03-21 12:48:28
1283003,5,"第一眼觉得做工没有之前出的几款鞋好，鞋孔里还有未除净的细屑，优点在于一点不打脚，我的脚属于比较宽，脚背也高，买大一码，完美合脚",2018-03-27 10:20:54
1283003,5,"很好",2018-03-21 07:53:53
1283003,5,"非常好",2018-03-21 12:40:51
1283003,5,"皮质有一点硬，鞋底有点滑，随便穿穿吧",2018-03-24 19:04:07
1283003,5,"样子不是很满意，懒地退。",2018-03-25 21:34:12
1283003,5,"鞋子超级舒服<U+0001F60C><U+0001F60C><U+0001F60C>",2018-03-20 17:50:09
1283003,5,"质量很好，皮质很软。",2018-03-20 19:50:07
1283003,5,"好看好穿，尺码准。",2018-03-20 14:32:10
1283003,5,"样式蛮好看的",2018-03-20 07:24:13
1283003,5,"啊啊啊啊啊啊啊啊好希望能送我一个脚掌垫啊有点松！然鹅只能这样了！鞋是美丽的！楦头做的很有型！我喜欢这种硬挺的款型皮质不会软塌塌的，又不会硌脚的感觉很舒服！有点担心走久了前头会不会有一个折痕",2018-03-23 13:32:31
1283003,5,"舒服，漂亮",2018-03-20 12:16:15
1283003,5,"鞋型很好。走路会有哒哒声。总体不错。",2018-03-26 18:16:24
1283003,5,"好",2018-03-19 12:33:59
1283003,5,"很舒服，大小合适，比欧版买的好很多",2018-03-15 18:58:05
1283003,5,"穿上非常舒服，皮很软",2018-03-18 11:16:30
1283003,5,"不错，显得脚小",2018-03-18 08:03:35
1283003,5,"不太好上脚",2018-03-23 19:16:07
1283003,5,"好",2018-03-18 22:18:01
1283003,5,"好",2018-03-18 14:04:38
1283003,5,"第一次穿都不挤脚，非常满意",2018-03-17 22:46:22
1283003,5,"非常不错，很漂亮",2018-03-16 06:44:17
1283003,5,"挺好的",2018-03-16 09:48:34
1283003,5,"好",2018-03-16 10:24:22
1283003,5,"皮质很好也很舒服",2018-03-15 15:46:11
1283003,5,"特别不错，赞一个。",2018-03-15 10:54:11
1283003,5,"不错",2018-03-15 17:27:08
1283003,5,"好",2018-03-15 22:48:31
1283003,5,"好穿，不磨脚",2018-03-14 19:45:15
1283003,5,"合适，很好",2018-03-14 09:14:11
1283003,5,"鞋子百搭",2018-03-14 15:13:02
1283003,5,"好质量！！！",2018-03-14 12:25:13
1283003,5,"很舒适",2018-03-14 07:14:11
1283003,5,"性价比很高的一款鞋子",2018-03-13 21:26:14
1283003,5,"买来搭配裙子，很喜欢呢，就是鞋跟有点响，走路哒哒哒...",2018-03-23 16:18:08
1283003,5,"很舒服的鞋子，前两年在某东上买了一双一样的硬邦邦还丑，没穿几次就扔了。",2018-03-11 11:34:32
1283003,5,"样式喜欢，鞋底偏硬，走路声音大，不过不到二百拿到性价比高",2018-03-22 23:40:26
1283003,5,"神速啊，当天就收到了，鞋子看着硬穿着软，而且显得特别秀气，超舒服的，太喜欢严选了",2018-03-02 19:35:16
1283003,5,"非常好，瘦长型脚穿码数正好，价格比clarks便宜一半不止，性价比高，皮子也很软",2018-03-02 12:24:26
1283003,5,"鞋子棒棒哒<U+0001F38A><U+0001F38A><U+0001F38A><U+0001F38A>性价比高，穿着也舒服，送给自己的情人节礼物",2018-02-13 20:57:46
1283003,5,"之前在严选买了一双鞋，穿着比较舒服，就又买了一双，鞋子便宜，穿着也舒服。",2018-02-26 10:48:15
1283003,5,"走路有声响，但是并不影响我对它的喜爱，皮质不错，秋天穿刚刚好，很好搭配衣服。",2018-01-18 15:42:23
1283003,5,"鞋子皮质很软很舒服，鞋底是偏硬的，款式是英伦款式，小休闲，很好搭衣服裤子。很喜欢",2017-12-18 17:22:45
1283003,5,"挺好的，又柔软又秀气，第一次在严选购物，没想到这么成功，下次还会再来哦！",2018-02-05 14:07:56
1283003,5,"很好，刚穿上完全不觉得不适，非常舒服的鞋子，能在网上买到这么合适的鞋子绝对满分",2017-12-03 12:20:31
1283003,5,"鞋子很不错，就是穿上鞋带要松一松，穿的套进去就好了",2018-03-20 21:37:04
1283003,5,"老婆说鞋子超好穿，并且与百丽有一款一模一样，但百丽折后还贵一百多，严选，真正不用发愁的选择！",2017-12-10 16:32:27
1283003,3,"鞋底居然是硬塑料底，是踢踏舞的好材料，可惜不是日常能穿的。自己拿去找鞋匠换了个底，老师傅质问为什么买这样的鞋啊，怎么不看看啊…… 是看不出来啊，网上好评还挺多，可是我需要的是日常走路不累的鞋啊。",2018-03-21 22:29:55
1283003,5,"质量很好，比较像正装皮鞋，后帮较硬，但是皮质又很柔软。我都有意再入一双棕色的了。",2017-12-08 17:32:49
1283003,5,"鞋头踢到了，穿着穿着就大了",2018-03-20 16:40:06
1283003,5,"很舒服的鞋子，一点都不磨脚，这是我买的皮鞋中唯一一双严选的，也是唯一一双不磨脚，最舒服的鞋子，很显脚小，很秀气。",2018-03-22 16:58:58
1283003,5,"一直纠结到底是38还是39，最终还是正常38合适，不需要买大一码。39退了。",2017-12-02 17:57:08
1283003,5,"码数很正而且显得脚小，穿着走了一天也没有磨脚，推荐。",2018-03-21 20:27:22
1283003,5,"买来当工鞋的 不得不说超级超级赞<U+0001F44D><U+0001F3FB> 底子很舒服 没有硬硬的感觉 值得购买",2017-11-21 22:33:05
1283003,5,"大小合适 鞋底有些硬 有哒哒的声响 这个价格也算是物有所值了！一个字：不错！",2018-01-03 11:49:14
1283003,5,"一下子在严选买了五双鞋子，感觉好疯狂，以前从来没试过
其中有一双因为码数退回去还没换回来，其他都不错",2018-03-21 14:07:31
1283003,5,"之前在日本买的坏了，自从对严选长草后，发现有这双我的最爱，毫不犹豫拿下",2017-12-09 18:26:39
1283003,5,"实物的颜色要淡很多，不是很好看",2018-03-19 20:43:54
1283003,5,"直接不错，买来当工作鞋，脚面有点紧，脚胖的人建议买大一码",2018-02-21 16:33:12
1283003,5,"在双十一之后买的，第二天就到了，这次物流快。鞋子挺喜欢的，以后会继续关注严选。",2017-11-18 21:17:28
1283003,5,"超满意，一下买了四双，别人一双我三爽，三双加起来才600多，商场也就能买一双，太值了",2017-10-22 15:07:25
1283003,5,"特别推荐 码数稍微有点大 可以比平时买小一号的 懒得换 质量好 样式也喜欢",2017-11-09 18:52:21
1283003,5,"穿着非常舒服，不磨脚，很软，也很好看，就是鞋跟走起来有点响",2017-11-23 08:53:32
1283003,5,"皮质比较硬，但穿上还算舒服，我是37.5的脚，脚掌比较宽，38穿着很舒服，前后都不磨脚",2017-12-08 23:00:52
1283003,5,"样式非常好<U+0001F44D>，鞋子也穿着舒服。但是需要注意，鞋子偏大。赤脚23cm，买35的合适，36的太大了。",2017-11-10 23:41:10
1283003,5,"37码有点大了，不过穿个厚袜子还是可以的，鞋子很上档次",2018-03-04 17:30:46
1283003,5,"完美，性价比超高，尺码合适，真材实料，在商场是买不到的，值得推荐",2017-12-04 19:25:37
1283003,5,"漂亮，帮家人买的，不知道码合适吗？男士的布洛克为何还不出？",2018-03-17 12:19:53
1283003,5,"非常喜欢，穿上很有型！舒适度也可以，日常的行走没觉得磨脚。",2018-03-02 00:04:18
1283003,5,"好看，就是走路有响声",2018-03-20 16:38:09
1283003,5,"颜色可接受，算浅棕色吧，不怯！牛皮，质量很好，内膛儿很舒服！平时穿39码，这款也买39码。赶七折优惠活动入，180多块，按这质量，超值！",2018-03-18 20:02:46
1283003,3,"一般吧，有的点硬，妈妈不是很喜欢。",2018-03-20 09:21:52
1283003,5,"看起来挺好的，有点英伦淑女范儿，不过还没穿，待到春暖花开时再穿。",2018-01-31 23:37:35
1283003,5,"颜色很好看，尺寸也合适，是我想要的款型。严选的鞋子很好啊，性价比高，款式又好，太喜欢啦。",2017-11-20 19:15:04
1283003,4,"好看没得说，和我之前买的百丽一模一样，质量只能说值这个价了",2017-12-21 21:12:45
1283003,5,"觉得比平时大半码，试了一下觉得还可以，期待穿后的效果",2018-03-11 22:13:16
1283003,5,"美观大方但尺码比一般鞋小二号如果穿37码的鞋最好买39号的",2017-11-20 07:33:57
1283003,3,"鞋型特别特别瘦，但皮子很软",2018-03-19 17:48:00
1283003,5,"和我想的一样，就是鞋带质量不好",2018-03-04 22:39:02
1283003,5,"非常好，给我妈买的，年轻女孩穿着时尚，老年人穿着稳重，完美！",2018-02-12 16:44:43
1283003,5,"36的脚，买了37的，穿厚袜子正好。皮质稍硬但不硌脚，不太方便的是鞋带系法和鞋口较小。",2018-03-08 10:54:47
1283003,4,"鞋底不够柔软，给妈妈穿的，走路有点累",2018-03-08 18:52:28
1283003,5,"物流速度惊人，上午下单下午就到了。鞋子穿着显脚小。",2018-03-03 10:46:59
1283003,5,"不错，就是鞋跟有点响",2018-03-18 16:58:30
1283003,5,"超喜欢。上次女儿买了。穿着舒服，不磨脚。所以再次购买了",2018-02-28 09:56:56
1283003,5,"超级好穿，皮子很软，一点也没有想象中的硬邦邦哦。舒服又精神哦！",2018-01-08 20:10:24
1283003,5,"颜值杠杠的 不过就是穿脱很艰难 不过穿着很舒服",2018-02-27 17:21:44
1283003,5,"略小了一些",2018-03-03 00:49:29
1283003,5,"皮子质量非常好，穿着显得脚很小，性价比很高",2018-03-13 08:57:59
1283003,5,"外层的皮质很细腻，内里是织物的，鞋型显得脚小，还不错",2018-01-03 20:26:54
1283003,4,"速度非常快，下单第二天就到了，包装惊艳。鞋子有两点不足，一是鞋底是平的，没有纹路，走路要小心怕打滑；二是脚面雕花的头部容易折，折痕什么的不在乎，但是容易走多了压脚趾，右脚感觉不出来，左脚压着疼，总之是一双颜值很赞但是穿了一天又不想穿了的鞋。买鞋看运气，个人左右脚还不一样呢，只能说运气吧。",2018-03-08 10:29:15
1283003,5,"换过一次，仍然有瑕疵，已经退货",2018-03-02 22:41:58
1283003,5,"鞋底稍硬，鞋子很精致，这个价钱买到这样的鞋不错了",2018-01-25 13:36:07
1283003,5,"这双鞋必须得好好说说了，真的很舒服，不打脚",2018-03-05 17:49:44
1283003,5,"价格在这里，也不要太苛求，就性价比来说还行，小毛病自然都有。",2017-11-25 16:39:54
1283003,5,"打折买的，划算。今天穿了下，感觉可以，不磨脚，显脚小。等过段时间看看耐不耐穿。目前购买体验挺好的。",2017-11-13 16:25:19
1283003,5,"质量挺好，我脚大，穿上显脚长，就是鞋带的材质不喜欢",2018-03-03 10:38:50
1283003,4,"穿着很舒服，皮子软。就是缝砸走线的细节一般，不能仔细看。相对价格来说可以接受的。总体满意",2018-03-06 12:54:50
1283003,5,"偏大 寄回了，不过很舒服",2018-01-06 22:48:12
1283003,5,"第一次在网上买鞋，有点担心，实物拿到手赶紧试穿，太好了，物超所值！",2017-10-22 11:00:51
1283003,5,"很好，穿着舒适，大小合适，平常码，只是走路有响声",2018-03-04 21:13:39
1283003,5,"已经退货",2018-03-05 08:56:04
1283003,5,"好穿，软软的，显得脚很小，严选的东西一直很好",2018-02-23 10:41:15
1283003,5,"从来穿皮鞋都觉着脚不舒服，这是第一双走路不累的 赞赞赞",2017-12-07 15:51:15
1283003,5,"鞋子超喜欢 小巧又柔软 已经买了三双了 都很喜欢 也便宜 棒棒哒",2017-11-09 18:46:15
1283003,5,"很好",2018-03-13 10:53:07
1283003,5,"舒服<U+0001F60A>八码适合。不刮脚。",2018-03-12 11:28:58
1283003,1,"穿了不到10次，鞋跟就拖了钉… 关键是联系了客服后，等待了半天，我得到的答案是自己去修理。所以… 售后毁一切！一颗星只是因为是系统设置，无法给出无星评价。",2018-03-13 19:23:43
1283003,5,"还不错，显脚瘦，就是走时间长了脚有一点痛",2018-03-14 18:12:53
1283003,5,"而且穿起来非常软，非常合脚，满意。",2018-03-11 08:12:01
1283003,5,"质量特别好！穿起来特别舒服",2018-03-12 12:01:49
1283003,5,"鞋子看着还可以，还没有穿",2018-03-12 11:51:32
1283003,5,"我脚背很高很高，这双稍微有些压脚背。但是不是鞋子的问题，是我的问题哈哈哈。尺码很准，发货简直是极速，二十四小时内就收到货了。",2018-03-15 13:33:45
1283003,2,"做工粗糙，实物比图片low好多，但是退换货做的很好，冲着售后好仍然是严选粉，就是希望以后商品上架，质量还是要严格把关，毕竟商品质量才是最主要的。",2018-02-23 18:44:52
1283003,1,"第一双有这个问题，第二双还是有，感觉对严选失望了，不知道为什么那么评价里，只有几个提到了这个问题！",2018-03-01 12:30:44
1283003,5,"刚好合适",2018-03-12 09:36:21
1283003,5,"很好！",2018-03-12 18:25:31
1283003,5,"好看",2018-03-12 18:12:59
1283003,5,"很舒适，妈妈和我一人一双，呵呵<U+0001F60A>",2018-03-06 20:54:36
1283003,5,"大小合适  平时穿什么码就买什么码  黑色百搭",2018-02-27 17:30:27
1283003,5,"鞋子还好，物流快。",2018-03-14 10:10:41
1283003,5,"推荐二位好友都说好",2018-03-10 21:25:51
1283003,3,"外形不错，价格不贵！
但皮不够软会打脚，而且鞋底偏硬了 走路好大声！ 果然一分钱一分货。。。",2018-03-12 15:10:34
1283003,5,"好漂亮的鞋啊！就是有一点点硬。",2018-03-08 20:48:48
1283003,5,"还不错，上脚洋气",2018-03-09 23:16:33
1283003,3,"质量还可以，但是版型有点老气，没图片好看",2018-03-13 09:40:45
1283003,5,"特别喜欢",2018-03-09 20:53:47
1283003,5,"很惊喜，非常好的质量，成严选的fans",2018-03-08 11:07:03
1283003,5,"换了一双36的很不错。",2018-03-08 20:53:38
1283003,5,"鞋底有点硬，走起路来会有格格的响声.真皮的，券后220买的，后来看评论才知道一百多都能买到，亏了亏了，等降价退货的说",2018-03-12 22:37:40
1283003,5,"鞋子比预期的好，第一次穿，不磨脚，稍胖一点脚也适合。赞<U+0001F44D>",2017-11-05 15:41:34
1283003,4,"脚背高的的确要买大一码。黑色百搭，还是对得起限时购价格的，就是不能用券，三八节活动3.7晚上买的也没见送赠品。",2018-03-10 16:26:36
1283003,5,"大小合适，也不磨脚，第二天就穿上了",2018-03-05 17:17:17
1283003,5,"很经典的款式，穿着舒服，只是鞋底偏硬了。",2018-02-24 10:52:13
1283003,5,"鞋子很轻巧，做工很精细呢",2018-03-07 19:46:16
1283003,5,"鞋子不错，走路有点响 但是总体还是很舒服的",2018-03-11 09:37:14
1283003,5,"样式还不错，就是鞋底有点硬，舒适度一般。长时间走路脚底板疼。",2018-03-12 18:26:41
1283003,5,"一如既往地优秀～<U+0001F646>",2018-03-07 19:51:22
1283003,5,"质量不错，款式一般",2018-03-07 19:57:31
1283003,5,"好",2018-03-07 18:23:12
1283003,5,"好看 舒服 这个价位想买就买不用像别家还要担心质量，就是比较软，脚肉多穿久了有点塌",2018-03-11 11:11:49
1283003,5,"鞋子尺码合适，眼影刷用得顺手，不错不错～",2018-03-04 10:55:22
1283003,4,"走路确实声音大，并且鞋口很小，要把鞋带松的很松才能穿进去。",2018-03-15 19:24:20
1283003,5,"质量不错，已经第二双了。",2018-03-06 20:55:40
1283003,5,"很舒适",2018-03-06 12:32:26
1283003,5,"真心喜欢",2018-03-06 16:28:57
1283003,5,"好",2018-03-06 13:25:56
1283003,5,"质量很好",2018-03-05 10:07:56
1283003,5,"穿起来脚感很软，走一天路都不类",2018-02-21 01:25:44
1283003,5,"老婆说好",2018-03-04 23:28:59
1283003,5,"很不错的鞋子，款式质量都很好",2018-03-03 13:24:18
1283003,5,"颜色比图片显示得稍微浅色一点，适合脚宽和脚背较高的穿，走路不累，但是皮有点硬，对得起这个价格",2018-03-16 09:09:25
1283003,5,"不硬，喜欢这个款式",2018-03-03 11:31:22
1283003,5,"穿穿可以",2018-03-03 21:46:18
1283003,5,"好非常好",2018-03-03 13:55:58
1283003,5,"有点窄",2018-03-03 13:32:40
1283003,5,"款式质量都好看，可惜我脚板厚，穿上太紧了，不是很舒服，只能退了。",2018-03-08 23:14:59
1283003,5,"商品有瑕疵，寄回去换货了",2018-03-09 10:48:33
1283003,4,"鞋子很软，皮质也不错，就是鞋跟穿上走路嘎嘎响，建议以后鞋跟弄成和鞋底一样的材质。另外晚上下完单的我第二天买就有三八节活动了，没参加成三八节活动有点不爽。严选总是不知道什么时候有优惠又不知道什么优惠结束。",2018-03-04 14:12:27
1283003,5,"好看～",2018-03-03 17:26:22
1283003,5,"皮质柔软，尽显英伦风，如果颜色深一些会更好",2018-02-20 22:09:28
1283003,5,"穿着很秀气，蛮好看的。",2018-03-02 13:54:23
1283003,5,"大小合适，好看",2018-03-02 12:03:16
1283003,5,"舒服，尺码正，百搭",2018-03-01 09:41:56
1283003,5,"非常舒服的鞋子，穿着样子也好，太喜欢了",2018-02-26 07:33:00
1283003,5,"非常舒服，，原本刚到手的时候觉得鞋子前头不太好看，但是穿着舒服就留下了，越穿越喜欢，其实前头颜色深一些显脚小的。唯一的缺点就是鞋子比较娇气，我也比较费鞋，大概过段时间会再入一双黑的吧哈哈",2018-03-01 12:14:01
1283003,5,"老婆说皮很好，就是鞋底有点硬",2018-02-27 20:56:07
1283003,5,"挺好穿的，本来以为会小，结果刚好",2018-03-03 23:58:26
1283003,5,"老婆说皮很好",2018-02-27 20:56:31
1283003,3,"硬",2018-02-27 15:08:00
1283003,4,"鞋子比较紧……皮质厚 穿着好看但是不舒服",2018-02-24 07:59:12
1283003,5,"原来36码换了37码，穿上好舒服，挺好看的，喜欢",2018-01-26 13:22:03
1283003,0,"鞋子外观很赞 试穿过挺不错 暂时还没长时间穿上路",2018-01-09 16:29:55
1283003,5,"鞋子很合脚，白搭，很满意",2018-02-26 18:37:18
1283003,5,"今年冬天，这双鞋全包了，好赞啊",2018-02-23 17:20:56
1283003,5,"很好，性价比很高",2018-02-25 08:52:05
1283003,5,"很合脚，不错不错",2018-02-25 21:52:15
1283003,5,"一如既往的满意哇啦啦啦啦",2018-02-24 14:51:30
1283003,5,"码数正好 穿得很舒服",2018-02-24 07:33:53
1283003,5,"满意",2018-02-24 15:21:11
