"itemId","star","content","createTime"
1283003,5,"还可以，平时穿38号码，这次买的38号正好。稍微有点夹脚",2018-08-12 10:55:10
1283003,5,"质量好穿着适合，喜欢",2018-08-10 10:39:35
1283003,5,"好",2018-08-10 20:55:50
1283003,5,"好",2018-08-10 20:55:53
1283003,5,"鞋子质量超乎想象，首单严选购物好感度倍增，以后还会来哒",2018-06-28 18:19:35
1283003,5,"质量不错，就是码小了点",2018-08-09 11:59:09
1283003,5,"超级舒服 给好评",2018-08-09 10:33:44
1283003,5,"很好，柔软舒适",2018-08-09 20:30:51
1283003,5,"秀气好看，最主要皮子软不打脚",2018-08-07 09:22:03
1283003,4,"鞋子还不错，老婆比较满意",2018-08-07 21:10:06
1283003,5,"穿了一段时间才来评价，鞋子真的特别舒服平时穿36这次也选择的是36，上班穿一整天都不累脚",2018-03-23 10:28:27
1283003,5,"质量真心不错，不磨脚，穿起来有型，以后多多出新品，严选，看好你哦!",2018-04-20 07:54:14
1283003,5,"和商品的描述一样，值得选购",2018-08-03 15:40:45
1283003,5,"很不错",2018-08-02 09:43:33
1283003,5,"网易严选第一单，开启了我对严选的痴迷之路<U+0001F643><U+0001F643><U+0001F643>戒不掉了，想买皮带，没在网易上看到合适的，都不想去别家买<U+0001F644><U+0001F644><U+0001F644>",2018-08-09 21:07:14
1283003,5,"还可以",2018-08-01 08:19:16
1283003,5,"鞋子码数正好，和平常码数一样，鞋子穿着很舒适，推荐购买！",2018-06-19 13:54:23
1283003,5,"宝贝质量不错，可惜39码穿着仍有点小，只能退了",2018-06-19 09:24:51
1283003,5,"没有磨脚，非常满意",2018-07-30 13:46:17
1283003,1,"皮质很差....而且鞋子真的有点土....以后再也不在严选购物了！黏胶粘不牢呀，不理解评论里为什么有那么多好评，最糟糕的一次购物体验。另外需要指出的：退货算的价钱明明有问题，严选是把用Apple Pay银行抵扣的钱给扣除计算的，根本不管银行退款的时候又再次把这个折扣给减掉了，这样折算下来白白多扣了几十块钱。严选还偏偏弄些不给退换的产品，退了东西不满包邮还要再加运费。最后等同于花100买了两三个用来凑单的后跟贴，真是醉了。",2018-04-17 22:08:41
1283003,5,"性价比高，不输商场大品牌，适合脚背低的人",2018-07-13 07:16:59
1283003,3,"早就买了，试穿了还可以",2018-08-02 14:32:27
1283003,5,"显脚长，软的，号正。",2018-07-15 13:11:07
1283003,5,"码子正好，很舒服，鞋型很是服帖，作为正装鞋子真得扎的住台面",2018-04-15 22:07:45
1283003,5,"我的脚属于瘦长类型的，我第一次用严选go shopping ，没有经验从大家评论里看到的结合自己情况选择了38码，平时我穿运动鞋也是38码。听平时朋友讲，非运动鞋子一般偏小。但是这个不是的，很赞，无后顾之忧，买着放心。分别穿袜子和光脚穿了，很舒服，也推荐给身边的朋友用严选<U+0001F601>",2018-04-17 20:50:21
1283003,5,"超级好穿，鞋底不硬，走路轻便，第一次上脚就很舒服也不磨脚，强烈推荐",2018-03-22 20:07:38
1283003,5,"还好，复古休闲款",2018-07-28 13:35:12
1283003,5,"c",2018-07-28 12:31:22
1283003,5,"发",2018-07-27 20:07:14
1283003,5,"便宜又好",2018-07-26 16:49:29
1283003,5,"这双鞋样世，鞋型都很漂亮，穿上很舒服，系带也很特别",2018-05-04 11:55:11
1283003,5,"样子很好看，夏天办公室空调太冷，穿这鞋子不冻脚了，不是软皮的，稍微有点硬，不过办公室穿不累脚的。",2018-04-22 20:18:56
1283003,5,"只见不错",2018-07-23 18:57:31
1283003,5,"穿着很舒适，而且怎么搭配都好看。很愉快的一次购物，默默的表示中了严选的毒，后面凉鞋单鞋都会在严选上买的！",2018-05-23 15:03:03
1283003,5,"皮质很好，就是鞋口太小了，鞋舌有点割脚背",2018-06-20 00:15:04
1283003,5,"试过了，很舒服，样子也不错。我的脚背比较低，感觉系带处较高。",2018-04-06 12:31:29
1283003,5,"很舒服很舒服，鞋底有点硬",2018-07-17 17:31:08
1283003,5,"不错",2018-07-15 19:59:20
1283003,5,"不错",2018-07-14 13:24:44
1283003,5,"穿了一个月，很合脚，而且轻便，上下班都是穿它。非常满意，真心推荐。",2018-05-16 11:24:30
1283003,5,"物超所值，标准码",2018-07-09 10:56:17
1283003,5,"满意",2018-07-07 04:01:22
1283003,5,"用料款式都很好，但是这个鞋楦真的适合很瘦的脚。",2018-04-13 18:33:16
1283003,5,"超值，很满意",2018-07-03 15:07:24
1283003,5,"网购几年才知道原来评论85个字才会有积分。所以从今天到以后，这段话走到哪里就会复制到哪里。首先要保证质量啊，东西不赖啊。不然就用别的话来评论了。不知道这样子够不够85字。谢谢老板的认真检查。东西特别好，我不是刷评论的，我是觉得东西好我才买的，你会发现我每一家都是这么写的。因为复制一下就好了。",2018-07-25 14:30:52
1283003,5,"质量很好！感觉已经中严选的毒，我一般是不在网上买鞋子的，但是严选刷新了我的认识！好多鞋子都想买～但是缺没我的码了～哭(′;;`)",2018-05-09 09:17:56
1283003,5,"鞋子形状不错，鞋底走起路来有声音，质量可以。适合秋冬季节的广东。",2018-05-06 16:17:48
1283003,5,"不错，就是走路会比较响",2018-07-02 00:49:13
1283003,5,"穿的时候有点困难，有点硬，穿进去正好，选的正常码数，正好。走路很舒适",2018-03-23 21:53:36
1283003,5,"颜色比图片淡一些，但挺好看的，也挺舒服，不磨脚，稍微又点儿硬",2018-04-12 09:32:37
1283003,5,"很酷 鞋底有点响 也蛮好",2018-06-30 15:21:39
1283003,5,"看上去不起眼，但是上脚效果超级好。我脚瘦，穿皮鞋脚踝骨容易磨，这双鞋一点都不磨脚，而且底很软，穿着不累，大赞！",2018-05-31 19:13:44
1283003,5,"不错。",2018-06-29 23:04:48
1283003,4,"有点硬鞋子",2018-05-09 21:37:29
1283003,5,"鞋子很轻，号码正。样子好看，上脚舒服，走一天的路也不累。",2018-05-02 07:59:09
1283003,5,"跟姐妹们一起买了三双，到货了，三个人都很满意，质量不错，物有所值！",2018-03-20 11:18:34
1283003,5,"鞋面皮质柔软，右脚有点磨小姆哥，稍微逛了个街，没出现脚底板疼的现象。",2018-04-13 08:58:44
1283003,5,"非常好穿，正常码像定做一样合脚，唯一不足就确实如介绍所说的鞋底的声音了",2018-04-12 14:00:13
1283003,5,"鞋子穿着舒服，但是走路鞋跟声音太大了，鞋底略微有点不防滑，总体来说，还是不错的",2018-04-12 13:35:43
1283003,5,"鞋子很舒服，无论是上班穿还是平常穿都很好很搭！",2018-05-18 22:34:28
1283003,5,"很满意 舒适好看 一如既往支持严选",2018-06-25 16:02:38
1283003,5,"穿着很舒服，而且不打脚",2018-06-25 10:21:26
1283003,5,"特别好，价格优惠，百搭款",2018-06-25 22:28:46
1283003,5,"鞋子很舒服，不磨脚，穿上走路很稳。棒棒哒，皮质不错，非常喜欢。",2018-04-09 06:42:22
1283003,5,"刚开始稍微有点顶脚，穿两次就好了，后跟完全不磨脚，样子很好，颜色貌美！",2018-06-30 09:29:44
1283003,5,"质量好，美观，百搭",2018-06-24 19:19:06
1283003,5,"不错，穿起舒服",2018-06-24 15:38:07
1283003,5,"很好看，超级喜欢",2018-06-23 21:46:05
1283003,5,"很舒服，也很漂亮",2018-06-23 20:01:36
1283003,5,"很不错的鞋子",2018-06-23 10:49:00
1283003,5,"好看",2018-06-23 14:26:15
1283003,5,"不错",2018-06-23 14:27:22
1283003,5,"满意",2018-06-21 19:49:39
1283003,5,"尺码合适，鞋底有些偏硬，质量挺好，现在还没到穿的季节，先囤货",2018-03-14 11:49:03
1283003,5,"还可以",2018-06-20 19:45:15
1283003,5,"有点偏大",2018-06-19 22:44:43
1283003,5,"鞋子质量非常不错  款式也新  颜色百搭  大方便宜质量好  严选出品真心不错  已经买过好几双鞋子了  都非常满意  一如既往地爱严选",2018-05-10 10:09:55
1283003,5,"一直很喜欢严选，东西品质很不错。",2018-06-18 22:25:07
1283003,5,"搞活动的时候性价比比较高，质量一般，不能期望200来块的皮质会很好",2018-06-21 06:09:17
1283003,5,"太硬",2018-06-30 09:10:24
1283003,5,"大小正好，很舒服",2018-06-17 18:47:32
1283003,5,"质量非常好，",2018-06-17 00:12:19
1283003,4,"里料是布的 底子很软 性价比高",2018-06-12 17:31:07
1283003,5,"呵呵红红火火恍恍惚惚",2018-06-16 17:11:18
1283003,5,"好",2018-06-16 11:40:58
1283003,5,"我爱严选，老粉丝了，可以说严选的每一件商品我都喜欢",2018-04-21 15:58:30
1283003,5,"不错不错不错不错。",2018-06-15 21:37:48
1283003,5,"之前因为联系方式填错了，只能退款，退款很及时，感谢！会再下单。",2018-04-20 15:44:10
1283003,4,"不好看，图片实物差距明显",2018-06-23 09:34:53
1283003,5,"非常喜欢，希望回购",2018-06-14 17:12:25
1283003,5,"很好穿，百搭",2018-06-13 08:15:51
1283003,5,"穿了这一年多来评价的，鞋子已经很柔软，颜色也很好，跟脚很贴合，性价比不错。唯一一点，后跟踩到塑胶地板有点响。",2018-06-24 09:11:45
1283003,5,"好，非常不错，下次还买！！！",2018-06-11 20:20:14
1283003,5,"很喜欢，一点都不磨脚。已经介绍给同事了",2018-06-06 19:02:26
1283003,1,"穿了一天，走了不到五千步，发现两只鞋脚后跟内侧鞋跟有裂痕，位置还非常对称，这妥妥的质量问题，联系客服，客服说可以免费换。我收到换货后十分惊讶，鞋子看起来非常新，然而相同位置同样有两条裂痕，妥妥地耍我，根本没换，寄到广州去就抹个油擦了擦?这时候客服非常厉害喔，说这是正常现象，不是商品质量，别的客户也没反应我这种问题。。",2018-05-26 10:54:40
1283003,5,"满意",2018-06-07 13:15:04
1283003,5,"满意",2018-06-07 13:15:14
1283003,3,"鞋底太硬，走在路上鞋底敲击地面声音太响，其他的还好。",2018-05-08 10:56:18
1283003,4,"穿着舒服，不过走路声音不小。",2018-04-22 23:38:00
1283003,5,"穿了一个月才来评价，很好看，显脚瘦，不会捂脚，但鞋底稍微有点硬，通勤路上我穿运动鞋，这双鞋就放在办公室穿，蛮好！",2018-05-07 11:29:38
1283003,5,"质量很好，穿起来脚很舒服，39码一点都不显脚大。",2018-04-13 19:27:48
1283003,5,"穿着很合适，便宜又好看，平时穿37就买了37，刚刚好",2018-04-13 17:15:22
1283003,5,"鞋型很秀气，皮子看着也不错，软，舒服，底有点响有点滑",2018-04-13 21:26:13
1283003,5,"鞋子很好看，很百搭，同时很舒服",2018-06-05 23:50:04
1283003,5,"白搭",2018-06-05 23:26:03
1283003,5,"棒棒的 显脚小",2018-06-04 17:43:42
1283003,5,"好看好看好看，送的",2018-06-04 17:36:51
1283003,5,"好",2018-06-04 21:33:48
1283003,5,"穿鞋有点困难",2018-06-15 09:49:57
1283003,5,"好吃",2018-06-02 10:35:00
1283003,2,"胶水味道很大，皮比较硬，不好上脚",2018-06-13 11:55:08
1283003,5,"严选好服务，换货很方便",2018-06-01 13:49:58
1283003,5,"有点大，垫了双鞋垫就好了，走路很舒服，样子也很不错。",2018-04-07 20:34:07
1283003,5,"鞋子漂亮   穿着舒服  继续下单  鞋子就选严选了",2018-05-16 21:49:14
1283003,5,"挺好看的就是买大了些",2018-05-30 14:21:16
1283003,5,"尺码标准，穿着舒适",2018-05-30 11:21:15
1283003,5,"质量很好",2018-05-30 10:24:36
1283003,5,"鞋型和脚感都很好！",2018-05-29 09:29:36
1283003,5,"刚开始有点硬，后来挺好的",2018-06-10 22:46:47
1283003,5,"好",2018-05-29 15:00:42
1283003,5,"美美的英伦风，有范，稍硬。",2018-05-28 08:28:57
1283003,5,"很好，赤脚穿也不磨脚",2018-05-28 11:36:34
1283003,5,"<U+0001F44D><U+0001F44D><U+0001F44D>",2018-05-28 16:19:55
1283003,5,"不错不错不错不错不错",2018-05-27 22:21:11
1283003,3,"底不防滑，雨天千万小心，好好走着好无防备就狠狠摔了一跤！",2018-06-05 14:07:12
1283003,5,"和想象的一致，当正装鞋用。",2018-05-26 07:39:37
1283003,5,"还可以 皮质一般",2018-05-26 11:23:03
1283003,5,"服务",2018-06-01 20:04:05
1283003,5,"36.5偏胖脚38码比较合适，舒适度还可以。",2018-05-21 12:18:37
1283003,5,"又买的一双！太好穿了！而且比上一双更便宜！",2018-05-10 21:04:11
1283003,5,"还好吧<U+0001F60A>",2018-05-24 15:07:01
1283003,5,"鞋子很好很舒服，就是走路挺响的，但是样子还是很好看～",2018-06-03 10:51:18
1283003,5,"很好穿，百搭",2018-05-24 10:27:48
1283003,5,"酷酷好看",2018-05-24 22:16:42
1283003,5,"这个皮质很软，走路跑步都不磨脚，我的脚稍微有点胖，本来以为会不舒服，但并没有这种感受。",2018-06-02 19:40:57
1283003,5,"非常符合预期",2018-05-23 08:04:37
1283003,5,"好",2018-05-22 06:35:42
1283003,5,"鞋子好看，穿了两个月质量也不错，好评",2018-05-21 23:44:04
1283003,5,"很喜欢",2018-05-21 14:23:58
1283003,5,"非常不错",2018-05-20 15:43:17
1283003,5,"京东的快递太棒了，昨天下单，今天收到货，鞋的质量满意的",2018-04-13 00:20:45
1283003,5,"非常好穿！样式经典。好评",2018-05-19 19:42:37
1283003,5,"不错。棒棒的。",2018-05-19 20:31:21
1283003,5,"穿着挺舒服，严选真的不错",2018-02-12 07:25:21
1283003,5,"看评论说要买大一码，平时穿36买了37，感觉还是有点大",2018-05-04 00:30:42
1283003,5,"软软的，走路不累",2018-05-18 20:34:13
1283003,5,"轻便",2018-05-18 17:38:21
1283003,5,"款式简洁大方，穿着非常舒适，不磨脚，号码合适",2018-05-13 15:31:45
1283003,5,"超级百搭，就是走多了有点累",2018-05-16 12:58:17
1283003,5,"质量很好 皮质很好 比严选的小白鞋稍微紧一些",2018-04-23 23:40:59
1283003,5,"总算不磨脚，换了好几款，这个没磨脚，太好了",2018-04-23 12:43:22
1283003,5,"特别舒服，这个价格能买到这么舒服的鞋子，真的超值",2018-04-22 19:36:30
1283003,5,"不磨脚很舒适皮质不错",2018-05-15 13:00:09
1283003,5,"做工和皮料都很好",2018-05-15 11:45:40
1283003,5,"皮质很舒服",2018-05-15 10:05:08
1283003,5,"好配衣服，一直在穿。",2018-05-14 11:04:14
1283003,5,"质量不错，",2018-05-14 13:16:51
1283003,5,"穿着舒服，性价比超高",2018-05-11 10:25:40
1283003,5,"好不错  挺好看",2018-05-10 22:02:30
1283003,5,"好",2018-05-10 11:11:12
1283003,5,"好",2018-05-09 00:31:23
1283003,5,"穿着非常舒服，买的大一码正合适。物流也满意。",2018-04-23 16:54:38
1283003,5,"有一点硬，穿的时候比较费劲，穿上还可以。",2018-05-06 14:03:15
1283003,5,"还不错哦",2018-05-07 09:18:08
1283003,5,"非常喜欢",2018-05-07 20:49:34
1283003,5,"不错",2018-05-07 13:22:50
1283003,5,"百搭的款式，上班、假日出行都很好穿",2018-05-05 22:27:24
1283003,5,"很好，很满意，推荐购买。很好，很满意，推荐购买。",2018-05-02 01:17:35
1283003,5,"好",2018-05-06 13:22:41
1283003,5,"平时穿37码的鞋，这双也是37码，合适",2018-04-28 18:00:53
1283003,5,"颜色不正拿去改色了",2018-05-05 15:59:23
1283003,5,"脚背高的建议拍大一码",2018-05-05 15:19:56
1283003,5,"好穿",2018-05-05 07:52:07
1283003,5,"很舒服，性价比高",2018-05-03 14:40:52
1283003,5,"第二次买这个鞋子了，这款超值了吗",2018-05-01 21:34:49
1283003,5,"女生上学天天穿，配学校礼服很有范",2018-05-02 23:24:40
1283003,5,"挺好",2018-05-02 15:06:12
1283003,5,"鞋底有点滑，退掉了",2018-05-03 12:08:26
1283003,5,"还可以",2018-04-14 20:11:37
1283003,5,"满意",2018-05-02 23:51:48
1283003,5,"满意，鞋底鞋面都软，没有任何不适",2018-04-28 07:07:29
1283003,5,"好穿",2018-05-01 22:32:25
1283003,5,"穿着特别舒服，喜欢的就赶紧下手吧",2018-04-30 18:08:06
1283003,4,"现在还没穿哒，哈哈",2018-04-30 08:54:19
1283003,5,"特别舒服，皮质好，推荐",2018-04-30 19:58:36
1283003,5,"穿着挺舒服。",2018-04-30 13:37:15
1283003,5,"大了",2018-04-30 17:34:28
1283003,5,"好",2018-04-30 11:30:36
1283003,5,"鞋子小巧好看，喜欢！",2018-04-29 11:34:29
1283003,5,"鞋子大小合适，舒服，做工精致，希望有更多款式可以选择。",2018-04-21 07:05:04
1283003,5,"换货，收到感觉不是全新的，有褶皱
试穿脚感还行不打脚",2018-04-30 17:32:21
1283003,5,"媳妇穿着很舒服",2018-04-28 14:07:50
1283003,5,"好穿",2018-04-28 14:06:03
1283003,5,"穿了两天了，感觉很舒适。做工精良，设计合理，物有所值！",2018-04-14 07:01:06
1283003,5,"同上",2018-04-27 06:16:33
1283003,5,"好看",2018-04-27 08:25:19
1283003,5,"鞋很好看，皮子刚穿有点儿硬，现在好多了",2018-04-13 09:46:27
1283003,5,"一点都不磨脚，非常舒服，版型也好，非常好看。",2018-04-19 22:42:40
1283003,5,"这双鞋好看是好看，但是穿着走路太响！办公室里太吵",2018-03-22 15:38:21
1283003,5,"灰常的漂亮啊",2018-04-26 23:11:14
1283003,5,"太满意了，这种颜色和款式真是无法掩藏的优雅，太喜欢了！皮质也很软，很好！！",2018-04-22 09:56:26
1283003,5,"穿着很舒服，就算是光脚穿也不会磨，就是底子有点响",2018-04-27 21:36:12
1283003,5,"好",2018-04-26 07:41:18
1283003,4,"有点显脚大，不太透气，捂脚，底子稍硬",2018-04-26 19:57:56
1283003,5,"后跟一点都不磨脚，很软，除了鞋底有点滑其他都很好，唯一不足就是买完几天就限时购降60",2018-04-28 19:09:40
1283003,5,"说实话做工没想象中好，倒是舒适，后跟有点硬，不知道会不会磨脚",2018-04-11 21:31:06
1283003,5,"穿了两个月才来评的，严选质量真的不错，基本每天都在穿，有点变形很正常，之前下雨打湿了水。",2018-04-27 22:43:38
1283003,5,"试穿了下，很舒服，是我想要的。",2018-04-25 22:05:35
1283003,5,"上脚舒服，特地买了大一码，便于穿厚袜子的时候穿。",2018-03-21 23:19:36
1283003,5,"很好，第一双不磨脚的新鞋。严选的东西，值得信赖",2018-04-11 08:38:02
1283003,5,"穿着舒服，鞋子适合脚背厚的人，大小尺码正常挑选即可。",2018-04-02 00:14:02
1283003,5,"合适，码正，穿着舒服，下半年穿了",2018-04-24 11:43:54
1283003,5,"皮鞋很好，传上去很软很舒服",2018-04-24 01:51:37
1283003,5,"尺码稍大了点，想换36的又怕抵脚，就将就了。鞋面软，穿着走路挺舒服的。",2018-04-12 09:03:53
1283003,5,"哈哈哈哈哈哈哈哈哈哈哈哈哈哈哈哈",2018-04-24 12:38:28
1283003,5,"满意",2018-04-24 13:12:15
1283003,5,"好",2018-04-24 20:22:51
1283003,5,"颜值高，鞋型较瘦，女儿脚有肉，开始买37的有点紧，换了一双38的正合适。不得不说严选服务很棒，换货申请通过后上门取货迅速还免费，售后服务没的说。",2018-04-14 13:49:24
1283003,2,"鞋有色差我能理解，色差成这样，我真是无语了。",2018-04-13 18:32:49
1283003,5,"穿着很舒服，价格也不贵。值得推荐",2018-04-23 20:32:57
1283003,5,"鞋子很舒服不打脚 码数很正",2018-04-23 12:59:18
1283003,5,"很舒服的鞋子，尺码刚好，穿上好看，好搭衣服。很棒。",2018-04-10 16:38:53
1283003,5,"漂亮，不错",2018-04-23 22:11:21
1283003,4,"有划痕，很深，懒得换了，麻烦",2018-04-13 20:49:36
1283003,5,"女儿穿好看，配裙子牛仔裤都好",2018-04-22 10:50:24
1283003,5,"尺码比正常码小1～1.5码",2018-04-22 14:06:14
1283003,3,"1、质量非常一般，鞋跟被人一踩就掉了。2、鞋跟走起来框框响，踢到内脚踝特别疼，远不如橡胶鞋跟。不会回购。",2018-04-14 11:26:03
1283003,5,"很好哦",2018-04-22 09:56:22
1283003,5,"舒服<U+0001F60C>",2018-04-22 19:37:10
1283003,5,"超喜欢的",2018-04-22 10:46:57
1283003,5,"鞋子不错哟",2018-04-22 09:28:05
1283003,5,"挺好",2018-04-22 14:07:25
1283003,5,"非常满意，收脚，时尚！",2018-04-21 20:20:45
1283003,4,"漂亮",2018-04-21 17:43:58
1283003,5,"好穿买了好多鞋子了便宜又质量好",2018-04-19 10:47:33
1283003,5,"媳妇儿真的极喜欢的",2018-04-20 22:00:38
1283003,5,"好穿～漂亮",2018-04-20 15:23:46
1283003,5,"很漂亮奥 大小正好 搭配打底裤太显瘦啦",2018-04-12 20:23:31
1283003,5,"穿着舒服，有型",2018-04-19 20:05:25
1283003,5,"还行",2018-04-19 14:46:54
1283003,5,"超级好穿，第一次在严选买鞋，依旧100分，铁粉！",2018-04-15 18:53:27
1283003,5,"质量很好 很软 码数也很正 十分满意",2018-04-15 09:59:16
1283003,5,"帮同事买的，英伦范，真皮舒适透气，百搭，价格只是商场同款价格的一半，有严选，再也不用逛商场了！期待更多的商品和我们见面，像手表啥的",2018-04-17 19:30:49
1283003,5,"穿着舒适，简单大方，很好",2018-04-18 08:32:45
1283003,5,"质量好 穿着不累",2018-04-18 23:15:13
1283003,5,"好好好好好好好好好好好好",2018-04-18 21:18:50
1283003,5,"皮质柔软，不打脚",2018-04-18 23:36:07
1283003,5,"还可以！有点硬",2018-04-18 22:03:35
1283003,5,"真的舒服不磨脚，逛街也无碍",2018-04-17 08:48:20
1283003,5,"不错，试的时候觉得有点硬，多穿几次就软了。",2018-04-09 16:10:44
1283003,5,"配点正装正合适，实惠舒适",2018-04-11 21:25:41
1283003,5,"很好穿，很小巧",2018-04-17 13:06:22
1283003,5,"不错，很好，值得拥有",2018-04-17 20:07:10
1283003,5,"漂亮而舒服的鞋子，看起来硬，穿着很软。下次打折再买",2018-03-25 19:17:30
1283003,5,"穿大了，请按正常尺码购买",2018-04-16 19:02:02
1283003,5,"适合脚胖的美眉。",2018-04-16 09:38:50
1283003,5,"不错",2018-04-16 11:15:10
1283003,5,"不错",2018-04-16 20:22:48
1283003,5,"黑色挺好，就是有点问题，换货了",2018-04-20 10:48:33
1283003,5,"很好的一次购物，鞋子很喜欢",2018-04-15 08:43:34
1283003,5,"还可以，还可以，还可以，还可以",2018-04-15 20:29:20
1283003,5,"老婆挺满意的，透气性一般",2018-04-15 00:01:47
1283003,5,"做工精美，复古风格，很喜欢。",2018-04-15 13:18:07
1283003,5,"一如既往的好。",2018-04-15 00:13:52
1283003,5,"不错",2018-04-15 21:23:38
1283003,5,"不错 鞋子做工可以 送的福包不喜欢",2018-04-14 10:36:16
1283003,4,"偏小，比较瘦",2018-04-14 18:19:16
1283003,5,"好！",2018-04-14 22:12:40
1283003,5,"太合脚了，36码不大不小，鞋带系得很别致",2018-04-13 20:40:57
1283003,5,"鞋子刚刚穿有点紧，穿了两三天就很舒服呢，完美～",2018-04-06 10:42:36
1283003,5,"非常喜欢啦，鞋子质量感觉很好。",2018-04-13 14:07:19
1283003,5,"好评",2018-04-13 21:35:33
1283003,5,"好。。。",2018-04-13 00:36:36
1283003,5,"颜值挺高，比图片颜色浅一些。鞋带挺闹心的，把它拆了自己搞了一个更方便的系法。",2018-04-11 19:46:22
1283003,5,"摸起来很顺滑，皮质很舒服",2018-04-12 16:21:28
1283003,5,"非常不错，到货就穿上了",2018-04-12 11:16:12
1283003,5,"平时36、37，先买36偏小，换37正好，但进口太小",2018-03-21 07:53:16
1283003,5,"超级合脚，好穿",2018-04-12 14:43:13
1283003,5,"质量好，很合穿",2018-04-12 10:09:11
1283003,5,"漂亮，百搭，减龄",2018-04-12 14:51:35
1283003,5,"喜欢，非常满意",2018-04-12 05:30:55
1283003,5,"不错，满意",2018-04-12 17:39:54
1283003,5,"很好",2018-04-12 22:34:45
1283003,5,"试了下还行，就是有点紧，脚丫子肥的美女慎入，肯定会磨脚。",2018-04-11 10:28:52
1283003,5,"这是买的第二双，黑色的看起来瘦一些",2018-04-11 19:42:51
1283003,5,"质量很好，一点不输上千的皮鞋",2018-04-11 11:30:46
1283003,5,"鞋子很好看，穿着很舒服",2018-04-11 12:14:07
1283003,5,"喜欢就买了好",2018-04-11 07:59:57
1283003,5,"还行吧",2018-04-11 12:12:31
1283003,5,"挺好的",2018-04-11 15:25:46
1283003,5,"不错不错",2018-04-11 20:12:03
1283003,5,"洋气，舒服",2018-04-11 21:42:47
1283003,5,"非常舒适！",2018-04-11 19:00:35
1283003,5,"好",2018-04-11 14:07:44
1283003,5,"满意",2018-04-11 16:09:39
1283003,5,"正合我的脚 脚面宽也不挤",2018-04-10 10:15:04
1283003,5,"鞋还不错，就是底有点硬",2018-04-10 11:23:05
1283003,5,"鞋的样子挺好看的，比较满意",2018-04-10 06:39:33
1283003,5,"很舒服，完全不累脚",2018-04-10 18:09:14
1283003,5,"穿着很舒服，满意！",2018-04-10 12:58:00
1283003,5,"试了，很舒服！",2018-04-10 19:59:47
1283003,5,"合脚",2018-04-10 22:03:15
1283003,5,"合脚",2018-04-10 22:03:23
1283003,5,"好穿",2018-04-10 09:31:30
1283003,4,"码数很正，很好看，就是鞋带用的橡皮筋那种，拿到就是断的。",2018-04-10 18:53:29
1283003,5,"好",2018-04-10 14:24:34
1283003,5,"鞋皮手感超软，无论外形与手工都绝不差过名牌，但唯一不足就是鞋底比较硬。",2018-04-10 14:49:07
1283003,5,"穿着舒服，就是后跟底太硬需要更换！",2018-04-06 07:10:47
1283003,5,"很好看也很舒服 关键真的便宜啊",2018-04-09 00:06:36
1283003,5,"不错，穿着蛮舒服的",2018-04-09 09:38:24
1283003,5,"很软，穿着舒适",2018-04-09 20:53:38
1283003,5,"性价比高",2018-04-09 11:06:43
1283003,5,"很好",2018-04-09 18:07:57
1283003,5,"好",2018-04-09 09:02:11
1283003,5,"还没穿，看着还不错，试穿感觉还挺舒服",2018-04-05 20:41:00
1283003,5,"性价比高！尺码标准的，春秋百搭款。",2018-04-07 22:06:18
1283003,5,"显得脚好秀气，也不磨脚，神奇",2018-04-08 08:20:00
1283003,5,"不错，大小合适，平时36大，35小买小一码，刚刚好。",2018-03-26 22:51:12
