"itemId","star","content","createTime"
1334020,1,"无理由退换货的产品有的地区支持上门取件，不支持取件的地区自己垫付邮费，可是垫付的邮费却以直减券形式下发，最让人觉得不合理的是，这种直减券还有使用限制！凭什么！",2017-12-15 22:04:07
1334020,5,"很好，厚实，暖和，小盆友很喜欢，还没开始穿，等穿了来追评",2017-12-12 10:32:57
1334020,5,"买大了一点，小家伙还没试。款式经典无懈可击，看小家伙穿得怎样再说吧",2017-12-08 19:14:04
1334020,5,"女儿平时运动鞋穿34码，这个稍微大了点，还可以结束，不过她说很暖",2017-12-07 19:08:38
1334020,5,"质量太好了，收到这个鞋子后才真正被网易圈粉了，不比某些大牌子差",2017-12-06 22:26:41
1334020,5,"不错，就是码子偏大，儿子平时都穿35，这双买33都还大",2018-01-02 21:14:00
1334020,5,"质量很好，就是买大了，先放着吧，明年再穿！！",2018-03-11 22:58:13
1334020,5,"大了两个码 平时穿34 这款选了33还是大 鞋本身很舒适",2017-12-02 13:46:41
1334020,5,"颜色好看，大小合适，厚厚的羊毛，脚底也是毛，舒适暖和，物美价廉，中严选的毒越来越深",2017-11-29 10:11:41
1334020,5,"隔天到真是方便，售后退换这些都是上门取件。自营的东西还是很靠谱的。",2017-12-29 00:40:09
1334020,5,"质量很好，毛皮一体，小朋友穿上就不愿意脱了，性价比非常高",2017-12-20 17:06:46
1334020,5,"挺好的，是真羊毛",2017-12-30 12:19:41
1334020,5,"毛很厚实，很暖和。虽然会让脚看起来很肥，但不会显腿短。",2017-11-21 20:37:16
1334020,5,"很暖和，孩子爱穿。灰色不抗脏，儿童款希望多点颜色，深咖之类的",2017-12-18 09:15:44
1334020,5,"超级棒。我和宝宝一人一双。靴子偏大一码。非常保暖。质量非常棒。",2017-12-18 09:09:39
1334020,5,"超级棒。我和宝宝一人一双。靴子偏大一码。非常保暖。质量非常棒。",2017-12-18 09:09:46
1334020,5,"帅帅的，现在是严选粉丝了，希望质量始终如一，不要越做越差哦",2017-12-13 21:53:09
1334020,5,"刚买完一周就降价50元活动了，但是因为买的颜色没货了也不能补差价，售后确认后可以退货后买另一个颜色，你们明白了吧，太麻烦这次就不这么玩了",2017-12-10 11:51:58
1334020,5,"鞋子做工和质量都挺好的，孩子非常喜欢，光脚穿很舒服，也省去了穿袜子。有了雪地靴连毛毛虫都不穿了。",2017-12-23 15:29:35
1334020,5,"小脚，只能买童鞋。做工不错，穿上保暖性也很好",2018-03-03 15:38:08
1334020,3,"故意送大一码的吗 好吧 35换来还是35",2017-12-10 14:41:27
1334020,5,"给小脚的婆婆买的，这个尺码很合适，让她满意一次不容易啊。",2017-12-13 19:41:44
1334020,5,"质量好，码偏大，32的换成30玛正好，小孩脚长19厘米，供参考。",2017-12-11 18:09:44
1334020,5,"严选的售后真是好！想给一万分！虽然上门取件的师傅搞错了流程，本来以为很复杂的，谁知道严选二话没说就解决了.每次买的东西真的是满意。这个鞋子是给孩子买的。确实是比平时穿的码子小一个号。只是宝贝详情页面没有注明脚长，还是买错了。换了，质感非常好，鞋底软硬适中。",2017-12-15 14:22:32
1334020,5,"很舒服，毛质很厚，个人觉得雪地靴买大一号更好～超级棒",2017-11-12 18:29:51
1334020,5,"真心好，轻便、防滑，虽然毛毛没有ugg厚实，性价比来说确实很值得",2018-01-01 18:50:06
1334020,5,"先给儿子买的，邻居也相中了，又帮邻居家的孩子买了一双",2017-12-06 18:07:38
1334020,5,"鞋子很好，小孩子穿上",2018-03-13 08:10:24
1334020,5,"这个和UGG的质量真的有一比",2018-03-11 15:08:49
1334020,5,"好好好好好好好好好好好好",2018-03-12 09:37:43
1334020,5,"很漂亮 孩子很喜欢",2018-03-12 11:47:23
1334020,5,"可以，孩子喜欢",2018-03-12 09:41:51
1334020,5,"鞋底还是有点硬，很暖是没错",2017-12-08 00:22:40
1334020,5,"东西很好，可惜小朋友不喜欢穿",2018-03-11 14:23:24
1334020,5,"不错，儿子喜欢",2018-03-11 20:33:29
1334020,5,"好",2018-01-05 16:32:57
1334020,5,"宝宝脚长16，这个码偏长一点，看起脚好大，质量还是不错的！",2017-12-04 23:25:57
1334020,5,"赶紧买哈，小鞋子特别可爱，等长大就穿不了这么可爱的鞋了",2017-12-03 10:51:41
1334020,5,"终于在降温之前穿上了雪地靴，质量跟成人的一样好，号码挺准的，这一冬不用愁了，零下二十度都没问题。",2017-12-11 08:41:00
1334020,5,"小朋友喜欢，谢谢！",2018-03-08 02:29:10
1334020,5,"质量不错",2018-03-08 12:09:12
1334020,5,"鞋子质量不错，跟UGG没差别，就是鞋子味道特别大，需要在外面多放几天",2018-03-10 22:05:29
1334020,5,"品质很棒",2018-03-07 09:37:49
1334020,5,"质量很好，孩子直接穿上，有时不穿 袜 子也一样舒服保暖。",2018-01-16 10:55:46
1334020,5,"物美价廉非常好。",2018-03-06 09:24:25
1334020,5,"有点味道，质量很好，买了就降价了",2017-12-13 16:14:37
1334020,5,"一如既往的高品质，值得信赖，希望严选越来越好！",2018-03-02 07:33:11
1334020,5,"很轻便，很暖和。我不是小宝宝哦，哈哈。上班族，平时穿35的刚刚合适，这次也很满意。网易家从来没让我失望。很给力",2017-12-07 17:59:09
1334020,5,"小鞋子质量特别好，很厚实，在东北足够了",2018-03-01 10:50:17
1334020,5,"质量很好，皮毛很好",2018-03-02 17:51:38
1334020,5,"鞋子质量不错，宝宝很喜欢，不过还没怎么穿，广州还没那么冷。",2018-01-12 23:49:06
1334020,5,"非常好的鞋子",2018-03-01 11:28:16
1334020,5,"相信严选希望能做的更好",2018-02-28 10:01:55
1334020,5,"比较暖和",2018-02-27 21:39:03
1334020,5,"看着不错，孩子穿着的感受我也不知道",2018-02-21 04:22:11
1334020,5,"挺暖和的",2018-02-26 17:34:38
1334020,5,"今年下雪正好可以穿雪地靴，皮质很软很好",2018-02-15 13:20:35
1334020,5,"买大了，自己穿了",2018-03-06 12:04:46
1334020,5,"性价比比较高",2018-02-25 11:52:09
1334020,5,"鞋子质量不错，我买的35码，但是感觉像36码，建议选小一号",2017-11-22 00:51:52
1334020,5,"小家伙没怎么穿",2018-03-02 10:50:51
1334020,5,"质量很好，小孩子很喜欢",2018-02-24 17:15:25
1334020,5,"很好～",2018-02-24 12:08:05
1334020,5,"儿子超喜欢，明年还会接着买的。",2018-02-23 10:11:23
1334020,5,"码子偏大，后跟毛好少，鞋底毛也不是很厚",2017-12-06 08:18:59
1334020,5,"不错，娃很喜欢",2018-02-23 21:38:22
1334020,5,"鞋子很漂亮",2018-02-21 17:33:03
1334020,5,"好",2018-02-20 20:33:10
1334020,5,"买给宝宝的，小朋友非常非常喜欢，做工好，不输大品牌。尺码按平时买大一码，3岁半买了26的。平时穿15cm的！！希望明年还能再穿一年。",2018-02-15 14:47:28
1334020,5,"还行",2018-02-19 20:31:17
1334020,5,"不错",2018-02-19 20:31:10
1334020,5,"鞋子一般，鞋楦定型不够好，可能因为是童鞋的缘故吧。",2018-02-27 10:06:45
1334020,5,"孩子特别喜欢。穿上就不脱了。刚刚16的脚丫，穿27微微松。",2017-12-12 22:24:50
1334020,5,"东西很不错！",2018-02-17 21:20:40
1334020,5,"很大，我本来穿35码，但是这个鞋子37码的人才能穿( ′<U+25D4> <U+2038><U+25D4>&#39;)哼 不得已又买了一双",2017-12-05 17:46:08
1334020,5,"平时运动鞋36.5 这个35还有点大呢",2017-12-07 23:10:12
1334020,5,"这是买的第三双啦，之前是大人的，这次给娃买的，一如既往地好",2017-11-16 12:18:38
1334020,5,"娃，不喜欢穿，可惜了",2018-02-10 09:50:54
1334020,5,"每年一双，儿童的版型很好的。",2018-02-16 16:22:45
1334020,5,"质量很好，很保暖~赞一个！",2018-02-16 21:36:03
1334020,5,"孩子穿着很暖和",2018-02-16 10:10:48
1334020,5,"很好,小朋友喜欢",2018-02-16 20:25:11
1334020,5,"保暖效果好！",2018-02-16 21:23:33
1334020,5,"还行",2018-02-15 13:04:52
1334020,5,"质量不错，宝宝穿着很舒适不比大牌差",2018-02-08 11:12:28
1334020,5,"这个超级喜欢你这个价格 真的不错",2018-02-12 15:41:31
1334020,5,"很好哦",2018-02-12 16:37:17
1334020,5,"质量超级棒超级舒服，皮质也特别好，底子防滑效果不错，儿子非常喜欢！",2017-12-06 21:44:00
1334020,5,"买大了退换货非常房产，一入严选深似海啊！",2018-02-01 01:00:52
1334020,5,"很暖很轻，妥妥的值那个价",2018-02-10 15:58:30
1334020,5,"女朋友很喜欢，最暖的一双雪地靴",2018-02-10 15:59:02
1334020,5,"舒服，不确定尺码，只好买了俩码。喜欢",2017-12-06 19:45:18
1334020,5,"儿子很喜欢",2018-02-11 12:14:08
1334020,5,"特别暖和",2018-02-11 20:34:33
1334020,5,"质量好的出乎想象，性价比太高了，这让其他电商以后还怎么混啊，从此在这安营扎寨了，用的还是京东物流，第二天就送到了，强强联合",2017-12-07 19:44:04
1334020,5,"买小了，换了大码的，孩子很喜欢，穿上也很舒服",2017-12-25 13:25:59
1334020,5,"质量超好",2018-02-10 10:33:13
1334020,5,"闺女很喜欢",2018-02-10 00:08:52
1334020,5,"非常好",2018-02-10 10:00:41
1334020,5,"这个太赞了，买了两双，一大一小",2018-02-08 21:13:54
1334020,5,"非常满意",2018-02-09 10:53:04
1334020,5,"就是鞋底有些硬，其他都好",2018-02-13 22:07:13
1334020,5,"这就是买大了两码的鞋 尺码选择太难了 明明照着严选毛毛虫尺寸大一码买的 谁知这个本身尺码偏大 质量是好的 换货态度也很积极",2017-12-07 06:01:09
1334020,5,"这鞋真的非常好",2018-02-08 01:44:40
1334020,5,"孩子喜欢穿，看着很笨重的样子，一点不重，比较轻便！",2018-01-20 17:57:07
1334020,5,"鞋子买大了，严选的退换货很赞，很快就换货回来。换了双小号的，雪地靴质量很好，孩子说穿上很舒服，开始有点掉毛，后来就不掉了",2018-02-13 09:53:52
1334020,5,"给自己买的 平日鞋子尺码在34-35之间 所以其实可以选34  当时买了35略宽松些  舒服还是挺舒服  希望是真的羊毛",2017-12-05 22:41:31
1334020,5,"雪地靴真不错，一年买一双正好过冬",2018-02-06 09:07:02
1334020,5,"很好穿",2018-02-07 17:02:46
1334020,5,"质量好",2018-02-07 15:15:38
1334020,5,"换鞋码严选亲自上门取回鞋子，服务非常好。鞋子孩子穿这舒服。",2017-12-22 08:30:33
1334020,5,"鞋挺好的，可惜买大了，想换却已断货了。",2018-01-07 21:18:31
1334020,5,"鞋子质量棒棒哒",2018-02-06 11:37:40
1334020,5,"很喜欢",2018-02-06 07:03:46
1334020,5,"很不错",2018-02-06 07:04:08
1334020,5,"超级棒！特别暖和，样式也好，好ugg没有任何差别",2018-02-03 17:01:09
1334020,5,"第二次买了，上次买的是姜黄色，宝宝穿很舒服",2018-01-26 11:04:55
1334020,5,"特别的合适，质量非常好",2018-02-05 15:54:14
1334020,5,"满意",2018-02-05 23:32:21
1334020,5,"满意",2018-02-05 23:32:33
1334020,3,"穿了两三个月，鞋底内侧的毛都快掉光了",2018-02-11 09:15:16
1334020,5,"挺不错，买了没多久就赶上历史上最大的雪了。",2018-01-05 20:50:25
1334020,5,"买大了送给朋友的孩子了",2018-02-04 13:34:48
1334020,5,"一样，很容易湿透",2018-02-11 20:11:49
1334020,5,"买大了，留着以后穿",2018-02-04 15:33:25
1334020,5,"是真毛的，穿着很轻巧",2018-02-04 11:15:15
1334020,5,"挺好的，厚实。",2018-02-04 08:57:49
1334020,5,"非常满意",2018-02-04 22:24:05
1334020,5,"想再买双，没货了",2018-02-03 11:26:31
1334020,5,"宝宝穿的很好",2018-02-03 21:46:58
1334020,5,"非常不错，小朋友很喜欢",2018-02-03 18:06:03
1334020,5,"鞋子不错的",2018-02-03 09:15:15
1334020,5,"不错",2018-02-03 13:37:52
1334020,5,"]想到35ao我穿是有大！ 下次我I34吧qq",2017-11-28 11:01:09
1334020,5,"质量很好，零下二十度可能还需要高到腿肚的",2018-01-23 15:55:38
1334020,5,"尺码真的偏大，很暖和，质量不错！",2017-12-21 21:05:52
1334020,5,"很满意",2018-02-02 22:16:29
1334020,1,"发货太慢了",2017-12-05 22:42:39
1334020,5,"非常不错的雪地棉，宝宝一上脚就不脱下来了",2017-12-17 10:47:22
1334020,5,"做工很棒，颜色很正",2018-02-01 20:13:04
1334020,5,"皮毛一体，特别高。",2018-02-01 00:59:46
1334020,5,"非常好，颜色耐脏，冬季主打。",2018-01-31 13:42:24
1334020,5,"非常棒，打算给孩子再买一双",2018-01-30 14:24:07
1334020,5,"特别好穿",2018-01-30 23:21:47
1334020,5,"很好",2018-01-30 11:08:06
1334020,5,"比较厚，适合东北的冬天，鞋底稍滑",2018-01-29 08:47:37
1334020,5,"还成吧，我买了较大的一点的，儿子每年都会买一双",2017-11-24 00:03:24
1334020,5,"内裤挺好的，柔软亲肤。",2018-01-29 22:56:04
1334020,5,"质量好的开法说",2018-01-29 20:30:38
1334020,5,"偏大。质量不错",2018-01-29 22:55:26
1334020,5,"非常棒，很保暖",2018-01-29 10:08:40
1334020,5,"适合雪天",2018-01-29 00:08:06
1334020,5,"很好了",2018-01-29 22:52:49
1334020,5,"质量很好",2018-01-29 13:50:26
1334020,5,"质量很好，性价比高！
什么时候补货啊，还要买啊",2017-12-14 16:54:27
1334020,5,"鞋子寄过来，号码大了两号，想换一直没货，郁闷。",2018-01-16 10:55:42
1334020,5,"宝宝这款特别好看 后来换了和女儿一样的颜色 超喜欢",2017-12-14 13:26:32
1334020,5,"还不错，孩子穿着挺舒服的",2018-01-28 21:06:15
1334020,5,"性价比超高，喜欢",2018-01-28 15:41:17
1334020,5,"很好",2018-01-28 17:12:47
1334020,5,"好",2017-12-25 10:33:29
1334020,5,"非常满意，下次需要还会回购！",2018-01-27 08:50:46
1334020,5,"非常满意，下次需要还会回购！",2018-01-27 08:50:52
1334020,5,"非常满意，下次需要还会回购！",2018-01-27 08:51:06
1334020,5,"暖和，不过小孩穿一天脚会有点疼，不适合运动量大的时候穿",2018-02-01 11:25:31
1334020,5,"很厚宝宝很暖和",2018-01-27 15:26:30
1334020,5,"超级满意喜欢码数刚好",2017-12-06 20:05:14
1334020,5,"非常满意",2018-01-27 21:45:01
1334020,5,"囤货啦，大了点不过明年接着穿 很满意 母子同款",2017-12-12 17:18:47
1334020,5,"质量很好",2018-01-26 14:48:26
1334020,5,"毛很厚实",2018-01-26 10:17:14
1334020,5,"质量很好就是买大了，只好等有货在重拍一双了",2017-12-23 07:03:18
1334020,5,"鞋子很好，这个价格很值，小孩都舍不得脱了",2018-01-20 12:19:52
1334020,5,"鞋型很好，上脚也好看，够厚实，特别满意",2018-01-20 18:28:50
1334020,5,"非常好的鞋子  孩子喜欢 冬天很暖和  里面是羊毛的",2018-01-15 23:44:04
1334020,5,"鞋子性价比很高，不错，女儿很喜欢",2018-01-24 14:58:14
1334020,5,"其实是给我奶奶买的",2018-01-25 10:56:16
1334020,5,"不错孩子挺喜欢的",2018-01-25 12:53:47
1334020,5,"非常舒服合脚",2018-01-25 22:34:07
1334020,5,"鞋质量很好",2018-01-25 19:06:38
1334020,5,"不错",2018-01-25 12:53:59
1334020,5,"儿子过冬小伴侣",2018-01-24 21:26:15
1334020,5,"女儿特别喜欢",2018-01-24 12:37:00
1334020,5,"挺好的",2018-01-24 10:26:59
1334020,5,"第一次买大了这次换的很合适",2018-01-23 20:20:35
1334020,5,"买大了！质量还可以",2017-11-16 23:25:14
1334020,5,"鞋的质量很好，颜色也和图片一样，孩子穿着很舒服。满意",2017-12-09 20:17:27
1334020,5,"非常好，暖和透气！女儿大爱",2018-01-23 13:59:29
1334020,5,"第一次下雪的时候穿下去，然后潮湿之后就变色了。无法恢复，发消息给厂商，厂商说这个问题是没有用防水喷雾。推卸责任一流，我以前用的正版油鸡鸡也没有这种情况啊！",2018-01-26 11:47:02
1334020,5,"好好好",2018-01-23 14:24:43
1334020,5,"孩子穿着很舒服哦  就是选的颜色不耐脏  哈哈",2017-12-24 19:54:29
1334020,5,"尺码有些偏大，但是超级舒服，宝宝穿上了就不肯脱了",2017-12-08 08:18:48
1334020,5,"保暖性能特别好",2018-01-22 11:17:18
1334020,5,"仔仔喜欢",2018-01-22 23:02:31
1334020,5,"买大了两码 换货很方便 态度很好 这鞋质量不错！",2017-12-07 05:59:02
1334020,5,"很保暖又容易穿脱",2018-01-21 10:46:25
1334020,5,"很保暖又容易穿脱",2018-01-21 10:46:32
1334020,5,"确实非常好，孩子超喜欢！",2018-01-21 02:47:20
1334020,5,"东西好速度快",2017-12-07 11:17:38
1334020,5,"亲子靴",2018-01-21 13:38:28
1334020,5,"满意一百分",2018-01-21 00:09:58
1334020,5,"非常好",2018-01-21 23:06:18
1334020,1,"网易买的东西一次比一次差，不是品牌的真的不应该买！想要退货，说不应该水洗！刚开始只是湿了一点，就显示明显的色差，才无奈水洗！其他品牌的价格比他便宜也从未见过如此褪色严重！再也不会买网易的东西了！",2018-01-21 22:18:32
1334020,4,"买给家里小孩的，款式很经典，小孩说喜欢",2018-01-18 15:01:25
1334020,4,"买给家里小孩的，款式很经典，小孩说喜欢",2018-01-18 15:01:28
1334020,5,"赶在最冷的日子之前穿上了 很暖和",2018-01-15 13:32:39
1334020,5,"小朋友早就穿上了，喜欢。",2018-01-20 09:19:19
1334020,5,"还好，就是鞋头穿几次就磨坏了。我UGG穿了3年还好好的",2018-01-21 07:54:35
1334020,5,"小朋友早就穿上了。",2018-01-20 09:18:54
1334020,5,"女儿好喜欢",2018-01-20 09:34:06
1334020,5,"质量绝对赞",2018-01-20 23:19:33
1334020,5,"质量超好",2018-01-20 23:19:51
1334020,5,"偏大，本来给女儿的，太长了，还好我能穿",2018-01-02 20:58:31
1334020,5,"幺儿穿了后脚脚热和，手终于也热和了",2018-01-02 15:55:17
1334020,5,"孩子穿大了很多，我37码的脚都能穿，怕麻烦懒得换了，留着我自己穿好了",2017-12-11 16:35:48
1334020,5,"好不容易抢到一个 看上去很暖和",2018-01-19 20:00:08
1334020,5,"质量不错",2018-01-19 10:35:28
1334020,5,"什么都好就是最小的尺码我的宝宝也穿不上，明年的话，又估计小了，只能退了。",2017-12-14 20:27:47
1334020,5,"严选的孩子的东西是真心的都不错 这款鞋子简直没得说",2017-11-15 20:13:12
1334020,5,"严选东西就是不一样，十分，十分满意，大爱",2018-01-16 21:18:25
1334020,5,"买给朋友的，据说很棒",2018-01-18 19:02:09
1334020,5,"性价比高 值得买",2018-01-18 11:12:36
1334020,5,"非常好用呢，喜欢",2018-01-18 09:34:26
1334020,5,"鞋子质量很好",2018-01-18 15:05:55
1334020,5,"好看，合适，喜欢",2018-01-18 09:32:47
1334020,5,"一般",2018-01-18 14:31:48
1334020,5,"鞋码大，给婆婆买的，与UGG做了比较，实在太划算！",2017-12-19 14:39:06
1334020,5,"还可以，软软的，暖和",2018-01-17 16:21:14
1334020,5,"好东西",2018-01-17 18:25:03
1334020,5,"好穿",2018-01-17 08:55:38
1334020,5,"非常好",2018-01-17 14:00:30
1334020,5,"鞋子真心不错，只是尺码有点偏差，不过质量和样式真心没话说。",2017-12-03 08:24:32
1334020,5,"超级可爱",2018-01-16 20:54:51
1334020,5,"很暖和！质量超级好！穿着显瘦！",2018-01-15 12:05:19
1334020,5,"不错，很暖和。码子有点大，要垫鞋垫",2018-01-14 11:23:21
1334020,5,"品质很赞，非常好，虽然没有牌子，但是品质一点都不差。",2017-12-24 11:43:00
1334020,5,"非常棒的鞋子！",2018-01-15 21:07:28
1334020,5,"买大了",2018-01-15 21:56:38
1334020,5,"这个穿着有暖和又舒服，宝宝很喜欢",2018-01-13 14:40:36
1334020,5,"很保暖，大冬天可以穿",2018-01-14 18:21:44
1334020,5,"非常不错，孩子很喜欢",2018-01-14 23:21:30
1334020,5,"偏大",2018-01-14 23:59:12
1334020,5,"偏大",2018-01-14 23:59:49
1334020,5,"质量很好的样子，和大牌看着档次一样高的！",2017-12-27 20:02:57
1334020,5,"鞋子非常好，不担心孩子冬天脚冷",2018-01-13 16:47:48
1334020,5,"质量不错，可是我买大啦，留着明年穿",2018-01-08 22:06:04
1334020,5,"厚实好穿，宝贝好喜欢",2018-01-13 19:28:18
1334020,5,"很好穿，暖和",2018-01-13 07:59:54
1334020,5,"质量不错的",2018-01-13 15:23:14
1334020,5,"买个女儿穿的应该挺好的吧相信相信网易严",2017-12-15 17:42:23
1334020,5,"送人，对方夸奖非常暖和",2018-01-12 17:55:31
1334020,5,"买了几双了，不错",2018-01-12 17:57:37
1334020,5,"手机壳真不错",2018-01-12 17:56:12
1334020,5,"哈哈哈哈哈哈哈",2018-01-12 10:36:08
1334020,5,"好好好",2018-01-12 09:52:23
1334020,5,"非常好，宝宝很喜欢，买大了一点，但是明年还可以穿。",2017-12-25 11:57:00
1334020,5,"儿子穿到现在了，很好<U+0001F44D>",2018-01-11 12:29:05
1334020,5,"不怎么样，退掉了",2018-01-13 15:45:07
1334020,5,"大了一丢丢，质量非常棒，严选东西的品质都很不错",2017-11-28 18:35:52
1334020,5,"质量很好，宝贝穿着很舒服！",2018-01-11 13:37:59
1334020,5,"给宝宝买的，挺好的",2018-01-11 10:54:21
1334020,5,"不错   很合适  很暖和",2018-01-11 15:05:38
1334020,5,"非常满意的一次购物",2018-01-11 23:24:00
1334020,5,"不错  很暖和",2018-01-11 15:05:20
1334020,5,"挺好的",2018-01-11 20:48:12
1334020,5,"非常满意",2018-01-03 22:12:18
1334020,5,"非常不错",2018-01-11 09:00:52
1334020,5,"goooood",2018-01-11 22:24:24
1334020,5,"小朋友非常喜欢，给妈妈也买了一双成人的，用时间证明质量。",2017-12-13 08:31:39
1334020,5,"质量很不错呢！小孩子脚长得快，买太贵的鞋子其实蛮不划算的，这个鞋子性价比高，就算明年穿不下了，也不会觉得浪费",2018-01-03 19:40:27
1334020,1,"双11屯的，柔软舒服又暖和，可是娃今天第一天穿，鞋头就磨破了，又过了30天的退换货期……怎么处理？",2018-01-09 17:53:59
1334020,5,"我是自己穿的，是羊毛的，质量非常好",2018-01-08 22:22:51
1334020,2,"鞋码发的就不对，质量不好太差劲，这还是UGG厂家的货？太可怕了",2017-12-11 16:57:40
1334020,5,"穿上很可爱",2018-01-10 14:41:39
1334020,5,"鞋子很保暖，推荐。",2018-01-10 16:49:10
1334020,5,"非常好的鞋子",2018-01-10 21:53:54
1334020,5,"喜欢，质量好",2018-01-10 12:29:27
1334020,5,"很好",2018-01-10 12:12:48
1334020,5,"很好",2018-01-10 12:12:54
1334020,5,"非常好",2018-01-10 07:17:54
1334020,5,"好看",2018-01-10 22:35:44
1334020,5,"好看",2018-01-10 22:35:48
1334020,5,"质量很好，很暖和，十分值得",2017-12-01 12:06:21
1334020,5,"不错，蛮合脚的",2018-01-09 17:44:32
1334020,5,"不错的鞋子，很暖和",2018-01-09 18:59:41
1334020,5,"弟弟很喜欢",2018-01-09 00:42:46
1334020,5,"蛮好的",2018-01-09 07:13:33
1334020,5,"很喜欢",2018-01-09 02:37:41
1334020,5,"非常满意",2018-01-09 21:19:20
1334020,4,"鞋底很硬，买大了，只能留到明年冬天穿了",2017-12-30 12:05:10
1334020,5,"和儿子来双亲子靴 男孩子 火力壮 穿不了几次",2017-12-30 16:46:55
1334020,5,"买小了，换了码，换货过程稍有些长，鞋非常好",2018-01-02 23:48:23
1334020,4,"鞋底很硬，我买大了，留着明年冬天穿吧",2017-12-30 12:04:16
1334020,5,"尺码差了很多，已经退货了",2017-12-30 12:51:37
1334020,5,"穿脱方便又保暖，孩子喜欢",2018-01-08 09:13:06
1334020,5,"女儿很喜欢，希望多出可爱的童款，最好有粉色和玫红色的",2017-11-25 19:56:40
1334020,5,"价格实惠，儿童穿够了。",2018-01-08 07:51:48
1334020,5,"非常好，洋气保暖时尚",2018-01-08 20:25:03
1334020,5,"很好<U+0001F44D>",2018-01-08 13:30:54
1334020,4,"码数偏大",2018-01-08 10:51:34
1334020,5,"很暖和，舒服",2018-01-08 21:02:31
1334020,5,"<U+0001F60D>",2018-01-08 07:31:08
1334020,5,"买给孩子的，比较满意，山东没有暖气，穿着很暖和。",2017-12-29 11:16:44
1334020,5,"质量很好，喜欢！赞！！！",2018-01-07 14:27:26
1334020,5,"很好",2018-01-07 17:43:01
1334020,5,"好",2018-01-07 22:58:17
1334020,5,"好",2018-01-07 22:58:32
1334020,5,"真的很划算 是真的皮毛一体的。穿上田暖和",2017-12-28 16:43:42
1334020,5,"挺合适的，气味只有一点点，散了一下就没油了。这个价格小朋友穿一季很合适！",2018-01-08 20:50:58
1334020,5,"我很满意，买贵了还退了差价。严选很靠谱的！",2017-12-09 08:16:17
1334020,5,"做工很好！孩子很喜欢。",2018-01-06 13:21:03
1334020,5,"好看暖和女儿很喜欢",2018-01-06 21:49:18
1334020,5,"不错，性价比高",2018-01-05 13:44:17
1334020,5,"不错，很暖和",2018-01-05 14:35:17
1334020,5,"很不错",2018-01-05 19:35:47
1334020,5,"好鞋",2018-01-05 00:14:48
1334020,5,"收到啦，但是颜色有点暗，不太像驼色。孩子很喜欢",2017-12-26 17:02:51
1334020,5,"有女童款的吗？想给女儿买一双。",2018-01-03 10:39:33
1334020,5,"很舒服的鞋子，儿子很喜欢",2018-01-04 15:35:55
1334020,4,"真心保暖，舒服，孩子非常喜欢，唯一的缺点:防滑性太差，地板砖有一点水就会很滑，比家里的普通拖鞋都不如，下雪天下雨天不敢让孩子穿，好几次差点滑倒了。希望严选能改进这一点就非常完美了",2018-01-07 00:05:05
1334020,5,"孩子喜欢",2018-01-04 17:39:07
1334020,5,"鞋子太大退掉了",2018-01-06 23:01:35
1334020,5,"很厚实 做工精细。就是买大了…留着明年再穿～",2017-12-17 10:06:02
1334020,5,"质量好 性价比极高",2018-01-03 20:39:56
1334020,5,"非常轻便，孩子很喜欢",2018-01-03 20:39:14
1334020,5,"非常好，很暖和！",2018-01-03 20:46:50
1334020,5,"大小合适，很暖和",2018-01-03 20:10:54
1334020,5,"略大了一点，孩子是不大，不让换了，那就明年继续穿吧",2018-01-04 11:46:57
1334020,5,"好",2017-11-26 10:58:42
