"itemId","star","content","createTime"
1438012,5,"唯有严选才穿的上，感受无与伦比，现在我周边都在用严选的产品，弹性好、柔软。",2018-08-21 15:41:01
1438012,5,"面料体感舒适，版型似乎就一般了，太热，只试了一下，还没穿。",2018-08-20 15:58:14
1438012,5,"柔软有弹性，性价比高，要是裤筒再宽松点就好。在严选买了不少东西了",2018-06-01 22:40:23
1438012,5,"没有一般牛仔裤硬邦邦的感觉，和薄的布料一样很柔软很舒服，待后续观察是否变形，如能克服这一点必定入手第二条。",2018-06-18 01:49:00
1438012,5,"老朋友。我又来你店光顾了，久了没来，生意看来还真不错哦。努力哦!",2018-07-18 18:20:23
1438012,5,"非常合身，唯一需要本人腿不够长需要裁剪下！平常穿32的，身高174，体重.70……大家参考！",2018-05-19 11:34:21
1438012,5,"穿着舒服，<U+0001F602>老实来说我可能太瘦了，还是觉得偏大，不过这种款式的牛仔裤，真的良心。",2018-05-29 19:19:18
1438012,5,"裤子不错，就是盒子太锋利，把手都割破了。",2018-08-20 18:18:13
1438012,5,"175的身高体重70kg穿31码刚刚好。所以又退回去换了31码。网易的服务很好，换货来回不耽误事",2018-06-25 09:08:19
1438012,5,"给男票买的，很喜欢，还是稍微大了一点，34应该就好了，会回购",2018-06-18 21:34:37
1438012,5,"裤子很贴身，很柔软，穿着非常舒适，对牛仔裤有颠覆性的新认识，不知道清洗后会不会变形，期待，不要失望",2018-06-13 21:56:21
1438012,5,"很弹很凉爽，穿着舒服。我腿粗，腰合适，腿很紧，穿起来略风骚",2018-07-12 22:09:32
1438012,5,"嗯 第一次穿这么舒服的牛仔裤 很透气 夏天的杭州穿着也不会热，强烈推荐！",2018-07-12 13:20:10
1438012,5,"非常满意，舒服！完全没有束缚感！同事们都夸我年轻了，老婆也说我很有型",2018-06-15 12:10:05
1438012,5,"171cm/64kg，腰围77cm，30码正好，非常显瘦，浅蓝年轻好看，裤子有弹性，买过的最舒服的牛仔裤。",2018-05-21 15:04:30
1438012,5,"产品质量好，柔软舒适透气，凉爽，价格实惠，送货速度很快，<U+0001F44D><U+0001F44D><U+0001F44D>",2018-08-06 16:31:31
1438012,5,"产品质量好，柔软舒适透气，凉爽，价格实惠，送货速度很快，<U+0001F44D><U+0001F44D><U+0001F44D>",2018-08-06 16:31:10
1438012,5,"东东很好，买了三样物品之一，传说中的赠品没给！失信的严选不按套路严送！",2018-05-21 17:47:14
1438012,5,"无侧骨的牛仔裤看上去有点娘炮，建议做一些有侧骨的天丝牛仔裤",2018-07-07 17:02:13
1438012,5,"手感非常好 长度正正好好 大小稍紧了点 如长度不变腰围臀围大腿围再大一点点就完美了",2018-05-05 11:30:38
1438012,5,"因第一次在严选上买衣服，对于尺码把握不好，买大了，本来挺头疼换货流程，不太想折腾了，不过后来三件衣服都不合适就一起换了，没想到整了换货流程很贴心，对于这次换货经历非常满意",2018-05-24 08:45:07
1438012,5,"打开包装有一股清淡的奶酪味，颜色有些许偏废！
厚度适合南方的二四八月，弹力十足，质量好～",2018-05-19 16:16:51
1438012,5,"这个牛仔裤太舒服了，原来以为只有女生的牛仔裤才有这种轻薄面料，现在终于不羡慕老婆的only了",2018-05-18 19:20:28
1438012,5,"这个牛仔裤太舒服了，原来以为只有女生的牛仔裤才有这种轻薄面料，现在终于不羡慕老婆的only了",2018-05-18 19:20:18
1438012,5,"弹力很好，尺码很准，180.71穿的31刚刚好，洗后只有轻微浮色，很棒",2018-05-31 10:27:18
1438012,5,"这已经是第二次购买了，上次买了个浅蓝的，这次买的中蓝，没什么说的，严选就是好呀，赞赞赞。",2018-06-27 21:13:54
1438012,5,"身高171厘米，体重126斤，穿29简直完美，面料微弹。质感一流，穿着很舒适，跟以往的穿的大不一样，推荐！",2018-05-03 23:02:54
1438012,5,"不错",2018-05-14 17:41:22
1438012,5,"推荐尺码表上小了一号，换了之后和合身。希望有更轻薄的裤子和鞋子",2018-06-06 17:16:19
1438012,5,"非常不错，健身有效，终于敢穿弹力牛仔裤了，版型相当好，穿一段试试，因为走路多，所以看看啥时候能磨烂",2018-05-14 18:21:26
1438012,5,"第一次在严选购物，质量简直太好了，不贵的价格能买到这么好质量的裤子，太惊喜了，以后一定专选严选",2018-07-18 21:47:09
1438012,5,"真的很舒服，给女票也买了一条一样颜色的，可惜适合码缺货，买了大一号的不合身只能退了",2018-06-01 17:16:48
1438012,5,"裤子大了一码，免费上门取件更换，很快寄回来了，裤子柔软舒适，穿起来很好看，真的不错",2018-05-12 00:55:00
1438012,5,"我体重85kg，身高172cm，主要肚子大但是码刚合适，经过几次购买裤子有经验了！",2018-06-03 20:17:50
1438012,5,"不怕货比货，就怕不识货。牛仔裤穿起来很有型，很舒服，这个价位太值了",2018-06-03 15:10:37
1438012,5,"很柔软很薄，有弹性，穿了很舒服和没穿一样，175身高80体重32正好，这款裤子号码偏大一号的",2018-05-30 20:43:29
1438012,5,"尺码小了，昨晚退的，今天上午收到，没想到严选和京东物流的顾客至上和高效，我很满意！快递小哥很棒！",2018-05-19 12:26:12
1438012,5,"裤子很舒服，水洗一般不过也不能要求太高",2018-05-17 12:05:58
1438012,5,"裤子很柔软，像是运动裤",2018-05-18 13:20:46
1438012,5,"老公穿上就说舒服，面料非常柔软，大小刚好，颜色也好，夏天穿估计也是不热，确实好",2018-05-11 07:55:34
1438012,5,"穿到身上是很舒服，就是太修身了，宽松点就好了，腿粗人的烦恼",2018-07-23 15:47:02
1438012,4,"还不错:也还挺软的:天热的时候穿挺保温…天冷的时候很凉快",2018-06-25 07:55:41
1438012,5,"老公说是他穿过最舒服的牛仔裤，好吧，虽然一开始我觉得一般般",2018-07-22 14:53:32
1438012,4,"这价格一般吧",2018-05-17 14:18:08
1438012,5,"这个穿着真的非常舒服，号码刚刚好合适很贴身。比我前一次买的另一款好太多，准备再入手了",2018-05-23 22:18:00
1438012,5,"穿着舒适透气休闲，质量不错，尺码标准，物流快捷，值得推荐！<U+0001F44D><U+0001F44D><U+0001F44D>",2018-07-18 14:39:01
1438012,5,"很不错 轻薄，舒适，有一个问题 2个裤兜有白衬漏出 需要时不时就整理",2018-08-14 17:27:46
1438012,5,"第一次在网易严选买服装，非常棒的一次购物体验，裤子很合身，下次继续买",2018-08-13 11:06:34
1438012,5,"Thank you very much for the excellent service ，and it is very good to do in warehouse management, logistics, distribution and so on. Delivery in a timely",2018-05-02 22:05:39
1438012,3,"已退",2018-08-18 11:18:48
1438012,5,"版型好，面料柔软舒服，非常合身舒服，特别满意！穿后别的裤子都不想穿了！",2018-06-17 21:39:05
1438012,5,"32的有些贴身，换了33好多了，主要是自己腿粗（173高，69公斤）供参考",2018-06-16 12:10:58
1438012,5,"很不错呢，就是裤腿长一些，改了就好了",2018-05-17 17:46:53
1438012,5,"还没穿，手感确实不错，尺寸刚好，相比天猫、京东平台价格再优惠点就更好了",2018-05-18 20:38:53
1438012,5,"上回买大了舍不得退，拿裁缝那改了，这回再买条合身的！<U+0001F62E>",2018-06-05 19:02:57
1438012,5,"面料特别舒服，裤型特别好，两种颜色都买了，还推荐了朋友们也买。",2018-07-01 13:09:09
1438012,5,"严选这款牛仔裤很棒，尺码很合身，面料很舒适，有弹性，活动很方便，透气性很好，即使炎热夏天穿也不会出汗。",2018-06-20 14:36:36
1438012,5,"你自己看后悔退退退",2018-08-10 22:27:31
1438012,5,"裤子质量非常好，和描述的一样，非常满意，选的号码大一号，下回就知道了。",2018-06-03 18:10:47
1438012,5,"很舒服弹力非常好不愧是大品牌。希望多来几个款型。买买买",2018-08-19 13:21:44
1438012,5,"牛仔裤舒适好穿，很受家人喜欢，计划做活动时再入一条",2018-08-18 10:09:52
1438012,5,"不错，如果再薄一点就好了，天气热了就不行了，春秋天应该可以",2018-07-22 07:14:05
1438012,5,"面料很柔软，版型也好，尺码偏大，建议小一码，176、65.31码稍大一点",2018-05-28 15:44:09
1438012,5,"蛮好的 我平时穿32 严选的裤子一般腰都太大 这次买31刚刚好",2018-05-28 14:25:32
1438012,3,"尺寸大，偏大很多，腰围非常大，面料舒适，就是腰围比例太奇怪，其他合适了，腰围也还是大",2018-08-11 08:21:27
1438012,5,"很舒服，柔软弹力好，买给老公的，他说穿着很舒服，物有所值。",2018-07-20 21:56:51
1438012,4,"手感面料做工都可以。因为太瘦了，退货了。适合腿比较细的人穿。",2018-07-20 16:19:36
1438012,5,"裤子很不错，穿着很舒服，很有弹性，薄厚合适，夏天穿着也不会太热",2018-05-26 04:10:57
1438012,5,"已经买了一条，这次买了小一码的，穿上更合身，好评",2018-08-11 07:33:37
1438012,5,"面料很舒服，就是我买大了老公穿显大，好在有弟弟，就给他了....",2018-04-30 10:42:12
1438012,5,"这款牛仔裤很舒适，严选的牛仔裤都比较不错，就是掉色。",2018-06-12 11:19:09
1438012,5,"裤子很好，穿起来很舒服，就是因为有弹性，所以尺码好像偏大了一号",2018-06-16 20:24:07
1438012,5,"很舒服裤型偏大 购买时咨询下客服哦",2018-07-14 17:53:00
1438012,5,"一代去年也买了，比较了一下，此款更舒适，做工都不错，可以按照尺码表购买。",2018-05-18 00:31:42
1438012,5,"裤腿有点儿紧，是自己太胖的原因。面料柔软舒适，性价比极高",2018-08-02 11:55:22
1438012,5,"好，我说好。",2018-05-26 21:05:33
1438012,5,"76码稍微有一点点紧，再买一条78码的两条换着穿",2018-07-29 11:16:01
1438012,5,"裤子面料舒服，第一次见无侧骨的;售后也好，过了一周多才试穿、调号，上门取件（不收费）、发新品，速度快。网购感受非常不错!",2018-06-09 15:47:17
1438012,5,"非常极其束缚",2018-06-07 14:20:46
1438012,5,"给老公买的，非常满意，非常舒服。身高180腿细，买的31码，上身效果很好",2018-05-13 14:07:43
1438012,5,"我家老公最不喜欢穿牛仔裤了，说勒腿，不透气。
这条一穿上就高兴地来了个侧踢，连连夸舒服。
非常满意！",2018-07-29 21:15:05
1438012,5,"从未穿过如此柔软舒适的牛仔裤，很好的商品。严选秉承着一贯的高品质！",2018-06-04 06:01:56
1438012,5,"裤子真的非常舒服，不穿不知道，颠覆了对牛仔裤的一贯看法。",2018-08-12 10:38:24
1438012,5,"看了大家评价跟风买的，穿起来果然很舒服。身高185，体重90kg，穿起来裤腰还有富裕，给大家做个参考。",2018-05-23 19:08:21
1438012,5,"Perfect！穿着有型、凉快、轻便、无感。170cm73kg，32码肥瘦合适，剪短9厘米。",2018-06-01 15:53:07
1438012,5,"手感很舒服，很满意，下次还是严选",2018-05-20 14:12:29
1438012,5,"手感非常棒。虽然是说4季都可以穿，但冬天肯定不行。",2018-08-22 16:24:26
1438012,5,"图片就不拍了，难的拍，不过裤子的质量是还不错的！支持严选",2018-05-28 16:28:04
1438012,5,"这条裤子真的是太舒服了，又软又弹又透气又舒适，很棒啊！",2018-05-27 21:18:29
1438012,5,"面料挺舒服，就是版型不适合我，退货速度也很快",2018-08-19 08:28:07
1438012,5,"很舒适，就是稍微有点紧，开始说换，后来老公说他要减肥，不换了",2018-05-26 17:25:15
1438012,5,"先生说穿着很舒服，大胖子穿着也显腿型，赞",2018-08-17 11:29:18
1438012,5,"很轻很薄很柔软，第一次用严选，感觉来对了，希望越做越好！！！",2018-05-24 22:32:54
1438012,5,"这条裤子是很满意的，在严选也买了不少东西了，7月21号买了一条牛仔裙，到25号还没发货，问客服，说是很抱歉，没货了！建议我取消订单，给我申请20元直减券，好，就算再不满意人家没货了你怎么办，取消订单了，今天30号了，所谓的直减券在哪里呢？严选的客服都是这样的服务吗？裙子没货了搞什么限时购的活动？没货了不告知一声吗？真的是差劲",2018-07-30 15:16:02
1438012,5,"176高68公斤 非常合适 给大家参考下，弹性十足，又透气。本人买了不下40条合种类牛仔裤，首选这条合身，舒服，以后必须严选！",2018-06-03 15:46:55
1438012,5,"腿粗，裤子粘在身上的。不知道洗洗会不会松一些",2018-06-03 19:48:06
1438012,5,"弹性十足，很合身同时透气性也不错，不过夏日炎炎还是短裤吧",2018-07-28 18:11:20
1438012,5,"170/62kg，30还好，29就太紧身。穿上皮肤很享受～～～",2018-08-12 21:26:14
1438012,5,"必须说一下，这个裤子质量真的好，严选的东西质量还是有保证",2018-08-12 08:12:51
1438012,5,"尺码合适，用料考究，舒适度高，第一次买到穿着这么舒服，合适的牛仔裤！严选<U+0001F44D>！",2018-05-20 15:19:32
1438012,5,"这是一款打动人心的产品：品质过硬，价格厚道<U+0001F44D><U+0001F44D><U+0001F44D>",2018-07-06 07:27:53
1438012,5,"贴身穿着舒适，弹性很好，无论下蹲或者大步跑动没有不适感。",2018-08-09 12:07:32
1438012,5,"有点长，但是腰还行，摸起来很舒服很软，没有味道",2018-08-20 10:44:44
1438012,5,"面料非常舒服，剪裁修长但也不是收脚的那种，非常大方得体",2018-07-24 23:22:51
1438012,5,"很舒服，第一天穿不知道挂到什么东西了，脱了线",2018-06-01 22:39:58
1438012,5,"穿了一段时间了，面料柔软亲肤，有弹性。我喜欢穿大点的码，176\65.33码，穿起来宽松大方。很适合夏天穿。深浅各一条。",2018-08-04 13:08:06
1438012,5,"每次在严选买东西都会买两件，因为质量太好了！",2018-08-19 22:43:03
1438012,5,"面料舒适无比且富有弹性。身高174，腰围84，裤长正好不需修改。",2018-07-23 07:33:53
1438012,5,"在网易严选买了两件产品，都非常好。符合我的预期，裤子刚刚好，面料非常舒服。网易上的评价都很不错，值得参考。",2018-05-06 10:36:52
1438012,5,"真的不错，穿上有凉爽的感觉，超弹很舒服。176cm/79kg保险起见买了175/80A，不系腰带，稍微松一点，下次试试175/78A。",2018-07-31 21:59:41
1438012,5,"质量真心不错 有史以来最舒服的一条牛仔裤 客服服务也很到位 为严选点赞",2018-06-07 09:32:39
1438012,5,"换货很方便，严选效率挺高的。这条裤子不适合太瘦的人穿，穿起来没型。但是舒适度很不错的，春夏不太热的时候穿很好～",2018-07-06 12:37:54
1438012,5,"深蓝的穿了，感觉很好。但看着图片感觉浅蓝很不好看，犹豫了较长时间。买回来后发现浅蓝也挺好<U+0001F604>",2018-07-01 21:31:26
1438012,5,"哇塞好棒啊 太喜欢了 么么哒～(^з^)-☆",2018-08-20 23:48:53
1438012,5,"挺好穿的，软，弹性好。夏天穿稍微厚了点",2018-08-20 22:10:57
1438012,5,"这个裤子是我买的最满意的，也是我一直想买的颜色,很喜欢",2018-05-11 20:33:20
1438012,5,"照片不知道以后能不能补。穿上这个裤子感觉很舒服，柔软合身，薄薄的9也不闷热，感觉这个价格很值，以后买牛仔裤，就来这里了",2018-06-30 19:26:14
1438012,5,"这是老公主动要求买的第二条牛仔裤，稀罕，可见多喜欢",2018-08-18 07:02:10
1438012,5,"质量很好，穿着非常舒服，很满意的一次购物",2018-08-22 22:42:51
1438012,5,"173，78公斤，腰围完全合适，大腿略有点儿包身。以前在严选买的裤都是175一档的，看来这款确实偏大。面料舒服，整体感觉很好。",2018-05-17 16:02:52
1438012,5,"伸展自如，穿上自由自在，本人182cm,体重79kg，穿上贴身但不紧绷，布料很透气，36°的天气也不会觉得热，摸起来比较丝滑",2018-07-25 00:53:03
1438012,5,"很舒服的裤子，本人185，76kg，穿上略紧",2018-08-21 10:18:11
1438012,4,"面料很舒服，做工很精细，物超所值。唯一的遗憾，拉链就不能再长2公分吗？拉链再做长2公分你们就会亏本了吗？",2018-08-21 21:35:38
1438012,5,"大了，退了，担心越穿我，换小一码。",2018-08-22 08:36:30
1438012,5,"说是不分季节，这酷热的夏季是没法穿的。",2018-08-16 10:38:52
1438012,5,"很喜欢这条牛仔裤，式样好看，面料舒适，性价比高，服务周到物流给力！",2018-06-01 21:31:07
1438012,5,"173cm。70kg 30腰刚好，大腿有点紧还好面料有弹性",2018-07-28 19:25:50
1438012,5,"牛仔裤不错的，换了个号码，之前的太大了",2018-08-20 11:16:51
1438012,5,"尺寸买大一号，换小一号的，穿着舒服",2018-08-20 11:08:26
1438012,5,"非常好的裤子，好久没买牛仔裤了，冲着好评买的，但没有失望，就是我这短腿，裤子得列表171M  75K   选31",2018-06-08 23:13:41
1438012,5,"相同的尺码，这款裤子明显太大。客服效率太高了，闪退货退款。太满意了。",2018-07-20 08:08:25
1438012,5,"很不错，网易严选已成我第一选择，性价比高，衣服款式适合中国人身材～",2018-05-07 16:45:55
1438012,5,"材质很好，版型不错。穿着舒服，推荐购买！",2018-08-22 20:47:00
1438012,5,"贴身，不出汗的时候挺舒服。172/73 远32刚好。",2018-08-14 19:30:32
1438012,5,"非常合适，非常舒服，非常优质 ，超好的一次购物！",2018-08-21 22:06:33
1438012,5,"很满意的一次购物，质量超级棒",2018-08-23 07:14:01
1438012,5,"裤子刚到就试穿了下，果然很舒服，颜色正是自己想要的。尺码也合适，66公斤，170cm穿31的腰，一点也不紧，不想其他牌子的，得买32的。",2018-08-19 22:17:02
1438012,5,"很好穿，很舒服，柔软弹性好，绝对推荐",2018-08-22 19:31:58
1438012,5,"裤型不错，面料也很舒服",2018-08-23 11:46:44
1438012,5,"挺舒服的",2018-08-23 12:00:46
1438012,5,"一穿上立即感觉到凉爽，特别舒服",2018-08-22 22:04:00
1438012,5,"愿觉挺好，舒服的，还会购买！",2018-08-22 15:19:42
1438012,5,"裤子穿上很凉快，下蹲啥的很轻松",2018-08-20 16:02:45
1438012,5,"很舒服 裤子买的最值的一次",2018-08-21 22:02:28
1438012,5,"大小合适，很贴身，夏季穿的时候略热。",2018-08-21 21:55:23
1438012,5,"柔软.适合夏季，这次是回购",2018-08-22 23:29:38
1438012,5,"严选出品，值得信赖",2018-08-22 13:47:26
1438012,5,"严选出品，值得信赖",2018-08-22 13:47:24
1438012,5,"宅男着舒服",2018-08-22 14:37:43
1438012,5,"穿着很舒服",2018-08-22 06:21:03
1438012,5,"穿着很舒服",2018-08-22 06:20:41
1438012,5,"好，舒服，很",2018-08-22 08:34:52
1438012,5,"66666666",2018-08-22 23:26:36
1438012,5,"好",2018-08-22 10:12:46
1438012,5,"质量，包装，物流速度都非常好，有需要还会再来购买。",2018-08-05 11:29:55
1438012,5,"面料柔软亲肤，有弹力，不紧绷，版型正，值得推荐<U+0001F44D><U+0001F3FB>",2018-05-29 10:07:31
1438012,5,"很柔软的面料，非常舒服，180，80KG，33码很合适。",2018-08-12 19:51:13
1438012,5,"裤子弹力惊人，稍薄，适合夏天穿着，老爸很喜欢",2018-08-12 12:31:05
1438012,5,"布料的确很舒服，尺码标准，颜色好看，挺满意的",2018-08-19 08:42:47
1438012,5,"舒服，非常赞。有活动时再买",2018-08-21 23:37:03
1438012,5,"面料舒适没有坚硬的感觉，很好",2018-08-21 19:12:36
1438012,5,"是我买过最棒的牛仔裤",2018-08-21 18:31:44
1438012,5,"弹性好，穿着有凉裤意，必须好评",2018-08-20 22:22:09
1438012,5,"材质不错，试穿了下委舒服。",2018-08-21 12:44:00
1438012,5,"很舒服的裤子，柔软，透气。",2018-08-21 21:05:05
1438012,5,"很好的牛仔裤",2018-08-21 11:52:06
1438012,5,"好好穿",2018-08-21 02:28:50
1438012,5,"好好",2018-08-21 21:51:50
1438012,5,"舒服",2018-08-21 19:07:32
1438012,5,"舒服",2018-08-21 17:42:10
1438012,5,"非常舒服的衣服，非常完美的退换货服务，非常棒的购物体验",2018-07-24 18:45:05
1438012,5,"颜色很好，面料舒适，穿着有型，严选购物持续中毒中",2018-07-24 11:23:03
1438012,5,"质地柔软细腻，裤形修身美观，有黑色就再买一条",2018-08-04 14:11:35
1438012,5,"老公反应很舒服，就是他腿太粗了",2018-07-04 12:12:40
1438012,5,"据说，据穿的人说，这是有史以来最舒服的裤子",2018-08-11 12:40:02
1438012,5,"质量很好，穿着很舒服，快递很给力，",2018-08-18 17:13:31
1438012,5,"柔软舒适，颜色好，是直筒显瘦。一样的面料，比李维斯便宜多了。",2018-06-19 13:52:24
1438012,5,"裤子挺好的，买了好几条了。",2018-08-20 16:50:03
1438012,5,"大男大女大男大女你的",2018-08-19 15:40:06
1438012,5,"很不错，长腿的我再也不怕了",2018-08-19 09:02:16
1438012,5,"严选宝贝都还可以 不错",2018-08-20 22:47:24
1438012,5,"裤子很合适，穿着很舒服。",2018-08-20 22:11:38
1438012,5,"性价比超高，值得推荐！",2018-08-20 20:46:02
1438012,5,"质地有保障，值得拥有",2018-08-20 20:26:43
1438012,5,"材质很舒服，很薄",2018-08-20 11:04:36
1438012,5,"不错，就是偏大。",2018-08-20 08:07:58
1438012,5,"176cm，80kg。",2018-08-20 20:48:55
1438012,5,"好穿，很舒服！",2018-08-20 12:01:48
1438012,5,"挺不错的，好好",2018-08-20 08:16:52
1438012,5,"真的没失望",2018-08-20 16:26:15
1438012,5,"不错不错，物美价廉",2018-08-20 09:38:29
1438012,5,"非常柔软，好",2018-08-20 08:47:13
1438012,5,"物有所值。",2018-08-20 07:54:22
1438012,5,"非常满意",2018-08-20 22:01:23
1438012,5,"很舒服",2018-08-20 21:59:07
1438012,5,"非常好！！！",2018-08-20 10:11:47
1438012,5,"不错",2018-08-20 21:08:42
1438012,5,"质量没得说，秒杀各大品牌",2018-08-19 21:15:46
1438012,5,"舒服，时尚，就是老公觉得太年轻了",2018-08-19 11:38:23
1438012,5,"质量不错，做工紧致，很满意的",2018-08-19 15:33:07
1438012,5,"再薄点就更好了",2018-08-19 19:00:18
1438012,5,"这个问题给联系一下有两弹一星",2018-08-19 16:32:03
1438012,5,"很舒适 软软的 颜色有点浅",2018-08-19 16:23:28
1438012,5,"适合夏秋时节穿 布料软舒适",2018-08-19 12:32:31
1438012,5,"非常舒服，质量也好",2018-08-19 22:53:55
1438012,5,"非常舒适的牛仔裤",2018-08-19 18:03:27
1438012,5,"很好",2018-08-19 11:03:42
1438012,5,"真好",2018-08-19 08:36:37
1438012,5,"非常喜欢",2018-08-19 07:48:15
1438012,5,"很柔软，裤型能再宽松些就更好了。",2018-08-14 10:49:06
1438012,5,"裤子很有弹性，真的很舒服。而且比较薄，很透气，夏天感觉都可以穿。这个高弹性的裤子找了好久，终于找到，真的值得推荐。",2018-05-14 17:37:42
1438012,5,"弹力十足！比较贴身，版型不错，很实惠！",2018-08-18 12:54:02
1438012,5,"非常不错的裤子，，支持严选",2018-08-18 22:56:24
1438012,5,"弹性很大，穿起来舒服",2018-08-18 11:53:48
1438012,5,"很舒服，有弹性无阻力",2018-08-18 17:38:14
1438012,5,"很舒服，弹力足无负担",2018-08-18 17:37:43
1438012,5,"非常好 值得购买",2018-08-18 19:14:29
1438012,5,"裤子质量不错",2018-08-18 18:05:30
1438012,5,"舒服",2018-08-18 20:36:34
1438012,5,"裤子穿的挺舒服的，版型也不错",2018-08-16 14:40:11
1438012,5,"质量很好，到货很快",2018-08-17 21:19:07
1438012,5,"宝贝很好，穿着舒服",2018-08-17 11:47:57
1438012,5,"说真很好",2018-08-17 00:35:46
1438012,5,"质量很好",2018-08-17 23:14:10
1438012,5,"非常满意",2018-08-17 21:27:14
1438012,5,"质量不错",2018-08-17 12:12:00
1438012,5,"好好好！",2018-08-17 07:42:21
1438012,5,"舒服",2018-08-17 22:36:49
1438012,5,"喜欢",2018-08-17 11:44:55
1438012,5,"好评",2018-08-17 11:29:27
1438012,5,"尺码很合适，布料有弹性也好舒服，裤型很赞。",2018-08-12 10:35:02
1438012,5,"触摸很舒适，就是裤腿有点长，要改裤腿",2018-05-25 10:26:33
1438012,5,"很满意，上手摸了一下，很舒服，回家洗洗再穿哈。",2018-08-07 15:32:10
1438012,5,"太赞了，已经是严选的第六条牛仔裤了",2018-08-16 21:57:39
1438012,5,"非常好的料，下次有新款还买。",2018-08-16 09:32:30
1438012,5,"给他买的，还没试穿",2018-08-16 23:36:51
1438012,5,"完全满意 老爹说有弹性 穿上特别舒服",2018-08-15 23:12:19
1438012,5,"质量不错，性价比高。",2018-08-16 21:07:36
1438012,5,"换货快捷！全五分！",2018-08-16 20:41:54
1438012,5,"柔软舒适 裤型也不错",2018-08-16 07:55:24
1438012,5,"非常柔软，穿着舒服",2018-08-16 17:56:23
1438012,5,"手感好，质量不错",2018-08-16 23:59:26
1438012,5,"第二次回购了",2018-08-16 23:33:41
1438012,5,"很好很不错",2018-08-16 20:01:01
1438012,5,"裤子很舒服",2018-08-16 05:52:58
1438012,5,"很好",2018-08-16 23:49:48
1438012,5,"确实舒适",2018-08-16 19:07:10
1438012,5,"挺不错",2018-08-16 15:09:55
1438012,5,"很舒服",2018-08-16 05:53:13
1438012,5,"有点小，换了大一号的，服务不错，产品也行！",2018-08-11 16:55:58
1438012,5,"为儿子买的，他穿着感觉很好，还想再买一条",2018-07-04 11:12:43
1438012,5,"柔软，穿上舒服。第一次在严选买东西。包装也很好",2018-08-06 15:42:24
