"itemId","star","content","createTime"
1450007,5,"孩子非常喜欢这个新课桌买回来，居然就变成了一个新的吃喝玩乐的场所，严选的品质很不错，希望能继续保持。目前为止是我所知道的性价比最高的儿童桌椅。",2018-03-04 17:13:35
1450007,3,"搭配的LED灯时好时坏，有时无法打开，有时无法关闭，有时无法调档，灯装在桌子的地方，根本不匹配。
桌子质量一般，味道是没有，但已经有很明显的裂痕。刚买没多久！
网易严选给我的感觉是东西越来越差，服务也是。
天下乌鸦一般黑，小米有品商城的东西也是。经常买到质量不好的东西。",2018-05-03 18:30:25
1450007,5,"质量好！完全没有味道！很漂亮",2018-03-06 00:18:44
1450007,5,"书桌非常好，很有质感，无异味。有灯的设计实用。儿子很喜欢，他问我：妈妈你小时候要是有这样一个书桌会不会也很开心？开心，那时候会开心爆了吧",2018-03-02 08:53:28
1450007,5,"完美质量！好好好",2018-03-04 14:41:11
1450007,1,"质量太差，用不到三个月，塑料竟然裂了",2018-06-28 17:22:15
1450007,1,"有两个螺丝柠不上，找了客服，说了问题，第一个客服让我等一下，然后就不理我了。第二个客服，说让我等两天，结果一周过去了。第三个客服，我希望不是石沉大海，结果一周过去了，还杳无音信。。本来对严选挺有好感，可是客服真的挺无语。",2018-04-22 22:25:52
1450007,5,"性价比超高的学习桌",2018-03-03 16:57:52
1450007,3,"用了没多久，台灯就坏掉了",2018-06-08 21:19:15
1450007,5,"严选的东西真的没话说，从来不用担心质量，外观清新洋气，毫无异味，安装简单，我一个小时安装了两套，女儿很喜欢，物超所值，提醒大家安装之前一定要看安装视频，这样很省时间。真心觉得找到了好地方，再也不用浪费时间满宝淘东西了，你们懂的，嘿嘿",2018-03-03 17:52:23
1450007,2,"凳子一坐就往下沉，根本卡不牢，老是要把螺丝拧开调高度，凳子才刚装上有个塑料卡扣不知怎么就裂了，桌子也是稍微一撑就往下沉，这种质量真是对不起这个价，昨天拿回来孩子爸装了好久才组装好，想退货又要拆掉寄回，真是麻烦死了<U+0001F621>",2018-06-24 17:48:26
1450007,5,"装起来不是很麻烦，东西不错。物美价廉！",2018-03-02 22:46:39
1450007,5,"质量非常好，用的，京东快递特别快",2018-06-03 17:37:55
1450007,5,"好好好好好好好好好好好好好好好好好好好好好好好好好好好好好好好好好好好好好好好好好好好好好好好好",2018-08-03 22:34:41
1450007,5,"组装很方便，调节高度也很方便，主要是宝贝很喜欢。质量很好，不是2，3百的可以比的。",2018-07-29 10:17:56
1450007,5,"用了一段时间才来评价，儿子非常喜欢，老公本来反对买的，看到质量这么好也没话说了^_^",2018-07-17 19:42:03
1450007,5,"性价比超高，更重要的是没味道，没味道，没味道，升降操作很方便，还带个台灯，灯光柔和。",2018-07-15 09:06:15
1450007,5,"简单实用，质量完全符合要求，就喜欢严选这种不求多但求性价比的feel",2018-08-21 08:20:55
1450007,5,"好用，方便。小朋友喜欢，充分利用空间，倾斜桌面画画很舒服。只是椅子液压称重力不大，成年人容易坐松",2018-07-02 16:07:37
1450007,1,"这破质量也就不说啥了，螺丝口又小又歪螺丝拧不上，下面的折页也是歪的，造成上面的缝儿宽窄不同，费劲装上懒得拆了换或者退了。便宜也不是这个便宜法。要是觉得不赚钱就不要卖，那这种烂东西卖，还要不要脸",2018-04-13 20:52:43
1450007,5,"安装方便，质量也好，宝贝很喜欢<U+2764><U+FE0F>",2018-06-18 10:25:20
1450007,5,"一直放在购物车里，等到618出手啦。分量挺足的，没什么味道，孩子坐上去看书写字都不错",2018-06-21 07:45:33
1450007,5,"活动价恢常划算，还没有安装，效果等安装了在评价，不过相信严选的质量和口碑！",2018-08-08 10:29:57
1450007,5,"很赞的桌子，女儿很喜欢，可以随着年龄调节桌子和椅子的高度，木材感觉厚实有质感，严选没有辜负我们的期望！",2018-06-18 00:35:40
1450007,5,"包装很好，没有破损，安装也比较方便，小部件已经安装好，大的地方在组装一下就可以了。",2018-06-01 19:52:54
1450007,5,"装了一个多小时完成，桌子稳稳的，孩子很喜欢，以后学习有专门的桌子了。",2018-08-22 10:08:08
1450007,5,"安装方便，简洁美观，无异味。大人孩子都很满意。但护眼灯的开关有问题，经常触摸后没反应。",2018-05-10 21:57:26
1450007,5,"我外甥女告诉我说非常喜欢，送给一年级的小朋友入学礼物相当合适了。特别棒，还有灯！",2018-06-22 20:41:07
1450007,5,"性价比太高了，做工质量非常好，孩子非常非常喜欢，组装难度不大，严选太赞了",2018-07-12 11:06:46
1450007,5,"质量不错，没有味道，组装还算简单，孩子也很喜欢，台灯感觉稍微差了点。",2018-08-20 10:14:46
1450007,5,"商场里都卖2000+，一个灯都起码两百，这东西价廉物美，囤货以后小孩长大再用",2018-06-22 18:20:36
1450007,5,"桌子已经收到了，小孩子非常满意，质量挺好的，没有什么味，严选的产品就是放心。",2018-06-19 14:56:22
1450007,5,"给大外甥买的，昨天刚组装起来，妹妹说非常结实，用料不错，没有异味，很好",2018-07-15 21:58:08
1450007,5,"学习椅安装完后有点摇摇晃晃的，不稳。只好把后头的两个螺丝松松才好点，所以说设计有点不合理。",2018-07-02 16:40:15
1450007,5,"质量很好，安装很简单，可惜当时粉色的没有货，只好买了蓝色的",2018-08-21 23:07:12
1450007,5,"桌椅不错，安装也算方便。椅子如果是市面流行的那种带软座垫 背部有支撑效果的话就更完美了。",2018-04-05 17:21:20
1450007,5,"这次到货后马上下单了，买到后，一如既往的好，没异味，孩子很喜欢，我也满意。",2018-05-09 23:55:04
1450007,5,"性价比高，比较满意的一次网购  “好的生活，么那么贵&#34; 比较贴切",2018-06-28 15:36:14
1450007,5,"质量不错，严选有毒，日常用品基本能买到的都在这买了",2018-08-18 21:16:09
1450007,5,"学习桌已经拼装好，椅子有点不稳，但是也不影响使用，细节做的也不错，性价比很高",2018-05-22 10:46:40
1450007,5,"满意，孩子收到很喜欢，坐着认真写字。之前就想买，但一直没货，这次活动有货了，果断买了，价格优惠",2018-04-14 11:30:06
1450007,2,"总体质量还不错，就是椅子调节高度后拧紧螺丝还是控制不住，结果滑丝了，也懒得跟客服联系了，严选的东西质量也没有保证了，最后一次在严选购物了，很失望。",2018-06-16 20:37:33
1450007,5,"感觉性价比不高，与想象的质量水准有差别。",2018-07-01 10:04:30
1450007,5,"质量非常好，利用率很高，自从有了这个书桌，儿子都爱学习了，哈哈哈<U+0001F604>",2018-06-04 15:05:18
1450007,5,"这个感觉非常不错，我都有打算再买一个，用来做电脑桌，真的坐姿很舒服",2018-04-15 16:01:15
1450007,5,"桌子很不错，服务很好，因为安装时候不小心把一个配件弄坏了，客服马上联系就把配件送过来了，免费的，五星赞<U+0001F44D><U+0001F44D><U+0001F44D>。相信严选的品质。",2018-07-01 12:10:46
1450007,5,"螺丝不是很好装，好在家里工具齐全，要不用手估计得起泡。但是装好后东西很好用，物有所值哦",2018-05-23 19:51:38
1450007,5,"非常好用！不比三千大洋的桌子差多少！现在就是严选的忠实粉丝",2018-07-16 11:34:01
1450007,5,"拼好了，还是挺满意的，小朋友也新鲜的不行哈哈哈。唯一不足的是选的快递公司服务不好，不愿意送楼下。",2018-05-22 18:42:47
1450007,5,"安装过程有点费时，不过小朋友很喜欢，以后写字看书就可以要求端正姿势了！",2018-06-18 11:45:43
1450007,5,"做工精细，安装方便，宝贝迫不及待坐着，背部挺得直直的开始画画儿了",2018-06-16 15:32:32
1450007,5,"质量好，功能性强，性价比高，很实用，桌子、椅子、台风一套就齐全了。",2018-07-09 19:02:34
1450007,5,"不与某宝比价的话，这个很不错。就是椅子没垫子硬了点。",2018-05-19 07:54:20
1450007,5,"早就看好了，一直种草，现在终于拔草，送儿子的生日礼物。",2018-08-09 23:45:07
1450007,5,"用了几个月了，感觉挺好的。儿子也很喜欢，满意。",2018-08-18 10:34:27
1450007,5,"很合适小户型，给一年级小朋友准备的，安装也不复杂，满意",2018-08-05 21:27:18
1450007,5,"桌子很重，很稳，就是桌面调节好后需要手动转紧有点麻烦,其他都很满意，宝妈安装也不费力。",2018-08-06 20:30:04
1450007,5,"品质做工很好，没有味道，不算大，没有太多放书的位置。比起市面上动辄几千块的学习桌，这个价格很超值了。",2018-05-04 09:24:35
1450007,5,"很好，虽然感觉安装的时候有些误差，总算装上了，样子不错，没有味道，比较满意",2018-05-13 22:19:55
1450007,5,"材质很好，没有味道，很重，安装方便，大小合适不占地方。满意。",2018-08-03 10:28:05
1450007,5,"很好啊，价格优惠，质量不错，小小的学习桌不占地方",2018-08-13 16:36:26
1450007,3,"质量还行 组装不难但是比较反人类 还有个螺丝有毛病 不带螺丝刀",2018-06-09 20:50:06
1450007,5,"物流很好",2018-08-20 11:37:57
1450007,5,"好",2018-08-23 11:35:34
1450007,5,"这是我在严选买的最糟心的一件产品！以前对严选的质量是一万个放心，所以看到有学校桌，想都没想就下单了！接着糟心的事情就一件件来了，起初是椅子的问题，一坐就往下沉，一个孩子能有多重？ 问客服说能不能单换个椅子，客户说要全部退回去全部换，好容易全部装好了，在拆了再退回去……我说算了吧，后续我们再买个椅子吧！可是没过多久，触摸灯又不亮了，基本装好了就没用过，想等着开学了在用……愁死了…又问客服…这次单寄了个灯！
这么忠实的客户，严选呀…千万别伤了我们…",2018-08-23 10:57:40
1450007,5,"质量很好，安装也方便。孩子非常喜欢。",2018-08-22 10:09:46
1450007,4,"质量不错 性价比高 灯的插口很紧 很难插进去",2018-07-10 18:57:05
1450007,5,"质量非常好，性价比高。",2018-08-22 11:02:34
1450007,5,"不错，很满意。",2018-08-22 08:48:10
1450007,5,"性价比高，坐姿合适，安装简单。",2018-08-21 11:19:09
1450007,5,"做工很精细，满意",2018-08-21 12:54:21
1450007,5,"很好",2018-08-21 21:53:48
1450007,5,"还可以",2018-08-20 13:16:06
1450007,5,"不错，物美价廉",2018-08-20 00:28:48
1450007,5,"装起来花了点时间，质量真的没话说！",2018-08-15 21:45:29
1450007,5,"花了二十分钟慢慢组装，要是椅子带滚轮就更好了",2018-08-10 23:47:45
1450007,5,"质地非常厚实，没有异味，儿子非常喜欢！",2018-08-19 12:08:49
1450007,5,"有点小问题，已经基本解决，客服服务不错，总体比较满意，希望注意细节，越做越好",2018-05-19 12:54:25
1450007,5,"货到了，和描述的很相符，好卖家!",2018-08-16 13:51:01
1450007,5,"安装方便，快递小哥负责",2018-08-18 16:31:36
1450007,5,"学习桌简单舒适，性价比高.",2018-08-17 22:34:20
1450007,5,"用了合适",2018-08-17 10:07:49
1450007,5,"好",2018-08-17 18:45:04
1450007,5,"sdfasfasdfas阿尔发送到发是打发违法",2018-08-16 01:34:09
1450007,5,"很好，非常满意!",2018-08-16 13:50:58
1450007,5,"终于收到我需要的宝贝了，东西很好，价美物廉，谢谢掌柜的！说实在，这是我淘宝购物来让我最满意的一次购物。无论是掌柜的态度还是对物品，我都非常满意的。掌柜态度很专业热情，有问必答，回复也很快，我问了不少问题，他都不觉得烦，都会认真回答我，这点我向掌柜表示由衷的敬意，这样的好掌柜可不多。再说宝贝，正是我需要的，收到的时候包装完整，打开后让我惊喜的是，宝贝比我想象中的还要好！不得不得竖起大拇指。下次需要的时候我还会再来的，到时候麻烦掌柜给个优惠哦",2018-08-15 15:43:30
1450007,5,"这套书桌质量真的很好 很结实 分量也挺沉的 粉色很漂亮 还可以调节高度 记得有次听一个教授的讲座 她说中国小孩就适合坐硬板凳 从古到今",2018-08-08 07:11:07
1450007,5,"质量不错。如果抽屉做成封闭的就完美了",2018-08-13 09:06:05
1450007,5,"去商场转了一圈，这个确实性价比超级高，组装很容易，儿子超级喜欢。不过有点小瑕疵，我的文具盒盖有点盖不上，但很快客服已经联系商家换零件处理，服务很好",2018-08-15 15:31:50
1450007,5,"非常棒",2018-08-14 14:55:33
1450007,5,"挺好",2018-08-14 14:46:43
1450007,5,"满意，相当的好，不错<U+0001F44D>",2018-08-13 03:01:51
1450007,5,"质量不错陪孩子慢慢长大",2018-08-13 16:06:57
1450007,5,"好评，大小合适，孩子喜欢",2018-08-13 17:10:54
1450007,5,"货到了，质量很不错，支持下~",2018-08-12 15:43:26
1450007,5,"满三岁即将入园的小朋友说非常喜欢，安装不繁琐，几个步骤就完成，就是螺丝稍微难上了点，需要借助其他工具。桌子很重，质量挺好的，粉色部分是硬胶质感，比较安全。就是有一点比较后悔，应该买蓝色，因为给女儿看照片的时候，她第一选择是蓝色，我引导式的让她选了粉色，而且蓝色看起来会沉静一些，对于读书写字比较适合。由于自己小时候的缺失，毅然给女儿（自己）选了粉色弥补，其实小孩子也不应该用颜色来区分性别，太女孩容易娇气矫情，她自己喜欢才是好。",2018-08-12 22:15:53
1450007,2,"桌子的抽屉有问题。对不到槽的轨道里。",2018-08-18 21:37:49
1450007,5,"儿子很满意",2018-08-12 23:02:36
1450007,5,"很好",2018-08-12 22:29:56
1450007,5,"设计人性化合理，性价比高。没有味道。大人小孩都喜欢",2018-08-02 16:48:49
1450007,5,"给孩子买的，还不错",2018-08-11 18:37:14
1450007,5,"试试看 应该还可以的",2018-08-11 00:26:36
1450007,5,"可以，没味道",2018-08-11 06:21:53
1450007,5,"好",2018-08-11 17:55:49
1450007,5,"好",2018-08-11 13:53:07
1450007,5,"非常好，非常喜欢，没有气味，健康！",2018-08-10 21:26:43
1450007,4,"台灯开关很魔性 所谓的触控完全摸不准 按半天不亮灯 所谓的亮度调节完全不受控制 桌子椅子都还好 台灯差评",2018-08-12 12:20:20
1450007,5,"用了一段时间了，很好，也很牢固。",2018-08-09 12:25:01
1450007,5,"不错，宝宝喜欢",2018-08-09 14:54:10
1450007,5,"还可以",2018-08-09 19:22:21
1450007,5,"还没用",2018-08-08 23:48:32
1450007,5,"很漂亮 质量也蛮好的！很好安装",2018-08-06 08:48:41
1450007,5,"桌子不错！",2018-08-07 19:51:35
1450007,5,"书桌安装完了太漂亮啦！大赞<U+0001F44D>，物美价廉。孩子今年上学，调的最矮一层，做上刚刚好，以后还会光顾的，",2018-04-13 16:42:06
1450007,5,"挺好用，很结实，娃挺喜欢",2018-08-06 21:38:20
1450007,3,"打开包装，桌面的味道特别大。大物件，懒得退了，只能多注意房间通风
通风不好的房间建议别买！
给严选一个建议：桌面采用E0级面板",2018-06-21 20:57:10
1450007,5,"东西很好，价格出人意外的便宜。",2018-08-05 23:44:38
1450007,4,"如果能包括安装就好了",2018-08-05 17:27:33
1450007,5,"非常好质量不错",2018-08-05 19:34:34
1450007,5,"桌子不错，小孩喜欢",2018-08-05 13:12:43
1450007,5,"很好",2018-08-05 16:11:13
1450007,5,"女儿很喜欢，好用",2018-08-04 00:59:00
1450007,5,"安装太麻烦退了",2018-08-08 11:49:14
1450007,5,"挺好的",2018-08-04 21:13:08
1450007,5,"质量还不错",2018-08-04 09:43:32
1450007,5,"hao",2018-08-04 14:48:09
1450007,5,"老大非常喜欢 老二看了也想要 那就再买个粉的",2018-06-23 00:13:24
1450007,5,"看起来和书店的一千多的差不多，还没用，感觉质量很好",2018-07-18 12:44:56
1450007,5,"在网易严选买了好多家居用品，质量好性价比高！",2018-07-25 10:52:39
1450007,5,"终于拿到啦~~好开心那!",2018-08-03 13:28:15
1450007,5,"不错哦",2018-08-03 22:02:32
1450007,5,"质量挺好，大人也能用，好评",2018-08-02 09:03:03
1450007,5,"东西很实惠哦，支持卖家",2018-08-02 16:13:36
1450007,5,"质量不错，没异味，孩子喜欢",2018-08-02 07:37:23
1450007,5,"质量非常棒，与商场上千元的学习桌媲美",2018-07-30 07:28:11
1450007,5,"非常棒的学习桌子，质量很不错，很喜欢",2018-07-31 11:31:12
1450007,5,"非常满意 女儿也非常喜欢",2018-08-01 20:36:54
1450007,5,"今年东南西北休息吧",2018-08-01 16:30:28
1450007,5,"好",2018-08-01 16:11:09
1450007,5,"好",2018-07-31 22:50:53
1450007,5,"物流很快，除了组装不是很容易外，其他都挺好的，换了一次货，售后服务挺好！",2018-08-07 18:25:56
1450007,5,"非常不错",2018-07-30 23:03:14
1450007,5,"货已收到，还没有安装",2018-07-29 03:54:52
1450007,5,"好",2018-07-29 09:19:19
1450007,3,"买的时候比较贵，而且有一个螺丝歪了，客服说可以退货，这么复杂大件打开了装回去费劲了，工艺有待提高，忠实粉又被家人鄙视了",2018-08-01 12:33:22
1450007,5,"看上去不错，孩子也喜欢～高低角度都可调，关键还便宜，性价比高！",2018-05-30 16:30:21
1450007,5,"很好用，买了两个，外甥一个，宝宝一个",2018-07-26 19:16:01
1450007,5,"安装简单，没有味道，很好",2018-07-28 21:49:54
1450007,5,"你自己却不知道。。",2018-07-28 16:27:58
1450007,5,"非常超值",2018-07-28 16:11:11
1450007,5,"质量很好！ 调节角度的设计能再方便一点就完美了",2018-07-11 06:12:11
1450007,5,"质量很好 很牢固，对学习好",2018-07-27 01:58:49
1450007,5,"儿童学习桌质量不错，安装也方便，我家孩子6岁，用起来挺合适。虽然与一两千元的学习桌比起来简单很多，功能也少了很多，但我个人觉得对于5-8岁的孩子应该够用了。儿童学习桌质量不错，安装也方便，我家孩子6岁，用起来挺合适。",2018-07-27 10:33:18
1450007,5,"女儿很喜欢。之前用过几张桌子了，都不及这个设计科学，做工和质感都是挺好的，自带的台灯真是不要太好用了。强烈推荐！！！",2018-07-05 21:44:19
1450007,1,"安装有些复杂，而且高度固定不住，老滑下来。感觉非常失败的一次购物",2018-07-29 22:30:42
1450007,1,"相信严选的质量，可是椅子组装完了，居然不是平的，放在屋里好几个地方都实验了，一直在晃，只能自己想办法垫一个角！",2018-07-26 22:41:10
1450007,3,"性价比高，质量也还可以！我买的桌子有个钢梁固定歪了，螺丝都被带出来了！估计是中奖啦！",2018-07-30 01:24:41
1450007,5,"说书桌质量很好，非常满意！",2018-07-25 11:16:38
1450007,5,"东西不错，简洁耐用！",2018-07-25 16:59:26
1450007,5,"质量很好，女儿很喜欢<U+0001F60D>",2018-07-24 14:00:12
1450007,5,"好好好好好好好好好好好好质量好",2018-07-24 10:37:57
1450007,5,"价格便宜 就是凳子硬点",2018-07-24 23:37:53
1450007,5,"很好",2018-07-24 09:18:45
1450007,5,"灯坏了，售后挺好，就是这个灯只能开不能关，有待提升，哈<U+0001F604>",2018-07-28 05:46:16
1450007,5,"好",2018-07-24 14:15:30
1450007,5,"好",2018-07-24 14:11:23
1450007,5,"颜色好看质量过硬。比市面上的学习桌好多了，性价比很高。",2018-05-04 18:50:46
1450007,5,"好",2018-07-23 08:08:00
1450007,3,"收到桌子腿上那个支撑架子有个螺丝拧不住，把旁边本来拧好的螺丝拆下来试也不行，这个应该是孔的问题。虽然少了这颗桌子也不会站不住，毕竟新的看着总不舒服。跟客服反映后客服说可能要寄回去看下，过了几天就默默地寄过来几个新螺丝。",2018-07-09 14:29:56
1450007,5,"东西不错，孩子已经用起来了",2018-07-22 09:17:43
1450007,5,"孩子很喜欢",2018-07-22 14:58:00
1450007,5,"好",2018-07-22 13:28:26
1450007,5,"儿子特别喜欢",2018-07-21 23:59:54
1450007,5,"挺不错<U+0001F60A>",2018-07-20 15:15:32
1450007,5,"好",2018-07-20 21:02:37
1450007,5,"ffnjnvvvbnjnjjj",2018-07-20 07:15:48
1450007,5,"小朋友喜欢，没有味道。台灯有点味道，散两天就好了",2018-07-15 14:28:23
1450007,5,"性价比较高，质量也不错",2018-07-19 09:14:51
1450007,3,"家里两个孩子，买了两套。
好的地方：塑料部件确实没味，桌面也不错。
不好的地方：可能是制作工艺精度的问题，装配起来不太容易（有个凳子的螺丝甚至滑丝了），而且装完后，很容易不对称，导致四个角高低不平（需要调节脚垫旋钮），或者抽屉滑轨完全滑出时，有一边几乎快脱落了。
因为装完了实在懒得拆下来，所以犹豫是否要换货。",2018-08-03 08:15:52
1450007,5,"孩子很喜欢！",2018-07-19 12:06:15
1450007,5,"不错 值得购买",2018-07-19 10:24:25
1450007,5,"质量很好",2018-07-19 09:21:44
1450007,5,"挺好",2018-07-19 22:21:06
1450007,5,"好",2018-07-19 14:17:11
1450007,5,"质量很好，没有味道，有份量。严选果然让人放心<U+2764>",2018-07-02 11:58:03
1450007,5,"用料非常赞，完全没异味，扎实稳固，设计大方实用。凭心而论，细节精细程度还有提升空间，比如椅子应该多配几个螺丝胶垫，杜绝咯吱声。但是对比淘宝上动辄就几千的产品来讲，没什么理由不买这个。",2018-07-08 10:44:46
1450007,5,"超级赞，推荐邻居友买了两个",2018-07-17 22:34:18
1450007,5,"质量很好，配的灯也不错，整体设计很合理，真是物美价廉。",2018-06-21 18:27:06
1450007,5,"很好 物流快 东西质量也好 宝宝很喜欢",2018-07-15 13:50:40
1450007,5,"质量杠杠的！孩子超级无比喜欢！",2018-07-17 17:23:15
1450007,5,"真心不错",2018-07-17 13:24:31
1450007,5,"还不错",2018-07-17 10:24:58
1450007,5,"很结实，简洁大方，功能强大，升高后大人也能用，满意",2018-07-08 17:28:49
1450007,5,"真不错，小朋友特别喜欢，也喜欢学习了",2018-07-16 08:25:17
1450007,5,"很满意",2018-07-16 17:07:14
1450007,5,"还比较好的，唯一的缺点是灯不够亮，小朋友可能需要再加一个灯",2018-07-13 22:54:23
1450007,5,"质量不错",2018-07-15 20:03:27
1450007,5,"好",2018-07-15 12:36:57
1450007,5,"好",2018-07-15 12:36:51
1450007,5,"质量很好，有分量，做工也精细，儿子也很喜欢，",2018-07-10 14:41:21
1450007,5,"挺好的，宝贝有做作业的地方了，组装容易",2018-07-10 11:29:02
1450007,5,"周年庆买挺划算的，做工精细",2018-07-14 19:41:40
1450007,5,"不错。质量也很好。",2018-07-14 14:16:07
1450007,5,"桌子很好，没有一点味道。安装也很方便，一个人半小时搞定，细节处理的很好，看螺丝钉就能看出来，质量绝对过硬。很满意，严选从来不会让人失望，总会让你有惊喜<U+0001F44D><U+0001F44D><U+0001F44D>",2018-07-13 18:17:39
1450007,5,"孩子很喜欢！",2018-07-13 10:02:52
1450007,5,"快递小哥超超超超超好，这么重的桌子给抬到家。",2018-07-16 15:04:16
1450007,5,"非常好",2018-07-13 08:50:55
1450007,5,"不错",2018-07-13 15:39:41
1450007,5,"质量没得说，没有一丁点味道，非常棒！！！",2018-07-12 09:33:16
1450007,5,"质量很不错，可以从幼儿园用到高中了",2018-07-12 18:06:08
1450007,5,"质量不错，挺结实",2018-07-12 08:32:02
1450007,5,"组装起来，看起来结实，宝宝很喜欢，没有味道",2018-07-11 08:34:23
1450007,5,"好用，价格适中，值得推荐",2018-07-11 12:26:23
1450007,5,"不错，没有味道，做工好！",2018-07-11 18:02:31
1450007,1,"呵呵给了个10几块红包让我用，现在降价九十，申请价格保护又说我用过红包不符合条件，我就呵呵了",2018-07-14 20:37:52
1450007,5,"用料结实厚重，安装方便",2018-06-27 09:37:37
1450007,5,"第二次购买。不错",2018-07-11 20:23:00
1450007,5,"非常好，就是装起来有点累",2018-07-16 22:32:12
1450007,5,"用这个，很不错！高矮可调节，非常方便！孩子喜欢！",2018-07-08 23:10:28
1450007,5,"第二次拍下，儿子也很满意",2018-07-10 11:09:46
1450007,3,"桌椅的各4条腿的套扣全有问题，很容易上偏，我这动手能力强的都装了1个多小时，而且椅子不平，要调节很高才平衡，台灯也晃，抽屉滑轨缝大，桌椅用料和外观做工没问题，但安装细节不好，整体评价一般",2018-07-15 21:11:37
1450007,5,"三档调节很有人性",2018-07-10 23:54:35
1450007,5,"非常满意，女儿喜欢",2018-07-10 11:09:05
1450007,5,"做工不错。",2018-07-10 22:50:42
1450007,5,"感觉书桌适合孩子读书和写字，外观也漂亮。",2018-07-09 16:18:57
1450007,5,"产品很不错，安装也比较简便",2018-07-08 13:24:40
1450007,5,"安装简易，质量挺好。",2018-07-08 18:04:26
1450007,5,"好用，孩子很喜欢，经常自己做好了好好看书写字",2018-06-21 07:17:32
1450007,5,"实惠，性价比高，质量很好",2018-07-06 15:10:45
