"itemId","star","content","createTime"
1450007,5,"还是不错的，很好",2018-07-06 10:43:18
1450007,5,"质量好价格出",2018-07-06 14:35:48
1450007,5,"第二次购买！十分满意，不仅速度快，服务好，质量还信得过。",2018-07-01 23:13:11
1450007,5,"包装完好，送货及时。按照说明书中所说步骤进行安装完全没问题。包装中附带小工具仅内六角好用，但小扳手不行。最好自己再准备一把十字螺丝刀，一把小扳手。颜色漂亮，桌椅高度可调，选材非常结实耐用，台灯是触碰开关，亮度三档可调，LED光源。值得拥有，孩子很喜欢。",2018-07-07 14:02:28
1450007,5,"质量不属于商场几千块的，值。安装也很简单",2018-07-03 15:09:04
1450007,4,"凳子脚不平",2018-07-05 21:45:19
1450007,5,"好好好",2018-07-05 14:33:38
1450007,5,"质量非常好！无异味！",2018-07-04 22:22:39
1450007,5,"m目前看起来，还不错用料扎实，希望使用起来也不错哦",2018-06-18 23:35:16
1450007,5,"特别好，安装非常方便。还带一个灯，没有想到，意外的惊喜，孩子身高115，现在用最低档，很开心也很喜欢，质量没得说，强力推荐",2018-04-23 22:49:13
1450007,5,"感觉还不错，宝宝还蛮喜欢的",2018-07-03 14:25:22
1450007,5,"孩子很喜欢",2018-07-03 10:27:33
1450007,5,"东西还不错的。就是安装的过程当中有点小插曲。升价需要两个人手工抬起来的，这个有点不舒服。",2018-03-18 15:19:58
1450007,5,"质量不错，孩子很喜欢。",2018-07-02 19:36:55
1450007,5,"好用，没味道",2018-07-02 11:08:50
1450007,5,"质量很好",2018-07-02 18:19:15
1450007,5,"虽然换成粉色了，但是依然很赞",2018-07-01 11:00:37
1450007,5,"还没打开，不知道啥样子的",2018-07-01 17:31:46
1450007,5,"颜值担当 孩纸喜欢 很实用",2018-07-01 13:18:18
1450007,5,"不错不错不错<U+0001F44D>",2018-07-01 21:22:48
1450007,5,"很好",2018-07-01 23:09:51
1450007,5,"美观实用",2018-07-01 16:54:28
1450007,5,"补货果断下手，没有异味，表面顺滑，设计合理，儿子小学6年的好伙伴",2018-04-14 09:24:58
1450007,5,"非常好，很满意",2018-06-30 21:20:00
1450007,5,"小孩好喜欢，争着坐",2018-06-29 09:28:34
1450007,5,"外甥女很喜欢呢！！",2018-06-29 09:47:07
1450007,5,"组装简单，孩子喜欢",2018-06-29 08:32:15
1450007,5,"孩子很喜欢",2018-06-29 17:36:52
1450007,5,"质量不错，很满意。",2018-06-28 16:55:01
1450007,5,"很好",2018-06-28 21:32:55
1450007,5,"很满意",2018-06-28 20:35:06
1450007,5,"买过多次了，性价比高",2018-06-27 09:49:50
1450007,5,"小朋友很喜欢",2018-06-27 22:53:31
1450007,5,"还没组装，后期追评，物流快",2018-06-26 21:00:14
1450007,5,"孩子非常喜欢",2018-06-26 13:44:40
1450007,5,"赞",2018-06-26 19:27:43
1450007,5,"桌子很不错，没有味道，组装也很简单。",2018-06-25 10:36:40
1450007,5,"性价比很高，又介绍朋友买了一个",2018-06-23 22:32:56
1450007,5,"很棒的学习桌，实用质量好",2018-06-25 10:46:53
1450007,5,"何必就是看看上课上课",2018-06-25 22:36:44
1450007,5,"不错",2018-06-25 10:48:07
1450007,5,"做工细、设计实用。",2018-06-24 12:56:23
1450007,5,"性价比超高",2018-06-24 11:56:44
1450007,5,"挺好的",2018-06-24 23:02:32
1450007,5,"好好好",2018-06-24 20:54:33
1450007,5,"样子不错，安装图解清楚，就是六角扳手长了点，很变扭",2018-05-29 08:18:07
1450007,5,"宝贝很喜欢！可以用到初中。",2018-06-23 17:14:08
1450007,5,"网易严选一如既往地给力",2018-06-23 18:18:47
1450007,5,"拼装简单，很美观实用！",2018-06-23 11:35:21
1450007,5,"小孩子很喜欢，安装相对简单",2018-06-23 00:02:08
1450007,5,"已经安装完成  看起来不错",2018-06-23 11:27:23
1450007,5,"太棒了 这是第二个",2018-06-23 00:12:30
1450007,5,"很好",2018-06-23 22:17:29
1450007,5,"买了 然后运回了新加坡 给孩子用",2018-06-22 12:55:52
1450007,5,"这个桌子真的很实用，大小尺寸也够了，女儿很喜欢",2018-06-14 13:59:11
1450007,5,"还好，就是小了点",2018-06-22 21:35:15
1450007,5,"小朋友参与动手安装，她很喜欢",2018-06-22 14:00:54
1450007,5,"桌子不错。孩子也喜欢",2018-06-22 13:52:19
1450007,5,"非常不错，很喜欢",2018-06-22 22:16:29
1450007,5,"质量不错，很满意。",2018-06-22 22:00:05
1450007,5,"质量不错",2018-06-22 09:46:27
1450007,5,"不错",2018-06-22 17:58:23
1450007,5,"不错",2018-06-22 06:38:13
1450007,5,"售后非常好<U+0001F44D>",2018-06-17 20:44:18
1450007,5,"儿子超级喜欢，感觉写作业也快了些。",2018-06-21 10:32:52
1450007,4,"总体还说还可以，有颗板凳螺丝拧不拢，板凳有点摇晃",2018-06-22 20:28:02
1450007,5,"一直想买一套学习的桌椅，看得上的动辄2000+严选这套算是解决了我的问题，做工相当扎实。虽然安装顺畅度，工具和螺丝质量相对于宜家还有提升空间，不过装完后还是相当不错，提个建议，在桌子后面再给个插班安放的空间。",2018-06-21 21:47:07
1450007,5,"用了很久了，娃很喜欢，谢谢",2018-06-21 18:45:07
1450007,5,"很实用，而且质量非常好，可以用很多年。",2018-06-21 11:05:49
1450007,5,"质量很不错，虽然不大，但够用，性价比很高",2018-06-06 21:15:39
1450007,5,"质量不错，性价比高，值得拥有。",2018-06-21 22:37:51
1450007,5,"孩子喜欢",2018-06-21 22:59:36
1450007,5,"好",2018-06-21 10:20:47
1450007,5,"质量很好，功能实用！很不错的桌子",2018-06-20 17:15:28
1450007,5,"很棒，已经是第二次购买了",2018-06-20 23:12:46
1450007,5,"质量好，儿子喜欢",2018-06-20 19:34:43
1450007,5,"多搞活动",2018-06-20 21:10:48
1450007,5,"挺不错的，儿子很喜欢，空间不大的地方放置很合适",2018-06-04 21:55:20
1450007,5,"非常好！很结实，用到初中没问题",2018-06-19 08:26:14
1450007,5,"桌子性价比高，孩子很喜欢！",2018-06-19 07:22:56
1450007,5,"稳固！就是安装花去较多时间！",2018-06-20 10:44:33
1450007,5,"确实做工很好 儿子很喜欢",2018-06-19 23:00:02
1450007,5,"表示很醉",2018-06-19 21:25:59
1450007,5,"很好",2018-06-19 20:08:04
1450007,5,"桌子质量好，设计也很合理，就是台灯不够亮",2018-06-14 09:55:01
1450007,5,"质量很好，价格相对来说很便宜了",2018-06-18 23:15:25
1450007,5,"椅子背有点割手",2018-06-21 22:27:54
1450007,5,"不错，小朋友很喜欢",2018-06-18 22:12:29
1450007,5,"挺漂亮的桌椅",2018-06-18 13:17:46
1450007,5,"质量非常好～",2018-06-18 21:44:53
1450007,5,"质量很好",2018-06-18 14:01:15
1450007,4,"还可以",2018-06-18 22:01:59
1450007,5,"质量不错",2018-06-18 21:25:10
1450007,5,"很满意",2018-06-18 21:05:58
1450007,5,"桌子结实",2018-06-18 11:36:02
1450007,4,"不错",2018-06-18 16:07:55
1450007,5,"质量没的说，很满意。大爱严选。",2018-06-17 07:22:26
1450007,5,"看评价买的，用了再来评论",2018-06-17 18:04:21
1450007,5,"非常好，比起那些品牌的，除了实惠太多，没别的毛病",2018-06-02 10:21:36
1450007,5,"挺好的，很喜欢。",2018-06-17 21:25:59
1450007,5,"很好用",2018-06-17 11:52:28
1450007,5,"好",2018-06-17 13:40:10
1450007,5,"套装很舒服",2018-06-16 18:38:22
1450007,5,"超级好",2018-06-16 12:41:48
1450007,5,"安装比想象的简单，我以为特别复杂呢。",2018-06-15 01:10:32
1450007,5,"网易积分2000多了才意识到不评论是多么罪恶，入坑不说了",2018-04-21 20:30:23
1450007,5,"优惠差了100块心塞",2018-06-15 23:38:18
1450007,5,"挺好的，没有味道，很结实。出了点小问题，客服也很好！",2018-04-20 09:14:10
1450007,5,"不错",2018-06-14 10:05:02
1450007,5,"不错，质量很好，无味道",2018-06-13 12:46:05
1450007,5,"看过商场里的 价格都好贵 没想到严选也有 尺寸合适 价格亲民 收到第一时间安装好 非常不错 灯也有 宝宝能一直用到大",2018-06-12 21:27:43
1450007,4,"本来想买粉色的一直等不到，中午买完下午就发消息粉色有货了，无语还没法退货，怎么联系客服都是一个机器人回答，不满意",2018-06-15 19:11:26
1450007,5,"满意",2018-06-13 09:58:43
1450007,5,"很好 很满意 孩子也高兴 就是粑粑装的时候觉得有点麻烦",2018-05-20 10:37:15
1450007,5,"很棒的儿童写字台，",2018-06-12 14:29:22
1450007,5,"孩子非常喜欢",2018-06-12 13:10:53
1450007,5,"还不错",2018-06-12 17:25:37
1450007,5,"好",2018-06-11 22:34:00
1450007,5,"特别喜欢，质量很好，看起来很高大上，朋友都问我在哪买的，严选真的性价比之王，质量不输大牌，价格还那么便宜，太喜欢了，谢谢，以后会多多支持严选！",2018-06-10 20:21:43
1450007,5,"给侄子买的，非常喜欢",2018-06-10 23:13:59
1450007,5,"没有异味，比较坚固",2018-06-10 12:24:14
1450007,5,"很实惠",2018-06-10 17:00:12
1450007,5,"不错，质量好，没有味道，要是可以不选灯就更好了",2018-05-16 16:19:33
1450007,5,"非常好，无味，质量杠杠的",2018-06-09 10:49:15
1450007,5,"好的",2018-06-09 11:55:35
1450007,3,"放在小朋友房间一晚，第二天就能闻到一股味，不知道是不是塑料不好",2018-06-11 19:22:52
1450007,1,"质量很差，一分钱一分货吧",2018-06-12 15:27:57
1450007,4,"先说桌子本身，6.1给宝贝买的，对质量本身很满意，严选没让我失望
但是不得不吐槽下价格，关注挺长时间一直都是815，6.1买的，结果6.11降价100+，还不能申请价格保护，心塞",2018-06-11 22:17:50
1450007,5,"儿子很喜欢，做工好，漂亮，就是小椅子的下面螺丝不好上",2018-05-15 21:37:40
1450007,5,"安装非常便捷，品质非常好，装好后小孩在书桌上看了好多书……",2018-04-14 21:10:12
1450007,5,"桌椅没问题，但灯的磨砂板破裂已联系客服，希望愉快处理好。",2018-05-20 16:41:07
1450007,5,"很厚实，椅子大人提都觉得沉，小孩坐上面应该不会来回乱动了",2018-03-25 16:28:39
1450007,5,"大人可以直接用",2018-06-07 19:16:15
1450007,5,"喜欢",2018-06-07 12:58:54
1450007,5,"质量很好，功能齐全，希望能陪完两个孩子度过童年！",2018-05-29 12:21:58
1450007,5,"味道一点没有哦<U+0001F604>一些问题经过和客服的反复沟通交流完美解决！通过跟学视频的安装步骤简单方便且里面是有技巧的<U+270C>这次自己安装学到了<U+0001F44F>",2018-06-08 10:38:26
1450007,5,"组装方便，孩子用正好",2018-06-06 11:42:49
1450007,5,"物有所值，质量非常不错，本打算孩子上小学买某童的四千多的桌子，无意间看到严选这款桌子，毫不犹豫买下，回来安装后非常满意",2018-03-29 13:24:08
1450007,5,"挺好的，刚组装好，组装挺简单的，还没用",2018-05-27 23:18:33
1450007,5,"很好",2018-06-04 11:45:36
1450007,5,"学习桌收到后有一个垫片裂了，客服非常负责，没几天就收到了补寄的零件，桌子一人安装稍微费点劲，铁的，所以螺丝对接不是那么顺畅，装好后，不管怎么调节，椅子都有晃动，凑合吧，孩子用后体验不错，只是没有座椅套或座椅垫，桌子还挺占地儿的，很大型",2018-05-28 05:17:30
1450007,5,"产品质量很好，没有味，材质很有良心～",2018-06-03 23:10:18
1450007,5,"学习桌很厚实，做工质量不错。安装也很简单，值得推荐。提一点小意见：安装的塑料垫片A1，能否多加两三个作为备份？比较脆，安装的时候裂了一个。",2018-05-21 09:21:42
1450007,5,"很重，特意去实体店摸了摸，感觉相差不大。只是椅子上的螺丝很难拧",2018-06-05 21:43:36
1450007,5,"好用，组装容易，台灯不闪烁，好评",2018-06-03 09:17:31
1450007,5,"挺好用的，小孩很喜欢",2018-06-03 21:51:04
1450007,5,"安装方便，孩子很喜欢",2018-06-03 22:13:08
1450007,5,"还不错",2018-06-03 21:42:32
1450007,5,"质量挺好，儿子一年级刚刚好",2018-06-02 16:55:14
1450007,4,"还可以",2018-06-02 21:59:52
1450007,5,"这个桌子看了好长时间才有货，到货了8折马上买了，安装的时候把手搞破了，其他的都非常好，有重量",2018-04-27 19:01:12
1450007,5,"非常满意，宝宝很喜欢",2018-06-01 09:00:35
1450007,5,"孩子很喜欢，感谢",2018-06-01 15:30:43
1450007,5,"灰色很好看",2018-06-01 12:50:22
1450007,5,"价格合理，物美价廉，实用",2018-06-01 07:47:19
1450007,4,"学习桌的质感和外观总体不错，主要的问题就是组装的时候。螺丝螺母以及配件咬合不够顺畅，安装比较费力，比如。学习椅的其中一个螺丝就很难拧动，花了很长的时间。两个腿儿中间的连接架安装也咬合不紧密。",2018-06-08 10:17:35
1450007,5,"好",2018-06-01 22:41:06
1450007,5,"实用性非常强",2018-05-31 14:31:06
1450007,5,"不错",2018-05-31 18:28:00
1450007,5,"质量很好，桌面也没有异味，最主要是孩子很喜欢。",2018-05-22 19:51:01
1450007,5,"相当稳当 感觉娃热爱学习了一点点",2018-05-30 18:14:31
1450007,5,"哈哈哈哈哈哈回家",2018-05-30 17:29:47
1450007,5,"陌陌摸摸弄",2018-05-30 00:10:32
1450007,5,"很不错，儿子很喜欢，价格也不高",2018-05-20 07:22:27
1450007,5,"不错",2018-05-30 12:09:19
1450007,1,"桌子安装好后，把高度设置到最高的情况下会掉下去，也就是只能用最矮的那个档位，是设计上有缺陷，高度调节没有突出卡位(类似雨伞卡槽)，只有螺丝挤紧。装起来不容易，拆了也不容易，也懒得申请售后了，以后对严选的东西不会像之前一样轻易相信。5岁以上小朋友的家庭多注意，5岁以下的小朋友用起来还可以。",2018-06-06 10:14:10
1450007,5,"装了，虽然不大，质感很好",2018-05-29 08:51:51
1450007,5,"非常好",2018-05-29 21:23:46
1450007,5,"非常满意。",2018-05-29 16:56:23
1450007,5,"帮邻居购买，反馈效果非常好",2018-05-28 00:19:22
1450007,5,"很好，小朋友很喜欢",2018-05-28 19:19:25
1450007,5,"质量非常好，家里地方小，用这个这个好",2018-05-27 15:36:33
1450007,3,"桌子很好，好看也实用，但是桌子上配的触控灯简直灾难，刚到没几天就触控开关不灵了，要不开不了，要不关不了，联系了客服，用了十天终于换了个新的，这回用的时间长点，两个星期，还是出现老问题，触控开关经常失灵，要命啊！",2018-05-30 17:13:29
1450007,5,"非常好",2018-05-27 00:33:28
1450007,5,"应该的，宝宝很喜欢",2018-05-26 06:52:01
1450007,5,"很不错的桌子，无异味，安装方便",2018-05-25 22:38:57
1450007,5,"非常好！",2018-05-25 11:42:51
1450007,5,"没有气味，很结实。就是腿不是很平整，还好有调节螺丝",2018-06-06 10:37:04
1450007,5,"太好了，质量超乎想象的好，孩子很喜欢",2018-05-22 08:08:22
1450007,5,"东西很结实 宝贝很喜欢",2018-05-24 23:16:41
1450007,5,"组装简单，实用大气，孩子喜欢！但是桌面有裂纹，已经通知客服，等待回复！",2018-05-06 20:52:08
1450007,5,"大小正好",2018-05-24 20:59:26
1450007,5,"还可以。",2018-05-24 07:22:05
1450007,5,"挺好的，价格是市场上那些的零头，家里空间小，这个尺寸正好。",2018-04-17 15:10:41
1450007,5,"不错。有几个螺丝挺难装的。。。。2个小时不到完事了。",2018-05-19 19:19:58
1450007,5,"还不错吧 椅子硬",2018-05-23 09:46:10
1450007,5,"桌子是等了一个多月才有货，抢来的，质量不错，没有任何味道，尤其是台灯很好用。当中有些小插曲客服回答是自然现象，因为喜欢也就不介意了。",2018-05-27 09:42:00
1450007,5,"质量还挺好的，就是鬼了点",2018-05-22 10:22:50
1450007,5,"这个书桌真的好赞，跟大商场2000块的有得一比",2018-05-08 16:21:25
1450007,5,"特别喜欢.谢谢严选的优质商品带给我们家品质的生活",2018-05-08 16:03:29
1450007,4,"还行。有点瑕疵，但不影响使用。产品挺扎实的，用起来很棒。",2018-04-13 19:10:23
1450007,5,"非常好的桌子，质量很棒！",2018-05-22 14:48:09
1450007,5,"谢谢很满意太好啦",2018-05-22 01:43:18
1450007,5,"材质质感很好 就是椅子功能单一 靠背基本靠不到",2018-04-23 22:08:17
1450007,5,"质量很好",2018-05-21 21:44:50
1450007,5,"安装不难，整体感觉还不错，价格很实惠",2018-05-20 16:57:53
1450007,5,"包装很好，螺丝分类也很清楚，桌椅很扎实。要说唯一缺点就是椅子背不能前后调整，小的孩子坐着靠不到椅背，背部无法支撑。600多价位上应该无人出其右了。给朋友也下了好几套。",2018-05-04 10:41:09
1450007,5,"尺寸更好，实用，关键确实没味道，直接能用",2018-05-18 22:55:24
1450007,5,"物美价廉，性价比很高",2018-05-20 20:11:24
1450007,5,"椅子要是有滚轮就更好了，孩子拖不动。。。",2018-05-11 14:08:15
1450007,5,"包装很好，螺丝分类也很清楚，桌椅很扎实。要说唯一缺点就是椅子背不能前后调整，小的孩子坐着靠不到椅背，背部无法支撑。600多价位上应该无人出其右了。给朋友也下了好几套。",2018-05-04 10:41:56
1450007,5,"宝贝不错的，好评。",2018-05-19 23:51:14
1450007,5,"很好",2018-05-19 15:36:30
1450007,5,"好",2018-05-19 10:57:56
1450007,5,"不错",2018-05-19 08:44:42
1450007,5,"好",2018-05-19 00:15:20
1450007,5,"不错不错，小朋友喜欢，安装不复杂，味道肯定是有一点，但放一放就好了，第二天小孩画画不小心画到桌面上了，用湿布加点洗洁精一擦就掉了。",2018-04-20 14:17:06
1450007,5,"等了好久，终于等到了，而且是粉色，女儿很喜欢",2018-05-10 14:26:44
1450007,4,"桌椅非常满意，料足，净重23公斤。无异味，直接装上就用了。扣的一颗星是因为物流，明明上周五就到配送站了，周末两天不给送，周一才送达。没有壮劳力搬起来很费劲的！！！",2018-04-18 00:27:11
1450007,5,"不错，性价比很高",2018-05-18 19:34:36
1450007,5,"质量确实非常好",2018-05-18 20:09:21
1450007,5,"还不错",2018-05-17 11:24:34
1450007,5,"我只能说……性价比实在太高了！",2018-04-14 16:38:59
1450007,5,"儿子很喜欢，坐上看书画画，也节省空间",2018-05-14 15:52:20
1450007,5,"桌子很好，孩子很喜欢的",2018-05-15 19:40:55
1450007,5,"很好，女儿喜欢",2018-05-14 22:45:37
1450007,5,"物超所值，还有台灯。安装比较简便，美中不足是说明书字太小，还是看安装说明的视频比较好。",2018-03-10 21:31:37
1450007,5,"可以的，安装也方便",2018-05-13 11:55:09
1450007,5,"非常非常喜欢",2018-05-13 22:41:25
1450007,5,"好",2018-05-13 15:45:14
1450007,1,"看一下你们严选出来的凳子自动调节出来的样子，佩服啊，客服居然还质疑我会不会用？严重伤害我对严选的感情，改名叫普选吧",2018-03-02 14:08:04
1450007,5,"还不错，性价比很高",2018-05-12 15:24:47
1450007,5,"质量不错，小孩子很喜欢",2018-05-12 15:30:58
1450007,5,"很厚实，感觉不错",2018-05-11 01:20:02
1450007,3,"严选的超级用户，这个产品包装严实，很重，但是安装时有个桌腿有滑丝现象，凳子安装结实后，一坐就下降，实在是郁闷，灯刚打开刺鼻，严重伤害超级用户的感情，请严选把关产品质量！这款价格也不便宜，淘宝搜了下，便宜好多",2018-03-11 15:44:54
1450007,5,"孩子很喜欢",2018-05-11 10:27:41
1450007,5,"送货很快，质量不错，没有味道，孩子喜欢",2018-05-10 10:32:20
1450007,5,"不错，值得拥有",2018-05-10 10:41:56
1450007,5,"桌子非常不错，一点味道没有，质量也很好。就是刚买了又有更加大的活动了，买贵了55块钱
<U+0001F62D>",2018-03-05 13:56:28
1450007,5,"质量非常好，配件也很棒，安装方便，闺女非常喜欢！",2018-05-05 12:22:21
1450007,5,"每天都打个广告",2018-05-09 19:25:20
1450007,5,"好高级的样子",2018-05-09 17:38:38
1450007,5,"经济实惠好用",2018-05-09 14:51:44
1450007,3,"台糸_P常性失`！其他可以。",2018-04-25 23:38:46
1450007,5,"很好，很满意。",2018-05-08 08:07:49
1450007,5,"价格实惠，使用方便",2018-05-08 07:05:16
1450007,4,"东西整体还是不错的，有两点小问题，1.不知道哪里弄来的两坨什么东西，2.螺丝很难紧，工艺设计有问题",2018-03-09 14:05:55
1450007,5,"必须好评，等了好久，一直缺货，周年庆活动期间竟然有货了，严选真是良心卖家。这个价位，买到可以调节，带台灯，功能全面的学习桌椅套装，我也是非常满意啦",2018-05-02 21:48:03
1450007,5,"做工不错，实惠，刚好遇到周年庆，八折，超级划算！",2018-05-06 19:37:32
1450007,5,"喜欢，就买了。小家伙还小，留着上学了用",2018-05-02 16:33:31
1450007,5,"该不错吧，但装上螺丝后会一边高一边低，只能扭松螺丝才能保持平衡[调节底部平衡螺丝其实意义不大。]大小刚好。",2018-03-08 20:37:05
1450007,5,"不错，满意",2018-05-06 11:10:01
1450007,5,"组装好上手，孩子用着还不错",2018-05-05 13:42:32
1450007,5,"不错的，可以升降，孩子也喜欢",2018-05-05 09:51:10
1450007,5,"书桌很赞，没有气味！但是我不得不说快递太糟糕，不愿意帮忙拿到楼上，花了三十元让别人搬到七楼的",2018-04-14 17:32:52
1450007,5,"超级赞，",2018-05-05 22:33:28
1450007,5,"质感不错",2018-05-05 17:12:28
1450007,5,"非常好，赶紧趁有货买下来",2018-05-04 08:29:23
1450007,5,"产品本身非常不错，但是物流有点差劲，货物留在楼下寄存也没电话通知。",2018-03-10 21:03:11
1450007,5,"囤货，还没打开。",2018-05-04 22:18:34
1450007,5,"完全没有异味，质量很好，赞一个<U+0001F44D>",2018-05-03 21:52:13
1450007,5,"终于买到了 很开心",2018-05-03 22:13:59
1450007,2,"都组装好1个月了，味道很重，又懒得换。怎么去味儿啊<U+0001F621><U+0001F621><U+0001F621>",2018-04-09 20:27:28
1450007,5,"质量不错，孩子很喜欢",2018-05-03 18:08:38
1450007,5,"好",2018-05-03 19:16:28
1450007,5,"品质非常好，装起来后很好用！",2018-05-01 13:57:35
1450007,4,"质量没得说，给4星是细节上有欠缺，中间的缝隙分布不均匀，网易什么时候出儿童床啊，我这急缺儿童床<U+0001F923>",2018-03-05 16:35:21
1450007,5,"很好很舒服的学习桌子",2018-05-01 14:14:38
1450007,5,"还可以，不便宜",2018-04-30 18:12:03
1450007,5,"很喜欢，性价比超高，市面上类似的至少3，5千，台灯有划痕，跟客服反应后直接又给寄了一个过来，严选的售后绝对没话说",2018-03-10 20:29:58
1450007,5,"细节做得特别好，小娃一起装都很放心",2018-04-28 23:02:08
1450007,5,"推荐大家都来买，便宜，好用，好安装。孩子非常喜欢",2018-04-22 16:59:42
1450007,5,"终于等到补货了，很好，很好",2018-04-28 14:16:14
1450007,3,"挺好的，自己组装不难，标记清楚明白，就是椅子坐垫那个塑料，上螺丝的时候有一个滑丝了，金属上进塑料不好掌握力度，这个是设计问题，希望改进，总体值得推荐。",2018-03-11 19:58:10
1450007,5,"还不错，每次一上架就被拍下架，终于",2018-04-24 21:48:49
1450007,5,"很棒",2018-04-28 18:19:55
1450007,5,"非常好，性价比很高",2018-04-27 20:28:05
1450007,4,"德邦物流稍慢，但送上楼了。
这套学习桌椅安装有宜家风，说明还算详细，质量及格，谈不上严选，比商场便宜，比淘宝贵。
座椅硬，没有软包，夏天凉爽冬天屁股冰凉。桌面凹槽设计符合人体工学，但桌子下拉抽屉太厚，占用腿部空间。
两根连接横档螺丝孔有安装使用过的痕迹，不知道是否是返修货。",2018-03-10 06:06:06
1450007,5,"真的很不错",2018-04-27 09:07:43
1450007,5,"高大上",2018-04-27 11:24:00
1450007,5,"性价比高！",2018-04-25 09:27:27
1450007,5,"终于安装好了，有个螺丝滑丝了……其它还好。",2018-03-04 15:10:40
1450007,5,"课桌很好，非常重，用料扎实，质量很好！女儿很喜欢！",2018-04-17 22:38:54
1450007,5,"没有气味，挺稳的",2018-04-24 14:29:51
1450007,5,"性价比不错",2018-04-24 11:11:36
1450007,5,"值！其实跟几千块的比起来，也没差太多",2018-04-30 06:21:22
1450007,5,"终于趁打折给儿子做作业的地方升级换代了。老公拼了一个小时终于大功告成，质量真的没话说。而且用料非常结实的，好重搬不动的。<U+0001F44D><U+0001F3FB>",2018-04-14 15:15:46
1450007,5,"非常好，已经组装",2018-04-22 00:06:39
1450007,5,"非常非常不错",2018-04-22 18:01:25
1450007,5,"无异味，手动比较麻烦，有电动的就好了",2018-04-14 18:52:18
1450007,5,"性价比很高",2018-04-21 22:13:30
1450007,5,"女儿眼睛要保护好",2018-04-21 10:34:31
1450007,5,"非常不错！！！",2018-04-21 15:52:46
1450007,5,"装好了很喜欢，就是装的时候很费力。",2018-03-15 15:59:27
1450007,5,"整体满意，带的台灯是充电的就更好了。",2018-04-17 21:44:25
1450007,5,"没有味道，很适合小朋友使用",2018-04-20 13:09:01
1450007,5,"质量很好，美观，安装方便。",2018-04-20 10:37:09
1450007,3,"台灯非常不好用，按键经常失灵。",2018-05-23 20:28:53
1450007,5,"大小合适，不占地方",2018-04-20 16:19:23
1450007,5,"好重 感觉材质很实在 没有味道 不错",2018-04-19 10:45:58
