"itemId","star","content","createTime"
1450007,1,"以后再也不会在严选买大件产品了，螺丝非常难上，螺丝外面的垫子是塑料的，拧紧就碎，在和客服联系的时候，开始是机器人客服，后来人工也没发沟通，传照片不行，还非得传视频，退款退货也不行。简直了。产品质量不好，差评。",2018-05-23 18:47:14
1450007,5,"不错",2018-04-19 10:06:21
1450007,5,"可以",2018-04-19 03:11:29
1450007,5,"非常棒的小桌子，没有味道，很稳当",2018-04-18 10:10:16
1450007,5,"性价比还是挺高的",2018-04-18 18:42:07
1450007,5,"质量很好 外观也很漂亮",2018-04-18 06:12:27
1450007,5,"真的质量好 超值",2018-04-18 09:59:49
1450007,5,"非常好",2018-04-18 20:31:16
1450007,2,"客服太差：台灯太晃，拍了视频通过邮箱反馈客服，电话沟通时，客服自己都说觉得有点太晃了，说可以退货，但是需要整件退货（含桌椅）。实在不想再拆了就提出只换台灯。客服表示第二天会给我回复，从此不再有消息。在线人工客服永远都是我们去核实一下再回复，也没有下文。最后客服通过邮箱反馈说台灯就是这么晃。这客服能力及态度简直了。。。",2018-04-24 18:59:38
1450007,5,"东西不错，没有异味，只是台灯不是充电的吧",2018-04-14 22:59:37
1450007,5,"质量挺好的，有多个调整尺寸，很实用。非常满意",2018-04-14 12:02:05
1450007,5,"超实用，质量好价格美丽，值得拥有",2018-04-17 21:19:18
1450007,1,"oZ的快f，肋x失望^！可海",2018-04-16 23:23:25
1450007,5,"朋友很满意，感谢我的推荐",2018-04-17 22:02:16
1450007,5,"很好很好很h",2018-04-17 23:00:01
1450007,5,"收到货，就开始组装，拧了一晚上的螺丝，整体还算顺利，性价比高，就是灯有点味道",2018-04-14 00:06:41
1450007,5,"非常满意",2018-04-17 08:15:42
1450007,5,"满意",2018-04-17 03:54:31
1450007,5,"安装说明很直观，按步骤安装，1个小时装完",2018-04-15 16:39:12
1450007,5,"的确不错。安装简单，调节方便。设计的很用心。唯一的缺陷在于台灯，底座固定不佳，建议调整。",2018-04-17 14:46:26
1450007,5,"非常喜欢，给大宝用正好",2018-04-16 20:58:51
1450007,5,"非常好，孩子很满意",2018-04-16 14:25:21
1450007,5,"呵呵呵呵呵",2018-04-16 09:01:09
1450007,5,"椅子有问题，调节高度的地方螺丝扭的很紧了，但还是坐下去会下沉。包括桌子调节高度的地方也是",2018-05-21 22:16:07
1450007,5,"很好很好",2018-04-16 18:01:10
1450007,5,"物美价廉，用料结实",2018-04-16 23:07:21
1450007,5,"很适用的",2018-04-16 13:18:11
1450007,5,"质量很好",2018-04-16 08:08:37
1450007,5,"挺好的，就是有两个螺丝拧不进去凳子上的。这个价格，超值了，无味。",2018-04-14 17:40:26
1450007,5,"很不错的书写桌，物美价廉，儿子超喜欢，推荐购买",2018-04-14 21:48:05
1450007,5,"儿子非常满意非常喜欢，太感谢了，6百多买的",2018-04-14 19:46:28
1450007,4,"几乎没有味道，比较扎实。但是，椅子和桌子横杆的螺丝位置，契合度不够精细，需要霸王硬上弓才能装上。因此，只给四星。",2018-05-17 08:52:14
1450007,5,"装着还挺简单的   可以调节高度 不错",2018-04-15 12:09:14
1450007,5,"非常好用，有粉色的更好了",2018-04-15 22:00:45
1450007,5,"质量不错，没异味，严选值得信赖",2018-04-15 11:03:32
1450007,5,"整体不错，外观有一点磕碰瑕疵，不过不影响使用，那些需要用螺丝固定的地方，时间长了不知道会不会滑丝",2018-04-15 16:11:46
1450007,5,"东西很不错下次还会购买",2018-04-15 14:33:50
1450007,5,"不错，很好，儿子很喜欢",2018-04-15 18:03:51
1450007,5,"好好好",2018-04-15 15:02:31
1450007,5,"刚开始很担心凳子不好，到货后担心都是多余的。赞<U+0001F44D>。。。唯独有点失望就是下单第二天就搞活动，领券可减95元",2018-05-21 17:35:12
1450007,5,"非常好，孩子很喜欢，每天都认真坐着写作业",2018-04-11 15:07:35
1450007,5,"拎着很重、还没有拆开",2018-04-14 18:03:03
1450007,4,"有漆剥落，还好",2018-04-14 13:21:02
1450007,5,"整体还可以 椅子上有个螺丝怎么上都上不紧 感觉口开歪了",2018-04-18 14:08:46
1450007,5,"第二套了，非常好",2018-04-14 15:06:15
1450007,5,"非常好",2018-04-14 18:53:28
1450007,5,"小巧实用，真心不错，没味道",2018-04-13 21:55:51
1450007,5,"学习桌没有想像的好，螺丝不好紧，塑料垫片坏了一个，不过不影响使用",2018-04-14 17:01:18
1450007,5,"很好，女儿很喜欢",2018-04-13 08:47:40
1450007,5,"这套桌椅质量不错，很结实，别的牌子都要一千多，这里打折六百多买的，儿子比较喜欢，最矮要110可以用，我儿子五岁正好可以最低档。没有什么味道，用了半个多小时两个人装好。还有个台灯装起来方便",2018-04-13 20:18:02
1450007,5,"感觉不错",2018-04-13 07:51:32
1450007,5,"台灯开关有点接触不良，但是安装花费了很长时间，懒得退了，其他都不错，希望能单独出个台灯，我买来替换下",2018-03-15 12:02:49
1450007,5,"之前刚上新时我看过，看图觉得很一般，比较廉价的样子，后来看到评论说可以，就抱着试试看的心态买回家，觉得也还好，至少对得起价钱。全部安装好后，是越看越喜欢，质量很好，安装也很容易。很值得购买",2018-04-13 09:52:35
1450007,5,"非常喜欢",2018-04-13 19:30:22
1450007,5,"安装方便，结实稳定，孩子用着正好。",2018-04-12 21:58:51
1450007,5,"辛苦装了一夜，第二天一早小孩迫不及待的问我的书桌装好没，有个缺点，就是调整高度是没有卡扣扣住，容易上下活动",2018-05-06 08:21:41
1450007,5,"很沉重，安装简单，二十分钟搞定",2018-04-12 18:21:54
1450007,5,"安装比较难，并且，配件一个多余的也没有，备用都没有。",2018-05-21 15:43:48
1450007,5,"质量不错的",2018-04-12 21:43:18
1450007,5,"感觉还不错",2018-04-12 21:21:27
1450007,5,"不错，女儿喜欢",2018-04-12 19:42:18
1450007,5,"质量很不错的",2018-04-11 14:19:47
1450007,5,"非常好用",2018-04-11 07:15:51
1450007,4,"整体质量挺好，无异味！就是螺丝质量有待提高，好两个螺丝滑丝，不知道用段时间会不会出现松动，然后螺丝滑丝拧不紧。",2018-03-17 22:43:04
1450007,5,"不比那些好几千的差，孩子用着合适，又经济又实用",2018-04-02 13:17:05
1450007,5,"这个桌子挺好的，没有异味，质量不错！值得购买，安装方便",2018-03-29 08:02:11
1450007,5,"好高好高好好好好好好好高好高好好好好好好",2018-03-23 16:16:15
1450007,4,"质量还可以。就是安装特别费事，安装视频看似容易，但三个人整整一晚上才安起来，送的工具也不给力，螺丝也非常不好拧，多少还是存在做工问题。快递小哥很好，看家中只有老人，那么重的桌子给帮忙扛上来，很感谢。",2018-05-22 11:27:33
1450007,5,"不错",2018-04-05 17:27:02
1450007,5,"质量挺好！",2018-04-04 22:02:43
1450007,5,"很好，没有气味，宝宝一下就喜欢上了",2018-04-03 12:59:31
1450007,5,"桌子腿不平衡，装起来还是有点难度",2018-05-19 23:06:41
1450007,5,"很好，划算",2018-04-03 13:11:47
1450007,5,"非常不错",2018-03-28 00:34:11
1450007,5,"很好 物超所值",2018-03-22 10:32:43
1450007,4,"桌子还不错，椅子不太好，因为安装的时候很费劲，椅子腿后面的螺丝孔和连杆上面的螺丝孔对不齐，装了好几次，装好之后还有点扭的，只能靠下面调节垫片来保持椅子四脚水平。台灯自己可以买，最好出一款不带台灯的，降低成本。",2018-05-19 15:29:11
1450007,5,"很好",2018-03-22 16:46:48
1450007,5,"xihuan",2018-03-22 22:00:28
1450007,5,"与描述相同，很好的学习桌，孩子很喜欢！",2018-03-20 07:16:10
1450007,5,"质量还算不错  安装的时候有点不顺利 老公一直认为是次品  我参与安装后 一切顺利了好多 说明啥呢 女人越来越汉子了",2018-03-13 18:11:28
1450007,5,"不错不错",2018-03-21 10:28:49
1450007,5,"装上了，没看到，等追评",2018-03-20 10:13:07
1450007,5,"组装起来挺方便，桌子没得说，椅子好像效果不太明显",2018-05-02 16:16:43
1450007,5,"和很满意   不错不错不错不错",2018-03-20 22:50:03
1450007,5,"挺好的，性价比高",2018-03-20 22:10:25
1450007,5,"品质很好",2018-03-20 16:32:25
1450007,5,"好评",2018-03-20 14:16:32
1450007,5,"为什么现在不补货了",2018-05-02 11:38:50
1450007,5,"闺女非常喜欢这个学习桌，质量很好，物美价廉，赞！",2018-03-16 20:17:12
1450007,5,"确实不错，物有所值。",2018-03-19 20:11:03
1450007,5,"很不错，儿子很喜欢",2018-03-19 17:45:41
1450007,5,"性价比很高，设计安装合理，就是邮寄来的台灯跟桌面的预留孔不配套装不上，联系客服，给我邮寄更换零件，更换后完美解决了，售后非常负责任，能够解决问题，",2018-04-30 23:02:56
1450007,5,"女儿用的不错",2018-03-19 10:44:55
1450007,5,"质量好，无味道。",2018-03-19 09:40:45
1450007,5,"好好好",2018-03-19 00:46:42
1450007,4,"螺丝质量不行，拧秃了，有点味，不是很重。",2018-04-18 12:29:18
1450007,5,"性价比非常高，没味道，很稳固",2018-03-18 08:05:02
1450007,5,"很不错的哈，给大家推荐一下",2018-03-18 02:18:22
1450007,5,"书桌很好用，物有所值",2018-03-18 09:09:19
1450007,5,"设计合理，安装方便。三四十分钟可以完工。调节范围比较大。没有明显气味。总体满意。
提个小建议，椅子腿最底端，调节水平用的黑色塑料件，建议选用Non Markable材质。椅子在地面上拖动，在所难免，但是目前这个材质，拖动后，很容易在地板上留下黑色印记，这个是很难去除的。换无印记的材质，成本方面的变化，可以忽略不计的。",2018-04-22 16:13:43
1450007,5,"物超所值",2018-03-18 10:18:08
1450007,5,"质量很好，没有气味，安装简单，功能实用",2018-03-17 07:33:27
1450007,5,"质量不错，性价比很高",2018-03-16 09:26:31
1450007,5,"五星给了主要的部件做工，稍微提示下这个桌子的安装对于新手有一定难度，而且安装配件没有多余的，螺丝如果扭花了就略微麻烦，但还是很推荐",2018-04-15 14:03:24
1450007,5,"给外甥买的，他很喜欢，开心",2018-03-15 21:52:36
1450007,5,"很好，很满意",2018-03-15 14:16:08
1450007,5,"安装有点儿麻烦，装好还可以。",2018-04-20 10:58:15
1450007,5,"很棒",2018-03-15 13:03:09
1450007,5,"高质高效",2018-03-15 05:01:09
1450007,5,"好",2018-03-15 23:25:01
1450007,5,"满意",2018-03-15 17:54:12
1450007,5,"细节不是很好。",2018-04-14 22:42:33
1450007,5,"宝贝很好，非常满意！五星好评！",2018-03-14 10:12:28
1450007,5,"物超所值！满意",2018-03-14 11:06:47
1450007,5,"好",2018-03-14 23:28:23
1450007,5,"这款书桌颜色挺漂亮，娃娃喜欢，安装过程中升降位置调整比较难弄一点，要反向拉到最高然后才可以降到最低位，桌子完全没有异味，台灯有的味道，上到桌子上也不稳定，就取下来闲置了。现在希望出一款配套的台灯，周年庆价格也很实惠，特别赞<U+0001F44D>",2018-04-14 22:30:03
1450007,5,"质量很不错，组装也很简单，赞",2018-03-13 22:51:31
1450007,5,"很赞",2018-03-13 23:49:45
1450007,5,"非常满意，安装图纸看上去不友好，很复杂但是实际安装还是蛮简单的。画安装图的人可以下岗了",2018-03-06 10:11:38
1450007,2,"桌椅暂时看还行，只是Led灯的塑料味道很刺鼻，电源做工也很粗糙！！！！",2018-03-02 14:47:12
1450007,5,"桌子拼装蛮方便的，比同款商场的便宜很多，很超值，没有异味！",2018-03-12 15:50:26
1450007,5,"设计合理简洁，功能实用，质量较好，今年要读小学了，希望孩子爱上学习！",2018-03-10 02:11:39
1450007,5,"这次购物很满意！座椅没有味道，性价比很高！就是灯有些味。",2018-03-09 23:09:20
1450007,5,"安b不算y，w感X好！",2018-03-12 23:18:34
1450007,5,"桌子很棒 没有气味。纠正孩子坐姿，严选质量没得说",2018-03-12 22:20:07
1450007,5,"非常满意，但感觉和京东上看的599的一款非常相似！",2018-03-11 17:23:14
1450007,5,"做工堪比某宝3000左右的。还带了led台灯。赞一个",2018-03-05 20:46:37
1450007,5,"这个套装真不错，那天刚好在逛严选的时候看到了，买来放在婆家刚好可以给孩子学习用。安装容易，工具也配套好。就是台灯有点味道，其他都可以。如果抽屉可以上面有一层防尘的会更好",2018-03-08 11:06:59
1450007,5,"安装方便，感觉很靠谱，性价比高",2018-03-11 21:23:13
1450007,5,"这个学习桌太给力了……女儿好喜欢",2018-03-11 12:10:07
1450007,5,"太好了，喜欢的不得了",2018-03-12 06:26:15
1450007,5,"桌子很好，很有分量的那种。小朋友也很喜欢，唯一不好的就是凳子调节高度的设计有点困难，其他都很好。",2018-03-12 10:16:24
1450007,5,"质量很好！值得信赖",2018-03-12 17:23:10
1450007,5,"好",2018-03-12 10:15:27
1450007,5,"桌子很实惠，样式美观，质量看起来还不错。",2018-03-11 19:13:24
1450007,5,"千万别用电动螺丝刀………被我弄烂一颗螺丝钉。但不是很影响使用。",2018-03-10 23:50:40
1450007,5,"很好用，材料实在，灯光柔和，小朋友很喜欢",2018-03-10 21:52:47
1450007,5,"质量一如既往的好",2018-03-11 20:32:53
1450007,5,"非常好",2018-03-11 16:11:10
1450007,5,"有点小瑕疵不影响 孩子很喜欢 没有任何味道",2018-03-11 16:37:41
1450007,5,"安装方便，性价比高，准备再入一张",2018-03-09 18:56:56
1450007,5,"性价比超高，孩子很喜欢。",2018-03-10 12:57:39
1450007,5,"质量好，孩子喜欢。",2018-03-10 23:47:35
1450007,5,"整体不错，LED灯开关不明感。先用着吧。",2018-03-07 21:41:13
1450007,5,"质量非常好",2018-03-10 21:38:26
1450007,5,"蛮结实的",2018-03-10 17:05:10
1450007,5,"好 完美",2018-03-10 21:02:12
1450007,5,"很好",2018-03-10 15:04:36
1450007,5,"好",2018-03-10 15:54:32
1450007,5,"没得说，性价比超高的产品",2018-03-09 23:14:11
1450007,5,"收到了，安装好了，目前看非常好",2018-03-09 17:06:40
1450007,5,"很满意的购买，安装也容易。不错！",2018-03-09 20:00:57
1450007,5,"不错，质量非常棒，好评",2018-03-09 10:39:14
1450007,5,"还不错，感觉螺丝固定不了",2018-05-25 11:42:04
1450007,5,"方便调节，实用。推荐购买",2018-03-08 12:12:43
1450007,4,"性价比较高",2018-03-08 10:09:44
1450007,5,"东西好",2018-03-08 15:43:22
1450007,5,"不反光桌面，可变角度的书架和桌面，多档升降的桌椅，不伤地板的地垫，特别是光线柔和的台灯，每一处细节都透露着严选的品质！一直在“严选”，价廉物更美，从未失望过",2018-03-07 08:41:16
1450007,4,"质量相当不错，价格有点小贵",2018-03-07 19:44:46
1450007,5,"宝贝刚刚三周，用着很好",2018-03-07 15:19:31
1450007,5,"i很好，满意",2018-03-07 21:22:06
1450007,5,"还行，满意",2018-03-07 07:38:27
1450007,5,"非常好！",2018-03-07 14:18:01
1450007,5,"非常好",2018-03-07 08:18:18
1450007,5,"超级赞！严选所有的东西都值得信赖！",2018-03-05 16:50:08
1450007,5,"挺好的",2018-03-06 17:10:27
1450007,5,"很好",2018-03-06 23:22:40
1450007,5,"花了2小时装好，还行",2018-03-05 09:54:52
