"itemId","star","content","createTime"
1453004,5,"质量好，手感很舒服，大小合身，是一次满意的购物体验。严选品牌靠得牢！",2018-07-29 20:36:46
1453004,5,"差点就买大一号，还好网易产品尺码规格很准确，尺码选对了穿上身很合适舒适，太满意了同时中网易的毒也越来越深了。",2018-06-08 00:11:55
1453004,5,"不错不错，618活动价出手，大小合适，颜色好看，上身好看。满意啊！",2018-06-06 19:16:05
1453004,5,"真的不错，这个价钱买到这种衬衫哇哈哈哈哈，严选是我的小衣柜了。还是希望抽个好的优惠券",2018-08-14 08:39:44
1453004,5,"很好的衣服，凉爽透气吸汗，穿上去柔软且不失挺括，值得购买，刚又下单再买一件！",2018-07-16 17:21:34
1453004,5,"很好，大小合身，夏天穿着也舒服，给老爸买的，很开心！赞赞赞<U+0001F44D>",2018-07-11 23:00:31
1453004,5,"京东快递神速。颜色很喜欢，手感非常舒服，只是本人微胖，穿着有点瘦，作为减肥的动力吧。",2018-05-31 09:57:37
1453004,5,"果断下手，棉麻系列，和自己预期差不多，品质较高，休闲商务均可，透气性良好，喜欢！",2018-07-16 22:55:28
1453004,5,"舒服，透气，但不抗皱，麻就是这样，追求舒适，自然要放弃一些，毕竟也是休闲款",2018-06-19 23:11:24
1453004,5,"给老公买了三件，老公很喜欢，料子也很好，穿着有型舒适，很不错！有优惠会再来购买",2018-05-03 09:12:02
1453004,5,"棉麻布料触感很舒服，颜色跟图片差不多，个人感觉很舒服满意，还很便宜",2018-07-17 23:17:59
1453004,5,"质量很好，我买的尺码大了点，包装一如既往的严选风格，很给力",2018-07-16 15:01:50
1453004,5,"老公穿着非常舒服，他只喜欢穿t恤衫，然而对这件衬衫爱不释手
这是买的第二件了，之前给老爸买了一件",2018-07-25 23:18:27
1453004,5,"手感柔软，不错！包装还是一如既往的好！赞！还送了了一条质量很好的毛巾。谢谢严选！",2018-04-12 16:57:53
1453004,5,"衣服很舒服，做工还不错，价格也不贵。包装用了一个超大的箱子，感觉都有些浪费了",2018-04-11 23:13:57
1453004,5,"质量很好，特别喜欢，不像其他纯麻的衬衫会比较皱。喜欢，多搞搞活动就好了。",2018-04-03 19:18:05
1453004,5,"一如既往的好!爱上严选我的专买店!",2018-08-15 22:22:46
1453004,5,"想买好久了，赶上特价十分划算",2018-08-16 10:58:15
1453004,5,"穿的很舒服，在买一件",2018-08-15 09:03:38
1453004,5,"很舒服的面料，穿上身还不错，有气质，没有肚腩的话，修身版会更好",2018-03-14 02:14:31
1453004,5,"不错，长短合适，衣服好，满意",2018-08-10 19:55:59
1453004,4,"穿惯了带领的衬衫，第一次尝试立领的。身高170，体重65，最近健身，所以这个尺寸穿起来挺合身的。总体感觉还不错。",2018-04-14 13:20:31
1453004,5,"非常满意，从来没有这么合身版型，设计理念很好",2018-08-02 13:11:47
1453004,5,"面料薄，比之前买的牛津款的舒服",2018-08-05 10:23:38
1453004,5,"还没穿，摸起来手感，质地柔软，中了严选的毒啦<U+0001F604>",2018-06-17 16:53:11
1453004,5,"包装非常好，打开包装就感觉都是一件很享受的事情",2018-07-10 12:57:21
1453004,5,"穿着合身，材质感觉舒适，衣服做工几精致，很满意的一件衬衣。",2018-06-07 12:27:45
1453004,5,"尺寸、质感、物流都超棒。很喜欢严选，继续支持。",2018-07-15 11:04:30
1453004,5,"衬衫的尺寸非常准，面料透气性好，做工精细。",2018-07-13 15:07:44
1453004,5,"不失典雅",2018-07-14 22:11:35
1453004,5,"衬衫一直都有在穿.超极棒",2018-07-10 08:06:42
1453004,5,"很不错很不错很不错很不错很不错很不错很不错很不错很不错很不错很不错很不错很不错很不错很不错很不错很不错很不错很不错很不错很不错很不错很不错很不错很不错很不错很不错很不错很不错很不错很不错很不错很不错很不错很不错很不错很不错很不错很不错很不错很不错很不错很不错很不错很不错",2018-07-10 20:00:05
1453004,5,"衣服不错，给老爸也买了一件。",2018-07-08 08:46:09
1453004,5,"料子柔软舒适，所以又买了一件。",2018-07-08 08:28:05
1453004,5,"衣服颜色、式样都很不错，穿着很合适。",2018-07-06 10:28:16
1453004,5,"穿起来很舒服的棉麻衬衣，买了立领的，下次买尖领试试",2018-05-09 08:59:42
1453004,5,"衣服面料柔软，穿着舒适透气，尺码合适。物流服务态度好，速度快，满意的一次购物。",2018-03-24 20:50:29
1453004,5,"相当满意。准备再入一个不同颜色。立领非常好。面料极好。非常轻薄透气。",2018-04-15 16:46:52
1453004,5,"非常完美，宽松版，夏天穿，很清爽，天空蓝超级好看！大爱！",2018-06-15 17:43:09
1453004,5,"包装走心，质量也还满意，需要的话可以考虑购买！",2018-06-20 13:56:35
1453004,5,"超级好啊，人生穿过中的最好的衬衫，没有之一，幸亏买了两个颜色",2018-04-12 11:20:15
1453004,5,"看图片以为是细纺亮面的，拿到手才知道是棉麻粗纺的，不过很喜欢啊！这个质感很惊喜。而且季节折扣99买到的。这个档次的衣服在实体时装店恐怕要四五百起才能买到吧！
图片模特<U+0001F448><U+0001F3FB><U+0001F602><U+0001F602><U+0001F602>170CM 73kg，穿着正好<U+0001F60C>",2018-06-28 20:28:16
1453004,5,"质量非常好，价格合适，性价比超高！",2018-06-24 08:27:22
1453004,5,"",2018-06-24 22:38:20
1453004,5,"穿着很舒服，就是宽松版有点大了，选合身版就好了。",2018-04-07 22:26:09
1453004,5,"好，还没打开用，看上去不错，等用了再来点赞",2018-06-07 16:59:11
1453004,5,"前两天买了一件，感觉不错，就又买了第二件！",2018-06-13 12:15:16
1453004,5,"款式时尚，面料舒适，价格实惠！",2018-06-21 21:50:57
1453004,5,"非常不错的衬衣   严选您帮我选",2018-06-19 19:50:40
1453004,5,"穿起来特别凉快，亚麻棉就是舒服",2018-06-17 11:40:58
1453004,5,"第二次购了，非常满意，推荐入手！！！！",2018-06-15 16:16:09
1453004,5,"满意，严选质量没得说",2018-06-14 08:19:53
1453004,5,"",2018-06-14 14:21:36
1453004,5,"做工精细，面料柔软，这都不算什么。可你为什么还要这么便宜？让人欲罢不能",2018-03-30 11:39:52
1453004,5,"好好看看",2018-06-12 22:36:29
1453004,5,"材质不错，质量应该很好，穿着舒适，总体感觉好",2018-06-07 16:57:45
1453004,5,"严选已经成为一个高质量定制的品牌了，价格这么低，还能把质量和标准做得这么好，让我着迷了。没想到这么合身，跟定制似的，以前都是买XS，这次买170的，太合身了。希望严选多做活动，把质量和信任做下去！",2018-06-09 11:49:11
1453004,5,"东西收到以后马上查看，发现与图片描述一致，超级喜欢，卖家发货速度很快，，服务也很到位，给老板点个赞，下次还会来购买.........",2018-03-31 12:17:48
1453004,5,"不错的体感",2018-06-07 07:52:03
1453004,5,"很好啊，小朋友洗澡很开心<U+0001F6C0>",2018-06-06 09:57:56
1453004,5,"棉麻衬衫质感非常不错，版型也好看",2018-06-03 08:44:14
1453004,5,"棉麻衬衫质感非常不错，版型也好看",2018-06-03 08:44:10
1453004,5,"棉麻衬衫质感非常不错，版型也好看",2018-06-03 08:44:06
1453004,5,"棉麻衬衫质感非常不错，版型也好看",2018-06-03 08:44:02
1453004,5,"挺好",2018-06-02 10:10:41
1453004,5,"挺好",2018-06-02 10:10:33
1453004,5,"原249-15买的，收来特价174，申请返差，客服服务很好，即使办理，索性又买了两件，三个颜色全了。中毒严选，希望一如既往的好。",2018-04-26 11:02:41
1453004,5,"严选品质值得信赖！衬衫质感非常舒服，做工细致，非常满意的购物体验。",2018-04-14 20:09:02
1453004,5,"太小了，比其他的药效很多",2018-05-18 18:30:24
1453004,5,"舒服，如鱼在水里游",2018-05-15 13:10:07
1453004,5,"非常舒服，版型不错颜色也很正，还会多买几件的",2018-04-19 12:43:20
1453004,5,"非常舒服，版型不错颜色也很正，还会多买几件的",2018-04-19 12:42:51
1453004,5,"版型好 不错的",2018-05-12 14:23:43
1453004,5,"第二次购买，这次买三件夏天穿，有点大，客服立即给办理换货手续，满意。衣服质量非常好，性价比非常高，已推荐给周围的小伙伴啦。",2018-04-14 16:57:59
1453004,5,"",2018-05-10 10:44:15
1453004,5,"",2018-05-10 10:44:00
1453004,5,"从包装细节可见品质我相信严选
好的品质是
严苛的锱铢必较是
甄选择的百里挑一
拆包核验棉麻材质穿着很舒服",2018-04-12 20:36:55
1453004,5,"虽说是合体版，但感觉上跟宽松版的差别不大，还是稍有点松垮，或许小一号更合适，注，我174，70公斤。穿着很舒适，很满意",2018-04-12 19:18:39
1453004,5,"宽松版版型不错，上身很舒服，哈哈～江南地区现在穿正合适",2018-04-14 15:26:31
1453004,5,"以前买过棉麻衬衫，穿着很舒服，这次趁着活动再入两件",2018-04-10 21:25:32
1453004,5,"以前买过棉麻衬衫，穿着很舒服，这次趁着活动再入两件",2018-04-10 21:25:25
1453004,5,"布料质感好，做工也很细致",2018-05-01 18:03:41
1453004,5,"很不错哦，穿了两个月了，很薄，修身",2018-04-29 17:16:17
1453004,5,"",2018-04-30 10:04:53
1453004,5,"棉麻的衬衫，真不错，舒服。买三件有大优惠，物流非常快。",2018-04-15 12:25:22
1453004,5,"穿着舒服。。。。。。。。。。",2018-04-28 10:31:21
1453004,5,"其它色没了，选了这个颜色，也很不错。适合这个季节",2018-04-14 12:34:31
1453004,5,"非常非常好，质量好价格便宜",2018-04-27 22:49:18
1453004,5,"看着不错，包装很好，虽然还没穿，赶脚很好",2018-04-13 11:04:35
1453004,5,"看着不错，包装很好，虽然还没穿，赶脚很好",2018-04-13 11:04:22
1453004,5,"很不错，价格也合适",2018-04-24 21:17:07
1453004,5,"合身，不错，不错",2018-04-24 21:15:48
1453004,5,"很不错，活动买的。质量很好。性价比很高。",2018-04-16 17:08:45
1453004,5,"这件衣服质量真的很不错，很好。上身效果也好看！",2018-04-15 00:08:17
1453004,5,"非常好。",2018-04-21 14:30:10
1453004,5,"东西很好，我很喜欢",2018-04-19 17:57:16
1453004,5,"合体版很合适，质地很好",2018-04-18 09:22:51
1453004,5,"跟预期一样，满意。",2018-04-18 13:58:17
1453004,5,"",2018-04-16 15:35:13
1453004,5,"",2018-04-16 18:36:53
1453004,4,"第一次买白色衬衫，白衬衫的确显黑，哈哈，还是皮肤白嫩的男生穿好看，不过还是愿意尝试一下，毕竟穿起来很合身，身高170，体重65，在健身，穿起来尺寸刚好。",2018-04-14 13:26:25
1453004,5,"立领版的棉麻衬衫，舒服。非常不错",2018-04-15 12:26:26
1453004,5,"很棒",2018-04-15 02:25:27
1453004,5,"衬衣不错，尺码合适，推荐，我177cm，68kg",2018-04-14 14:13:10
1453004,5,"非常满意的一次购物，以后会经常光顾的。",2018-04-14 20:10:34
1453004,5,"满意五星！",2018-04-13 16:50:01
1453004,5,"非常好，这个款什么颜色都想买了",2018-04-12 11:20:53
1453004,5,"宽松款，还算合身。面料摸起来柔软",2018-04-12 20:04:00
1453004,5,"",2018-04-12 20:33:48
1453004,5,"穿起来很舒服，很柔软，就是容易起褶，不过鱼和熊掌不可兼得哈，很喜欢。",2018-08-17 09:08:54
1453004,5,"衣服已穿上了，大小适中，还不错<U+0001F44D>",2018-04-09 06:59:16
1453004,5,"质量挺好的，值这个价",2018-04-10 23:30:24
1453004,5,"",2018-04-10 20:00:26
1453004,5,"非常友好的一次网购，物超所值!",2018-04-07 19:12:23
1453004,5,"好看 合身 穿着特别舒服",2018-04-06 11:20:40
1453004,5,"宽松版亚麻衬衫，质量好，价格实惠",2018-04-03 11:16:56
1453004,5,"这次买得正合身",2018-07-17 10:20:48
1453004,4,"衣服的质量很好，可惜有点显的成熟所以退货了",2018-08-03 10:58:45
1453004,5,"很好",2018-04-03 15:39:21
1453004,4,"需要熨烫，比较容易起皱。",2018-08-21 18:52:55
1453004,5,"好评专用",2018-04-02 23:30:41
1453004,5,"一直信赖严选，继续前行做的更好",2018-03-31 13:14:47
1453004,5,"很随性的风度，但不建议直接穿要和体恤搭配就很棒了，麻质感略微有点摩擦皮肤，我的皮肤较为敏感。",2018-08-05 15:09:31
1453004,5,"买了三次了，穿着舒服，就是掉色。",2018-07-10 23:28:21
1453004,5,"单穿很贴身舒适 也潮",2018-03-31 20:12:49
1453004,5,"不错",2018-03-28 14:30:09
1453004,5,"很舒服，布料很好值得购买",2018-03-27 08:05:53
1453004,5,"好",2018-03-27 19:04:28
1453004,5,"棉麻质感很不错，穿起来很舒服<U+0001F60C>",2018-03-26 22:50:43
1453004,5,"非常满意，实物颜色更深，我更加喜欢",2018-03-26 15:13:39
1453004,5,"版型不好，容易褶皱",2018-07-11 15:42:43
1453004,5,"穿了一次，时间长了估计掉色",2018-07-08 10:39:00
1453004,5,"柔软舒适",2018-03-25 18:09:13
1453004,5,"衣服不错，一直买",2018-03-17 09:04:42
1453004,5,"一口气买了两件衬衣，物流超给力，今天下午就收到了。一到手就迫不及待的上身试了一下，刚合身。担心会缩水，问了客服说只要不机洗应该不会。忐忑中",2018-03-05 18:16:58
1453004,5,"很帅气的衬衫，特价的时候买还是很实惠的，穿的很有型，严选的物品质量有保障。",2018-03-02 14:40:12
1453004,5,"182cm，100kg。买slim fit 185/104A 尺码正好，棉麻材质舒适。还没下过水，等下水后再追评吧",2018-03-13 10:30:11
1453004,5,"还没穿，打算春天再穿吧
还没穿，打算春天再穿吧
还没穿，打算春天再穿吧",2018-01-23 09:32:56
1453004,5,"还没穿，打算春天再穿吧
还没穿，打算春天再穿吧
还没穿，打算春天再穿吧",2018-01-23 09:33:06
1453004,4,"绝对热得一比",2018-07-10 15:58:49
1453004,5,"这个是给爸爸买的   宽松版型的    颜色也不是特别鲜艳   适合爸爸穿    质量不错  好评好评好评",2017-12-19 12:57:53
1453004,5,"衬衫非常好 质感价格都超值 物流也很快负责 有活动的话就更划算了",2018-03-10 18:17:49
1453004,5,"我买的时候140多，怎么现在又掉价这么厉害，99块，几个意思啊",2018-06-22 13:01:12
1453004,5,"衣服收到了  质量不错   包装很是专业    质量更是没的说   相信严选    直接买了三件   很划算   正品  好评",2017-12-19 12:56:36
1453004,5,"很好，洗过之后很rouruan",2018-07-08 09:53:27
1453004,5,"质量上乘，码子合适。找到以后买衬衫的去处了，虽然严选上款式不多不花哨，但质量杠杠的，简约",2017-12-14 19:29:54
1453004,5,"174，140kg，m码非常合身，版型非常棒。原以为和凡客当年质量会差不多(毕竟比较便宜)，出乎意料的好！",2017-12-13 18:24:46
1453004,5,"衣服手感不错，版型也还可以，尺码合适，不厚。目前还没过水不知道洗后如何，有图为证",2017-12-13 12:48:24
1453004,5,"没有想象中好，但也不错",2018-06-21 06:59:25
1453004,5,"很好，洗了也不皱！推荐",2018-06-22 20:17:00
1453004,5,"非常合身，修身剪裁，款式也很不错，物流相当给力，隔天就到，一如既往地的支持，给满分！！！",2017-12-11 19:35:07
1453004,5,"穿上特别舒服，感觉好好，给老公买了一件，又给儿子买了一件，都喜欢",2018-06-30 09:52:24
1453004,5,"不错，质量可以，适合夏季穿。172cm65kg穿M号，大小很合身，只是正面衣长稍微略短，长一点就完美了",2017-12-15 16:25:54
1453004,5,"降价，<U+0001F44D>",2018-06-16 15:54:45
1453004,5,"本人168/68，M号比较宽松，衬衫是棉麻面料，里面最好穿一件打底衫",2017-12-12 19:00:00
1453004,5,"价廉物美，设计细致。很漂亮。",2018-07-29 20:06:41
1453004,5,"买三赠一，很合适，面料也很舒服，夏天穿都没问题",2018-05-18 19:06:14
1453004,5,"绅士夏季的必备衬衫之一。比全棉材质的更透露出清爽的气息，让坐在旁边的女同学忍不住想触摸。立领款是新潮流，fantastic",2018-05-21 14:14:57
1453004,5,"超级棒哦～版型设计、面料采用、做工质量都是一级的赞！全五星好评！",2017-12-18 15:48:46
1453004,5,"衣服很不错啊！比得上某库的质量，简约不简单！",2018-06-18 14:31:28
1453004,5,"客服推荐的号码非常的合身，颜色非常的好，价格实惠。适合打工人士使用。",2017-12-15 22:22:11
1453004,5,"退了，颜色不是太喜欢",2018-06-09 07:46:40
1453004,5,"一直没穿，应该不错，棉麻有点旧旧皱皱的感觉，活动很便宜",2018-01-23 23:35:39
1453004,5,"一直没穿，应该不错，棉麻有点旧旧皱皱的感觉，活动很便宜",2018-01-23 23:35:54
1453004,5,"穿起来很舒服，吸汗透气，可惜170的只有这个颜色了。不然会多入几件！！",2018-06-10 22:35:34
1453004,5,"美中不足的是箱子被拆开过，衣服包装袋也被拆开过",2018-06-17 07:34:56
1453004,5,"质量很好，穿着舒适，值得拥有",2018-06-23 09:18:30
1453004,5,"174/75kg，买的都是L，好评，质感",2018-03-07 17:16:26
1453004,5,"合体。修身，非常不错",2018-06-12 11:02:08
1453004,5,"第二次买 很舒服 值得囤货",2018-06-09 06:53:47
1453004,5,"初次买的有点小了，店家立马给调换了，上门取的货，还换到了喜欢的颜色！棒棒哒！",2018-08-20 12:10:53
1453004,5,"好东西，不错不错<U+A242> <U+0CED>(<U+02F5>ˉ<U+0334><U+0352><U+A1F4>ˉ<U+0334><U+0352><U+02F5>)<U+0C68>”",2018-01-06 18:52:21
1453004,5,"这个真舒服，物美廉价。",2018-06-16 14:46:43
1453004,5,"棉麻贴身稍微有些扎",2018-06-15 20:19:09
1453004,5,"第二次买，很满意。只是快递公司竟然凌晨十二点半打电话让人收快递，让人无语。",2018-06-03 15:24:58
1453004,5,"剪裁不是很合体",2018-06-13 20:19:41
1453004,5,"一下子买了三件，今年的衣服250元就搞定了，质量也不错，非常值得。",2017-12-12 18:58:34
1453004,5,"衬衫收到，衬衫节买了三件，质量不错，选择严选没让我失望，满意。",2017-12-11 21:23:18
1453004,5,"尺寸合适，标准。
颜色非常适合，穿着都说好看。
贴身穿，很舒服的面料。
还会再次购买的。",2018-08-21 08:39:06
1453004,5,"第二次购买，第一次249，这次99，不知是第一次买亏了还是这次赚了，质量蛮好的超值",2018-08-20 19:47:42
1453004,5,"真的好，像我这种微胖体型穿上也特有型的，买三免一，大商大爱，一旦拥有，别无所求，至此爱上严选了<U+0001F463>",2017-12-28 13:00:13
1453004,5,"后悔当时买早，现在才99",2018-06-13 15:54:51
1453004,5,"料子很舒服，唯一不满的是L号，袖子有点长，偏肥。M号又稍微偏短。严选有毒，网购有瘾，且买且戒。",2018-06-09 03:49:35
1453004,5,"好得不得了 …",2018-02-14 20:52:01
1453004,5,"码数偏小，特意买的大一码，男朋友穿上刚刚合适，特价时买的，材质很好，是棉麻的。",2018-08-09 23:35:17
1453004,5,"还不错",2018-02-07 14:02:29
1453004,5,"已中毒",2018-02-01 16:59:59
1453004,5,"不多说了，漂亮，帅气，无异味，做工精细，超值！一如既往信赖严选！",2017-12-14 23:41:59
1453004,4,"喜欢这个衣服，夏天超凉爽透气，就是洗了容易皱",2018-06-03 09:24:08
1453004,5,"网易的东西我还是信任的，可惜我胖了点  有点圆",2017-12-12 19:27:31
1453004,5,"麻的贴身穿有点刺。洗一洗会不会好一点？",2018-06-02 13:43:56
1453004,5,"挺舒服的棉麻料",2018-01-24 15:40:48
1453004,5,"这个颜色有点驾驭不住 还没穿",2018-05-21 15:02:33
1453004,5,"帅",2018-01-20 13:51:01
1453004,5,"衣服很好。夏天穿特别适合。本人女生，我故意买了男款自己穿。oversize的穿非常随意舒适。哈哈哈哈。",2018-07-14 11:14:48
1453004,5,"原本买大了，调小了一号，换货时间比较长。和男朋友前天刚分手，今天他收到了调换后的衣服，希望他会喜欢。我也依旧爱他……",2017-12-27 22:36:15
1453004,5,"网易真不错，上件买小了，二话不说立马换，新的衣服潇洒飘逸，就是版有点瘦！",2018-07-21 22:12:50
1453004,5,"版型质量超好，严选值得信赖！",2018-01-12 13:10:11
1453004,5,"保暖衣接触皮肤很舒服！做工相当精细！衬衣做工也不错很精细！",2017-12-14 10:39:12
1453004,5,"帅气",2018-01-09 01:44:19
1453004,5,"以前买过，穿着很舒服，这个季节买，价格很合适，秋凉再穿，没打开看，质量应该没问题",2018-07-10 13:04:28
1453004,5,"布料手感很好，就是容易皱。",2018-08-15 11:36:24
1453004,5,"很好，透气，简单大方",2018-01-08 14:26:23
1453004,5,"",2018-01-07 20:40:02
1453004,5,"给男票买的，还担心大了不敢洗，试穿后立马下水，可惜还没看够，下次再来件白色的^_^",2018-05-17 08:44:34
1453004,5,"肥胖人士穿",2018-01-06 20:12:50
1453004,5,"不错<U+0001F44D><U+0001F44D><U+0001F44D> 不错<U+0001F44D><U+0001F44D><U+0001F44D> 不错<U+0001F44D><U+0001F44D><U+0001F44D>",2018-08-17 18:19:54
1453004,5,"退货",2018-05-31 10:33:18
1453004,5,"简洁，帅气，穿着舒服",2018-01-04 10:52:36
1453004,5,"这个很满意，老爸穿宽松版的很合适，不像一般的衬衣穿出来都是腰身合适了袖子长，袖子合适了有偏瘦。还有就是，活动时五折好划算",2018-05-03 16:10:39
1453004,5,"好看！",2018-01-04 02:44:46
1453004,5,"全麻的衣服穿着很舒服，超值啦",2018-01-01 12:04:22
1453004,1,"只穿了一个月，衣领就起毛了",2018-05-09 19:31:50
1453004,5,"手感很好，穿着很舒服，对得起这不到一百的价格！",2017-12-15 11:02:16
1453004,5,"颜色不错，穿着舒适",2018-01-01 12:05:00
1453004,4,"立领版这个颜色实在有些意外，有点太粉嫩了。这牛仔蓝太不牛仔了。",2018-05-20 10:29:31
1453004,5,"颜色比想象中浅一些，摸着手感不错，还没有穿，过几天就穿起来！",2018-04-26 20:46:48
1453004,5,"大小合适，穿着舒适，价格合适",2017-12-31 11:03:32
1453004,5,"一如既往支持严选，特价买的很划算，先囤着夏天穿",2017-12-13 20:58:48
1453004,5,"很舒服 就是洗完之后 皱皱巴巴 晾干费劲 穿穿就好了",2018-04-30 16:09:02
1453004,5,"一如既往支持严选，特价买的很划算，先囤着夏天穿。",2017-12-13 20:57:20
1453004,5,"还不错。",2017-12-28 16:32:02
1453004,5,"衬衫节买了三件，1.时尚休闲牛津纺2.法国雨露棉麻3.男士商务。厚度是时尚牛津最厚，比较挺，上身舒服。其次是雨露，稍微柔软一点，有麻料特有的质感。没想到居然是商务最薄，感觉不算特别挺，不过比较亲肤，应该适合初秋季节穿。总体而言超值，都很舒服！",2017-12-28 14:15:49
1453004,5,"非常不错，换货一次",2018-04-26 01:41:54
1453004,5,"质量很好，比平时的麻质衣服手感软。帮老爸买的，老人家觉得容易皱，不知为啥？哈哈哈可爱<U+0001F60A>！",2018-07-09 16:00:12
1453004,5,"质量好穿着舒服 严选 值得信赖",2017-12-24 12:12:24
1453004,3,"衬衫还行，但是看起来并没有想象中什么全世界最好的麻，那样好。等穿完一次再来谈谈感受。",2018-04-30 17:22:46
1453004,5,"棉麻手感不错，留到春暖花开时再穿吧",2017-12-23 10:06:45
1453004,5,"一次搞定 质量不错 严选",2017-12-24 12:14:07
1453004,5,"质量很好 穿着舒服",2017-12-24 12:14:52
1453004,5,"",2017-12-24 01:36:04
1453004,5,"质量很好，穿的很舒服，选择虽然没有淘宝多，但看的出来都用心了，望越做越好",2018-06-15 22:33:54
1453004,1,"洗后跟旧衣一样，皱巴巴的，没有宣传的质量。",2018-04-27 21:35:38
1453004,3,"不好意思只能给三星了，买来还没穿过刚拿出来，我才发现颜色给我送错了……送成了藏蓝色",2018-04-14 22:55:04
1453004,5,"还不错<U+0001F44D>，算是老严选粉了",2017-12-23 10:38:32
1453004,5,"很好<U+0001F44D>基本合身，穿起来很舒服，白色略透",2017-12-12 16:34:38
1453004,5,"衣服洗好后穿了，质感很好，穿着很舒服，唯一不足的就是衣服发回来少了个扣子，包装里面找了几遍没找到，最后拆了个扣子缝上去了，多年没有做手工活了，还不错",2018-04-24 23:27:13
1453004,5,"非常喜欢",2017-12-21 16:02:34
1453004,5,"蛮帅的(⊙o⊙)哦，最大号，178cm，180斤。",2017-12-16 21:13:04
1453004,2,"洗过后容易变形",2018-04-17 03:58:29
1453004,5,"衣服非常好。会继续支持严选。",2017-12-19 12:27:34
1453004,5,"衣服非常好。会继续支持严选！！！！",2017-12-19 12:28:15
1453004,5,"衣服非常好。会继续支持严选！！！",2017-12-19 12:28:56
1453004,5,"做工版型没的说，很不错！",2017-12-19 19:41:52
1453004,3,"这个颜色很不推荐，特别像是医院的那种蓝色护士服的颜色，不过我也懒得换了毕竟一共也没几个颜色可选，都是余货",2018-04-15 22:05:43
1453004,1,"衬衫的边歪歪扭扭的，我看很多人晒图也是这样的。。。大家都无视这个情况的么？？好奇
客服很好，给退货了。。。还是想这里问问",2018-04-14 12:55:51
