"itemId","star","content","createTime"
1481018,1,"明明拍的是36码，却发成了39码，问过客服说没码换不了了，只能让我申请退货，可是已经关注了大半个月，居然因为人工的错误，发错货，仅仅让退货是弥补不了顾客的心情的，本来觉得自己要进严选坑了，经过这次好失望！！！看到同一双鞋子，收到的评论都是发错码，我觉得严选这次应该要检讨下为什么这样，针对我们这些用户来个返场优惠，不然真的遗憾而且失望。刚好同事合适，退了也可惜，只好割爱了，哎",2018-04-11 00:38:39
1481018,5,"非常满意，质量很好。",2018-05-05 13:49:50
1481018,5,"买了两种颜色的，黑色的上班穿裸色的日常穿，高度合适，上班走走不会太疼，走路走多了还是有点不适，可能个人脚型关系吧。第一次发错了码～颜值不错。",2018-05-07 12:56:20
1481018,5,"很好看 质量也很好",2018-05-04 10:04:21
1481018,1,"在严选买了好多次，这次是最不满意的购物体验",2018-04-13 09:48:14
1481018,5,"大小合适，穿起来很舒服。",2018-05-04 14:16:37
1481018,4,"看到评论里说鞋都发错码，那我是幸运儿，是喜欢颜色才买这款的个人认为鞋底比较薄蝴蝶结有点不对称，便宜就随便穿穿吧！",2018-04-14 17:48:08
1481018,5,"穿上非常合适，划算！",2018-05-04 23:15:43
1481018,5,"这鞋子本身不错，但我下38码，给我发36码，换货还没到，不知道能否正常码子，在严选购物到现在，从没退和换，这是第一次！",2018-04-14 09:33:00
1481018,5,"漂亮，舒服，价格实惠！",2018-05-04 23:15:59
1481018,5,"发错货了，沟通很顺畅，上门取件换了货",2018-04-17 09:12:59
1481018,5,"好穿",2018-05-04 14:54:46
1481018,5,"挺好",2018-05-04 06:59:40
1481018,5,"第三次购买。。。第一次蝴蝶结不对称退了，第二次发错尺码转让我朋友了，第三次终于没发错了，可是对鞋子的热情已经淡了，鞋底比较硬，不太好走。而且右脚上有一个明显的小黑点，穿了才发现",2018-04-23 14:00:31
1481018,5,"还行，有些硬，鞋跟符合要求，作为工作鞋可以了。",2018-04-14 14:29:14
1481018,5,"好看",2018-05-04 16:07:50
1481018,5,"这是换货，原来发错了，后来联系客服进行了调换。不能不说，网易售后服务很不错，换货非常及时和顺利，把顾客因为发错货引发的不良情绪化解于无形。作为严选的死忠粉，真心希望严选越来越好！",2018-04-17 09:54:49
1481018,5,"颜值高！",2018-05-04 23:06:57
1481018,5,"鞋子很漂亮，号也是对的，包装很严实。左边鞋的鞋跟处没处理好，有些不稳，但影响不大，右边的鞋就没事儿。还送了半垫，还有备用的鞋跟垫。",2018-04-14 20:32:14
1481018,5,"挺漂亮的鞋，穿着舒服。",2018-05-03 11:24:30
1481018,5,"买的34的给我来的35的 咋和评论一样一样的 这么多人换来换去的不找原因吗 严选铁粉表示不能理解 福袋给我寄个本 55555",2018-04-12 20:47:57
1481018,5,"不错，穿上很好看",2018-05-03 22:44:42
1481018,5,"好看，舒服，穿上显得脚又瘦又美，跟的高度很合适，不会觉得累，鞋子版型也很好，也不觉得卡脚。平时三八三九都能穿，买的三九码，很合适。随鞋盒赠送了半码垫，但是没用上。包装很用心，连蝴蝶结里面都加了海绵，完全是好鞋一双！",2018-04-13 21:01:38
1481018,5,"第二次购买，感觉质量好，喜欢",2018-05-03 18:10:55
1481018,5,"太好看，本来想买茱萸粉，没有40的，黑色也好看，40的也不显脚大，看评论80%都把码发错了，还担心呢，收到第一时间看号，40的没错，试穿很舒服，鞋跟既舒服又好看，我脚宽，前面稍微有点挤脚，过一阵就没事了，",2018-04-12 21:58:22
1481018,5,"鞋子很好，很稳",2018-05-03 14:18:45
1481018,5,"买的38码收到36码… 开始没注意我一度以为得削掉脚后跟才能塞进去…  跟客服沟通  说退货+ 20元现金券（老套路） 上次买的一男士衬衫穿了没多久 袖子直接开线接近10厘米 客服也是给了20代金券了事。 这次在多次沟通后才得到等处理换货的结果。 这次发错货事故+ 客服习惯性补偿建议 估计要流失好多用户了！ 估计以后也要弃严选了！ 很垃圾！",2018-04-12 00:40:24
1481018,5,"henh",2018-05-03 22:45:04
1481018,5,"订了38码，发了36码，不能换只能退货，然后送的会员福袋也要退回去。看了评论区一片差评，看来是故意发错码的，表示愤怒，而且会晒朋友圈",2018-04-11 19:19:09
1481018,5,"看着挺好的，还没穿，粉粉的很美",2018-04-25 09:01:06
1481018,5,"很舒服很舒服，虽然有点小波折，但是还是好评喔",2018-04-25 18:58:44
1481018,1,"买的35发过来37的，要人怎么穿",2018-04-11 15:32:18
1481018,3,"我想说看起来挺好看的，但是穿的一点都不舒服，它的鞋头太窄太窄，穿着就像裹足一样",2018-05-07 12:29:36
1481018,5,"不错，很稳，样子也好看，不硬的",2018-05-02 14:29:39
1481018,2,"一直用严选的产品，觉得不错。但这次鞋子买的36码，收到货是39的。怎么了？",2018-04-13 10:57:47
1481018,3,"尺码偏小，退货时选这项，还要求拍照上传，why? 是要传什么问题呢？",2018-04-19 22:39:29
1481018,5,"鞋子真的很漂亮，好喜欢",2018-05-02 09:01:01
1481018,5,"舒适又好看 大爱",2018-05-02 19:29:03
1481018,3,"买的38码，邮来36码，黑线",2018-04-22 10:22:09
1481018,5,"真的如履平地",2018-05-02 16:13:08
1481018,3,"买的36码，发的是39码",2018-04-17 22:52:35
1481018,5,"囤货好穿",2018-05-02 12:59:13
1481018,3,"寄错号码了",2018-04-13 18:01:34
1481018,5,"囤货",2018-05-02 12:58:55
1481018,5,"非常不错，点个赞<U+0001F44D>。右脚很舒服，左脚后跟担心磨脚，应该是我的脚的问题。",2018-04-18 17:51:04
1481018,5,"好",2018-05-02 09:26:31
1481018,5,"鞋子很好看，穿上显的脚很秀气，本想再买个黑色，可是发现下架了",2018-04-24 11:51:03
1481018,5,"好",2018-05-02 12:54:12
1481018,1,"买的38码，发的36码，换货竟然要求原价购买，连带赠品一起退货，这次严选太不靠谱了吧",2018-04-12 16:31:49
1481018,5,"非常好穿的鞋，尺码很合适，高度也很好，不累",2018-04-18 14:26:29
1481018,1,"拍的36码，送成39。客服说没货换不了。。。哈哈哈。。这样也行。。。没办法，退了",2018-04-10 22:58:21
1481018,5,"很漂亮，跟也不会太高，挺舒服！",2018-05-01 09:58:45
1481018,1,"我买的39，发成38，不知道严选出了什么问题。。看到买别的买错发成39的评论好像直接互换。。",2018-04-11 18:02:37
1481018,5,"款式优雅知性，穿着比较舒适，略有些夹脚。",2018-04-24 22:07:12
1481018,5,"第一次严选给我发错的货就是这鞋，还好换货及时",2018-04-28 00:40:14
1481018,5,"好",2018-05-01 07:18:07
1481018,1,"买36，给39，并且无法换，因为没码了，一看评论，原来这么多都发错了，是不是应该正式说明一下？",2018-04-12 13:34:48
1481018,5,"非常舒适，特别软，第一不穿就可以走远路",2018-04-29 18:19:47
1481018,5,"很不错，挺好的，就是蝴蝶结有点脏，给补偿了券",2018-05-01 15:39:22
1481018,5,"很漂亮的颜色，送了半垫",2018-04-30 21:27:40
1481018,5,"穿了一天都不打脚的鞋很棒",2018-05-04 15:58:47
1481018,5,"很合适",2018-04-30 22:20:57
1481018,5,"质量好，就是我穿着有些硬",2018-05-02 12:49:33
1481018,5,"好，质量超级好。超级喜欢，，超级满意，喜欢严选",2018-04-28 01:19:27
1481018,5,"鞋子很不错，5cm的跟穿着也并不辛苦。
需要点赞的是小花，不像别的鞋花是胶上去的，这双鞋的小花是车上去的，不需要担心有天会掉下来。",2018-04-27 16:42:11
1481018,5,"很喜欢，这个颜色很有内涵，显得高雅端庄，正是想要的。",2018-04-16 22:52:15
1481018,2,"鞋好看。码发错。我想要35粉，换货只有35黑。唉，勉强换黑色。我想要粉色啊。心情都不好了。",2018-04-11 19:57:32
1481018,5,"鞋子好看又不磨脚，很棒",2018-04-29 21:42:30
1481018,5,"看评价大部分发错码数，好庆幸没发错，很喜欢",2018-04-15 23:21:49
1481018,5,"买的35码发了37码，我也是醉了",2018-04-12 12:35:49
1481018,5,"好",2018-04-29 22:49:00
1481018,5,"好",2018-04-29 09:26:37
1481018,3,"码数不对，在换",2018-04-15 20:02:40
1481018,5,"终于拿到想要的码数了。鞋很好看，喜欢",2018-04-15 21:22:33
1481018,5,"买的36发的39，幸亏上门取货",2018-04-14 11:08:40
1481018,5,"我的脚一直不敢穿尖头高跟鞋，朋友推介来的，抱着试试的心态，结果意外的合脚和舒服，一点也不磨脚，一买停不下来了，哈哈。",2018-04-16 18:12:36
1481018,5,"发大三码的，没有小的，可惜！",2018-04-12 09:11:07
1481018,5,"鞋子很舒服，就是买37略大36略小",2018-04-24 18:36:36
1481018,5,"发错尺码有点不可思议",2018-04-12 21:41:19
1481018,5,"挺好的，颜色也好看",2018-04-28 22:06:41
1481018,1,"拍的35，发的37，浪费时间还要贴邮费换货，差评送给你",2018-04-23 01:13:19
1481018,5,"尺码标准，脚感舒服。",2018-04-28 20:23:20
1481018,3,"不是吧，刚收到货就降价！！尝鲜价难道不是应该更优惠吗？",2018-04-12 06:47:42
1481018,5,"很喜欢<U+0001F495>",2018-04-28 05:38:36
1481018,1,"要的36，发的39。要换没有码，要退要扣钱，严重影响心情",2018-04-12 12:36:28
1481018,5,"希望多出点大码鞋子",2018-04-27 09:23:25
1481018,1,"太离谱了，看评论很多人发错货了，给个合理的解释呗",2018-04-23 01:14:11
1481018,1,"跟大部分人一样，发错货了，发成37码根本穿不了",2018-04-12 13:34:29
1481018,5,"大小合适",2018-04-27 16:07:22
1481018,5,"超级好看",2018-04-27 19:01:48
1481018,1,"越来越差了，竟然大家都发错码了
包装也是越来越差。",2018-04-12 21:04:52
1481018,5,"鞋子穿起来超舒服 想再买一双",2018-04-26 15:44:56
1481018,1,"偏小，第一次发错码，这次一看鞋码对了，但是挤脚，因为是晚上试的以为是脚肿的缘故，结果发现是鞋子偏小一码，已经下地了，没法退换了，好在鞋子百搭款，颜色柔和，就不特别心塞了",2018-05-05 12:41:49
1481018,5,"给一位朋友买的，大小，舒适度都很合适，相信严选！",2018-04-19 10:00:00
1481018,1,"这双鞋我明明拍的是36码，我的订单图也是36码，点进来变成39码，收到39码的鞋，而且没有36的可以换了。呵呵。对严选开始没那么迷信了，也挺好。",2018-05-02 14:15:53
1481018,5,"鞋子很漂亮，质量也很好。",2018-04-26 09:56:19
1481018,1,"虽然是严粉，但要第一次给严选差评！希望包装和售后部门再接再厉。第一次发错码，买39，发38。跟客服无数次沟通，感觉沟通花的时间都不只几千块……经历了将近20天的换货后，终于收到了，但是发来的蝴蝶结不对称，挺歪的，而且39的脚，穿它39的鞋，挤脚明显，号码偏大鞋偏小。想要换货，却发现下架了。图个便宜实惠买个鞋，果然风险极高，还是乖乖去买商场的品牌鞋子吧。",2018-04-29 23:09:35
1481018,5,"美得没话说，舒服的要死人，哈哈哈哈哈",2018-04-22 21:46:27
1481018,5,"漂亮的鞋再多一双！",2018-04-26 18:38:28
1481018,5,"很好<U+0001F44D>有点小",2018-04-25 21:36:23
1481018,1,"买的39发给我38，搞什么鬼，发货也不看看吗",2018-04-11 20:33:03
1481018,3,"平时穿37码鞋子，这款起初也买了37码，试穿有点顶脚，就换了38码，然而早上回到公司，开始换了这双新鞋子穿，晚上还未到家时，觉得有点磨脚了。第二天继续穿，想着穿袜子是不是好点，但是穿了袜子，明显鞋子有点小了。然后脱了袜子，又有点粘脚，各种不舒服。",2018-04-24 12:55:42
1481018,1,"这双鞋是真的一星都不想给，先是发错货，客服说是很多人都发错货了，换了货之后根本不能穿，非常压脚面。我确实不是瘦脚，但是我穿其他品牌的同类型的鞋子38码全部都刚好，只有这双不行，所以最后还是给退了。
因为这双鞋我差点对严选失去信心，怀疑自己买的几千块钱的东西是不是都没有它说的那个质量。
最后希望严选能严格像名字说的那样，严格选择。",2018-04-24 15:19:12
1481018,5,"好看",2018-04-25 13:12:37
1481018,5,"漂亮",2018-04-25 20:49:51
1481018,5,"不错",2018-04-25 10:17:38
1481018,1,"垃圾，买的36，收到39～干什么呢？本来有用的，这下又得去商场重新买类似的，换货这一来一回要耽误多久？严选之严何在？要求给个说法",2018-04-12 00:05:39
1481018,5,"非常贴脚，不磨，漂浪好穿",2018-04-24 09:18:14
1481018,1,"发错码数了…………",2018-04-18 22:13:09
1481018,5,"穿着还是挺舒服的",2018-04-24 09:54:16
1481018,1,"不满意",2018-04-17 21:14:18
1481018,5,"挺适脚，我脚瘦。脚肥建议买大一码",2018-04-16 22:00:25
1481018,2,"之前寄错了，看评论发现90%的发错了，不知道这回是怎么了，退回吧还不能选上门自取，之前看宣传说的退换货多简单。退了后返运费也是券的形式，7块钱的运费还要核对付款记录，也是心累！",2018-04-16 17:56:09
1481018,5,"花是斜的有点不习惯！小贵！",2018-04-23 12:24:26
1481018,1,"首先我买的是34码，发错成35码了，对此次大规模发错货很失望。第二，我的换货时间提前预约确定了，事情很多，特意安排出换货时间，结果系统配送的的快递员休息，和快递员联系他也不确定是否安排了其他快递员；和严选客服反映问题，先是让我自己去联系快递，并没有及时有效帮我解决问题。我长期出差在外，本来想这个周末回来试下鞋子是否合适，现在34码的鞋子还未寄出，给我的生活带来了很大不便，差评！！我本是严选粉丝，开始失望了<U+0001F61E>",2018-04-16 10:34:20
1481018,5,"鞋子特别好穿，新鞋第一天穿都没有不舒服的感觉，而且我是几乎不穿高跟鞋的女生都觉得没有问题，大胆的买吧，严选的东西只要看上了就不要犹豫，值得信赖只要",2018-04-23 08:54:44
1481018,5,"发错货",2018-04-14 00:06:10
1481018,5,"很好看，尺码也合适，满意",2018-04-23 18:24:01
1481018,1,"提前就关注的鞋子，第一时间拍下，结果买的36，收到的39！！！换货显示没尺码！只能退！今天早上一看又有尺码了，可是我已经退货了！再买又比以前贵！",2018-04-12 09:34:09
1481018,5,"有一点点大，但是鞋子上脚很舒服，鞋跟高低合适",2018-04-19 09:53:12
1481018,1,"拍的38，收到36！让人无语！",2018-04-12 12:52:17
1481018,5,"很漂亮，精致，喜欢",2018-04-23 07:28:34
1481018,1,"发错尺码！！！！！！是故意的吗？？？",2018-04-12 10:01:39
1481018,1,"买的38码，发的36码，换货的时候没库存，找客服建议退货，等有库存再拍，我说价格就不一样了，又让我等库存有了再换，看了别人的评价，貌似这次发错货是普遍现象，严选竟然没有一个公开的致歉声明，然后给出统一的解决办法，确让客服跟顾客在退货和等货中绕来绕去，真是浪费时间。",2018-04-12 09:16:08
1481018,5,"又漂亮又舒服",2018-04-23 13:31:19
1481018,5,"又漂亮又舒服",2018-04-23 13:31:36
1481018,2,"不看不知道 一看吓一跳 严选可真是故意给自己打脸吗 周年庆 一双鞋子惹来这么多呼声 发错码 这么多人都发错码 而且无法换货 只能退 终于等到有货可以换又要等到收回货物检验后再完成换货 来来回回周期拉这么长 买到一双合心意的鞋子不容易 弄这么一出 真是心塞",2018-04-12 20:26:06
1481018,5,"非常喜欢，淑女",2018-04-23 09:53:27
1481018,1,"看到原来被发错货的人不止我一个，瞬间感觉很差...下午申请换货发现没有尺码了，晚上却又是全线有货...只想问严选是几个意思？！哎...把账户里的余额用用完，大约不会再来了……另外，同时还拍了另外款式的一双，没有什么问题，所以应该是操作这款的团队出了问题……蛮想要你们给个解释的",2018-04-12 00:06:41
1481018,5,"非常满意",2018-04-23 11:28:10
1481018,5,"几经周折，终于收到鞋子，跟比较低，有点不太习惯，不过还算舒服，蝴蝶结是歪的，强迫症表示有点难以习惯…",2018-04-24 22:03:56
1481018,5,"不错",2018-04-23 14:29:55
1481018,5,"不错",2018-04-23 14:30:14
1481018,5,"不错",2018-04-23 14:30:24
1481018,4,"码是对的，样子也不错，就是有一边鞋底粘的不是很细致，严选的品控感觉不如以前了",2018-04-15 11:04:09
1481018,5,"已经退换货了，看到那么多人也被弄错尺码，放心了。不知道有没有承担责任的。",2018-04-17 19:57:06
1481018,5,"天呐 这是公主的鞋子吧 又稳又优雅 刚拿到看到鞋窄窄以为穿不进去 结果很合适啊",2018-04-14 11:56:12
1481018,5,"非常号，码正",2018-04-22 10:40:56
1481018,5,"很喜欢地就穿上了，过了一会脚疼啊，为什么我的脚这么胖<U+0001F622>",2018-04-25 19:59:44
1481018,5,"不错 很漂亮",2018-04-22 11:55:00
1481018,5,"发货后，短信通知检查尺码，果然小一码，申请换货，全程无忧退换，顺丰快递取货，快速到货，赞<U+0001F44D>。",2018-04-17 19:55:19
1481018,5,"鞋子很舒服",2018-04-22 00:23:34
1481018,5,"鞋子不错，就是尺码发错了，第一次退回，发现严选服务十分方便，还赠送了30购物券，比较满意，顺丰小哥也很快速。",2018-04-16 12:47:32
1481018,5,"好看",2018-04-22 22:20:48
1481018,5,"可以",2018-04-22 14:08:59
1481018,5,"好小哦，尺码偏小，换大一号肯定又太大了 还是不换，基本上还是满意的",2018-04-19 19:09:18
1481018,1,"早早定的鞋子，发货错误不能穿，再买已经下架无法参加活动，很生气",2018-04-11 10:27:11
1481018,5,"这个是真的，又好穿又好看，完美！",2018-04-20 12:31:06
1481018,5,"额，胖脚真没法穿，买双40的，比我39的还小。已退，严选退货还是挺痛快的，顺丰上门取货，不收费",2018-04-19 09:32:25
1481018,5,"号码小了，果断换了大一号",2018-04-21 22:11:02
1481018,5,"之前码数发错商品下架只能退货，因为实在挺喜欢又花了不少时间看，发现有货还是又一次拍下。好穿也。喜欢。",2018-04-15 00:53:27
1481018,5,"合脚颜色好",2018-04-21 11:49:09
1481018,5,"原来大家都遇到发错码的问题，我们要不要去@三石同志，我要36码的，发39码的给我是个什么意思？？？",2018-04-12 14:36:42
1481018,5,"买的38码，发的36码。看评论很多人的订单都发错了，想问一下，是机器人发货的嘛？不然怎么会这么多失误？",2018-04-12 09:33:44
1481018,5,"不错啊",2018-04-21 15:51:45
1481018,5,"还不错",2018-04-21 20:45:50
1481018,5,"我买的是34码，为何寄给我的是35码？该找谁！！！",2018-04-10 17:49:39
1481018,5,"一波三折算了解决了，鞋子质量好，后跟不磨脚",2018-04-17 14:27:27
1481018,5,"平时穿36.5，这次买的37码有点紧，穿了脚有些疼",2018-04-22 08:30:23
1481018,5,"好看，舒适，关键还很便宜",2018-04-20 18:07:03
1481018,5,"换回来了，还没试穿",2018-04-20 07:55:23
1481018,5,"很漂亮但是不能久穿，适合不要走什么路的时候穿",2018-04-25 14:15:50
1481018,5,"感觉比粉色的质感好",2018-04-20 19:54:28
1481018,5,"挺好看的，今天穿了一下，很磨脚哦，有点小失望",2018-05-04 19:26:17
1481018,5,"样子很漂亮，拍38，邮寄37，我说是配货员报复严选故意发错，却要消费者承担结果，看评论鞋子发错的也太多了吧",2018-04-18 23:52:47
1481018,5,"很漂亮的鞋子，喜欢",2018-04-20 16:40:36
1481018,5,"非常好看，但是前面有一点点磨脚，然后有点掉色",2018-05-07 12:20:22
1481018,5,"挺好的",2018-04-20 23:25:23
1481018,5,"穿起来可以，鞋头蝴蝶结部分有明显的粘胶痕迹",2018-04-27 13:41:25
1481018,5,"还不错",2018-04-20 01:06:19
1481018,5,"号码发错了，等待新鞋来，样子还是很好看的",2018-04-16 21:02:16
1481018,5,"美丽",2018-04-20 02:11:09
1481018,5,"好看",2018-04-20 09:59:43
1481018,5,"蝴蝶结在两只鞋子上的位置不对称，上脚的舒适感也就是这个价位的感觉，穿一个下午下来脚还是会痛，尤其是鞋头那个位置",2018-04-20 16:02:40
1481018,5,"鞋子和图片有色差，蝴蝶结的材质显的比较廉价。懒得换了",2018-04-15 06:30:15
1481018,5,"穿着很舒服，性价比高",2018-04-19 10:21:06
1481018,3,"舒适度有待改进 磨小脚趾",2018-05-07 23:27:20
1481018,5,"很舒服，穿上很好看",2018-04-19 22:13:11
1481018,5,"鞋子的质量确实可以，穿着很舒服，唯一的缺点是走路声音很大，不只是跟在响，听上去声音像是脚和鞋之间有空气的声音，比较难理解。不知道别人会不会有这个问题？但是总体上说，以后应该会相信严选，继续买东西！比起淘宝货比三家，这种质量有保障的平台很好！",2018-05-07 13:52:57
1481018,4,"款式很漂亮，但脚感一般。",2018-04-19 19:28:56
1481018,5,"小了，退掉了",2018-05-06 06:05:57
1481018,5,"偏大，建议买小一号",2018-04-19 00:18:27
1481018,5,"严选一直满意！只是这双鞋发错了两次！",2018-04-27 14:49:47
1481018,5,"很好的货物送货上门神速！！！",2018-04-19 18:45:44
1481018,5,"发错了号码",2018-05-04 19:28:00
1481018,5,"鞋子质量不错",2018-04-19 10:16:48
1481018,5,"真的好看的，就是一开始尺码发错了比较讨厌",2018-04-15 19:18:38
1481018,5,"一般般。",2018-04-19 15:43:26
1481018,5,"有个蝴蝶结刮丝了，难得换",2018-04-28 05:52:51
1481018,5,"码子没有发错，赠送了小小软软的硅胶半码垫，鞋子真心很美丽，最最重要的是终于有了34码！！之前买的35码到现在都没能穿出去……<U+0001F62D>",2018-04-17 11:32:32
1481018,5,"右脚不好",2018-04-27 11:21:24
1481018,5,"棒棒哒<U+0001F38A><U+0001F388>不磨脚",2018-04-18 18:19:48
1481018,5,"这个鞋子真的让人太无语了，首先我想吐槽一下严选的客服，人工客服像机器人经常答非所问，客服系统也有问题，每次问完一个客服都会自动退出界面，再打开一次客服系统还要跟新的客服再描述一遍问题，这个新的客服竟然不会看聊天记录，像机器一样再来一遍，简直太浪费时间了，还效率很低，这个鞋子让我感受到了严选的客服多么难沟通，最后我只能打电话解决了，而且还没有投诉机制，这个真的比不上某宝的客服服务，最后我放弃了这双鞋子，想起那闹心的沟通就不想要了，忘记说沟通的原因是我下单的36码，他们自己发错成39码，还各种拒收退货，拒退款，不过现在都解决了，不吐不快",2018-04-26 11:40:38
1481018,5,"客服态度很不错，鞋子很舒服",2018-04-18 17:57:05
1481018,5,"原来发了一双，码子错了，后来换了一双",2018-04-24 22:05:03
1481018,5,"鞋子还行，就是有点卡脚",2018-04-25 20:16:06
1481018,5,"很美，跟想象的一样。",2018-04-18 10:00:53
1481018,1,"发错鞋号，有鞋号了有没有优惠价了，感觉商家故意的。
给错退货地址，退了两次货，走了三趟物流。
退款退了三次，十几天了，到现在都没退完。
体验太差！",2018-04-24 19:32:38
1481018,5,"帮别人买的，据说不错",2018-04-18 06:26:50
1481018,5,"终于发现了一款有大码数的鞋子！鞋子角度很好，穿起来很舒服。美中不足的是码数略显小，脚尖处有点紧。款式美，不舍得退换啦<U+0001F60A>",2018-04-22 07:05:18
1481018,5,"喜欢，物超所值。",2018-04-18 22:50:00
1481018,5,"不错，不错，很秀气，好看",2018-04-18 15:17:55
1481018,5,"还不错，鞋跟不是完美契合，不影响穿",2018-04-22 16:58:33
1481018,5,"虽然鞋子很满意，但是中间的曲折实在讨厌，寄错号码了，还一堆毛病，把我对严选的好印象完全抹去了，再也不会给别人推荐了，服务差评",2018-04-17 21:13:09
1481018,5,"非常舒适，颜色好看！",2018-04-18 10:37:02
1481018,5,"鞋子质量很好，不磨脚，但是时候脚瘦的妹子，我按照平时的码子买的，感觉尖头鞋还是前面会有点挤，怕挤的妹子可以考虑大一码",2018-04-17 14:28:44
1481018,5,"看着还行",2018-04-18 10:49:18
1481018,5,"鞋码寄错，退货了",2018-04-22 17:04:21
1481018,5,"不错",2018-04-18 22:55:18
1481018,5,"不错",2018-04-18 22:56:18
1481018,5,"式样还行，但第一天穿脚尖疼的厉害，没有之前评论说的可以做通勤些，这穿着要疼死的，不过多穿几次后估计会松一点，希望不再脚疼",2018-04-18 14:11:51
1481018,4,"还行吧，看了很多评论还是选择了购买，以为严选会总结这次的失误。鞋子穿着还是舒服，款式也不错，但是鞋子上有一些瑕疵和脏污，也不知道是不是这个材质的影响。",2018-04-21 08:58:54
1481018,5,"很好穿的一双鞋，质量不错",2018-04-17 16:15:00
1481018,5,"鞋子穿得非常漂亮，但是穿了一天 脚疼，",2018-04-17 21:00:28
1481018,5,"很合脚，走路不累",2018-04-17 00:54:26
