"itemId","star","content","createTime"
1512004,5,"做工非常精致，和手机很搭配，应该和苹果原装配件几乎相同了。",2018-08-18 08:14:06
1512004,5,"这个很好呢 淘宝100多已经觉得比专卖店便宜好多了 可是网易更厉害 质量也是超级给力的 除了没有apple的logo 可是who care",2018-05-28 21:51:27
1512004,5,"颜色正，手感好。一直钟爱严选，家里的拖鞋、笔、毛巾全都是严选的",2018-07-28 18:11:01
1512004,5,"非常滑，手感好，脏了擦一下就干净了，目前非常满意，还会考虑买别的颜色！",2018-05-13 10:54:45
1512004,5,"好的人一个人的生活方式就是这样一个人在家的时候",2018-08-17 08:55:43
1512004,5,"这款手机壳太好了，颜色正，质地好，手感不错！真的不错，也是客服给我推荐的！便宜又好！严选！不错的选择！",2018-07-11 20:31:05
1512004,5,"壳子真的非常棒，手感特别好，戴上根本不想换啊！必须赞一个",2018-07-03 11:17:20
1512004,5,"超级好用超级喜欢，质量超级好，手感超级好，比苹果原版的还好。值！",2018-06-06 20:27:07
1512004,5,"真正让人变好的选择，过程都不会很舒服，这就是生活，必须坚持下去。",2018-05-11 14:24:56
1512004,5,"在对网易严选裤架，运动毛巾，瑜伽裤，运动T，袜子等产品大失所望后本不准备再下单，这次手机壳将好感度扭亏为盈。",2018-06-18 10:21:32
1512004,5,"比较厚实的手机壳，一次买了两个。跟苹果官网上的手机壳看起来一样。",2018-06-05 17:41:43
1512004,5,"手感几家啊，没用过官方版，不好对比……有入手绿色  网易中毒了",2018-08-14 11:38:16
1512004,5,"绝对是性价比之王，比苹果原装质量好。再也花300块买苹果咯",2018-06-03 22:57:30
1512004,5,"手机壳非常好，颜色很卡马龙，手感也很好，最重要是皮实",2018-07-22 23:12:07
1512004,5,"很防滑，但是很粘灰尘。",2018-03-18 00:11:57
1512004,5,"手感很好，但电源键触感稍微有点硬",2018-05-31 21:02:44
1512004,1,"太容易粘灰，用了一天就感觉超脏",2018-05-30 10:08:22
1512004,5,"还可以，和苹果正版的差不多。就是不知道经脏不，正版是很耐脏的。",2018-04-14 01:09:16
1512004,5,"店家很讲信誉，而且很不错哦，在这家店买东东，我很满意~",2018-07-20 11:59:44
1512004,5,"看到网评文章说网易的手机壳不错才买的  回来发现稍有瑕疵  有点小黑点  不过也没关系  手感还可以  但没我老公的手机壳柔软  耐脏度还不错  值得表扬",2018-05-29 13:07:35
1512004,5,"做工很不错，就是质量不太行，不禁拆。买了两个换着用，已经有一个边角已经烂了。买的第一个一装进去就烂了边角，严选给我换了这个，结果这个拆装几次还是烂了。",2018-03-29 04:39:12
1512004,5,"手感非常好 比官方的划算太太太多 唯一不足就是散热有点不好 夏天打游戏会很烫 冬天用很不错",2018-05-31 17:40:11
1512004,5,"颜色很喜欢，软壳也不会伤到手机，就是有的钢化膜可能会顶膜。",2018-05-31 11:52:57
1512004,5,"手机壳超级好哦，手感很棒。一个自己用一个给闺蜜，而且按键那里也很赞。很多壳用了都是按键很硬，这个一点都不会。",2018-08-20 16:04:31
1512004,5,"手感细腻柔软，不足就是容易粘灰和粘毛",2018-05-30 16:39:56
1512004,5,"手感很好，希望用久了不会两边不会变黑",2018-05-29 10:38:07
1512004,5,"手机壳的手感真的不要太好啊，装上后就舍不得放下手机<U+0001F4F1>",2018-05-05 18:03:49
1512004,5,"手机壳大小正好，手感完美，要是有钱，每个颜色都买一个换个玩，吼吼～",2018-05-05 16:56:42
1512004,3,"太滑",2018-05-30 14:51:18
1512004,5,"契合度没的说，就是里面还有层绒。。。真是怕手机不烫嘛<U+0001F602>",2018-05-29 15:39:01
1512004,1,"很失望，材质不仅很粘毛，而且并没有防摔，这个价格真心不值当，果断换其他的，也懒得退了。",2018-05-28 15:52:52
1512004,1,"东西没收到就三件七折 还不能价保，因为价格没降，呵呵  以后不会再买",2018-05-29 09:30:04
1512004,4,"很舒服，如果对应机型设计就最好了，因为摄像头后面那里实在不好看",2018-04-18 16:29:45
1512004,5,"真心不错的壳，用过苹果原版的，这个和原版得手感差不多",2018-08-07 10:01:47
1512004,5,"上手顺滑，跟苹果专卖的那款一样的质感。等夏天来了就用上，这个蓝色应该跟夏天更搭吧。<U+0001F642>",2018-04-28 19:53:37
1512004,5,"很舒服，按键也蛮不错，更加好按的话就更好了",2018-08-22 18:29:49
1512004,5,"看图片蛮普通的，其实拿到以后手感很好，看上去很有质感！",2018-08-06 08:56:29
1512004,5,"和之前某宝买的一百多的手感几乎一样，这价位值了",2018-08-19 21:25:45
1512004,5,"手机壳很好呢，拿在手上很舒服，还会回购的",2018-08-19 13:04:16
1512004,5,"苹果7配耐看有型！",2018-06-09 15:43:13
1512004,4,"手机壳确实不错。8上用的稍微有点紧，装和卸的时候比较困难。
很厚，很滑。如果再薄一点就更好了",2018-06-04 11:46:19
1512004,5,"不为别的，手机壳确实不错，手感很棒，办公室的人都说不错",2018-07-30 21:43:49
1512004,5,"一开始选的红色后来换的午夜蓝感觉颜色更正。赞一个",2018-03-17 12:52:52
1512004,4,"喜欢这种颜色才买的，云感手机壳已经买了三款了。",2018-08-13 09:51:59
1512004,1,"手机壳有残胶，抠不掉。",2018-03-28 12:59:20
1512004,5,"厚了一点，而且容易粘灰",2018-05-30 00:31:49
1512004,5,"好容易等到了粉色，立马入了。和原装的苹果硅胶壳相比还是会有手感上的差别，但性价比一流，推荐购买",2018-05-10 15:51:56
1512004,5,"几经波折，手机套终于到货了……这次购物是非常不满意的，还好套套到手的时候，还是挺开心的",2018-03-13 17:19:52
1512004,5,"手机壳很棒，手感很接近官壳，但比官壳轻。",2018-08-22 20:23:06
1512004,5,"收到手机壳，很好安装，握在手中的手感很棒！也不易于弄脏",2018-06-12 17:10:06
1512004,5,"手感和质量都非常好，稍微有点粘灰，但是一擦就掉。很满意的体验",2018-05-18 11:37:09
1512004,5,"触感特别好的手机壳，装上了就舍不得拿下来啦，孔位精准，里面是绒面的，很好的保护了手机，满意。",2018-05-30 19:21:39
1512004,5,"丰常喜欢 这个类似磨砂的柔顺手感和颜色跟本来就红色的手机完美搭配",2018-04-23 14:00:29
1512004,5,"质量还可以吧，但是从两米高的上铺摔下裂开了，手机边框也有点划痕",2018-05-27 12:45:38
1512004,5,"非常满意，就是黑色和粉色有那么一点不协调，大家买膜一定要买白色的，会非常好看，可惜我买了黑色",2018-04-17 13:39:38
1512004,5,"以前就买过一个正红的，相对来说不是很薄，但是手感很好，可以全方位给手机保护，这次买的黄色也很好看，是我想要的颜色。",2018-08-21 21:23:04
1512004,5,"手感，做工都很好，第一次给手机穿衣服，以后会继续给它换各种衣服的，嘿嘿",2018-04-22 11:16:29
1512004,4,"跟官方的壳子可是没法比 我收到用了两天之后壳子外面已经有点和底子分离了 不过胜在便宜 也懒得退换了",2018-05-27 01:16:58
1512004,3,"厚重……装进兜儿还是掏出来摩擦力太大，费劲儿得狠，上次那个39的手感很好，又轻，但是一次摔烂了一个角，很容易坏。所谓鱼和熊掌不可得兼吧",2018-05-26 22:08:29
1512004,5,"手感细腻顺滑柔软，绝对不是X宝上随便买到的那种质感！只有用了才知道这种奇妙的是手感 嘻嘻",2018-04-16 08:18:52
1512004,5,"包裹保护的很好，还有气垫！手机壳包的很紧！相信严选！",2018-07-23 14:45:18
1512004,5,"这个手机壳必须安利一下，确实不错，立即更换上，把旧的直接扔垃圾桶了。",2018-06-10 22:16:43
1512004,5,"很棒的手感和用料，比之前买的某品牌同类型产品好，没那么涩。",2018-05-16 03:56:02
1512004,5,"没想到质感这么好，物流也特别快，看好京东物流，网易严选",2018-08-07 17:45:36
1512004,5,"手感很棒，也并不厚，很nice的一款手机壳，值得购买！",2018-08-07 15:14:59
1512004,5,"已经买第二个手机壳了，很漂亮，这款配白色手机面相当漂亮。物流也非常给力。没的说，准备在买一个送媳妇！",2018-05-06 15:28:40
1512004,5,"手感很好，就是这个味道不喜欢有点刺鼻",2018-05-26 15:15:08
1512004,5,"真心不错，手感好，以后考虑买华为手机，望以后有华为产品",2018-08-17 17:54:11
1512004,5,"真的还蛮好用的，网易严选的东西看上去很舒服",2018-08-17 11:16:33
1512004,5,"不错，质量不输苹果官方的壳子，但手感有点滑，不好抓。",2018-08-17 11:08:33
1512004,4,"外观和手感同官方版是差不多的，但是在一些细节的处理上还是不及的，比如整体和按键位置的刚性，和内衬的覆盖，一分钱一分货，这个价位还是挺值的。",2018-05-28 11:09:21
1512004,2,"iphonex的设计有问题，静音键上面凸出，空隙很大，换货也是一样。",2018-05-24 14:34:27
1512004,5,"手感可以，包边贴合，正常的掉落没有影响手机",2018-05-28 16:10:45
1512004,5,"笫一次I了一用看|量如何？Y果物超所值，|感非常好也不会滑手，非常M意！",2018-05-05 18:23:14
1512004,5,"绝对的，这个无敌了，手感超好，和原装的壳是一样的",2018-08-05 12:18:51
1512004,5,"为了得到免费的拖鞋，凑单的，手机壳确实质量可以～手感很好有那么一点点厚，但是可以接受。应该是严选的最后一单了，这里的东西个别的还好，大部分都有点溢价",2018-05-26 17:09:56
1512004,5,"手感超级棒，这一款是给朋友买的，他是看到我在上面买了一款蓝色的强烈，要求我给他买一个骚黄色的。",2018-05-25 09:58:52
1512004,5,"周围朋友都在用的手机壳～颜值手感都很棒，不逊官方的质量，价格还很便宜，第二次购买帮朋友也带了一个～",2018-05-25 08:42:08
1512004,5,"壳还不错 就是有点紧 包的还蛮严实的",2018-08-22 00:15:36
1512004,5,"很好看，和苹果官方比没差，就是太好看被朋友抢走了…",2018-06-06 15:11:09
1512004,5,"一开始觉得白的有些呆板，看顺眼了越看越喜欢",2018-08-14 12:58:08
1512004,5,"款式手感都很好，很满意，但是粘毛，粘毛，粘毛！",2018-05-27 13:38:07
1512004,5,"手感还可以，但比苹果官方的稍微差点，而且有点味儿，不过考虑到价位，性价比还是挺高的，官方的我用四个月就坏了，希望这个质量好点",2018-05-27 20:58:14
1512004,5,"手机壳真心不错，价廉物美！不沾灰，不手滑，缝位贴合，手感佳，无异味，柔度硬度平衡！用到现在最满意的一个手机壳。",2018-05-24 15:04:52
1512004,5,"质量很好，手感很好，就是有一点点厚，不过保护效果很好",2018-07-18 17:20:15
1512004,5,"快递的速度很快，壳的质量也很好，手感真是没得说",2018-06-26 15:08:46
1512004,5,"好看，质感也很好，我买了之后，朋友看到也立马入手了一个。推荐@",2018-06-03 00:55:56
1512004,5,"手感超棒 真的物有所值 客服让人很满意！",2018-08-10 16:34:05
1512004,5,"手感超棒 真的物有所值 客服让人很满意！",2018-08-10 16:33:48
1512004,5,"手感超棒 真的物有所值 客服让人很满意！",2018-08-10 16:33:39
1512004,3,"和网易自己的贴膜不搭，一起用的时候边角会翘",2018-05-23 11:24:35
1512004,5,"手感不错 想追求原装手机壳质感的可以考虑一下",2018-08-21 22:41:33
1512004,5,"手感挺好的，就是感觉稍微厚了点。",2018-08-23 10:16:25
1512004,5,"久等了的iphonex的终于有了 赶快剁手",2018-08-23 00:45:17
1512004,5,"手机壳的开孔精确度很高，手感特别棒，摸着想磨砂一样，点赞<U+0001F44D>",2018-03-22 03:43:52
1512004,5,"同事推荐，很不错的……手感很好，和我同事买的原版手感忒像",2018-06-23 14:40:41
1512004,5,"颜色虽然不是艳粉色，比较暗粉，但是手感很不错哦～价格也算实惠",2018-05-31 23:06:03
1512004,5,"很简单的设计 手感也不错 颜色比图片上更鲜艳哦",2018-08-07 17:34:32
1512004,5,"手机壳丝滑般如少女的肌肤(￣<U+2207>￣)",2018-08-19 22:06:05
1512004,5,"手感很好，就是偏厚，内部有植绒，做工没话说，保护性满分，做工95，手感85",2018-03-21 12:04:37
1512004,5,"目前看起来不错，觉的边上容易破，希望可以用久一点",2018-08-14 00:24:42
1512004,5,"手感非常好，最满意这个了，颜色也很正",2018-08-21 10:13:11
1512004,1,"我的天，为什么质量这么差，才用了1个月就裂了。",2018-05-25 18:36:54
1512004,5,"很不错的手机壳，手感极佳",2018-08-23 12:25:19
1512004,5,"手感超赞的手机壳，炫酷",2018-08-23 00:20:53
1512004,5,"手感极佳",2018-08-23 09:05:09
1512004,5,"手感很好",2018-08-23 03:21:01
1512004,5,"很不错",2018-08-23 00:04:19
1512004,5,"满意",2018-08-23 10:54:25
1512004,5,"满意",2018-08-23 10:54:22
1512004,5,"非常舒服的一件保护壳儿精细度非常的好，比网上买的其他产品都好多了。现在，也推荐朋友用网易的手机壳儿",2018-06-24 16:35:54
1512004,5,"手感很好 有一点点厚 但可以接受 总体感觉不错",2018-08-13 00:23:32
1512004,5,"|量超好，物超所值，已M了3个，再I3个分享o亲友！",2018-05-05 18:28:22
1512004,5,"拆洗不方便，其他都还好吧",2018-08-22 22:40:53
1512004,5,"很有质感，手感舒服，颜色淡雅",2018-08-22 22:30:28
1512004,5,"质量挺好的，价格可以",2018-08-22 22:06:33
1512004,5,"质量很好 很便宜",2018-08-22 20:33:03
1512004,5,"质量很好。good",2018-08-22 22:38:12
1512004,5,"很不错，非常漂亮",2018-08-22 21:57:02
1512004,5,"好看，手感好",2018-08-22 22:32:44
1512004,5,"手感很舒服",2018-08-22 22:06:57
1512004,5,"手感超好",2018-08-22 17:12:16
1512004,5,"不错 很满意",2018-08-22 12:29:52
1512004,5,"哈哈哈哈哈哈哈哈",2018-08-22 12:12:13
1512004,5,"手感超好！",2018-08-22 12:05:26
1512004,5,"一般般啊",2018-08-22 09:56:41
1512004,5,"很好",2018-08-22 20:39:25
1512004,5,"质量不错",2018-08-22 16:49:26
1512004,5,"手感好",2018-08-22 13:57:27
1512004,5,"很好",2018-08-22 09:33:22
1512004,5,"物流满分，昨晚九点半长沙下单，从鄂州仓库发货到今天下午六点拿到货，网易智造的商品真的很赞，拿到货第一时间来评论，同类型手机壳某宝88入手，槽点较多主要很黏灰，这款上手很舒服，兼顾手感和防黏，很满意",2018-08-22 18:19:32
1512004,5,"好",2018-08-22 16:14:21
1512004,5,"不错",2018-08-22 10:50:37
1512004,5,"一般",2018-08-22 09:42:50
1512004,5,"一般",2018-08-22 09:42:45
1512004,5,"太喜欢了 质量太好了 网易严选 网购首选",2018-08-17 00:51:58
1512004,5,"手感一级棒，而且很轻。有一点点容易粘毛。",2018-05-26 09:41:06
1512004,5,"手机壳手感不错，把手机装进去略紧，能很好的保护手机。",2018-06-20 22:24:17
1512004,5,"对于讲究的人来说，不错了",2018-08-21 20:35:19
1512004,5,"好用，颜色也好，其实也不怕脏。",2018-08-21 09:15:28
1512004,5,"质量很好！跟我手上的正版比了下！真的没差！而且不心疼便宜啊",2018-05-04 20:12:54
1512004,5,"后悔能早点遇见你，壳子很舒服，比裸机手感还好，关键便宜，红色非常好看",2018-05-04 13:53:09
1512004,5,"很不错，和三百多原装壳有滴一拼。",2018-08-20 20:32:15
1512004,5,"手感非常好颜色也很正",2018-08-21 23:47:08
1512004,5,"非常快，东西也很好",2018-08-21 12:45:25
1512004,5,"好拼，壳子质感非常好",2018-08-21 11:49:03
1512004,5,"很漂亮，手感也很不错",2018-08-21 11:48:43
1512004,5,"手感确实好，第二次购买了",2018-08-21 11:11:29
1512004,5,"不错，很舒服，跟官方差不多。",2018-08-21 02:21:01
1512004,5,"非常不错，耐用，高级，便宜",2018-08-21 20:35:04
1512004,5,"质感很舒服，手感好。",2018-08-21 09:35:05
1512004,5,"没有色差 很棒",2018-08-21 22:41:50
1512004,5,"非常不错<U+0001F44D>",2018-08-21 16:56:08
1512004,5,"非常棒",2018-08-21 19:39:32
1512004,5,"手感不错",2018-08-21 15:36:47
1512004,5,"手感一流",2018-08-21 13:14:40
1512004,5,"质量好",2018-08-21 12:53:42
1512004,5,"很舒服",2018-08-21 11:40:51
1512004,5,"挺好",2018-08-21 10:17:43
1512004,5,"不错！！！",2018-08-21 08:49:18
1512004,5,"好",2018-08-21 00:03:34
1512004,5,"好",2018-08-21 00:03:14
1512004,5,"和之前买的手感不一样。没有之前的好！",2018-05-28 10:35:15
1512004,5,"有点小厚，手感还不错，总体来说挺满意的",2018-08-16 23:13:10
1512004,5,"有点小厚，手感还不错，总体来说挺满意的",2018-08-16 23:13:04
1512004,5,"很不错 手感好 就是装上有点点厚 很不错的",2018-08-04 14:26:51
1512004,5,"自从严选后，发现一个问题，家里多了很多高质量的包装垃圾，建议严选包装扁平化，好东西不靠包装背书。",2018-05-11 09:02:45
1512004,5,"手机壳手感非常好已经买第三个啦",2018-08-20 11:40:56
1512004,5,"东西好棒，速度快的超乎想象",2018-08-20 23:56:13
1512004,5,"手感很好，全包边，值得推荐！",2018-08-20 18:58:12
1512004,5,"很棒，和同事买的苹果原装的一模一样。",2018-08-19 08:40:57
1512004,5,"手感跟苹果原装差不多，可以入手",2018-08-20 21:29:18
1512004,5,"配黑色8P挺好看的",2018-08-20 01:31:06
1512004,5,"第二个了，相信同样的质感",2018-08-20 23:04:39
1512004,5,"第二个了呢 很好哦",2018-08-20 22:55:14
1512004,5,"手感很好，赞一个",2018-08-20 18:46:11
1512004,5,"简直不要太棒",2018-08-20 13:11:54
1512004,5,"第二次买了，不错",2018-08-20 12:23:16
1512004,5,"非常好的选择",2018-08-20 11:57:46
1512004,5,"不错不错不错",2018-08-20 19:09:38
1512004,5,"质量很好",2018-08-20 11:03:18
1512004,5,"非常好哦",2018-08-20 09:09:55
1512004,5,"手感很好",2018-08-20 08:48:07
1512004,5,"哈哈哈哈哈",2018-08-20 18:27:35
1512004,5,"好呀",2018-08-20 16:08:04
1512004,5,"手感不错",2018-08-20 10:05:52
1512004,5,"好",2018-08-20 23:37:31
1512004,5,"好",2018-08-20 14:01:27
1512004,5,"好",2018-08-20 08:57:43
1512004,5,"好",2018-08-20 06:29:04
1512004,5,"这个手机壳很好啊，握持感非常舒适我很喜欢",2018-08-03 19:59:51
1512004,5,"送女同事的，说是颜色很清新很喜欢。",2018-08-17 21:56:10
1512004,5,"收到宝贝 很好 满意 快递小哥服务很周到",2018-08-17 15:23:16
1512004,5,"手机壳摸着还可以，没有什么异味，小贵",2018-08-17 14:24:54
1512004,5,"质感特别好，快递速度也特别快",2018-08-19 17:49:49
1512004,5,"手感很好，摸着好嫩",2018-08-19 17:34:31
1512004,5,"很好用，也很漂亮",2018-08-19 15:25:25
1512004,5,"还可以，用着比较舒服",2018-08-19 13:56:25
1512004,5,"手感好，再次购买了",2018-08-19 22:00:25
1512004,5,"很好哦",2018-08-19 23:53:34
1512004,5,"还可以的",2018-08-19 16:22:22
1512004,5,"还可以",2018-08-19 15:19:42
1512004,5,"哦哦",2018-08-19 10:39:51
1512004,5,"可以",2018-08-19 18:03:28
1512004,5,"手感好，防滑好，软硬合适，就怕不耐脏，买的粉色",2018-07-07 21:05:45
1512004,5,"系统默认好评",2018-07-26 02:03:34
1512004,5,"性价比超高，和官网货差不多",2018-08-18 14:21:31
1512004,5,"很不错。手感好。黄色超级好看。",2018-08-18 17:53:22
1512004,5,"买一件都很喜欢<U+0001F495>！",2018-08-18 09:24:42
1512004,5,"硅胶磨砂的手感非常好",2018-08-18 00:14:25
1512004,5,"非常满意非常满意非常满意",2018-08-18 21:55:02
1512004,5,"很鲜亮，颜值高，手感更好",2018-08-18 18:38:36
1512004,5,"手感跟以前一样好",2018-08-18 12:24:10
1512004,5,"很好，质感很好",2018-08-18 07:22:02
1512004,5,"很好，手感不错",2018-08-18 21:57:48
1512004,5,"实物比图好看",2018-08-18 14:54:25
1512004,5,"质量很棒",2018-08-18 17:42:36
1512004,5,"质量很不错",2018-08-18 11:38:53
1512004,5,"很好看",2018-08-18 11:37:01
1512004,5,"很好",2018-08-18 12:01:55
1512004,5,"完美，喜欢",2018-08-18 10:58:04
1512004,5,"还行",2018-08-18 00:22:28
1512004,5,"不错",2018-08-18 13:18:39
1512004,5,"样子很好看，质量也很不错。算非常满意的！",2018-08-13 14:38:04
1512004,5,"手感超棒！用了一个月也没有脏 又下单买个白色看看",2018-07-06 10:38:04
1512004,5,"白壳的盒子感觉像被拆过一样<U+0001F614>",2018-05-18 13:11:48
1512004,5,"给男朋友买的 他说特别好",2018-08-17 00:57:39
1512004,5,"比起淘宝上质量更好",2018-08-17 21:54:46
1512004,5,"质量很好，厚的冬天用。",2018-08-17 21:01:13
1512004,5,"握起来手感挺好的",2018-08-17 19:13:44
1512004,5,"非常棒了，手感很好",2018-08-17 00:12:39
1512004,5,"手感很好 质量不错",2018-08-17 21:55:19
1512004,5,"很便宜，质量又好",2018-08-17 21:14:35
1512004,5,"漂亮，手感也很好",2018-08-17 12:45:25
1512004,5,"很不错，手感很棒",2018-08-17 09:10:29
1512004,5,"不错 第二次买了",2018-08-17 22:23:48
1512004,5,"跟官方版本差不多",2018-08-17 21:56:38
1512004,5,"非常非常非常好！！！！",2018-08-17 11:15:28
1512004,5,"非常不错得手机壳",2018-08-17 09:44:19
1512004,5,"手感好，颜色亮丽",2018-08-17 06:47:32
1512004,5,"非常好喜欢",2018-08-17 21:14:30
1512004,5,"这个也不错",2018-08-17 13:36:59
1512004,5,"好东西呀",2018-08-17 10:21:09
1512004,5,"手感非常好",2018-08-17 10:12:02
1512004,5,"手感很好",2018-08-17 06:45:49
1512004,5,"还可以",2018-08-17 22:00:13
1512004,5,"很好",2018-08-17 21:24:31
1512004,5,"极好",2018-08-17 20:24:10
1512004,5,"好用",2018-08-17 18:29:48
1512004,5,"手感不错",2018-08-17 17:03:29
1512004,5,"手感不错",2018-08-17 15:54:47
1512004,5,"好看",2018-08-17 16:33:45
1512004,5,"实物比照片颜色更亮，不过手感不错，总体挺满意",2018-08-12 22:05:59
1512004,5,"非常喜欢，自己买了红色的，给婆婆又买了湖水蓝，她非常喜欢",2018-06-16 22:44:13
1512004,5,"0色差，手感特别好，是我近半年用的最久的手机壳",2018-07-05 08:10:17
1512004,5,"手机壳质感很好，里面是绒布的感觉，不伤手机，真心不错",2018-07-20 21:23:52
1512004,5,"粉色很可爱，手感也很好，钢化膜很好贴",2018-08-07 16:17:43
1512004,5,"手感超细腻，跟苹果官方手机壳没啥区别！非常推荐！",2018-08-07 11:06:19
1512004,5,"太好了 性价比太高了",2018-08-16 22:36:34
1512004,5,"还不错，质量挺好的，速度也快!",2018-08-16 14:05:36
1512004,5,"不错不错不错不错不错不错不错不错不错不错不错",2018-08-14 09:22:34
1512004,5,"手感软糯，很好很舒适",2018-08-16 06:40:09
1512004,5,"开模精准，做工优秀。",2018-08-16 16:46:45
1512004,5,"开模精准，做工优秀。",2018-08-16 16:46:17
1512004,5,"开模精准，做工优秀。",2018-08-16 16:46:04
1512004,5,"很舒服摸着，也好看",2018-08-16 14:44:06
1512004,5,"收到啦，很漂亮，很喜欢",2018-08-16 11:35:29
1512004,5,"之前一直买他们家de",2018-08-16 00:02:21
1512004,5,"颜色纯正，手感很好",2018-08-16 18:08:51
1512004,5,"手感细腻，非常好！",2018-08-16 02:07:07
1512004,5,"手感超级好",2018-08-16 22:25:42
1512004,5,"手感很舒服",2018-08-16 14:12:55
1512004,5,"非常好，",2018-08-16 18:52:30
1512004,5,"手感一流",2018-08-16 14:36:43
1512004,5,"好用",2018-08-16 13:41:44
1512004,5,"质量好",2018-08-16 08:28:09
1512004,5,"不错",2018-08-16 09:57:53
1512004,5,"严选是我不二之选，第一次购买就是严选的粉丝了，然后入了VIP会员，不但省钱，关键服务还好。从家具到个人用品，每一样都没让我失望过，买了这么多严选的东西，总的感觉就是质量好，设计好，价格好。好的生活，真的没有那么贵。",2018-08-16 13:09:37
1512004,5,"手感很好，颜色也很搭，就是用在7上感觉有点厚",2018-07-04 08:41:47
1512004,5,"老公用上，很厚实，比某宝买的79元的要好",2018-08-06 18:06:23
1512004,5,"手感超级好 而且保护的很到位",2018-08-15 09:53:15
1512004,5,"手感超级好 而且保护的很到位",2018-08-15 09:53:12
1512004,5,"颜色风骚得很，质感也不错。",2018-08-15 23:25:10
1512004,5,"就是不知道耐不耐脏",2018-08-15 17:09:15
1512004,5,"手机壳软很舒服<U+0001F60C>",2018-08-15 10:50:33
1512004,5,"手感好，做工好，棒了个棒棒哒",2018-08-14 08:12:30
1512004,5,"手感还是很好的，就是比较厚",2018-08-14 06:44:00
1512004,5,"手感，很棒，很奈斯",2018-08-15 11:58:11
1512004,5,"品质非常好，值得购买。",2018-08-15 18:34:03
1512004,5,"一直在用，手感不错",2018-08-15 10:02:34
1512004,5,"很好啊",2018-08-15 21:38:40
1512004,5,"质量非常好",2018-08-15 20:56:13
1512004,5,"手感极佳",2018-08-15 17:14:43
1512004,5,"挺好的",2018-08-15 13:23:46
1512004,5,"很好用",2018-08-15 06:47:05
1512004,5,"手感好",2018-08-15 23:25:41
1512004,5,"好用",2018-08-15 14:57:03
1512004,5,"很满意。",2018-08-15 11:56:56
1512004,5,"漂亮",2018-08-15 16:34:16
1512004,5,"好",2018-08-15 14:43:54
1512004,5,"嗯",2018-08-15 12:06:42
1512004,5,"好看",2018-08-15 10:31:50
1512004,5,"好看",2018-08-15 10:31:35
1512004,5,"不错",2018-08-15 10:21:33
1512004,5,"不错",2018-08-15 08:52:38
1512004,5,"满意",2018-08-15 08:52:28
1512004,5,"不错",2018-08-15 08:48:53
