"itemId","star","content","createTime"
1512004,5,"质量很好，无接缝！无接缝！无接缝！准备再买几个，给家里人也换上，推荐给同学了，再次下单中，希望增加5s/se版本",2018-08-13 09:01:42
1512004,5,"保护壳手感非常棒，和手机的契合度也非常高，就是有点粘布毛，其他都很好，感觉很超值。",2018-08-21 08:33:06
1512004,5,"手感真的不错，直接买严选的可以免去我翻淘宝比较的时间，好评。已经安利同事，再买几个备着",2018-06-12 00:04:53
1512004,5,"说实在。网易严选上的东西的确比x宝的便宜又好。第二次在严选上买东西 觉得真的很好很实惠。",2018-06-21 17:53:02
1512004,5,"内外兼修，品控不错，包装到位，作为一个手机壳该有的性价比都有了，等待使用时间了",2018-05-12 11:50:00
1512004,5,"在朋友的安利下买了这个手机壳，手感是真的好，摸起来很舒服，走过路过的朋友们不要错过啊",2018-05-28 17:00:48
1512004,5,"手机壳很轻，比想象中要薄一些。内面有内衬，外层手感也软。",2018-06-19 23:44:40
1512004,5,"收到宝贝后立马换上，做工精细手感很好非常喜欢网易的这款手机保护壳！",2018-05-14 09:43:40
1512004,5,"手机壳跟原装的类似，但价格感人、质感很好、包装也好、送人",2018-08-10 10:31:41
1512004,5,"手感真是超级好，可能比不上苹果原装的，但性价比超高！",2018-07-15 22:13:11
1512004,5,"很好用，颜色很美，和苹果原装的没什么差别！性价比之王！买了好几个了，很喜欢，以后再换手机也首选考虑严选的壳子。哦耶。",2018-08-11 09:33:50
1512004,5,"给差评的绝壁是黑！这价格能买到这样的，手感也太好了吧，堪比官方原厂的啊。<U+0001F602><U+0001F602><U+0001F602><U+0001F602>",2018-08-10 11:44:11
1512004,5,"质量是真的好，比某猫某狗的性价比高啊",2018-08-01 16:17:38
1512004,5,"比较理想的手机壳，触感细腻舒适",2018-08-21 21:34:51
1512004,5,"完美，手感舒适，保护到位，严选的东西有着一般品牌的价格，高档品牌的质量。",2018-06-17 14:59:02
1512004,5,"这个粉色淡淡的特别好看 手机壳手感很好 性价比可以",2018-07-20 06:56:54
1512004,5,"东西不错，值这个价格！",2018-08-08 13:09:46
1512004,5,"太有质感了！白色的8plus配这个手机壳好看的不行",2018-06-23 18:55:03
1512004,5,"很喜欢，精致，质感很好，媲美官方壳。",2018-08-01 11:54:14
1512004,5,"精致漂亮，第一次在严选购物，蛮好的",2018-07-29 15:36:55
1512004,5,"手感细腻，非常适合",2018-06-20 09:23:39
1512004,5,"喜欢简约，好的品质。虽然严选不是所有东西都物超所值，但这份体验要好的多。",2018-08-14 09:46:15
1512004,5,"壳子很好，手感和官方一样",2018-05-24 17:09:05
1512004,5,"非常舒服，好看，nice",2018-07-27 17:06:43
1512004,5,"隔日达。包装严密，手感好，无手印，贴合度高，内部植绒，价格便宜，性价比高，满意。",2018-08-20 12:55:50
1512004,5,"非常喜欢，夏天的颜色",2018-05-07 00:48:42
1512004,5,"我自己用特别好用，而且很便宜。所以又买一个送给朋友，朋友特别满意，朋友还给女朋友买了一个。",2018-07-11 14:35:01
1512004,5,"手机壳很好。很稳。手感非常好。果半斤现在拿着也不累了。保护性也很好肯定耐摔",2018-07-03 16:07:35
1512004,5,"手感真的很好、颜色正、薄厚适中……还不知道耐脏否但价格美丽哪怕脏了再来一只也不会太心疼啦～没记错是第一次带图评、因为真的很满意 ZQSG推一波 哈哈",2018-04-26 00:16:50
1512004,5,"手感真的好好呀，绵绵的。壳子是真的紧，贴膜贴不好会挤的翘起来。但是真的好合适，壳子满分！",2018-08-15 21:55:07
1512004,5,"超级喜欢，性价比可以，右侧苹果的也不过如此！有没有苹果标都无所谓的！lj",2018-08-16 21:15:17
1512004,5,"包装得非常好，高端大气上档次，手感的确比我之前买的其他牌子好一点。应该是接近原装的质量",2018-06-22 08:22:47
1512004,5,"手感质感真的没得说 先前买了灰色和粉红色了 再买个黄色自用 夏天适合这种清爽的颜色",2018-06-20 18:28:11
1512004,5,"DD很漂亮，发货及时，包装完好， 谢谢,以后有机会还从您那里购买。  好卖家，宝贝相当理想，关注ing！",2018-06-19 20:12:20
1512004,5,"收货之前我还怕会不会太粉了 但是粉的刚刚好，超级超骚气，这个夏天属于粉色好吗",2018-07-10 06:53:25
1512004,5,"各方面都很好，特别在保护性能上尤其出色，重重一摔手机毫发未伤，可惜手机壳崩裂一口子。",2018-06-12 20:22:06
1512004,5,"非常好，手感很好，不比苹果原装壳差，关键这个价格实在让人舒服，结果同事看到很喜欢，让我帮着买了一堆",2018-08-14 11:43:59
1512004,5,"很满意的价格能接受 软中有硬 磨砂质感很棒 还不容易沾灰 实在是很满意的商品了",2018-06-25 11:36:45
1512004,5,"很漂亮，看了很久，已经在淘宝买了个手机壳了。还是没忍住把这个收入囊中了，喜欢<U+0001F495>",2018-08-05 14:35:11
1512004,5,"和原装的那款手感一样，爽爽的，3号下午下单，4号早上就到，快的很！",2018-07-04 10:26:29
1512004,5,"手感台舒服了，颜色也很好看，很结实，手机摔了以后也能很好保护，好像再买别的颜色",2018-05-19 16:12:50
1512004,5,"非常好，材质很满意，没有异味，手感好，手汗也能很好的处理掉，很满意这个颜色。好看好评",2018-05-12 10:17:18
1512004,5,"手感舒适，颜色很正，是我喜欢的红，做工精细，很贴合，希望不会褪色。",2018-08-19 14:29:13
1512004,5,"特别喜欢这个手机壳，颜色好看手感也特别好，脏了湿纸巾擦就干净了，还会回购别的颜色的。",2018-06-01 08:22:21
1512004,5,"已不是第一次I了  |西很好  超喜g手感好到爆",2018-08-18 22:25:37
1512004,5,"手机壳很不错，虽然质量不能和Apple的比，毕竟价格只有Apple的15%左右。推荐！",2018-07-08 13:51:50
1512004,5,"蛮不错<U+A242> <U+0CED>(<U+02F5>ˉ<U+0334><U+0352><U+A1F4>ˉ<U+0334><U+0352><U+02F5>)<U+0C68>”的，性价比很高，爱严选",2018-05-04 14:01:17
1512004,5,"很满意 做工细节很好 不比苹果的差 手感也很好 沾灰尘是硅胶套通病 目前好像没什么办法解决",2018-04-24 12:54:28
1512004,5,"很满意 做工细节很好 不比苹果的差 手感也很好 沾灰尘是硅胶套通病 目前好像没什么办法解决",2018-04-24 12:54:24
1512004,5,"不错 信任严选 已经是我的习惯了 质感很好比我原装的还好",2018-06-30 18:25:30
1512004,5,"手感没得说…和官方的没啥区别
配送用的京东物流，非常快！
网易严选值得信赖！",2018-04-22 18:27:50
1512004,5,"太太喜欢了！鼓掌<U+0001F44F>女儿在专卖店买348元一个，这个品质一点不逊色于它，赚到了！真正的物美价廉！",2018-04-20 12:57:02
1512004,5,"本来想要白色的，但是一直没货，质量很好，手感和水果原装的一样，<U+0001F44D><U+0001F44D><U+0001F44D>",2018-04-14 21:30:45
1512004,5,"手感无敌 电视上说便宜手机壳含大量致癌物 赶紧把以前的全扔了 换成这个 跟原装的手感一样 爱不释手的感觉",2018-07-02 07:26:17
1512004,5,"颜色很喜欢，非常好，手感很好，不比苹果原装壳差，关键这个价格实在让人舒服，结果同事看到很喜欢，让我帮着买了一堆",2018-08-14 11:43:55
1512004,5,"很美，之前买了一个红色的，然后又买了一对，老公和我各一个。挺好！堪比官方版手机壳手感！！！",2018-04-23 16:32:22
1512004,5,"颜色很正，这个颜色很清爽，适合夏天。
也太硅胶，手感软硬适中，很舒服。
总之，喜欢，满意。",2018-04-09 12:37:13
1512004,5,"没有拍带上去的样子，如果我们怎么评论，那就是美观与舒适感俱佳的合集。非常喜欢",2018-04-01 12:46:47
1512004,5,"黑的漂亮，高大尚，原来的手机壳朋友说我是买的起马，配不起鞍！这回跟媳妇的全换了！",2018-05-30 21:22:17
1512004,4,"过年时买了个红色，手感很好。好容易等到灰色上架赶紧拍了。颜色太深了些，浅一点更好看。",2018-04-19 21:28:57
1512004,5,"手感非常不错。盲测外部和苹果店里的区分不出，内部绒面略微薄。总体绝对推荐入手。哈哈哈哈",2018-03-30 09:00:27
1512004,5,"很满意，和之前在苹果店里买的7P的比较过，手感质量都一样，红色很正",2018-04-20 16:05:39
1512004,5,"好不错哦，手感很好很好。促销39元买的，不过感觉还是有点小贵，毕竟我很精打细算哈哈",2018-03-29 20:24:37
1512004,5,"背板厚度很好的照顾到主镜头，放在桌上不用担心磨到镜头。",2018-08-18 15:11:34
1512004,5,"收 藏 最近太忙了，确认晚了，东西是很好的，呵呵，谢了。",2018-07-22 17:55:28
1512004,5,"物流迅速，包装给力，很轻，真的是云感啊，而且贴合度很高，这个颜色很清新",2018-04-15 21:52:41
1512004,5,"性价比完胜官方壳 手感不错 就是8p要用点力压进去 包装也很用心 挺满意的",2018-03-24 11:56:54
1512004,5,"手机壳确实很棒，手感一点不输苹果那个三百多的壳，强烈推荐，第一次从网易严选买东西，快递也给力，次日达，很棒的购物体验。",2018-08-16 15:19:50
1512004,5,"手机壳超级好用，磨砂质感，包装精致，我的照片有色差，东东的颜色比照片深",2018-04-13 14:52:31
1512004,5,"炒鸡喜欢<U+0001F618>正红色，手感特好，和<U+0001F34E>专卖店质量差不多呦！物流小哥神速，第二天一早就收到啦！",2018-03-28 11:03:58
1512004,5,"有了问题能很好的处理，可以信赖的好店家，以后有机会我们再合作",2018-06-19 09:14:11
1512004,5,"质量非常好，和手机非常贴和，全方位的保护，手感非常好，非常满意的",2018-08-09 16:14:41
1512004,5,"包装很好，壳手感很好，清新的湖蓝适合夏天，看起来很高档，就是有点容易沾灰",2018-04-10 15:30:34
1512004,5,"很舒服 跟原装壳差不多   而且价格实惠  也很好看   对孔也完美  等后面几个颜色有货再买一个",2018-03-27 12:01:15
1512004,5,"云端白云感手机保护壳这白色特别漂亮，手感超级棒，年轻化的感觉赞一个！",2018-07-09 18:52:48
1512004,5,"壳子带上去之后手感非常的细腻  非常的有韧性 掉在地上会有效的保护避免磕碰",2018-04-04 12:18:09
1512004,5,"这个算得上性价比很高了，手感和质量赶得上原装壳了",2018-06-06 20:20:36
1512004,5,"不是特别软，软中带硬，手感不错，夏天用要是更薄就好了",2018-07-01 23:37:57
1512004,5,"颜色真的很好看～很适合夏天～本来想买柠檬黄但一直木有货所以才选择这个～",2018-03-29 15:11:15
1512004,5,"蓝色真的是超级的小清新！！配上优衣库买的line蓝色，真是绝配啊。。",2018-04-14 13:07:18
1512004,5,"手感非常好，而且颜色特别漂亮，内部还有保护手机的一层绒，真的非常喜欢",2018-06-01 21:33:47
1512004,5,"比苹果店里的防滑度要弱些，但这性价比可以说很高了",2018-04-11 08:45:01
1512004,5,"质量很好呀，超值！跟苹果原装两百多的没有差别！严选超赞！！",2018-08-19 14:44:30
1512004,5,"硅胶手感跟苹果官方的没差别，非常超值了，全包边，而且有细节指引安装，很不错",2018-03-20 15:19:50
1512004,5,"手感特别好，比想象中的好。感觉和原装没差别了。满意。",2018-08-17 15:42:37
1512004,5,"之前买了绿色的 白色的心心念念很久了终于又入手了 手感很好",2018-04-24 11:02:56
1512004,5,"手感非常不错，朱雀红颜色也很正，丝毫不比专卖店里288的手机壳差，就少了个标志而已，严选，值得购买",2018-04-15 15:13:14
1512004,5,"非常好的手机壳，手感很棒。到手马上让同事抢走，只好再买一个。包装也精美",2018-04-20 15:17:15
1512004,5,"推荐！很厚，结实装上很难取下来。如果追求裸机手感就不要了。",2018-06-03 23:21:38
1512004,5,"超好用 以前是为了玩手机 现在是为了摸摸这软绵绵的手感 不影响无线充电",2018-04-14 08:52:13
1512004,5,"本来挑好了那款磨砂的。谁知道没货。后来选了这个款。手感特别好。大爱大爱。满意满意满意哈哈。",2018-04-08 09:45:38
1512004,5,"漂亮，质量赞，比后面出的那些壳都要好！",2018-08-21 12:31:32
1512004,5,"非常喜欢严选这个意外的味道，我想知道严选有没有卖这个味道的香水",2018-04-13 22:09:55
1512004,5,"都很好的很不错哦",2018-08-22 21:14:50
1512004,5,"颜色浅好看",2018-08-22 21:43:21
1512004,5,"不错不错",2018-08-22 21:41:58
1512004,5,"可以",2018-08-22 21:42:44
1512004,5,"",2018-08-22 21:45:23
1512004,5,"手感特别好，质量不错，值得推荐，第二次购买",2018-08-21 08:49:47
1512004,5,"手机壳做工很好，挺厚实而且手感不错，软软的抗摔性能应该不错，整体都挺好，严选的东西确实都不错，期待使用效果",2018-04-25 12:03:18
1512004,5,"手感很好，价钱合适，下次再来",2018-08-21 10:26:12
1512004,5,"手感不错，比辣鸡爱否好很多",2018-08-20 18:42:01
1512004,5,"手感很好，一次买两个",2018-08-21 08:50:54
1512004,5,"手感丝滑，很贴合",2018-08-21 18:33:42
1512004,5,"特别好！特别好！特别好！",2018-08-21 12:32:30
1512004,5,"手感好，涩涩的，有一定的摩擦力，不会滑。",2018-08-21 22:41:31
1512004,5,"手感非常好。",2018-08-21 16:29:17
1512004,5,"有点小厚，手感还不错，总体来说挺满意的",2018-08-16 23:13:14
1512004,5,"白色的也还行吧，没有粉色好看，可惜粉色同事买过了",2018-07-23 17:03:11
1512004,5,"买过粉色，有点坏了，这次买个红色，漂亮！",2018-08-17 19:07:28
1512004,5,"很漂亮哦，拿着也很舒服",2018-08-19 19:41:02
1512004,5,"",2018-08-19 17:47:32
1512004,5,"是预想中的颜色，但保护壳一装上我的全屏膜就会起泡，好难受，试了好几次都这样，不知道有什么解决办法没有。",2018-08-21 17:51:31
1512004,5,"]_始用，一送去_沉耍肋x的品|是相信的。",2018-03-17 21:42:37
1512004,5,"很白，很合适，就是不知道耐不耐脏。会不会慢慢变色，用了超过一个季度之后慢慢变色是可以接受的。目前很满意，已经用上了，就不拍照了。",2018-08-22 19:42:18
1512004,3,"里面的绒和外壳分离了包边部分 没之前那个好",2018-08-22 01:05:20
1512004,5,"完美，手感舒适，保护到位，严选的东西有着一般品牌的价格，高档品牌的质量。",2018-06-17 14:58:50
1512004,5,"买了好几次，买个好几个，自用和送朋友。很好用",2018-08-01 13:58:54
1512004,5,"手机壳手感很好，整体不错",2018-08-17 12:27:03
1512004,5,"",2018-08-17 15:56:08
1512004,5,"超级舒服，手感很好，朋友们都很喜欢",2018-08-15 15:51:21
1512004,5,"挺漂亮的喜欢<U+0001F60D>",2018-08-16 11:59:01
1512004,5,"手机壳不错。手感可以的。",2018-08-15 20:24:13
1512004,5,"【天o】4栋绝版小高层，最后1<U+20E3><U+FE0F>栋江景洋房",2018-07-29 15:36:44
1512004,5,"买第二个了，之前是藏蓝色",2018-08-14 14:43:57
1512004,3,"用了一个多月就有点松了",2018-08-20 17:44:20
1512004,5,"手机壳特别满意！！！就是颜色我选错了……和黑色不搭.建议还是仔细比较下颜色<U+0001F602>.手机壳还是不错的.",2018-08-21 13:11:04
1512004,5,"樱花粉，超级美的颜色！",2018-08-14 21:15:43
1512004,5,"如丝般顺滑，值得推荐",2018-08-13 09:11:45
1512004,5,"666",2018-08-13 21:53:19
1512004,4,"细节有待改进",2018-08-19 21:15:45
1512004,5,"质量不错，手感也可以，毕竟比苹果店里卖的便宜很多，性价比不错",2018-04-27 11:08:12
1512004,5,"一直买个这个，手感质量都很好！",2018-08-12 21:26:59
1512004,5,"手感特别好 很有质感 手机不会再滑掉啦",2018-08-03 10:05:28
1512004,4,"开孔很合适，样子跟原装没差，但这个手感太滑了，感觉手机很容易飞出去...",2018-08-18 20:09:03
1512004,3,"质量一般",2018-08-16 10:11:07
1512004,5,"宝贝不错 以前用的一个超薄的手机壳 感觉有点太薄了 怕摔坏 看知乎说云感手机壳不错 就下单买一个 带上后感觉就不一样 很舒服 很有质感 对得起这个价格 好评",2018-08-12 10:24:06
1512004,4,"有点太贴切了，弄的贴膜都翘起来了",2018-08-19 21:10:56
1512004,5,"价格实惠超好用",2018-08-12 20:26:36
1512004,5,"不错哟",2018-08-11 12:05:30
1512004,1,"白色明显就是别人退回去的、包装封口胶都是开的、懒得退了、但是之前买的用了一个月就坏了、表面硅胶在手机下端开裂、硅胶里面是一层薄薄的塑料壳、又不能换、也就不上图了、免得影响想买的客户、系统垃圾、再下单就显示平凡下单、也不知道这个问题其他人有没有提过、垃圾系统、问客服什么原因、客服就会说、哎呀、这个是系统自动识别的、识别你妹啊、垃圾后台、",2018-08-16 21:18:56
1512004,5,"质感很好，送货也快，准备把严选其他几个壳也尝试下",2018-07-13 18:05:55
1512004,5,"出汗很好，开始摩擦比较大，用几天就好了",2018-08-15 22:25:31
1512004,5,"手感特别好特别喜欢这款手机壳价格也还可以性价比不错",2018-06-09 10:11:38
1512004,4,"颜色比较艳丽",2018-08-08 10:08:41
1512004,5,"手感爆表 一直纠结午夜蓝还是骚红最后觉得还是低调一把好 刚买的办公椅也到了感觉爆好",2018-03-24 23:05:34
1512004,5,"不错",2018-08-06 19:47:59
1512004,5,"质量好的 就是我可能之前用的是透明的软的 这个有些硬可能我还不习惯 所以还是先放着了",2018-08-17 13:57:50
1512004,5,"比原版颜色浅一点 整体差不多 性价比很高",2018-08-01 19:00:50
1512004,5,"好看喜欢手感好",2018-08-05 23:58:41
1512004,5,"",2018-08-03 10:04:23
1512004,5,"收到以后就迅速换上了，手感很好，不容易脏，好评",2018-07-24 13:57:58
1512004,5,"",2018-07-30 19:33:02
1512004,5,"这个颜色没有冰激凌蓝好看，很低调",2018-07-28 10:15:37
1512004,5,"出汗很好，开始摩擦比较大，用几天就好了",2018-08-15 22:25:27
1512004,5,"我控制不住我自己啊，这手感赞到摸得停不下来XD
平时穿衣服比较中性色，选红色的刚好作为点缀提亮一下",2018-06-01 21:16:02
1512004,5,"可以说是很喜欢了 右边粉色的用了一个多月都不会脏",2018-08-11 20:59:25
1512004,5,"出汗很好，开始摩擦比较大，用几天就好了",2018-08-15 22:25:29
1512004,5,"好看好看，严选我的最爱<U+0001F44D><U+0001F44D><U+0001F44D>",2018-07-19 20:01:21
1512004,5,"不错.很接近苹果原装",2018-07-26 17:34:08
1512004,5,"触感非常棒，但是做工还有待提高，摄像头开孔出有黑边，略显瑕疵",2018-08-11 14:33:08
1512004,3,"做工真的不严选，到手还发现有个洞，退了",2018-08-13 22:35:18
1512004,5,"做工不错 考虑入手别的颜色，网易老粉 游戏音乐都在用，么么哒哈哈",2018-04-12 14:51:12
1512004,5,"刚收到就降价了~不开心！",2018-08-14 16:12:14
1512004,5,"手感好，好评！特意用了半个月才来评价的，好用<U+0001F44D><U+0001F3FC>",2018-05-04 17:23:04
1512004,5,"可以哦可以哦可以哦可以哦可以哦可以哦可以哦可以哦可以哦可以哦可以哦可以哦可以哦可以哦可以哦可以哦",2018-05-10 20:00:17
1512004,5,"质量很好，值得购买",2018-07-22 23:41:12
1512004,5,"非常好用，可以说是买手机壳以来最好用的了，手感很好，而且耐看，用了一个多月也没有什么划痕的，白色和蓝色也比较耐脏，还会回购的",2018-08-13 10:30:04
1512004,5,"好看 手感也很好 我朋友在苹果专卖店买的原版 看了我这个让我给他也买一个 太值了 永远支持网易严选",2018-04-19 10:45:39
1512004,5,"颜色好看 手感超好 很喜欢了",2018-07-20 06:57:00
1512004,5,"哇咔咔~手感很软糯，diy了小动物，敲可爱~",2018-07-11 21:00:24
1512004,5,"支持网易国产",2018-07-19 15:03:25
1512004,5,"朋友推荐来买的，手感确实不错，而且也不会滑手，摩擦力挺大的。",2018-04-29 23:42:30
1512004,5,"手感一如既往的好，而且大小合适。",2018-07-18 22:54:39
1512004,5,"白很白 刚换上简直闪眼的说～ 用了几天也没见变黑发黄 希望以后也不会～",2018-08-12 17:24:58
1512004,5,"用了一段期间，整体感觉比较满意，现在有个角已经磨亮了。",2018-08-01 19:29:17
1512004,5,"不错",2018-07-18 11:48:09
1512004,5,"不错",2018-07-18 11:48:04
1512004,5,"的太好了 手感很舒服",2018-07-17 00:11:39
1512004,3,"手感不错，每天摸十遍，但是太滑了，所以立不住",2018-08-07 11:46:33
1512004,5,"手感特别好！很喜欢",2018-07-17 12:28:26
1512004,5,"好用，光滑，里面有绒。不磨损手机。就是有点滑，不过比不戴还是防滑。",2018-08-08 10:09:04
1512004,5,"物流真的是特别快 快递小哥也很有耐心 等了我一会儿问我在哪儿 就把快递送到离我近的地方 包装很好 颜色也是和图片上差异不大 套上手机刚好合适 手感很好 很舒服 本来就喜欢玩儿手机 这下带了这个壳子更想摸手机了 手机壳设计很喜欢 简约 只有背后有个“N”字母 内部设计也是看着很好看 整体感觉很好 很满意",2018-08-06 22:37:43
1512004,5,"",2018-07-17 17:00:56
1512004,5,"手感很好，和原版没区别，颜色漂亮",2018-07-14 19:22:57
1512004,5,"手感非常顺滑，与手机严丝合缝，颜色也很高级，喜欢",2018-07-09 11:28:56
1512004,5,"颜值都挺高一对儿～",2018-07-13 19:13:42
1512004,5,"马卡龙色心也暖了",2018-07-13 19:12:48
1512004,5,"黄色的质感好，买了红色黑色（黄色最近买的）总体质感棒棒哒",2018-05-15 20:05:06
1512004,4,"手机壳手感很不错，就是手机套边角的地方用没用就坏了",2018-08-01 23:02:35
1512004,5,"质量非常好！颜色很马卡龙！适合夏天用！不过浅色很不紧脏就是了",2018-04-22 16:21:49
1512004,4,"手感还行，跟液体硅胶有差距，没那么粘，还是会滑手",2018-08-06 10:05:44
1512004,5,"手感很好，不留痕，我这样一个粗心大意的人随处乱放手机都没怎么留下痕迹，我很满意，已经推荐给朋友。",2018-08-02 10:19:26
1512004,5,"特别好",2018-07-10 14:55:26
1512004,5,"特别好",2018-07-10 14:55:12
1512004,5,"非常好看，手感细腻，唯一缺点就是容易沾灰",2018-07-26 18:15:12
1512004,5,"",2018-07-10 10:12:09
1512004,5,"质量非常好，手感超好，买了两个，凑了一单免邮！",2018-05-30 21:22:11
1512004,5,"nice的没话说",2018-07-09 12:54:24
1512004,5,"还是不错的。就是内部贴合有点感觉胶水用的不够，但是还是要好评，官方的摩擦力太大了，放进口袋掏不出来，但是这个，很舒服！",2018-07-28 11:40:52
1512004,5,"用了整整四个月，边缘已经残破了",2018-08-01 14:48:20
1512004,5,"材质一般般。",2018-07-30 18:30:41
1512004,5,"限时购买的，大小正合适，手感超级棒，有阻尼感，整体细节做的很好！",2018-03-29 18:49:37
1512004,5,"超级好手感",2018-07-08 10:35:50
1512004,5,"手机壳质量挺好的 摄像头稍微有偏差",2018-07-19 11:11:22
1512004,5,"第一眼，喜欢包装的美观度
第二眼，喜欢手机壳的颜色，太正了
第三眼，套上手机更好看
第四眼，手触感真的很好。",2018-04-27 11:30:46
1512004,5,"跟苹果店的一模一样，好开心",2018-07-06 12:10:21
1512004,5,"颜色很漂亮，质感不比苹果专卖店的差，价廉物美",2018-07-04 13:22:46
1512004,5,"手机壳下方边缘位置容易坏，其他都还好",2018-07-25 07:54:29
1512004,5,"非常满意！后面稍硬，边缘却很软，内层面有绒，太保护我的iphoneX啦！手感细腻，严选的东西就是好：质量好且不贵！",2018-04-06 09:33:26
1512004,5,"手感nice，一次买了两，信赖网易。还买了一个骚气的红色，很不错",2018-03-25 12:35:02
1512004,5,"物美价廉<U+0001F61D>",2018-07-03 10:30:46
1512004,5,"有一点厚",2018-07-24 14:15:42
1512004,5,"买了一个红色的、质感很好、再买一个、",2018-06-30 15:50:45
1512004,5,"该款手机壳第N次购买，手感佳，唯一的缺点就是容易有脏脏的感觉",2018-07-23 22:03:41
1512004,5,"几个颜色都很好看，纠结中选了藕荷粉，很漂亮手感也不错。",2018-05-05 17:22:04
1512004,5,"手感特别质量也相当不错，就是容易在口袋里出不来",2018-06-05 10:21:23
1512004,5,"东西依然很好已经买过两个手机壳",2018-07-17 15:36:35
1512004,5,"手机壳的话性价比还可以 就是比较容易粘灰  币苹果原装的壳手感稍微滑一点",2018-07-24 09:00:48
1512004,5,"质感很好，就是不清楚耐磨程度如何",2018-07-13 20:57:53
1512004,5,"手感好",2018-06-28 14:40:14
1512004,5,"跟苹果两百多的没差别感觉，手感软乎乎的，非常好，全包边能保护好机器",2018-03-20 15:19:01
1512004,1,"质量很不好，用了一个月就破损了，我手机一次都没摔。。。用了两个月有裂痕。
其实我只是偶尔拆卸外壳，清洗手机。他就裂了，那要是摔了，怎么办。
每次装壳都有摩擦声，伤手机",2018-07-16 18:39:36
1512004,5,"触感柔软，非常喜欢！",2018-06-27 06:49:07
